Date of data,Commodity code,Commodity,US dollar
202011,10290,Other live bovine animals,6598303.0
202011,10392,"Other lives wine,weighing 50 kg or more",49306967.0
202011,10420,Goats,119214.0
202011,10511,"Fowls of the species Gallus omesticus, weighing not more than 185 g",170500.0
202011,10594,"Fowls of the species Gallus domesticus,weighing more than 185 g",28430.0
202011,10614,Rabbits and hares,58497.0
202011,10619,Other mammals,657452.0
202011,10620,Reptiles (including snakes and turtles),908175.0
202011,10649,Other insects,4165.0
202011,10690,Other lives animals,126779.0
202011,20230,Boneless,68923.0
202011,20312,"Hams, shoulders and cuts thereof, with bone in",257797.0
202011,20319,Other fresh or chilled meat of swine,701487.0
202011,20321,Carcasses and halfcarcasses,553612.0
202011,20329,Other frozen meat of swine,7273270.0
202011,20442,"Other cuts with bone in,frozen",1167412.0
202011,20443,"Boneless meat of sheep,frozen",336672.0
202011,20450,"Meat of goats,frozen",4577962.0
202011,20500,"Meat of horses, asses, mules or hinnies, fresh, chilled or frozen",144057.0
202011,20629,"Other edible offal of bovine animals,frozen",14582.0
202011,20690,"Other edible offal,frozen",14958.0
202011,20711,"Fowls of the species gallus domesticus,not cut in pieces, fresh or chilled",22465436.0
202011,20712,"Fowls of the species gallus domesticus,not cut in pieces, frozen",717883.0
202011,20713,"Cuts and offal, fresh or chilled",548896.0
202011,20714,"Cuts and offal, frozen",16277564.0
202011,20741,"Ducks,not cut in pieces, fresh or chilled",4190406.0
202011,20742,"Ducks,not cut in pieces, frozen",973789.0
202011,20744,"Other cuts and offal of ducks, fresh or chilled",34503.0
202011,20745,"Other cuts and offal of ducks, frozen",271185.0
202011,20751,"Geese,not cut in pieces, fresh or chilled",4938059.0
202011,20752,"Geese,not cut in pieces, frozen",5856.0
202011,20754,"Other cuts and offal of geese, fresh or chilled",47676.0
202011,20810,"Meat and edible meat offal of rabbits or hares,fresh, chilled or frozen",703372.0
202011,20890,"Other meat and edible meat offal,fresh, chilled or frozen",2061390.0
202011,21011,"Hams, shoulders and cuts thereof, with bone in",70616.0
202011,21012,Bellies (streaky) and cuts thereof,85525.0
202011,21019,Other,180397.0
202011,21020,Meat of bovine animals,15685.0
202011,21099,"Other meat and edible meat offal,salted, in brine, dried or smoked",414176.0
202011,30111,Ornamental fish of freshwater,375490.0
202011,30191,"Trout (Salmo trutta, Oncorhynchus mykiss, Oncorhynchus clarki, Oncorhynchus aguabonita, Oncorhynchus gilae, Oncorhynchus apache and Oncorhynchus chrysogaster)",8478.0
202011,30192,Eels (Anguilla spp),12368197.0
202011,30193,"Carp (Cyprinus spp, Carassius spp, Ctenopharyngodon idellus, Hypophthalmichthys spp, Cirrhinus spp, Mylopharyngodon piceus, Catla catla, Labeo spp, Osteochilus hasselti, Leptobarbus hoeveni, Megalobrama spp)",7511859.0
202011,30199,Other,33483593.0
202011,30223,"Sole (Solea spp) ,fresh or chilled",286700.0
202011,30229,"Other flat fish,fresh or chilled",1161.0
202011,30245,"Jack and horse mackerel (Trachurus spp) ,fresh or chilled",40858.0
202011,30246,"Cobia (Rachycentron canadum) ,fresh or chilled",361824.0
202011,30249,"Other herrings (Clupea harengus, Clupea pallasii), anchovies ,fresh or chilled(Engraulis spp.), sardines (Sardina pilchardus, Sardinops spp.), sardinella (Sardinella spp.), brisling or sprats (Sprattus sprattus), mackerel (Scomber scombrus, Scomber australasicus, Scomber japonicus), Indian mackerels (Rastrelliger spp.), seerfishes (Scomberomorus spp.), jack and horse mackerel (Trachurus spp.), jacks, crevalles (Caranx spp.), cobia (Rachycentron canadum), silver pomfrets (Pampus spp.), Pacific saury (Cololabis saira), scads (Decapterus spp.), capelin (Mallotus villosus), swordfish (Xiphias gladius), Kawakawa (Euthynnus affinis), bonitos (Sarda spp.), marlins, sailfishes, spearfish (Istiophoridae)",57402.0
202011,30251,"Cod (Gadus morhua, Gadus ogac, Gadus macrocephalus) ,fresh or chilled",86380.0
202011,30271,"Tilapias (Oreochromis spp) ,fresh or chilled",4084.0
202011,30273,"Carp (Cyprinus spp, Carassius spp, Ctenopharyngodon idellus, fresh or chilledHypophthalmichthys spp, Cirrhinus spp, Mylopharyngodon piceus, Catla catla, Labeo spp, Osteochilus hasselti, Leptobarbus hoeveni, Megalobrama spp)",80522.0
202011,30274,"Eels (Anguilla spp) ,fresh or chilled",270428.0
202011,30282,"Rays and skates (Rajidae) ,fresh or chilled",190907.0
202011,30289,"Other fish,fresh or chilled",16892556.0
202011,30291,"Livers, roes and milt ,fresh or chilled",2773611.0
202011,30299,"Other fish fins, heads, tails, maws and other edible fish offal,fresh or chilled",1684388.0
202011,30312,"Other Pacific salmon (Oncorhynchus gorbuscha, Oncorhynchus keta, Oncorhynchus tschawytscha, Oncorhynchus kisutch, Oncorhynchus masou and Oncorhynchus rhodurus) ,frozen",349403.0
202011,30313,"Atlantic salmon (Salmo salar) and Danube salmon (Hucho hucho) ,frozen",346796.0
202011,30314,"Trout (Salmo trutta, Oncorhynchus mykiss, Oncorhynchus clarki, Oncorhynchus aguabonita, Oncorhynchus gilae, Oncorhynchus apache and Oncorhynchus chrysogaster) ,frozen",1771159.0
202011,30319,"Other salmonidae,frozen",46732.0
202011,30323,"Tilapias (Oreochromis spp) , frozen",19255886.0
202011,30324,"Catfish (Pangasius spp, Silurus spp, Clarias spp, Ictalurus spp) , frozen",2493610.0
202011,30325,"Carp (Cyprinus spp, Carassius spp, Ctenopharyngodon idellus, , frozenHypophthalmichthys spp, Cirrhinus spp, Mylopharyngodon piceus, Catla catla, Labeo spp, Osteochilus hasselti, Leptobarbus hoeveni, Megalobrama spp)",241990.0
202011,30326,"Eels (Anguilla spp) , frozen",623510.0
202011,30331,"Halibut (Reinhardtius hippoglossoides, Hippoglossus hippoglossus, Hippoglossus stenolepis) , frozen",4423565.0
202011,30333,"Sole (Solea spp) , frozen",1469627.0
202011,30339,"Other flat fish (Pleuronectidae, Bothidae, Cynoglossidae, Soleidae Scophthalmidae and Citharidae), frozen",3174917.0
202011,30341,"Albacore or longfinned tunas (Thunnus alalunga),frozen",10233769.0
202011,30342,"Yellowfin tunas (Thunnus albacares),frozen",13613267.0
202011,30343,"Skipjack or stripebellied bonito ,frozen",3750190.0
202011,30344,"Bigeye tunas (Thunnus obesus) ,frozen",5544683.0
202011,30349,"Other tunas (of the genus Thunnus), skipjack or stripe-bellied bonito (Euthynnus (Katsuwonus) pelamis),frozen",321084.0
202011,30351,"Herrings (Clupea harengus, Clupea pallasii) ,frozen",3414535.0
202011,30353,"Sardines (Sardina pilchardus, Sardinops spp), sardinella (Sardinella spp), brisling or sprats (Sprattus sprattus),frozen",6063159.0
202011,30354,"Mackerel (Scomber scombrus, Scomber australasicus, Scomber japonicus) ,frozen",37525437.0
202011,30355,"Jack and horse mackerel (Trachurus spp) ,frozen",1928097.0
202011,30357,"Swordfish (Xiphias gladius) ,frozen",967719.0
202011,30359,"Other herrings (Clupea harengus, Clupea pallasii), anchovies (Engraulis spp.), sardines (Sardina pilchardus, Sardinops spp.), sardinella (Sardinella spp.), brisling or sprats (Sprattus sprattus), mackerel (Scomber scombrus, Scomber australasicus, Scomber japonicus), Indian mackerels (Rastrelliger spp.), seerfishes (Scomberomorus spp), jack and horse mackerel (Trachurus spp.), jacks, crevalles (Caranx spp.), cobia (Rachycentron canadum), silver pomfrets (Pampus spp.), Pacific saury (Cololabis saira), scads (Decapterus spp.), capelin (Mallotus villosus), swordfish (Xiphias gladius), Kawakawa (Euthynnus affinis), bonitos (Sarda spp.), marlins, sailfishes, spearfish (Istiophoridae),frozen",39493181.0
202011,30363,"Cod (Gadus morhua, Gadus ogac, Gadus macrocephalus) ,frozen",63263.0
202011,30366,"Hake (Merluccius spp, Urophycis spp) ,frozen",85918.0
202011,30367,"Alaska Pollack (Theragra chalcogramma) ,frozen",836480.0
202011,30382,"Rays and skates (Rajidae) ,frozen",74170.0
202011,30383,"Toothfish (Dissostichus spp) ,frozen",118120.0
202011,30384,"Seabass (Dicentrarchus spp) ,frozen",460245.0
202011,30389,"Other fish ,frozen",98855334.0
202011,30391,"Livers, roes and milt,frozen",800213.0
202011,30399,"Other fish fins, heads, tails, maws and other edible fish offal,frozen",248246.0
202011,30439,"Other fresh or chilled fillets of tilapias (Oreochromis spp.), catfish (Pangasius spp., Silurus spp., Clarias spp., Ictalurus spp.), carp (Cyprinus spp., Carassius spp., Ctenopharyngodon idellus, Hypophthalmichthys spp., Cirrhinus spp., Mylopharyngodon piceus, Catla catla, Labeo spp., Osteochilus hasselti, Leptobarbus hoeveni, Megalobrama spp.), eels (Anguilla spp.), Nile perch (Lates niloticus) and snakeheads (Channa spp.)",230256.0
202011,30451,"Fresh or chilled meat, whether or not minced, of tilapias (Oreochromis spp), catfish (Pangasius spp, Silurus spp, Clarias spp, Ictalurus spp), carp (Cyprinus spp, Carassius spp, Ctenopharyngodon idellus, Hypophthalmichthys spp, Cirrhinus spp, Mylopharyngodon piceus, Catla catla, Labeo spp, Osteochilus hasselti, Leptobarbus hoeveni, Megalobrama spp), eels (Anguilla spp), Nile perch (Lates niloticus) and snakeheads (Channa spp)",2078786.0
202011,30459,"Fresh or chilled fish meat, whether or not minced (excluding all fillets, tilapias, catfish, carp, eels, Nile perch, snakeheads, salmonidae, swordfish, toothfish and fish of the families Bregmacerotidae, Euclichthyidae, Gadidae, Macrouridae, Melanonidae, Merlucciidae, Moridae and Muraenolepididae)",53211.0
202011,30461,Frozen fillets of tilapias (Oreochromis spp),10086930.0
202011,30462,"Frozen fillets of catfish (Pangasius spp, Silurus spp, Clarias spp, Ictalurus spp)",2816850.0
202011,30463,Frozen fillets of nile Perch (Lates niloticus),28360.0
202011,30469,"Frozen fillets of carp Cyprinus carpio, Carassius carassius, Ctenopharyngodon idellus, Hypophthalmichthys spp., Cirrhinus spp., Mylopharyngodon piceus"", eels ""Anguilla spp."" and snakeheads ""Channa spp.""""",3185342.0
202011,30471,"Frozen fillets of cod (Gadus morhua, Gadus ogac, Gadus macrocephalus)",54397650.0
202011,30472,Frozen fillets of haddock (Melanogrammus aeglefinus),14253821.0
202011,30473,Frozen fillets of coalfish (Pollachius virens),6793278.0
202011,30474,"Frozen fillets of hake (Merluccius spp, Urophycis spp)",3750131.0
202011,30475,Frozen fillets of alaska Pollack (Theragra chalcogramma),41110744.0
202011,30479,"Frozen fillets of fish of the families Bregmacerotidae, Euclichthyidae, Gadidae, Macrouridae, Melanonidae, Merlucciidae, Moridae and Muraenolepididae (excluding cod, haddock, coalfish, hake and Alaska pollack)",3323160.0
202011,30481,"Frozen fillets of Pacific salmon (Oncorhynchus nerka, Oncorhynchus gorbuscha, Oncorhynchus keta, Oncorhynchus tschawytscha, Oncorhynchus kisutch, Oncorhynchus masou and Oncorhynchus rhodurus), Atlantic salmon (Salmo salar) and Danube salmon (Hucho hucho)",38127368.0
202011,30482,"Frozen fillets of trout (Salmo trutta, Oncorhynchus mykiss, Oncorhynchusclarki, Oncorhynchus aguabonita, Oncorhynchus gilae,Oncorhynchus apache and Oncorhynchus chrysogaster)",940114.0
202011,30483,"Frozen fillets of flat fish (Pleuronectidae, Bothidae, Cynoglossidae, Soleidae, Scophthalmidae and Citharidae)",29301781.0
202011,30484,Frozen fillets of swordfish (Xiphias gladius),144086.0
202011,30486,"Frozen fillets of herrings (Clupea harengus, Clupea pallasii)",151137.0
202011,30487,"Frozen fillets of tunas (of the genus Thunnus), skipjack or stripebellied bonito (Euthynnus (Katsuwonus) pelamis)",12104350.0
202011,30488,"Frozen fillets of dogfish, other sharks, rays and skates (Rajidae)",429576.0
202011,30489,"Frozen fish fillets, n.e.s.",44441863.0
202011,30491,"Frozen meat, whether or not minced, of swordfish (Xiphias gladius)",227357.0
202011,30493,"Frozen meat, whether or not minced, of tilapias (Oreochromis spp), catfish (Pangasius spp, Silurus spp, Clarias spp, Ictalurus spp), carp (Cyprinus spp, Carassius spp, Ctenopharyngodon idellus, Hypophthalmichthys spp, Cirrhinus spp, Mylopharyngodon piceus, Catla catla, Labeo spp, Osteochilus hasselti, Leptobarbus hoeveni, Megalobrama spp), eels (Anguilla spp), Nile perch (Lates niloticus) and snakeheads (Channa spp)",34250.0
202011,30494,"Frozen meat, whether or not minced, of alaska Pollack (Theragra chalcogramma)",2245116.0
202011,30495,"Frozen meat, whether or not minced, of fish of the families Bregmacerotidae, Euclichthyidae, Gadidae, Macrouridae, Melanonidae, Merlucciidae, Moridae and Muraenolepididae, other than Alaska Pollack (Theragra chalcogramma)",3074988.0
202011,30496,"Frozen meat, whether or not minced, of dogfish and other sharks",472550.0
202011,30499,Frozen fish meat n.e.s. (excluding fillets),20586328.0
202011,30510,"Flours, meals and pellets of fish, fit for human consumption",715849.0
202011,30520,"Livers, roes and milt of fish, dried, smoked, salted or in brine",4308045.0
202011,30532,"Fillets, dried, salted or in brine, but not smoked, of fish of the families Bregmacerotidae, Euclichthyidae, Gadidae, Macrouridae, Melanonidae, Merlucciidae, Moridae and Muraenolepididae",7743257.0
202011,30539,"Fish fillets, dried, salted or in brine, but not smoked (excluding tilapia, catfish, carp, eels, Nile perch, snakeheads and fish of the families Bregmacerotidae, Euclichthyidae, Gadidae, Macrouridae, Melanonidae, Merlucciidae, Moridae and Muraenolepididae)",494643.0
202011,30541,"Smoked Pacific salmon (Oncorhynchus nerka, Oncorhynchus gorbuscha, Oncorhynchus keta, Oncorhynchus tschawytscha, Oncorhynchus kisutch, Oncorhynchus masou and Oncorhynchus rhodurus), Atlantic salmon (Salmo salar) and Danube salmon (Hucho hucho)",131333.0
202011,30542,"Smoked herrings (Clupea harengus, Clupea pallasii)",64288.0
202011,30543,"Smoked trout (Salmo trutta, Oncorhynchus mykiss, Oncorhynchus clarki, Oncorhynchus aguabonita, Oncorhynchus gilae, Oncorhynchus apache and Oncorhynchus chrysogaster)",745313.0
202011,30549,"Smoked fish, incl. fillets (excluding offal, Pacific salmon, Atlantic salmon, Danube salmon, herring, trout, tilapia, catfish, carp, eels, Nile perch and snakeheads)",2105615.0
202011,30551,"Dried cod (Gadus morhua, Gadus ogac, Gadus macrocephalus)",1516286.0
202011,30553,"Dried fish of the families Bregmacerotidae, Euclichthyidae, Gadidae, Macrouridae, Melanonidae, Merlucciidae, Moridae and Muraenolepididae, other than cod (Gadus morhua, Gadus ogac, Gadus macrocephalus)",545920.0
202011,30554,"Dried herrings (Clupea harengus, Clupea pallasii), anchovies (Engraulis spp), sardines (Sardina pilchardus, Sardinops spp), sardinella (Sardinella spp), brisling or sprats (Sprattus sprattus), mackerel (Scomber scombrus, Scomber australasicus, Scomber japonicus), Indian mackerels (Rastrelliger spp), seerfishes (Scomberomorus spp), jack and horse mackerel (Trachurus spp), jacks, crevalles (Caranx spp), cobia (Rachycentron canadum), silver pomfrets (Pampus spp), Pacific saury (Cololabis saira), scads (Decapterus spp), capelin (Mallotus villosus), swordfish (Xiphias gladius), Kawakawa (Euthynnus affinis), bonitos (Sarda spp), marlins, sailfishes, spearfish (Istiophoridae)",1198247.0
202011,30559,"Dried fish, even salted but not smoked (excluding fillets, offal and cod)",8981262.0
202011,30562,"Cod (Gadus morhua, Gadus ogac, Gadus macrocephalus),salted or in brine (excluding fillets and offal)",617855.0
202011,30569,"Other fish, salted or in brine only (excluding fillets, offal, herring, cod, anchovies, tilapia, catfish, carp, eels, Nile perch and snakeheads)",1319245.0
202011,30571,"Shark fins, smoked, dried, salted or in brine",752570.0
202011,30572,"Fish heads, tails and maws, smoked, dried, salted or in brine",895459.0
202011,30579,"Other fish fins and other edible fish offal, smoked, dried, salted or in brine (excluding heads, tails, maws and shark fins)",866987.0
202011,30611,"Frozen rock lobster and other sea crawfish (Palinurus spp, Panulirus spp, Jasus spp)",245019.0
202011,30614,Frozen crabs,33259656.0
202011,30616,"Frozen cold-water shrimps and prawns (Pandalus spp, Crangon crangon)",5817480.0
202011,30617,"Frozen shrimps and prawns, even smoked, whether in shell or not, incl. shrimps and prawns in shell, cooked by steaming or by boiling in water (excluding cold-water shrimps and prawns)",49231839.0
202011,30619,"Other, including flours, meals and pellets of crustaceans, fit for human consumption",1480955.0
202011,30631,"Rock lobster and other sea crawfish (Palinurus spp, Panulirus spp, Jasus spp) , whether in shell or not, live, fresh or chilled",2490.0
202011,30633,"Crabs , whether in shell or not, live, fresh or chilled",14407502.0
202011,30636,"Other shrimps and prawns, whether in shell or not, live, fresh or chilled",10593445.0
202011,30639,"Crustaceans, fit for human consumption, whether in shell or not, live, fresh or chilled (excl. rock lobster and other sea crawfish, lobsters, crabs, Norway lobsters, shrimps and prawns); flours, meals and pellets of crustaceans, fit for human consumption, fresh or chilled",137972.0
202011,30695,"Shrimps and prawns,, whether in shell or not, live, fresh or chilled (excl. rock lobster and other sea crawfish, lobsters, crabs, Norway lobsters, shrimps and prawns); flours, meals and pellets of crustaceans, fit for human consumption, fresh or chilled",12077227.0
202011,30699,"Crustaceans, fit for human consumption, whether in shell or not, dried, salted, smoked or in brine, incl. crustaceans in shell, cooked by steaming or by boiling in water (excl. rock lobster and other sea crawfish, lobsters, crabs, Norway lobsters, shrimps and prawns); flours, meals and pellets of crustaceans, dried, salted, smoked or in brine, fit for human consumption",195160.0
202011,30711,"Oysters, live, fresh, chilled",296969.0
202011,30712,"Oysters, frozen",63297.0
202011,30719,"Oysters, smoked, frozen, dried, salted or in brine",434477.0
202011,30721,"Live, fresh or chilled, scallops, incl. queen scallops, of the genera Pecten, Chlamys or Placopecten, even in shell",422582.0
202011,30722,"Frozen scallops, incl. queen scallops, of the genera Pecten, Chlamys or Placopecten, even in shell",17123474.0
202011,30729,"Scallops, incl. queen scallops, of the genera Pecten, Chlamys or Placopecten, smoked, frozen, dried, salted or in brine, even in shell",544442.0
202011,30731,"Live, fresh or chilled, not smoked, mussels (Mytilus spp., Perna spp.), with or without shell",15173.0
202011,30732,"Frozen mussels (Mytilus spp., Perna spp.), with or without shell",946157.0
202011,30742,"Live, fresh or chilled, not smoked, cuttle fish and squid, with or without shell",1872421.0
202011,30743,"Frozen cuttle fish and squid, with or without shell",190918211.0
202011,30749,"Cuttle fish and squid, smoked, frozen, dried, salted or in brine, with or without shell",2761986.0
202011,30751,"Live, fresh or chilled, not smoked,octopus (Octopus spp.)",8772667.0
202011,30752,Frozen octopus (Octopus spp.),19798262.0
202011,30759,"Octopus (Octopus spp.), smoked, frozen, dried, salted or in brine",157273.0
202011,30760,"Snails, other than sea snails",15555.0
202011,30771,"Live, fresh or chilled, even in shell, clams, cockles and ark shells (families Arcidae, Arcticidae,Cardiidae,Donacidae,Hiatellidae,Mactridae,Mesodesmatidae, Myidae, Semelidae, Solecurtidae, Solenidae, Tridacnidae and Veneridae)",15053521.0
202011,30772,"Frozen, even in shell, clams, cockles and ark shells (families Arcidae, Arcticidae,Cardiidae,Donacidae,Hiatellidae,Mactridae,Mesodesmatidae, Myidae, Semelidae, Solecurtidae, Solenidae, Tridacnidae and Veneridae)",2459754.0
202011,30779,"Smoked, frozen, dried, salted or in brine, even in shell, clams, cockles and ark shells families Arcidae, Arcticidae, Cardiidae, Donacidae, Hiatellidae, Mactridae, Mesodesmatidae, Myidae, Semelidae, Solecurtidae, Solenidae, Tridacnidae and Veneridae""""",389800.0
202011,30781,"Live, fresh or chilled abalone (Haliotis spp)",4742648.0
202011,30783,Frozen abalone (Haliotis spp),466430.0
202011,30791,"Live, fresh or chilled molluscs, fit for human consumption, even in shell (excluding oysters, scallops of the genera Pecten, Chlamys or Placopecten, mussels Mytilus spp., Perna spp."", cuttle fish ""Sepia officinalis, Rossia macrosoma, Sepiola spp."", squid ""Ommastrephes spp., Loligo spp., Nototodarus spp., Sepioteuthis spp."", octopus ""Octopus spp."", snails other than sea snails, clams, cockles and ark shells and abalone); fresh or chilled flours, meals and pellets of molluscs, fit for human consumption""",3514638.0
202011,30792,"Molluscs, even in shell, frozen (excl. oysters, scallops of the genera Pecten, Chlamys or Placopecten, mussels Mytilus spp., Perna spp."", cuttle fish and squid, octopus ""Octopus spp."", snails other than sea snails, clams, cockles and ark shells, abalone and stromboid conchs); flours, meals and pellets of molluscs, frozen, fit for human consumption""",6110817.0
202011,30799,"Molluscs, fit for human consumption, even in shell, smoked, frozen, dried, salted or in brine (excluding oysters, scallops of the genera Pecten, Chlamys or Placopecten, mussels Mytilus spp., Perna spp."", cuttle fish ""Sepia officinalis, Rossia macrosoma, Sepiola spp."", squid ""Ommastrephes spp., Loligo spp., Nototodarus spp., Sepioteuthis spp."", octopus ""Octopus spp."", snails other than sea snails, clams, cockles and ark shells and abalone); frozen, dried, salted or in brine, flours, meals and pellets of molluscs, fit for human consumption""",645396.0
202011,30812,"Frozen sea cucumbers (Stichopus japonicus, Holothuroidea)",46.0
202011,30821,"Live, fresh or chilled, sea urchins (Strongylocentrotus spp., Paracentrotus lividus, Loxechinus albus, Echinus esculentus)",37559.0
202011,30830,Jellyfish (Rhopilema spp),2151682.0
202011,30890,"Live, fresh, chilled, frozen, dried, salted or in brine, even smoked, aquatic invertebrates (excluding crustaceans, molluscs, sea cucumbers, sea urchins and jellyfish); all flours, meals and pellets of aquatic invertebrates other than crustaceans and molluscs, fit for human consumption",2035051.0
202011,40120,"Milk and cream of a fat content, by weight, exceeding 1% but not exceeding 6%",1704183.0
202011,40210,"Milk and cream in powder, granules or other solid forms, of a fat content, by weight, not exceeding 1.5%",349022.0
202011,40221,"Not containing added sugar or other sweetening matter, of a fat content, by weight, more than 1.5%",297294.0
202011,40229,"Milk and cream in solid forms, of a fat content by weight, more than 1,5%, sweetened",171.0
202011,40291,"Milk and cream, concentrated but unsweetened (excluding in solid forms)",28457.0
202011,40299,"Milk and cream, concentrated and sweetened (excluding in solid forms)",405801.0
202011,40310,"Yogurt, whether or not flavoured or containing added sugar or other sweetening matter, fruits, nuts or cocoa",438748.0
202011,40390,"Buttermilk, curdled milk and cream, kephir and other fermented or acidified milk and cream, whether or not concentrated or flavoured or containing added sugar or other sweetening matter, fruits, nuts or cocoa (excluding yogurt)",500897.0
202011,40410,"Whey and modified whey, whether or not concentrated or containing added sugar or other sweetening matter",316340.0
202011,40490,"Products consisting of natural milk constituents, whether or not sweetened, n.e.s.",19830.0
202011,40510,Butter,331078.0
202011,40590,"Fats and oils derived from milk, and dehydrated butter and ghee (excluding natural butter, recombined butter and whey butter)",130090.0
202011,40620,"Grated or powdered cheese, of all kinds",146707.0
202011,40711,Of fowls of the species Gallus domesticus,74683.0
202011,40721,"Other fresh eggs of fowls of the species Gallus domesticus, in shell",8718933.0
202011,40729,"Other Fresh birds'eggs,in shell",116515.0
202011,40790,"Other birds'eggs, in shell, preserved or cooked",3625168.0
202011,40811,Dried egg yolks,378778.0
202011,40819,Other egg yolks,440793.0
202011,40891,"Dried birds'eggs, not in shell, whether or not sweetened (excluding egg yolks)",32275.0
202011,40899,"Other birds'eggs, not in shell, fresh, cooked by steaming or boiling in water, moulded, frozen or otherwise preserved, whether or not sweetened (excluding dried)",853449.0
202011,40900,atural honey,22806438.0
202011,41000,"dible products of animal origin, not elsewhere specified or included",9584587.0
202011,50100,"Human hair, unworked, whether or not washed or scoured; waste of human hair",275220.0
202011,50210,"Pigs', hogs' or boars' bristles and hair and waste thereof",4171062.0
202011,50290,Badger and other brush making hair and waste thereof,1381212.0
202011,50400,"Guts, bladders and stomachs of animals (other than fish), wholeand pieces thereof, fresh, chilled, frozen, salted, in brine, dried orsmoked",76178314.0
202011,50510,Feathers of a kind used for stuffing; down,30343550.0
202011,50590,"Skins and other parts of birds, with their feathers or down, feathers and parts of feathers, whether or not with trimmed edges, not further worked than cleaned, disinfected or treated for preservation; powder and waste of feathers or parts of feathers (excluding feathers used for stuffing and down)",572670.0
202011,50690,"Bones and horn-cores and their powder and waste, unworked, defatted, degelatinised or simply prepared (excluding ossein and bones treated with acid and cut to shape)",66383.0
202011,50790,"Tortoiseshell, whalebone, Otherhorns, antlers, hooves, nails, claws and beaks, other powder and waste there of",1594057.0
202011,50800,"Coral and similar materials, unworked or simply prepared bunot otherwise worked; shells of molluscs, crustaceans or echinoderms and cuttlebone, unworked or simply prepared bunot cut to shape, powder and waste thereof",881761.0
202011,51000,"Ambergris, castoreum, civet and musk; cantharides; bile, whether or not dried; glands and other animal products used in the preparation of pharmaceutical products, fresh, chilled, frozen or otherwise provisionally preserved",213425.0
202011,51191,"Products of fish or crustaceans, molluscs or other aquatic invertebrates; dead animals of Chapter 3",3273775.0
