Date of data,Commodity code,Commodity,US dollar
202011,381511,Supported catalysts with nickel or nickel compounds as the active substance,499530.0
202011,381512,Supported catalysts with precious metal or precious metal compounds as the active substance,10501132.0
202011,381519,"Supported catalysts, n.e.s. (excluding with precious metal, a precious-metal compound, nickel or a nickel compound as the active substance)",21980775.0
202011,381590,"Reaction initiators, reaction accelerators and catalytic preparations, n.e.s. (excluding rubber accelerators and supported catalysts)",17353160.0
202011,381600,"Refractory cements, mortars, concretes and similar compositions, other than products of heading 38.01.",35302093.0
202011,381700,"Mixed alkylbenzenes and mixed alkylnaphthalenes, other than those of heading 27.07 or 29.02.",9909228.0
202011,381800,"Chemical elements doped for use in electronics, in the form of discs, wafers or similar forms; chemical compounds doped for use in electronics. form of",244700851.0
202011,381900,"Hydraulic brake fluids and other prepared liquids for hydraulictransmission, not containing or containing less than 70% byweight of petroleum oils or oils obtained from bituminousminerals.",1090592.0
202011,382000,Antifreezing preparations and prepared deicing fluids.,1565519.0
202011,382100,"Prepared culture media for the development or maintenance of microorganisms (including viruses and the like) or of plant, human or animal cells.",26409555.0
202011,382200,"Diagnostic or laboratory reagents on a backing, prepareddiagnostic or laboratory reagents whether or not on a backing,other than those of heading 30.02 or 30.06; certified referencematerials.",187963539.0
202011,382311,Stearic acid,1767407.0
202011,382312,Oleic acid,406971.0
202011,382319,"Fatty acids, industrial, monocarboxylic; acid oils from refining (excluding stearic acid, oleic acid and tall oil fatty acids)",1214901.0
202011,382370,Industrial fatty alcohols,200878.0
202011,382410,Prepared binders for foundry moulds or cores,2572332.0
202011,382430,Nonagglomerated metal carbides mixed together or with metallic binders,5252993.0
202011,382440,"Prepared additives for cements, mortars or concretes",19616182.0
202011,382450,Nonrefractory mortars and concretes,3666433.0
202011,382460,Sorbitol other than that of subheading 2905.44,2608528.0
202011,382474,"Containing hydrochlorofluorocarbons (HCFCs), whether or not containing perfluorocarbons (PFCs) or hydrofluorocarbons (HFCs), but not containing chlorofluorocarbons (CFCs)",1029068.0
202011,382478,"Containing perfluorocarbons (PFCs) or hydrofluorocarbons (HFCs), but not containing chlorofluorocarbons (CFCs) or hydrochlorofluorocarbons (HCFCs)",29705817.0
202011,382479,"Mixtures containing halogenated derivatives of methane, ethane or propane (excluding those of subheadings 3824.71.00 to 3824.78.00)",79240.0
202011,382491,"Mixtures and preparations consisting mainly of (5ethyl2methyl2oxido1,3,2dioxaphosphinan5yl)methyl methyl methylphosphonate and bis[(5ethyl2methyl2oxido1,3,2dioxaphosphinan5yl)methyl] methylphosphonate",285857.0
202011,382499,"Chemical products and preparations of the chemical or allied industries, incl. those consisting of mixtures of natural products, n.e.s.",361530379.0
202011,382549,"Waste organic solvents, non-halogenated",394344.0
202011,382561,Mainly containing organic constituents,279248.0
202011,382569,"Wastes from chemical or allied industries (excluding wastes of metal pickling liquors, of hydraulic fluids, brake fluids and anti-freeze fluids and those mainly containing organic constituents)",16691.0
202011,382590,"Residual products of the chemical or allied industries, n.e.s. (excluding waste)",1126499.0
202011,382600,"Biodiesel and mixtures thereof, not containing or containing less than 70% by weight of petroleum oils or oils obtained from bituminous minerals.",56319942.0
202011,390110,Polyethylene having a specific gravity of less than 0.94,16016372.0
202011,390120,Polyethylene having a specific gravity of 0.94 or more,15106682.0
202011,390130,Ethylenevinyl acetate copolymers,16139336.0
202011,390140,"Ethylenealphaolefin copolymers, having a specific gravity of less than 0.94",6689890.0
202011,390190,"Polymers of ethylene, in primary forms (excluding polyethylene and ethylene-vinyl acetate copolymers)",57743673.0
202011,390210,Polypropylene,46030956.0
202011,390220,Polyisobutylene,2149699.0
202011,390230,Propylene copolymers,9413896.0
202011,390290,"Polymers of propylene or of other olefins, in primary forms (excluding polypropylene, polyisobutylene and propylene copolymers)",3211564.0
202011,390311,"Expansible polystyrene, in primary forms",11396708.0
202011,390319,"Polystyrene, in primary forms (excluding expansible)",9211174.0
202011,390320,Styreneacrylonitrile (SAN) copolymers,2643094.0
202011,390330,Acrylonitrilebutadienestyrene (ABS) copolymers,13877876.0
202011,390390,"Polymers of styrene, in primary forms (excluding polystyrene, styrene-acrylonitrile copolymers SAN"" and acrylonitrile-butadiene-styrene ""ABS"")""",8957169.0
202011,390410,"Poly(vinyl chloride), not mixed with any other substances",105125833.0
202011,390421,Nonplasticised,10885663.0
202011,390422,Plasticised,27255161.0
202011,390430,Vinyl chloridevinyl acetate copolymers,2110329.0
202011,390440,Other vinyl chloride copolymers,2600547.0
202011,390450,Vinylidene chloride polymers,188781.0
202011,390461,Polytetrafluoroethylene,22201040.0
202011,390469,"Fluoropolymers of vinyl chloride or of other halogenated olefins, in primary forms (excluding polytetrafluoroethylene)",17440446.0
202011,390490,"Polymers of vinyl chloride or other halogenated olefins, in primary forms (excluding polyvinyl chloride"", copolymers of vinyl chloride, polymers of vinyl chloride and fluoropolymers)""",639325.0
202011,390512,"Polyvinyl acetate"", in aqueous dispersion""",406830.0
202011,390519,"Polyvinyl acetate"", in primary forms (excluding in aqueous dispersion)""",423888.0
202011,390521,"Vinyl acetate copolymers, in aqueous dispersion",647409.0
202011,390529,"Vinyl acetate copolymers, in primary forms (excluding in aqueous dispersion)",1530137.0
202011,390530,"Poly(vinyl alcohol), whether or not containing unhydrolysed acetate groups",20595477.0
202011,390591,Copolymers,541504.0
202011,390599,"Polymers of vinyl esters and other vinyl polymers, in primary forms (excluding those of vinyl chloride or other halogenated olefins, polyvinyl acetate"", vinyl acetate copolymers and poly""vinyl alcohol"", whether or not containing unhydrolised acetate groups)""",6580421.0
202011,390610,"Polymethyl methacrylate"", in primary forms""",6141061.0
202011,390690,"Acrylic polymers, in primary forms (excluding polymethyl methacrylate"")""",102536618.0
202011,390710,Polyacetals,5014383.0
202011,390720,Other polyethers,218393656.0
202011,390730,Epoxide resins,11832891.0
202011,390740,Polycarbonates,55528738.0
202011,390750,Alkyd resins,971328.0
202011,390761,"Polyethylene terephthalate"", in primary forms, having a viscosity number of 78 ml/g or higher""",132572921.0
202011,390769,"Polyethylene terephthalate"", in primary forms, having a viscosity number of < 78 ml/g""",32867367.0
202011,390770,Poly(lactic acid),1241009.0
202011,390791,Unsaturated,7954153.0
202011,390799,"Saturated polyesters in primary forms (excluding polycarbonates, alkyd resins, polyethylene terephthalate"" and poly""lactic acid"")""",64086781.0
202011,390810,"Polyamide6, 11, 12, 6,6, 6,9, 6,10 or 6,12 ,in primary forms",61316372.0
202011,390890,"Polyamides, in primary forms (excluding polyamides-6, -11, -12, -6,6, -6,9, -6,10 and -6,12)",22636081.0
202011,390910,Urea resins; thiourea resins,3676788.0
202011,390920,Melamine resins,4280999.0
202011,390931,"Poly(methylene phenyl isocyanate) (crude MDI, polymeric MDI)",79003092.0
202011,390939,"Amino-resins, in primary forms (excl. urea, thiourea and melamine resins and MDI)",168525.0
202011,390940,Phenolic resins,13631947.0
202011,390950,Polyurethanes,56617884.0
202011,391000,Silicones in primary forms.,68851896.0
202011,391110,"Petroleum resins, coumarone, indene or coumaroneindene resins and polyterpenes",31440220.0
202011,391190,"Polysulphides, polysulphones and other polymers and prepolymers produced by chemical synthesis, n.e.s., in primary forms",32576353.0
202011,391211,Nonplasticised,333107.0
202011,391212,Plasticised,59181.0
202011,391220,Cellulose nitrates (including collodions),4885801.0
202011,391231,Carboxymethylcellulose and its salts,12021604.0
202011,391239,"Cellulose ethers, in primary forms (excluding carboxymethylcellulose and its salts)",23729154.0
202011,391290,"Cellulose and chemical derivatives thereof, n.e.s., in primary forms (excluding cellulose acetates, cellulose nitrates and cellulose ethers)",9003927.0
202011,391390,"Natural polymers and modified natural polymers, e.g. hardened proteins, chemical derivatives of natural rubber, n.e.s., in primary forms (excluding alginic acid and its salts and esters)",32603530.0
202011,391400,"Ionexchangers based on polymers of headings 39.01 to 39.13, in primary forms.",20509670.0
202011,391510,"Waste, parings and scrap, of polymers of ethylene",10298.0
202011,391520,"Waste, parings and scrap, of polymers of styrene",198900.0
202011,391530,"Waste, parings and scrap, of polymers of vinyl chloride",5746431.0
202011,391590,"Waste, parings and scrap, of other plastics",5548163.0
202011,391610,Monofilament of polymers of ethylene,7690398.0
202011,391620,Monofilament of polymers of vinyl chloride,19923260.0
202011,391690,Monofilament of other plastics,37397477.0
202011,391710,Artificial guts (sausage casings) of hardened protein or of cellulosic materials,8316794.0
202011,391721,"Rigid tubes, pipes and hoses, of polymers of ethylene",17250571.0
202011,391722,"Rigid tubes, pipes and hoses, of polymers of propylene",9791050.0
202011,391723,"Rigid tubes, pipes and hoses, of polymers of vinyl chloride",14516009.0
202011,391729,"Rigid tubes, pipes and hoses, of other plastics",14033348.0
202011,391731,"Flexible tubes, pipes and hoses, having a minimum burst pressure of 27.6 Mpa",25815220.0
202011,391732,"Other, not reinforced or otherwise combined with other materials,without fittings",28188469.0
202011,391733,"Other, not reinforced or otherwise combined with other materials,without fittings",13672688.0
202011,391739,"Flexible tubes, pipes and hoses, of plastics, reinforced or otherwise combined with other materials (excluding those with a burst pressure of ≥ 27,6 MPa)",96303807.0
202011,391740,Fittings,72925787.0
202011,391810,Of polymers of vinyl chloride,575799954.0
202011,391890,Of other plastics,174871886.0
202011,391910,"Self-adhesive plates, sheets, film, foil, tape, strip and other flat shapes, of plastics, in rolls ≤ 20 cm wide",120660497.0
202011,391990,"Self-adhesive plates, sheets, film, foil, tape, strip and other flat shapes, of plastics, whether or not in rolls > 20 cm wide (excluding floor, wall and ceiling coverings of heading 3918)",280773280.0
202011,392010,"Plates, sheets, film, foil and strip, of non-cellular polymers of ethylene, not reinforced, laminated, supported or similarly combined with other materials, without backing, unworked or merely surface-worked or merely cut into squares or rectangles (excluding self-adhesive products, and floor, wall and ceiling coverings of heading 3918)",205024870.0
202011,392020,"Plates, sheets, film, foil and strip, of non-cellular polymers of ethylene, not reinforced, laminated, supported or similarly combined with other materials, without backing, unworked or merely surface-worked or merely cut into squares or rectangles (excluding self-adhesive products, and floor, wall and ceiling coverings of heading 3918)",74351946.0
202011,392030,"Plates, sheets, foil, film and strip, of non-cellular polymers of styrene, not reinforced, laminated, supported or similarly combined with other materials, without backing, unworked or merely surface-worked or merely cut into squares or rectangles (excluding self-adhesive products, and floor, wall and ceiling coverings of heading 3918)",15039552.0
202011,392043,"Plates, sheets, film, foil and strip, of non-cellular polymers of vinyl chloride, containing by weight ≥ 6% of plasticisers, not reinforced, laminated, supported or similarly combined with other materials, without backing, unworked or merely surface-worked or merely cut into squares or rectangles (excluding self-adhesive products, and floor, wall and ceiling coverings of heading 3918)",59331300.0
202011,392049,"Plates, sheets, film, foil and strip, of non-cellular polymers of vinyl chloride, containing by weight < 6% of plasticisers, not reinforced, laminated, supported or similarly combined with other materials, without backing, unworked or merely surface-worked or merely cut into squares or rectangles (excluding self-adhesive products, and floor, wall and ceiling coverings of heading 3918)",78531650.0
202011,392051,"Plates, sheets, film, foil and strip, of non-cellular polymethyl methacrylate"", not reinforced, laminated, supported or similarly combined with other materials, without backing, unworked or merely surface-worked or merely cut into squares or rectangles (excluding self-adhesive products, and floor, wall and ceiling coverings of heading 3918)""",27775602.0
202011,392059,"Plates, sheets, film, foil and strip, of non-cellular acrylic polymers, not reinforced, laminated, supported or similarly combined with other materials, without backing, unworked or merely surface-worked or merely cut into squares or rectangles (excluding those of polymethyl methacrylate"", self-adhesive products, and floor, wall and ceiling coverings of heading 3918)""",1163828.0
202011,392061,"Plates, sheets, film, foil and strip, of non-cellular polycarbonates, not reinforced, laminated, supported or similarly combined with other materials, without backing, unworked or merely surface-worked or merely cut into squares or rectangles (excluding those of polymethyl methacrylate"", self-adhesive products, and floor, wall and ceiling coverings of heading 3918)""",24993859.0
202011,392062,"Plates, sheets, film, foil and strip, of non-cellular polyethylene terephthalate"", not reinforced, laminated, supported or similarly combined with other materials, without backing, unworked or merely surface-worked or merely cut into squares or rectangles (excluding those of poly""methyl methacrylate"", self-adhesive products, and floor, wall and ceiling coverings of heading 3918)""",87718007.0
202011,392063,"Plates, sheets, film, foil and strip, of non-cellular unsaturated polyesters, not reinforced, laminated, supported or similarly combined with other materials, without backing, unworked or merely surface-worked or merely cut into squares or rectangles (excluding those of polymethyl methacrylate"", self-adhesive products, and floor, wall and ceiling coverings of heading 3918)""",8505031.0
202011,392069,"Plates, sheets, film, foil and strip, of non-cellular polyesters, not reinforced, laminated, supported or similarly combined with other materials, not worked or only surface-worked, or only cut to rectangular, incl. square, shapes (excluding polycarbonates, polythylene terephthalate and other unsaturated polyesters, self-adhesive products, and floor, wall and ceiling coverings in heading 3918)",20424701.0
202011,392071,"Plates, sheets, film, foil and strip, of non-cellular regenerated cellulose, not reinforced, laminated, supported or similarly combined with other materials, without backing, unworked or merely surface-worked or merely cut into squares or rectangles (excluding self-adhesive products, and floor, wall and ceiling coverings of heading 3918)",2693615.0
202011,392073,"Plates, sheets, film, foil and strip, of non-cellular cellulose acetates, not reinforced, laminated, supported or similarly combined with other materials, without backing, unworked or merely surface-worked or merely cut into squares or rectangles (excluding self-adhesive products, and floor, wall and ceiling coverings of heading 3918)",6650626.0
202011,392079,"Plates, sheets, film, foil and strip, of non-cellular cellulose derivatives, not reinforced, laminated, supported or similarly combined with other materials, without backing, unworked or merely surface-worked or merely cut into squares or rectangles (excluding products of cellulose acetates, self-adhesive products, floor, wall and ceiling coverings of heading 3918)",853708.0
202011,392091,"Plates, sheets, film, foil and strip, of non-cellular polyvinyl butyral"", not reinforced, laminated, supported or similarly combined with other materials, without backing, unworked or merely surface-worked or merely cut into squares or rectangles (excluding self-adhesive products, floor, wall and ceiling coverings of heading 3918)""",12935212.0
202011,392092,"Plates, sheets, film, foil and strip, of non-cellular polyamides, not reinforced, laminated, supported or similarly combined with other materials, without backing, unworked or merely surface-worked or merely cut into squares or rectangles (excluding self-adhesive products, floor, wall and ceiling coverings of heading 3918)",10729387.0
202011,392093,"Plates, sheets, film, foil and strip, of non-cellular amino-resins, not reinforced, laminated, supported or similarly combined with other materials, without backing, unworked or merely surface-worked or merely cut into squares or rectangles (excluding self-adhesive products, floor, wall and ceiling coverings of heading 3918)",2099401.0
202011,392094,"Plates, sheets, film, foil and strip, of non-cellular phenolic resins, not reinforced, laminated, supported or similarly combined with other materials, without backing, unworked or merely surface-worked or merely cut into squares or rectangles (excluding self-adhesive products, floor, wall and ceiling coverings of heading 3918)",8473297.0
202011,392099,"Plates, sheets, film, foil and strip, of non-cellular plastics, n.e.s., not reinforced, laminated, supported or similarly combined with other materials, without backing, unworked or merely surface-worked or merely cut into squares or rectangles (excluding self-adhesive products, floor, wall and ceiling coverings of heading 3918 and sterile surgical or dental adhesion barriers of subheading 3006.10.30)",76982057.0
202011,392111,"Plates, sheets, film, foil and strip, of polymers of styrene",15203718.0
202011,392112,"Plates, sheets, film, foil and strip, of polymers of vinyl chloride",73603665.0
202011,392113,"Plates, sheets, film, foil and strip, of polyurethanes",51510838.0
202011,392114,"Plates, sheets, film, foil and strip, of regenerated cellulose",2393537.0
202011,392119,"Plates, sheets, film, foil and strip, of other plastics",59853373.0
202011,392190,"Plates, sheets, film, foil and strip, (excluding of cellular plastic; self-adhesive products, floor, wall and ceiling coverings of heading 3918)",107976950.0
202011,392210,"Baths, showerbaths, sinks and washbasins",68833955.0
202011,392220,Lavatory seats and covers,43788601.0
202011,392290,"Bidets, lavatory pans, flushing cisterns and similar sanitary ware, of plastics (excluding baths, shower-baths, sinks, washbasins, lavatory seats and covers)",30271595.0
202011,392310,"Boxes, cases, crates and similar articles",191978799.0
202011,392321,"Sacks and bags, incl. cones, of polymers of ethylene",271893906.0
202011,392329,"Sacks and bags, incl. cones, of other plastics",203265630.0
202011,392330,"Carboys, bottles, flasks and similar articles",201560426.0
202011,392340,"Spools, cops, bobbins and similar supports",14591207.0
202011,392350,"Stoppers, lids, caps and other closures",145794287.0
202011,392390,"Articles for the conveyance or packaging of goods, of plastics (excluding boxes, cases, crates and similar articles; sacks and bags, incl. cones; carboys, bottles, flasks and similar articles; spools, spindles, bobbins and similar supports; stoppers, lids, caps and other closures)",159882569.0
202011,392410,Tableware and kitchenware,742643129.0
202011,392490,"Household articles and toilet articles, of plastics (excluding tableware, kitchenware, baths, shower-baths, washbasins, bidets, lavatory pans, seats and covers, flushing cisterns and similar sanitary ware)",594081301.0
202011,392510,"Reservoirs, tanks, vats and similar containers, of a capacity exceeding 300 l",5226624.0
202011,392520,"Doors, windows and their frames and thresholds for doors",33966278.0
202011,392530,"Shutters, blinds (including Venetian blinds) and similar articles and parts thereof",47656296.0
202011,392590,Other,151542568.0
202011,392610,Office or school supplies,104196506.0
202011,392620,"Articles of apparel and clothing accessories (including gloves, mittens and mitts)",814432636.0
202011,392630,"Fittings for furniture, coachwork or the like",54110779.0
202011,392640,Statuettes and other ornamental articles,405929436.0
202011,392690,"Articles of plastics and articles of other materials of heading 3901 to 3914, n.e.s (excluding goods of 9619)",1871831882.0
202011,400110,"Natural rubber latex, whether or not prevulcanised",531.0
202011,400122,Technically specified natural rubber (TSNR),394580.0
202011,400129,"Natural rubber in primary forms or in plates, sheets or strip (excluding smoked sheets, technically specified natural rubber TSNR"" and natural rubber latex, whether or not prevulcanised)""",49874.0
202011,400211,Latex,2232947.0
202011,400219,"Styrene-butadiene rubber SBR""; carboxylated styrene-butadiene rubber ""XSBR"", in primary forms or in plates, sheets or strip (excluding latex)""",14137935.0
202011,400220,Butadiene rubber (BR),14117401.0
202011,400231,Isobuteneisoprene (butyl) rubber (IIR),1683092.0
202011,400239,"Halo-isobutene-isoprene rubber CIIR"" or ""BIIR"", in primary forms or in plates, sheets or strip""",2604959.0
202011,400249,"Chloroprene chlorobutadiene rubber, CR"", in primary forms or in plates, sheets or strip (excluding latex)""",4571971.0
202011,400251,"Latex of acrylonitrile-butadiene rubber NBR""""",28380875.0
202011,400259,"Acrylonitrile-butadiene rubber NBR"", in primary forms or in plates, sheets or strip (excluding latex)""",1435421.0
202011,400260,Isoprene rubber (IR),532058.0
202011,400270,Ethylenepropylenenonconjugated diene rubber (EPDM),2979485.0
202011,400280,Mixtures of any product of heading 40.01 with any product of this heading,140173.0
202011,400291,Latex,605540.0
202011,400299,"Synthetic rubber and factice derived from oils, in primary forms or in plates, sheets or strip (excluding latex, styrene-butadiene rubber SBR"", carboxylated styrene-butadiene rubber ""XSBR"", butadiene rubber ""BR"", isobutylene isoprene rubber ""IIR"", halo-isobutene-isoprene rubber ""CIIR"" or ""BIIR"", chloroprene rubber ""CR"", acrylonitrile-butadiene rubber ""NBR"", isoprene rubber ""IR"" and non-conjugated ethylene-propylene diene rubber ""EPDM"")""",24900498.0
202011,400300,"Reclaimed rubber in primary forms or in plates, sheets or strip.",9070325.0
202011,400400,"Waste, parings and scrap of rubber (other than hard rubber) and powders and granules obtained therefrom.",10184124.0
202011,400510,Compounded with carbon black or silica,5302497.0
202011,400591,"Compounded rubber, unvulcanised, in the form of plates, sheets or strip",3621186.0
202011,400599,"Other compounded, unvulcanised rubber in primary forms",1069543.0
202011,400610,ìCamelback? strips for retreading rubber tyres,260721.0
202011,400690,"Rods, bars, tubes, profiles and other forms of unvulcanised rubber, incl. mixed rubber, and articles of unvulcanised rubber, incl. mixed rubber (excluding plates, sheets and strip which, apart from basic surface-working, have not been cut, or have merely been cut into square or rectangular shapes, and 'camel-back' strips)",780937.0
202011,400700,Vulcanised rubber thread and cord.,10238538.0
202011,400811,"Plates, sheets and strip, of cellular rubber",15978253.0
202011,400819,"Rods and profile shapes, of cellular rubber",902948.0
202011,400821,"Plates, sheets and strip, of non-cellular rubber",22071812.0
202011,400829,"Rods, tubes and profile shapes, of non-cellular rubber",2309259.0
202011,400911,"Tubes, pipes and hoses, of vulcanised rubber (excluding hard rubber), not reinforced or otherwise combined with other materials, without fittings",14627982.0
202011,400912,"Tubes, pipes and hoses, of vulcanised rubber (excluding hard rubber), not reinforced or otherwise combined with other materials, with fittings",5733880.0
202011,400921,"Tubes, pipes and hoses, of vulcanised rubber (excluding hard rubber), reinforced or otherwise combined only with metal, without fittings",21928636.0
202011,400922,"Tubes, pipes and hoses, of vulcanised rubber (excluding hard rubber), reinforced or otherwise combined only with metal, with fittings",19611703.0
202011,400931,"Tubes, pipes and hoses, of vulcanised rubber (excluding hard rubber), reinforced or otherwise combined only with textile materials, without fittings",14235703.0
202011,400932,"Tubes, pipes and hoses, of vulcanised rubber (excluding hard rubber), reinforced or otherwise combined only with textile materials, with fittings",8545957.0
202011,400941,"Tubes, pipes and hoses, of vulcanised rubber (excluding hard rubber), reinforced or otherwise combined with materials other than metal or textile materials, without fittings",1786324.0
202011,400942,"Tubes, pipes and hoses, of vulcanised rubber (excluding hard rubber), reinforced or otherwise combined with materials other than metal or textile materials, with fittings",2598857.0
202011,401011,"Conveyor belts or belting, of vulcanised rubber, reinforced only with metal",17443900.0
202011,401012,"Conveyor belts or belting, of vulcanised rubber, reinforced only with textile materials",41579662.0
202011,401019,"Conveyor belts or belting, of vulcanised rubber (excluding reinforced only with metal or only with textile materials)",2286834.0
