Date of data,Commodity code,Commodity,US dollar
202412,370255,"Other film, for colour photography (polychrome) , of a width exceeding 16 mm but not exceeding 35 mm and of a length exceeding 30 m",45
202412,370256,"Other film, for colour photography (polychrome) , of a width exceeding 35 mm",9382
202412,370296,Other film of a width not exceeding 35 mm and of a length not exceeding 30 m,10399
202412,370297,Other film of a width not exceeding 35 mm and of a length exceeding 30 m,4582
202412,370298,Other film of a width exceeding 35 mm,1794
202412,370310,In rolls of a width exceeding 610 mm,2115716
202412,370320,"Other, for colour photography (polychrome)",5144681
202412,370390,"Photographic paper, paperboard and textiles, sensitised, unexposed, for monochrome photography (excluding products in rolls ＞ 610 mm wide)",995431
202412,370400,"Photographic plates, film, paper, paperboard and textiles, exposed but not developed",799
202412,370500,"Photographic plates and film, exposed and developed, other than cinematographic film.",36321
202412,370710,Sensitising emulsions,1427751
202412,370790,"Preparation of chemicals, incl. unmixed products put up in measured portions or put up for retail sale in a form ready for use (excluding varnishes, glues, adhesives and similar preparations, sensitising emulsions and salts and precious-metal compounds etc. of heading 2843 to 2846)",20013283
202412,380110,Artificial graphite,71712590
202412,380120,Colloidal or semicolloidal graphite,28994
202412,380130,Carbonaceous pastes for electrodes and similar pastes for furnace linings,26521565
202412,380190,"Preparations based on graphite or other carbon in the form of pastes, blocks, plates or other semi-manufactures (excluding carbonaceous pastes for electrodes and similar pastes for furnace linings)",50291034
202412,380210,Activated carbon,36436159
202412,380290,"Activated kieselguhr and other activated natural mineral products; animal black, whether or not spent (excluding activated carbon, calcinated diatomite without the addition of sintering agents and activated chemical products)",7476517
202412,380300,"Tall oil, whether or not refined.",2961
202412,380400,"Residual lyes from the manufacture of wood pulp, whether or not concentrated, desugared or chemically treated, including lignin sulphonates, but excluding tall oil of heading 38.03.",1454465
202412,380510,"Gum, wood or sulphate turpentine oils",135359
202412,380590,"Crude dipentene; sulphite turpentine and other crude para-cymene; terpenic oils produced by the distillation or other treatment of coniferous woods (excluding gum turpentine, wood turpentine and sulphate turpentine)",723341
202412,380610,Rosin and resin acids,1554160
202412,380620,"Salts of rosin, of resin acids or of derivatives of rosin or resin acids, other than salts of rosin adducts",491799
202412,380630,Ester gums,1483515
202412,380690,"Derivatives of rosin, incl. salts of rosin adducts, and of resin acids, light and heavy resin oils and modified natural resins obtained by heat treatment ""run gums"" (excluding salts of rosin, of resin acids or salts of derivatives of rosin or resin acids, and ester gums)",11970947
202412,380700,"Wood tar; wood tar oils; wood creosote; wood naphtha; vegetable pitch; brewers' pitch and similar preparations based on rosin, resin acids or on vegetable pitch.",318237
202412,380859,Other goods specified in Subheading Note 1 of Chapter 38,70036
202412,380861,"Articles under subheading note 2 of this chapter, in packings of a net weight content not exceeding 300 g",522910
202412,380862,"Articles under subheading note 2 of this chapter, in packings of a net weight content exceeding 300 g but not exceeding 7.5 kg",2945772
202412,380869,"Articles under subheading note 2 of this chapter, in packings of a net weight content exceeding7.5 kg",732339
202412,380891,Insecticides,205825519
202412,380892,Fungicides,110580757
202412,380893,"Herbicides, antisprouting products and plantgrowth regulators",483675293
202412,380894,Disinfectants,31111999
202412,380899,"Articles under heading 38.08,nes",4352859
202412,380910,"Finishing agents and the like,used in textile, paper,lether and the similar industries,with a basis of amylaceous substances",300675
202412,380991,"Other finishing agents and like, of a kind used in the textile or like industries",10488073
202412,380992,"Other finishing agents and like, of a kind used in the paper or like industries",7511102
202412,380993,"Other finishing agents and like, of a kind used in the leather or like industries",1817760
202412,381010,"Pickling preparations for metal surfaces; soldering, brazing or welding powders and pastes consisting of metal and other materials",15865777
202412,381090,"Fluxes and other auxiliary preparations for soldering, brazing or welding;preparations of a kind used as cores or coatings for welding electrodes or rods",6236960
202412,381121,"Additives for lubricating oils,containing petroleum oils or oils obtained from bituminous minerals",65401487
202412,381129,Other additives for lubricating oils,970536
202412,381190,"Oxidation inhibitors, gum inhibitors, viscosity improvers, anti-corrosive preparations and other prepared additives for mineral oils, incl. gasoline, or for other liquids used for the same purposes as mineral oils (excluding anti-knock preparations and oil lubricant additives)",3890613
202412,381210,Prepared rubber accelerators,48053783
202412,381220,Compound plasticisers for rubber or plastics,10612861
202412,381231,"Mixtures of oligomers of 2,2,4trimethyl1,2dihydroquinoline (TMQ)",10239556
202412,381239,"Anti-oxidising preparations and other compound stabilisers for rubber or plastics (excl. mixtures of oligomers of 2,2,4-trimethyl-1,2-dihydroquinoline ""TMQ"")",64308812
202412,381300,Preparations and charges for fireextinguishers; charged fireextinguishing grenades,3507429
202412,381400,"Organic composite solvents and thinners, not elsewhere specified or included; prepared paint or varnish removers.",5537458
202412,381511,Supported catalysts with nickel or nickel compounds as the active substance,16061518
202412,381512,Supported catalysts with precious metal or precious metal compounds as the active substance,14726325
202412,381519,"Supported catalysts, n.e.s. (excluding with precious metal, a precious-metal compound, nickel or a nickel compound as the active substance)",87253394
202412,381590,"Reaction initiators, reaction accelerators and catalytic preparations, n.e.s. (excluding rubber accelerators and supported catalysts)",32669748
202412,381600,"Refractory cements, mortars, concretes and similar compositions, other than products of heading 38.01",49556187
202412,381700,"Mixed alkylbenzenes and mixed alkylnaphthalenes, other than those of heading 27.07 or 29.02.",19378311
202412,381800,"Chemical elements doped for use in electronics, in the form of discs, wafers or similar forms; chemical compounds doped for use in electronics. form of",184041349
202412,381900,"Hydraulic brake fluids and other prepared liquids for hydraulic transmission, not containing or containing less than 70% by weight of petroleum oils or oils obtained from bituminous minerals.",3160186
202412,382000,Antifreezing preparations and prepared deicing fluids.,4203867
202412,382100,"Prepared culture media for the development or maintenance of microorganisms (including viruses and the like) or of plant, human or animal cells.",8693805
202412,382211,"Diagnostic or laboratory reagents on a backing, prepared diagnostic or laboratory reagents, for malaria",2760727
202412,382212,"Diagnostic or laboratory reagents on a backing, prepared diagnostic or laboratory reagents whether or not on a backing, for Zika and other diseases transmitted by mosquitoes of the genus Aedes",125013
202412,382213,"Diagnostic or laboratory reagents on a backing, prepared diagnostic or laboratory reagents whether or not on a backing, for blood-grouping",147843
202412,382219,"Other diagnostic or laboratory reagents attached to backing and dispensing reagents, whether or not attached to backing",190711106
202412,382290,Certified reference sample,9997449
202412,382311,Stearic acid,3406832
202412,382312,Oleic acid,2735760
202412,382313,Tall oil fatty acids,44112
202412,382319,"Fatty acids, industrial, monocarboxylic; acid oils from refining (excluding stearic acid, oleic acid and tall oil fatty acids)",2316557
202412,382370,Industrial fatty alcohols,589679
202412,382410,Prepared binders for foundry moulds or cores,4109394
202412,382430,Nonagglomerated metal carbides mixed together or with metallic binders,10819603
202412,382440,"Prepared additives for cements, mortars or concretes",33296161
202412,382450,Nonrefractory mortars and concretes,4331613
202412,382460,Sorbitol other than that of subheading 2905.44,1180015
202412,382481,"Goods specified in subheading note 3 to chapter 38, containing oxirane (ethylene oxide)",6299
202412,382491,"Mixtures and preparations consisting mainly of (5ethyl2methyl 2oxido1,3,2dioxaphosphinan5yl)methyl methyl methylphosphonate and bis[(5ethyl2methyl2oxido1,3,2 dioxaphosphinan5yl)methyl] methylphosphonate",86752
202412,382492,Polyglycol esters of methylphosphonic acid,234014
202412,382499,"Chemical products and preparations of the chemical or allied industries, incl. those consisting of mixtures of natural products, n.e.s.",580497786
202412,382561,Mainly containing organic constituents,523
202412,382569,"Wastes from chemical or allied industries (excluding wastes of metal pickling liquors, of hydraulic fluids, brake fluids and anti-freeze fluids and those mainly containing organic constituents)",106958
202412,382590,"Residual products of the chemical or allied industries, nes (excluding waste)",1200323
202412,382600,"Biodiesel and mixtures thereof, not containing or containing less than 70% by weight of petroleum oils or oils obtained from bituminous minerals.",71095256
202412,382731,Mixtures containing substances of subheadings 2903.41 to 2903.48,120065
202412,382732,"Other mixtures, containing substances of subheadings 2903.71 to 2903.75",25968
202412,382761,"Mixtures containing 15 % or more by mass of 1,1,1-trifluoroethane (HFC- 143a)",14569234
202412,382762,"Other mixtures, not included in the subheading above, containing 55 % or more by mass of pentafluoroethane (HFC- 125) but not containing unsaturated fluorinated derivatives of acyclic hydrocarbons (HFOs)",779485
202412,382763,"Other mixtures, not included in the subheadings above, containing 40 % or more by mass of pentafluoroethane (HFC-125)",23045173
202412,382764,"Other mixtures, not included in the subheadings above, containing 30 % or more by mass of 1,1,1,2-tetrafluoroethane (HFC-134a) but not containing unsaturated fluorinated derivatives of acyclic hydrocarbons (HFOs)",2649582
202412,382765,"Other mixtures, not included in the subheadings above, containing 20 % or more by mass of difluoromethane (HFC-32) and 20 % or more by mass of pentafluoroethane (HFC-125)",682960
202412,382768,"Other mixtures, not included in the subheadings above, containing substances of subheadings 2903.41 to 2903.48",1945006
202412,390110,Polyethylene having a specific gravity of less than 0.94,27880353
202412,390120,Polyethylene having a specific gravity of 0.94 or more,35361322
202412,390130,Ethylenevinyl acetate copolymers,49598452
202412,390140,"Ethylenealphaolefin copolymers, having a specific gravity of less than 0.94",16990307
202412,390190,"Polymers of ethylene, in primary forms (excluding polyethylene and ethylene-vinyl acetate copolymers)",72749606
202412,390210,Polypropylene,192517993
202412,390220,Polyisobutylene,7835106
202412,390230,Propylene copolymers,27899343
202412,390290,"Polymers of propylene or of other olefins, in primary forms (excluding polypropylene, polyisobutylene and propylene copolymers)",9211384
202412,390311,"Expansible polystyrene, in primary forms",30554367
202412,390319,"Polystyrene, in primary forms (excluding expansible)",25770228
202412,390320,Styreneacrylonitrile (SAN) copolymers,8119529
202412,390330,Acrylonitrilebutadienestyrene (ABS) copolymers,37858290
202412,390390,"Polymers of styrene, in primary forms (excluding polystyrene, styrene-acrylonitrile copolymers ""SAN"" and acrylonitrile-butadiene-styrene ""ABS"")",19570519
202412,390410,"Poly(vinyl chloride), not mixed with any other substances",164258207
202412,390421,Nonplasticised,10582341
202412,390422,Plasticised,46923508
202412,390430,Vinyl chloridevinyl acetate copolymers,2559441
202412,390440,Other vinyl chloride copolymers,4508230
202412,390450,Vinylidene chloride polymers,1070060
202412,390461,Polytetrafluoroethylene,23884215
202412,390469,"Fluoropolymers of vinyl chloride or of other halogenated olefins, in primary forms (excluding polytetrafluoroethylene)",43246548
202412,390490,"Polymers of vinyl chloride or other halogenated olefins, in primary forms (excluding poly""vinyl chloride"", copolymers of vinyl chloride, polymers of vinyl chloride and fluoropolymers)",291786
202412,390512,"Poly""vinyl acetate"", in aqueous dispersion",667657
202412,390519,"Poly""vinyl acetate"", in primary forms (excluding in aqueous dispersion)",320886
202412,390521,"Vinyl acetate copolymers, in aqueous dispersion",2389914
202412,390529,"Vinyl acetate copolymers, in primary forms (excluding in aqueous dispersion)",6271987
202412,390530,"Poly(vinyl alcohol), whether or not containing unhydrolysed acetate groups",33928597
202412,390591,Copolymers,3938874
202412,390599,"Polymers of vinyl esters and other vinyl polymers, in primary forms (excluding those of vinyl chloride or other halogenated olefins, poly""vinyl acetate"", vinyl acetate copolymers and poly""vinyl alcohol"", whether or not containing unhydrolised acetate groups)",21903624
202412,390610,"Poly""methyl methacrylate"", in primary forms",11480729
202412,390690,"Acrylic polymers, in primary forms (excluding poly""methyl methacrylate"")",192426648
202412,390710,Polyacetals,6807699
202412,390721,"Bis(polyoxyethylene) methylphosphonate, in primary forms",1054479
202412,390729,"Other polyethers, in primary forms",279377845
202412,390730,Epoxide resins,40785145
202412,390740,Polycarbonates,104579685
202412,390750,Alkyd resins,2226593
202412,390761,"Poly""ethylene terephthalate"", in primary forms, having a viscosity number of 78 ml/g or higher",521331881
202412,390769,"Poly""ethylene terephthalate"", in primary forms, having a viscosity number of ＜ 78 ml/g",100794162
202412,390770,Poly(lactic acid) in primary forms,4729329
202412,390791,Unsaturated polyesters in primary forms,25926769
202412,390799,"Saturated polyesters in primary forms (excluding polycarbonates, alkyd resins, poly""ethylene terephthalate"" and poly""lactic acid"")",111528851
202412,390810,"Polyamide6, 11, 12, 6,6, 6,9, 6,10 or 6,12 ,in primary forms",133307743
202412,390890,"Polyamides, in primary forms (excluding polyamides-6, -11, -12, -6,6, -6,9, -6,10 and -6,12)",30446961
202412,390910,"Urea resins and thiourea resins, in primary forms",6314112
202412,390920,Melamine resins,8369784
202412,390931,"Poly(methylene phenyl isocyanate) (crude MDI, polymeric MDI) ,in primary forms",179352423
202412,390939,"Amino-resins, in primary forms (excl. urea, thiourea and melamine resins and MDI)",358993
202412,390940,"Phenolic resins,in primary forms",19513358
202412,390950,"Polyurethanes,in primary forms",84695850
202412,391000,Silicones in primary forms,130884097
202412,391110,"Petroleum resins, coumarone, indene or coumaroneindene resins and polyterpenes",56979095
202412,391190,"Polysulphides, polysulphones and other polymers and prepolymers produced by chemical synthesis, nes, in primary forms",42360416
202412,391211,"Nonplasticised cellulose acetates,in primary forms",6548123
202412,391212,"Plasticised cellulose acetates,in primary forms",5743
202412,391220,"Cellulose nitrates (including collodions), in primary forms",6648116
202412,391231,"Carboxymethylcellulose and its salts,in primary forms",26890798
202412,391239,"Cellulose ethers, in primary forms (excluding carboxymethylcellulose and its salts)",38707972
202412,391290,"Cellulose and chemical derivatives thereof, n.e.s., in primary forms (excluding cellulose acetates, cellulose nitrates and cellulose ethers)",18791893
202412,391310,"Alginic acid, its salts and esters,in primary forms",426068
202412,391390,"Natural polymers and modified natural polymers, e.g. hardened proteins, chemical derivatives of natural rubber, n.e.s., in primary forms (excluding alginic acid and its salts and esters)",79672221
202412,391400,"Ionexchangers based on polymers of headings 39.01 to 39.13, in primary forms",35928396
202412,391510,"Waste, parings and scrap, of polymers of ethylene",17654
202412,391520,"Waste, parings and scrap, of polymers of styrene",57687
202412,391530,"Waste, parings and scrap, of polymers of vinyl chloride",336449
202412,391590,"Waste, parings and scrap, of other plastics",1405136
202412,391610,Monofilament of polymers of ethylene,7550456
202412,391620,Monofilament of polymers of vinyl chloride,34577582
202412,391690,Monofilament of other plastics,79690005
202412,391710,Artificial guts (sausage casings) of hardened protein or of cellulosic materials,17579782
202412,391721,"Rigid tubes, pipes and hoses, of polymers of ethylene",31755899
202412,391722,"Rigid tubes, pipes and hoses, of polymers of propylene",12338719
202412,391723,"Rigid tubes, pipes and hoses, of polymers of vinyl chloride",25942662
202412,391729,"Rigid tubes, pipes and hoses, of other plastics",25304206
202412,391731,"Flexible tubes, pipes and hoses, having a minimum burst pressure of 27.6 Mpa",34933962
202412,391732,"Other plastic tubes, not reinforced or otherwise combined with other materials,without fittings",47099996
202412,391733,"Other plastic tubes, not reinforced or otherwise combined with other materials,with fittings",23821325
202412,391739,"Flexible tubes, pipes and hoses, of plastics, reinforced or otherwise combined with other materials (excluding those with a burst pressure of ≥ 27,6 MPa)",129588991
202412,391740,"Fittings for tubes, of plastic",100430026
202412,391810,"Wall or floor coverings, of polymers of vinyl chloride",519689565
202412,391890,"Wall or floor coverings, of other plastics",191031658
202412,391910,"Self-adhesive plates, sheets, film, foil, tape, strip and other flat shapes, of plastics, in rolls ≤ 20 cm wide",171614498
202412,391990,"Self-adhesive plates, sheets, film, foil, tape, strip and other flat shapes, of plastics, whether or not in rolls ＞ 20 cm wide (excluding floor, wall and ceiling coverings of heading 3918)",483144500
202412,392010,"Plates, sheets, film, foil and strip, of non-cellular polymers of ethylene, not reinforced, laminated, supported or similarly combined with other materials, without backing, unworked or merely surface-worked or merely cut into squares or rectangles (excluding self-adhesive products, and floor, wall and ceiling coverings of heading 3918)",316252420
202412,392020,"Plates, sheets, film, foil and strip, of non-cellular polymers of ethylene, not reinforced, laminated, supported or similarly combined with other materials, without backing, unworked or merely surface-worked or merely cut into squares or rectangles (excluding self-adhesive products, and floor, wall and ceiling coverings of heading 3918)",129727777
202412,392030,"Plates, sheets, foil, film and strip, of non-cellular polymers of styrene, not reinforced, laminated, supported or similarly combined with other materials, without backing, unworked or merely surface-worked or merely cut into squares or rectangles (excluding self-adhesive products, and floor, wall and ceiling coverings of heading 3918)",24719186
202412,392043,"Plates, sheets, film, foil and strip, of non-cellular polymers of vinyl chloride, containing by weight ≥ 6% of plasticisers, not reinforced, laminated, supported or similarly combined with other materials, without backing, unworked or merely surface-worked or merely cut into squares or rectangles (excluding self-adhesive products, and floor, wall and ceiling coverings of heading 3918)",108672396
202412,392049,"Plates, sheets, film, foil and strip, of non-cellular polymers of vinyl chloride, containing by weight ＜ 6% of plasticisers, not reinforced, laminated, supported or similarly combined with other materials, without backing, unworked or merely surface-worked or merely cut into squares or rectangles (excluding self-adhesive products, and floor, wall and ceiling coverings of heading 3918)",131317850
202412,392051,"Plates, sheets, film, foil and strip, of non-cellular poly""methyl methacrylate"", not reinforced, laminated, supported or similarly combined with other materials, without backing, unworked or merely surface-worked or merely cut into squares or rectangles (excluding self-adhesive products, and floor, wall and ceiling coverings of heading 3918)",64205187
202412,392059,"Plates, sheets, film, foil and strip, of non-cellular acrylic polymers, not reinforced, laminated, supported or similarly combined with other materials, without backing, unworked or merely surface-worked or merely cut into squares or rectangles (excluding those of poly""methyl methacrylate"", self-adhesive products, and floor, wall and ceiling coverings of heading 3918)",2472452
202412,392061,"Plates, sheets, film, foil and strip, of non-cellular polycarbonates, not reinforced, laminated, supported or similarly combined with other materials, without backing, unworked or merely surface-worked or merely cut into squares or rectangles (excluding those of poly""methyl methacrylate"", self-adhesive products, and floor, wall and ceiling coverings of heading 3918)",38208758
202412,392062,"Plates, sheets, film, foil and strip, of non-cellular poly""ethylene terephthalate"", not reinforced, laminated, supported or similarly combined with other materials, without backing, unworked or merely surface-worked or merely cut into squares or rectangles (excluding those of poly""methyl methacrylate"", self-adhesive products, and floor, wall and ceiling coverings of heading 3918)",144906990
202412,392063,"Plates, sheets, film, foil and strip, of non-cellular unsaturated polyesters, not reinforced, laminated, supported or similarly combined with other materials, without backing, unworked or merely surface-worked or merely cut into squares or rectangles (excluding those of poly""methyl methacrylate"", self-adhesive products, and floor, wall and ceiling coverings of heading 3918)",9804113
202412,392069,"Plates, sheets, film, foil and strip, of non-cellular polyesters, not reinforced, laminated, supported or similarly combined with other materials, not worked or only surface-worked, or only cut to rectangular, incl. square, shapes (excluding polycarbonates, polythylene terephthalate and other unsaturated polyesters, self-adhesive products, and floor, wall and ceiling coverings in heading 3918)",36164935
202412,392071,"Plates, sheets, film, foil and strip, of non-cellular regenerated cellulose, not reinforced, laminated, supported or similarly combined with other materials, without backing, unworked or merely surface-worked or merely cut into squares or rectangles (excluding self-adhesive products, and floor, wall and ceiling coverings of heading 3918)",4597608
202412,392073,"Plates, sheets, film, foil and strip, of non-cellular cellulose acetates, not reinforced, laminated, supported or similarly combined with other materials, without backing, unworked or merely surface-worked or merely cut into squares or rectangles (excluding self-adhesive products, and floor, wall and ceiling coverings of heading 3918)",7901015
202412,392079,"Plates, sheets, film, foil and strip, of non-cellular cellulose derivatives, not reinforced, laminated, supported or similarly combined with other materials, without backing, unworked or merely surface-worked or merely cut into squares or rectangles (excluding products of cellulose acetates, self-adhesive products, floor, wall and ceiling coverings of heading 3918)",2543489
202412,392091,"Plates, sheets, film, foil and strip, of non-cellular poly""vinyl butyral"", not reinforced, laminated, supported or similarly combined with other materials, without backing, unworked or merely surface-worked or merely cut into squares or rectangles (excluding self-adhesive products, floor, wall and ceiling coverings of heading 3918)",23932746
202412,392092,"Plates, sheets, film, foil and strip, of non-cellular polyamides, not reinforced, laminated, supported or similarly combined with other materials, without backing, unworked or merely surface-worked or merely cut into squares or rectangles (excluding self-adhesive products, floor, wall and ceiling coverings of heading 3918)",26505261
202412,392093,"Plates, sheets, film, foil and strip, of non-cellular amino-resins, not reinforced, laminated, supported or similarly combined with other materials, without backing, unworked or merely surface-worked or merely cut into squares or rectangles (excluding self-adhesive products, floor, wall and ceiling coverings of heading 3918)",3062057
202412,392094,"Plates, sheets, film, foil and strip, of non-cellular phenolic resins, not reinforced, laminated, supported or similarly combined with other materials, without backing, unworked or merely surface-worked or merely cut into squares or rectangles (excluding self-adhesive products, floor, wall and ceiling coverings of heading 3918)",11955950
202412,392099,"Plates, sheets, film, foil and strip, of non-cellular plastics, n.e.s., not reinforced, laminated, supported or similarly combined with other materials, without backing, unworked or merely surface-worked or merely cut into squares or rectangles (excluding self-adhesive products, floor, wall and ceiling coverings of heading 3918 and sterile surgical or dental adhesion barriers of subheading 3006.10.30)",112940057
