Date of data,Commodity code,Commodity,US dollar
201605,392062,"Plates, sheets, film, foil and strip, of non-cellular polyethylene terephthalate"", not reinforced, laminated, supported or similarly combined with other materials, without backing, unworked or merely surface-worked or merely cut into squares or rectangles (excluding those of poly""methyl methacrylate"", self-adhesive products, and floor, wall and ceiling coverings of heading 3918)""",84244886.0
201605,392063,"Plates, sheets, film, foil and strip, of non-cellular unsaturated polyesters, not reinforced, laminated, supported or similarly combined with other materials, without backing, unworked or merely surface-worked or merely cut into squares or rectangles (excluding those of polymethyl methacrylate"", self-adhesive products, and floor, wall and ceiling coverings of heading 3918)""",10120682.0
201605,392069,"Plates, sheets, film, foil and strip, of non-cellular polyesters, not reinforced, laminated, supported or similarly combined with other materials, not worked or only surface-worked, or only cut to rectangular, incl. square, shapes (excluding polycarbonates, polythylene terephthalate and other unsaturated polyesters, self-adhesive products, and floor, wall and ceiling coverings in heading 3918)",9404803.0
201605,392071,"Plates, sheets, film, foil and strip, of non-cellular regenerated cellulose, not reinforced, laminated, supported or similarly combined with other materials, without backing, unworked or merely surface-worked or merely cut into squares or rectangles (excluding self-adhesive products, and floor, wall and ceiling coverings of heading 3918)",2792778.0
201605,392073,"Plates, sheets, film, foil and strip, of non-cellular cellulose acetates, not reinforced, laminated, supported or similarly combined with other materials, without backing, unworked or merely surface-worked or merely cut into squares or rectangles (excluding self-adhesive products, and floor, wall and ceiling coverings of heading 3918)",13394926.0
201605,392079,"Plates, sheets, film, foil and strip, of non-cellular cellulose derivatives, not reinforced, laminated, supported or similarly combined with other materials, without backing, unworked or merely surface-worked or merely cut into squares or rectangles (excluding products of cellulose acetates, self-adhesive products, floor, wall and ceiling coverings of heading 3918)",858485.0
201605,392091,"Plates, sheets, film, foil and strip, of non-cellular polyvinyl butyral"", not reinforced, laminated, supported or similarly combined with other materials, without backing, unworked or merely surface-worked or merely cut into squares or rectangles (excluding self-adhesive products, floor, wall and ceiling coverings of heading 3918)""",13636449.0
201605,392092,"Plates, sheets, film, foil and strip, of non-cellular polyamides, not reinforced, laminated, supported or similarly combined with other materials, without backing, unworked or merely surface-worked or merely cut into squares or rectangles (excluding self-adhesive products, floor, wall and ceiling coverings of heading 3918)",6597774.0
201605,392093,"Plates, sheets, film, foil and strip, of non-cellular amino-resins, not reinforced, laminated, supported or similarly combined with other materials, without backing, unworked or merely surface-worked or merely cut into squares or rectangles (excluding self-adhesive products, floor, wall and ceiling coverings of heading 3918)",538197.0
201605,392094,"Plates, sheets, film, foil and strip, of non-cellular phenolic resins, not reinforced, laminated, supported or similarly combined with other materials, without backing, unworked or merely surface-worked or merely cut into squares or rectangles (excluding self-adhesive products, floor, wall and ceiling coverings of heading 3918)",9138124.0
201605,392099,"Plates, sheets, film, foil and strip, of non-cellular plastics, n.e.s., not reinforced, laminated, supported or similarly combined with other materials, without backing, unworked or merely surface-worked or merely cut into squares or rectangles (excluding self-adhesive products, floor, wall and ceiling coverings of heading 3918 and sterile surgical or dental adhesion barriers of subheading 3006.10.30)",44680195.0
201605,392111,"Plates, sheets, film, foil and strip, of polymers of styrene",7431182.0
201605,392112,"Plates, sheets, film, foil and strip, of polymers of vinyl chloride",35432572.0
201605,392113,"Plates, sheets, film, foil and strip, of polyurethanes",26326317.0
201605,392114,"Plates, sheets, film, foil and strip, of regenerated cellulose",2408495.0
201605,392119,"Plates, sheets, film, foil and strip, of other plastics",25781773.0
201605,392190,"Plates, sheets, film, foil and strip, (excluding of cellular plastic; self-adhesive products, floor, wall and ceiling coverings of heading 3918)",71729096.0
201605,392210,"Baths, showerbaths, sinks and washbasins,of plastics",27061577.0
201605,392220,Lavatory seats and covers,28282369.0
201605,392290,"Bidets, lavatory pans, flushing cisterns and similar sanitary ware, of plastics (excluding baths, shower-baths, sinks, washbasins, lavatory seats and covers)",12996823.0
201605,392310,"Boxes, cases, crates and similar articles",103353468.0
201605,392321,"Sacks and bags, incl. cones, of polymers of ethylene",223873237.0
201605,392329,"Sacks and bags, incl. cones, of other plastics",91608436.0
201605,392330,"Carboys, bottles, flasks and similar articles, of plastics",82909032.0
201605,392340,"Spools, cops, bobbins and similar supports, of plastics",9554086.0
201605,392350,"Stoppers, lids, caps and other closures, of plastics",86177423.0
201605,392390,"Articles for the conveyance or packaging of goods, of plastics (excluding boxes, cases, crates and similar articles; sacks and bags, incl. cones; carboys, bottles, flasks and similar articles; spools, spindles, bobbins and similar supports; stoppers, lids, caps and other closures)",69050798.0
201605,392410,"Tableware and kitchenware, of plastics",412453655.0
201605,392490,"Household articles and toilet articles, of plastics (excluding tableware, kitchenware, baths, shower-baths, washbasins, bidets, lavatory pans, seats and covers, flushing cisterns and similar sanitary ware)",242933040.0
201605,392510,"Reservoirs, tanks, vats and similar containers, of a capacity exceeding 300 l, of plastics",2002838.0
201605,392520,"Doors, windows and their frames and thresholds for doors, of plastics",19379474.0
201605,392530,"Shutters, blinds (including Venetian blinds) and similar articles and parts thereof, of plastics",36899483.0
201605,392590,"Builderss ware of plastics, nes",86080457.0
201605,392610,"Office or school supplies, of plastics",123269124.0
201605,392620,"Articles of apparel and clothing accessories (including gloves, mittens and mitts), of plastics",205351044.0
201605,392630,"Fittings for furniture, coachwork or the like, of plastics",25473018.0
201605,392640,"Statuettes and other ornamental articles, of plastics",253190071.0
201605,392690,"Articles of plastics and articles of other materials of heading 3901 to 3914, n.e.s (excluding goods of 9619)",863532776.0
201605,400110,"Natural rubber latex, whether or not prevulcanised",87439.0
201605,400121,Smoked sheets,447876.0
201605,400122,Technically specified natural rubber (TSNR),227816.0
201605,400129,"Natural rubber in primary forms or in plates, sheets or strip (excluding smoked sheets, technically specified natural rubber TSNR"" and natural rubber latex, whether or not prevulcanised)""",23600.0
201605,400211,Latex,842248.0
201605,400219,"Styrene-butadiene rubber SBR""; carboxylated styrene-butadiene rubber ""XSBR"", in primary forms or in plates, sheets or strip (excluding latex)""",10762038.0
201605,400220,Butadiene rubber (BR),2901252.0
201605,400231,Isobuteneisoprene (butyl) rubber (IIR),1676339.0
201605,400239,"Halo-isobutene-isoprene rubber CIIR"" or ""BIIR"", in primary forms or in plates, sheets or strip""",1197044.0
201605,400241,"Chloroprene latex chlorobutadiene rubber, CR""""",5994.0
201605,400249,"Chloroprene chlorobutadiene rubber, CR"", in primary forms or in plates, sheets or strip (excluding latex)""",165366.0
201605,400251,"Latex of acrylonitrile-butadiene rubber NBR""""",1459066.0
201605,400259,"Acrylonitrile-butadiene rubber NBR"", in primary forms or in plates, sheets or strip (excluding latex)""",1337691.0
201605,400260,Isoprene rubber (IR),375907.0
201605,400270,Ethylenepropylenenonconjugated diene rubber (EPDM),1832591.0
201605,400280,Mixtures of any product of heading 40.01 with any product of this heading,21588.0
201605,400291,Latex,37107.0
201605,400299,"Synthetic rubber and factice derived from oils, in primary forms or in plates, sheets or strip (excluding latex, styrene-butadiene rubber SBR"", carboxylated styrene-butadiene rubber ""XSBR"", butadiene rubber ""BR"", isobutylene isoprene rubber ""IIR"", halo-isobutene-isoprene rubber ""CIIR"" or ""BIIR"", chloroprene rubber ""CR"", acrylonitrile-butadiene rubber ""NBR"", isoprene rubber ""IR"" and non-conjugated ethylene-propylene diene rubber ""EPDM"")""",13870789.0
201605,400300,"Reclaimed rubber in primary forms or in plates, sheets or strip.",9346534.0
201605,400400,"Waste, parings and scrap of rubber (other than hard rubber) and powders and granules obtained therefrom.",233782.0
201605,400510,"Compounded rubber with carbon black or silica, unvulcanized",4549661.0
201605,400520,Solutions; dispersions other than those of subheading 4005.10,9284.0
201605,400591,"Compounded rubber, unvulcanised, in the form of plates, sheets or strip",2225241.0
201605,400599,"Other compounded, unvulcanised rubber in primary forms",85714.0
201605,400610,Camel-back strips for retreading rubber tyres,70560.0
201605,400690,"Rods, bars, tubes, profiles and other forms of unvulcanised rubber, incl. mixed rubber, and articles of unvulcanised rubber, incl. mixed rubber (excluding plates, sheets and strip which, apart from basic surface-working, have not been cut, or have merely been cut into square or rectangular shapes, and 'camel-back' strips)",281301.0
201605,400700,Vulcanised rubber thread and cord.,10088338.0
201605,400811,"Plates, sheets and strip, of cellular rubber",5440486.0
201605,400819,"Rods and profile shapes, of cellular rubber",289344.0
201605,400821,"Plates, sheets and strip, of non-cellular rubber",13849210.0
201605,400829,"Rods, tubes and profile shapes, of non-cellular rubber",851831.0
201605,400911,"Tubes, pipes and hoses, of vulcanised rubber (excluding hard rubber), not reinforced or otherwise combined with other materials, without fittings",9454151.0
201605,400912,"Tubes, pipes and hoses, of vulcanised rubber (excluding hard rubber), not reinforced or otherwise combined with other materials, with fittings",6542952.0
201605,400921,"Tubes, pipes and hoses, of vulcanised rubber (excluding hard rubber), reinforced or otherwise combined only with metal, without fittings",19199138.0
201605,400922,"Tubes, pipes and hoses, of vulcanised rubber (excluding hard rubber), reinforced or otherwise combined only with metal, with fittings",14103517.0
201605,400931,"Tubes, pipes and hoses, of vulcanised rubber (excluding hard rubber), reinforced or otherwise combined only with textile materials, without fittings",11191376.0
201605,400932,"Tubes, pipes and hoses, of vulcanised rubber (excluding hard rubber), reinforced or otherwise combined only with textile materials, with fittings",3559180.0
201605,400941,"Tubes, pipes and hoses, of vulcanised rubber (excluding hard rubber), reinforced or otherwise combined with materials other than metal or textile materials, without fittings",1625315.0
201605,400942,"Tubes, pipes and hoses, of vulcanised rubber (excluding hard rubber), reinforced or otherwise combined with materials other than metal or textile materials, with fittings",2621876.0
201605,401011,"Conveyor belts or belting, of vulcanised rubber, reinforced only with metal",3632081.0
201605,401012,"Conveyor belts or belting, of vulcanised rubber, reinforced only with textile materials",28348336.0
201605,401019,"Conveyor belts or belting, of vulcanised rubber (excluding reinforced only with metal or only with textile materials)",3452025.0
201605,401031,"Endless transmission belts of trapezoidal crosssection (Vbelts), Vribbed, of an outside circumference exceeding 60 cm but not exceeding 180 cm",6695520.0
201605,401032,"Endless transmission belts of trapezoidal crosssection (Vbelts), other than Vribbed, of an outside circumference exceeding 60 cm but not exceeding 180 cm",2503455.0
201605,401033,"Endless transmission belts of trapezoidal crosssection (Vbelts), Vribbed, of an outside circumference exceeding 180 cm but not exceeding 240 cm",845096.0
201605,401034,"Endless transmission belts of trapezoidal crosssection (Vbelts), other than Vribbed, of an outside circumference exceeding 180 cm but not exceeding 240 cm",607852.0
201605,401035,"Endless synchronous belts, of an outside circumference exceeding 60 cm but not exceeding 150 cm",2549961.0
201605,401036,"Endless synchronous belts, of an outside circumference exceeding 150 cm but not exceeding 198 cm",88131.0
201605,401039,"Other transmission belts or belting, of valcanized rubber",11535668.0
201605,401110,"New pneumatic tyres, of rubber, of a kind used on motor cars (including station wagons and racing cars)",437350225.0
201605,401120,"New pneumatic tyres, of rubber, of a kind used on buses or lorries",695073558.0
201605,401130,"New pneumatic tyres, of rubber, of a kind used on aircraft",1069731.0
201605,401140,"New pneumatic tyres, of rubber, of a kind used on motorcycles",28283297.0
201605,401150,"New pneumatic tyres, of rubber, of a kind used on bicycles",20803965.0
201605,401161,-------,18108373.0
201605,401162,-------,4280912.0
201605,401163,-------,6975360.0
201605,401169,-------,1843847.0
201605,401192,-------,4156283.0
201605,401193,-------,13713950.0
201605,401194,-------,29482128.0
201605,401199,-------,21303348.0
201605,401211,"Retreaded pneumatic tyres, of rubber, of a kind used on motor cars (including station wagons and racing cars)",59950.0
201605,401212,"Retreaded pneumatic tyres, of rubber, of a kind used on buses or lorries",294731.0
201605,401213,"Retreaded pneumatic tyres, of rubber, of a kind used on aircraft",723582.0
201605,401219,"Retreaded pneumatic tyres, of rubber (excluding of a kind used on motor cars, station wagons, racing cars, buses, lorries and aircraft)",63055.0
201605,401220,Used pneumatic tyres,734409.0
201605,401290,"Solid or cushion tyres, interchangeable tyre treads and tyre flaps, of rubber",11053761.0
201605,401310,"Inner tubes, of rubber, of a kind used on motor cars (including station wagons and racingcars), buses or lorries",13761923.0
201605,401320,"Inner tubes, of rubber, of a kind used on bicycles",14887695.0
201605,401390,"Inner tubes, of rubber (excluding those of a kind used on motor cars, incl. station wagons and racing cars, buses, lorries and bicycles)",18605751.0
201605,401410,"Sheath contraceptives, of valcanized rubber",5302520.0
201605,401490,"Hygienic or pharmaceutical articles, incl. teats, of vulcanised rubber (excluding hard rubber), with or without fittings of hard rubber, n.e.s. (excluding sheath contraceptives and articles of apparel and clothing accessories, incl. gloves, for all purposes)",4670282.0
201605,401511,Surgical,16285955.0
201605,401519,"Gloves, mittens and mitts, of vulcanised rubber (excluding surgical gloves)",27249357.0
201605,401590,"Articles of apparel and clothing accessories, for all purposes, of vulcanised rubber (excluding hard rubber and footwear and headgear and parts thereof, and gloves, mittens and mitts)",2222249.0
201605,401610,"Articles of cellular rubber, of valcanized rubber",8900669.0
201605,401691,"Floor coverings and mats, of valcanized rubber",9092478.0
201605,401692,"Erasers, of valcanized rubber",14287802.0
201605,401693,"Gaskets, washers and other seals,of valcanized rubber",79442065.0
201605,401694,"Boat or dock fenders, whether or not inflatable, of valcanized rubber",3330523.0
201605,401695,"Other inflatable articles, of valcanized rubber",4745596.0
201605,401699,"Articles of vulcanised rubber (excluding hard rubber), n.e.s",76134208.0
201605,401700,"Hard rubber (for example, ebonite) in all forms, including waste and scrap; articles of hard rubber.",3171007.0
201605,410190,"Other, including butts, bends and bellies",979751.0
201605,410221,"Raw skins of sheep or lambs, without wool on, pickled, whether or not split",112488.0
201605,410411,"Full grains, unsplit and grain splits, in the wet state incl. wet-blue"", of hides and skins of bovine ""incl. buffalo"" or equine animals, tanned, without hair on (excluding further prepared)""",2041572.0
201605,410419,"Hides and skins of bovine incl. buffalo"" or equine animals, in the wet state ""incl. wet-blue"", tanned, without hair on, whether or not split (excluding further prepared and full grains, unsplit and grain splits)""",748119.0
201605,410441,"Full grains leather, unsplit and grain splits leather, in the dry state crust"", of hides and skins of bovine ""incl. buffalo"" or equine animals, without hair on (excluding further prepared)""",289583.0
201605,410449,"Hides and skins of bovine incl. buffalo"" or equine animals, in the dry state ""crust"", without hair on, whether or not split (excluding further prepared and full grains, unsplit and grain splits)""",83348.0
201605,410510,"Skins of sheep or lambs, in the wet state incl. wet-blue"", tanned, without wool on, whether or not split (excluding further prepared and pre-tanned only)""",107524.0
201605,410530,"Skins of sheep or lambs, in the dry state crust"", without wool on, whether or not split (excluding further prepared and pre-tanned only)""",47398.0
201605,410621,"Hides and skins of goats or kids, in the wet state incl. wet-blue"", tanned, without wool on, whether or not split (excluding further prepared and pre-tanned only)""",548514.0
201605,410622,"Hides and skins of goats or kids, in the dry state crust"", without wool on, whether or not split (excluding further prepared and pre-tanned only)""",155.0
201605,410631,"Hides and skins of swine, in the wet state (incl. wet-blue), tanned, without wool on, whether or not split (excluding further prepared and pre-tanned only)",10397.0
201605,410632,"Hides and skins of swine, in the dry state (crust), without wool on, whether or not split (excluding further prepared and pre-tanned only)",2780.0
201605,410692,"Hides and skins of antelopes, deer, elks, elephants and other animals, incl. sea animals, without wool or hair on, and leather of hairless animals, in the dry state crust"", whether or not split (excluding further prepared and of bovine and equine animals, sheep and lambs, goats and kids, swine and reptiles, and pre-tanned only)""",264000.0
201605,410711,"Full grains leather incl. parchment-dressed leather"", unsplit, of the whole hides and skins of bovine ""incl. buffalo"" or equine animals, further prepared after tanning or crusting, without hair on (excluding chamois leather, patent leather and patent laminated leather, and metallised leather)""",45579.0
201605,410712,"Grain splits leather incl. parchment-dressed leather"", of the whole hides and skins of bovine ""incl. buffalo"" or equine animals, further prepared after tanning or crusting, without hair on (excluding chamois leather, patent leather and patent laminated leather, and metallised leather)""",8226323.0
201605,410719,"Leather incl. parchment-dressed leather"" of the whole hides and skins of bovine ""incl. buffalo"" or equine animals, further prepared after tanning or crusting, without hair on (excluding unsplit full grains leather, grain splits leather, chamois leather, patent leather and patent laminated leather, and metallised leather)""",939219.0
201605,410792,"Grain splits leather incl. parchment-dressed leather"", of the portions, strips or sheets of hides and skins of bovine ""incl. buffalo"" or equine animals, further prepared after tanning or crusting, without hair on (excluding chamois leather, patent leather and patent laminated leather, and metallised leather)""",25716882.0
201605,410799,"Leather incl. parchment-dressed leather"" of the portions, strips or sheets of hides and skins of bovine ""incl. buffalo"" or equine animals, further prepared after tanning or crusting, without hair on (excluding unsplit full grains leather, grain splits leather, chamois leather, patent leather and patent laminated leather, and metallised leather)""",11021784.0
201605,411200,"Leather further prepared after tanning or crusting, including parchmentdressed leather, of sheep or lamb, without wool on, whether or not split, other than leather of heading 41.14",2398769.0
201605,411310,"Leather further prepared after tanning or crusting incl. parchment-dressed leather"", of goats or kids, without wool or hair on, whether or not split (excluding chamois leather, patent leather and patent laminated leather, and metallised leather)""",710861.0
201605,411320,"Leather further prepared after tanning or crusting incl. parchment-dressed leather"", of pigs, without hair on, whether or not split (excluding chamois leather, patent leather and patent laminated leather, and metallised leather)""",5487017.0
201605,411390,"Leather further prepared after tanning or crusting incl. parchment-dressed leather"", of antelopes, deer, elks, elephants and other animals, incl. sea animals, without wool or hair on, and leather of hairless animals, whether or not split (excluding leather of bovine and equine animals, sheep and lambs, goats or kids, swine and reptiles, and chamois leather, patent leather, patent laminated leather and metallised leather)""",906.0
201605,411410,Chamois (including combination chamois) leather,187141.0
201605,411420,Patent leather and patent laminated leather; metallised leather,828675.0
201605,411510,"Composition leather with a basis of leather or leather fibre, inslabs, sheets or strip, whether or not in rolls",946426.0
201605,411520,"Parings and other waste of leather or of composition leather, not suitable for the manufacture of leather articles; leather dust, powder and flour",599441.0
201605,420100,"Saddlery and harness for any animal, incl. traces, leads, knee pads, muzzles, saddle cloths, saddlebags, dog coats and the like, of any material",36610858.0
201605,420211,"Trunks, suitcases, vanity cases, executive-cases, briefcases, school satchels and similar containers, with outer surface of leather, composition leather or patent leather",58164558.0
201605,420212,"Trunks, suitcases, vanity cases, executive-cases, briefcases, school satchels and similar containers, with outer surface of plastics or textile materials",966257620.0
201605,420219,"Trunks, suitcases, vanity cases, executive-cases, briefcases, school satchels and similar containers (excluding with outer surface of leather, composition leather, patent leather",2206589.0
201605,420221,"Handbags, whether or not with shoulder straps, incl. those without handles, with outer surface of leather, composition leather or patent leather",155026892.0
201605,420222,"Handbags, whether or not with shoulder straps, incl. those without handles, with outer surface of plastic sheeting or textile materials",508532215.0
201605,420229,"Handbags, whether or not with shoulder strap, incl. those without handle, with outer surface of vulcanised fibre or paperboard, or wholly or mainly covered with such materials or with paper",1368761.0
201605,420231,"Wallets, purses, key-pouches, cigarette-cases, tobacco-pouches and similar articles carried in the pocket or handbag, with outer surface of leather, composition leather or patent leather",48133865.0
201605,420232,"Wallets, purses, key-pouches, cigarette-cases, tobacco-pouches and similar articles carried in the pocket or handbag, with outer surface of plastic sheeting or textile materials",222914275.0
201605,420239,"Wallets, purses, key-cases, cigarette-cases, tobacco-pouches and similar articles of a kind normally carried in the pocket or handbag, with outer surface of vulcanised fibre or paperboard, or wholly or mainly covered with such materials or with paper, incl. spectacle cases of moulded plastic material",2489330.0
201605,420291,"Travelling-bags, insulated food or beverage bags, toilet bags, rucksacks, shopping-bags, map-cases, tool bags, sports bags, jewellery boxes, cutlery cases, binocular cases, camera cases, musical instrument cases, gun cases, holsters and similar containers, with outer surface of leather, composition leather or patent leather (excluding trunks, briefcases, school satchels and similar containers, handbags and articles normally carried in the pocket or handbag)",7067154.0
201605,420292,"Travelling-bags, insulated food or beverage bags, toilet bags, rucksacks, shopping-bags, map-cases, tool bags, sports bags, jewellery boxes, cutlery cases, binocular cases, camera cases, musical instrument cases, gun cases, holsters and similar containers, with outer surface of plastic sheeting or textile materials (excluding trunks, briefcases, school satchels and similar containers, handbags and articles carried in the pocket or handbag)",391179304.0
201605,420299,"Travelling-bags, shopping or tool bags, jewellery boxes, cutlery cases and similar, with outer surface of vulcanised fibre or paperboard; cases for binoculars, cameras, musical instruments, guns, holsters and similar containers with outer surface of materials (not leather, plastic sheeting or textile materials) (excluding trunks, briefcases, school satchels and similar; handbags; articles normally carried in pocket or handbag)",15202560.0
201605,420310,Articles of apparel,19180645.0
201605,420321,"Gloves of lather or of composition leather, specially designed for use in sports",6513267.0
