Date of data,Commodity code,Commodity,US dollar
202011,761100,"Aluminium reservoirs, tanks, vats and similar containers, for any material (other than compressed or liquefied gas), of a capacity exceeding 300 l, whether or not lined or heatinsulated, but not fitted with mechanical or thermal equipment.",1341299.0
202011,761210,"Collapsible tubular containers, of aluminium",3230869.0
202011,761290,"Casks, drums, cans, boxes and similar containers, incl. rigid tubular containers, of aluminium, for any material (other than compressed or liquefied gas), of a capacity of ≤ 300 l, n.e.s.",35218715.0
202011,761300,Aluminium containers for compressed or liquefied gas.,6361025.0
202011,761410,"Stranded wire, cables, plaited bands and the like, of aluminium, with steel core, not electrically insulated",10452334.0
202011,761490,"Stranded wires, cables, ropes and similar articles, of aluminium (other than with steel core and electrically insulated products)",17717758.0
202011,761510,"Table, kitchen or other household articles and parts thereof; pot scourers and scouring or polishing pads, gloves and the like",340418376.0
202011,761520,Sanitary ware and parts thereof,9455971.0
202011,761610,"Nails, tacks, staples (other than those of heading 83.05), screws, bolts, nuts, screw hooks, rivets, cotters, cotterpins, washers and similar articles",10149712.0
202011,761691,"Cloth, grill, netting and fencing, of aluminium wire",8646405.0
202011,761699,Unwrought lead (excluding refined lead and lead containing by weight antimony as the principal other element),344117682.0
202011,780110,"Unwrought lead, refined",28175.0
202011,780191,"Unwrought lead, containing by weight antimony as the principal other element",361367.0
202011,780199,Unwrought lead (excluding refined lead and lead containing by weight antimony as the principal other element),158940.0
202011,780411,"Sheets, strip and foil of a thickness (excluding any backing) not exceeding 0.2 mm",53992.0
202011,780419,"Lead plates; lead sheets, strip and foil, of a thickness (excluding any backing) exceeding 0,2 mm",1020811.0
202011,780420,Powders and flakes,16913.0
202011,780600,Other articles of lead.,955126.0
202011,790111,"Unwrought zinc, not alloyed, containing by weight 99.99% or more of zinc",2285295.0
202011,790112,"Unwrought zinc, not alloyed, containing by weight less than 99.99% of zinc",1600.0
202011,790120,Unwrought zinc alloys,903164.0
202011,790390,Zinc powders and flakes,207934.0
202011,790400,"Zinc bars, rods, profiles and wire.",1052990.0
202011,790500,"Zinc plates, sheets, strip and foil.",1772030.0
202011,790700,Other articles of zinc.,14176422.0
202011,800110,"Unwrought tin, not alloyed",7406926.0
202011,800300,"Tin bars, rods, profiles and wire.",1100364.0
202011,800700,Other articles of tin.,5582049.0
202011,810110,Tungsten powders,2504423.0
202011,810194,"Unwrought tungsten, incl. bars and rods of tungsten obtained simply by sintering",831300.0
202011,810196,"Tungsten bars and rods (other than those obtained simply by sintering), profiles, plates, sheets, strip and foil, n.e.s.",2781176.0
202011,810197,Tungsten wire,338650.0
202011,810199,Tungsten waste and scrap (excluding ash and residues containing tungsten),4153205.0
202011,810210,Molybdenum powders,431588.0
202011,810294,"Unwrought molybdenum, incl. bars and rods obtained simply by sintering",2117746.0
202011,810295,"Molybdenum bars and rods (other than those obtained simply by sintering), profiles, plates, sheets, strip and foil, n.e.s.",2144019.0
202011,810296,Molybdenum wire,1204375.0
202011,810297,Molybdenum waste and scrap (excluding ash and residues containing molybdenum),773346.0
202011,810299,"Articles of molybdenum, n.e.s.",500058.0
202011,810320,"Unwrought tantalum, including bars and rods obtained simply by sintering; powders",3259750.0
202011,810330,Tantalum waste and scrap (excluding ash and residues containing tantalum),50702.0
202011,810390,"Articles of tantalum, n.e.s.",9013263.0
202011,810411,"Unwrought magnesium, containing ≥ 99,8% by weight of magnesium",49456255.0
202011,810419,"Unwrought magnesium, containing < 99,8% by weight of magnesium",32534009.0
202011,810420,Magnesium waste and scrap,855859.0
202011,810430,"Magnesium raspings, turnings and granules, graded according to size; magnesium powders",16775388.0
202011,810490,"Articles of magnesium, n.e.s.",2900370.0
202011,810520,Cobalt mattes and other intermediate products of cobalt metallurgy; unwrought cobalt; powders,2885813.0
202011,810590,"Articles of cobalt, n.e.s.",326595.0
202011,810600,"Bismuth and articles thereof, including waste and scrap.",2305607.0
202011,810720,Unwrought cadmium; powders,425017.0
202011,810790,"Articles of cadmium, n.e.s.",5434.0
202011,810820,Unwrought titanium; powders,154116.0
202011,810890,"Articles of titanium, n.e.s.",33979337.0
202011,810920,Unwrought zirconium; powders,608520.0
202011,810990,"Articles of zirconium, n.e.s.",872480.0
202011,811010,Unwrought antimony; powders,2953734.0
202011,811100,"Manganese and articles thereof, including waste and scrap.",54913824.0
202011,811221,Unwrought chromium; chromium powders,236754.0
202011,811229,"Articles of chromium, n.e.s.",342735.0
202011,811292,"Unwrought hafnium (celtium), niobium (columbium), rhenium, gallium, indium, vanadium and germanium; powders and waste and scrap of these metals (excluding ash and residues containing these metals)",1365474.0
202011,811299,"Articles of hafnium (celtium), niobium (columbium), rhenium, gallium, indium, vanadium and germanium, n.e.s.",5289933.0
202011,811300,"Cermets and articles thereof, including waste and scrap.",2358084.0
202011,820110,Spades and shovels,32573520.0
202011,820130,"Mattocks, picks, hoes and rakes",23395367.0
202011,820140,"Axes, bill hooks and similar hewing tools",9277447.0
202011,820150,Secateurs and similar onehanded pruners and shears (including poultry shears),9283283.0
202011,820160,"Hedge shears, twohanded pruning shears and similar twohanded shears",7468539.0
202011,820190,"Other hand tools of a kind used in agriculture, horticulture or forestry",10676444.0
202011,820210,Hand saws,16400345.0
202011,820220,Band saw blades,3792261.0
202011,820231,"Circular saw blades, incl. slitting or slotting saw blades, of base metal, with working parts of steel",13448655.0
202011,820239,"Circular saw blades, incl. slitting or slotting saw blades, and parts thereof, of base metal, with working parts of materials other than steel",64898025.0
202011,820240,Chain saw blades,7200484.0
202011,820291,"Straight saw blades, for working metal",1995149.0
202011,820299,"Saw blades, incl. toothless saw blades, of base metal (excluding bandsaw blades, circular saw blades, slitting or slotting saw blades, chainsaw blades and straight saw blades for working metal)",25679807.0
202011,820310,"Files, rasps and similar tools",5271867.0
202011,820320,"Pliers (including cutting pliers), pincers, tweezers and similar tools",74343058.0
202011,820330,Metal cutting shears and similar tools,4702119.0
202011,820340,"Pipecutters, bolt croppers, perforating punches and similar tools",5866248.0
202011,820411,"Hand-operated spanners and wrenches, incl. torque meter wrenches, of base metal, non-adjustable",41541353.0
202011,820412,"Hand-operated spanners and wrenches, incl. torque meter wrenches, of base metal, adjustable (excluding tap wrenches)",25806749.0
202011,820420,"Interchangeable spanner sockets, with or without handles",36323849.0
202011,820510,"Drilling, threading or tapping tools",2879298.0
202011,820520,Hammers and sledge hammers,26955880.0
202011,820530,"Planes, chisels, gouges and similar cutting tools for working wood",8696638.0
202011,820540,Screwdrivers,34350628.0
202011,820551,"Household hand tools, non-mechanical, with working parts of base metal, n.e.s.",112892233.0
202011,820559,"Hand tools, incl. glaziers' diamonds, of base metal, n.e.s.",114083325.0
202011,820560,Blow lamps,1156864.0
202011,820570,"Vices, clamps and the like",20309730.0
202011,820590,"Other, including sets of articles of two or more of  subheadings of this heading",13194669.0
202011,820600,"Tools of two or more of the headings 82.02 to 82.05, put up in sets for retail sale.",78885195.0
202011,820713,"Rock-drilling or earth-boring tools, interchangeable, with working parts of sintered metal carbides or cermets",3144765.0
202011,820719,"Rock-drilling or earth-boring tools, interchangeable, and parts therefor, with working parts of materials other than sintered metal carbide or cermets",41511396.0
202011,820720,Dies for drawing or extruding metal,6966837.0
202011,820730,"Tools for pressing, stamping or punching",105179219.0
202011,820740,Tools for tapping or threading,8921796.0
202011,820750,"Tools for drilling, other than for rock drilling",99400046.0
202011,820760,Tools for boring or broaching,1676901.0
202011,820770,Tools for milling,17112118.0
202011,820780,Tools for turning,3049904.0
202011,820790,Other interchangeable tools,36406769.0
202011,820810,"Knives and cutting blades, of base metal, for machines or for mechanical appliances, for metalworking",18687958.0
202011,820820,"Knives and cutting blades, of base metal, for machines or for mechanical appliances, for wood-working",5013926.0
202011,820830,"Knives and cutting blades, of base metal, for kitchen appliances or for machines used by the food industry",1463606.0
202011,820840,"Knives and cutting blades, of base metal, for agricultural, horticultural or forestry machines (excluding those for wood-working)",3514912.0
202011,820890,"Knives and cutting blades, of base metal, for machines or for mechanical appliances (excluding those for metal or wood-working, kitchen appliances or machines used by the food industry and those for agricultural, horticultural or forestry machines)",10880109.0
202011,820900,"Plates, sticks, tips and the like for tools, unmounted, of cermets.",34318801.0
202011,821000,"Hand-operated mechanical appliances, weighing 10 kg or less, used in the preparation, conditioning or serving of food or drink.",31667968.0
202011,821110,Sets of assorted articles,65929133.0
202011,821191,Table knives having fixed blades,11504475.0
202011,821192,Other knives having fixed blades,55195505.0
202011,821193,Knives having other than fixed blades,23000573.0
202011,821194,"Blades of base metal for table knives, pocket knives and other knives of heading 8211",4836556.0
202011,821195,Handles of base metal,268112.0
202011,821210,Razors,29432848.0
202011,821220,"Safety razor blades, including razor blade blanks in strips",5906626.0
202011,821290,Parts of non-electric razors of base metal (excluding safety razor blades and razor blade blanks in strips),3975331.0
202011,821300,"Scissors, tailors' shears and similar shears, and blades therefor.",67136847.0
202011,821410,"Paper knives, letter openers, erasing knives, pencil sharpeners and blades therefor",12825645.0
202011,821420,Manicure or pedicure sets and instruments (including nail files),32674376.0
202011,821490,"Hair clippers, butchers' or kitchen cleavers and other articles of cutlery of base metal, n.e.s.",27893246.0
202011,821510,Sets of assorted articles containing at least one article plated with precious metal,153367.0
202011,821520,Other sets of assorted articles,90545494.0
202011,821591,Plated with precious metal,154504.0
202011,821599,"Spoons, forks, ladles, skimmers, cake-servers, fish-knives, butter-knives, sugar tongs and similar kitchen or tableware of base metal, not plated with precious metal (excluding sets of articles such as lobster cutters and poultry shears)",127479406.0
202011,830110,Padlocks,69124204.0
202011,830120,Locks of a kind used for motor vehicles,33130666.0
202011,830130,Locks of a kind used for furniture,31948214.0
202011,830140,Other locks,165257788.0
202011,830150,"Clasps and frames with clasps, incorporating locks",2154647.0
202011,830160,"Parts of padlocks, locks, clasps and frames with clasps, incorporating locks, of base metal, n.e.s.",93503196.0
202011,830170,Keys presented separately,4456053.0
202011,830210,"Hinges of all kinds, of base metal",213373643.0
202011,830220,Castors with mountings of base metal,52762108.0
202011,830230,"Base metal mountings, fittings and similar articles suitable for motor vehicles (excluding hinges and castors)",13990218.0
202011,830241,Base metal mountings and fittings suitable for buildings (excluding locks with keys and hinges),376540303.0
202011,830242,"Base metal mountings, fittings and similar articles suitable for furniture (excluding locks with keys, hinges and castors)",446265075.0
202011,830249,"Base metal mountings, fittings and similar articles (excluding locks with keys, clasps and frames with clasps incorporating locks, hinges, castors and mountings and fittings suitable for buildings, motor vehicles or furniture)",61772565.0
202011,830250,"Hat-racks, hat-pegs, brackets and similar fixtures of base metal",124407249.0
202011,830260,Automatic door closers of base metal,26765678.0
202011,830300,"Armoured or reinforced safes, strongboxes and doors and safe deposit lockers for strongrooms, cash or deed boxes and the like, of base metal",61129639.0
202011,830400,"Filing cabinets, cardindex cabinets, paper trays, paper rests, pen trays, officestamp stands and similar office or desk equipment, of base metal, other than office furniture of heading 9403",19502213.0
202011,830510,"Fittings for loose-leaf binders or files, of base metal (excluding drawing pins and clasps for books or registers)",4324803.0
202011,830520,"Staples in strips, of base metal",15267336.0
202011,830590,"Office articles such as letter clips, letter corners, paper clips and indexing tags, of base metal, incl. parts of articles of heading 8305 (excluding fittings for loose-leaf binders or files, staples in strips, drawing pins and clasps for books or registers)",18383964.0
202011,830610,"Bells, gongs and the like, non-electric, of base metal",6240314.0
202011,830621,"Statuettes and other ornaments, of base metal, plated with precious metal",773287.0
202011,830629,"Statuettes and other ornaments, of base metal, not plated with precious metal",125472411.0
202011,830630,"Photograph, picture or similar frames, of base metal; mirrors of base metal",16249151.0
202011,830710,"Flexible tubing of iron or steel, with or without fittings",28645562.0
202011,830790,"Flexible tubing of base metal other than iron or steel, with or without fittings",7450851.0
202011,830810,"Hooks, eyes and eyelets, of base metal, of a kind used for clothing, footwear, awnings, handbags, travel goods or other made-up articles",60686731.0
202011,830820,"Tubular or bifurcated rivets, of base metal",12130573.0
202011,830890,"Clasps, frames with clasps without locks, buckles and buckle-clasps, of base metal, for clothing, footwear, handbags, travel goods or other made-up articles, incl. parts of articles of heading 8308, of base metal (excluding hooks, eyes, eyelets and tubular or bifurcated rivets)",14781322.0
202011,830910,Crown corks of base metal,612070.0
202011,830990,"Stoppers, caps and lids, incl. screw caps and pouring stoppers, capsules for bottles, threaded bungs, bung covers, seals and other packing accessories of base metal (excluding crow corks)",78545578.0
202011,831000,"Signplates, nameplates, addressplates and similar plates, numbers, letters and other symbols, of base metal, excluding those of heading 9405",18289508.0
202011,831110,"Coated electrodes of base metal, for electric arc-welding",33971804.0
202011,831120,"Cored wire of base metal, for electric arc-welding",11774710.0
202011,831130,"Coated rods and cored wire, of base metal, for soldering, brazing or welding by flame (excluding wire and rods cored with solder which, excluding the flux material, contains ≥ 2% by weight of precious metal)",15059713.0
202011,831190,"Wire, rods, tubes, plates, electrodes and the like, of base metal or of metal carbides, coated or cored with flux material, for soldering, brazing, welding or deposition of metal or metal carbides, n.e.s., and wire and rods of agglomerated base metal powder, for metal spraying, n.e.s.",1504911.0
202011,840130,"Fuel elements (cartridges), nonirradiated",9727531.0
202011,840211,Watertube boilers with a steam production exceeding 45 t per hour,3897249.0
202011,840212,Watertube boilers with a steam production not exceeding 45 t per hour,7485764.0
202011,840219,"Other vapour generating boilers, including hybrid boilers",8878940.0
202011,840220,Superheated water boilers,354669.0
202011,840290,"Parts of vapour generating boilers and superheated water boilers, n.e.s.",94503376.0
202011,840310,"Central heating boilers, non-electric (excluding vapour generating boilers and superheated water boilers of heading 8402)",7100278.0
202011,840390,"Parts of central heating boilers, n.e.s.",11824598.0
202011,840410,Auxiliary plant for use with boilers of heading 84.02 or 84.03,29724995.0
202011,840420,Condensers for steam or other vapour power units,3014578.0
202011,840490,"Parts of auxiliary plant of heading 8402 or 8403 and condensers for steam or other vapour power units, n.e.s.",3654912.0
202011,840510,"Producer gas or water gas generators, with or without their purifiers; acetylene gas generators and similar water process gas generators, with or without their purifiers",1846409.0
202011,840590,"Parts of producer gas or water gas generators and acetylene gas generators or similar water process gas generators, n.e.s.",580197.0
202011,840681,"Turbines, of an output exceeding 40 MW",7208986.0
202011,840682,"Turbines, of an output not exceeding 40 MW",816519.0
202011,840690,"Parts of steam and other vapour turbines, n.e.s.",28344797.0
202011,840721,Spark-ignition outboard motors for marine propulsion,15878663.0
202011,840729,"Spark-ignition reciprocating or rotary engines, for marine propulsion (excluding outboard motors)",11808.0
202011,840731,"Spark-ignition reciprocating piston engine, of a kind used for the propulsion of vehicles of chapter 87, of a cylinder capacity ≤ 50 ml",2390687.0
202011,840732,"Spark-ignition reciprocating piston engine, of a kind used for the propulsion of vehicles of chapter 87, Of a cylinder capacity exceeding 50 cc but not exceeding 250 cc",27445697.0
202011,840733,"Spark-ignition reciprocating piston engine, of a kind used for the propulsion of vehicles of chapter 87, Of a cylinder capacity exceeding 250 cc but not exceeding 1,000 cc",13431827.0
202011,840734,"Spark-ignition reciprocating piston engine, of a kind used for the propulsion of vehicles of chapter 87, Of a cylinder capacity exceeding 1,000 cc",87470539.0
202011,840790,Other engines,90692548.0
202011,840810,Marine propulsion engines,10543761.0
202011,840820,Engines of a kind used for the propulsion of vehicles of Chapter 87,37323525.0
202011,840890,Other engines,84484074.0
202011,840910,"Parts suitable for use solely or principally with internal combustion piston engine for aircraft, n.e.s.",241072.0
202011,840991,"Parts suitable for use solely or principally with spark-ignition internal combustion piston engine, n.e.s.",341170496.0
202011,840999,"Parts suitable for use solely or principally with compression-ignition internal combustion piston engine diesel or semi-diesel engine"", n.e.s.""",207335666.0
202011,841011,"Hydraulic turbines and water wheels, off a power not exceeding 1,000 kW",144959.0
202011,841012,"Hydraulic turbines and water wheels, off a power exceeding 1,000 kW but not exceeding 10,000 kW",44714.0
202011,841013,"Hydraulic turbines and water wheels, off a power exceeding 10,000 kW",653744.0
202011,841090,Parts of hydraulic turbines and water wheels incl. regulators,10574404.0
202011,841111,Turbojets of a thrust not exceeding 25 kN,114639.0
202011,841112,Turbojets of a thrust exceeding 25 kN,19541373.0
202011,841181,"Gas turbines of a power not exceeding 5,000 kW",350755.0
202011,841182,"Gas turbines of a power exceeding 5,000 kW",2333117.0
202011,841191,"Parts of turbojets or turbopropellers, n.e.s.",155879135.0
202011,841199,"Parts of gas turbines, n.e.s.",32915199.0
202011,841221,"Hydraulic power engines and motors, linear acting (cylinders)",58649269.0
202011,841229,"Hydraulic power engines and motors (excluding hydraulic turbines and water wheels of heading 8410, steam turbines and hydraulic power engines and motors, linear acting)",24812764.0
202011,841231,"Pneumatic power engines and motors, linear acting (cylinders)",23548929.0
202011,841239,Pneumatic power engines and motors (excluding linear acting),5931515.0
202011,841280,"Engines and motors (excluding steam turbines, internal combustion piston engine, hydraulic turbines, water wheels, gas turbines, reaction engines, hydraulic power engines and motors, pneumatic power engines and motors and electric motors)",933843.0
202011,841290,"Parts of non-electrical engines and motors, n.e.s.",121374920.0
202011,841311,"Pumps for dispensing fuel or lubricants, of the type used in fillingstations or in garages",10367683.0
202011,841319,"Pumps for liquids, fitted or designed to be fitted with a measuring device (excluding pumps for dispensing fuel or lubricants, of the type used in filling stations or in garages)",7351491.0
202011,841320,"Hand pumps, other than those of subheading 8413.11 or 8413.19",83225577.0
202011,841330,"Fuel, lubricating or cooling medium pumps for internal combustion piston engines",96615450.0
202011,841340,Concrete pumps,2594697.0
202011,841350,Other reciprocating positive displacement pumps,99018538.0
202011,841360,Other rotary positive displacement pumps,95631601.0
202011,841370,Other centrifugal pumps,315079109.0
202011,841381,"Pumps for liquids, power-driven (excluding those of subheading 8413.11 and 8413.19, fuel, lubricating or cooling medium pumps for internal combustion piston engine, concrete pumps, general reciprocating or rotary positive displacement pumps and centrifugal pumps of all kinds)",14896952.0
202011,841382,Liquid elevators,256066.0
202011,841391,"Parts of pumps for liquids, n.e.s.",162738661.0
202011,841392,"Parts of liquid elevators, n.e.s.",964583.0
202011,841410,Vacuum pumps,28211959.0
202011,841420,Hand or footoperated air pumps,31133095.0
202011,841430,Compressors of a kind used in refrigerating equipment,362920274.0
202011,841440,Air compressors mounted on a wheeled chassis for towing,7406214.0
202011,841451,"Table, floor, wall, window, ceiling or roof fans, with a selfcontained electric motor of an output not exceeding 125 W",315175329.0
202011,841459,"Fans (excluding table, floor, wall, window, ceiling or roof fans, with a self-contained electric motor of an output ≤ 125 W)",218466984.0
202011,841460,Hoods having a maximum horizontal side not exceeding 120 cm,74526858.0
202011,841480,"Air pumps, air or other gas compressors and ventilating or recycling hoods incorporating a fan, whether or not fitted with filters, having a maximum horizontal side > 120 cm (excluding vacuum pumps, hand- or foot-operated air pumps, compressors for refrigerating equipment and air compressors mounted on a wheeled chassis for towing)",279965653.0
202011,841490,"Parts of: air or vacuum pumps, air or other gas compressors, fans and ventilating or recycling hoods incorporating a fan, n.e.s.",273472041.0
202011,841510,"Air conditioning machines of a kind designed to be fixed to a window, wall, ceiling or floor, selfcontained or .splitsystem.",517000798.0
202011,841520,"Air conditioning machines of a kind used for persons, in motor vehicles",23742233.0
202011,841581,Air conditioning machines incorporating a refrigerating unit and a valve for reversal of the cooling/heat cycle (reversible heat pumps),21500560.0
202011,841582,"Other, air conditioning machines incorporating a refrigerating unit",30522372.0
202011,841583,"Air conditioning machines,not incorporating a refrigerating unit",7994856.0
202011,841590,"Parts of air conditioning machines, comprising a motor-driven fan and elements for changing the temperature and humidity, n.e.s.",392976443.0
202011,841610,Furnace burners for liquid fuel,1130739.0
202011,841620,"Other furnace burners, including combination burners",26623347.0
202011,841630,"Mechanical stokers, including their mechanical grates, mechanical ash dischargers and similar appliances",194680.0
202011,841690,"Parts of furnace burners such as mechanical stokers, incl. their mechanical grates, mechanical ash dischargers and similar appliances, n.e.s.",4087835.0
202011,841710,"Furnaces and ovens for the roasting, melting or other heattreatment of ores, pyrites or of metals",15458895.0
202011,841720,"Bakery ovens, including biscuit ovens",8354904.0
202011,841780,"Industrial or laboratory furnaces and ovens, non-electric, incl. incinerators (excluding those for the roasting, melting or other heat treatment of ores, pyrites or metals, bakery ovens, drying ovens and ovens for cracking operations)",21433292.0
202011,841790,"Parts of industrial or laboratory furnaces, non-electric, incl. incinerators, n.e.s.",25910448.0
202011,841810,"Combined refrigeratorfreezers, fitted with separate external doors",470560338.0
202011,841821,"Household refrigerators, compression-type",154068284.0
202011,841829,"Household refrigerators, absorption-type",23046965.0
202011,841830,"Freezers of the chest type, of a capacity ≤ 800L",171339120.0
202011,841840,"Freezers of the upright type, of a capacity ≤ 900L",55569833.0
202011,841850,"Furniture (chests, cabinets, display counters, show-cases and the like) for storage and display, incorporating refrigerating or freezing equipment (excluding combined refrigerator-freezers with separate external doors, household refrigerators and freezers of the chest type of a capacity ≤ 800L or of the upright type of a capacity ≤ 900L)",126634684.0
202011,841861,Heat pumps other than air conditioning machines of heading 84.15,35508729.0
202011,841869,Refrigerating or freezing equipment (excluding refrigerating and freezing furniture),127472465.0
