Date of data,Commodity code,Commodity,US dollar
202412,732399,"Table, kitchen or other household articles, and parts thereof, of iron other than cast iron or steel other than stainless (excluding enamelled articles; cans, boxes and similar containers of heading 7310; waste baskets; shovels and other articles of the nature of a work implement; cutlery, spoons, ladles etc. of heading 8211 to 8215; ornamental articles; sanitary ware)",306705261
202412,732410,"Sinks and washbasins, of stainless steel",128154389
202412,732421,"Baths of cast iron, whether or not enamelled",1698282
202412,732429,Baths of steel sheet,1819387
202412,732490,"Sanitary ware, incl. parts thereof (excluding cans, boxes and similar containers of heading 7310, small wall cabinets for medical supplies or toiletries and other furniture of chapter 94, and fittings, complete sinks and washbasins, of stainless steel, complete baths and fittings)",179271955
202412,732510,"Articles of non-malleable cast iron, n.e.s.",68735484
202412,732591,"Grinding balls and similar articles for mills, cast (excluding such articles of non-malleable cast iron)",32061779
202412,732599,"Cast articles of iron or steel, n.e.s. (excluding articles of non-malleable cast iron, and grinding balls and similar articles for mills)",42598478
202412,732611,"Grinding balls and similar articles for mills, of iron or steel, forged or stamped, but not further worked",114925609
202412,732619,"Articles of iron or steel, forged or stamped, but not further worked, n.e.s. (excluding grinding balls and similar articles for mills)",86630364
202412,732620,"Articles of iron or steel wire, n.e.s.",154264384
202412,732690,"Articles of iron or steel, n.e.s. (excluding cast articles or articles of iron or steel wire)",1432947675
202412,740200,Unrefined copper; copper anodes for electrolytic refining.,78018
202412,740311,"Cathodes and sections of cathodes of refined copper, unwrought",150777272
202412,740313,"Billets of refined copper, unwrought",468861
202412,740321,Copperzincbasealloys(brass),26177
202412,740400,Copper waste and scrap.,911
202412,740500,Master alloys of copper.,883394
202412,740610,Powders of nonlamellar structure,2990749
202412,740620,Powders of lamellar structure; flakes,255345
202412,740710,"Bars, rods and profiles, of refined copper, n.e.s.",8157582
202412,740721,"Bars, rods and profiles, of copper-zinc base alloys ""brass"", n.e.s.",1690367
202412,740729,"Bars, rods and profiles of copper alloys, n.e.s. (excluding such articles of copper-zinc base alloys ""brass"")",5793945
202412,740811,"Wire of refined copper, of which the maximum crosssectional dimension exceeds 6 mm",35961662
202412,740819,"Wire of refined copper, other",45984689
202412,740821,Wire of copper-zinc base alloys (brass),7411904
202412,740822,"Wire of copper-nickel alloys (cupro-nickel)or copper-nickel-zinc alloys ""nickel silver""",237540
202412,740829,"Wire of copper alloys (other than copper-zinc alloys [brass], copper-nickel alloys [cupro-nickel] or copper-nickel-zinc alloys [nickel silver])",3311804
202412,740911,"Plates, sheets and strip, of refined copper, in coils, of a thickness of ＞ 0,15 mm",40657510
202412,740919,"Plates, sheets and strip, of refined copper, not in coils, of a thickness of ＞ 0,15 mm",9736692
202412,740921,"Plates, sheets and strip, of copper-zinc base alloys ""brass"", of a thickness of ＞ 0,15 mm, in coils",13836524
202412,740929,"Plates, sheets and strip, of copper-zinc base alloys ""brass"", of a thickness of ＞ 0,15 mm, not in coils",1694545
202412,740931,"Plates, sheets and strip, of copper-tin base alloys ""bronze"", of a thickness of ＞ 0,15 mm, in coils",8971891
202412,740939,"Plates, sheets and strip, of copper-tin base alloys ""bronze"", of a thickness of ＞ 0,15 mm, not in coils",34784
202412,740940,"Plates, sheets and strip, of copper-nickel base alloys ""cupro-nickel"" or copper-nickel-zinc base alloys ""nickel silver"", of a thickness of ＞ 0,15 mm, not in coils",8354082
202412,740990,"Plates, sheets and strip, of copper alloys, of a thickness of ＞ 0,15 mm, other",4432455
202412,741011,"Refined copper foil, not backed, of a thickness of ≤ 0,15 mm",38238732
202412,741012,"Copper alloy foil, not backed, of a thickness of ≤ 0,15 mm",3521495
202412,741021,"Refined copper foil, backed, of a thickness ""excluding any backing"" of ≤ 0,15 mm",53612734
202412,741022,"Copper alloy foil, backed, of a thickness ""excluding any backing"" of ≤ 0,15 mm",398417
202412,741110,Tubes and pipes of refined copper,204976790
202412,741121,"Tubes and pipes of copper-zinc base alloys ""brass""",9864755
202412,741122,"Tubes and pipes of copper-nickel base alloys ""cupro-nickel"" or copper-nickel-zinc base alloys ""nickel silver""",11853313
202412,741129,"Tubes and pipes of copper alloys (excluding copper-zinc base alloys ""brass"", copper-nickel base alloys ""cupro-nickel"" and copper-nickel-zinc base alloys ""nickel silver"")",1550065
202412,741210,"Refined copper tube or pipe fittings ""e.g., couplings, elbows, sleeves""",22938392
202412,741220,"Copper alloy tube or pipe fittings ""e.g., couplings, elbows, sleeves""",92216789
202412,741300,"Stranded wire, cables, plaited bands and the like, of copper, not electrically insulated.",5518333
202412,741510,"Nails and tacks, drawing pins, staples and similar articles",304953
202412,741521,"Washers, ""incl. spring washers and spring lock washers"", of copper",1765339
202412,741529,"Rivets, cotters, cotter pins and the like, not threaded, of copper (excluding spring washers and spring lock washers)",2546945
202412,741533,"Screws, bolts, nuts and similar articles, threaded, of copper (other than screw hooks, ring- and eyebolts, lag screws, plugs, bungs and the like, with screw thread)",11330053
202412,741539,"Screw hooks, screw rings and the like, threaded, of copper (excluding standard screws and bolts and nuts)",2265013
202412,741810,"Table, kitchen or other household articles and parts thereof; pot scourers and scouring or polishing pads, gloves and the like",2508694
202412,741820,Sanitary ware and parts thereof,44700705
202412,741920,"Cast, moulded, stamped or forged copper articles without further processing",12287266
202412,741980,other copper articles,29709121
202412,750120,Nickel oxide sinters and other intermediate products of nickel metallurgy,12909
202412,750210,"Nickel, not alloyed",272125711
202412,750220,Nickel alloys,4089582
202412,750300,Nickel waste and scrap.,597780
202412,750400,Nickel powders and flakes.,8205590
202412,750511,"Bars, rods, profiles and wire, of non-alloy nickel, n.e.s.",371474
202412,750512,"Bars, rods, profiles and wire, of nickel alloys, n.e.s.",21133468
202412,750521,Wire of non-alloy nickel,251489
202412,750522,Wire of nickel alloys,4451752
202412,750610,"Plates, sheets, strip and foil, of non-alloy nickel",4756274
202412,750620,"Plates, sheets, strip and foil, of nickel alloys",3688327
202412,750711,Tubes and pipes of non-alloy nickel,157348
202412,750712,Tubes and pipes of nickel alloys,17317097
202412,750720,"Tube or pipe fittings, of nickel",3829655
202412,750810,"Cloth, grill, netting and fencing, of nickel wire",1104234
202412,750890,"Articles of nickel, n.e.s.",3502064
202412,760110,"Aluminium, not alloyed",30474594
202412,760120,Aluminium alloys,61229013
202412,760200,Aluminium waste and scrap.,206954
202412,760310,"Powders of aluminium, of non-lamellar structure",5053383
202412,760320,"Powders of aluminium, of lamellar structure, and flakes of aluminium",535818
202412,760410,"Bars, rods and profiles, of non-alloy aluminium, n.e.s.",982304
202412,760421,"Hollow profiles of aluminium alloys, n.e.s.",132171956
202412,760429,"Bars, rods and solid profiles, of aluminium alloys, n.e.s.",117739983
202412,760511,"Wire of non-alloy aluminium, with a maximum cross-sectional dimension of ＞ 7 mm",5262003
202412,760519,"Wire of non-alloy aluminium, with a maximum cross-sectional dimension of ≤ 7 mm",2055889
202412,760521,"Wire of aluminium alloys, with a maximum cross-sectional dimension of ＞ 7 mm",4759532
202412,760529,"Wire, of aluminium alloys, having a maximum cross-sectional dimension of ≤ 7 mm",7147451
202412,760611,"Plates, sheets and strip, of non-alloy aluminium, of a thickness exceeding 0.2 mm, square or rectangular",89771388
202412,760612,"Plates, sheets and strip, of aluminium alloys, of a thickness exceeding 0.2 mm, square or rectangular",695033145
202412,760691,"Plates, sheets and strip, of non-alloy aluminium, of a thickness exceeding 0.2 mm",19122688
202412,760692,"Plates, sheets and strip, of aluminium alloys, of a thickness exceeding 0.2 mm , other",35151808
202412,760711,"Aluminium foil, not backed, rolled but not further worked, of a thickness not exceeding 0.2 mm. (excluding stamping foils of heading 3212, and foil made up as christmas tree decorating material)",250687798
202412,760719,"Aluminium foil, not backed, rolled and further worked, of a thickness not exceeding 0.2 mm. (excluding stamping foils of heading 3212, and foil made up as christmas tree decorating material)",116051120
202412,760720,"Aluminium foil, backed, of a thickness (excluding any backing) not exceeding 0.2 mm.(excluding stamping foils of heading 3212, and foil made up as christmas tree decorating material)",68948335
202412,760810,Tubes and pipes of non-alloy aluminium,4095529
202412,760820,Tubes and pipes of aluminium alloys,40679798
202412,760900,"Aluminium tube or pipe fittings (for example, couplings, elbows, sleeves).",22384485
202412,761010,"Doors, windows and their frames and thresholds for doors",227351154
202412,761090,"Structures and parts of structures, of aluminium, n.e.s., and plates, rods, profiles, tubes and the like, prepared for use in structures, of aluminium, n.e.s.",449959379
202412,761100,"Aluminium reservoirs, tanks, vats and similar containers, for any material (other than compressed or liquefied gas), of a capacity exceeding 300 l, whether or not lined or heatinsulated, but not fitted with mechanical or thermal equipment.",2462653
202412,761210,"Collapsible tubular containers, of aluminium",4551783
202412,761290,"Casks, drums, cans, boxes and similar containers, incl. rigid tubular containers, of aluminium, for any material (other than compressed or liquefied gas), of a capacity of ≤ 300 l, n.e.s.",38631442
202412,761300,Aluminium containers for compressed or liquefied gas.,7972861
202412,761410,"Stranded wire, cables, plaited bands and the like, of aluminium, with steel core, not electrically insulated",55620505
202412,761490,"Stranded wires, cables, ropes and similar articles, of aluminium (other than with steel core and electrically insulated products)",29188824
202412,761510,"Table, kitchen or other household articles and parts thereof; pot scourers and scouring or polishing pads, gloves and the like",316672838
202412,761520,Sanitary ware and parts thereof,12865250
202412,761610,"Nails, tacks, staples (other than those of heading 83.05), screws, bolts, nuts, screw hooks, rivets, cotters, cotterpins, washers and similar articles",17172538
202412,761691,"Cloth, grill, netting and fencing, of aluminium wire",9005059
202412,761699,Unwrought lead (excluding refined lead and lead containing by weight antimony as the principal other element),524261458
202412,780110,"Unwrought lead, refined",1580009
202412,780191,"Unwrought lead, containing by weight antimony as the principal other element",508387
202412,780199,Unwrought lead (excluding refined lead and lead containing by weight antimony as the principal other element),880829
202412,780411,"Sheets, strip and foil of a thickness (excluding any backing) not exceeding 0.2 mm",205477
202412,780419,"Lead plates; lead sheets, strip and foil, of a thickness (excluding any backing) exceeding 0,2 mm",1541233
202412,780420,Powders and flakes,3549
202412,780600,Other articles of lead.,679821
202412,790111,"Unwrought zinc, not alloyed, containing by weight 99.99% or more of zinc",13655407
202412,790120,Unwrought zinc alloys,2363080
202412,790310,Zinc dust,8431
202412,790390,Zinc powders and flakes,1239958
202412,790400,"Zinc bars, rods, profiles and wire.",1886128
202412,790500,"Zinc plates, sheets, strip and foil.",449713
202412,790700,Other articles of zinc.,9836177
202412,800110,"Unwrought tin, not alloyed",69478526
202412,800120,"Unwrought tin, alloys",437028
202412,800300,"Tin bars, rods, profiles and wire.",2633326
202412,800700,Other articles of tin.,3298105
202412,810110,Tungsten powders,7287897
202412,810194,"Unwrought tungsten, incl. bars and rods of tungsten obtained simply by sintering",11887430
202412,810196,"Tungsten bars and rods (other than those obtained simply by sintering), profiles, plates, sheets, strip and foil, n.e.s.",3487620
202412,810197,Tungsten wire,1259600
202412,810199,Tungsten waste and scrap (excluding ash and residues containing tungsten),6282760
202412,810210,Molybdenum powders,1696285
202412,810294,"Unwrought molybdenum, incl. bars and rods obtained simply by sintering",9394085
202412,810295,"Molybdenum bars and rods (other than those obtained simply by sintering), profiles, plates, sheets, strip and foil, n.e.s.",5677787
202412,810296,Molybdenum wire,1659370
202412,810297,Molybdenum waste and scrap (excluding ash and residues containing molybdenum),16609186
202412,810299,"Articles of molybdenum, n.e.s.",1082237
202412,810320,"Unwrought tantalum, including bars and rods obtained simply by sintering; powders",4812581
202412,810330,Tantalum waste and scrap (excluding ash and residues containing tantalum),39753
202412,810399,Other wrought tantalum and its products,13793471
202412,810411,"Unwrought magnesium, containing ≥ 99,8% by weight of magnesium",56073124
202412,810419,"Unwrought magnesium, containing ＜ 99,8% by weight of magnesium",20269147
202412,810420,Magnesium waste and scrap,2876949
202412,810430,"Magnesium raspings, turnings and granules, graded according to size; magnesium powders",15394925
202412,810490,"Articles of magnesium, n.e.s.",3324477
202412,810520,Cobalt mattes and other intermediate products of cobalt metallurgy; unwrought cobalt; powders,18877687
202412,810590,"Articles of cobalt, n.e.s.",1086614
202412,810610,"Bismuth content of more than 99% by weight Bismuth and its products, including waste and scrap",4564026
202412,810690,"Bismuth content of 99% or less by weight Bismuth and its products, including waste and scrap",528521
202412,810820,Unwrought titanium; powders,6955981
202412,810830,Titanium waste and scrap (excluding ash and residues containing titanium),2432044
202412,810890,"Articles of titanium, nes",86695059
202412,810921,Unwrought zirconium and powder with a hafnium to zirconium ratio of less than 1:500 by weight,11128625
202412,810929,Other unwrought zirconium and powder,1141110
202412,810991,Wrought zirconium and zirconium products with a hafnium to zirconium ratio of less than 1:500 by weight,3706106
202412,810999,Other wrought zirconium and zirconium products,289118
202412,811100,"Manganese and articles thereof, including waste and scrap",53217060
202412,811219,Wrought beryllium and articles thereof,37046
202412,811221,Unwrought chromium; chromium powders,18374144
202412,811229,Wrought chromium and articles thereof,1661058
202412,811231,Unwrought hafnium; waste and scrap; powder,7116312
202412,811239,Wrought hafnium and articles products,753269
202412,811241,Unwrought rhenium; waste and scrap; powder,309028
202412,811249,Wrought rhenium and articles thereof,8767
202412,811269,"Cadmium, powder and cadmium products",19559
202412,811292,"Unwrought niobium (columbium),gallium, indium, vanadium and germanium; powders and waste and scrap of these metals",103202677
202412,811299,"Wrought niobium (columbium),gallium, indium, vanadium and germanium; and articles thereof",25767511
202412,811300,"Cermets and articles thereof, including waste and scrap.",6656824
202412,820110,Spades and shovels,35453690
202412,820130,"Mattocks, picks, hoes and rakes",23538170
202412,820140,"Axes, bill hooks and similar hewing tools",9572533
202412,820150,Secateurs and similar onehanded pruners and shears (including poultry shears),18555973
202412,820160,"Hedge shears, twohanded pruning shears and similar twohanded shears",12075804
202412,820190,"Other hand tools of a kind used in agriculture, horticulture or forestry",16110492
202412,820210,Hand saws,19021060
202412,820220,Band saw blades,7613211
202412,820231,"Circular saw blades, incl. slitting or slotting saw blades, of base metal, with working parts of steel",15721401
202412,820239,"Circular saw blades, incl. slitting or slotting saw blades, and parts thereof, of base metal, with working parts of materials other than steel",74849422
202412,820240,Chain saw blades,16748808
202412,820291,"Straight saw blades, for working metal",2775986
202412,820299,"Saw blades, incl. toothless saw blades, of base metal (excluding bandsaw blades, circular saw blades, slitting or slotting saw blades, chainsaw blades and straight saw blades for working metal)",35009222
202412,820310,"Files, rasps and similar tools",7770740
202412,820320,"Pliers (including cutting pliers), pincers, tweezers and similar tools",104779851
202412,820330,Metal cutting shears and similar tools,4815023
202412,820340,"Pipecutters, bolt croppers, perforating punches and similar tools",6650389
202412,820411,"Hand-operated spanners and wrenches, incl. torque meter wrenches, of base metal, non-adjustable",67127561
202412,820412,"Hand-operated spanners and wrenches, incl. torque meter wrenches, of base metal, adjustable (excluding tap wrenches)",35979059
202412,820420,"Interchangeable spanner sockets, with or without handles",55371391
202412,820510,"Drilling, threading or tapping tools",9851399
202412,820520,Hammers and sledge hammers,29198552
202412,820530,"Planes, chisels, gouges and similar cutting tools for working wood",11283078
202412,820540,Screwdrivers,37118093
202412,820551,"Household hand tools, non-mechanical, with working parts of base metal, n.e.s.",150117314
202412,820559,"Hand tools, incl. glaziers' diamonds, of base metal, n.e.s.",187527874
202412,820560,Blow lamps,882392
202412,820570,"Vices, clamps and the like",20068963
202412,820590,Portable forges; hand or pedal operated grinding wheels with frameworks; including sets of articles of two or more of subheadings of this heading,15098737
202412,820600,"Tools of two or more of the headings 82.02 to 82.05, put up in sets for retail sale.",99972817
202412,820713,"Rock-drilling or earth-boring tools, interchangeable, with working parts of sintered metal carbides or cermets",6645197
202412,820719,"Rock-drilling or earth-boring tools, interchangeable, and parts therefor, with working parts of materials other than sintered metal carbide or cermets",73102003
202412,820720,Dies for drawing or extruding metal,10999307
202412,820730,"Tools for pressing, stamping or punching",175010018
202412,820740,Tools for tapping or threading,13491556
202412,820750,"Tools for drilling, other than for rock drilling",134251791
202412,820760,Tools for boring or broaching,3358058
202412,820770,Tools for milling,37317650
202412,820780,Tools for turning,8468933
202412,820790,Other interchangeable tools,47132535
202412,820810,"Knives and cutting blades, of base metal, for machines or for mechanical appliances, for metalworking",38051748
202412,820820,"Knives and cutting blades, of base metal, for machines or for mechanical appliances, for wood-working",5588995
202412,820830,"Knives and cutting blades, of base metal, for kitchen appliances or for machines used by the food industry",3447005
202412,820840,"Knives and cutting blades, of base metal, for agricultural, horticultural or forestry machines (excluding those for wood-working)",9395073
202412,820890,"Knives and cutting blades, of base metal, for machines or for mechanical appliances (excluding those for metal or wood-working, kitchen appliances or machines used by the food industry and those for agricultural, horticultural or forestry machines)",19291167
202412,820900,"Plates, sticks, tips and the like for tools, unmounted, of cermets.",61496784
202412,821000,"Hand-operated mechanical appliances, weighing 10 kg or less, used in the preparation, conditioning or serving of food or drink.",41226372
202412,821110,Sets of assorted articles,37434466
202412,821191,Table knives having fixed blades,12601681
202412,821192,Other knives having fixed blades,48316964
202412,821193,Knives having other than fixed blades,23668837
202412,821194,"Blades of base metal for table knives, pocket knives and other knives of heading 8211",6144712
202412,821195,Handles of base metal,740068
202412,821210,Razors,41430100
202412,821220,"Safety razor blades, including razor blade blanks in strips",7672186
202412,821290,Parts of non-electric razors of base metal (excluding safety razor blades and razor blade blanks in strips),9314837
202412,821300,"Scissors, tailors' shears and similar shears, and blades therefor.",67606615
202412,821410,"Paper knives, letter openers, erasing knives, pencil sharpeners and blades therefor",19407235
202412,821420,Manicure or pedicure sets and instruments (including nail files),59494513
202412,821490,"Hair clippers, butchers' or kitchen cleavers and other articles of cutlery of base metal, n.e.s.",27350023
202412,821510,Sets of assorted articles containing at least one article plated with precious metal,255367
202412,821520,Other sets of assorted articles,91117317
202412,821591,Plated with precious metal,207278
202412,821599,"Spoons, forks, ladles, skimmers, cake-servers, fish-knives, butter-knives, sugar tongs and similar kitchen or tableware of base metal, not plated with precious metal (excluding sets of articles such as lobster cutters and poultry shears)",157812375
202412,830110,Padlocks,87076411
202412,830120,Locks of a kind used for motor vehicles,53645500
202412,830130,Locks of a kind used for furniture,38817803
202412,830140,Other locks,232481749
202412,830150,"Clasps and frames with clasps, incorporating locks",3749389
202412,830160,"Parts of padlocks, locks, clasps and frames with clasps, incorporating locks, of base metal, n.e.s.",116404556
202412,830170,Keys presented separately,7796711
202412,830210,"Hinges of all kinds, of base metal",251146414
202412,830220,Castors with mountings of base metal,70218126
202412,830230,"Base metal mountings, fittings and similar articles suitable for motor vehicles (excluding hinges and castors)",24748942
202412,830241,Base metal mountings and fittings suitable for buildings (excluding locks with keys and hinges),389638965
202412,830242,"Base metal mountings, fittings and similar articles suitable for furniture (excluding locks with keys, hinges and castors)",485273116
202412,830249,"Base metal mountings, fittings and similar articles (excluding locks with keys, clasps and frames with clasps incorporating locks, hinges, castors and mountings and fittings suitable for buildings, motor vehicles or furniture)",70414493
202412,830250,"Hat-racks, hat-pegs, brackets and similar fixtures of base metal",105172172
202412,830260,Automatic door closers of base metal,48762025
202412,830300,"Armoured or reinforced safes, strongboxes and doors and safe deposit lockers for strongrooms, cash or deed boxes and the like, of base metal",58517787
202412,830400,"Filing cabinets, cardindex cabinets, paper trays, paper rests, pen trays, officestamp stands and similar office or desk equipment, of base metal, other than office furniture of heading 9403",19246447
202412,830510,"Fittings for loose-leaf binders or files, of base metal (excluding drawing pins and clasps for books or registers)",7565018
202412,830520,"Staples in strips, of base metal",19477506
202412,830590,"Office articles such as letter clips, letter corners, paper clips and indexing tags, of base metal, incl. parts of articles of heading 8305 (excluding fittings for loose-leaf binders or files, staples in strips, drawing pins and clasps for books or registers)",21973813
202412,830610,"Bells, gongs and the like, non-electric, of base metal",13536633
202412,830621,"Statuettes and other ornaments, of base metal, plated with precious metal",850311
202412,830629,"Statuettes and other ornaments, of base metal, not plated with precious metal",177096909
202412,830630,"Photograph, picture or similar frames, of base metal; mirrors of base metal",17685990
202412,830710,"Flexible tubing of iron or steel, with or without fittings",42731342
202412,830790,"Flexible tubing of base metal other than iron or steel, with or without fittings",6069282
202412,830810,"Hooks, eyes and eyelets, of base metal, of a kind used for clothing, footwear, awnings, handbags, travel goods or other made-up articles",109683652
202412,830820,"Tubular or bifurcated rivets, of base metal",20886561
202412,830890,"Clasps, frames with clasps without locks, buckles and buckle-clasps, of base metal, for clothing, footwear, handbags, travel goods or other made-up articles, incl. parts of articles of heading 8308, of base metal (excluding hooks, eyes, eyelets and tubular or bifurcated rivets)",26162968
202412,830910,Crown corks of base metal,1614066
202412,830990,"Stoppers, caps and lids, incl. screw caps and pouring stoppers, capsules for bottles, threaded bungs, bung covers, seals and other packing accessories of base metal (excluding crow corks)",142902997
202412,831000,"Signplates, nameplates, addressplates and similar plates, numbers, letters and other symbols, of base metal, excluding those of heading 9405",44605001
202412,831110,"Coated electrodes of base metal, for electric arc-welding",43417938
202412,831120,"Cored wire of base metal, for electric arc-welding",27361299
202412,831130,"Coated rods and cored wire, of base metal, for soldering, brazing or welding by flame (excluding wire and rods cored with solder which, excluding the flux material, contains ≥ 2% by weight of precious metal)",25264805
