Date of data,Commodity code,Commodity,US dollar
202412,581099,"Embroidery of materials other than cotton or man-made fibres, on a textile fabric base, in the piece, in strips or in motifs (excluding embroidery without visible ground)",2490124
202412,581100,"Quilted textile products in the piece, composed of one or more layers of textile materials assembled with padding by stitching or otherwise (excluding embroidery of heading 5810 and quilted fabrics for bedding and furnishings)",6494959
202412,590110,"Textile fabrics coated with gum or amylaceous substances, of a kind used for the outer covers of books or the like",3887176
202412,590190,Tracing cloth; prepared painting canvas; buckram and similar stiffened textile fabrics of a kind used for hat foundations (excluding plastic-coated textile fabrics),27990777
202412,590210,"Tyre cord fabric of high-tenacity yarn of nylon or other polyamides, whether or not dipped or impregnated with rubber or plastic",37391827
202412,590220,"Tyre cord fabric of high-tenacity polyester yarn, whether or not dipped or impregnated with rubber or plastic",36708194
202412,590290,"Tyre cord fabric of high-tenacity viscose rayon yarn, whether or not dipped in rubber or plastic",4858
202412,590310,"Textile fabrics impregnated, coated, covered or laminated with poly""vinyl chloride"" (excluding wallcoverings of textile materials impregnated or covered with poly""vinyl chloride""; floor coverings consisting of a textile backing and a top layer or covering of poly""vinyl chloride"")",248837578
202412,590320,"Textile fabrics impregnated, coated, covered or laminated with polyurethane (excluding wallcoverings of textile materials impregnated or covered with polyurethane; floor coverings consisting of a textile backing and a top layer or covering of polyurethane)",265925992
202412,590390,"Textile fabrics impregnated, coated, covered or laminated with plastics other than poly""vinyl chloride"" or polyurethane (excluding tyre cord fabric of high-tenacity yarn of nylon or other polyamides, polyesters or viscose rayon; wallcoverings of textile materials impregnated or covered with plastic; floor coverings consisting of a textile backing and a top layer or covering of plastics)",141606078
202412,590410,"Linoleum, whether or not cut to shap",285501
202412,590490,"Floor coverings consisting of a coating or covering applied on a textile backing, whether or not cut to shape (excluding linoleum)",2091707
202412,590500,Textile wall coverings.,3427052
202412,590610,Adhesive tape of a width not exceeding 20 cm,18908637
202412,590691,"Knitted or crocheted textile fabrics, rubberised, n.e.s.",3084039
202412,590699,"Rubberised textile fabrics (excluding knitted or crocheted textile fabrics, adhesive tape of a width of ≤ 20 cm, and tyre cord fabric of high-tenacity yarn of nylon or other polyamides, polyesters or viscose rayon)",9752077
202412,590700,"Impregnated, coated or covered textile fabrics; painted canvas being theatrical scenery, studio backcloths or the like, n.e.s.",40598995
202412,590800,"Textile wicks, woven, plaited or knitted, for lamps, stoves, lighters, candles or the like; incandescent gas mantles and tubular knitted gas-mantle fabric for incandescent gas mantles, whether or not impregnated",890821
202412,590900,"Textile hosepiping and similar textile tubing, whether or not impregnated or coated, with or without lining, armour or accessories of other materials",14933454
202412,591000,"Transmission or conveyor belts or belting, of textile material, whether or not impregnated, coated, covered or laminated with plastics, or reinforced with metal or other material.",14947558
202412,591110,"Textile fabrics, felt and felt-lined woven fabrics, coated, covered or laminated with rubber, leather or other material, of a kind used for card clothing, and similar fabrics of a kind used for other technical purposes, incl. narrow fabrics made of velvet impregnated with rubber, for covering weaving spindles ""weaving beams""",1383851
202412,591120,"Bolting cloth, whether or not made up",5699828
202412,591131,"Textile fabrics and felts, endless or fitted with linking devices, of a kind used in papermaking or similar machines, e.g. for paper pulp or asbestos-cement, weighing ＜ 650 g/m2",1960317
202412,591132,"Textile fabrics and felts, endless or fitted with linking devices, of a kind used in papermaking or similar machines, e.g. for paper pulp or asbestos-cement, weighing ≥ 650 g/m2",11904440
202412,591140,"Filtering or straining cloth of a kind used in oil-presses or for similar technical purposes, incl. that of human hair",11213516
202412,591190,"Textile products and articles, for technical purposes, specified in Note 7 to chapter 59, n.e.s.",49030400
202412,600110,"Long pile fabrics, knitted or crocheted",20635030
202412,600121,"Looped pile fabrics of cotton, knitted or crocheted",11011005
202412,600122,"Looped pile fabrics of man-made fibres, knitted or crocheted",15789487
202412,600129,"Looped pile fabrics, knitted or crocheted (excluding of cotton or man-made fibres)",483811
202412,600191,"Pile fabrics of cotton, knitted or crocheted (excluding ""long pile"" fabrics)",33631926
202412,600192,"Pile fabrics of man-made fibres, knitted or crocheted (excluding ""long pile"" fabrics)",314361539
202412,600199,"Pile fabrics, knitted or crocheted (excluding cotton or man-made fibres and ""long pile"" fabrics)",822626
202412,600240,"Knitted or crocheted fabrics, of a width of ≤ 30 cm, containing ≥ 5% by weight elastomeric yarn",8477801
202412,600290,"Knitted or crocheted fabrics, of a width of ≤ 30 cm, containing ≥ 5% by weight elastomeric yarn and rubber thread or rubber thread only",6719440
202412,600310,"Knitted or crocheted fabrics of wool or fine animal hair, of a width of ≤ 30 cm",12942
202412,600320,"Knitted or crocheted fabrics of cotton, of a width of ≤ 30 cm",449155
202412,600330,"Knitted or crocheted fabrics of synthetic fibres, of a width of ≤ 30 cm",3867716
202412,600340,"Knitted or crocheted fabrics of artificial fibres, of a width of ≤ 30 cm",69163
202412,600390,Knitted or crocheted fabrics of a width of ≤ 30 cm,272375
202412,600410,"Knitted or crocheted fabrics, of a width of ＞ 30 cm, containing ≥ 5% by weight elastomeric yarn",526858707
202412,600490,"Knitted or crocheted fabrics, of a width of ＞ 30 cm, containing ≥ 5% by weight elastomeric yarn and rubber thread or rubber thread only",3731818
202412,600521,"Unbleached or bleached cotton warp knit fabrics ""incl. those made on galloon knitting machines"", of a width of ＞ 30 cm",132842
202412,600522,"Dyed cotton warp knit fabrics ""incl. those made on galloon knitting machines"", of a width of ＞ 30 cm",1682402
202412,600523,"Cotton warp knit fabrics of yarns of different colours ""incl. those made on galloon knitting machines"", of a width of ＞ 30 cm",58438
202412,600524,"Printed cotton warp knit fabrics ""incl. those made on galloon knitting machines"", of a width of ＞ 30 cm",29960
202412,600535,Fabrics specified in Subheading Note 1 to this Chapter,239189
202412,600536,"Unbleached or bleached warp knit fabrics of synthetic fibres ""incl. those made on galloon knitting machines"", of a width of ＞ 30 cm",12566128
202412,600537,"Dyed warp knit fabrics of synthetic fibres ""incl. those made on galloon knitting machines"", of a width of ＞ 30 cm",104620890
202412,600538,"Warp knit fabrics of synthetic fibres, of yarns of different colours ""incl. those made on galloon knitting machines"", of a width of ＞ 30 cm",2873386
202412,600539,"Printed warp knit fabrics of synthetic fibres ""incl. those made on galloon knitting machines"", of a width of ＞ 30 cm",14438743
202412,600541,"Unbleached or bleached warp knit fabrics of artificial fibres ""incl. those made on galloon knitting machines"", of a width of ＞ 30 cm",336884
202412,600542,"Dyed warp knit fabrics of artificial fibres ""incl. those made on galloon knitting machines"", of a width of ＞ 30 cm",576493
202412,600543,"Warp knit fabrics of artificial fibres, of yarns of different colours ""incl. those made on galloon knitting machines"", of a width of ＞ 30 cm",4706
202412,600544,"Printed warp knit fabrics of artificial fibres ""incl. those made on galloon knitting machines"", of a width of ＞ 30 cm",36019
202412,600590,"Warp knit fabrics ""incl. those made on galloon knitting machines"", of a width of ＞ 30 cm",764667
202412,600610,"Fabrics, knitted or crocheted, of a width of ＞ 30 cm, of wool or fine animal hair",2510481
202412,600621,"Unbleached or bleached cotton fabrics, knitted or crocheted, of a width of ＞ 30 cm",19195289
202412,600622,"Dyed cotton fabrics, knitted or crocheted, of a width of ＞ 30 cm",171415032
202412,600623,"Cotton fabrics, knitted or crocheted, of yarns of different colours, of a width of ＞ 30 cm",18728250
202412,600624,"Printed cotton fabrics, knitted or crocheted, of a width of ＞ 30 cm",20935415
202412,600631,"Unbleached or bleached fabrics, knitted or crocheted, of synthetic fibres, of a width of ＞ 30 cm",34541609
202412,600632,"Dyed fabrics, knitted or crocheted, of synthetic fibres, of a width of ＞ 30 cm",533756109
202412,600633,"Fabrics, knitted or crocheted, of synthetic fibres, of yarns of different colours, of a width of ＞ 30 cm",38169431
202412,600634,"Printed fabrics, knitted or crocheted, of synthetic fibres, of a width of ＞ 30 cm",64827301
202412,600641,"Unbleached or bleached fabrics, knitted or crocheted, of artificial fibres, of a width of ＞ 30 cm",1965510
202412,600642,"Dyed fabrics, knitted or crocheted, of artificial fibres, of a width of ＞ 30 cm",46505756
202412,600643,"Fabrics, knitted or crocheted, of artificial fibres, of yarns of different colours, of a width of ＞ 30 cm",2174678
202412,600644,"Printed fabrics, knitted or crocheted, of artificial fibres, of a width of ＞ 30 cm",6021724
202412,600690,"Fabrics, knitted or crocheted, of a width of ＞ 30 cm",10422496
202412,610120,"Overcoats, car coats, capes, cloaks, anoraks, incl. ski jackets, windcheaters, wind-jackets and similar articles of cotton, for men or boys, knitted or crocheted",2818092
202412,610130,"Overcoats, car coats, capes, cloaks, anoraks, incl. ski jackets, windcheaters, wind-jackets and similar articles of man-made fibres, for men or boys, knitted or crocheted",16151271
202412,610190,"Overcoats, car coats, capes, cloaks, anoraks, incl. ski jackets, windcheaters, wind-jackets and similar articles of textile materials, for men or boys, knitted or crocheted",853507
202412,610210,"Women's or girls' overcoats, car coats, capes, cloaks, anoraks, incl. ski jackets, windcheaters, wind-jackets and similar articles, of wool or fine animal hair, knitted or crocheted",1918035
202412,610220,"Women's or girls' overcoats, car coats, capes, cloaks, anoraks, incl. ski jackets, windcheaters, wind-jackets and similar articles of cotton, knitted or crocheted",4705776
202412,610230,"Women's or girls' overcoats, car coats, capes, cloaks, anoraks, incl. ski jackets, windcheaters, wind-jackets and similar articles of man-made fibres, knitted or crocheted",43537627
202412,610290,"Women's or girls' overcoats, car coats, capes, cloaks, anoraks, incl. ski jackets, windcheaters, wind-jackets and similar articles, of textile materials, knitted or crocheted",270462
202412,610310,"Men's or boys' suits of textile materials, knitted or crocheted",1127896
202412,610322,"Men's or boys' ensembles of cotton, knitted or crocheted",39230476
202412,610323,"Men's or boys' ensembles of synthetic fibres, knitted or crocheted",29294861
202412,610329,Men's or boys' ensembles of textile materials,256735
202412,610331,"Men's or boys' jackets and blazers of wool or fine animal hair, knitted or crocheted",6933855
202412,610332,"Men's or boys' jackets and blazers of cotton, knitted or crocheted",87158640
202412,610333,"Men's or boys' jackets and blazers of synthetic fibres, knitted or crocheted",49018268
202412,610339,Men's or boys' jackets and blazers of textile materials,1898595
202412,610341,"Men's or boys' trousers, bib and brace overalls, breeches and shorts of wool or fine animal hair, knitted or crocheted",1377334
202412,610342,"Men's or boys' trousers, bib and brace overalls, breeches and shorts of cotton, knitted or crocheted",142883878
202412,610343,"Men's or boys' trousers, bib and brace overalls, breeches and shorts of synthetic fibres, knitted or crocheted",187814603
202412,610349,"Men's or boys' trousers, bib and brace overalls, breeches and shorts of textile materials, knitted or crocheted",4248424
202412,610413,"Women's or girls' suits of synthetic fibres, knitted or crocheted",624597
202412,610419,"Women's or girls' suits of textile materials, knitted or crocheted",176216
202412,610422,"Women's or girls' ensembles of cotton, knitted or crocheted",53053589
202412,610423,"Women's or girls' ensembles of synthetic fibres, knitted or crocheted",82739292
202412,610429,Women's or girls' ensembles of textile materials,17644734
202412,610431,"Women's or girls' jackets and blazers of wool or fine animal hair, knitted or crocheted",5771601
202412,610432,"Women's or girls' jackets and blazers of cotton, knitted or crocheted",133017366
202412,610433,"Women's or girls' jackets and blazers of synthetic fibres, knitted or crocheted",199019699
202412,610439,"Women's or girls' jackets and blazers of textile materials, knitted or crocheted",11892664
202412,610441,"Women's or girls' dresses of wool or fine animal hair, knitted or crocheted",2925487
202412,610442,"Women's or girls' dresses of cotton, knitted or crocheted",45521833
202412,610443,"Women's or girls' dresses of synthetic fibres, knitted or crocheted",200414114
202412,610444,"Women's or girls' dresses of artificial fibres, knitted or crocheted",32908138
202412,610449,"Women's or girls' dresses of textile materials, knitted or crocheted",2092104
202412,610451,"Women's or girls' skirts and divided skirts of wool or fine animal hair, knitted or crocheted",775708
202412,610452,"Women's or girls' skirts and divided skirts of cotton, knitted or crocheted",25142866
202412,610453,"Women's or girls' skirts and divided skirts of synthetic fibres, knitted or crocheted",140216695
202412,610459,"Women's or girls' skirts and divided skirts of textile materials, knitted or crocheted",6997122
202412,610461,"Women's or girls' trousers, bib and brace overalls, breeches and shorts of wool or fine animal hair, knitted or crocheted",5216531
202412,610462,"Women's or girls' trousers, bib and brace overalls, breeches and shorts of cotton, knitted or crocheted",153859481
202412,610463,"Women's or girls' trousers, bib and brace overalls, breeches and shorts of synthetic fibres, knitted or crocheted",376597357
202412,610469,"Women's or girls' trousers, bib and brace overalls, breeches and shorts of textile materials, knitted or crocheted",31061178
202412,610510,"Men's or boys' shirts of cotton, knitted or crocheted (excluding nightshirts, T-shirts, singlets and other vests)",61033020
202412,610520,"Men's or boys' shirts of man-made fibres, knitted or crocheted (excluding nightshirts, T-shirts, singlets and other vests)",100058964
202412,610590,"Men's or boys' shirts of textile materials, knitted or crocheted (excluding of cotton or man-made fibres, nightshirts, T-shirts, singlets and other vests)",1433313
202412,610610,"Women's or girls' blouses, shirts and shirt-blouses of cotton, knitted or crocheted (excluding T-shirts and vests)",12176795
202412,610620,"Women's or girls' blouses, shirts and shirt-blouses of man-made fibres, knitted or crocheted (excluding T-shirts and vests)",26971162
202412,610690,"Women's or girls' blouses, shirts and shirt-blouses of textile materials, knitted or crocheted (excluding of cotton or man-made fibres, T-shirts and vests)",632069
202412,610711,"Men's or boys' underpants and briefs of cotton, knitted or crocheted",122343870
202412,610712,"Men's or boys' underpants and briefs of man-made fibres, knitted or crocheted",99659622
202412,610719,"Men's or boys' underpants and briefs of other textile materials, knitted or crocheted (excluding of cotton or man-made fibres)",2262368
202412,610721,"Men's or boys' nightshirts and pyjamas of cotton, knitted or crocheted (excluding vests and singlets)",29048833
202412,610722,"Men's or boys' nightshirts and pyjamas of man-made fibres, knitted or crocheted (excluding vests and singlets)",29658863
202412,610729,"Men's or boys' nightshirts and pyjamas of textile materials, knitted or crocheted (excluding of cotton or man-made fibres, and vests and singlets)",859419
202412,610791,"Men's or boys' bathrobes, dressing gowns and similar articles of cotton, knitted or crocheted",7865653
202412,610799,"Men's or boys' bathrobes, dressing gowns and similar articles of textile materials, knitted or crocheted (excluding of cotton)",16352297
202412,610811,"Women's or girls' slips and petticoats of man-made fibres, knitted or crocheted (excluding T-shirts and vests)",1318787
202412,610819,"Women's or girls' slips and petticoats of textile materials, knitted or crocheted (excluding man-made fibres, T-shirts and vests)",303206
202412,610821,"Women's or girls' briefs and panties of cotton, knitted or crocheted",114911074
202412,610822,"Women's or girls' briefs and panties of man-made fibres, knitted or crocheted",111176181
202412,610829,"Women's or girls' briefs and panties of textile materials, knitted or crocheted (excluding cotton or man-made fibres)",1827198
202412,610831,"Women's or girls' nightdresses and pyjamas of cotton, knitted or crocheted (excluding T-shirts, vests and négligés)",43253032
202412,610832,"Women's or girls' nightdresses and pyjamas of man-made fibres, knitted or crocheted (excluding T-shirts, vests and négligés)",150397170
202412,610839,"Women's or girls' nightdresses and pyjamas of textile materials, knitted or crocheted (excluding of cotton and man-made fibres, T-shirts, vests and négligés)",2821794
202412,610891,"Women's or girls' négligés, bathrobes, dressing gowns, housejackets and similar articles of cotton, knitted or crocheted (excluding vests, slips, petticoats, briefs and panties, nightdresses, pyjamas, brassiéres, girdles, corsets and similar articles)",65896508
202412,610892,"Women's or girls' négligés, bathrobes, dressing gowns, housejackets and similar articles of man-made fibres, knitted or crocheted (excluding vests, slips, petticoats, briefs and panties, nightdresses, pyjamas, brassiéres, girdles, corsets and similar articles)",114053890
202412,610899,"Women's or girls' négligés, bathrobes, dressing gowns, housejackets and similar articles of textile materials, knitted or crocheted (excluding of cotton or man-made fibres, vests, slips, petticoats, briefs and panties, nightdresses, pyjamas, brassiéres, girdles, corsets and similar articles)",409418
202412,610910,"T-shirts, singlets and other vests of cotton, knitted or crocheted",446275201
202412,610990,"T-shirts, singlets and other vests of textile materials, knitted or crocheted (excluding cotton)",482086394
202412,611011,"Jerseys, pullovers, cardigans, waistcoats and similar articles, of hair of Kashmir ""cashmere"" goats, knitted or crocheted (excluding quilted articles)",58557379
202412,611012,"Jerseys, pullovers, cardigans, waistcoats and similar articles, of fine animal hair, knitted or crocheted (excluding from hair of Kashmir ""cashmere"" goats and quilted articles)",47898869
202412,611019,"Jerseys, pullovers, cardigans, waistcoats and similar articles, of cotton, knitted or crocheted (excluding wadded waistcoats)",13762692
202412,611020,"Jerseys, pullovers, cardigans, waistcoats and similar articles, of man-made fibres, knitted or crocheted (excluding wadded waistcoats)",576859152
202412,611030,"Jerseys, pullovers, cardigans, waistcoats and similar articles, of textile materials, knitted or crocheted (excluding of wool, fine animal hair, cotton or man-made fibres, and wadded waistcoats)",1029331407
202412,611090,"bies' garments and clothing accessories, knitted or crocheted (excluding hats)",15962061
202412,611120,"Babies' garments and clothing accessories of cotton, knitted or crocheted (excluding hats)",130340162
202412,611130,"Babies' garments and clothing accessories of synthetic fibres, knitted or crocheted (excluding hats)",33438241
202412,611190,"Babies' garments and clothing accessories of textile materials, knitted or crocheted (excluding of cotton or synthetic fibres, and hats)",11524647
202412,611211,"Track-suits of cotton, knitted or crocheted",3498465
202412,611212,"Track-suits of synthetic fibres, knitted or crocheted",19624876
202412,611219,"Track-suits of textile materials, knitted or crocheted (excluding cotton or synthetic fibres)",401466
202412,611220,"Ski-suits, knitted or crocheted",437974
202412,611231,"Men's or boys' swimwear of synthetic fibres, knitted or crocheted",17926115
202412,611241,"Women's or girls' swimwear of synthetic fibres, knitted or crocheted",165980451
202412,611249,"Women's or girls' swimwear of textile materials, knitted or crocheted (excluding synthetic fibres)",789771
202412,611300,"Garments, knitted or crocheted, rubberised or impregnated, coated or covered with plastics or other materials (excluding babies' garments and clothing accessories)",21254162
202412,611420,"Other garments of cotton, knitted or crocheted",189419220
202412,611430,"Other garments of man-made fibres, knitted or crocheted",163557614
202412,611490,"Other garments of other textile materials, knitted or crocheted",9754739
202412,611510,"Graduated compression hosiery [e.g., stockings for varicose veins], of textile materials, knitted or crocheted (excluding hosiery for babies)",2619475
202412,611521,"Pantyhose and tights of synthetic fibres, knitted or crocheted, measuring per single yarn ＜ 67 decitex (excluding graduated compression hosiery)",26718953
202412,611522,"Pantyhose and tights of synthetic fibres, knitted or crocheted, measuring per single yarn ≥ 67 decitex (excluding graduated compression hosiery)",12331034
202412,611529,"Pantyhose and tights of textile materials, knitted or crocheted (excluding graduated compression hosiery, those of synthetic fibres and hosiery for babies)",11215841
202412,611530,"Women's full-length or knee-length hosiery, knitted or crocheted, measuring per single yarn ＜ 67 decitex (excluding graduated compression hosiery, pantyhose and tights)",10516769
202412,611594,"Full-length or knee-length stockings, socks and other hosiery, incl. footwear without applied soles, of wool or fine animal hair, knitted or crocheted (excluding graduated compression hosiery, pantyhose and tights, women's full-length or knee-length stockings, measuring per single yarn ＜ 67 decitex, and hosiery for babies)",5395654
202412,611595,"Full-length or knee-length stockings, socks and other hosiery, incl. footwear without applied soles, of cotton, knitted or crocheted (excluding graduated compression hosiery, pantyhose and tights, women's full-length or knee-length stockings, measuring per single yarn ＜ 67 decitex, and hosiery for babies)",250762307
202412,611596,"Full-length or knee-length stockings, socks and other hosiery, incl. footwear without applied soles, of synthetic fibres, knitted or crocheted (excluding graduated compression hosiery, pantyhose and tights, women's full-length or knee-length stockings, measuring per single yarn ＜ 67 decitex, and hosiery for babies)",246842979
202412,611599,"Full-length or knee-length stockings, socks and other hosiery, incl. footwear without applied soles, of textile materials, knitted or crocheted (excluding of wool, fine animal hair, cotton or synthetic fibres, graduated compression hosiery, pantyhose and tights, women's full-length or knee-length stockings, measuring per single yarn ＜ 67 decitex, and hosiery for babies)",7739939
202412,611610,"Impregnated, coated, covered or laminated with plastics or rubber",195145250
202412,611691,"Gloves, mittens and mitts, of wool or fine animal hair, knitted or crocheted (excluding for babies)",2042404
202412,611692,"Gloves, mittens and mitts, of cotton, knitted or crocheted (excluding impregnated, coated or covered with plastics or rubber, and for babies)",30197697
202412,611693,"Gloves, mittens and mitts, of synthetic fibres, knitted or crocheted (excluding impregnated, coated or covered with plastics or rubber, and for babies)",54935986
202412,611699,"Gloves, mittens and mitts, of textile materials, knitted or crocheted (excluding of wool, fine animal hair, cotton or synthetic fibres, impregnated, coated or covered with plastics or rubber, and for babies)",4902496
202412,611710,"Shawls, scarves, mufflers, mantillas, veils and the like, knitted or crocheted",94025173
202412,611780,"Ties, bow ties, cravats and other made-up clothing accessories, knitted or crocheted, n.e.s. (excluding shawls, scarves, mufflers, mantillas, veils and the like)",62119631
202412,611790,"Parts of garments or clothing accessories, knitted or crocheted, n.e.s.",22347621
202412,620120,"Men’s or boys’ overcoats, car-coats, capes, cloaks, anoraks (including ski-jackets), wind-cheaters, windjackets and similar artic，of wool or fine animal hair",3718397
202412,620130,"Men’s or boys’ overcoats, car-coats, capes, cloaks, anoraks (including ski-jackets), wind-cheaters, windjackets and similar artic，of cotton",25483623
202412,620140,"Men’s or boys’ overcoats, car-coats, capes, cloaks, anoraks (including ski-jackets), wind-cheaters, windjackets and similar artic，of man-made fibres",262003177
202412,620190,"Men's or boys' overcoats, raincoats, car coats, capes, cloaks and similar articles, of other textile materials",3716352
202412,620220,"Women’s or girls’ overcoats, car-coats, capes, cloaks, anoraks (including ski-jackets), wind-cheaters, wind jackets and similar articles, of wool or fine animal hair",17962517
