Date of data,Commodity code,Commodity,Renminbi Yuan
202305,380590,"Crude dipentene; sulphite turpentine and other crude para-cymene; terpenic oils produced by the distillation or other treatment of coniferous woods (excluding gum turpentine, wood turpentine and sulphate turpentine)",7327848.0
202305,380610,Rosin and resin acids,16848259.0
202305,380620,"Salts of rosin, of resin acids or of derivatives of rosin or resin acids, other than salts of rosin adducts",2011449.0
202305,380630,Ester gums,16955109.0
202305,380690,"Derivatives of rosin, incl. salts of rosin adducts, and of resin acids, light and heavy resin oils and modified natural resins obtained by heat treatment run gums"" (excluding salts of rosin, of resin acids or salts of derivatives of rosin or resin acids, and ester gums)""",64058686.0
202305,380700,"Wood tar; wood tar oils; wood creosote; wood naphtha; vegetable pitch; brewers' pitch and similar preparations based on rosin, resin acids or on vegetable pitch.",2205979.0
202305,380859,Other goods specified in Subheading Note 1 of Chapter 38,800249.0
202305,380862,"Articles under subheading note 2 of this chapter, in packings of a net weight content exceeding 300 g but not exceeding 7.5 kg",7748447.0
202305,380869,"Articles under subheading note 2 of this chapter, in packings of a net weight content exceeding7.5 kg",18085874.0
202305,380891,Insecticides,1059534149.0
202305,380892,Fungicides,439297348.0
202305,380893,"Herbicides, antisprouting products and plantgrowth regulators",2440780183.0
202305,380894,Disinfectants,169452981.0
202305,380899,"Articles under heading 38.08,nes",15995176.0
202305,380910,"Finishing agents and the like,used in textile, paper,lether and the similar industries,with a basis of amylaceous substances",7931908.0
202305,380991,"Other finishing agents and like, of a kind used in the textile or like industries",43320863.0
202305,380992,"Other finishing agents and like, of a kind used in the paper or like industries",32798274.0
202305,380993,"Other finishing agents and like, of a kind used in the leather or like industries",9630149.0
202305,381010,"Pickling preparations for metal surfaces; soldering, brazing or welding powders and pastes consisting of metal and other materials",74436721.0
202305,381090,"Fluxes and other auxiliary preparations for soldering, brazing or welding;preparations of a kind used as cores or coatings for welding electrodes or rods",30358521.0
202305,381111,"Anti-knock preparations,based on lead compounds",5646389.0
202305,381119,Anti-knock preparations for motor fuels (excluding those based on lead compounds),3637.0
202305,381121,"Additives for lubricating oils,containing petroleum oils or oils obtained from bituminous minerals",332016245.0
202305,381129,Other additives for lubricating oils,5478730.0
202305,381190,"Oxidation inhibitors, gum inhibitors, viscosity improvers, anti-corrosive preparations and other prepared additives for mineral oils, incl. gasoline, or for other liquids used for the same purposes as mineral oils (excluding anti-knock preparations and oil lubricant additives)",25911154.0
202305,381210,Prepared rubber accelerators,250006445.0
202305,381220,Compound plasticisers for rubber or plastics,45939635.0
202305,381231,"Mixtures of oligomers of 2,2,4trimethyl1,2dihydroquinoline (TMQ)",63644205.0
202305,381239,"Anti-oxidising preparations and other compound stabilisers for rubber or plastics (excl. mixtures of oligomers of 2,2,4-trimethyl-1,2-dihydroquinoline TMQ"")""",268655638.0
202305,381300,Preparations and charges for fireextinguishers; charged fireextinguishing grenades,27476344.0
202305,381400,"Organic composite solvents and thinners, not elsewhere specified or included; prepared paint or varnish removers.",19480572.0
202305,381511,Supported catalysts with nickel or nickel compounds as the active substance,8389618.0
202305,381512,Supported catalysts with precious metal or precious metal compounds as the active substance,596485194.0
202305,381519,"Supported catalysts, n.e.s. (excluding with precious metal, a precious-metal compound, nickel or a nickel compound as the active substance)",260267449.0
202305,381590,"Reaction initiators, reaction accelerators and catalytic preparations, n.e.s. (excluding rubber accelerators and supported catalysts)",137376092.0
202305,381600,"Refractory cements, mortars, concretes and similar compositions, other than products of heading 38.01",286461758.0
202305,381700,"Mixed alkylbenzenes and mixed alkylnaphthalenes, other than those of heading 27.07 or 29.02.",131596543.0
202305,381800,"Chemical elements doped for use in electronics, in the form of discs, wafers or similar forms; chemical compounds doped for use in electronics. form of",4110703237.0
202305,381900,"Hydraulic brake fluids and other prepared liquids for hydraulictransmission, not containing or containing less than 70% byweight of petroleum oils or oils obtained from bituminousminerals.",15573796.0
202305,382000,Antifreezing preparations and prepared deicing fluids.,14773347.0
202305,382100,"Prepared culture media for the development or maintenance of microorganisms (including viruses and the like) or of plant, human or animal cells.",10448996.0
202305,382211,"Diagnostic or laboratory reagents on a backing, prepared diagnostic or laboratory reagents, for malaria",1828358.0
202305,382212,"Diagnostic or laboratory reagents on a backing, prepared diagnostic or laboratory reagents whether or not on a backing, for Zika and other diseases transmitted by mosquitoes of the genus Aedes",146508.0
202305,382213,"Diagnostic or laboratory reagents on a backing, prepared diagnostic or laboratory reagents whether or not on a backing, for blood-grouping",79280.0
202305,382219,"Other diagnostic or laboratory reagents attached to backing and dispensing reagents, whether or not attached to backing",788191912.0
202305,382290,Certified reference sample,49241497.0
202305,382311,Stearic acid,16667032.0
202305,382312,Oleic acid,10283834.0
202305,382313,Tall oil fatty acids,572915.0
202305,382319,"Fatty acids, industrial, monocarboxylic; acid oils from refining (excluding stearic acid, oleic acid and tall oil fatty acids)",8248933.0
202305,382370,Industrial fatty alcohols,5130285.0
202305,382410,Prepared binders for foundry moulds or cores,19772479.0
202305,382430,Nonagglomerated metal carbides mixed together or with metallic binders,73229653.0
202305,382440,"Prepared additives for cements, mortars or concretes",168698031.0
202305,382450,Nonrefractory mortars and concretes,32941072.0
202305,382460,Sorbitol other than that of subheading 2905.44,10712769.0
202305,382481,"Goods specified in subheading note 3 to chapter 38, containing oxirane (ethylene oxide)",127998.0
202305,382487,"Goods specified in subheading note 3 to chapter 38, containing perfluorooctane sulphonic acid, its salts, perfluorooctane sulphonamides, or perfluorooctane sulphonyl fluoride",81.0
202305,382489,Mixtures and preparations containing short-chain chlorinated paraffins,278174.0
202305,382491,"Mixtures and preparations consisting mainly of (5ethyl2methyl2oxido1,3,2dioxaphosphinan5yl)methyl methyl methylphosphonate and bis[(5ethyl2methyl2oxido1,3,2dioxaphosphinan5yl)methyl] methylphosphonate",4582339.0
202305,382492,Polyglycol esters of methylphosphonic acid,91879.0
202305,382499,"Chemical products and preparations of the chemical or allied industries, incl. those consisting of mixtures of natural products, n.e.s.",3234000560.0
202305,382530,Clinical waste,18310.0
202305,382561,Mainly containing organic constituents,440.0
202305,382569,"Wastes from chemical or allied industries (excluding wastes of metal pickling liquors, of hydraulic fluids, brake fluids and anti-freeze fluids and those mainly containing organic constituents)",177087.0
202305,382590,"Residual products of the chemical or allied industries, nes (excluding waste)",8761199.0
202305,382600,"Biodiesel and mixtures thereof, not containing or containing less than 70% by weight of petroleum oils or oils obtained from bituminous minerals.",1582811034.0
202305,382732,"Other mixtures, containing substances of subheadings 2903.71 to 2903.75",244339.0
202305,382761,"Mixtures containing 15 % or more by mass of 1,1,1-trifluoroethane (HFC-143a)",84938763.0
202305,382762,"Other mixtures, not included in the subheading above, containing 55 % or more by mass of pentafluoroethane (HFC- 125) but not containing unsaturated fluorinated derivatives of acyclic hydrocarbons (HFOs)",5083069.0
202305,382763,"Other mixtures, not included in the subheadings above, containing 40 % or more by mass of pentafluoroethane (HFC-125)",183216869.0
202305,382764,"Other mixtures, not included in the subheadings above, containing 30 % or more by mass of 1,1,1,2-tetrafluoroethane (HFC-134a) but not containing unsaturated fluorinated derivatives of acyclic hydrocarbons (HFOs)",19722792.0
202305,382765,"Other mixtures, not included in the subheadings above, containing 20 % or more by mass of difluoromethane (HFC-32) and 20 % or more by mass of pentafluoroethane (HFC-125)",1689913.0
202305,382768,"Other mixtures, not included in the subheadings above, containing substances of subheadings 2903.41 to 2903.48",5515968.0
202305,382790,"Mixtures containing halogenated derivatives of methane, ethane or propane ,nes",8660.0
202305,390110,Polyethylene having a specific gravity of less than 0.94,245932187.0
202305,390120,Polyethylene having a specific gravity of 0.94 or more,390541179.0
202305,390130,Ethylenevinyl acetate copolymers,302293604.0
202305,390140,"Ethylenealphaolefin copolymers, having a specific gravity of less than 0.94",120059730.0
202305,390190,"Polymers of ethylene, in primary forms (excluding polyethylene and ethylene-vinyl acetate copolymers)",502880450.0
202305,390210,Polypropylene,873465097.0
202305,390220,Polyisobutylene,14120566.0
202305,390230,Propylene copolymers,126002377.0
202305,390290,"Polymers of propylene or of other olefins, in primary forms (excluding polypropylene, polyisobutylene and propylene copolymers)",38670594.0
202305,390311,"Expansible polystyrene, in primary forms",253480413.0
202305,390319,"Polystyrene, in primary forms (excluding expansible)",143569328.0
202305,390320,Styreneacrylonitrile (SAN) copolymers,29463691.0
202305,390330,Acrylonitrilebutadienestyrene (ABS) copolymers,133483344.0
202305,390390,"Polymers of styrene, in primary forms (excluding polystyrene, styrene-acrylonitrile copolymers SAN"" and acrylonitrile-butadiene-styrene ""ABS"")""",55149708.0
202305,390410,"Poly(vinyl chloride), not mixed with any other substances",881300017.0
202305,390421,Nonplasticised,64597956.0
202305,390422,Plasticised,214433194.0
202305,390430,Vinyl chloridevinyl acetate copolymers,15304305.0
202305,390440,Other vinyl chloride copolymers,10444375.0
202305,390450,Vinylidene chloride polymers,7972687.0
202305,390461,Polytetrafluoroethylene,156861256.0
202305,390469,"Fluoropolymers of vinyl chloride or of other halogenated olefins, in primary forms (excluding polytetrafluoroethylene)",329302382.0
202305,390490,"Polymers of vinyl chloride or other halogenated olefins, in primary forms (excluding polyvinyl chloride"", copolymers of vinyl chloride, polymers of vinyl chloride and fluoropolymers)""",2084051.0
202305,390512,"Polyvinyl acetate"", in aqueous dispersion""",5515046.0
202305,390519,"Polyvinyl acetate"", in primary forms (excluding in aqueous dispersion)""",3165094.0
202305,390521,"Vinyl acetate copolymers, in aqueous dispersion",11388070.0
202305,390529,"Vinyl acetate copolymers, in primary forms (excluding in aqueous dispersion)",35942444.0
202305,390530,"Poly(vinyl alcohol), whether or not containing unhydrolysed acetate groups",232783981.0
202305,390591,Copolymers,12249327.0
202305,390599,"Polymers of vinyl esters and other vinyl polymers, in primary forms (excluding those of vinyl chloride or other halogenated olefins, polyvinyl acetate"", vinyl acetate copolymers and poly""vinyl alcohol"", whether or not containing unhydrolised acetate groups)""",164813029.0
202305,390610,"Polymethyl methacrylate"", in primary forms""",34050259.0
202305,390690,"Acrylic polymers, in primary forms (excluding polymethyl methacrylate"")""",1042510913.0
202305,390710,Polyacetals,55377306.0
202305,390721,"Bis(polyoxyethylene) methylphosphonate, in primary forms",7391355.0
202305,390729,"Other polyethers, in primary forms",1695081939.0
202305,390730,Epoxide resins,254651832.0
202305,390740,Polycarbonates,486599386.0
202305,390750,Alkyd resins,11946721.0
202305,390761,"Polyethylene terephthalate"", in primary forms, having a viscosity number of 78 ml/g or higher""",2286557030.0
202305,390769,"Polyethylene terephthalate"", in primary forms, having a viscosity number of ＜ 78 ml/g""",513024479.0
202305,390770,Poly(lactic acid) in primary forms,6337443.0
202305,390791,Unsaturated polyesters in primary forms,139179405.0
202305,390799,"Saturated polyesters in primary forms (excluding polycarbonates, alkyd resins, polyethylene terephthalate"" and poly""lactic acid"")""",688583902.0
202305,390810,"Polyamide6, 11, 12, 6,6, 6,9, 6,10 or 6,12 ,in primary forms",822660837.0
202305,390890,"Polyamides, in primary forms (excluding polyamides-6, -11, -12, -6,6, -6,9, -6,10 and -6,12)",197670324.0
202305,390910,"Urea resins and thiourea resins, in primary forms",34477110.0
202305,390920,Melamine resins,47104346.0
202305,390931,"Poly(methylene phenyl isocyanate) (crude MDI, polymeric MDI) ,in primary forms",1249703549.0
202305,390939,"Amino-resins, in primary forms (excl. urea, thiourea and melamine resins and MDI)",1979597.0
202305,390940,"Phenolic resins,in primary forms",124034016.0
202305,390950,"Polyurethanes,in primary forms",538788330.0
202305,391000,Silicones in primary forms,727378014.0
202305,391110,"Petroleum resins, coumarone, indene or coumaroneindene resins and polyterpenes",352746496.0
202305,391190,"Polysulphides, polysulphones and other polymers and prepolymers produced by chemical synthesis, nes, in primary forms",381060923.0
202305,391211,"Nonplasticised cellulose acetates,in primary forms",31241691.0
202305,391212,"Plasticised cellulose acetates,in primary forms",269472.0
202305,391220,"Cellulose nitrates (including collodions), in primary forms",51544943.0
202305,391231,"Carboxymethylcellulose and its salts,in primary forms",148755618.0
202305,391239,"Cellulose ethers, in primary forms (excluding carboxymethylcellulose and its salts)",275847459.0
202305,391290,"Cellulose and chemical derivatives thereof, n.e.s., in primary forms (excluding cellulose acetates, cellulose nitrates and cellulose ethers)",102078500.0
202305,391310,"Alginic acid, its salts and esters,in primary forms",441537.0
202305,391390,"Natural polymers and modified natural polymers, e.g. hardened proteins, chemical derivatives of natural rubber, n.e.s., in primary forms (excluding alginic acid and its salts and esters)",760891087.0
202305,391400,"Ionexchangers based on polymers of headings 39.01 to 39.13, in primary forms",230860736.0
202305,391510,"Waste, parings and scrap, of polymers of ethylene",6892000.0
202305,391520,"Waste, parings and scrap, of polymers of styrene",139118.0
202305,391530,"Waste, parings and scrap, of polymers of vinyl chloride",2121303.0
202305,391590,"Waste, parings and scrap, of other plastics",33258626.0
202305,391610,Monofilament of polymers of ethylene,41279033.0
202305,391620,Monofilament of polymers of vinyl chloride,190008430.0
202305,391690,Monofilament of other plastics,347734533.0
202305,391710,Artificial guts (sausage casings) of hardened protein or of cellulosic materials,103696177.0
202305,391721,"Rigid tubes, pipes and hoses, of polymers of ethylene",209094283.0
202305,391722,"Rigid tubes, pipes and hoses, of polymers of propylene",72000639.0
202305,391723,"Rigid tubes, pipes and hoses, of polymers of vinyl chloride",172857368.0
202305,391729,"Rigid tubes, pipes and hoses, of other plastics",178083345.0
202305,391731,"Flexible tubes, pipes and hoses, having a minimum burst pressure of 27.6 Mpa",185338953.0
202305,391732,"Other plastic tubes, not reinforced or otherwise combined with other materials,without fittings",244278938.0
202305,391733,"Other plastic tubes, not reinforced or otherwise combined with other materials,with fittings",112911055.0
202305,391739,"Flexible tubes, pipes and hoses, of plastics, reinforced or otherwise combined with other materials (excluding those with a burst pressure of ≥ 27,6 MPa)",741344444.0
202305,391740,"Fittings for tubes, of plastic",575216400.0
202305,391810,"Wall or floor coverings, of polymers of vinyl chloride",3294741670.0
202305,391890,"Wall or floor coverings, of other plastics",943211859.0
202305,391910,"Self-adhesive plates, sheets, film, foil, tape, strip and other flat shapes, of plastics, in rolls ≤ 20 cm wide",1060025579.0
202305,391990,"Self-adhesive plates, sheets, film, foil, tape, strip and other flat shapes, of plastics, whether or not in rolls ＞ 20 cm wide (excluding floor, wall and ceiling coverings of heading 3918)",2382281843.0
202305,392010,"Plates, sheets, film, foil and strip, of non-cellular polymers of ethylene, not reinforced, laminated, supported or similarly combined with other materials, without backing, unworked or merely surface-worked or merely cut into squares or rectangles (excluding self-adhesive products, and floor, wall and ceiling coverings of heading 3918)",2069875477.0
202305,392020,"Plates, sheets, film, foil and strip, of non-cellular polymers of ethylene, not reinforced, laminated, supported or similarly combined with other materials, without backing, unworked or merely surface-worked or merely cut into squares or rectangles (excluding self-adhesive products, and floor, wall and ceiling coverings of heading 3918)",683673795.0
202305,392030,"Plates, sheets, foil, film and strip, of non-cellular polymers of styrene, not reinforced, laminated, supported or similarly combined with other materials, without backing, unworked or merely surface-worked or merely cut into squares or rectangles (excluding self-adhesive products, and floor, wall and ceiling coverings of heading 3918)",115760342.0
202305,392043,"Plates, sheets, film, foil and strip, of non-cellular polymers of vinyl chloride, containing by weight ≥ 6% of plasticisers, not reinforced, laminated, supported or similarly combined with other materials, without backing, unworked or merely surface-worked or merely cut into squares or rectangles (excluding self-adhesive products, and floor, wall and ceiling coverings of heading 3918)",506523780.0
202305,392049,"Plates, sheets, film, foil and strip, of non-cellular polymers of vinyl chloride, containing by weight ＜ 6% of plasticisers, not reinforced, laminated, supported or similarly combined with other materials, without backing, unworked or merely surface-worked or merely cut into squares or rectangles (excluding self-adhesive products, and floor, wall and ceiling coverings of heading 3918)",670360505.0
202305,392051,"Plates, sheets, film, foil and strip, of non-cellular polymethyl methacrylate"", not reinforced, laminated, supported or similarly combined with other materials, without backing, unworked or merely surface-worked or merely cut into squares or rectangles (excluding self-adhesive products, and floor, wall and ceiling coverings of heading 3918)""",262384830.0
202305,392059,"Plates, sheets, film, foil and strip, of non-cellular acrylic polymers, not reinforced, laminated, supported or similarly combined with other materials, without backing, unworked or merely surface-worked or merely cut into squares or rectangles (excluding those of polymethyl methacrylate"", self-adhesive products, and floor, wall and ceiling coverings of heading 3918)""",12049267.0
202305,392061,"Plates, sheets, film, foil and strip, of non-cellular polycarbonates, not reinforced, laminated, supported or similarly combined with other materials, without backing, unworked or merely surface-worked or merely cut into squares or rectangles (excluding those of polymethyl methacrylate"", self-adhesive products, and floor, wall and ceiling coverings of heading 3918)""",152847585.0
202305,392062,"Plates, sheets, film, foil and strip, of non-cellular polyethylene terephthalate"", not reinforced, laminated, supported or similarly combined with other materials, without backing, unworked or merely surface-worked or merely cut into squares or rectangles (excluding those of poly""methyl methacrylate"", self-adhesive products, and floor, wall and ceiling coverings of heading 3918)""",912899632.0
202305,392063,"Plates, sheets, film, foil and strip, of non-cellular unsaturated polyesters, not reinforced, laminated, supported or similarly combined with other materials, without backing, unworked or merely surface-worked or merely cut into squares or rectangles (excluding those of polymethyl methacrylate"", self-adhesive products, and floor, wall and ceiling coverings of heading 3918)""",69107895.0
202305,392069,"Plates, sheets, film, foil and strip, of non-cellular polyesters, not reinforced, laminated, supported or similarly combined with other materials, not worked or only surface-worked, or only cut to rectangular, incl. square, shapes (excluding polycarbonates, polythylene terephthalate and other unsaturated polyesters, self-adhesive products, and floor, wall and ceiling coverings in heading 3918)",212857036.0
202305,392071,"Plates, sheets, film, foil and strip, of non-cellular regenerated cellulose, not reinforced, laminated, supported or similarly combined with other materials, without backing, unworked or merely surface-worked or merely cut into squares or rectangles (excluding self-adhesive products, and floor, wall and ceiling coverings of heading 3918)",30224659.0
202305,392073,"Plates, sheets, film, foil and strip, of non-cellular cellulose acetates, not reinforced, laminated, supported or similarly combined with other materials, without backing, unworked or merely surface-worked or merely cut into squares or rectangles (excluding self-adhesive products, and floor, wall and ceiling coverings of heading 3918)",46179974.0
202305,392079,"Plates, sheets, film, foil and strip, of non-cellular cellulose derivatives, not reinforced, laminated, supported or similarly combined with other materials, without backing, unworked or merely surface-worked or merely cut into squares or rectangles (excluding products of cellulose acetates, self-adhesive products, floor, wall and ceiling coverings of heading 3918)",7561126.0
202305,392091,"Plates, sheets, film, foil and strip, of non-cellular polyvinyl butyral"", not reinforced, laminated, supported or similarly combined with other materials, without backing, unworked or merely surface-worked or merely cut into squares or rectangles (excluding self-adhesive products, floor, wall and ceiling coverings of heading 3918)""",130870557.0
202305,392092,"Plates, sheets, film, foil and strip, of non-cellular polyamides, not reinforced, laminated, supported or similarly combined with other materials, without backing, unworked or merely surface-worked or merely cut into squares or rectangles (excluding self-adhesive products, floor, wall and ceiling coverings of heading 3918)",116239520.0
202305,392093,"Plates, sheets, film, foil and strip, of non-cellular amino-resins, not reinforced, laminated, supported or similarly combined with other materials, without backing, unworked or merely surface-worked or merely cut into squares or rectangles (excluding self-adhesive products, floor, wall and ceiling coverings of heading 3918)",8354801.0
202305,392094,"Plates, sheets, film, foil and strip, of non-cellular phenolic resins, not reinforced, laminated, supported or similarly combined with other materials, without backing, unworked or merely surface-worked or merely cut into squares or rectangles (excluding self-adhesive products, floor, wall and ceiling coverings of heading 3918)",63732493.0
202305,392099,"Plates, sheets, film, foil and strip, of non-cellular plastics, n.e.s., not reinforced, laminated, supported or similarly combined with other materials, without backing, unworked or merely surface-worked or merely cut into squares or rectangles (excluding self-adhesive products, floor, wall and ceiling coverings of heading 3918 and sterile surgical or dental adhesion barriers of subheading 3006.10.30)",520706029.0
202305,392111,"Plates, sheets, film, foil and strip, of polymers of styrene",50395977.0
202305,392112,"Plates, sheets, film, foil and strip, of polymers of vinyl chloride",457471246.0
202305,392113,"Plates, sheets, film, foil and strip, of polyurethanes",331535346.0
202305,392114,"Plates, sheets, film, foil and strip, of regenerated cellulose",8189505.0
202305,392119,"Plates, sheets, film, foil and strip, of other plastics",311317692.0
202305,392190,"Plates, sheets, film, foil and strip, (excluding of cellular plastic; self-adhesive products, floor, wall and ceiling coverings of heading 3918)",881354778.0
202305,392210,"Baths, showerbaths, sinks and washbasins,of plastics",405035951.0
202305,392220,Lavatory seats and covers,239062263.0
202305,392290,"Bidets, lavatory pans, flushing cisterns and similar sanitary ware, of plastics (excluding baths, shower-baths, sinks, washbasins, lavatory seats and covers)",263951163.0
202305,392310,"Boxes, cases, crates and similar articles",1174162844.0
202305,392321,"Sacks and bags, incl. cones, of polymers of ethylene",1855389396.0
202305,392329,"Sacks and bags, incl. cones, of other plastics",1327538546.0
202305,392330,"Carboys, bottles, flasks and similar articles, of plastics",1285786654.0
202305,392340,"Spools, cops, bobbins and similar supports, of plastics",113344302.0
202305,392350,"Stoppers, lids, caps and other closures, of plastics",1098761227.0
