Date of data,Commodity code,Commodity,Renminbi Yuan
202207,831190,"Wire, rods, tubes, plates, electrodes and the like, of base metal or of metal carbides, coated or cored with flux material, for soldering, brazing, welding or deposition of metal or metal carbides, n.e.s., and wire and rods of agglomerated base metal powder, for metal spraying, n.e.s.",36409809.0
202207,840212,Watertube boilers with a steam production not exceeding 45 t per hour,74284865.0
202207,840219,"Other vapour generating boilers, including hybrid boilers",94040174.0
202207,840220,Superheated water boilers,461371.0
202207,840290,"Parts of vapour generating boilers and superheated water boilers, n.e.s.",500442595.0
202207,840310,"Central heating boilers, non-electric (excluding vapour generating boilers and superheated water boilers of heading 8402)",95604847.0
202207,840390,"Parts of central heating boilers, n.e.s.",118634403.0
202207,840410,Auxiliary plant for use with boilers of heading 84.02 or 84.03,181900772.0
202207,840420,Condensers for steam or other vapour power units,26595183.0
202207,840490,"Parts of auxiliary plant of heading 8402 or 8403 and condensers for steam or other vapour power units, n.e.s.",55483419.0
202207,840510,"Producer gas or water gas generators, with or without their purifiers; acetylene gas generators and similar water process gas generators, with or without their purifiers",22841949.0
202207,840590,"Parts of producer gas or water gas generators and acetylene gas generators or similar water process gas generators, n.e.s.",4216976.0
202207,840682,"Turbines, of an output not exceeding 40 MW",23502970.0
202207,840690,"Parts of steam and other vapour turbines, n.e.s.",111963711.0
202207,840710,"Spark-ignition reciprocating or rotary internal combustion piston engine, for aircraft",151425.0
202207,840721,Spark-ignition outboard motors for marine propulsion,202503554.0
202207,840729,"Spark-ignition reciprocating or rotary engines, for marine propulsion (excluding outboard motors)",119517.0
202207,840731,"Spark-ignition reciprocating piston engine, of a kind used for the propulsion of vehicles of chapter 87, of a cylinder capacity ≤ 50 ml",43066792.0
202207,840732,"Spark-ignition reciprocating piston engine, of a kind used for the propulsion of vehicles of chapter 87, Of a cylinder capacity exceeding 50 cc but not exceeding 250 cc",265234658.0
202207,840733,"Spark-ignition reciprocating piston engine, of a kind used for the propulsion of vehicles of chapter 87, Of a cylinder capacity exceeding 250 cc but not exceeding 1,000 cc",83999067.0
202207,840734,"Spark-ignition reciprocating piston engine, of a kind used for the propulsion of vehicles of chapter 87, Of a cylinder capacity exceeding 1,000 cc",677333330.0
202207,840790,Other engines,699940298.0
202207,840810,Marine propulsion engines,81301986.0
202207,840820,Engines of a kind used for the propulsion of vehicles of Chapter 87,409352774.0
202207,840890,Other engines,834889318.0
202207,840910,"Parts suitable for use solely or principally with internal combustion piston engine for aircraft, n.e.s.",56707.0
202207,840991,"Parts suitable for use solely or principally with spark-ignition internal combustion piston engine, n.e.s.",3092458384.0
202207,840999,"Parts suitable for use solely or principally with compression-ignition internal combustion piston engine diesel or semi-diesel engine"", n.e.s.""",2309232138.0
202207,841011,"Hydraulic turbines and water wheels, off a power not exceeding 1,000 kW",1759680.0
202207,841012,"Hydraulic turbines and water wheels, off a power exceeding 1,000 kW but not exceeding 10,000 kW",5191486.0
202207,841013,"Hydraulic turbines and water wheels, off a power exceeding 10,000 kW",2124.0
202207,841090,Parts of hydraulic turbines and water wheels incl. regulators,139440062.0
202207,841111,Turbojets of a thrust not exceeding 25 kN,638543.0
202207,841112,Turbojets of a thrust exceeding 25 kN,349804187.0
202207,841181,"Gas turbines of a power not exceeding 5,000 kW",7944697.0
202207,841182,"Gas turbines of a power exceeding 5,000 kW",13948939.0
202207,841191,"Parts of turbojets or turbopropellers, n.e.s.",1176018930.0
202207,841199,"Parts of gas turbines, n.e.s.",274337232.0
202207,841221,"Hydraulic power engines and motors, linear acting (cylinders)",723428473.0
202207,841229,"Hydraulic power engines and motors (excluding hydraulic turbines and water wheels of heading 8410, steam turbines and hydraulic power engines and motors, linear acting)",363436891.0
202207,841231,"Pneumatic power engines and motors, linear acting (cylinders)",251516299.0
202207,841239,Pneumatic power engines and motors (excluding linear acting),122792683.0
202207,841280,"Engines and motors (excluding steam turbines, internal combustion piston engine, hydraulic turbines, water wheels, gas turbines, reaction engines, hydraulic power engines and motors, pneumatic power engines and motors and electric motors)",27949200.0
202207,841290,"Parts of non-electrical engines and motors, n.e.s.",1138113534.0
202207,841311,"Pumps for dispensing fuel or lubricants, of the type used in fillingstations or in garages",60277542.0
202207,841319,"Pumps for liquids, fitted or designed to be fitted with a measuring device (excluding pumps for dispensing fuel or lubricants, of the type used in filling stations or in garages)",84143848.0
202207,841320,"Hand pumps, other than those of subheading 8413.11 or 8413.19",329527064.0
202207,841330,"Fuel, lubricating or cooling medium pumps for internal combustion piston engines",897872327.0
202207,841340,Concrete pumps,37594383.0
202207,841350,Other reciprocating positive displacement pumps,563756993.0
202207,841360,Other rotary positive displacement pumps,872511784.0
202207,841370,Other centrifugal pumps,2588695379.0
202207,841381,"Pumps for liquids, power-driven (excluding those of subheading 8413.11 and 8413.19, fuel, lubricating or cooling medium pumps for internal combustion piston engine, concrete pumps, general reciprocating or rotary positive displacement pumps and centrifugal pumps of all kinds)",65294023.0
202207,841382,Liquid elevators,349377.0
202207,841391,"Parts of pumps for liquids, n.e.s.",1800074910.0
202207,841392,"Parts of liquid elevators, n.e.s.",9803707.0
202207,841410,Vacuum pumps,276586177.0
202207,841420,Hand or footoperated air pumps,196379374.0
202207,841430,Compressors of a kind used in refrigerating equipment,3249055710.0
202207,841440,Air compressors mounted on a wheeled chassis for towing,94312784.0
202207,841451,"Table, floor, wall, window, ceiling or roof fans, with a selfcontained electric motor of an output not exceeding 125 W",2966154801.0
202207,841459,"Fans (excluding table, floor, wall, window, ceiling or roof fans, with a self-contained electric motor of an output ≤ 125 W)",2240251058.0
202207,841460,Hoods having a maximum horizontal side not exceeding 120 cm,488046825.0
202207,841470,Gas-tight biological safety cabinets,2319779.0
202207,841480,"Air pumps, air or other gas compressors and ventilating or recycling hoods incorporating a fan, whether or not fitted with filters, having a maximum horizontal side ＞ 120 cm (excluding vacuum pumps, hand- or foot-operated air pumps, compressors for refrigerating equipment and air compressors mounted on a wheeled chassis for towing)",2595905806.0
202207,841490,"Parts of: air or vacuum pumps, air or other gas compressors, fans and ventilating or recycling hoods incorporating a fan, n.e.s.",2558199081.0
202207,841510,"Air conditioning machines of a kind designed to be fixed to a window, wall, ceiling or floor, selfcontained or .splitsystem.",6643194413.0
202207,841520,"Air conditioning machines of a kind used for persons, in motor vehicles",179147524.0
202207,841581,Air conditioning machines incorporating a refrigerating unit and a valve for reversal of the cooling/heat cycle (reversible heat pumps),365111919.0
202207,841582,"Other, air conditioning machines incorporating a refrigerating unit",369130604.0
202207,841583,"Air conditioning machines,not incorporating a refrigerating unit",102127282.0
202207,841590,"Parts of air conditioning machines, comprising a motor-driven fan and elements for changing the temperature and humidity, n.e.s.",5765561853.0
202207,841610,Furnace burners for liquid fuel,21937915.0
202207,841620,"Other furnace burners, including combination burners",52766336.0
202207,841630,"Mechanical stokers, including their mechanical grates, mechanical ash dischargers and similar appliances",16439178.0
202207,841690,"Parts of furnace burners such as mechanical stokers, incl. their mechanical grates, mechanical ash dischargers and similar appliances, n.e.s.",64008660.0
202207,841710,"Furnaces and ovens for the roasting, melting or other heattreatment of ores, pyrites or of metals",179665613.0
202207,841720,"Bakery ovens, including biscuit ovens",68480671.0
202207,841780,"Industrial or laboratory furnaces and ovens, non-electric, incl. incinerators (excluding those for the roasting, melting or other heat treatment of ores, pyrites or metals, bakery ovens, drying ovens and ovens for cracking operations)",344266935.0
202207,841790,"Parts of industrial or laboratory furnaces, non-electric, incl. incinerators, n.e.s.",347254761.0
202207,841810,"Combined refrigeratorfreezers, fitted with separate external doors or draws, or combinations thereof",2455077516.0
202207,841821,"Household refrigerators, compression-type",927961206.0
202207,841829,"Household refrigerators, absorption-type",147112627.0
202207,841830,"Freezers of the chest type, of a capacity ≤ 800L",763433495.0
202207,841840,"Freezers of the upright type, of a capacity ≤ 900L",293206923.0
202207,841850,"Furniture (chests, cabinets, display counters, show-cases and the like) for storage and display, incorporating refrigerating or freezing equipment (excluding combined refrigerator-freezers with separate external doors, household refrigerators and freezers of the chest type of a capacity ≤ 800L or of the upright type of a capacity ≤ 900L)",1138492528.0
202207,841861,Heat pumps other than air conditioning machines of heading 84.15,784069486.0
202207,841869,Refrigerating or freezing equipment (excluding refrigerating and freezing furniture),1557804063.0
202207,841891,Furniture designed to receive refrigerating or freezing equipment,17585715.0
202207,841899,"Parts of refrigerating or freezing equipment and heat pumps, n.e.s.",1137445837.0
202207,841911,Instantaneous gas water heaters,303232892.0
202207,841912,Solar water heaters,100181198.0
202207,841919,"Instantaneous or storage water heaters, non-electric (excluding instantaneous gas water heaters and boilers or water heaters for central heating)",25397640.0
202207,841920,"Medical, surgical or laboratory sterilisers",82176651.0
202207,841933,"Lyophilisation apparatus, freeze drying units and spray dryers",85146105.0
202207,841934,Dryers for agricultural products,26668351.0
202207,841935,"Dryers for wood, paper pulp, paper or paperboard",83843281.0
202207,841939,"Dryers (excluding dryers for agricultural products, for wood, paper pulp, paper or paperboard, for yarns, fabrics and other textile products, dryers for bottles or other containers, hairdryers, hand dryers and domestic appliances)",424968165.0
202207,841940,Distilling or rectifying plant,168088522.0
202207,841950,Heat exchange units,1222757082.0
202207,841960,Machinery for liquefying air or other gases,263580524.0
202207,841981,"Machinery, plant and equipment for making hot drinks or for cooking or heating food (excluding domestic appliances)",404376264.0
202207,841989,"Machinery, plant or laboratory equipment, whether or not electrically heated, for the treatment of materials by a process involving a change of temperature such as heating, cooking, roasting, sterilising, pasteurising, steaming, evaporating, vaporising, condensing or cooling, n.e.s. (excluding machinery used for domestic purposes and furnaces, ovens and other equipment of heading 8514)",962445466.0
202207,841990,"Parts of machinery, plant and laboratory equipment, whether or not electrically heated, for the treatment of materials by a process involving a change of temperature, and of non-electric instantaneous and storage water heaters, n.e.s.",902747473.0
202207,842010,Calendering or other rolling machines,105720145.0
202207,842091,Cylinders,12881795.0
202207,842099,"Parts for calendering or rolling machines, n.e.s. (other than for metals or glass and excluding cylinders)",14483046.0
202207,842111,Centrifugal cream separators,39543.0
202207,842112,Centrifugal clothes-dryers,13963762.0
202207,842119,"Centrifuges, incl. centrifugal dryers (excluding isotope separators, cream separators and clothes dryers)",182762936.0
202207,842121,Machinery and apparatus for filtering or purifying water,1210186673.0
202207,842122,Machinery and apparatus for filtering or purifying beverages (excludingwater),12812957.0
202207,842123,Oil or petrol-filters for internal combustion engines,816830955.0
202207,842129,"Machinery and apparatus for filtering or purifying liquids (excluding such machinery and apparatus for water and other beverages, oil or petrol-filters for internal combustion engines and artificial kidneys)",640006984.0
202207,842131,Intake air filters for internal combustion engines,439764071.0
202207,842132,"Catalytic converters or particulate filters, whether or not combined, for purifying or filtering exhaust gases from internal combustion engines",207596845.0
202207,842139,Machinery and apparatus for filtering or purifying gases (excluding isotope separators and intake air filters for internal combustion engines),1552707077.0
202207,842191,"Parts of centrifuges, incl. centrifugal dryers, n.e.s.",43282888.0
202207,842199,"Parts of machinery and apparatus for filtering or purifying liquids or gases, n.e.s.",2180004543.0
202207,842211,Dishwashing machines of the household type,581515639.0
202207,842219,Dishwashing machines (excluding those of the household type),23036510.0
202207,842220,Machinery for cleaning or drying bottles or other containers (excluding dishwashing machines),32677593.0
202207,842230,"Machinery for filling, closing, sealing or labelling bottles, cans, boxes, bags or other containers; machinery for capsuling bottles, jars, tubes and similar containers; machinery for aerating beverages",925390311.0
202207,842240,"Packing or wrapping machinery, incl. heat-shrink wrapping machinery (excluding machinery for filling, closing, sealing or labelling bottles, cans, boxes, bags or other containers and machinery for capsuling bottles, jars, tubes and similar containers)",400563716.0
202207,842290,"Parts of dishwashing machines, packing or wrapping machinery and other machinery and apparatus of heading 8422, n.e.s.",298707817.0
202207,842310,"Personal weighing machines, incl. baby scales; household scales",518913586.0
202207,842320,Scales for continuous weighing of goods on conveyors,13266002.0
202207,842330,"Constant weight scales and scales for discharging a pre-determined weight of material into a bag or container, incl. hopper scales (excluding scales for continuous weighing of goods on conveyors)",66242206.0
202207,842381,"Weighing machinery having a maximum weighing capacity ≤ 30 kg (excluding balances of a sensitivity of 5 cg or better, personal weighing machines, household scales, scales for continuous weighing of goods on conveyors, constant weight scales and scales for discharging a pre-determined weight of material into a bag or container, incl. hopper scales)",166511703.0
202207,842382,"Weighing machinery of a maximum weighing capacity ＞ 30 kg but ≤ 5.000 kg (excluding personal weighing machines, scales for continuous weighing of goods on conveyors, constant weight scales and scales for discharging a pre-determined weight of material into a bag or container, incl. hopper scales)",136781555.0
202207,842389,Weighing machinery of a maximum weighing capacity ＞ 5.000 kg,38828253.0
202207,842390,"Weighing machine weights of all kinds; parts of weighing machinery, n.e.s.",198927903.0
202207,842410,"Fire extinguishers, whether or not charged",261319973.0
202207,842420,Spray guns and similar appliances,471613599.0
202207,842430,Steam or sand blasting machines and similar jet projecting machines,324109841.0
202207,842441,"Agricultural or horticultural sprayers, portable",282585543.0
202207,842449,Agricultural or horticultural sprayers (excl. portable),49019946.0
202207,842482,"Agricultural or horticultural mechanical appliances, whether or not hand-operated, for projecting or dispersing liquids or powders (excl. sprayers)",79895037.0
202207,842489,"Mechanical appliances, whether or not hand-operated, for projecting, dispersing or spraying liquids or powders, n.e.s.",962753281.0
202207,842490,"Parts of fire extinguishers, spray guns and similar appliances, steam or sand blasting machines and similar jet projecting machines and machinery and apparatus for projecting, dispersing or spraying liquids or powders, n.e.s.",636434041.0
202207,842511,"Pulley tackle and hoists, powered by electric motor (other than skip hoists or hoists of a kind used for raising vehicles)",162010593.0
202207,842519,"Pulley tackle and hoists (other than skip hoists or hoists of a kind used for raising vehicles), non-powered by electric motor",153521106.0
202207,842531,Winches and capstans powered by electric motor,371092384.0
202207,842539,"Winches and capstans, non-powered by electric motor",82986468.0
202207,842541,Built-in jacking systems of a type used in garages,2333733.0
202207,842542,"Jacks and hoists, hydraulic (excluding built-in jacking systems used in garages)",900200569.0
202207,842549,"Jacks and hoists of a kind used for raising vehicles, not hydraulic",293125515.0
202207,842611,Overhead travelling cranes on fixed support,240339081.0
202207,842612,Mobile lifting frames on tyres and straddle carriers,3321612.0
202207,842619,"Overhead travelling cranes, transporter cranes, gantry cranes, bridge cranes and mobile lifting frames (excluding overhead travelling cranes on fixed support, mobile lifting frames on tyres, straddle carriers and portal or pedestal jib cranes)",821250543.0
202207,842620,Tower cranes,200593179.0
202207,842630,Portal or pedestal jib cranes,355349290.0
202207,842641,"Mobile cranes and works trucks fitted with a crane, self-propelled, on tyres (excluding wheel-mounted cranes, mobile lifting frames on tyres and straddle carriers)",243022755.0
202207,842649,"Mobile cranes and works trucks fitted with a crane, self-propelled (excluding those on tyres and straddle carriers)",390322808.0
202207,842691,Cranes designed for mounting on road vehicles,18530835.0
202207,842699,"Ships' derricks; cranes, incl. cable cranes (excluding overhead travelling cranes, transporter cranes, gantry cranes, portal or pedestal jib cranes, bridge cranes, mobile lifting frames and straddle carriers, tower cranes, works trucks fitted with a crane, mobile cranes and cranes designed for mounting on road vehicles)",24401235.0
202207,842710,Selfpropelled trucks powered by an electric motor,1934137500.0
202207,842720,Other selfpropelled trucks,2028270036.0
202207,842790,"Works trucks fitted with lifting or handling equipment, not self-propelled",368599931.0
202207,842810,Lifts and skip hoists,1322358332.0
202207,842820,Pneumatic elevators and conveyors,46498103.0
202207,842831,"Continuous-action elevators and conveyors, for goods or materials, specially designed for underground use",972257.0
202207,842832,"Continuous-action elevators and conveyors, for goods or materials, bucket type",92569239.0
202207,842833,"Continuous-action elevators and conveyors, for goods or materials, belt type",546759595.0
202207,842839,"Continuous-action elevators and conveyors, for goods or materials (excluding those for underground use and bucket, belt or pneumatic types)",639243268.0
202207,842840,Escalators and moving walkways,361699676.0
202207,842860,"Teleferics, chairlifts, skidraglines; traction mechanisms for funiculars",335491.0
202207,842870,Industrial robots,100787687.0
202207,842890,"Machinery for lifting, handling, loading or unloading, nes",1131574514.0
202207,842911,"Bulldozers and angledozers,track laying",472374503.0
202207,842919,"Bulldozers and angledozers, other",7855516.0
202207,842920,Graders and levellers,303606509.0
202207,842930,Scrapers,72829157.0
202207,842940,Tamping machines and road rollers,438258587.0
202207,842951,Frontend shovel loaders,1741663330.0
202207,842952,Machinery with a 360? revolving superstructure,5464050958.0
202207,842959,"Self-propelled mechanical shovels, excavators and shovel loaders (excluding self-propelled mechanical shovels with a 360° revolving superstructure and front-end shovel loaders)",66591902.0
202207,843010,Piledrivers and pileextractors,49820323.0
202207,843020,Snowploughs and snowblowers,463293127.0
202207,843031,"Other, self-propelled coal or rock cutters and tunnelling machinery",122084278.0
202207,843039,"Other, coal or rock cutters and tunnelling machinery, not self-propelled",8682208.0
202207,843041,"Other, self-propelled boring or sinking machinery for boring earth or extracting minerals or ores",448357009.0
202207,843049,"Other, boring or sinking machinery for boring earth or extracting minerals or ores, not self-propelled and not hydraulic",105090172.0
202207,843050,"Other machinery, selfpropelled",169606284.0
202207,843061,"Tamping or compacting machinery, not self-propelled (excluding hand-operated tools)",91839289.0
202207,843069,"Earth moving machinery, not self-propelled, n.e.s.",122046617.0
202207,843110,Part of machinery of heading 84.25,177624717.0
202207,843120,Part of machinery of heading 84.27,865940978.0
202207,843131,"Part off lifts, skip hoists or escalators, of heading 84.28",870811661.0
202207,843139,"Parts of machinery of heading 8428, n.e.s.",904068177.0
202207,843141,"Buckets, shovels, grabs and grips",209210670.0
202207,843142,Bulldozer or angledozer blades,5372751.0
202207,843143,Parts for boring or sinking machinery of subheading 8430.41 or,989615588.0
202207,843149,"Parts of machinery of heading 8426, 8429 and 8430, n.e.s.",5608305901.0
202207,843210,Ploughs,12725274.0
202207,843221,Disc harrows,7252979.0
202207,843229,"Harrows, scarifiers, cultivators, weeders and hoes for use in agriculture, horticulture or forestry (excluding disc harrows)",173218235.0
202207,843231,"Notill direct seeders, planters and transplanters",12605122.0
202207,843239,"No-till direct seeders, planters and transplanters",21093057.0
202207,843241,"Seeders, planters and transplanters (excl. no-till machines)",1470489.0
202207,843242,Fertiliser distributors,952351.0
202207,843280,"Agricultural, horticultural or forestry machinery for soil preparation or cultivation; lawn or sports-ground rollers (excluding sprayers and dusters, ploughs, harrows, scarifiers, cultivators, weeders, hoes, seeders, planters, manure spreaders and fertiliser distributors)",54294405.0
202207,843290,"Parts of agricultural, horticultural or forestry machinery for soil preparation or cultivation or of lawn or sports-ground rollers, n.e.s.",348189519.0
202207,843311,"Powered, with the cutting device rotating in a horizontal plane",540756980.0
202207,843319,"Mowers for lawns, parks or sports grounds, powered, with the cutting device rotating in a vertical plane or with cutter bars",249302658.0
202207,843320,"Other mowers, including cutter bars for tractor mounting",49114967.0
202207,843330,Other haymaking machinery,5791263.0
202207,843340,"Straw or fodder balers, including pickup balers",26342751.0
202207,843351,Combine harvester-threshers,150610549.0
202207,843352,Threshing machinery (excluding combine harvester-threshers),12948973.0
202207,843353,Root or tuber harvesting machines,1208215.0
202207,843359,"Harvesting machinery for agricultural produce (excluding mowers, haymaking machinery, straw and fodder balers, incl. pick-up balers, combine harvester-threshers, other threshing machinery and root or tuber harvesting machines)",20771381.0
202207,843360,"Machines for cleaning, sorting or grading eggs, fruit or other agricultural produce",34276782.0
202207,843390,"Parts of harvesting machinery, threshing machinery, mowers and machines for cleaning, sorting or grading agricultural produce, n.e.s.",651057299.0
202207,843410,Milking machines,1767939.0
202207,843420,Dairy machinery,4892215.0
202207,843490,"Parts of milking machines and dairy machinery, n.e.s.",30764224.0
202207,843510,"Presses, crushers and similar machinery used in the manufacture of wine, cider, fruit juices or similar beverages (excluding machinery for the treatment of these beverages, incl. centrifuges, filter presses, other filtering equipment and domestic appliances)",19032841.0
202207,843590,"Parts of presses, crushers and similar machinery used in the manufacture of wine, cider, fruit juices or similar beverages, n.e.s.",10530333.0
202207,843610,Machinery for preparing animal feeding stuffs,112548007.0
202207,843621,Poultry incubators and brooders,27337886.0
202207,843629,"Poultry-keeping machinery (excluding machines for sorting or grading eggs, poultry pickers of heading 8438 and incubators and brooders)",88132384.0
202207,843680,"Agricultural, horticultural, forestry or bee-keeping machinery, n.e.s.",184247267.0
202207,843691,"Parts of poultry-keeping machinery or poultry incubators and brooders, n.e.s.",41071788.0
202207,843699,"Parts of agricultural, horticultural, forestry or bee-keeping machinery of heading 84.36, n.e.s.",132456805.0
202207,843710,"Machines for cleaning, sorting or grading seed, grain or dried leguminous vegetables",157439631.0
