Date of data,Commodity code,Commodity,Renminbi Yuan
202207,590699,"Rubberised textile fabrics (excluding knitted or crocheted textile fabrics, adhesive tape of a width of ≤ 20 cm, and tyre cord fabric of high-tenacity yarn of nylon or other polyamides, polyesters or viscose rayon)",60864437.0
202207,590700,"Impregnated, coated or covered textile fabrics; painted canvas being theatrical scenery, studio backcloths or the like, n.e.s.",265582032.0
202207,590800,"Textile wicks, woven, plaited or knitted, for lamps, stoves, lighters, candles or the like; incandescent gas mantles and tubular knitted gas-mantle fabric for incandescent gas mantles, whether or not impregnated",4913792.0
202207,590900,"Textile hosepiping and similar textile tubing, whether or not impregnated or coated, with or without lining, armour or accessories of other materials",92171356.0
202207,591000,"Transmission or conveyor belts or belting, of textile material, whether or not impregnated, coated, covered or laminated with plastics, or reinforced with metal or other material.",79955788.0
202207,591110,"Textile fabrics, felt and felt-lined woven fabrics, coated, covered or laminated with rubber, leather or other material, of a kind used for card clothing, and similar fabrics of a kind used for other technical purposes, incl. narrow fabrics made of velvet impregnated with rubber, for covering weaving spindles weaving beams""""",8050722.0
202207,591120,"Bolting cloth, whether or not made up",38574368.0
202207,591131,"Textile fabrics and felts, endless or fitted with linking devices, of a kind used in papermaking or similar machines, e.g. for paper pulp or asbestos-cement, weighing ＜ 650 g/m2",9964720.0
202207,591132,"Textile fabrics and felts, endless or fitted with linking devices, of a kind used in papermaking or similar machines, e.g. for paper pulp or asbestos-cement, weighing ≥ 650 g/m2",81390722.0
202207,591140,"Filtering or straining cloth of a kind used in oil-presses or for similar technical purposes, incl. that of human hair",93931318.0
202207,591190,"Textile products and articles, for technical purposes, specified in Note 7 to chapter 59, n.e.s.",316493889.0
202207,600110,"Long pile fabrics, knitted or crocheted",188137672.0
202207,600121,"Looped pile fabrics of cotton, knitted or crocheted",108009569.0
202207,600122,"Looped pile fabrics of man-made fibres, knitted or crocheted",139036374.0
202207,600129,"Looped pile fabrics, knitted or crocheted (excluding of cotton or man-made fibres)",4425116.0
202207,600191,"Pile fabrics of cotton, knitted or crocheted (excluding long pile"" fabrics)""",385846461.0
202207,600192,"Pile fabrics of man-made fibres, knitted or crocheted (excluding long pile"" fabrics)""",2849143003.0
202207,600199,"Pile fabrics, knitted or crocheted (excluding cotton or man-made fibres and long pile"" fabrics)""",5979984.0
202207,600240,"Knitted or crocheted fabrics, of a width of ≤ 30 cm, containing ≥ 5% by weight elastomeric yarn",52576689.0
202207,600290,"Knitted or crocheted fabrics, of a width of ≤ 30 cm, containing ≥ 5% by weight elastomeric yarn and rubber thread or rubber thread only",24682123.0
202207,600310,"Knitted or crocheted fabrics of wool or fine animal hair, of a width of ≤ 30 cm",2577779.0
202207,600320,"Knitted or crocheted fabrics of cotton, of a width of ≤ 30 cm",2948076.0
202207,600330,"Knitted or crocheted fabrics of synthetic fibres, of a width of ≤ 30 cm",28474257.0
202207,600340,"Knitted or crocheted fabrics of artificial fibres, of a width of ≤ 30 cm",311703.0
202207,600390,Knitted or crocheted fabrics of a width of ≤ 30 cm,1347104.0
202207,600410,"Knitted or crocheted fabrics, of a width of ＞ 30 cm, containing ≥ 5% by weight elastomeric yarn",2885218464.0
202207,600490,"Knitted or crocheted fabrics, of a width of ＞ 30 cm, containing ≥ 5% by weight elastomeric yarn and rubber thread or rubber thread only",23415291.0
202207,600521,"Unbleached or bleached cotton warp knit fabrics incl. those made on galloon knitting machines"", of a width of ＞ 30 cm""",265479.0
202207,600522,"Dyed cotton warp knit fabrics incl. those made on galloon knitting machines"", of a width of ＞ 30 cm""",2833841.0
202207,600523,"Cotton warp knit fabrics of yarns of different colours incl. those made on galloon knitting machines"", of a width of ＞ 30 cm""",953449.0
202207,600524,"Printed cotton warp knit fabrics incl. those made on galloon knitting machines"", of a width of ＞ 30 cm""",592101.0
202207,600535,Fabrics specified in Subheading Note 1 to this Chapter,2121138.0
202207,600536,"Unbleached or bleached warp knit fabrics of synthetic fibres incl. those made on galloon knitting machines"", of a width of ＞ 30 cm""",84368251.0
202207,600537,"Dyed warp knit fabrics of synthetic fibres incl. those made on galloon knitting machines"", of a width of ＞ 30 cm""",655617743.0
202207,600538,"Warp knit fabrics of synthetic fibres, of yarns of different colours incl. those made on galloon knitting machines"", of a width of ＞ 30 cm""",18472208.0
202207,600539,"Printed warp knit fabrics of synthetic fibres incl. those made on galloon knitting machines"", of a width of ＞ 30 cm""",72854878.0
202207,600541,"Unbleached or bleached warp knit fabrics of artificial fibres incl. those made on galloon knitting machines"", of a width of ＞ 30 cm""",1199835.0
202207,600542,"Dyed warp knit fabrics of artificial fibres incl. those made on galloon knitting machines"", of a width of ＞ 30 cm""",8519928.0
202207,600543,"Warp knit fabrics of artificial fibres, of yarns of different colours incl. those made on galloon knitting machines"", of a width of ＞ 30 cm""",18668.0
202207,600544,"Printed warp knit fabrics of artificial fibres incl. those made on galloon knitting machines"", of a width of ＞ 30 cm""",949495.0
202207,600590,"Warp knit fabrics incl. those made on galloon knitting machines"", of a width of ＞ 30 cm""",15934364.0
202207,600610,"Fabrics, knitted or crocheted, of a width of ＞ 30 cm, of wool or fine animal hair",14025882.0
202207,600621,"Unbleached or bleached cotton fabrics, knitted or crocheted, of a width of ＞ 30 cm",151760516.0
202207,600622,"Dyed cotton fabrics, knitted or crocheted, of a width of ＞ 30 cm",1287861206.0
202207,600623,"Cotton fabrics, knitted or crocheted, of yarns of different colours, of a width of ＞ 30 cm",262724447.0
202207,600624,"Printed cotton fabrics, knitted or crocheted, of a width of ＞ 30 cm",200257042.0
202207,600631,"Unbleached or bleached fabrics, knitted or crocheted, of synthetic fibres, of a width of ＞ 30 cm",240082968.0
202207,600632,"Dyed fabrics, knitted or crocheted, of synthetic fibres, of a width of ＞ 30 cm",3706422920.0
202207,600633,"Fabrics, knitted or crocheted, of synthetic fibres, of yarns of different colours, of a width of ＞ 30 cm",188054703.0
202207,600634,"Printed fabrics, knitted or crocheted, of synthetic fibres, of a width of ＞ 30 cm",552773963.0
202207,600641,"Unbleached or bleached fabrics, knitted or crocheted, of artificial fibres, of a width of ＞ 30 cm",15767844.0
202207,600642,"Dyed fabrics, knitted or crocheted, of artificial fibres, of a width of ＞ 30 cm",379019434.0
202207,600643,"Fabrics, knitted or crocheted, of artificial fibres, of yarns of different colours, of a width of ＞ 30 cm",16906105.0
202207,600644,"Printed fabrics, knitted or crocheted, of artificial fibres, of a width of ＞ 30 cm",35693544.0
202207,600690,"Fabrics, knitted or crocheted, of a width of ＞ 30 cm",24356726.0
202207,610120,"Overcoats, car coats, capes, cloaks, anoraks, incl. ski jackets, windcheaters, wind-jackets and similar articles of cotton, for men or boys, knitted or crocheted",76676949.0
202207,610130,"Overcoats, car coats, capes, cloaks, anoraks, incl. ski jackets, windcheaters, wind-jackets and similar articles of man-made fibres, for men or boys, knitted or crocheted",371327939.0
202207,610190,"Overcoats, car coats, capes, cloaks, anoraks, incl. ski jackets, windcheaters, wind-jackets and similar articles of textile materials, for men or boys, knitted or crocheted",12473249.0
202207,610210,"Women's or girls' overcoats, car coats, capes, cloaks, anoraks, incl. ski jackets, windcheaters, wind-jackets and similar articles, of wool or fine animal hair, knitted or crocheted",66177941.0
202207,610220,"Women's or girls' overcoats, car coats, capes, cloaks, anoraks, incl. ski jackets, windcheaters, wind-jackets and similar articles of cotton, knitted or crocheted",53351917.0
202207,610230,"Women's or girls' overcoats, car coats, capes, cloaks, anoraks, incl. ski jackets, windcheaters, wind-jackets and similar articles of man-made fibres, knitted or crocheted",767905726.0
202207,610290,"Women's or girls' overcoats, car coats, capes, cloaks, anoraks, incl. ski jackets, windcheaters, wind-jackets and similar articles, of textile materials, knitted or crocheted",11955085.0
202207,610310,"Men's or boys' suits of textile materials, knitted or crocheted",7858897.0
202207,610322,"Men's or boys' ensembles of cotton, knitted or crocheted",189720998.0
202207,610323,"Men's or boys' ensembles of synthetic fibres, knitted or crocheted",205252781.0
202207,610329,Men's or boys' ensembles of textile materials,4891122.0
202207,610331,"Men's or boys' jackets and blazers of wool or fine animal hair, knitted or crocheted",42264982.0
202207,610332,"Men's or boys' jackets and blazers of cotton, knitted or crocheted",767129839.0
202207,610333,"Men's or boys' jackets and blazers of synthetic fibres, knitted or crocheted",508038350.0
202207,610339,Men's or boys' jackets and blazers of textile materials,10784046.0
202207,610341,"Men's or boys' trousers, bib and brace overalls, breeches and shorts of wool or fine animal hair, knitted or crocheted",38505825.0
202207,610342,"Men's or boys' trousers, bib and brace overalls, breeches and shorts of cotton, knitted or crocheted",1370906360.0
202207,610343,"Men's or boys' trousers, bib and brace overalls, breeches and shorts of synthetic fibres, knitted or crocheted",1412093567.0
202207,610349,"Men's or boys' trousers, bib and brace overalls, breeches and shorts of textile materials, knitted or crocheted",31628145.0
202207,610413,"Women's or girls' suits of synthetic fibres, knitted or crocheted",2192941.0
202207,610419,"Women's or girls' suits of textile materials, knitted or crocheted",4789269.0
202207,610422,"Women's or girls' ensembles of cotton, knitted or crocheted",194310178.0
202207,610423,"Women's or girls' ensembles of synthetic fibres, knitted or crocheted",362001540.0
202207,610429,Women's or girls' ensembles of textile materials,30867407.0
202207,610431,"Women's or girls' jackets and blazers of wool or fine animal hair, knitted or crocheted",18445756.0
202207,610432,"Women's or girls' jackets and blazers of cotton, knitted or crocheted",1427681862.0
202207,610433,"Women's or girls' jackets and blazers of synthetic fibres, knitted or crocheted",1367156271.0
202207,610439,"Women's or girls' jackets and blazers of textile materials, knitted or crocheted",100716613.0
202207,610441,"Women's or girls' dresses of wool or fine animal hair, knitted or crocheted",60945865.0
202207,610442,"Women's or girls' dresses of cotton, knitted or crocheted",585286465.0
202207,610443,"Women's or girls' dresses of synthetic fibres, knitted or crocheted",1610033757.0
202207,610444,"Women's or girls' dresses of artificial fibres, knitted or crocheted",395115722.0
202207,610449,"Women's or girls' dresses of textile materials, knitted or crocheted",20435021.0
202207,610451,"Women's or girls' skirts and divided skirts of wool or fine animal hair, knitted or crocheted",14073668.0
202207,610452,"Women's or girls' skirts and divided skirts of cotton, knitted or crocheted",213248846.0
202207,610453,"Women's or girls' skirts and divided skirts of synthetic fibres, knitted or crocheted",409000869.0
202207,610459,"Women's or girls' skirts and divided skirts of textile materials, knitted or crocheted",59055552.0
202207,610461,"Women's or girls' trousers, bib and brace overalls, breeches and shorts of wool or fine animal hair, knitted or crocheted",76860489.0
202207,610462,"Women's or girls' trousers, bib and brace overalls, breeches and shorts of cotton, knitted or crocheted",1813426061.0
202207,610463,"Women's or girls' trousers, bib and brace overalls, breeches and shorts of synthetic fibres, knitted or crocheted",3073925418.0
202207,610469,"Women's or girls' trousers, bib and brace overalls, breeches and shorts of textile materials, knitted or crocheted",371178476.0
202207,610510,"Men's or boys' shirts of cotton, knitted or crocheted (excluding nightshirts, T-shirts, singlets and other vests)",346274557.0
202207,610520,"Men's or boys' shirts of man-made fibres, knitted or crocheted (excluding nightshirts, T-shirts, singlets and other vests)",444466918.0
202207,610590,"Men's or boys' shirts of textile materials, knitted or crocheted (excluding of cotton or man-made fibres, nightshirts, T-shirts, singlets and other vests)",9436708.0
202207,610610,"Women's or girls' blouses, shirts and shirt-blouses of cotton, knitted or crocheted (excluding T-shirts and vests)",71848852.0
202207,610620,"Women's or girls' blouses, shirts and shirt-blouses of man-made fibres, knitted or crocheted (excluding T-shirts and vests)",243616679.0
202207,610690,"Women's or girls' blouses, shirts and shirt-blouses of textile materials, knitted or crocheted (excluding of cotton or man-made fibres, T-shirts and vests)",7895326.0
202207,610711,"Men's or boys' underpants and briefs of cotton, knitted or crocheted",915030750.0
202207,610712,"Men's or boys' underpants and briefs of man-made fibres, knitted or crocheted",536118980.0
202207,610719,"Men's or boys' underpants and briefs of other textile materials, knitted or crocheted (excluding of cotton or man-made fibres)",14862052.0
202207,610721,"Men's or boys' nightshirts and pyjamas of cotton, knitted or crocheted (excluding vests and singlets)",251268741.0
202207,610722,"Men's or boys' nightshirts and pyjamas of man-made fibres, knitted or crocheted (excluding vests and singlets)",544081632.0
202207,610729,"Men's or boys' nightshirts and pyjamas of textile materials, knitted or crocheted (excluding of cotton or man-made fibres, and vests and singlets)",21675152.0
202207,610791,"Men's or boys' bathrobes, dressing gowns and similar articles of cotton, knitted or crocheted",39701833.0
202207,610799,"Men's or boys' bathrobes, dressing gowns and similar articles of textile materials, knitted or crocheted (excluding of cotton)",181730594.0
202207,610811,"Women's or girls' slips and petticoats of man-made fibres, knitted or crocheted (excluding T-shirts and vests)",7231884.0
202207,610819,"Women's or girls' slips and petticoats of textile materials, knitted or crocheted (excluding man-made fibres, T-shirts and vests)",1489010.0
202207,610821,"Women's or girls' briefs and panties of cotton, knitted or crocheted",758468314.0
202207,610822,"Women's or girls' briefs and panties of man-made fibres, knitted or crocheted",862722191.0
202207,610829,"Women's or girls' briefs and panties of textile materials, knitted or crocheted (excluding cotton or man-made fibres)",13724182.0
202207,610831,"Women's or girls' nightdresses and pyjamas of cotton, knitted or crocheted (excluding T-shirts, vests and négligés)",334757663.0
202207,610832,"Women's or girls' nightdresses and pyjamas of man-made fibres, knitted or crocheted (excluding T-shirts, vests and négligés)",1673481151.0
202207,610839,"Women's or girls' nightdresses and pyjamas of textile materials, knitted or crocheted (excluding of cotton and man-made fibres, T-shirts, vests and négligés)",29346085.0
202207,610891,"Women's or girls' négligés, bathrobes, dressing gowns, housejackets and similar articles of cotton, knitted or crocheted (excluding vests, slips, petticoats, briefs and panties, nightdresses, pyjamas, brassiéres, girdles, corsets and similar articles)",411260928.0
202207,610892,"Women's or girls' négligés, bathrobes, dressing gowns, housejackets and similar articles of man-made fibres, knitted or crocheted (excluding vests, slips, petticoats, briefs and panties, nightdresses, pyjamas, brassiéres, girdles, corsets and similar articles)",1014824779.0
202207,610899,"Women's or girls' négligés, bathrobes, dressing gowns, housejackets and similar articles of textile materials, knitted or crocheted (excluding of cotton or man-made fibres, vests, slips, petticoats, briefs and panties, nightdresses, pyjamas, brassiéres, girdles, corsets and similar articles)",6410218.0
202207,610910,"T-shirts, singlets and other vests of cotton, knitted or crocheted",2739263699.0
202207,610990,"T-shirts, singlets and other vests of textile materials, knitted or crocheted (excluding cotton)",2756189458.0
202207,611011,"Jerseys, pullovers, cardigans, waistcoats and similar articles, of hair of Kashmir cashmere"" goats, knitted or crocheted (excluding quilted articles)""",1350417891.0
202207,611012,"Jerseys, pullovers, cardigans, waistcoats and similar articles, of fine animal hair, knitted or crocheted (excluding from hair of Kashmir cashmere"" goats and quilted articles)""",904024917.0
202207,611019,"Jerseys, pullovers, cardigans, waistcoats and similar articles, of cotton, knitted or crocheted (excluding wadded waistcoats)",294310025.0
202207,611020,"Jerseys, pullovers, cardigans, waistcoats and similar articles, of man-made fibres, knitted or crocheted (excluding wadded waistcoats)",5690697345.0
202207,611030,"Jerseys, pullovers, cardigans, waistcoats and similar articles, of textile materials, knitted or crocheted (excluding of wool, fine animal hair, cotton or man-made fibres, and wadded waistcoats)",12112745475.0
202207,611090,"bies' garments and clothing accessories, knitted or crocheted (excluding hats)",138397309.0
202207,611120,"Babies' garments and clothing accessories of cotton, knitted or crocheted (excluding hats)",1237193480.0
202207,611130,"Babies' garments and clothing accessories of synthetic fibres, knitted or crocheted (excluding hats)",483623025.0
202207,611190,"Babies' garments and clothing accessories of textile materials, knitted or crocheted (excluding of cotton or synthetic fibres, and hats)",88264898.0
202207,611211,"Track-suits of cotton, knitted or crocheted",41267960.0
202207,611212,"Track-suits of synthetic fibres, knitted or crocheted",226303217.0
202207,611219,"Track-suits of textile materials, knitted or crocheted (excluding cotton or synthetic fibres)",2179251.0
202207,611220,"Ski-suits, knitted or crocheted",2484319.0
202207,611231,"Men's or boys' swimwear of synthetic fibres, knitted or crocheted",72146695.0
202207,611239,"Men's or boys' swimwear of textile materials, knitted or crocheted (excluding synthetic fibres)",32015.0
202207,611241,"Women's or girls' swimwear of synthetic fibres, knitted or crocheted",705930273.0
202207,611249,"Women's or girls' swimwear of textile materials, knitted or crocheted (excluding synthetic fibres)",7979139.0
202207,611300,"Garments, knitted or crocheted, rubberised or impregnated, coated or covered with plastics or other materials (excluding babies' garments and clothing accessories)",489416695.0
202207,611420,"Other garments of cotton, knitted or crocheted",527018116.0
202207,611430,"Other garments of man-made fibres, knitted or crocheted",1796188799.0
202207,611490,"Other garments of other textile materials, knitted or crocheted",67610968.0
202207,611510,"Graduated compression hosiery [e.g., stockings for varicose veins], of textile materials, knitted or crocheted (excluding hosiery for babies)",11889531.0
202207,611521,"Pantyhose and tights of synthetic fibres, knitted or crocheted, measuring per single yarn ＜ 67 decitex (excluding graduated compression hosiery)",193005362.0
202207,611522,"Pantyhose and tights of synthetic fibres, knitted or crocheted, measuring per single yarn ≥ 67 decitex (excluding graduated compression hosiery)",147914755.0
202207,611529,"Pantyhose and tights of textile materials, knitted or crocheted (excluding graduated compression hosiery, those of synthetic fibres and hosiery for babies)",211374094.0
202207,611530,"Women's full-length or knee-length hosiery, knitted or crocheted, measuring per single yarn ＜ 67 decitex (excluding graduated compression hosiery, pantyhose and tights)",52739805.0
202207,611594,"Full-length or knee-length stockings, socks and other hosiery, incl. footwear without applied soles, of wool or fine animal hair, knitted or crocheted (excluding graduated compression hosiery, pantyhose and tights, women's full-length or knee-length stockings, measuring per single yarn ＜ 67 decitex, and hosiery for babies)",162803430.0
202207,611595,"Full-length or knee-length stockings, socks and other hosiery, incl. footwear without applied soles, of cotton, knitted or crocheted (excluding graduated compression hosiery, pantyhose and tights, women's full-length or knee-length stockings, measuring per single yarn ＜ 67 decitex, and hosiery for babies)",1934355559.0
202207,611596,"Full-length or knee-length stockings, socks and other hosiery, incl. footwear without applied soles, of synthetic fibres, knitted or crocheted (excluding graduated compression hosiery, pantyhose and tights, women's full-length or knee-length stockings, measuring per single yarn ＜ 67 decitex, and hosiery for babies)",2751397201.0
202207,611599,"Full-length or knee-length stockings, socks and other hosiery, incl. footwear without applied soles, of textile materials, knitted or crocheted (excluding of wool, fine animal hair, cotton or synthetic fibres, graduated compression hosiery, pantyhose and tights, women's full-length or knee-length stockings, measuring per single yarn ＜ 67 decitex, and hosiery for babies)",60868500.0
202207,611610,"Impregnated, coated, covered or laminated with plastics or rubber",1222652603.0
202207,611691,"Gloves, mittens and mitts, of wool or fine animal hair, knitted or crocheted (excluding for babies)",137789593.0
202207,611692,"Gloves, mittens and mitts, of cotton, knitted or crocheted (excluding impregnated, coated or covered with plastics or rubber, and for babies)",259841954.0
202207,611693,"Gloves, mittens and mitts, of synthetic fibres, knitted or crocheted (excluding impregnated, coated or covered with plastics or rubber, and for babies)",895589383.0
202207,611699,"Gloves, mittens and mitts, of textile materials, knitted or crocheted (excluding of wool, fine animal hair, cotton or synthetic fibres, impregnated, coated or covered with plastics or rubber, and for babies)",95969691.0
202207,611710,"Shawls, scarves, mufflers, mantillas, veils and the like, knitted or crocheted",965925037.0
202207,611780,"Ties, bow ties, cravats and other made-up clothing accessories, knitted or crocheted, n.e.s. (excluding shawls, scarves, mufflers, mantillas, veils and the like)",452540840.0
202207,611790,"Parts of garments or clothing accessories, knitted or crocheted, n.e.s.",183704235.0
202207,620120,"Men’s or boys’ overcoats, car-coats, capes, cloaks, anoraks (including ski-jackets), wind-cheaters, windjackets and similar artic,of wool or fine animal hair",175789557.0
202207,620130,"Men’s or boys’ overcoats, car-coats, capes, cloaks, anoraks (including ski-jackets), wind-cheaters, windjackets and similar artic,of cotton",716341774.0
202207,620140,"Men’s or boys’ overcoats, car-coats, capes, cloaks, anoraks (including ski-jackets), wind-cheaters, windjackets and similar artic,of man-made fibres",6353563055.0
202207,620190,"Men's or boys' overcoats, raincoats, car coats, capes, cloaks and similar articles, of  other textile materials",179712716.0
202207,620220,"Women’s or girls’ overcoats, car-coats, capes, cloaks, anoraks (including ski-jackets), wind-cheaters, wind jackets and similar articles, of wool or fine animal hair",299207466.0
202207,620230,"Women’s or girls’ overcoats, car-coats, capes, cloaks, anoraks (including ski-jackets), wind-cheaters, wind jackets and similar articles, of cotton",519571091.0
202207,620240,"Women’s or girls’ overcoats, car-coats, capes, cloaks, anoraks (including ski-jackets), wind-cheaters, wind jackets and similar articles,of man-made fibres",8489653079.0
202207,620290,"Women’s or girls’ overcoats, car-coats, capes, cloaks, anoraks (including ski-jackets), wind-cheaters, wind jackets and similar articles, of other textile materials",167573978.0
202207,620311,"Men's or boys' suits of wool or fine animal hair (excluding knitted or crocheted, tracksuits, ski suits and swimwear)",199255965.0
202207,620312,"Men's or boys' suits of synthetic fibres (excluding knitted or crocheted, tracksuits, ski suits and swimwear)",204741204.0
202207,620319,"Men's or boys' suits of textile materials (excluding of wool, fine animal hair or synthetic fibres, knitted or crocheted, tracksuits, ski suits and swimwear)",10947127.0
202207,620322,"Men's or boys' ensembles of cotton (excluding knitted or crocheted, ski ensembles and swimwear)",53345566.0
202207,620323,"Men's or boys' ensembles of synthetic fibres (excluding knitted or crocheted, ski ensembles and swimwear)",191831093.0
202207,620329,"Men's or boys' ensembles of textile materials (excluding of cotton or synthetic fibres, knitted or crocheted, ski ensembles and swimwear)",6214074.0
202207,620331,"Men's or boys' jackets and blazers of wool or fine animal hair (excluding knitted or crocheted, and wind-jackets and similar articles)",180988242.0
202207,620332,"Men's or boys' jackets and blazers of cotton (excluding knitted or crocheted, and wind-jackets and similar articles)",684358702.0
202207,620333,"Men's or boys' jackets and blazers of synthetic fibres (excluding knitted or crocheted, and wind-jackets and similar articles)",904031361.0
