Date of data,Commodity code,Commodity,Renminbi Yuan
201903,380190,"Preparations based on graphite or other carbon in the form of pastes, blocks, plates or other semi-manufactures (excluding carbonaceous pastes for electrodes and similar pastes for furnace linings)",160643701.0
201903,380210,Activated carbon,259469890.0
201903,380290,"Activated kieselguhr and other activated natural mineral products; animal black, whether or not spent (excluding activated carbon, calcinated diatomite without the addition of sintering agents and activated chemical products)",52043957.0
201903,380300,"Tall oil, whether or not refined.",77624.0
201903,380400,"Residual lyes from the manufacture of wood pulp, whether or not concentrated, desugared or chemically treated, including lignin sulphonates, but excluding tall oil of heading 38.03.",10702553.0
201903,380510,"Gum, wood or sulphate turpentine oils",2891515.0
201903,380590,"Crude dipentene; sulphite turpentine and other crude para-cymene; terpenic oils produced by the distillation or other treatment of coniferous woods (excluding gum turpentine, wood turpentine and sulphate turpentine)",14671608.0
201903,380610,Rosin and resin acids,38247535.0
201903,380620,"Salts of rosin, of resin acids or of derivatives of rosin or resin acids, other than salts of rosin adducts",537808.0
201903,380630,Ester gums,7974053.0
201903,380690,"Derivatives of rosin, incl. salts of rosin adducts, and of resin acids, light and heavy resin oils and modified natural resins obtained by heat treatment run gums"" (excluding salts of rosin, of resin acids or salts of derivatives of rosin or resin acids, and ester gums)""",105003303.0
201903,380700,"Wood tar; wood tar oils; wood creosote; wood naphtha; vegetable pitch; brewers' pitch and similar preparations based on rosin, resin acids or on vegetable pitch.",1816856.0
201903,380891,Insecticides,770494667.0
201903,380892,Fungicides,351742244.0
201903,380893,"Herbicides, antisprouting products and plantgrowth regulators",2020786925.0
201903,380894,Disinfectants,66756014.0
201903,380899,Other,13879145.0
201903,380910,With a basis of amylaceous substances,1281132.0
201903,380991,Of a kind used in the textile or like industries,64739282.0
201903,380992,Of a kind used in the paper or like industries,101545192.0
201903,380993,Of a kind used in the leather or like industries,21867076.0
201903,381010,"Pickling preparations for metal surfaces; soldering, brazing or welding powders and pastes consisting of metal and other materials",32023088.0
201903,381090,Other,26376571.0
201903,381119,Anti-knock preparations for motor fuels (excluding those based on lead compounds),6871.0
201903,381121,Containing petroleum oils or oils obtained from bituminous minerals,88415415.0
201903,381129,Other,17786174.0
201903,381190,"Oxidation inhibitors, gum inhibitors, viscosity improvers, anti-corrosive preparations and other prepared additives for mineral oils, incl. gasoline, or for other liquids used for the same purposes as mineral oils (excluding anti-knock preparations and oil lubricant additives)",5110629.0
201903,381210,Prepared rubber accelerators,337901901.0
201903,381220,Compound plasticisers for rubber or plastics,27265464.0
201903,381231,"Mixtures of oligomers of 2,2,4trimethyl1,2dihydroquinoline (TMQ)",58662663.0
201903,381239,"Anti-oxidising preparations and other compound stabilisers for rubber or plastics (excl. mixtures of oligomers of 2,2,4-trimethyl-1,2-dihydroquinoline TMQ"")""",149439645.0
201903,381300,Preparations and charges for fireextinguishers; charged fireextinguishing grenades.,16995934.0
201903,381400,"Organic composite solvents and thinners, not elsewhere specified or included; prepared paint or varnish removers.",23905812.0
201903,381511,Supported catalysts with nickel or nickel compounds as the active substance,1649740.0
201903,381512,Supported catalysts with precious metal or precious metal compounds as the active substance,136828343.0
201903,381519,"Supported catalysts, n.e.s. (excluding with precious metal, a precious-metal compound, nickel or a nickel compound as the active substance)",207739144.0
201903,381590,"Reaction initiators, reaction accelerators and catalytic preparations, n.e.s. (excluding rubber accelerators and supported catalysts)",93998765.0
201903,381600,"Refractory cements, mortars, concretes and similar compositions, other than products of heading 38.01.",190504069.0
201903,381700,"Mixed alkylbenzenes and mixed alkylnaphthalenes, other than those of heading 27.07 or 29.02.",174259063.0
201903,381800,"Chemical elements doped for use in electronics, in the form of discs, wafers or similar forms; chemical compounds doped for use in electronics. form of",1535675105.0
201903,381900,"Hydraulic brake fluids and other prepared liquids for hydraulictransmission, not containing or containing less than 70% byweight of petroleum oils or oils obtained from bituminousminerals.",4497576.0
201903,382000,Antifreezing preparations and prepared deicing fluids.,9284216.0
201903,382100,"Prepared culture media for the development or maintenance of microorganisms (including viruses and the like) or of plant, human or animal cells.",4553314.0
201903,382200,"Diagnostic or laboratory reagents on a backing, prepareddiagnostic or laboratory reagents whether or not on a backing,other than those of heading 30.02 or 30.06; certified referencematerials.",176117569.0
201903,382311,Stearic acid,8813239.0
201903,382312,Oleic acid,2028403.0
201903,382313,Tall oil fatty acids,377910.0
201903,382319,"Fatty acids, industrial, monocarboxylic; acid oils from refining (excluding stearic acid, oleic acid and tall oil fatty acids)",6158800.0
201903,382370,Industrial fatty alcohols,658778.0
201903,382410,Prepared binders for foundry moulds or cores,23793554.0
201903,382430,Nonagglomerated metal carbides mixed together or with metallic binders,46213492.0
201903,382440,"Prepared additives for cements, mortars or concretes",165654995.0
201903,382450,Nonrefractory mortars and concretes,26077084.0
201903,382460,Sorbitol other than that of subheading 2905.44,22824453.0
201903,382474,"Containing hydrochlorofluorocarbons (HCFCs), whether or not containing perfluorocarbons (PFCs) or hydrofluorocarbons (HFCs), but not containing chlorofluorocarbons (CFCs)",11767967.0
201903,382478,"Containing perfluorocarbons (PFCs) or hydrofluorocarbons (HFCs), but not containing chlorofluorocarbons (CFCs) or hydrochlorofluorocarbons (HCFCs)",294939130.0
201903,382481,Containing oxirane (ethylene oxide),173490.0
201903,382491,"Mixtures and preparations consisting mainly of (5ethyl2methyl2oxido1,3,2dioxaphosphinan5yl)methyl methyl methylphosphonate and bis[(5ethyl2methyl2oxido1,3,2dioxaphosphinan5yl)methyl] methylphosphonate",235423.0
201903,382499,"Chemical products and preparations of the chemical or allied industries, incl. those consisting of mixtures of natural products, n.e.s.",2065090831.0
201903,382549,"Waste organic solvents, non-halogenated",945122.0
201903,382561,Mainly containing organic constituents,16538.0
201903,382569,"Wastes from chemical or allied industries (excluding wastes of metal pickling liquors, of hydraulic fluids, brake fluids and anti-freeze fluids and those mainly containing organic constituents)",225585.0
201903,382590,"Residual products of the chemical or allied industries, n.e.s. (excluding waste)",5680204.0
201903,382600,"Biodiesel and mixtures thereof, not containing or containing less than 70% by weight of petroleum oils or oils obtained from bituminous minerals.",241050936.0
201903,390110,Polyethylene having a specific gravity of less than 0.94,96101607.0
201903,390120,Polyethylene having a specific gravity of 0.94 or more,142066776.0
201903,390130,Ethylenevinyl acetate copolymers,64368816.0
201903,390140,"Ethylenealphaolefin copolymers, having a specific gravity of less than 0.94",32313762.0
201903,390190,"Polymers of ethylene, in primary forms (excluding polyethylene and ethylene-vinyl acetate copolymers)",307438688.0
201903,390210,Polypropylene,279462725.0
201903,390220,Polyisobutylene,8940362.0
201903,390230,Propylene copolymers,49396687.0
201903,390290,"Polymers of propylene or of other olefins, in primary forms (excluding polypropylene, polyisobutylene and propylene copolymers)",20348535.0
201903,390311,"Expansible polystyrene, in primary forms",224503047.0
201903,390319,"Polystyrene, in primary forms (excluding expansible)",41410961.0
201903,390320,Styreneacrylonitrile (SAN) copolymers,9158202.0
201903,390330,Acrylonitrilebutadienestyrene (ABS) copolymers,56838967.0
201903,390390,"Polymers of styrene, in primary forms (excluding polystyrene, styrene-acrylonitrile copolymers SAN"" and acrylonitrile-butadiene-styrene ""ABS"")""",37425700.0
201903,390410,"Poly(vinyl chloride), not mixed with any other substances",400765413.0
201903,390421,Nonplasticised,45499227.0
201903,390422,Plasticised,88704128.0
201903,390430,Vinyl chloridevinyl acetate copolymers,22409142.0
201903,390440,Other vinyl chloride copolymers,4999559.0
201903,390450,Vinylidene chloride polymers,575903.0
201903,390461,Polytetrafluoroethylene,142027008.0
201903,390469,"Fluoropolymers of vinyl chloride or of other halogenated olefins, in primary forms (excluding polytetrafluoroethylene)",174792247.0
201903,390490,"Polymers of vinyl chloride or other halogenated olefins, in primary forms (excluding polyvinyl chloride"", copolymers of vinyl chloride, polymers of vinyl chloride and fluoropolymers)""",3689187.0
201903,390512,"Polyvinyl acetate"", in aqueous dispersion""",2706261.0
201903,390519,"Polyvinyl acetate"", in primary forms (excluding in aqueous dispersion)""",6464667.0
201903,390521,"Vinyl acetate copolymers, in aqueous dispersion",4715264.0
201903,390529,"Vinyl acetate copolymers, in primary forms (excluding in aqueous dispersion)",22274832.0
201903,390530,"Poly(vinyl alcohol), whether or not containing unhydrolysed acetate groups",180253543.0
201903,390591,Copolymers,5003582.0
201903,390599,"Polymers of vinyl esters and other vinyl polymers, in primary forms (excluding those of vinyl chloride or other halogenated olefins, polyvinyl acetate"", vinyl acetate copolymers and poly""vinyl alcohol"", whether or not containing unhydrolised acetate groups)""",47675734.0
201903,390610,"Polymethyl methacrylate"", in primary forms""",26323185.0
201903,390690,"Acrylic polymers, in primary forms (excluding polymethyl methacrylate"")""",744578715.0
201903,390710,Polyacetals,42580374.0
201903,390720,Other polyethers,834526739.0
201903,390730,Epoxide resins,97994610.0
201903,390740,Polycarbonates,462953561.0
201903,390750,Alkyd resins,3932325.0
201903,390761,"Polyethylene terephthalate"", in primary forms, having a viscosity number of 78 ml/g or higher""",2543412548.0
201903,390769,"Polyethylene terephthalate"", in primary forms, having a viscosity number of < 78 ml/g""",396946938.0
201903,390770,Poly(lactic acid),4155681.0
201903,390791,Unsaturated,36213707.0
201903,390799,"Saturated polyesters in primary forms (excluding polycarbonates, alkyd resins, polyethylene terephthalate"" and poly""lactic acid"")""",498279091.0
201903,390810,"Polyamide6, 11, 12, 6,6, 6,9, 6,10 or 6,12 ,in primary forms",546647364.0
201903,390890,"Polyamides, in primary forms (excluding polyamides-6, -11, -12, -6,6, -6,9, -6,10 and -6,12)",165284487.0
201903,390910,Urea resins; thiourea resins,21012124.0
201903,390920,Melamine resins,33675998.0
201903,390931,"Poly(methylene phenyl isocyanate) (crude MDI, polymeric MDI)",742144485.0
201903,390939,"Amino-resins, in primary forms (excl. urea, thiourea and melamine resins and MDI)",3713552.0
201903,390940,Phenolic resins,117600159.0
201903,390950,Polyurethanes,413066585.0
201903,391000,Silicones in primary forms.,539834965.0
201903,391110,"Petroleum resins, coumarone, indene or coumaroneindene resins and polyterpenes",233982197.0
201903,391190,"Polysulphides, polysulphones and other polymers and prepolymers produced by chemical synthesis, n.e.s., in primary forms",256123555.0
201903,391211,Nonplasticised,6010709.0
201903,391212,Plasticised,1451673.0
201903,391220,Cellulose nitrates (including collodions),35332251.0
201903,391231,Carboxymethylcellulose and its salts,131539121.0
201903,391239,"Cellulose ethers, in primary forms (excluding carboxymethylcellulose and its salts)",168837928.0
201903,391290,"Cellulose and chemical derivatives thereof, n.e.s., in primary forms (excluding cellulose acetates, cellulose nitrates and cellulose ethers)",63255907.0
201903,391310,"Alginic acid, its salts and esters",990062.0
201903,391390,"Natural polymers and modified natural polymers, e.g. hardened proteins, chemical derivatives of natural rubber, n.e.s., in primary forms (excluding alginic acid and its salts and esters)",304310801.0
201903,391400,"Ionexchangers based on polymers of headings 39.01 to 39.13, in primary forms.",176897797.0
201903,391510,"Waste, parings and scrap, of polymers of ethylene",143053.0
201903,391520,"Waste, parings and scrap, of polymers of styrene",6147061.0
201903,391530,"Waste, parings and scrap, of polymers of vinyl chloride",1541930.0
201903,391590,"Waste, parings and scrap, of other plastics",57999833.0
201903,391610,Monofilament of polymers of ethylene,24630031.0
201903,391620,Monofilament of polymers of vinyl chloride,128162846.0
201903,391690,Monofilament of other plastics,156408715.0
201903,391710,Artificial guts (sausage casings) of hardened protein or of cellulosic materials,34348263.0
201903,391721,"Rigid tubes, pipes and hoses, of polymers of ethylene",88533125.0
201903,391722,"Rigid tubes, pipes and hoses, of polymers of propylene",50856617.0
201903,391723,"Rigid tubes, pipes and hoses, of polymers of vinyl chloride",88806938.0
201903,391729,"Rigid tubes, pipes and hoses, of other plastics",68112033.0
201903,391731,"Flexible tubes, pipes and hoses, having a minimum burst pressure of 27.6 Mpa",100057857.0
201903,391732,"Other, not reinforced or otherwise combined with other materials,without fittings",142252093.0
201903,391733,"Other, not reinforced or otherwise combined with other materials,without fittings",78685723.0
201903,391739,"Flexible tubes, pipes and hoses, of plastics, reinforced or otherwise combined with other materials (excluding those with a burst pressure of ≥ 27,6 MPa)",418313961.0
201903,391740,Fittings,339749362.0
201903,391810,Of polymers of vinyl chloride,2344952714.0
201903,391890,Of other plastics,593912188.0
201903,391910,"Self-adhesive plates, sheets, film, foil, tape, strip and other flat shapes, of plastics, in rolls ≤ 20 cm wide",533595781.0
201903,391990,"Self-adhesive plates, sheets, film, foil, tape, strip and other flat shapes, of plastics, whether or not in rolls > 20 cm wide (excluding floor, wall and ceiling coverings of heading 3918)",1280721559.0
201903,392010,"Plates, sheets, film, foil and strip, of non-cellular polymers of ethylene, not reinforced, laminated, supported or similarly combined with other materials, without backing, unworked or merely surface-worked or merely cut into squares or rectangles (excluding self-adhesive products, and floor, wall and ceiling coverings of heading 3918)",1000048950.0
201903,392020,"Plates, sheets, film, foil and strip, of non-cellular polymers of ethylene, not reinforced, laminated, supported or similarly combined with other materials, without backing, unworked or merely surface-worked or merely cut into squares or rectangles (excluding self-adhesive products, and floor, wall and ceiling coverings of heading 3918)",509294637.0
201903,392030,"Plates, sheets, foil, film and strip, of non-cellular polymers of styrene, not reinforced, laminated, supported or similarly combined with other materials, without backing, unworked or merely surface-worked or merely cut into squares or rectangles (excluding self-adhesive products, and floor, wall and ceiling coverings of heading 3918)",109121719.0
201903,392043,"Plates, sheets, film, foil and strip, of non-cellular polymers of vinyl chloride, containing by weight ≥ 6% of plasticisers, not reinforced, laminated, supported or similarly combined with other materials, without backing, unworked or merely surface-worked or merely cut into squares or rectangles (excluding self-adhesive products, and floor, wall and ceiling coverings of heading 3918)",267098163.0
201903,392049,"Plates, sheets, film, foil and strip, of non-cellular polymers of vinyl chloride, containing by weight < 6% of plasticisers, not reinforced, laminated, supported or similarly combined with other materials, without backing, unworked or merely surface-worked or merely cut into squares or rectangles (excluding self-adhesive products, and floor, wall and ceiling coverings of heading 3918)",315804806.0
201903,392051,"Plates, sheets, film, foil and strip, of non-cellular polymethyl methacrylate"", not reinforced, laminated, supported or similarly combined with other materials, without backing, unworked or merely surface-worked or merely cut into squares or rectangles (excluding self-adhesive products, and floor, wall and ceiling coverings of heading 3918)""",94615783.0
201903,392059,"Plates, sheets, film, foil and strip, of non-cellular acrylic polymers, not reinforced, laminated, supported or similarly combined with other materials, without backing, unworked or merely surface-worked or merely cut into squares or rectangles (excluding those of polymethyl methacrylate"", self-adhesive products, and floor, wall and ceiling coverings of heading 3918)""",8846111.0
201903,392061,"Plates, sheets, film, foil and strip, of non-cellular polycarbonates, not reinforced, laminated, supported or similarly combined with other materials, without backing, unworked or merely surface-worked or merely cut into squares or rectangles (excluding those of polymethyl methacrylate"", self-adhesive products, and floor, wall and ceiling coverings of heading 3918)""",137195916.0
201903,392062,"Plates, sheets, film, foil and strip, of non-cellular polyethylene terephthalate"", not reinforced, laminated, supported or similarly combined with other materials, without backing, unworked or merely surface-worked or merely cut into squares or rectangles (excluding those of poly""methyl methacrylate"", self-adhesive products, and floor, wall and ceiling coverings of heading 3918)""",747494190.0
201903,392063,"Plates, sheets, film, foil and strip, of non-cellular unsaturated polyesters, not reinforced, laminated, supported or similarly combined with other materials, without backing, unworked or merely surface-worked or merely cut into squares or rectangles (excluding those of polymethyl methacrylate"", self-adhesive products, and floor, wall and ceiling coverings of heading 3918)""",53940316.0
201903,392069,"Plates, sheets, film, foil and strip, of non-cellular polyesters, not reinforced, laminated, supported or similarly combined with other materials, not worked or only surface-worked, or only cut to rectangular, incl. square, shapes (excluding polycarbonates, polythylene terephthalate and other unsaturated polyesters, self-adhesive products, and floor, wall and ceiling coverings in heading 3918)",99686895.0
201903,392071,"Plates, sheets, film, foil and strip, of non-cellular regenerated cellulose, not reinforced, laminated, supported or similarly combined with other materials, without backing, unworked or merely surface-worked or merely cut into squares or rectangles (excluding self-adhesive products, and floor, wall and ceiling coverings of heading 3918)",19950254.0
201903,392073,"Plates, sheets, film, foil and strip, of non-cellular cellulose acetates, not reinforced, laminated, supported or similarly combined with other materials, without backing, unworked or merely surface-worked or merely cut into squares or rectangles (excluding self-adhesive products, and floor, wall and ceiling coverings of heading 3918)",28267653.0
201903,392079,"Plates, sheets, film, foil and strip, of non-cellular cellulose derivatives, not reinforced, laminated, supported or similarly combined with other materials, without backing, unworked or merely surface-worked or merely cut into squares or rectangles (excluding products of cellulose acetates, self-adhesive products, floor, wall and ceiling coverings of heading 3918)",6828085.0
201903,392091,"Plates, sheets, film, foil and strip, of non-cellular polyvinyl butyral"", not reinforced, laminated, supported or similarly combined with other materials, without backing, unworked or merely surface-worked or merely cut into squares or rectangles (excluding self-adhesive products, floor, wall and ceiling coverings of heading 3918)""",109972091.0
201903,392092,"Plates, sheets, film, foil and strip, of non-cellular polyamides, not reinforced, laminated, supported or similarly combined with other materials, without backing, unworked or merely surface-worked or merely cut into squares or rectangles (excluding self-adhesive products, floor, wall and ceiling coverings of heading 3918)",78870525.0
201903,392093,"Plates, sheets, film, foil and strip, of non-cellular amino-resins, not reinforced, laminated, supported or similarly combined with other materials, without backing, unworked or merely surface-worked or merely cut into squares or rectangles (excluding self-adhesive products, floor, wall and ceiling coverings of heading 3918)",5469409.0
201903,392094,"Plates, sheets, film, foil and strip, of non-cellular phenolic resins, not reinforced, laminated, supported or similarly combined with other materials, without backing, unworked or merely surface-worked or merely cut into squares or rectangles (excluding self-adhesive products, floor, wall and ceiling coverings of heading 3918)",42723095.0
201903,392099,"Plates, sheets, film, foil and strip, of non-cellular plastics, n.e.s., not reinforced, laminated, supported or similarly combined with other materials, without backing, unworked or merely surface-worked or merely cut into squares or rectangles (excluding self-adhesive products, floor, wall and ceiling coverings of heading 3918 and sterile surgical or dental adhesion barriers of subheading 3006.10.30)",529251252.0
201903,392111,"Plates, sheets, film, foil and strip, of polymers of styrene",50395260.0
201903,392112,"Plates, sheets, film, foil and strip, of polymers of vinyl chloride",271962577.0
201903,392113,"Plates, sheets, film, foil and strip, of polyurethanes",233207126.0
201903,392114,"Plates, sheets, film, foil and strip, of regenerated cellulose",10030594.0
201903,392119,"Plates, sheets, film, foil and strip, of other plastics",239488138.0
201903,392190,"Plates, sheets, film, foil and strip, (excluding of cellular plastic; self-adhesive products, floor, wall and ceiling coverings of heading 3918)",636221855.0
201903,392210,"Baths, showerbaths, sinks and washbasins",181916453.0
201903,392220,Lavatory seats and covers,183304147.0
201903,392290,"Bidets, lavatory pans, flushing cisterns and similar sanitary ware, of plastics (excluding baths, shower-baths, sinks, washbasins, lavatory seats and covers)",120819524.0
201903,392310,"Boxes, cases, crates and similar articles",827984444.0
201903,392321,"Sacks and bags, incl. cones, of polymers of ethylene",1506707187.0
201903,392329,"Sacks and bags, incl. cones, of other plastics",722062968.0
201903,392330,"Carboys, bottles, flasks and similar articles",734061271.0
201903,392340,"Spools, cops, bobbins and similar supports",91937428.0
201903,392350,"Stoppers, lids, caps and other closures",697361059.0
201903,392390,"Articles for the conveyance or packaging of goods, of plastics (excluding boxes, cases, crates and similar articles; sacks and bags, incl. cones; carboys, bottles, flasks and similar articles; spools, spindles, bobbins and similar supports; stoppers, lids, caps and other closures)",693780498.0
201903,392410,Tableware and kitchenware,2862169234.0
201903,392490,"Household articles and toilet articles, of plastics (excluding tableware, kitchenware, baths, shower-baths, washbasins, bidets, lavatory pans, seats and covers, flushing cisterns and similar sanitary ware)",1892623136.0
201903,392510,"Reservoirs, tanks, vats and similar containers, of a capacity exceeding 300 l",25282379.0
201903,392520,"Doors, windows and their frames and thresholds for doors",152147790.0
201903,392530,"Shutters, blinds (including Venetian blinds) and similar articles and parts thereof",259675000.0
201903,392590,Other,668554425.0
201903,392610,Office or school supplies,577860353.0
201903,392620,"Articles of apparel and clothing accessories (including gloves, mittens and mitts)",1075793011.0
201903,392630,"Fittings for furniture, coachwork or the like",226645269.0
201903,392640,Statuettes and other ornamental articles,1284191558.0
201903,392690,"Articles of plastics and articles of other materials of heading 3901 to 3914, n.e.s (excluding goods of 9619)",7192338851.0
201903,400110,"Natural rubber latex, whether or not prevulcanised",442699.0
201903,400121,Smoked sheets,5185682.0
201903,400122,Technically specified natural rubber (TSNR),3615239.0
201903,400129,"Natural rubber in primary forms or in plates, sheets or strip (excluding smoked sheets, technically specified natural rubber TSNR"" and natural rubber latex, whether or not prevulcanised)""",1523682.0
201903,400130,"Balata, guttapercha, guayule, chicle and similar natural gums",445481.0
201903,400211,Latex,19989237.0
201903,400219,"Styrene-butadiene rubber SBR""; carboxylated styrene-butadiene rubber ""XSBR"", in primary forms or in plates, sheets or strip (excluding latex)""",77630206.0
201903,400220,Butadiene rubber (BR),46920414.0
201903,400231,Isobuteneisoprene (butyl) rubber (IIR),6790691.0
201903,400239,"Halo-isobutene-isoprene rubber CIIR"" or ""BIIR"", in primary forms or in plates, sheets or strip""",16215567.0
201903,400241,"Chloroprene latex chlorobutadiene rubber, CR""""",19757.0
