Date of data,Commodity code,Commodity,Renminbi Yuan
201903,740829,"Wire of copper alloys (other than copper-zinc alloys [brass], copper-nickel alloys [cupro-nickel] or copper-nickel-zinc alloys [nickel silver])",17859872.0
201903,740911,"Plates, sheets and strip, of refined copper, in coils, of a thickness of > 0,15 mm",67090163.0
201903,740919,"Plates, sheets and strip, of refined copper, not in coils, of a thickness of > 0,15 mm",13282895.0
201903,740921,"Plates, sheets and strip, of copper-zinc base alloys brass"", of a thickness of > 0","15 mm, in coils"""
201903,740929,"Plates, sheets and strip, of copper-zinc base alloys brass"", of a thickness of > 0","15 mm, not in coils"""
201903,740931,"Plates, sheets and strip, of copper-tin base alloys bronze"", of a thickness of > 0","15 mm, in coils"""
201903,740939,"Plates, sheets and strip, of copper-tin base alloys bronze"", of a thickness of > 0","15 mm, not in coils"""
201903,740940,"Plates, sheets and strip, of copper-nickel base alloys cupro-nickel"" or copper-nickel-zinc base alloys ""nickel silver"", of a thickness of > 0","15 mm, not in coils"""
201903,740990,"Plates, sheets and strip, of copper alloys, of a thickness of > 0,15 mm, other",27773633.0
201903,741011,"Refined copper foil, not backed, of a thickness of ≤ 0,15 mm",164860418.0
201903,741012,"Copper alloy foil, not backed, of a thickness of ≤ 0,15 mm",20374338.0
201903,741021,"Refined copper foil, backed, of a thickness excluding any backing"" of ≤ 0","15 mm"""
201903,741022,"Copper alloy foil, backed, of a thickness excluding any backing"" of ≤ 0","15 mm"""
201903,741110,Tubes and pipes of refined copper,811963591.0
201903,741121,"Tubes and pipes of copper-zinc base alloys brass""""",69359352.0
201903,741122,"Tubes and pipes of copper-nickel base alloys cupro-nickel"" or copper-nickel-zinc base alloys ""nickel silver""""",24798081.0
201903,741129,"Tubes and pipes of copper alloys (excluding copper-zinc base alloys brass"", copper-nickel base alloys ""cupro-nickel"" and copper-nickel-zinc base alloys ""nickel silver"")""",4647028.0
201903,741210,"Refined copper tube or pipe fittings e.g., couplings, elbows, sleeves""""",85588294.0
201903,741220,"Copper alloy tube or pipe fittings e.g., couplings, elbows, sleeves""""",355399087.0
201903,741300,"Stranded wire, cables, plaited bands and the like, of copper, not electrically insulated.",42570255.0
201903,741510,"Nails and tacks, drawing pins, staples and similar articles",1311857.0
201903,741521,"Washers, incl. spring washers and spring lock washers"", of copper""",10212147.0
201903,741529,"Rivets, cotters, cotter pins and the like, not threaded, of copper (excluding spring washers and spring lock washers)",8958092.0
201903,741533,"Screws, bolts, nuts and similar articles, threaded, of copper (other than screw hooks, ring- and eyebolts, lag screws, plugs, bungs and the like, with screw thread)",39481883.0
201903,741539,"Screw hooks, screw rings and the like, threaded, of copper (excluding standard screws and bolts and nuts)",3882849.0
201903,741810,"Table, kitchen or other household articles and parts thereof; pot scourers and scouring or polishing pads, gloves and the like",4784932.0
201903,741820,Sanitary ware and parts thereof,91422249.0
201903,741910,"Chain and parts thereof, of copper (excluding watch chains, necklace chains and the like)",1925330.0
201903,741991,"Articles of copper, cast, moulded, stamped or forged, but not further worked, n.e.s.",32026460.0
201903,741999,"Articles of copper, n.e.s.",119862792.0
201903,750210,"Nickel, not alloyed",81527181.0
201903,750220,Nickel alloys,5270.0
201903,750300,Nickel waste and scrap.,4395359.0
201903,750400,Nickel powders and flakes.,19543682.0
201903,750511,"Bars, rods, profiles and wire, of non-alloy nickel, n.e.s.",929282.0
201903,750512,"Bars, rods, profiles and wire, of nickel alloys, n.e.s.",28538171.0
201903,750521,Wire of non-alloy nickel,476856.0
201903,750522,Wire of nickel alloys,14436284.0
201903,750610,"Plates, sheets, strip and foil, of non-alloy nickel",9926126.0
201903,750620,"Plates, sheets, strip and foil, of nickel alloys",10079189.0
201903,750711,Tubes and pipes of non-alloy nickel,762700.0
201903,750712,Tubes and pipes of nickel alloys,20728843.0
201903,750720,"Tube or pipe fittings, of nickel",534545.0
201903,750810,"Cloth, grill, netting and fencing, of nickel wire",4801097.0
201903,750890,"Articles of nickel, n.e.s.",22497727.0
201903,760110,"Aluminium, not alloyed",273766583.0
201903,760120,Aluminium alloys,653026938.0
201903,760200,Aluminium waste and scrap.,1834305.0
201903,760310,"Powders of aluminium, of non-lamellar structure",21416919.0
201903,760320,"Powders of aluminium, of lamellar structure, and flakes of aluminium",1444780.0
201903,760410,"Bars, rods and profiles, of non-alloy aluminium, n.e.s.",7970932.0
201903,760421,"Hollow profiles of aluminium alloys, n.e.s.",824148778.0
201903,760429,"Bars, rods and solid profiles, of aluminium alloys, n.e.s.",785227681.0
201903,760511,"Wire of non-alloy aluminium, with a maximum cross-sectional dimension of > 7 mm",21047560.0
201903,760519,"Wire of non-alloy aluminium, with a maximum cross-sectional dimension of ≤ 7 mm",14007410.0
201903,760521,"Wire of aluminium alloys, with a maximum cross-sectional dimension of > 7 mm",18673746.0
201903,760529,"Wire, of aluminium alloys, having a maximum cross-sectional dimension of ≤ 7 mm",30303596.0
201903,760611,"Plates, sheets and strip, of non-alloy aluminium, of a thickness exceeding 0.2 mm, square or rectangular",1006021915.0
201903,760612,"Plates, sheets and strip, of aluminium alloys, of a thickness exceeding 0.2 mm, square or rectangular",2754836076.0
201903,760691,"Plates, sheets and strip, of non-alloy aluminium, of a thickness exceeding 0.2 mm",110792983.0
201903,760692,"Plates, sheets and strip, of aluminium alloys, of a thickness exceeding 0.2 mm , other",147847320.0
201903,760711,"Aluminium foil, not backed, rolled but not further worked, of a thickness not exceeding 0.2 mm. (excluding stamping foils of heading 3212, and foil made up as christmas tree decorating material)",1500991721.0
201903,760719,"Aluminium foil, not backed, rolled and further worked, of a thickness not exceeding 0.2 mm. (excluding stamping foils of heading 3212, and foil made up as christmas tree decorating material)",723433555.0
201903,760720,"Aluminium foil, backed, of a thickness (excluding any backing) not exceeding 0.2 mm.(excluding stamping foils of heading 3212, and foil made up as christmas tree decorating material)",403784878.0
201903,760810,Tubes and pipes of non-alloy aluminium,29365856.0
201903,760820,Tubes and pipes of aluminium alloys,218036572.0
201903,760900,"Aluminium tube or pipe fittings (for example, couplings, elbows, sleeves).",133148009.0
201903,761010,"Doors, windows and their frames and thresholds for doors",527063256.0
201903,761090,"Structures and parts of structures, of aluminium, n.e.s., and plates, rods, profiles, tubes and the like, prepared for use in structures, of aluminium, n.e.s.",1458035702.0
201903,761100,"Aluminium reservoirs, tanks, vats and similar containers, for any material (other than compressed or liquefied gas), of a capacity exceeding 300 l, whether or not lined or heatinsulated, but not fitted with mechanical or thermal equipment.",3831343.0
201903,761210,"Collapsible tubular containers, of aluminium",14034366.0
201903,761290,"Casks, drums, cans, boxes and similar containers, incl. rigid tubular containers, of aluminium, for any material (other than compressed or liquefied gas), of a capacity of ≤ 300 l, n.e.s.",114038517.0
201903,761300,Aluminium containers for compressed or liquefied gas.,24585258.0
201903,761410,"Stranded wire, cables, plaited bands and the like, of aluminium, with steel core, not electrically insulated",166559311.0
201903,761490,"Stranded wires, cables, ropes and similar articles, of aluminium (other than with steel core and electrically insulated products)",167330146.0
201903,761510,"Table, kitchen or other household articles and parts thereof; pot scourers and scouring or polishing pads, gloves and the like",1134388535.0
201903,761520,Sanitary ware and parts thereof,18968717.0
201903,761610,"Nails, tacks, staples (other than those of heading 83.05), screws, bolts, nuts, screw hooks, rivets, cotters, cotterpins, washers and similar articles",46739433.0
201903,761691,"Cloth, grill, netting and fencing, of aluminium wire",34663109.0
201903,761699,Unwrought lead (excluding refined lead and lead containing by weight antimony as the principal other element),1619294750.0
201903,780110,"Unwrought lead, refined",1062994.0
201903,780191,"Unwrought lead, containing by weight antimony as the principal other element",132087.0
201903,780199,Unwrought lead (excluding refined lead and lead containing by weight antimony as the principal other element),448215.0
201903,780411,"Sheets, strip and foil of a thickness (excluding any backing) not exceeding 0.2 mm",250759.0
201903,780419,"Lead plates; lead sheets, strip and foil, of a thickness (excluding any backing) exceeding 0,2 mm",4311117.0
201903,780420,Powders and flakes,76656.0
201903,780600,Other articles of lead.,11934905.0
201903,790111,"Unwrought zinc, not alloyed, containing by weight 99.99% or more of zinc",20746667.0
201903,790112,"Unwrought zinc, not alloyed, containing by weight less than 99.99% of zinc",27500.0
201903,790120,Unwrought zinc alloys,4191826.0
201903,790310,Zinc dust,186775.0
201903,790390,Zinc powders and flakes,1299526.0
201903,790400,"Zinc bars, rods, profiles and wire.",9801025.0
201903,790500,"Zinc plates, sheets, strip and foil.",2057504.0
201903,790700,Other articles of zinc.,62777415.0
201903,800110,"Unwrought tin, not alloyed",84021695.0
201903,800120,"Unwrought tin, alloys",4286.0
201903,800300,"Tin bars, rods, profiles and wire.",5786180.0
201903,800700,Other articles of tin.,15913893.0
201903,810110,Tungsten powders,36963906.0
201903,810194,"Unwrought tungsten, incl. bars and rods of tungsten obtained simply by sintering",21504061.0
201903,810196,"Tungsten bars and rods (other than those obtained simply by sintering), profiles, plates, sheets, strip and foil, n.e.s.",21730216.0
201903,810197,Tungsten wire,2387763.0
201903,810199,Tungsten waste and scrap (excluding ash and residues containing tungsten),43306007.0
201903,810210,Molybdenum powders,4614561.0
201903,810294,"Unwrought molybdenum, incl. bars and rods obtained simply by sintering",44139676.0
201903,810295,"Molybdenum bars and rods (other than those obtained simply by sintering), profiles, plates, sheets, strip and foil, n.e.s.",14037391.0
201903,810296,Molybdenum wire,7609607.0
201903,810297,Molybdenum waste and scrap (excluding ash and residues containing molybdenum),21179884.0
201903,810299,"Articles of molybdenum, n.e.s.",5051256.0
201903,810320,"Unwrought tantalum, including bars and rods obtained simply by sintering; powders",14059527.0
201903,810330,Tantalum waste and scrap (excluding ash and residues containing tantalum),2048108.0
201903,810390,"Articles of tantalum, n.e.s.",89517519.0
201903,810411,"Unwrought magnesium, containing ≥ 99,8% by weight of magnesium",379739251.0
201903,810419,"Unwrought magnesium, containing < 99,8% by weight of magnesium",207847526.0
201903,810420,Magnesium waste and scrap,7557972.0
201903,810430,"Magnesium raspings, turnings and granules, graded according to size; magnesium powders",149777735.0
201903,810490,"Articles of magnesium, n.e.s.",20131649.0
201903,810520,Cobalt mattes and other intermediate products of cobalt metallurgy; unwrought cobalt; powders,68756550.0
201903,810590,"Articles of cobalt, n.e.s.",2346490.0
201903,810600,"Bismuth and articles thereof, including waste and scrap.",25581252.0
201903,810720,Unwrought cadmium; powders,11828136.0
201903,810790,"Articles of cadmium, n.e.s.",845454.0
201903,810820,Unwrought titanium; powders,3917147.0
201903,810890,"Articles of titanium, n.e.s.",256699560.0
201903,810920,Unwrought zirconium; powders,2744490.0
201903,810990,"Articles of zirconium, n.e.s.",3219120.0
201903,811010,Unwrought antimony; powders,56683086.0
201903,811100,"Manganese and articles thereof, including waste and scrap.",570874930.0
201903,811219,"Articles of beryllium, n.e.s.",11427.0
201903,811221,Unwrought chromium; chromium powders,7478481.0
201903,811229,"Articles of chromium, n.e.s.",7713578.0
201903,811292,"Unwrought hafnium (celtium), niobium (columbium), rhenium, gallium, indium, vanadium and germanium; powders and waste and scrap of these metals (excluding ash and residues containing these metals)",63151514.0
201903,811299,"Articles of hafnium (celtium), niobium (columbium), rhenium, gallium, indium, vanadium and germanium, n.e.s.",68101512.0
201903,811300,"Cermets and articles thereof, including waste and scrap.",40790149.0
201903,820110,Spades and shovels,97809930.0
201903,820130,"Mattocks, picks, hoes and rakes",71255811.0
201903,820140,"Axes, bill hooks and similar hewing tools",31866579.0
201903,820150,Secateurs and similar onehanded pruners and shears (including poultry shears),36934960.0
201903,820160,"Hedge shears, twohanded pruning shears and similar twohanded shears",34595254.0
201903,820190,"Other hand tools of a kind used in agriculture, horticulture or forestry",41320114.0
201903,820210,Hand saws,54585550.0
201903,820220,Band saw blades,21913111.0
201903,820231,"Circular saw blades, incl. slitting or slotting saw blades, of base metal, with working parts of steel",86588972.0
201903,820239,"Circular saw blades, incl. slitting or slotting saw blades, and parts thereof, of base metal, with working parts of materials other than steel",311928811.0
201903,820240,Chain saw blades,34964013.0
201903,820291,"Straight saw blades, for working metal",11378515.0
201903,820299,"Saw blades, incl. toothless saw blades, of base metal (excluding bandsaw blades, circular saw blades, slitting or slotting saw blades, chainsaw blades and straight saw blades for working metal)",99383803.0
201903,820310,"Files, rasps and similar tools",21449592.0
201903,820320,"Pliers (including cutting pliers), pincers, tweezers and similar tools",291880829.0
201903,820330,Metal cutting shears and similar tools,21481478.0
201903,820340,"Pipecutters, bolt croppers, perforating punches and similar tools",16221972.0
201903,820411,"Hand-operated spanners and wrenches, incl. torque meter wrenches, of base metal, non-adjustable",224726059.0
201903,820412,"Hand-operated spanners and wrenches, incl. torque meter wrenches, of base metal, adjustable (excluding tap wrenches)",108332708.0
201903,820420,"Interchangeable spanner sockets, with or without handles",114004365.0
201903,820510,"Drilling, threading or tapping tools",7490356.0
201903,820520,Hammers and sledge hammers,101917749.0
201903,820530,"Planes, chisels, gouges and similar cutting tools for working wood",32203310.0
201903,820540,Screwdrivers,140305495.0
201903,820551,"Household hand tools, non-mechanical, with working parts of base metal, n.e.s.",296008473.0
201903,820559,"Hand tools, incl. glaziers' diamonds, of base metal, n.e.s.",378198610.0
201903,820560,Blow lamps,3200937.0
201903,820570,"Vices, clamps and the like",84049723.0
201903,820590,"Other, including sets of articles of two or more of  subheadings of this heading",55718097.0
201903,820600,"Tools of two or more of the headings 82.02 to 82.05, put up in sets for retail sale.",315391241.0
201903,820713,"Rock-drilling or earth-boring tools, interchangeable, with working parts of sintered metal carbides or cermets",27224089.0
201903,820719,"Rock-drilling or earth-boring tools, interchangeable, and parts therefor, with working parts of materials other than sintered metal carbide or cermets",288361491.0
201903,820720,Dies for drawing or extruding metal,44688125.0
201903,820730,"Tools for pressing, stamping or punching",575346202.0
201903,820740,Tools for tapping or threading,47666668.0
201903,820750,"Tools for drilling, other than for rock drilling",571143558.0
201903,820760,Tools for boring or broaching,9205741.0
201903,820770,Tools for milling,112414524.0
201903,820780,Tools for turning,26099886.0
201903,820790,Other interchangeable tools,188889139.0
201903,820810,"Knives and cutting blades, of base metal, for machines or for mechanical appliances, for metalworking",121945847.0
201903,820820,"Knives and cutting blades, of base metal, for machines or for mechanical appliances, for wood-working",20093397.0
201903,820830,"Knives and cutting blades, of base metal, for kitchen appliances or for machines used by the food industry",7139211.0
201903,820840,"Knives and cutting blades, of base metal, for agricultural, horticultural or forestry machines (excluding those for wood-working)",21150069.0
201903,820890,"Knives and cutting blades, of base metal, for machines or for mechanical appliances (excluding those for metal or wood-working, kitchen appliances or machines used by the food industry and those for agricultural, horticultural or forestry machines)",52055124.0
201903,820900,"Plates, sticks, tips and the like for tools, unmounted, of cermets.",371785978.0
201903,821000,"Hand-operated mechanical appliances, weighing 10 kg or less, used in the preparation, conditioning or serving of food or drink.",89165963.0
201903,821110,Sets of assorted articles,155474641.0
201903,821191,Table knives having fixed blades,52036822.0
201903,821192,Other knives having fixed blades,188386355.0
201903,821193,Knives having other than fixed blades,105500560.0
201903,821194,"Blades of base metal for table knives, pocket knives and other knives of heading 8211",17094157.0
201903,821195,Handles of base metal,809902.0
201903,821210,Razors,158652103.0
201903,821220,"Safety razor blades, including razor blade blanks in strips",39802735.0
201903,821290,Parts of non-electric razors of base metal (excluding safety razor blades and razor blade blanks in strips),30028225.0
201903,821300,"Scissors, tailors' shears and similar shears, and blades therefor.",220930446.0
201903,821410,"Paper knives, letter openers, erasing knives, pencil sharpeners and blades therefor",58917491.0
201903,821420,Manicure or pedicure sets and instruments (including nail files),89522830.0
201903,821490,"Hair clippers, butchers' or kitchen cleavers and other articles of cutlery of base metal, n.e.s.",87477203.0
201903,821510,Sets of assorted articles containing at least one article plated with precious metal,2261585.0
201903,821520,Other sets of assorted articles,258039682.0
201903,821591,Plated with precious metal,941753.0
201903,821599,"Spoons, forks, ladles, skimmers, cake-servers, fish-knives, butter-knives, sugar tongs and similar kitchen or tableware of base metal, not plated with precious metal (excluding sets of articles such as lobster cutters and poultry shears)",438331468.0
201903,830110,Padlocks,263145710.0
201903,830120,Locks of a kind used for motor vehicles,221768500.0
201903,830130,Locks of a kind used for furniture,94338788.0
201903,830140,Other locks,800690455.0
201903,830150,"Clasps and frames with clasps, incorporating locks",14211954.0
201903,830160,"Parts of padlocks, locks, clasps and frames with clasps, incorporating locks, of base metal, n.e.s.",380979304.0
201903,830170,Keys presented separately,20871876.0
201903,830210,"Hinges of all kinds, of base metal",633552213.0
201903,830220,Castors with mountings of base metal,162215065.0
201903,830230,"Base metal mountings, fittings and similar articles suitable for motor vehicles (excluding hinges and castors)",41271051.0
201903,830241,Base metal mountings and fittings suitable for buildings (excluding locks with keys and hinges),1085908294.0
201903,830242,"Base metal mountings, fittings and similar articles suitable for furniture (excluding locks with keys, hinges and castors)",1231890226.0
201903,830249,"Base metal mountings, fittings and similar articles (excluding locks with keys, clasps and frames with clasps incorporating locks, hinges, castors and mountings and fittings suitable for buildings, motor vehicles or furniture)",405795257.0
201903,830250,"Hat-racks, hat-pegs, brackets and similar fixtures of base metal",367359786.0
201903,830260,Automatic door closers of base metal,163960230.0
201903,830300,"Armoured or reinforced safes, strongboxes and doors and safe deposit lockers for strongrooms, cash or deed boxes and the like, of base metal",187190507.0
201903,830400,"Filing cabinets, cardindex cabinets, paper trays, paper rests, pen trays, officestamp stands and similar office or desk equipment, of base metal, other than office furniture of heading 9403",79506673.0
201903,830510,"Fittings for loose-leaf binders or files, of base metal (excluding drawing pins and clasps for books or registers)",64483505.0
201903,830520,"Staples in strips, of base metal",79139677.0
201903,830590,"Office articles such as letter clips, letter corners, paper clips and indexing tags, of base metal, incl. parts of articles of heading 8305 (excluding fittings for loose-leaf binders or files, staples in strips, drawing pins and clasps for books or registers)",102059769.0
201903,830610,"Bells, gongs and the like, non-electric, of base metal",31766126.0
201903,830621,"Statuettes and other ornaments, of base metal, plated with precious metal",2651880.0
201903,830629,"Statuettes and other ornaments, of base metal, not plated with precious metal",522556790.0
201903,830630,"Photograph, picture or similar frames, of base metal; mirrors of base metal",51452145.0
201903,830710,"Flexible tubing of iron or steel, with or without fittings",129143834.0
201903,830790,"Flexible tubing of base metal other than iron or steel, with or without fittings",16364497.0
201903,830810,"Hooks, eyes and eyelets, of base metal, of a kind used for clothing, footwear, awnings, handbags, travel goods or other made-up articles",307067662.0
201903,830820,"Tubular or bifurcated rivets, of base metal",75177909.0
201903,830890,"Clasps, frames with clasps without locks, buckles and buckle-clasps, of base metal, for clothing, footwear, handbags, travel goods or other made-up articles, incl. parts of articles of heading 8308, of base metal (excluding hooks, eyes, eyelets and tubular or bifurcated rivets)",62781856.0
201903,830910,Crown corks of base metal,3877522.0
201903,830990,"Stoppers, caps and lids, incl. screw caps and pouring stoppers, capsules for bottles, threaded bungs, bung covers, seals and other packing accessories of base metal (excluding crow corks)",335049917.0
201903,831000,"Signplates, nameplates, addressplates and similar plates, numbers, letters and other symbols, of base metal, excluding those of heading 9405",91933381.0
201903,831110,"Coated electrodes of base metal, for electric arc-welding",204375163.0
201903,831120,"Cored wire of base metal, for electric arc-welding",76133555.0
201903,831130,"Coated rods and cored wire, of base metal, for soldering, brazing or welding by flame (excluding wire and rods cored with solder which, excluding the flux material, contains ≥ 2% by weight of precious metal)",167298013.0
201903,831190,"Wire, rods, tubes, plates, electrodes and the like, of base metal or of metal carbides, coated or cored with flux material, for soldering, brazing, welding or deposition of metal or metal carbides, n.e.s., and wire and rods of agglomerated base metal powder, for metal spraying, n.e.s.",9719883.0
201903,840130,"Fuel elements (cartridges), nonirradiated",9135366.0
201903,840140,Parts of nuclear reactors,2007634.0
201903,840211,Watertube boilers with a steam production exceeding 45 t per hour,90229247.0
201903,840212,Watertube boilers with a steam production not exceeding 45 t per hour,58601769.0
201903,840219,"Other vapour generating boilers, including hybrid boilers",77566580.0
201903,840220,Superheated water boilers,79235.0
201903,840290,"Parts of vapour generating boilers and superheated water boilers, n.e.s.",418978937.0
201903,840310,"Central heating boilers, non-electric (excluding vapour generating boilers and superheated water boilers of heading 8402)",17944661.0
201903,840390,"Parts of central heating boilers, n.e.s.",64333080.0
201903,840410,Auxiliary plant for use with boilers of heading 84.02 or 84.03,51790979.0
201903,840420,Condensers for steam or other vapour power units,3680989.0
201903,840490,"Parts of auxiliary plant of heading 8402 or 8403 and condensers for steam or other vapour power units, n.e.s.",96123285.0
201903,840510,"Producer gas or water gas generators, with or without their purifiers; acetylene gas generators and similar water process gas generators, with or without their purifiers",5320145.0
201903,840590,"Parts of producer gas or water gas generators and acetylene gas generators or similar water process gas generators, n.e.s.",5386529.0
201903,840681,"Turbines, of an output exceeding 40 MW",158698.0
201903,840682,"Turbines, of an output not exceeding 40 MW",26857299.0
201903,840690,"Parts of steam and other vapour turbines, n.e.s.",225992193.0
201903,840710,"Spark-ignition reciprocating or rotary internal combustion piston engine, for aircraft",33171.0
201903,840721,Spark-ignition outboard motors for marine propulsion,126993970.0
201903,840729,"Spark-ignition reciprocating or rotary engines, for marine propulsion (excluding outboard motors)",51682.0
201903,840731,"Spark-ignition reciprocating piston engine, of a kind used for the propulsion of vehicles of chapter 87, of a cylinder capacity ≤ 50 ml",25280310.0
201903,840732,"Spark-ignition reciprocating piston engine, of a kind used for the propulsion of vehicles of chapter 87, Of a cylinder capacity exceeding 50 cc but not exceeding 250 cc",90868840.0
201903,840733,"Spark-ignition reciprocating piston engine, of a kind used for the propulsion of vehicles of chapter 87, Of a cylinder capacity exceeding 250 cc but not exceeding 1,000 cc",113942733.0
