Date of data,Commodity code,Commodity,Renminbi Yuan
202606,340420,Waxes of poly(oxyethylene) (polyethylene glycol),246515631.0
202606,340490,Other artificial waxes and prepared waxes,228432529.0
202606,340510,"Polishes, creams and similar preparations for footwear or leather",29036199.0
202606,340520,"Polishes, creams and similar preparations for the maintenance of wooden furniture, floors or other woodwork",9117654.0
202606,340530,"Polishes and similar preparations for coachwork, other than metal polishes",38094992.0
202606,340540,Scouring pastes and powders and other scouring preparations,14115831.0
202606,340590,"Glass or metal polishes, whether or not in the form of paper, wadding, felt, nonwovens, cellular plastics or cellular rubber, impregnated, coated or covered with such preparations",62381197.0
202606,340600,"Candles, tapers and the like",570827882.0
202606,340700,"Modelling pastes, including those put up for children's amusement; preparations known as “dental wax”or as “dental impression compounds”, put up in sets, in packings for retail sale or in plates, horseshoe shapes, sticks or similar forms; other preparations for use in dentistry, with a basis of plaster (of calcined gypsum or calcium sulphate).",364340175.0
202606,350110,Casein,1367557.0
202606,350190,"Caseinates and other casein derivatives; casein glues (excluding those put up for retail sale as glue and weighing ≤ 1 kg, and organic or inorganic compounds of mercury whether or not chemically defined)",1131104.0
202606,350211,Dried egg albumin,1431678.0
202606,350219,Egg albumin (excluding dried),81358.0
202606,350220,"Milk albumin, including concentrates of two or more whey proteins",341984.0
202606,350290,"Albumins, albuminates and other albumin derivatives (excluding egg albumin and milk albumin [incl. concentrates of two or more whey proteins containing by weight ＞ 80% whey proteins, calculated on the dry matter], and organic or inorganic compounds of mercury whether or not chemically defined)",1194715.0
202606,350300,"Gelatin (including gelatin in rectangular (including square) sheets, whether or not surfaceworked or coloured) and gelatin derivatives; isinglass; other glues of animal origin, excluding casein glues of heading 35.01.",200361931.0
202606,350400,"Peptones and their derivatives; other protein substances and their derivatives, not elsewhere specified or included; hide powder, whether or not chromed.",563833033.0
202606,350510,Dextrins and other modified starches,173304928.0
202606,350520,"Glues based on starches, dextrins or other modified starches",14462524.0
202606,350610,"Products suitable for use as glues or adhesives, put up for retail sale as glues or adhesives, not exceeding a net weight of 1 kg",813404929.0
202606,350691,Adhesives based on polymers of headings 39.01 to 39.13 or on rubber,1395610581.0
202606,350699,"Glues, prepared, and other prepared adhesives, n.e.s.",393416956.0
202606,350710,Rennet and concentrates thereof,684910.0
202606,350790,"Enzymes and prepared enzymes, n.e.s. (excluding rennet and concentrates thereof)",424325409.0
202606,360100,Propellent powders,10626932.0
202606,360200,"Prepared explosives, other than propellent powders",14382398.0
202606,360320,Detonating cords,3818084.0
202606,360340,Detonating caps,29742821.0
202606,360350,Igniters,8240229.0
202606,360360,Electric detonators,13178428.0
202606,360410,Fireworks,345278681.0
202606,360490,"Signalling flares, rain rockets, fog signals and other pyrotechnic articles (excluding fireworks and cartridge blanks)",3062935.0
202606,360500,"Matches, other than pyrotechnic articles of heading 36.04.",7862251.0
202606,360610,Liquid or liquefiedgas fuels in containers of a kind used for filling or refilling cigarette or similar lighters and of a capacity not exceeding 300 cm3,10495655.0
202606,360690,Ferro-cerium and other pyrophoricalloys and other articles of combustible materials,7854656.0
202606,370110,"Photographic plates and film in the flat, sensitised, unexposed, for X-ray (excluding of paper, paperboard and textiles)",39663474.0
202606,370120,Instant print film,11233175.0
202606,370130,"Other plates and film, with any side exceeding 255 mm",717304484.0
202606,370191,"Photographic plates and film in the flat, sensitised, unexposed, of any material other than paper, paperboard or textiles, for colour photography polychrome"" (excluding instant print film)""",810274.0
202606,370199,"Photographic plates and film in the flat for monochrome photography, sensitised, unexposed, of any material other than paper, paperboard or textiles (excluding X-ray film and photographic plates, film in the flat with any side ＞ 255 mm, and instant print film)",12892112.0
202606,370210,"Photographic film in rolls, unexposed, for X-ray",2264305.0
202606,370231,"Photographic film in rolls, unexposed, for colour photography (polychrome)",1517086.0
202606,370232,"Other films with silver halide emulsion, width≤105mm",7433.0
202606,370239,"Photographic film incl. instant print film"", sensitised, in rolls, unexposed, without perforations, width ≤ 105 mm, for monochrome photography (excluding film with silver halide emulsion, film made of paper, paperboard or textiles and X-ray film)""",51500.0
202606,370242,"Other films for non-colour photography (polychrome),width＞610 mm and length＞200m",81084973.0
202606,370243,"Other films,width＞610 mm and length＞200m",10587391.0
202606,370244,"Other films,105mm＜width≤610mm",27825913.0
202606,370252,"Other film, for colour photography (polychrome) , of a width not exceeding 16 mm",3557.0
202606,370253,"Other film, for colour photography (polychrome) , of a width exceeding 16 mm but not exceeding 35 mm and of a length not exceeding 30 m, for slides",272318.0
202606,370254,"Other film, for colour photography (polychrome) , of a width exceeding 16 mm but not exceeding 35 mm and of a length not exceeding 30 m, other than for slides",6145958.0
202606,370255,"Other film, for colour photography (polychrome) , of a width exceeding 16 mm but not exceeding 35 mm and of a length exceeding 30 m",8837.0
202606,370256,"Other film, for colour photography (polychrome) , of a width exceeding 35 mm",60264.0
202606,370296,Other film of a width not exceeding 35 mm and of a length not exceeding 30 m,578573.0
202606,370298,Other film of a width exceeding 35 mm,91721.0
202606,370310,In rolls of a width exceeding 610 mm,13908862.0
202606,370320,"Other, for colour photography (polychrome)",31823587.0
202606,370390,"Photographic paper, paperboard and textiles, sensitised, unexposed, for monochrome photography (excluding products in rolls ＞ 610 mm wide)",5440368.0
202606,370400,"Photographic plates, film, paper, paperboard and textiles, exposed but not developed",363299.0
202606,370500,"Photographic plates and film, exposed and developed, other than cinematographic film.",862425.0
202606,370690,"Cinematographic film, exposed and developed, whether or not incorporating soundtrack or consisting only of soundtrack, width ＜ 35 mm",9029.0
202606,370710,Sensitising emulsions,16066824.0
202606,370790,"Preparation of chemicals, incl. unmixed products put up in measured portions or put up for retail sale in a form ready for use (excluding varnishes, glues, adhesives and similar preparations, sensitising emulsions and salts and precious-metal compounds etc. of heading 2843 to 2846)",134229751.0
202606,380110,Artificial graphite,377736411.0
202606,380120,Colloidal or semicolloidal graphite,228629.0
202606,380130,Carbonaceous pastes for electrodes and similar pastes for furnace linings,135141477.0
202606,380190,"Preparations based on graphite or other carbon in the form of pastes, blocks, plates or other semi-manufactures (excluding carbonaceous pastes for electrodes and similar pastes for furnace linings)",260090881.0
202606,380210,Activated carbon,332403091.0
202606,380290,"Activated kieselguhr and other activated natural mineral products; animal black, whether or not spent (excluding activated carbon, calcinated diatomite without the addition of sintering agents and activated chemical products)",50670192.0
202606,380300,"Tall oil, whether or not refined.",305715.0
202606,380400,"Residual lyes from the manufacture of wood pulp, whether or not concentrated, desugared or chemically treated, including lignin sulphonates, but excluding tall oil of heading 38.03.",12131108.0
202606,380510,"Gum, wood or sulphate turpentine oils",874709.0
202606,380590,"Crude dipentene; sulphite turpentine and other crude para-cymene; terpenic oils produced by the distillation or other treatment of coniferous woods (excluding gum turpentine, wood turpentine and sulphate turpentine)",8100457.0
202606,380610,Rosin and resin acids,19735099.0
202606,380620,"Salts of rosin, of resin acids or of derivatives of rosin or resin acids, other than salts of rosin adducts",1359514.0
202606,380630,Ester gums,17402258.0
202606,380690,"Derivatives of rosin, incl. salts of rosin adducts, and of resin acids, light and heavy resin oils and modified natural resins obtained by heat treatment run gums"" (excluding salts of rosin, of resin acids or salts of derivatives of rosin or resin acids, and ester gums)""",89284551.0
202606,380700,"Wood tar; wood tar oils; wood creosote; wood naphtha; vegetable pitch; brewers' pitch and similar preparations based on rosin, resin acids or on vegetable pitch.",12518339.0
202606,380859,Other goods specified in Subheading Note 1 of Chapter 38,41576.0
202606,380861,"Articles under subheading note 2 of this chapter, in packings of a net weight content not exceeding 300 g",13099.0
202606,380862,"Articles under subheading note 2 of this chapter, in packings of a net weight content exceeding 300 g but not exceeding 7.5 kg",21274464.0
202606,380869,"Articles under subheading note 2 of this chapter, in packings of a net weight content exceeding7.5 kg",61387942.0
202606,380891,Insecticides,1918703560.0
202606,380892,Fungicides,898628137.0
202606,380893,"Herbicides, antisprouting products and plantgrowth regulators",4833798926.0
202606,380894,Disinfectants,231025823.0
202606,380899,"Articles under heading 38.08,nes",52700113.0
202606,380910,"Finishing agents and the like,used in textile, paper,lether and the similar industries,with a basis of amylaceous substances",2053053.0
202606,380991,"Other finishing agents and like, of a kind used in the textile or like industries",65857730.0
202606,380992,"Other finishing agents and like, of a kind used in the paper or like industries",43417507.0
202606,380993,"Other finishing agents and like, of a kind used in the leather or like industries",11537540.0
202606,381010,"Pickling preparations for metal surfaces; soldering, brazing or welding powders and pastes consisting of metal and other materials",110237565.0
202606,381090,"Fluxes and other auxiliary preparations for soldering, brazing or welding;preparations of a kind used as cores or coatings for welding electrodes or rods",68657281.0
202606,381111,"Anti-knock preparations,based on lead compounds",6873528.0
202606,381119,Anti-knock preparations for motor fuels (excluding those based on lead compounds),141784.0
202606,381121,"Additives for lubricating oils,containing petroleum oils or oils obtained from bituminous minerals",538997693.0
202606,381129,Other additives for lubricating oils,13216236.0
202606,381190,"Oxidation inhibitors, gum inhibitors, viscosity improvers, anti-corrosive preparations and other prepared additives for mineral oils, incl. gasoline, or for other liquids used for the same purposes as mineral oils (excluding anti-knock preparations and oil lubricant additives)",38032001.0
202606,381210,Prepared rubber accelerators,327043003.0
202606,381220,Compound plasticisers for rubber or plastics,69953455.0
202606,381231,"Mixtures of oligomers of 2,2,4trimethyl1,2dihydroquinoline (TMQ)",78313253.0
202606,381239,"Anti-oxidising preparations and other compound stabilisers for rubber or plastics (excl. mixtures of oligomers of 2,2,4-trimethyl-1,2-dihydroquinoline TMQ"")""",435395965.0
202606,381300,Preparations and charges for fireextinguishers; charged fireextinguishing grenades,44109991.0
202606,381400,"Organic composite solvents and thinners, not elsewhere specified or included; prepared paint or varnish removers.",59578904.0
202606,381511,Supported catalysts with nickel or nickel compounds as the active substance,41470936.0
202606,381512,Supported catalysts with precious metal or precious metal compounds as the active substance,145443656.0
202606,381519,"Supported catalysts, n.e.s. (excluding with precious metal, a precious-metal compound, nickel or a nickel compound as the active substance)",411511446.0
202606,381590,"Reaction initiators, reaction accelerators and catalytic preparations, n.e.s. (excluding rubber accelerators and supported catalysts)",156156550.0
202606,381600,"Refractory cements, mortars, concretes and similar compositions, other than products of heading 38.01",355501508.0
202606,381700,"Mixed alkylbenzenes and mixed alkylnaphthalenes, other than those of heading 27.07 or 29.02.",354147523.0
202606,381800,"Chemical elements doped for use in electronics, in the form of discs, wafers or similar forms; chemical compounds doped for use in electronics",1692266012.0
202606,381900,"Hydraulic brake fluids and other prepared liquids for hydraulictransmission, not containing or containing less than 70% byweight of petroleum oils or oils obtained from bituminousminerals.",24304646.0
202606,382000,Antifreezing preparations and prepared deicing fluids.,66669726.0
202606,382100,"Prepared culture media for the development or maintenance of microorganisms (including viruses and the like) or of plant, human or animal cells.",51265758.0
202606,382211,"Diagnostic or laboratory reagents on a backing, prepared diagnostic or laboratory reagents, for malaria",5350290.0
202606,382212,"Diagnostic or laboratory reagents on a backing, prepared diagnostic or laboratory reagents whether or not on a backing, for Zika and other diseases transmitted by mosquitoes of the genus Aedes",507608.0
202606,382213,"Diagnostic or laboratory reagents on a backing, prepared diagnostic or laboratory reagents whether or not on a backing, for blood-grouping",809411.0
202606,382219,"Other diagnostic or laboratory reagents attached to backing and dispensing reagents, whether or not attached to backing",1434911994.0
202606,382290,Certified reference sample,120109246.0
202606,382311,Stearic acid,55848448.0
202606,382312,Oleic acid,34050576.0
202606,382313,Tall oil fatty acids,1368239.0
202606,382319,"Fatty acids, industrial, monocarboxylic; acid oils from refining (excluding stearic acid, oleic acid and tall oil fatty acids)",25675674.0
202606,382370,Industrial fatty alcohols,10491313.0
202606,382410,Prepared binders for foundry moulds or cores,39674650.0
202606,382430,Nonagglomerated metal carbides mixed together or with metallic binders,114810994.0
202606,382440,"Prepared additives for cements, mortars or concretes",334175549.0
202606,382450,Nonrefractory mortars and concretes,38171759.0
202606,382460,Sorbitol other than that of subheading 2905.44,12561267.0
202606,382481,"Goods specified in subheading note 3 to chapter 38, containing oxirane (ethylene oxide)",109600.0
202606,382491,"Mixtures and preparations consisting mainly of (5ethyl2methyl2oxido1,3,2dioxaphosphinan5yl)methyl methyl methylphosphonate and bis[(5ethyl2methyl2oxido1,3,2dioxaphosphinan5yl)methyl] methylphosphonate",547798.0
202606,382492,Polyglycol esters of methylphosphonic acid,158521.0
202606,382499,"Chemical products and preparations of the chemical or allied industries, incl. those consisting of mixtures of natural products, n.e.s.",6085581287.0
202606,382530,Clinical waste,20846.0
202606,382561,Mainly containing organic constituents,1293181.0
202606,382569,"Wastes from chemical or allied industries (excluding wastes of metal pickling liquors, of hydraulic fluids, brake fluids and anti-freeze fluids and those mainly containing organic constituents)",364490.0
202606,382590,"Residual products of the chemical or allied industries, nes (excluding waste)",3633654.0
202606,382600,"Biodiesel and mixtures thereof, not containing or containing less than 70% by weight of petroleum oils or oils obtained from bituminous minerals.",817267716.0
202606,382731,Mixtures containing substances of subheadings 2903.41 to 2903.48,697632.0
202606,382732,"Other mixtures, containing substances of subheadings 2903.71 to 2903.75",274015.0
202606,382751,Mixtures containing trifluoromethane (HFC-23),182305.0
202606,382761,"Mixtures containing 15 % or more by mass of 1,1,1-trifluoroethane (HFC-143a)",134109464.0
202606,382762,"Other mixtures, not included in the subheading above, containing 55 % or more by mass of pentafluoroethane (HFC- 125) but not containing unsaturated fluorinated derivatives of acyclic hydrocarbons (HFOs)",2892451.0
202606,382763,"Other mixtures, not included in the subheadings above, containing 40 % or more by mass of pentafluoroethane (HFC-125)",223225979.0
202606,382764,"Other mixtures, not included in the subheadings above, containing 30 % or more by mass of 1,1,1,2-tetrafluoroethane (HFC-134a) but not containing unsaturated fluorinated derivatives of acyclic hydrocarbons (HFOs)",35085513.0
202606,382765,"Other mixtures, not included in the subheadings above, containing 20 % or more by mass of difluoromethane (HFC-32) and 20 % or more by mass of pentafluoroethane (HFC-125)",20430941.0
202606,382768,"Other mixtures, not included in the subheadings above, containing substances of subheadings 2903.41 to 2903.48",25996810.0
202606,382769,"Mixtures containing hydrofluorocarbons (HFCs) but not perchlorofluorocarbons (CFCs) or hydrochlorofluorocarbons (HCFCs),nes",137.0
202606,390110,Polyethylene having a specific gravity of less than 0.94,896437219.0
202606,390120,Polyethylene having a specific gravity of 0.94 or more,1775969492.0
202606,390130,Ethylenevinyl acetate copolymers,468214483.0
202606,390140,"Ethylenealphaolefin copolymers, having a specific gravity of less than 0.94",1129464318.0
202606,390190,"Polymers of ethylene, in primary forms (excluding polyethylene and ethylene-vinyl acetate copolymers)",724941230.0
202606,390210,Polypropylene,3227861145.0
202606,390220,Polyisobutylene,42048956.0
202606,390230,Propylene copolymers,583985885.0
202606,390290,"Polymers of propylene or of other olefins, in primary forms (excluding polypropylene, polyisobutylene and propylene copolymers)",98637580.0
202606,390311,"Expansible polystyrene, in primary forms",434501772.0
202606,390319,"Polystyrene, in primary forms (excluding expansible)",489261306.0
202606,390320,Styreneacrylonitrile (SAN) copolymers,81102964.0
202606,390330,Acrylonitrilebutadienestyrene (ABS) copolymers,696555203.0
202606,390390,"Polymers of styrene, in primary forms (excluding polystyrene, styrene-acrylonitrile copolymers SAN"" and acrylonitrile-butadiene-styrene ""ABS"")""",249182850.0
202606,390410,"Poly(vinyl chloride), not mixed with any other substances",1628119100.0
202606,390421,Nonplasticised,61158355.0
202606,390422,Plasticised,230533644.0
202606,390430,Vinyl chloridevinyl acetate copolymers,36789829.0
202606,390440,Other vinyl chloride copolymers,34602677.0
202606,390450,Vinylidene chloride polymers,24831201.0
202606,390461,Polytetrafluoroethylene,162243624.0
202606,390469,"Fluoropolymers of vinyl chloride or of other halogenated olefins, in primary forms (excluding polytetrafluoroethylene)",328939221.0
202606,390490,"Polymers of vinyl chloride or other halogenated olefins, in primary forms (excluding polyvinyl chloride"", copolymers of vinyl chloride, polymers of vinyl chloride and fluoropolymers)""",12387723.0
202606,390512,"Polyvinyl acetate"", in aqueous dispersion""",9554150.0
202606,390519,"Polyvinyl acetate"", in primary forms (excluding in aqueous dispersion)""",5781434.0
202606,390521,"Vinyl acetate copolymers, in aqueous dispersion",41081246.0
202606,390529,"Vinyl acetate copolymers, in primary forms (excluding in aqueous dispersion)",128918513.0
202606,390530,"Poly(vinyl alcohol), whether or not containing unhydrolysed acetate groups",343230206.0
202606,390591,Copolymers,41572561.0
202606,390599,"Polymers of vinyl esters and other vinyl polymers, in primary forms (excluding those of vinyl chloride or other halogenated olefins, polyvinyl acetate"", vinyl acetate copolymers and poly""vinyl alcohol"", whether or not containing unhydrolised acetate groups)""",136469412.0
202606,390610,"Polymethyl methacrylate"", in primary forms""",100818925.0
202606,390690,"Acrylic polymers, in primary forms (excluding polymethyl methacrylate"")""",2082596605.0
202606,390710,Polyacetals,58692528.0
202606,390721,"Bis(polyoxyethylene) methylphosphonate, in primary forms",4028553.0
202606,390729,"Other polyethers, in primary forms",2769879784.0
202606,390730,Epoxide resins,438496544.0
202606,390740,Polycarbonates,1099578943.0
202606,390750,Alkyd resins,26864826.0
202606,390761,"Polyethylene terephthalate"", in primary forms, having a viscosity number of 78 ml/g or higher""",3921095142.0
202606,390769,"Polyethylene terephthalate"", in primary forms, having a viscosity number of ＜ 78 ml/g""",1355516417.0
202606,390770,Poly(lactic acid) in primary forms,44898062.0
202606,390791,Unsaturated polyesters in primary forms,273554165.0
202606,390799,"Saturated polyesters in primary forms (excluding polycarbonates, alkyd resins, polyethylene terephthalate"" and poly""lactic acid"")""",1106688462.0
202606,390810,"Polyamide6, 11, 12, 6,6, 6,9, 6,10 or 6,12 ,in primary forms",1587367797.0
202606,390890,"Polyamides, in primary forms (excluding polyamides-6, -11, -12, -6,6, -6,9, -6,10 and -6,12)",338330841.0
202606,390910,"Urea resins and thiourea resins, in primary forms",72164488.0
202606,390920,Melamine resins,67291282.0
202606,390931,"Poly(methylene phenyl isocyanate) (crude MDI, polymeric MDI) ,in primary forms",1692161842.0
202606,390939,"Amino-resins, in primary forms (excl. urea, thiourea and melamine resins and MDI)",3700104.0
202606,390940,"Phenolic resins,in primary forms",178261892.0
202606,390950,"Polyurethanes,in primary forms",746365691.0
202606,391000,Silicones in primary forms,821754684.0
202606,391110,"Petroleum resins, coumarone, indene or coumaroneindene resins and polyterpenes",633967715.0
202606,391190,"Polysulphides, polysulphones and other polymers and prepolymers produced by chemical synthesis, nes, in primary forms",523280418.0
202606,391211,"Nonplasticised cellulose acetates,in primary forms",26524999.0
202606,391212,"Plasticised cellulose acetates,in primary forms",304061.0
202606,391220,"Cellulose nitrates (including collodions), in primary forms",88507828.0
202606,391231,"Carboxymethylcellulose and its salts,in primary forms",175285629.0
202606,391239,"Cellulose ethers, in primary forms (excluding carboxymethylcellulose and its salts)",408000183.0
202606,391290,"Cellulose and chemical derivatives thereof, n.e.s., in primary forms (excluding cellulose acetates, cellulose nitrates and cellulose ethers)",144073884.0
202606,391310,"Alginic acid, its salts and esters,in primary forms",930707.0
202606,391390,"Natural polymers and modified natural polymers, e.g. hardened proteins, chemical derivatives of natural rubber, n.e.s., in primary forms (excluding alginic acid and its salts and esters)",542289515.0
202606,391400,"Ionexchangers based on polymers of headings 39.01 to 39.13, in primary forms",259324559.0
202606,391510,"Waste, parings and scrap, of polymers of ethylene",273557.0
202606,391520,"Waste, parings and scrap, of polymers of styrene",481.0
202606,391530,"Waste, parings and scrap, of polymers of vinyl chloride",1363750.0
202606,391590,"Waste, parings and scrap, of other plastics",6390418.0
202606,391610,Monofilament of polymers of ethylene,68002270.0
202606,391620,Monofilament of polymers of vinyl chloride,292326824.0
202606,391690,Monofilament of other plastics,1054969183.0
202606,391710,Artificial guts (sausage casings) of hardened protein or of cellulosic materials,108937588.0
202606,391721,"Rigid tubes, pipes and hoses, of polymers of ethylene",328326201.0
202606,391722,"Rigid tubes, pipes and hoses, of polymers of propylene",98004815.0
202606,391723,"Rigid tubes, pipes and hoses, of polymers of vinyl chloride",241124806.0
202606,391729,"Rigid tubes, pipes and hoses, of other plastics",181416796.0
202606,391731,"Flexible tubes, pipes and hoses, having a minimum burst pressure of 27.6 Mpa",267754572.0
202606,391732,"Other plastic tubes, not reinforced or otherwise combined with other materials,without fittings",353360036.0
202606,391733,"Other plastic tubes, not reinforced or otherwise combined with other materials,with fittings",196198078.0
202606,391739,"Flexible tubes, pipes and hoses, of plastics, reinforced or otherwise combined with other materials (excluding those with a burst pressure of ≥ 27,6 MPa)",1086341014.0
202606,391740,"Fittings for tubes, of plastic",792112089.0
202606,391810,"Wall or floor coverings, of polymers of vinyl chloride",2702458346.0
202606,391890,"Wall or floor coverings, of other plastics",1232384731.0
202606,391910,"Self-adhesive plates, sheets, film, foil, tape, strip and other flat shapes, of plastics, in rolls ≤ 20 cm wide",1467206042.0
202606,391990,"Self-adhesive plates, sheets, film, foil, tape, strip and other flat shapes, of plastics, whether or not in rolls ＞ 20 cm wide (excluding floor, wall and ceiling coverings of heading 3918)",3588796031.0
202606,392010,"Plates, sheets, film, foil and strip, of non-cellular polymers of ethylene, not reinforced, laminated, supported or similarly combined with other materials, without backing, unworked or merely surface-worked or merely cut into squares or rectangles (excluding self-adhesive products, and floor, wall and ceiling coverings of heading 3918)",2959572847.0
