Date of data,Commodity code,Commodity,Renminbi Yuan
201903,600536,"Unbleached or bleached warp knit fabrics of synthetic fibres incl. those made on galloon knitting machines"", of a width of > 30 cm""",73639472.0
201903,600537,"Dyed warp knit fabrics of synthetic fibres incl. those made on galloon knitting machines"", of a width of > 30 cm""",406539842.0
201903,600538,"Warp knit fabrics of synthetic fibres, of yarns of different colours incl. those made on galloon knitting machines"", of a width of > 30 cm""",22218405.0
201903,600539,"Printed warp knit fabrics of synthetic fibres incl. those made on galloon knitting machines"", of a width of > 30 cm""",38882930.0
201903,600541,"Unbleached or bleached warp knit fabrics of artificial fibres incl. those made on galloon knitting machines"", of a width of > 30 cm""",871124.0
201903,600542,"Dyed warp knit fabrics of artificial fibres incl. those made on galloon knitting machines"", of a width of > 30 cm""",2901483.0
201903,600543,"Warp knit fabrics of artificial fibres, of yarns of different colours incl. those made on galloon knitting machines"", of a width of > 30 cm""",1529.0
201903,600590,"Warp knit fabrics incl. those made on galloon knitting machines"", of a width of > 30 cm""",2503548.0
201903,600610,"Fabrics, knitted or crocheted, of a width of > 30 cm, of wool or fine animal hair",5335132.0
201903,600621,"Unbleached or bleached cotton fabrics, knitted or crocheted, of a width of > 30 cm",114709327.0
201903,600622,"Dyed cotton fabrics, knitted or crocheted, of a width of > 30 cm",1239864122.0
201903,600623,"Cotton fabrics, knitted or crocheted, of yarns of different colours, of a width of > 30 cm",267473026.0
201903,600624,"Printed cotton fabrics, knitted or crocheted, of a width of > 30 cm",192282337.0
201903,600631,"Unbleached or bleached fabrics, knitted or crocheted, of synthetic fibres, of a width of > 30 cm",138463954.0
201903,600632,"Dyed fabrics, knitted or crocheted, of synthetic fibres, of a width of > 30 cm",2164161683.0
201903,600633,"Fabrics, knitted or crocheted, of synthetic fibres, of yarns of different colours, of a width of > 30 cm",158780640.0
201903,600634,"Printed fabrics, knitted or crocheted, of synthetic fibres, of a width of > 30 cm",267179796.0
201903,600641,"Unbleached or bleached fabrics, knitted or crocheted, of artificial fibres, of a width of > 30 cm",5206809.0
201903,600642,"Dyed fabrics, knitted or crocheted, of artificial fibres, of a width of > 30 cm",305004012.0
201903,600643,"Fabrics, knitted or crocheted, of artificial fibres, of yarns of different colours, of a width of > 30 cm",20038316.0
201903,600644,"Printed fabrics, knitted or crocheted, of artificial fibres, of a width of > 30 cm",37646028.0
201903,600690,"Fabrics, knitted or crocheted, of a width of > 30 cm",48415601.0
201903,610120,"Overcoats, car coats, capes, cloaks, anoraks, incl. ski jackets, windcheaters, wind-jackets and similar articles of cotton, for men or boys, knitted or crocheted",15679935.0
201903,610130,"Overcoats, car coats, capes, cloaks, anoraks, incl. ski jackets, windcheaters, wind-jackets and similar articles of man-made fibres, for men or boys, knitted or crocheted",38679052.0
201903,610190,"Overcoats, car coats, capes, cloaks, anoraks, incl. ski jackets, windcheaters, wind-jackets and similar articles of textile materials, for men or boys, knitted or crocheted",1192548.0
201903,610210,"Women's or girls' overcoats, car coats, capes, cloaks, anoraks, incl. ski jackets, windcheaters, wind-jackets and similar articles, of wool or fine animal hair, knitted or crocheted",1271913.0
201903,610220,"Women's or girls' overcoats, car coats, capes, cloaks, anoraks, incl. ski jackets, windcheaters, wind-jackets and similar articles of cotton, knitted or crocheted",11340083.0
201903,610230,"Women's or girls' overcoats, car coats, capes, cloaks, anoraks, incl. ski jackets, windcheaters, wind-jackets and similar articles of man-made fibres, knitted or crocheted",44755810.0
201903,610290,"Women's or girls' overcoats, car coats, capes, cloaks, anoraks, incl. ski jackets, windcheaters, wind-jackets and similar articles, of textile materials, knitted or crocheted",1945264.0
201903,610310,"Men's or boys' suits of textile materials, knitted or crocheted",1950503.0
201903,610322,"Men's or boys' ensembles of cotton, knitted or crocheted",55829892.0
201903,610323,"Men's or boys' ensembles of synthetic fibres, knitted or crocheted",36969745.0
201903,610329,Men's or boys' ensembles of textile materials,282772.0
201903,610331,"Men's or boys' jackets and blazers of wool or fine animal hair, knitted or crocheted",5205303.0
201903,610332,"Men's or boys' jackets and blazers of cotton, knitted or crocheted",462712060.0
201903,610333,"Men's or boys' jackets and blazers of synthetic fibres, knitted or crocheted",180148352.0
201903,610339,Men's or boys' jackets and blazers of textile materials,3763168.0
201903,610341,"Men's or boys' trousers, bib and brace overalls, breeches and shorts of wool or fine animal hair, knitted or crocheted",5757187.0
201903,610342,"Men's or boys' trousers, bib and brace overalls, breeches and shorts of cotton, knitted or crocheted",612240050.0
201903,610343,"Men's or boys' trousers, bib and brace overalls, breeches and shorts of synthetic fibres, knitted or crocheted",531435319.0
201903,610349,"Men's or boys' trousers, bib and brace overalls, breeches and shorts of textile materials, knitted or crocheted",7284954.0
201903,610413,"Women's or girls' suits of synthetic fibres, knitted or crocheted",145284.0
201903,610419,"Women's or girls' suits of textile materials, knitted or crocheted",276149.0
201903,610422,"Women's or girls' ensembles of cotton, knitted or crocheted",70262410.0
201903,610423,"Women's or girls' ensembles of synthetic fibres, knitted or crocheted",69726789.0
201903,610429,Women's or girls' ensembles of textile materials,7260032.0
201903,610431,"Women's or girls' jackets and blazers of wool or fine animal hair, knitted or crocheted",6040120.0
201903,610432,"Women's or girls' jackets and blazers of cotton, knitted or crocheted",1052763821.0
201903,610433,"Women's or girls' jackets and blazers of synthetic fibres, knitted or crocheted",369485565.0
201903,610439,"Women's or girls' jackets and blazers of textile materials, knitted or crocheted",45626521.0
201903,610441,"Women's or girls' dresses of wool or fine animal hair, knitted or crocheted",4468270.0
201903,610442,"Women's or girls' dresses of cotton, knitted or crocheted",407407674.0
201903,610443,"Women's or girls' dresses of synthetic fibres, knitted or crocheted",665202244.0
201903,610444,"Women's or girls' dresses of artificial fibres, knitted or crocheted",177147084.0
201903,610449,"Women's or girls' dresses of textile materials, knitted or crocheted",7890174.0
201903,610451,"Women's or girls' skirts and divided skirts of wool or fine animal hair, knitted or crocheted",621631.0
201903,610452,"Women's or girls' skirts and divided skirts of cotton, knitted or crocheted",195851084.0
201903,610453,"Women's or girls' skirts and divided skirts of synthetic fibres, knitted or crocheted",198564576.0
201903,610459,"Women's or girls' skirts and divided skirts of textile materials, knitted or crocheted",26169179.0
201903,610461,"Women's or girls' trousers, bib and brace overalls, breeches and shorts of wool or fine animal hair, knitted or crocheted",5537101.0
201903,610462,"Women's or girls' trousers, bib and brace overalls, breeches and shorts of cotton, knitted or crocheted",859284193.0
201903,610463,"Women's or girls' trousers, bib and brace overalls, breeches and shorts of synthetic fibres, knitted or crocheted",979164331.0
201903,610469,"Women's or girls' trousers, bib and brace overalls, breeches and shorts of textile materials, knitted or crocheted",87594189.0
201903,610510,"Men's or boys' shirts of cotton, knitted or crocheted (excluding nightshirts, T-shirts, singlets and other vests)",321130720.0
201903,610520,"Men's or boys' shirts of man-made fibres, knitted or crocheted (excluding nightshirts, T-shirts, singlets and other vests)",272678726.0
201903,610590,"Men's or boys' shirts of textile materials, knitted or crocheted (excluding of cotton or man-made fibres, nightshirts, T-shirts, singlets and other vests)",4254520.0
201903,610610,"Women's or girls' blouses, shirts and shirt-blouses of cotton, knitted or crocheted (excluding T-shirts and vests)",127503261.0
201903,610620,"Women's or girls' blouses, shirts and shirt-blouses of man-made fibres, knitted or crocheted (excluding T-shirts and vests)",68648087.0
201903,610690,"Women's or girls' blouses, shirts and shirt-blouses of textile materials, knitted or crocheted (excluding of cotton or man-made fibres, T-shirts and vests)",2028206.0
201903,610711,"Men's or boys' underpants and briefs of cotton, knitted or crocheted",474921321.0
201903,610712,"Men's or boys' underpants and briefs of man-made fibres, knitted or crocheted",300385000.0
201903,610719,"Men's or boys' underpants and briefs of other textile materials, knitted or crocheted (excluding of cotton or man-made fibres)",4270314.0
201903,610721,"Men's or boys' nightshirts and pyjamas of cotton, knitted or crocheted (excluding vests and singlets)",51792247.0
201903,610722,"Men's or boys' nightshirts and pyjamas of man-made fibres, knitted or crocheted (excluding vests and singlets)",71773230.0
201903,610729,"Men's or boys' nightshirts and pyjamas of textile materials, knitted or crocheted (excluding of cotton or man-made fibres, and vests and singlets)",1232145.0
201903,610791,"Men's or boys' bathrobes, dressing gowns and similar articles of cotton, knitted or crocheted",11527651.0
201903,610799,"Men's or boys' bathrobes, dressing gowns and similar articles of textile materials, knitted or crocheted (excluding of cotton)",29981641.0
201903,610811,"Women's or girls' slips and petticoats of man-made fibres, knitted or crocheted (excluding T-shirts and vests)",5275414.0
201903,610819,"Women's or girls' slips and petticoats of textile materials, knitted or crocheted (excluding man-made fibres, T-shirts and vests)",1008438.0
201903,610821,"Women's or girls' briefs and panties of cotton, knitted or crocheted",397152712.0
201903,610822,"Women's or girls' briefs and panties of man-made fibres, knitted or crocheted",517135139.0
201903,610829,"Women's or girls' briefs and panties of textile materials, knitted or crocheted (excluding cotton or man-made fibres)",4728766.0
201903,610831,"Women's or girls' nightdresses and pyjamas of cotton, knitted or crocheted (excluding T-shirts, vests and négligés)",168472323.0
201903,610832,"Women's or girls' nightdresses and pyjamas of man-made fibres, knitted or crocheted (excluding T-shirts, vests and négligés)",340333472.0
201903,610839,"Women's or girls' nightdresses and pyjamas of textile materials, knitted or crocheted (excluding of cotton and man-made fibres, T-shirts, vests and négligés)",7639980.0
201903,610891,"Women's or girls' négligés, bathrobes, dressing gowns, housejackets and similar articles of cotton, knitted or crocheted (excluding vests, slips, petticoats, briefs and panties, nightdresses, pyjamas, brassiéres, girdles, corsets and similar articles)",213041194.0
201903,610892,"Women's or girls' négligés, bathrobes, dressing gowns, housejackets and similar articles of man-made fibres, knitted or crocheted (excluding vests, slips, petticoats, briefs and panties, nightdresses, pyjamas, brassiéres, girdles, corsets and similar articles)",384742332.0
201903,610899,"Women's or girls' négligés, bathrobes, dressing gowns, housejackets and similar articles of textile materials, knitted or crocheted (excluding of cotton or man-made fibres, vests, slips, petticoats, briefs and panties, nightdresses, pyjamas, brassiéres, girdles, corsets and similar articles)",95137.0
201903,610910,"T-shirts, singlets and other vests of cotton, knitted or crocheted",2413926267.0
201903,610990,"T-shirts, singlets and other vests of textile materials, knitted or crocheted (excluding cotton)",2198943293.0
201903,611011,"Jerseys, pullovers, cardigans, waistcoats and similar articles, of hair of Kashmir cashmere"" goats, knitted or crocheted (excluding quilted articles)""",185052395.0
201903,611012,"Jerseys, pullovers, cardigans, waistcoats and similar articles, of fine animal hair, knitted or crocheted (excluding from hair of Kashmir cashmere"" goats and quilted articles)""",27891457.0
201903,611019,"Jerseys, pullovers, cardigans, waistcoats and similar articles, of cotton, knitted or crocheted (excluding wadded waistcoats)",26881557.0
201903,611020,"Jerseys, pullovers, cardigans, waistcoats and similar articles, of man-made fibres, knitted or crocheted (excluding wadded waistcoats)",1685054060.0
201903,611030,"Jerseys, pullovers, cardigans, waistcoats and similar articles, of textile materials, knitted or crocheted (excluding of wool, fine animal hair, cotton or man-made fibres, and wadded waistcoats)",2200908888.0
201903,611090,"bies' garments and clothing accessories, knitted or crocheted (excluding hats)",110312780.0
201903,611120,"Babies' garments and clothing accessories of cotton, knitted or crocheted (excluding hats)",626349077.0
201903,611130,"Babies' garments and clothing accessories of synthetic fibres, knitted or crocheted (excluding hats)",128064970.0
201903,611190,"Babies' garments and clothing accessories of textile materials, knitted or crocheted (excluding of cotton or synthetic fibres, and hats)",9212529.0
201903,611211,"Track-suits of cotton, knitted or crocheted",11114818.0
201903,611212,"Track-suits of synthetic fibres, knitted or crocheted",46404259.0
201903,611219,"Track-suits of textile materials, knitted or crocheted (excluding cotton or synthetic fibres)",474825.0
201903,611220,"Ski-suits, knitted or crocheted",166021.0
201903,611231,"Men's or boys' swimwear of synthetic fibres, knitted or crocheted",95326235.0
201903,611239,"Men's or boys' swimwear of textile materials, knitted or crocheted (excluding synthetic fibres)",318873.0
201903,611241,"Women's or girls' swimwear of synthetic fibres, knitted or crocheted",1146837803.0
201903,611249,"Women's or girls' swimwear of textile materials, knitted or crocheted (excluding synthetic fibres)",4181268.0
201903,611300,"Garments, knitted or crocheted, rubberised or impregnated, coated or covered with plastics or other materials (excluding babies' garments and clothing accessories)",53625923.0
201903,611420,Of cotton,121171635.0
201903,611430,Of manmade fibres,437859842.0
201903,611490,Of other textile materials,14988088.0
201903,611510,"Graduated compression hosiery [e.g., stockings for varicose veins], of textile materials, knitted or crocheted (excluding hosiery for babies)",4058483.0
201903,611521,"Pantyhose and tights of synthetic fibres, knitted or crocheted, measuring per single yarn < 67 decitex (excluding graduated compression hosiery)",112217492.0
201903,611522,"Pantyhose and tights of synthetic fibres, knitted or crocheted, measuring per single yarn ≥ 67 decitex (excluding graduated compression hosiery)",31651684.0
201903,611529,"Pantyhose and tights of textile materials, knitted or crocheted (excluding graduated compression hosiery, those of synthetic fibres and hosiery for babies)",32502183.0
201903,611530,"Women's full-length or knee-length hosiery, knitted or crocheted, measuring per single yarn < 67 decitex (excluding graduated compression hosiery, pantyhose and tights)",23480535.0
201903,611594,"Full-length or knee-length stockings, socks and other hosiery, incl. footwear without applied soles, of wool or fine animal hair, knitted or crocheted (excluding graduated compression hosiery, pantyhose and tights, women's full-length or knee-length stockings, measuring per single yarn < 67 decitex, and hosiery for babies)",3198897.0
201903,611595,"Full-length or knee-length stockings, socks and other hosiery, incl. footwear without applied soles, of cotton, knitted or crocheted (excluding graduated compression hosiery, pantyhose and tights, women's full-length or knee-length stockings, measuring per single yarn < 67 decitex, and hosiery for babies)",1040284628.0
201903,611596,"Full-length or knee-length stockings, socks and other hosiery, incl. footwear without applied soles, of synthetic fibres, knitted or crocheted (excluding graduated compression hosiery, pantyhose and tights, women's full-length or knee-length stockings, measuring per single yarn < 67 decitex, and hosiery for babies)",1083783655.0
201903,611599,"Full-length or knee-length stockings, socks and other hosiery, incl. footwear without applied soles, of textile materials, knitted or crocheted (excluding of wool, fine animal hair, cotton or synthetic fibres, graduated compression hosiery, pantyhose and tights, women's full-length or knee-length stockings, measuring per single yarn < 67 decitex, and hosiery for babies)",29141710.0
201903,611610,"Gloves, mittens and mitts, impregnated, coated or covered with plastics or rubber, knitted or crocheted",615370672.0
201903,611691,"Gloves, mittens and mitts, of wool or fine animal hair, knitted or crocheted (excluding for babies)",11634348.0
201903,611692,"Gloves, mittens and mitts, of cotton, knitted or crocheted (excluding impregnated, coated or covered with plastics or rubber, and for babies)",382901825.0
201903,611693,"Gloves, mittens and mitts, of synthetic fibres, knitted or crocheted (excluding impregnated, coated or covered with plastics or rubber, and for babies)",197556419.0
201903,611699,"Gloves, mittens and mitts, of textile materials, knitted or crocheted (excluding of wool, fine animal hair, cotton or synthetic fibres, impregnated, coated or covered with plastics or rubber, and for babies)",27313779.0
201903,611710,"Shawls, scarves, mufflers, mantillas, veils and the like, knitted or crocheted",262100672.0
201903,611780,"Ties, bow ties, cravats and other made-up clothing accessories, knitted or crocheted, n.e.s. (excluding shawls, scarves, mufflers, mantillas, veils and the like)",127471881.0
201903,611790,"Parts of garments or clothing accessories, knitted or crocheted, n.e.s.",185478419.0
201903,620111,"Men's or boys' overcoats, raincoats, car coats, capes, cloaks and similar articles, of wool or fine animal hair",10526769.0
201903,620112,"Men's or boys' overcoats, raincoats, car coats, capes, cloaks and similar articles, of cotton",67466378.0
201903,620113,"Men's or boys' overcoats, raincoats, car coats, capes, cloaks and similar articles, of man-made fibres",117507631.0
201903,620119,"Men's or boys' overcoats, raincoats, car coats, capes, cloaks and similar articles, of textile materials (excluding of wool or fine animal hair, cotton or man-made fibres, knitted or crocheted)",1360638.0
201903,620191,"Men's or boys' anoraks, incl. ski jackets, windcheaters, wind-jackets and similar articles, of wool or fine animal hair (excluding knitted or crocheted, suits, ensembles, jackets, blazers and trousers)",3049509.0
201903,620192,"Men's or boys' anoraks, windcheaters, wind jackets and similar articles, of cotton (not knitted or crocheted and excluding suits, ensembles, jackets, blazers, trousers and tops of ski suits)",170772564.0
201903,620193,"Men's or boys' anoraks, windcheaters, wind jackets and similar articles, of man-made fibres (not knitted or crocheted and excluding suits, ensembles, jackets, blazers, trousers and tops of ski suits)",409135466.0
201903,620199,"Men's or boys' anoraks, incl. ski jackets, windcheaters, wind-jackets and similar articles of textile materials (excluding of wool, fine animal hair, cotton or man-made fibres, knitted or crocheted, suits, ensembles, jackets, blazers and trousers)",6183591.0
201903,620211,"Women's or girls' overcoats, raincoats, car coats, capes, cloaks and similar articles, of wool or fine animal hair",41427778.0
201903,620212,"Women's or girls' overcoats, raincoats, car coats, capes, cloaks and similar articles, of cotton",96553281.0
201903,620213,"Women's or girls' overcoats, raincoats, car coats, capes, cloaks and similar articles, of man-made fibres",240527920.0
201903,620219,"Women's or girls' overcoats, raincoats, car coats, capes, cloaks and similar articles, of textile materials (excluding of wool or fine animal hair, cotton or man-made fibres, knitted or crocheted)",17136780.0
201903,620291,"Women's or girls' anoraks, incl. ski jackets, windcheaters, wind-jackets and similar articles, of wool or fine animal hair (excluding knitted or crocheted, suits, ensembles, jackets, blazers and trousers)",2608072.0
201903,620292,"Women's or girls' anoraks, windcheaters, wind jackets and similar articles, of cotton (not knitted or crocheted and excluding suits, ensembles, jackets, blazers, trousers and tops of ski suits)",120971664.0
201903,620293,"Women's or girls' anoraks, windcheaters, wind jackets and similar articles, of man-made fibres (not knitted or crocheted and excluding suits, ensembles, jackets, blazers, trousers and tops of ski suits)",458839640.0
201903,620299,"Women's or girls' anoraks, incl. ski jackets, windcheaters, wind-jackets and similar articles, of textile materials (excluding of wool, fine animal hair, cotton or man-made fibres, knitted or crocheted, suits, ensembles, jackets, blazers and trousers)",5333604.0
201903,620311,"Men's or boys' suits of wool or fine animal hair (excluding knitted or crocheted, tracksuits, ski suits and swimwear)",252020718.0
201903,620312,"Men's or boys' suits of synthetic fibres (excluding knitted or crocheted, tracksuits, ski suits and swimwear)",118678200.0
201903,620319,"Men's or boys' suits of textile materials (excluding of wool, fine animal hair or synthetic fibres, knitted or crocheted, tracksuits, ski suits and swimwear)",10189101.0
201903,620322,"Men's or boys' ensembles of cotton (excluding knitted or crocheted, ski ensembles and swimwear)",48866961.0
201903,620323,"Men's or boys' ensembles of synthetic fibres (excluding knitted or crocheted, ski ensembles and swimwear)",64506268.0
201903,620329,"Men's or boys' ensembles of textile materials (excluding of cotton or synthetic fibres, knitted or crocheted, ski ensembles and swimwear)",6701184.0
201903,620331,"Men's or boys' jackets and blazers of wool or fine animal hair (excluding knitted or crocheted, and wind-jackets and similar articles)",117777678.0
201903,620332,"Men's or boys' jackets and blazers of cotton (excluding knitted or crocheted, and wind-jackets and similar articles)",507641097.0
201903,620333,"Men's or boys' jackets and blazers of synthetic fibres (excluding knitted or crocheted, and wind-jackets and similar articles)",461489036.0
201903,620339,"Men's or boys' jackets and blazers of textile materials (excluding of wool, fine animal hair, cotton or synthetic fibres, knitted or crocheted, and wind-jackets and similar articles)",371991419.0
201903,620341,"Men's or boys' trousers, bib and brace overalls, breeches and shorts, of wool or fine animal hair (excluding knitted or crocheted, underpants and swimwear)",70485231.0
201903,620342,"Men's or boys' trousers, bib and brace overalls, breeches and shorts, of cotton (excluding knitted or crocheted, underpants and swimwear)",1940691026.0
201903,620343,"Men's or boys' trousers, bib and brace overalls, breeches and shorts of synthetic fibres (excluding knitted or crocheted, underpants and swimwear)",1099090410.0
201903,620349,"Men's or boys' trousers, bib and brace overalls, breeches and shorts of textile materials (excluding of wool, fine animal hair, cotton or synthetic fibres, knitted or crocheted, underpants and swimwear)",73387401.0
201903,620411,"Women's or girls' suits of wool or fine animal hair (excluding knitted or crocheted, ski overalls and swimwear)",1102749.0
201903,620412,"Women's or girls' suits of cotton (excluding knitted or crocheted, ski overalls and swimwear)",609026.0
201903,620413,"Women's or girls' suits of synthetic fibres (excluding knitted or crocheted, ski overalls and swimwear)",5248103.0
201903,620419,"Women's or girls' suits of textile materials (excluding of wool, fine animal hair, cotton or synthetic fibres, knitted or crocheted, ski overalls and swimwear)",109041.0
201903,620421,"Women's or girls' ensembles of wool or fine animal hair (excluding knitted or crocheted, ski overalls and swimwear)",400633.0
201903,620422,"Women's or girls' ensembles of cotton (excluding knitted or crocheted, ski overalls and swimwear)",63859060.0
201903,620423,"Women's or girls' ensembles of synthetic fibres (excluding knitted or crocheted, ski overalls and swimwear)",45994924.0
201903,620429,"Women's or girls' ensembles of textile materials (excluding of wool, fine animal hair, cotton or synthetic fibres, knitted or crocheted, ski overalls and swimwear)",4411182.0
201903,620431,"Women's or girls' jackets and blazers of wool or fine animal hair (excluding knitted or crocheted, wind-jackets and similar articles)",15725283.0
201903,620432,"Women's or girls' jackets and blazers of cotton (excluding knitted or crocheted, wind-jackets and similar articles)",1450286729.0
201903,620433,"Women's or girls' jackets and blazers of synthetic fibres (excluding knitted or crocheted, wind-jackets and similar articles)",1021835816.0
201903,620439,"Women's or girls' jackets and blazers of textile materials (excluding of wool, fine animal hair, cotton or synthetic fibres, knitted or crocheted, wind-jackets and similar articles)",252904297.0
201903,620441,Women's or girls' dresses of wool or fine animal hair (excluding knitted or crocheted and petticoats),772011.0
201903,620442,Women's or girls' dresses of cotton (excluding knitted or crocheted and petticoats),606563536.0
201903,620443,Women's or girls' dresses of synthetic fibres (excluding knitted or crocheted and petticoats),1198749385.0
201903,620444,Women's or girls' dresses of artificial fibres (excluding knitted or crocheted and petticoats),482825439.0
