Date of data,Commodity code,Commodity,Renminbi Yuan
202606,10129,Other horses,36000.0
202606,10229,Other cattle,393967.0
202606,10290,Other live bovine animals,19527516.0
202606,10392,"Other lives wine,weighing 50 kg or more",201981710.0
202606,10511,"Fowls of the species Gallus omesticus, weighing not more than 185 g",1849682.0
202606,10614,Rabbits and hares,502509.0
202606,10619,Other mammals,13303857.0
202606,10620,Reptiles (including snakes and turtles),6179420.0
202606,10649,Other insects,144968.0
202606,10690,Other lives animals,802737.0
202606,20110,Carcasses and halfcarcasses,43260.0
202606,20120,Other cuts with bone in,17013.0
202606,20130,Boneless,4995463.0
202606,20220,Other cuts with bone in,148114.0
202606,20230,Boneless,6516711.0
202606,20311,Carcasses and halfcarcasses,4580055.0
202606,20312,"Hams, shoulders and cuts thereof, with bone in",8227063.0
202606,20319,Other fresh or chilled meat of swine,3325452.0
202606,20321,Carcasses and halfcarcasses,7527602.0
202606,20322,"Hams, shoulders and cuts thereof, with bone in",1833049.0
202606,20329,Other frozen meat of swine,93078536.0
202606,20442,"Other cuts with bone in,frozen",12419041.0
202606,20443,"Boneless meat of sheep,frozen",4209477.0
202606,20450,"Meat of goats,frozen",42513.0
202606,20500,"Meat of horses, asses, mules or hinnies, fresh, chilled or frozen",1816482.0
202606,20610,"Of bovine animals, fresh or chilled",22775.0
202606,20622,"Livers of bovine animals,frozen",10983637.0
202606,20629,"Other edible offal of bovine animals,frozen",112135.0
202606,20641,"Livers,frozen",101050.0
202606,20649,"Other edible offal of swine,frozen",1350572.0
202606,20690,"Other edible offal,frozen",3637986.0
202606,20711,"Fowls of the species gallus domesticus,not cut in pieces, fresh or chilled",139084866.0
202606,20712,"Fowls of the species gallus domesticus,not cut in pieces, frozen",22323098.0
202606,20713,"Cuts and offal, fresh or chilled",9968027.0
202606,20714,"Cuts and offal, frozen",853498770.0
202606,20741,"Ducks,not cut in pieces, fresh or chilled",15984725.0
202606,20742,"Ducks,not cut in pieces, frozen",66113057.0
202606,20744,"Other cuts and offal of ducks, fresh or chilled",292491.0
202606,20745,"Other cuts and offal of ducks, frozen",88811635.0
202606,20751,"Geese,not cut in pieces, fresh or chilled",40692692.0
202606,20752,"Geese,not cut in pieces, frozen",887613.0
202606,20754,"Other cuts and offal of geese, fresh or chilled",1390283.0
202606,20755,"Other cuts and offal of geese, frozen",9171.0
202606,20810,"Meat and edible meat offal of rabbits or hares,fresh, chilled or frozen",24058401.0
202606,20890,"Other meat and edible meat offal,fresh, chilled or frozen",23486455.0
202606,20910,"Pig fat, free of lean meat,not rendered or otherwise extracted, fresh, chilled, frozen, salted, in brine, dried or smoked",2656670.0
202606,20990,"Poultry fat, not rendered or otherwise extracted, fresh, chilled, frozen, salted, in brine, dried or smoked",1782.0
202606,21011,"Hams, shoulders and cuts thereof, with bone in",301261.0
202606,21012,Bellies (streaky) and cuts thereof,571380.0
202606,21019,Other meat of swine,596099.0
202606,21020,Meat of bovine animals,275472.0
202606,21099,"Other meat and edible meat offal,salted, in brine, dried or smoked",3123398.0
202606,30111,Ornamental fish of freshwater,2708930.0
202606,30192,Eels (Anguilla spp),60268579.0
202606,30193,"Carp (Cyprinus spp, Carassius spp, Ctenopharyngodon idellus, Hypophthalmichthys spp, Cirrhinus spp, Mylopharyngodon piceus, Catla catla, Labeo spp, Osteochilus hasselti, Leptobarbus hoeveni, Megalobrama spp)",40610542.0
202606,30199,"Live fish,nes",162536628.0
202606,30211,"rout (Salmo trutta, Oncorhynchus mykiss, Oncorhynchus clarki, fresh or chilledOncorhynchus aguabonita, Oncorhynchus gilae, Oncorhynchus apache and Oncorhynchus chrysogaster)",2216748.0
202606,30214,"Atlantic salmon (Salmo salar) and Danube salmon (Hucho hucho) ,fresh or chilled",600.0
202606,30223,"Sole (Solea spp) ,fresh or chilled",661604.0
202606,30224,"Turbots (Psetta maxima),fresh or chilled",16280.0
202606,30239,"Other tunas (of the genus Thunnus), skipjack or stripe-bellied bonito ,fresh or chilled(Euthynnus (Katsuwonus) pelamis),fresh or chilled",53640.0
202606,30242,"Anchovies (Engraulis spp) ,fresh or chilled",1210.0
202606,30244,"Mackerel (Scomber scombrus, Scomber australasicus, Scomber japonicus) ,fresh or chilled",428848.0
202606,30246,"Cobia (Rachycentron canadum) ,fresh or chilled",3642078.0
202606,30249,"Other herrings (Clupea harengus, Clupea pallasii), anchovies ,fresh or chilled(Engraulis spp.), sardines (Sardina pilchardus, Sardinops spp.), sardinella (Sardinella spp.), brisling or sprats (Sprattus sprattus), mackerel (Scomber scombrus, Scomber australasicus, Scomber japonicus), Indian mackerels (Rastrelliger spp.), seerfishes (Scomberomorus spp.), jack and horse mackerel (Trachurus spp.), jacks, crevalles (Caranx spp.), cobia (Rachycentron canadum), silver pomfrets (Pampus spp.), Pacific saury (Cololabis saira), scads (Decapterus spp.), capelin (Mallotus villosus), swordfish (Xiphias gladius), Kawakawa (Euthynnus affinis), bonitos (Sarda spp.), marlins, sailfishes, spearfish (Istiophoridae)",653275.0
202606,30271,"Tilapias (Oreochromis spp) ,fresh or chilled",164162.0
202606,30273,"Carp (Cyprinus spp, Carassius spp, Ctenopharyngodon idellus, fresh or chilledHypophthalmichthys spp, Cirrhinus spp, Mylopharyngodon piceus, Catla catla, Labeo spp, Osteochilus hasselti, Leptobarbus hoeveni, Megalobrama spp)",1205668.0
202606,30274,"Eels (Anguilla spp) ,fresh or chilled",473279.0
202606,30284,"Seabass (Dicentrarchus spp) ,fresh or chilled",112935.0
202606,30285,"Seabream (Sparidae) ,fresh or chilled",2052.0
202606,30289,"Other fish,fresh or chilled",68930287.0
202606,30291,"Livers, roes and milt ,fresh or chilled",1620.0
202606,30299,"Other fish fins, heads, tails, maws and other edible fish offal,fresh or chilled",743712.0
202606,30312,"Other Pacific salmon (Oncorhynchus gorbuscha, Oncorhynchus keta, Oncorhynchus tschawytscha, Oncorhynchus kisutch, Oncorhynchus masou and Oncorhynchus rhodurus) ,frozen",5945043.0
202606,30313,"Atlantic salmon (Salmo salar) and Danube salmon (Hucho hucho) ,frozen",5008837.0
202606,30314,"Trout (Salmo trutta, Oncorhynchus mykiss, Oncorhynchus clarki, Oncorhynchus aguabonita, Oncorhynchus gilae, Oncorhynchus apache and Oncorhynchus chrysogaster) ,frozen",30391305.0
202606,30323,"Tilapias (Oreochromis spp) , frozen",317459424.0
202606,30324,"Catfish (Pangasius spp, Silurus spp, Clarias spp, Ictalurus spp) , frozen",17896111.0
202606,30325,"Carp (Cyprinus spp, Carassius spp, Ctenopharyngodon idellus, , frozenHypophthalmichthys spp, Cirrhinus spp, Mylopharyngodon piceus, Catla catla, Labeo spp, Osteochilus hasselti, Leptobarbus hoeveni, Megalobrama spp)",1245229.0
202606,30326,"Eels (Anguilla spp) , frozen",11013521.0
202606,30331,"Halibut (Reinhardtius hippoglossoides, Hippoglossus hippoglossus, Hippoglossus stenolepis) , frozen",18883315.0
202606,30332,"Plaice (Pleuronectes platessa) , frozen",2162200.0
202606,30333,"Sole (Solea spp) , frozen",983791.0
202606,30334,"Turbots (Psetta maxima) ,frozen",5032155.0
202606,30339,"Other flat fish (Pleuronectidae, Bothidae, Cynoglossidae, Soleidae Scophthalmidae and Citharidae), frozen",22021334.0
202606,30341,"Albacore or longfinned tunas (Thunnus alalunga),frozen",25886191.0
202606,30342,"Yellowfin tunas (Thunnus albacares),frozen",50689249.0
202606,30343,"Skipjack tuna (stripe-bellied bonito) (Katsuwonus pelamis) ,frozen",4505183.0
202606,30344,"Bigeye tunas (Thunnus obesus) ,frozen",11738570.0
202606,30351,"Herrings (Clupea harengus, Clupea pallasii) ,frozen",71397098.0
202606,30353,"Sardines (Sardina pilchardus, Sardinops spp), sardinella (Sardinella spp), brisling or sprats (Sprattus sprattus),frozen",9275120.0
202606,30354,"Mackerel (Scomber scombrus, Scomber australasicus, Scomber japonicus) ,frozen",255440185.0
202606,30355,"Jack and horse mackerel (Trachurus spp) ,frozen",15728591.0
202606,30357,"Swordfish (Xiphias gladius) ,frozen",5696176.0
202606,30359,"Other herrings (Clupea harengus, Clupea pallasii), anchovies (Engraulis spp.), sardines (Sardina pilchardus, Sardinops spp.), sardinella (Sardinella spp.), brisling or sprats (Sprattus sprattus), mackerel (Scomber scombrus, Scomber australasicus, Scomber japonicus), Indian mackerels (Rastrelliger spp.), seerfishes (Scomberomorus spp), jack and horse mackerel (Trachurus spp.), jacks, crevalles (Caranx spp.), cobia (Rachycentron canadum), silver pomfrets (Pampus spp.), Pacific saury (Cololabis saira), scads (Decapterus spp.), capelin (Mallotus villosus), swordfish (Xiphias gladius), Kawakawa (Euthynnus affinis), bonitos (Sarda spp.), marlins, sailfishes, spearfish (Istiophoridae),frozen",67958278.0
202606,30363,"Cod (Gadus morhua, Gadus ogac, Gadus macrocephalus) ,frozen",3438680.0
202606,30366,"Hake (Merluccius spp, Urophycis spp) ,frozen",1053315.0
202606,30367,"Alaska Pollack (Theragra chalcogramma) ,frozen",20557403.0
202606,30368,"Blue whitings (Micromesistius poutassou, Micromesistius australis) ,frozen",453604.0
202606,30369,"Other fish of the families Bregmacerotidae, Euclichthyidae, Gadidae, Macrouridae, Melanonidae, Merlucciidae, Moridae and Muraenolepididae,frozen",980000.0
202606,30382,"Rays and skates (Rajidae) ,frozen",321546.0
202606,30384,"Seabass (Dicentrarchus spp) ,frozen",5497258.0
202606,30389,"Other fish ,frozen",358812082.0
202606,30391,"Livers, roes and milt,frozen",8541160.0
202606,30399,"Other fish fins, heads, tails, maws and other edible fish offal,frozen",5452948.0
202606,30431,Fresh or chilled tilapias (Oreochromis spp),124500.0
202606,30439,"Other fresh or chilled fillets of tilapias (Oreochromis spp.), catfish (Pangasius spp., Silurus spp., Clarias spp., Ictalurus spp.), carp (Cyprinus spp., Carassius spp., Ctenopharyngodon idellus, Hypophthalmichthys spp., Cirrhinus spp., Mylopharyngodon piceus, Catla catla, Labeo spp., Osteochilus hasselti, Leptobarbus hoeveni, Megalobrama spp.), eels (Anguilla spp.), Nile perch (Lates niloticus) and snakeheads (Channa spp.)",2110991.0
202606,30441,"Fresh or chilled pacific salmon (Oncorhynchus nerka, Oncorhynchus gorbuscha , fresh, chilledOncorhynchus keta, Oncorhynchus tschawytscha, Oncorhynchus kisutch, Oncorhynchus masou and Oncorhynchus rhodurus), Atlantic salmon (Salmo salar) and Danube salmon (Hucho hucho)",1990727.0
202606,30442,"Fresh or chilled trout (Salmo trutta, Oncorhynchus mykiss, Oncorhynchus clarki, Oncorhynchus aguabonita, Oncorhynchus gilae, Oncorhynchus apache and Oncorhynchus chrysogaster)",1103751.0
202606,30449,"Fresh or chilled fillets of fish, n.e.s",1038083.0
202606,30451,"Fresh or chilled meat, whether or not minced, of tilapias (Oreochromis spp), catfish (Pangasius spp, Silurus spp, Clarias spp, Ictalurus spp), carp (Cyprinus spp, Carassius spp, Ctenopharyngodon idellus, Hypophthalmichthys spp, Cirrhinus spp, Mylopharyngodon piceus, Catla catla, Labeo spp, Osteochilus hasselti, Leptobarbus hoeveni, Megalobrama spp), eels (Anguilla spp), Nile perch (Lates niloticus) and snakeheads (Channa spp)",8991681.0
202606,30459,"Fresh or chilled fish meat, whether or not minced (excluding all fillets, tilapias, catfish, carp, eels, Nile perch, snakeheads, salmonidae, swordfish, toothfish and fish of the families Bregmacerotidae, Euclichthyidae, Gadidae, Macrouridae, Melanonidae, Merlucciidae, Moridae and Muraenolepididae)",19742.0
202606,30461,Frozen fillets of tilapias (Oreochromis spp),71935244.0
202606,30462,"Frozen fillets of catfish (Pangasius spp, Silurus spp, Clarias spp, Ictalurus spp)",4410881.0
202606,30469,"Frozen fillets of carp Cyprinus carpio, Carassius carassius, Ctenopharyngodon idellus, Hypophthalmichthys spp., Cirrhinus spp., Mylopharyngodon piceus"", eels ""Anguilla spp."" and snakeheads ""Channa spp.""""",15016587.0
202606,30471,"Frozen fillets of cod (Gadus morhua, Gadus ogac, Gadus macrocephalus)",821090109.0
202606,30472,Frozen fillets of haddock (Melanogrammus aeglefinus),139660954.0
202606,30473,Frozen fillets of coalfish (Pollachius virens),59054815.0
202606,30474,"Frozen fillets of hake (Merluccius spp, Urophycis spp)",19945029.0
202606,30475,Frozen fillets of Alaska Pollock (Theragra chalcogramma),689288430.0
202606,30479,"Frozen fillets of fish of the families Bregmacerotidae, Euclichthyidae, Gadidae, Macrouridae, Melanonidae, Merlucciidae, Moridae and Muraenolepididae (excluding cod, haddock, coalfish, hake and Alaska pollack)",49533254.0
202606,30481,"Frozen fillets of Pacific salmon (Oncorhynchus nerka, Oncorhynchus gorbuscha, Oncorhynchus keta, Oncorhynchus tschawytscha, Oncorhynchus kisutch, Oncorhynchus masou and Oncorhynchus rhodurus), Atlantic salmon (Salmo salar) and Danube salmon (Hucho hucho)",321756129.0
202606,30482,"Frozen fillets of trout (Salmo trutta, Oncorhynchus mykiss, Oncorhynchusclarki, Oncorhynchus aguabonita, Oncorhynchus gilae,Oncorhynchus apache and Oncorhynchus chrysogaster)",11850459.0
202606,30483,"Frozen fillets of flat fish (Pleuronectidae, Bothidae, Cynoglossidae, Soleidae, Scophthalmidae and Citharidae)",246242476.0
202606,30484,Frozen fillets of swordfish (Xiphias gladius),729264.0
202606,30486,"Frozen fillets of herrings (Clupea harengus, Clupea pallasii)",1679604.0
202606,30487,"Frozen fillets of tunas (of the genus Thunnus),skipjack tuna (stripe-bellied bonito) (Katsuwonus pelamis)",234177478.0
202606,30488,"Frozen fillets of dogfish, other sharks, rays and skates (Rajidae)",598563.0
202606,30489,"Frozen fish fillets, n.e.s.",412702431.0
202606,30491,"Frozen meat, whether or not minced, of swordfish (Xiphias gladius)",2262660.0
202606,30493,"Frozen meat, whether or not minced, of tilapias (Oreochromis spp), catfish (Pangasius spp, Silurus spp, Clarias spp, Ictalurus spp), carp (Cyprinus spp, Carassius spp, Ctenopharyngodon idellus, Hypophthalmichthys spp, Cirrhinus spp, Mylopharyngodon piceus, Catla catla, Labeo spp, Osteochilus hasselti, Leptobarbus hoeveni, Megalobrama spp), eels (Anguilla spp), Nile perch (Lates niloticus) and snakeheads (Channa spp)",99626.0
202606,30494,"Frozen meat, whether or not minced, of alaska Pollack (Theragra chalcogramma)",21801520.0
202606,30495,"Frozen meat, whether or not minced, of fish of the families Bregmacerotidae, Euclichthyidae, Gadidae, Macrouridae, Melanonidae, Merlucciidae, Moridae and Muraenolepididae, other than Alaska Pollack (Theragra chalcogramma)",42505248.0
202606,30499,Frozen fish meat n.e.s. (excluding fillets),106878466.0
202606,30520,"Livers, roes and milt of fish, dried, smoked, salted or in brine",11280463.0
202606,30532,"Fillets, dried, salted or in brine, but not smoked, of fish of the families Bregmacerotidae, Euclichthyidae, Gadidae, Macrouridae, Melanonidae, Merlucciidae, Moridae and Muraenolepididae",108520235.0
202606,30539,"Fish fillets, dried, salted or in brine, but not smoked (excluding tilapia, catfish, carp, eels, Nile perch, snakeheads and fish of the families Bregmacerotidae, Euclichthyidae, Gadidae, Macrouridae, Melanonidae, Merlucciidae, Moridae and Muraenolepididae)",1266693.0
202606,30541,"Smoked Pacific salmon (Oncorhynchus nerka, Oncorhynchus gorbuscha, Oncorhynchus keta, Oncorhynchus tschawytscha, Oncorhynchus kisutch, Oncorhynchus masou and Oncorhynchus rhodurus), Atlantic salmon (Salmo salar) and Danube salmon (Hucho hucho)",3087791.0
202606,30542,"Smoked herrings (Clupea harengus, Clupea pallasii)",7591959.0
202606,30543,"Smoked trout (Salmo trutta, Oncorhynchus mykiss, Oncorhynchus clarki, Oncorhynchus aguabonita, Oncorhynchus gilae, Oncorhynchus apache and Oncorhynchus chrysogaster)",11885435.0
202606,30549,"Smoked fish, incl. fillets (excluding offal, Pacific salmon, Atlantic salmon, Danube salmon, herring, trout, tilapia, catfish, carp, eels, Nile perch and snakeheads)",16026347.0
202606,30551,"Dried cod (Gadus morhua, Gadus ogac, Gadus macrocephalus)",300193.0
202606,30553,"Dried fish of the families Bregmacerotidae, Euclichthyidae, Gadidae, Macrouridae, Melanonidae, Merlucciidae, Moridae and Muraenolepididae, other than cod (Gadus morhua, Gadus ogac, Gadus macrocephalus)",12037234.0
202606,30554,"Dried herrings (Clupea harengus, Clupea pallasii), anchovies (Engraulis spp), sardines (Sardina pilchardus, Sardinops spp), sardinella (Sardinella spp), brisling or sprats (Sprattus sprattus), mackerel (Scomber scombrus, Scomber australasicus, Scomber japonicus), Indian mackerels (Rastrelliger spp), seerfishes (Scomberomorus spp), jack and horse mackerel (Trachurus spp), jacks, crevalles (Caranx spp), cobia (Rachycentron canadum), silver pomfrets (Pampus spp), Pacific saury (Cololabis saira), scads (Decapterus spp), capelin (Mallotus villosus), swordfish (Xiphias gladius), Kawakawa (Euthynnus affinis), bonitos (Sarda spp), marlins, sailfishes, spearfish (Istiophoridae)",20931623.0
202606,30559,"Dried fish, even salted but not smoked (excluding fillets, offal and cod)",61908336.0
202606,30561,"Herrings (Clupea harengus, Clupea pallasii), only salted or in brine (excluding fillets and offal)",300188.0
202606,30562,"Cod (Gadus morhua, Gadus ogac, Gadus macrocephalus),salted or in brine (excluding fillets and offal)",17129373.0
202606,30564,"Tilapia Oreochromis spp."", catfish ""Pangasius spp., Silurus spp., Clarias spp., Ictalurus spp."", carp ""Cyprinus carpio, Carassius carassius, Ctenopharyngodon idellus, Hypophthalmichthys spp., Cirrhinus spp., Mylopharyngodon piceus"", eels ""Anguilla spp."", Nile perch ""Lates niloticus"" and snakeheads ""Channa spp."", salted or in brine only (excluding fillets and offal)""",154767.0
202606,30569,"Other fish, salted or in brine only (excluding fillets, offal, herring, cod, anchovies, tilapia, catfish, carp, eels, Nile perch and snakeheads)",19234595.0
202606,30571,"Shark fins, smoked, dried, salted or in brine",1866779.0
202606,30572,"Fish heads, tails and maws, smoked, dried, salted or in brine",2873313.0
202606,30579,"Other fish fins and other edible fish offal, smoked, dried, salted or in brine (excluding heads, tails, maws and shark fins)",2464560.0
202606,30611,"Frozen rock lobster and other sea crawfish (Palinurus spp, Panulirus spp, Jasus spp)",728470.0
202606,30612,Frozen lobsters (Homarus spp),92357.0
202606,30614,Frozen crabs,62339838.0
202606,30615,Frozen norway lobsters (Nephrops norvegicus),1101074.0
202606,30616,"Frozen cold-water shrimps and prawns (Pandalus spp, Crangon crangon)",29609245.0
202606,30617,"Frozen shrimps and prawns, even smoked, whether in shell or not, incl. shrimps and prawns in shell, cooked by steaming or by boiling in water (excluding cold-water shrimps and prawns)",275802038.0
202606,30619,Other frozen crustaceans,1732314.0
202606,30631,"Rock lobster and other sea crawfish (Palinurus spp, Panulirus spp, Jasus spp) , whether in shell or not, live, fresh or chilled",135046.0
202606,30632,"Lobsters (Homarus spp), whether in shell or not, live, fresh or chilled",2750.0
202606,30633,"Crabs , whether in shell or not, live, fresh or chilled",18429654.0
202606,30635,"Coldwater shrimps and prawns (Pandalus spp, Crangon crangon), whether in shell or not, live, fresh or chilled",10564.0
202606,30636,"Other shrimps and prawns, whether in shell or not, live, fresh or chilled",22231883.0
202606,30639,"Other crustaceans, live, fresh or chilled",1714530.0
202606,30695,"Shrimps and prawns,, whether in shell or not, live, fresh or chilled (excl. rock lobster and other sea crawfish, lobsters, crabs, Norway lobsters, shrimps and prawns); flours, meals and pellets of crustaceans, fit for human consumption, fresh or chilled",6560854.0
202606,30699,"Other Crustaceans, incl. in  0309",260400.0
202606,30711,"Oysters, live, fresh, chilled",13098729.0
202606,30712,"Oysters, frozen",5326790.0
202606,30719,"Oysters, smoked, frozen, dried, salted or in brine",14478.0
202606,30721,"Live, fresh or chilled, scallops and other molluscs of the family Pectinidae",887318.0
202606,30722,Frozen scallops and other molluscs of the family Pectinidae,65000491.0
202606,30729,"Dried, salted or in brine, smoked, scallops and other molluscs of the family Pectinidae",3566929.0
202606,30731,"Live, fresh or chilled, not smoked, mussels (Mytilus spp., Perna spp.), with or without shell",462457.0
202606,30732,"Frozen mussels (Mytilus spp., Perna spp.), with or without shell",25874304.0
202606,30742,"Live, fresh or chilled, not smoked, cuttle fish and squid, with or without shell",3799300.0
202606,30743,"Frozen cuttle fish and squid, with or without shell",794820665.0
202606,30749,"Cuttle fish and squid, smoked, frozen, dried, salted or in brine, with or without shell",27006590.0
202606,30751,"Live, fresh or chilled, not smoked,octopus (Octopus spp.)",46562673.0
202606,30752,Frozen octopus (Octopus spp.),92883038.0
202606,30759,"Octopus (Octopus spp.), smoked, frozen, dried, salted or in brine",2073239.0
202606,30760,"Snails, other than sea snails",17684.0
202606,30771,"Live, fresh or chilled, even in shell, clams, cockles and ark shells (families Arcidae, Arcticidae,Cardiidae,Donacidae,Hiatellidae,Mactridae,Mesodesmatidae, Myidae, Semelidae, Solecurtidae, Solenidae, Tridacnidae and Veneridae)",27359986.0
202606,30772,"Frozen, even in shell, clams, cockles and ark shells (families Arcidae, Arcticidae,Cardiidae,Donacidae,Hiatellidae,Mactridae,Mesodesmatidae, Myidae, Semelidae, Solecurtidae, Solenidae, Tridacnidae and Veneridae)",32676040.0
202606,30779,"Smoked, frozen, dried, salted or in brine, even in shell, clams, cockles and ark shells families Arcidae, Arcticidae, Cardiidae, Donacidae, Hiatellidae, Mactridae, Mesodesmatidae, Myidae, Semelidae, Solecurtidae, Solenidae, Tridacnidae and Veneridae""""",345.0
202606,30781,"Live, fresh or chilled abalone (Haliotis spp)",15908445.0
202606,30782,"Live, fresh or chilled stromboid conchs (Strombus spp)",18639.0
202606,30783,Frozen abalone (Haliotis spp),5132039.0
202606,30787,"Smoked, dried, salted or in brine, even in shell, abalone (Haliotis spp.)",13200.0
202606,30791,"Other molluscs,live/fresh/chilled",1840790.0
202606,30792,Other frozen Molluscs,26614438.0
202606,30799,"Other Molluscs,dried/salted/ in brine/smoked",3863955.0
202606,30811,"Live, fresh or chilled, sea cucumbers (Stichopus japonicus, Holothuroidea)",22084.0
202606,30812,"Frozen sea cucumbers (Stichopus japonicus, Holothuroidea)",2657162.0
202606,30819,"Smoked, dried, salted or in brine, sea cucumbers (Stichopus japonicus, Holothurioidea)",72370.0
202606,30821,"Live, fresh or chilled, sea urchins (Strongylocentrotus spp., Paracentrotus lividus, Loxechinus albus, Echinus esculentus)",12655214.0
202606,30822,"Frozen sea urchins (Strongylocentrotus spp., Paracentrotus lividus, Loxechinus albus, Echinus esculentus)",1134757.0
202606,30830,Jellyfish (Rhopilema spp),12635434.0
202606,30890,"Live, fresh, chilled, frozen, dried, salted or in brine, even smoked, aquatic invertebrates (excluding crustaceans, molluscs, sea cucumbers, sea urchins and jellyfish)",10506194.0
202606,30910,"Flours, meals and pellets of fish, fit for human consumption",2824084.0
202606,40110,"Milk and cream of a fat content, by weight, not exceeding 1%",374666.0
202606,40120,"Milk and cream of a fat content, by weight, exceeding 1% but not exceeding 6%",21965525.0
202606,40150,"Milk and cream of a fat content, by weight, exceeding 10%",303316.0
202606,40210,"Milk and cream in powder, granules or other solid forms, of a fat content, by weight, not exceeding 1.5%",76804867.0
202606,40221,"Not containing added sugar or other sweetening matter, of a fat content, by weight, more than 1.5%",64022266.0
202606,40229,"Milk and cream in solid forms, of a fat content by weight, more than 1,5%, sweetened",405441.0
202606,40291,"Milk and cream, concentrated but unsweetened (excluding in solid forms)",401121.0
202606,40299,"Milk and cream, concentrated and sweetened (excluding in solid forms)",3356744.0
202606,40320,Yogurt,4619466.0
202606,40390,"Buttermilk, curdled milk and cream, kephir and other fermented or acidified milk and cream, whether or not concentrated or flavoured or containing added sugar or other sweetening matter, fruits, nuts or cocoa",6321963.0
202606,40410,"Whey and modified whey, whether or not concentrated or containing added sugar or other sweetening matter",539150.0
202606,40490,"Products consisting of natural milk constituents, whether or not sweetened, n.e.s.",675228.0
202606,40510,Butter,2546964.0
202606,40590,"Fats and oils derived from milk, and dehydrated butter and ghee (excluding natural butter, recombined butter and whey butter)",7100829.0
202606,40610,"Fresh (unripened or uncured) cheese, including whey cheese, and curd",1630.0
202606,40620,"Grated or powdered cheese, of all kinds",2549245.0
202606,40630,"Processed cheese, not grated or powdered",949780.0
202606,40690,Other cheese,66728.0
202606,40711,Of fowls of the species Gallus domesticus,4132421.0
202606,40721,"Other fresh eggs of fowls of the species Gallus domesticus, in shell",133689473.0
202606,40729,"Other Fresh birds'eggs,in shell",708509.0
202606,40790,"Other birds'eggs, in shell, preserved or cooked",38252970.0
202606,40811,Dried egg yolks,10671252.0
202606,40819,Other egg yolks,13770094.0
202606,40891,"Dried birds'eggs, not in shell, whether or not sweetened (excluding egg yolks)",1562806.0
202606,40899,"Other birds'eggs, not in shell, fresh, cooked by steaming or boiling in water, moulded, frozen or otherwise preserved, whether or not sweetened (excluding dried)",21989198.0
202606,40900,atural honey,116289753.0
202606,41010,"Edible insects, nes",284874.0
202606,41090,"Other edible products of animal origin, not elsewhere specified or included",15479271.0
202606,50210,"Pigs', hogs' or boars' bristles and hair and waste thereof",13289707.0
202606,50290,Badger and other brush making hair and waste thereof,884189.0
