Date of data,Commodity code,Commodity,Renminbi Yuan
202306,10290,Other live bovine animals,28783229.0
202306,10391,"Other lives wine,weighing less than 50 kg",19706.0
202306,10392,"Other lives wine,weighing 50 kg or more",232462297.0
202306,10420,Goats,195778.0
202306,10511,"Fowls of the species Gallus omesticus, weighing not more than 185 g",1599347.0
202306,10614,Rabbits and hares,243292.0
202306,10619,Other mammals,14854107.0
202306,10620,Reptiles (including snakes and turtles),2069615.0
202306,10649,Other insects,177038.0
202306,10690,Other lives animals,825254.0
202306,20220,Other cuts with bone in,125035.0
202306,20312,"Hams, shoulders and cuts thereof, with bone in",15815348.0
202306,20319,Other fresh or chilled meat of swine,2413930.0
202306,20321,Carcasses and halfcarcasses,3348249.0
202306,20322,"Hams, shoulders and cuts thereof, with bone in",128146.0
202306,20329,Other frozen meat of swine,43287427.0
202306,20430,"Carcasses and halfcarcasses of lamb, frozen",91800.0
202306,20442,"Other cuts with bone in,frozen",5769884.0
202306,20443,"Boneless meat of sheep,frozen",747113.0
202306,20500,"Meat of horses, asses, mules or hinnies, fresh, chilled or frozen",2163002.0
202306,20622,"Livers of bovine animals,frozen",273154.0
202306,20629,"Other edible offal of bovine animals,frozen",901756.0
202306,20641,"Livers,frozen",130815.0
202306,20690,"Other edible offal,frozen",1349981.0
202306,20711,"Fowls of the species gallus domesticus,not cut in pieces, fresh or chilled",149036629.0
202306,20712,"Fowls of the species gallus domesticus,not cut in pieces, frozen",3922000.0
202306,20713,"Cuts and offal, fresh or chilled",4771357.0
202306,20714,"Cuts and offal, frozen",194598235.0
202306,20741,"Ducks,not cut in pieces, fresh or chilled",26458424.0
202306,20742,"Ducks,not cut in pieces, frozen",15455615.0
202306,20743,"Fatty livers of ducks, fresh or chilled",245059.0
202306,20744,"Other cuts and offal of ducks, fresh or chilled",302987.0
202306,20745,"Other cuts and offal of ducks, frozen",12558715.0
202306,20751,"Geese,not cut in pieces, fresh or chilled",55848698.0
202306,20752,"Geese,not cut in pieces, frozen",45118.0
202306,20753,"Fatty livers of geese, fresh or chilled",370800.0
202306,20754,"Other cuts and offal of geese, fresh or chilled",1304361.0
202306,20755,"Other cuts and offal of geese, frozen",58000.0
202306,20810,"Meat and edible meat offal of rabbits or hares,fresh, chilled or frozen",13089014.0
202306,20890,"Other meat and edible meat offal,fresh, chilled or frozen",23778025.0
202306,20910,"Pig fat, free of lean meat,not rendered or otherwise extracted, fresh, chilled, frozen, salted, in brine, dried or smoked",375000.0
202306,21012,Bellies (streaky) and cuts thereof,90770.0
202306,21019,Other,392744.0
202306,21099,"Other meat and edible meat offal,salted, in brine, dried or smoked",681327.0
202306,30111,Ornamental fish of freshwater,1950871.0
202306,30192,Eels (Anguilla spp),154855701.0
202306,30193,"Carp (Cyprinus spp, Carassius spp, Ctenopharyngodon idellus, Hypophthalmichthys spp, Cirrhinus spp, Mylopharyngodon piceus, Catla catla, Labeo spp, Osteochilus hasselti, Leptobarbus hoeveni, Megalobrama spp)",52027608.0
202306,30199,Other,265833071.0
202306,30223,"Sole (Solea spp) ,fresh or chilled",3767596.0
202306,30229,"Other flat fish,fresh or chilled",1930880.0
202306,30239,"Other tunas (of the genus Thunnus), skipjack or stripe-bellied bonito ,fresh or chilled(Euthynnus (Katsuwonus) pelamis),fresh or chilled",46943.0
202306,30246,"Cobia (Rachycentron canadum) ,fresh or chilled",4593964.0
202306,30249,"Other herrings (Clupea harengus, Clupea pallasii), anchovies ,fresh or chilled(Engraulis spp.), sardines (Sardina pilchardus, Sardinops spp.), sardinella (Sardinella spp.), brisling or sprats (Sprattus sprattus), mackerel (Scomber scombrus, Scomber australasicus, Scomber japonicus), Indian mackerels (Rastrelliger spp.), seerfishes (Scomberomorus spp.), jack and horse mackerel (Trachurus spp.), jacks, crevalles (Caranx spp.), cobia (Rachycentron canadum), silver pomfrets (Pampus spp.), Pacific saury (Cololabis saira), scads (Decapterus spp.), capelin (Mallotus villosus), swordfish (Xiphias gladius), Kawakawa (Euthynnus affinis), bonitos (Sarda spp.), marlins, sailfishes, spearfish (Istiophoridae)",472350.0
202306,30271,"Tilapias (Oreochromis spp) ,fresh or chilled",104212.0
202306,30273,"Carp (Cyprinus spp, Carassius spp, Ctenopharyngodon idellus, fresh or chilledHypophthalmichthys spp, Cirrhinus spp, Mylopharyngodon piceus, Catla catla, Labeo spp, Osteochilus hasselti, Leptobarbus hoeveni, Megalobrama spp)",1498180.0
202306,30274,"Eels (Anguilla spp) ,fresh or chilled",522345.0
202306,30279,"Other tilapias (Oreochromis spp.), catfish (Pangasius spp., Silurus spp., Clarias spp., Ictalurus spp.), carp (Cyprinus spp., Carassius spp., Ctenopharyngodon idellus, Hypophthalmichthys spp., Cirrhinus spp., Mylopharyngodon piceus, Catla catla, Labeo spp., Osteochilus hasselti, Leptobarbus hoeveni, Megalobrama spp.), eels (Anguilla spp.), Nile perch (Lates niloticus) and snakeheads (Channa spp.) ,fresh or chilled",1960.0
202306,30289,"Other fish,fresh or chilled",112835807.0
202306,30299,"Other fish fins, heads, tails, maws and other edible fish offal,fresh or chilled",38069.0
202306,30312,"Other Pacific salmon (Oncorhynchus gorbuscha, Oncorhynchus keta, Oncorhynchus tschawytscha, Oncorhynchus kisutch, Oncorhynchus masou and Oncorhynchus rhodurus) ,frozen",1660828.0
202306,30313,"Atlantic salmon (Salmo salar) and Danube salmon (Hucho hucho) ,frozen",755421.0
202306,30314,"Trout (Salmo trutta, Oncorhynchus mykiss, Oncorhynchus clarki, Oncorhynchus aguabonita, Oncorhynchus gilae, Oncorhynchus apache and Oncorhynchus chrysogaster) ,frozen",1742358.0
202306,30323,"Tilapias (Oreochromis spp) , frozen",129895760.0
202306,30324,"Catfish (Pangasius spp, Silurus spp, Clarias spp, Ictalurus spp) , frozen",7622192.0
202306,30325,"Carp (Cyprinus spp, Carassius spp, Ctenopharyngodon idellus, , frozenHypophthalmichthys spp, Cirrhinus spp, Mylopharyngodon piceus, Catla catla, Labeo spp, Osteochilus hasselti, Leptobarbus hoeveni, Megalobrama spp)",303832.0
202306,30326,"Eels (Anguilla spp) , frozen",9008841.0
202306,30331,"Halibut (Reinhardtius hippoglossoides, Hippoglossus hippoglossus, Hippoglossus stenolepis) , frozen",14411293.0
202306,30332,"Plaice (Pleuronectes platessa) , frozen",828.0
202306,30339,"Other flat fish (Pleuronectidae, Bothidae, Cynoglossidae, Soleidae Scophthalmidae and Citharidae), frozen",28744204.0
202306,30341,"Albacore or longfinned tunas (Thunnus alalunga),frozen",18731087.0
202306,30342,"Yellowfin tunas (Thunnus albacares),frozen",26358942.0
202306,30343,"Skipjack tuna (stripe-bellied bonito) (Katsuwonus pelamis) ,frozen",7443137.0
202306,30344,"Bigeye tunas (Thunnus obesus) ,frozen",12720009.0
202306,30349,"Other tunas (of the genus Thunnus), skipjack or stripe-bellied bonito (Euthynnus (Katsuwonus) pelamis),frozen",71142.0
202306,30351,"Herrings (Clupea harengus, Clupea pallasii) ,frozen",41403200.0
202306,30353,"Sardines (Sardina pilchardus, Sardinops spp), sardinella (Sardinella spp), brisling or sprats (Sprattus sprattus),frozen",14356307.0
202306,30354,"Mackerel (Scomber scombrus, Scomber australasicus, Scomber japonicus) ,frozen",291542864.0
202306,30355,"Jack and horse mackerel (Trachurus spp) ,frozen",2347913.0
202306,30357,"Swordfish (Xiphias gladius) ,frozen",10182533.0
202306,30359,"Other herrings (Clupea harengus, Clupea pallasii), anchovies (Engraulis spp.), sardines (Sardina pilchardus, Sardinops spp.), sardinella (Sardinella spp.), brisling or sprats (Sprattus sprattus), mackerel (Scomber scombrus, Scomber australasicus, Scomber japonicus), Indian mackerels (Rastrelliger spp.), seerfishes (Scomberomorus spp), jack and horse mackerel (Trachurus spp.), jacks, crevalles (Caranx spp.), cobia (Rachycentron canadum), silver pomfrets (Pampus spp.), Pacific saury (Cololabis saira), scads (Decapterus spp.), capelin (Mallotus villosus), swordfish (Xiphias gladius), Kawakawa (Euthynnus affinis), bonitos (Sarda spp.), marlins, sailfishes, spearfish (Istiophoridae),frozen",102008777.0
202306,30363,"Cod (Gadus morhua, Gadus ogac, Gadus macrocephalus) ,frozen",317193.0
202306,30367,"Alaska Pollack (Theragra chalcogramma) ,frozen",2517780.0
202306,30368,"Blue whitings (Micromesistius poutassou, Micromesistius australis) ,frozen",21.0
202306,30369,"Other fish of the families Bregmacerotidae, Euclichthyidae, Gadidae, Macrouridae, Melanonidae, Merlucciidae, Moridae and Muraenolepididae,frozen",554014.0
202306,30382,"Rays and skates (Rajidae) ,frozen",971788.0
202306,30384,"Seabass (Dicentrarchus spp) ,frozen",2903339.0
202306,30389,"Other fish ,frozen",333077511.0
202306,30391,"Livers, roes and milt,frozen",313787.0
202306,30399,"Other fish fins, heads, tails, maws and other edible fish offal,frozen",8942967.0
202306,30439,"Other fresh or chilled fillets of tilapias (Oreochromis spp.), catfish (Pangasius spp., Silurus spp., Clarias spp., Ictalurus spp.), carp (Cyprinus spp., Carassius spp., Ctenopharyngodon idellus, Hypophthalmichthys spp., Cirrhinus spp., Mylopharyngodon piceus, Catla catla, Labeo spp., Osteochilus hasselti, Leptobarbus hoeveni, Megalobrama spp.), eels (Anguilla spp.), Nile perch (Lates niloticus) and snakeheads (Channa spp.)",1076514.0
202306,30449,"Fresh or chilled fillets of fish, n.e.s",1493365.0
202306,30451,"Fresh or chilled meat, whether or not minced, of tilapias (Oreochromis spp), catfish (Pangasius spp, Silurus spp, Clarias spp, Ictalurus spp), carp (Cyprinus spp, Carassius spp, Ctenopharyngodon idellus, Hypophthalmichthys spp, Cirrhinus spp, Mylopharyngodon piceus, Catla catla, Labeo spp, Osteochilus hasselti, Leptobarbus hoeveni, Megalobrama spp), eels (Anguilla spp), Nile perch (Lates niloticus) and snakeheads (Channa spp)",13673264.0
202306,30459,"Fresh or chilled fish meat, whether or not minced (excluding all fillets, tilapias, catfish, carp, eels, Nile perch, snakeheads, salmonidae, swordfish, toothfish and fish of the families Bregmacerotidae, Euclichthyidae, Gadidae, Macrouridae, Melanonidae, Merlucciidae, Moridae and Muraenolepididae)",166835.0
202306,30461,Frozen fillets of tilapias (Oreochromis spp),57234941.0
202306,30462,"Frozen fillets of catfish (Pangasius spp, Silurus spp, Clarias spp, Ictalurus spp)",4572238.0
202306,30469,"Frozen fillets of carp Cyprinus carpio, Carassius carassius, Ctenopharyngodon idellus, Hypophthalmichthys spp., Cirrhinus spp., Mylopharyngodon piceus"", eels ""Anguilla spp."" and snakeheads ""Channa spp.""""",7762035.0
202306,30471,"Frozen fillets of cod (Gadus morhua, Gadus ogac, Gadus macrocephalus)",340662778.0
202306,30472,Frozen fillets of haddock (Melanogrammus aeglefinus),105462757.0
202306,30473,Frozen fillets of coalfish (Pollachius virens),31795292.0
202306,30474,"Frozen fillets of hake (Merluccius spp, Urophycis spp)",10358776.0
202306,30475,Frozen fillets of Alaska Pollock (Theragra chalcogramma),311035733.0
202306,30479,"Frozen fillets of fish of the families Bregmacerotidae, Euclichthyidae, Gadidae, Macrouridae, Melanonidae, Merlucciidae, Moridae and Muraenolepididae (excluding cod, haddock, coalfish, hake and Alaska pollack)",22939766.0
202306,30481,"Frozen fillets of Pacific salmon (Oncorhynchus nerka, Oncorhynchus gorbuscha, Oncorhynchus keta, Oncorhynchus tschawytscha, Oncorhynchus kisutch, Oncorhynchus masou and Oncorhynchus rhodurus), Atlantic salmon (Salmo salar) and Danube salmon (Hucho hucho)",234981857.0
202306,30482,"Frozen fillets of trout (Salmo trutta, Oncorhynchus mykiss, Oncorhynchusclarki, Oncorhynchus aguabonita, Oncorhynchus gilae,Oncorhynchus apache and Oncorhynchus chrysogaster)",4953790.0
202306,30483,"Frozen fillets of flat fish (Pleuronectidae, Bothidae, Cynoglossidae, Soleidae, Scophthalmidae and Citharidae)",174532536.0
202306,30484,Frozen fillets of swordfish (Xiphias gladius),57570.0
202306,30486,"Frozen fillets of herrings (Clupea harengus, Clupea pallasii)",988134.0
202306,30487,"Frozen fillets of tunas (of the genus Thunnus),skipjack tuna (stripe-bellied bonito) (Katsuwonus pelamis)",67497327.0
202306,30488,"Frozen fillets of dogfish, other sharks, rays and skates (Rajidae)",5455592.0
202306,30489,"Frozen fish fillets, n.e.s.",271447043.0
202306,30491,"Frozen meat, whether or not minced, of swordfish (Xiphias gladius)",793613.0
202306,30493,"Frozen meat, whether or not minced, of tilapias (Oreochromis spp), catfish (Pangasius spp, Silurus spp, Clarias spp, Ictalurus spp), carp (Cyprinus spp, Carassius spp, Ctenopharyngodon idellus, Hypophthalmichthys spp, Cirrhinus spp, Mylopharyngodon piceus, Catla catla, Labeo spp, Osteochilus hasselti, Leptobarbus hoeveni, Megalobrama spp), eels (Anguilla spp), Nile perch (Lates niloticus) and snakeheads (Channa spp)",43440.0
202306,30494,"Frozen meat, whether or not minced, of alaska Pollack (Theragra chalcogramma)",19381352.0
202306,30495,"Frozen meat, whether or not minced, of fish of the families Bregmacerotidae, Euclichthyidae, Gadidae, Macrouridae, Melanonidae, Merlucciidae, Moridae and Muraenolepididae, other than Alaska Pollack (Theragra chalcogramma)",19899938.0
202306,30499,Frozen fish meat n.e.s. (excluding fillets),138507347.0
202306,30520,"Livers, roes and milt of fish, dried, smoked, salted or in brine",22622897.0
202306,30532,"Fillets, dried, salted or in brine, but not smoked, of fish of the families Bregmacerotidae, Euclichthyidae, Gadidae, Macrouridae, Melanonidae, Merlucciidae, Moridae and Muraenolepididae",37152113.0
202306,30539,"Fish fillets, dried, salted or in brine, but not smoked (excluding tilapia, catfish, carp, eels, Nile perch, snakeheads and fish of the families Bregmacerotidae, Euclichthyidae, Gadidae, Macrouridae, Melanonidae, Merlucciidae, Moridae and Muraenolepididae)",2025503.0
202306,30541,"Smoked Pacific salmon (Oncorhynchus nerka, Oncorhynchus gorbuscha, Oncorhynchus keta, Oncorhynchus tschawytscha, Oncorhynchus kisutch, Oncorhynchus masou and Oncorhynchus rhodurus), Atlantic salmon (Salmo salar) and Danube salmon (Hucho hucho)",2031938.0
202306,30542,"Smoked herrings (Clupea harengus, Clupea pallasii)",718000.0
202306,30543,"Smoked trout (Salmo trutta, Oncorhynchus mykiss, Oncorhynchus clarki, Oncorhynchus aguabonita, Oncorhynchus gilae, Oncorhynchus apache and Oncorhynchus chrysogaster)",5913218.0
202306,30549,"Smoked fish, incl. fillets (excluding offal, Pacific salmon, Atlantic salmon, Danube salmon, herring, trout, tilapia, catfish, carp, eels, Nile perch and snakeheads)",11636778.0
202306,30551,"Dried cod (Gadus morhua, Gadus ogac, Gadus macrocephalus)",3536995.0
202306,30553,"Dried fish of the families Bregmacerotidae, Euclichthyidae, Gadidae, Macrouridae, Melanonidae, Merlucciidae, Moridae and Muraenolepididae, other than cod (Gadus morhua, Gadus ogac, Gadus macrocephalus)",4379672.0
202306,30554,"Dried herrings (Clupea harengus, Clupea pallasii), anchovies (Engraulis spp), sardines (Sardina pilchardus, Sardinops spp), sardinella (Sardinella spp), brisling or sprats (Sprattus sprattus), mackerel (Scomber scombrus, Scomber australasicus, Scomber japonicus), Indian mackerels (Rastrelliger spp), seerfishes (Scomberomorus spp), jack and horse mackerel (Trachurus spp), jacks, crevalles (Caranx spp), cobia (Rachycentron canadum), silver pomfrets (Pampus spp), Pacific saury (Cololabis saira), scads (Decapterus spp), capelin (Mallotus villosus), swordfish (Xiphias gladius), Kawakawa (Euthynnus affinis), bonitos (Sarda spp), marlins, sailfishes, spearfish (Istiophoridae)",15434227.0
202306,30559,"Dried fish, even salted but not smoked (excluding fillets, offal and cod)",76251137.0
202306,30562,"Cod (Gadus morhua, Gadus ogac, Gadus macrocephalus),salted or in brine (excluding fillets and offal)",7254726.0
202306,30569,"Other fish, salted or in brine only (excluding fillets, offal, herring, cod, anchovies, tilapia, catfish, carp, eels, Nile perch and snakeheads)",6957462.0
202306,30571,"Shark fins, smoked, dried, salted or in brine",2637020.0
202306,30572,"Fish heads, tails and maws, smoked, dried, salted or in brine",4093944.0
202306,30579,"Other fish fins and other edible fish offal, smoked, dried, salted or in brine (excluding heads, tails, maws and shark fins)",3225104.0
202306,30611,"Frozen rock lobster and other sea crawfish (Palinurus spp, Panulirus spp, Jasus spp)",2282487.0
202306,30614,Frozen crabs,58581338.0
202306,30616,"Frozen cold-water shrimps and prawns (Pandalus spp, Crangon crangon)",48053116.0
202306,30617,"Frozen shrimps and prawns, even smoked, whether in shell or not, incl. shrimps and prawns in shell, cooked by steaming or by boiling in water (excluding cold-water shrimps and prawns)",217723609.0
202306,30619,Other frozen crustaceans,243106.0
202306,30631,"Rock lobster and other sea crawfish (Palinurus spp, Panulirus spp, Jasus spp) , whether in shell or not, live, fresh or chilled",27150.0
202306,30633,"Crabs , whether in shell or not, live, fresh or chilled",6196128.0
202306,30635,"Coldwater shrimps and prawns (Pandalus spp, Crangon crangon), whether in shell or not, live, fresh or chilled",262.0
202306,30636,"Other shrimps and prawns, whether in shell or not, live, fresh or chilled",55752186.0
202306,30639,"Other crustaceans, live, fresh or chilled",380839.0
202306,30695,"Shrimps and prawns,, whether in shell or not, live, fresh or chilled (excl. rock lobster and other sea crawfish, lobsters, crabs, Norway lobsters, shrimps and prawns); flours, meals and pellets of crustaceans, fit for human consumption, fresh or chilled",6471941.0
202306,30699,"Other Crustaceans, incl. in  0309",196650.0
202306,30711,"Oysters, live, fresh, chilled",11199817.0
202306,30712,"Oysters, frozen",4626196.0
202306,30721,"Live, fresh or chilled, scallops and other molluscs of the family Pectinidae",3067770.0
202306,30722,Frozen scallops and other molluscs of the family Pectinidae,158347283.0
202306,30729,"Dried, salted or in brine, smoked, scallops and other molluscs of the family Pectinidae",354071.0
202306,30731,"Live, fresh or chilled, not smoked, mussels (Mytilus spp., Perna spp.), with or without shell",176879.0
202306,30732,"Frozen mussels (Mytilus spp., Perna spp.), with or without shell",9104675.0
202306,30742,"Live, fresh or chilled, not smoked, cuttle fish and squid, with or without shell",17618175.0
202306,30743,"Frozen cuttle fish and squid, with or without shell",916811609.0
202306,30749,"Cuttle fish and squid, smoked, frozen, dried, salted or in brine, with or without shell",18517043.0
202306,30751,"Live, fresh or chilled, not smoked,octopus (Octopus spp.)",64854959.0
202306,30752,Frozen octopus (Octopus spp.),71178772.0
202306,30759,"Octopus (Octopus spp.), smoked, frozen, dried, salted or in brine",4550799.0
202306,30760,"Snails, other than sea snails",1262.0
202306,30771,"Live, fresh or chilled, even in shell, clams, cockles and ark shells (families Arcidae, Arcticidae,Cardiidae,Donacidae,Hiatellidae,Mactridae,Mesodesmatidae, Myidae, Semelidae, Solecurtidae, Solenidae, Tridacnidae and Veneridae)",40634407.0
202306,30772,"Frozen, even in shell, clams, cockles and ark shells (families Arcidae, Arcticidae,Cardiidae,Donacidae,Hiatellidae,Mactridae,Mesodesmatidae, Myidae, Semelidae, Solecurtidae, Solenidae, Tridacnidae and Veneridae)",17817374.0
202306,30781,"Live, fresh or chilled abalone (Haliotis spp)",34040928.0
202306,30783,Frozen abalone (Haliotis spp),9891285.0
202306,30787,"Smoked, dried, salted or in brine, even in shell, abalone (Haliotis spp.)",139496.0
202306,30791,"Other molluscs,live/fresh/chilled",9495052.0
202306,30792,Other frozen Molluscs,21651960.0
202306,30799,"Other Molluscs,dried/salted/ in brine/smoked",105.0
202306,30812,"Frozen sea cucumbers (Stichopus japonicus, Holothuroidea)",1096817.0
202306,30821,"Live, fresh or chilled, sea urchins (Strongylocentrotus spp., Paracentrotus lividus, Loxechinus albus, Echinus esculentus)",8519062.0
202306,30822,"Frozen sea urchins (Strongylocentrotus spp., Paracentrotus lividus, Loxechinus albus, Echinus esculentus)",23017.0
202306,30830,Jellyfish (Rhopilema spp),15583995.0
202306,30890,"Live, fresh, chilled, frozen, dried, salted or in brine, even smoked, aquatic invertebrates (excluding crustaceans, molluscs, sea cucumbers, sea urchins and jellyfish)",15313519.0
202306,30910,"Flours, meals and pellets of fish, fit for human consumption",4632715.0
202306,40110,"Milk and cream of a fat content, by weight, not exceeding 1%",9737.0
202306,40120,"Milk and cream of a fat content, by weight, exceeding 1% but not exceeding 6%",11799383.0
202306,40210,"Milk and cream in powder, granules or other solid forms, of a fat content, by weight, not exceeding 1.5%",3999623.0
202306,40221,"Not containing added sugar or other sweetening matter, of a fat content, by weight, more than 1.5%",10249230.0
202306,40229,"Milk and cream in solid forms, of a fat content by weight, more than 1,5%, sweetened",453519.0
202306,40291,"Milk and cream, concentrated but unsweetened (excluding in solid forms)",296861.0
202306,40299,"Milk and cream, concentrated and sweetened (excluding in solid forms)",2319278.0
202306,40320,Yogurt,5355345.0
202306,40390,"Buttermilk, curdled milk and cream, kephir and other fermented or acidified milk and cream, whether or not concentrated or flavoured or containing added sugar or other sweetening matter, fruits, nuts or cocoa",4829827.0
202306,40490,"Products consisting of natural milk constituents, whether or not sweetened, n.e.s.",446657.0
202306,40510,Butter,1306652.0
202306,40520,Dairy spreads,23677.0
202306,40590,"Fats and oils derived from milk, and dehydrated butter and ghee (excluding natural butter, recombined butter and whey butter)",1101545.0
202306,40620,"Grated or powdered cheese, of all kinds",1756509.0
202306,40630,"Processed cheese, not grated or powdered",42033.0
202306,40690,Other cheese,347296.0
202306,40711,Of fowls of the species Gallus domesticus,320262.0
202306,40721,"Other fresh eggs of fowls of the species Gallus domesticus, in shell",126616909.0
202306,40729,"Other Fresh birds'eggs,in shell",737389.0
202306,40790,"Other birds'eggs, in shell, preserved or cooked",51972381.0
202306,40811,Dried egg yolks,6443512.0
202306,40819,Other egg yolks,11614249.0
202306,40891,"Dried birds'eggs, not in shell, whether or not sweetened (excluding egg yolks)",6398293.0
202306,40899,"Other birds'eggs, not in shell, fresh, cooked by steaming or boiling in water, moulded, frozen or otherwise preserved, whether or not sweetened (excluding dried)",14269076.0
202306,40900,atural honey,117236445.0
202306,41090,"Other edible products of animal origin, not elsewhere specified or included",25629365.0
202306,50210,"Pigs', hogs' or boars' bristles and hair and waste thereof",17445102.0
202306,50290,Badger and other brush making hair and waste thereof,12395293.0
202306,50400,"Guts, bladders and stomachs of animals (other than fish), wholeand pieces thereof, fresh, chilled, frozen, salted, in brine, dried orsmoked",573489185.0
202306,50510,Feathers of a kind used for stuffing; down,352109696.0
202306,50590,"Skins and other parts of birds, with their feathers or down, feathers and parts of feathers, whether or not with trimmed edges, not further worked than cleaned, disinfected or treated for preservation; powder and waste of feathers or parts of feathers (excluding feathers used for stuffing and down)",12679257.0
202306,50790,"Tortoiseshell, whalebone, Otherhorns, antlers, hooves, nails, claws and beaks, other powder and waste there of",12327886.0
202306,50800,"Coral and similar materials, unworked or simply prepared bunot otherwise worked; shells of molluscs, crustaceans or echinoderms and cuttlebone, unworked or simply prepared bunot cut to shape, powder and waste thereof",6622179.0
202306,51000,"Ambergris, castoreum, civet and musk; cantharides; bile, whether or not dried; glands and other animal products used in the preparation of pharmaceutical products, fresh, chilled, frozen or otherwise provisionally preserved",3431650.0
202306,51191,"Products of fish or crustaceans, molluscs or other aquatic invertebrates; dead animals of Chapter 3",19251333.0
202306,51199,"Unkown Products of animal origin, n.e.s., dead animals, unfit for human consumption (excluding fish, crustaceans, molluscs or other aquatic invertebrates)",61491019.0
202306,60210,Unrooted cuttings and slips,6119889.0
202306,60220,"Trees, shrubs and bushes, grafted or not, of kinds which bear edible fruit or nuts",540764.0
202306,60230,"Rhododendrons and azaleas, grafted or not",26342.0
202306,60240,"Roses, grafted or not",56080.0
202306,60290,Other live plant,150607901.0
202306,60311,"Fresh cut roses and buds, of a kind suitable for bouquets or for ornamental purposes",7905099.0
202306,60312,"Fresh cut carnations and buds, of a kind suitable for bouquets or for ornamental purposes",13014681.0
202306,60313,"Fresh cut orchids and buds, of a kind suitable for bouquets or for ornamental purposes",379378.0
202306,60314,"Fresh cut chrysanthemums and buds, of a kind suitable for bouquets or for ornamental purposes",17815729.0
202306,60315,"Fresh cut Lilies (Lilium spp.) and buds, of a kind suitable for bouquets or for ornamental purposes",4236305.0
202306,60319,"Fresh cut flowers and buds, of a kind suitable for bouquets or for ornamental purposes",13795718.0
202306,60390,"Dried, dyed, bleached, impregnated or otherwise prepared cut flowers and buds, of a kind suitable for bouquets or for ornamental purposes",8419541.0
202306,60420,"Foliage, branches and other parts of plants, without flowers or flower buds, and grasses, mosses and lichens, being goods of a kind suitable for bouquets or for ornamental purposes, fresh",17164909.0
