Date of data,Commodity code,Commodity,Renminbi Yuan
202308,6815,"Articles of stone or of other mineral substances (including carbon fibres, articles of carbon fibres and articles of peat), not elsewhere specified or included.",526278039.0
202308,6901,"Bricks, blocks, tiles and other ceramic goods of siliceous fossil meals (for example, kieselguhr, tripolite or diatomite) or of similar siliceous earths",1264048.0
202308,6902,"Refractory bricks, blocks, tiles and similar refractory ceramic constructional goods, other than those of siliceous fossil meals or similar siliceous earths.",72245831.0
202308,6903,"Other refractory ceramic goods (for example, retorts, crucibles, muffles, nozzles, plugs, supports, cupels, tubes, pipes, sheaths, rods and slide gates), other than those of siliceous fossil meals or of similar siliceous earths.”",125762170.0
202308,6904,"Geramic building bricks, flooring blocks, support or filler tiles and the like.",1504004.0
202308,6905,"Roofing tiles, chimneypots, cowls, chimney liners, architectural ornaments and other ceramic constructional goods.",2242854.0
202308,6906,"Ceramic pipes, conduits, guttering and pipe fittings",3148947.0
202308,6907,"Geramic flags and paving, hearth or wall tiles; ceramic mosaic cubes and the like, whether or not on a backing; finishing ceramics.",130268224.0
202308,6909,"Geramic wares for laboratory, chemical or other technical uses; ceramic troughs, tubs and similar receptacles of a kind used in agriculture; ceramic pots, jars and similar articles of a kind used for the conveyance or packing of goods.",323387221.0
202308,6910,"Geramic sinks, wash basins, wash basin pedestals, baths, bidets, water closet pans, flushing cisterns, urinals and similar sanitary fixtures.",61287679.0
202308,6911,"Tableware, kitchenware, other household articles and toilet articles, of porcelain or china.",56737252.0
202308,6912,"Geramic tableware, kitchenware, other household articles and toilet articles, other than of porcelain or china.",29373389.0
202308,6913,Statuettes and other ornamental ceramic articles.,15163410.0
202308,6914,Other ceramic articles.,122395119.0
202308,7001,"Cullet and other waste and scrap of glass, excluding glass from cathode ray tubes or other activated glass of heading 85.49; glass in the mass.",45478662.0
202308,7002,"Glass in balls (other than microspheres of heading 70.18), rods or tubes, unworked.",138214477.0
202308,7003,"Cast glass and rolled glass, in sheets or profiles, whether or not having an absorbent, reflecting or nonreflecting layer, but not otherwise worked.",811615341.0
202308,7004,"Drawn glass and blown glass, in sheets, whether or not having an absorbent, reflecting or nonreflecting layer, but not otherwise worked.",761687651.0
202308,7005,"Float glass and surface ground or polished glass, in sheets, whether or not having an absorbent, reflecting or nonreflecting layer, but not otherwise worked.",614414197.0
202308,7006,"Glass of heading 70.03, 70.04 or 70.05, bent, edgeworked, engraved, drilled, enamelled or otherwise worked, but not framed or fitted with other materials.",487958364.0
202308,7007,"safety glass, consisting of toughened (tempered) or laminated glass.",70500727.0
202308,7008,Multiplewalled insulating units of glass.,318517.0
202308,7009,"Glass mirrors, whether or not framed, including rearview mirrors.",255655253.0
202308,7010,"Carboys, bottles, flasks, jars, pots, phials, ampoules and other containers, of glass, of a kind used for the conveyance or packing of goods; preserving jars of glass; stoppers, lids and other closures, of glass.",32098437.0
202308,7011,"Glass envelopes (including bulbs and tubes), open, and glass parts thereof, without fittings, for electric lamps and light sources, cathoderay tubes or the like.",3975158.0
202308,7013,"Glassware of a kind used for table, kitchen, toilet, office, indoor decoration or similar purposes (other than that of heading 70.10 or 70.18).",61040362.0
202308,7014,"Signalling glassware and optical elements of glass (other than those of heading 70.15), not optically worked.",40691952.0
202308,7015,"Clock or watch glasses and similar glasses, glasses for noncorrective or corrective spectacles, curved, bent, hollowed or the like, not optically worked; hollow glass spheres and their segments, for the manufacture of such glasses.",17443564.0
202308,7016,"Paving blocks, slabs, bricks, squares, tiles and other articles of pressed or moulded glass, whether or not wired, of a kind used for building or construction purposes; glass cubes and other glass smallwares, whether or not on a backing, for mosaics or similar decorative purposes; leaded lights and the like;multicellular or foam glass in blocks, panels, plates, shells or similar forms.",1438100.0
202308,7017,"Laboratory, hygienic or pharmaceutical glassware, whether or not graduated or calibrated.",46869740.0
202308,7018,"Glass beads, imitation pearls, imitation precious or semiprecious stones and similar glass smallwares, and articles thereof otherthan imitation jewellery; glass eyes other than prosthetic articles; statuettes and other ornaments of lampworked glass, other than imitation jewellery; glass microspheres not exceeding 1mm in diameter.",58922409.0
202308,7019,"Glass fibres (including glass wool) and articles thereof (for example, yarn, rovings, woven fabrics).",529556108.0
202308,7020,Other articles of glass,309425981.0
202308,7101,"Pearls, natural or cultured, whether or not worked or graded but not strung, mounted or set; pearls, natural or cultured,temporarily strung for convenience of transport.",35280101.0
202308,7102,"Diamonds, whether or not worked, but not mounted or set.",3411465679.0
202308,7103,"Precious stones and semi-precious stones, whether or not worked or graded, but not strung, mounted or set, ungraded precious stones and semi-precious stones, temporarily strung for convenience of transport",190997744.0
202308,7104,"Synthetic or reconstructed precious or semiprecious stones, whether or not worked or graded but not strung, mounted or set; ungraded synthetic or reconstructed precious or semiprecious stones, temporarily strung for convenience of transport.",152098350.0
202308,7105,Dust and powder of natural or synthetic precious or semiprecious stones.,6291563.0
202308,7106,"Silver (including silver plated with gold or platinum), unwrought or in semimanufactured forms, or in powder form.",851118957.0
202308,7107,"Base metals clad with silver, not further worked than semimanufactured.",6239778.0
202308,7108,"Gold (including gold plated with platinum) unwrought or in semimanufactured forms, or in powder form.",54167904739.0
202308,7109,"Base metals or silver, clad with gold, not further worked than semimanufactured.",1116575.0
202308,7110,"Platinum, unwrought or in semimanufactured forms, or in powder form.",4886755233.0
202308,7111,"Base metals, silver or gold, clad with platinum, not further worked than semimanufactured.",6827724.0
202308,7113,"Articles of jewellery and parts thereof, of precious metal or of metal clad with precious metal.",2768784602.0
202308,7114,"Articles of goldsmiths' or silversmiths' wares and parts thereof, of precious metal or of metal clad with precious metal.",9407626.0
202308,7115,Other articles of precious metal or of metal clad with precious metal.,106664149.0
202308,7116,"Articles of natural or cultured pearls, precious or semiprecious stones (natural, synthetic or reconstructed).",46673390.0
202308,7117,Imitation jewellery.,193544820.0
202308,7118,Coin.,146161.0
202308,7201,"Pig iron and spiegeleisen in pigs, blocks or other primary forms.",45149479.0
202308,7202,Ferroalloys.,15102450575.0
202308,7203,"Ferrous products obtained by direct reduction of iron ore and other spongy ferrous products, in lumps, pellets or similar forms; iron having a minimum purity by weight of 99.94%, in lumps, pellets or similar forms.",76573566.0
202308,7204,Ferrous waste and scrap; remelting scrap ingots of iron or steel.,200532070.0
202308,7205,"Nranules and powders, of pig iron, spiegeleisen, iron or steel",176169894.0
202308,7206,Iron and nonalloy steel in ingots or other primary forms (excluding iron of heading 72.03).,297516.0
202308,7207,Semi-finished products of iron or nonalloy steel.,866028637.0
202308,7208,"Flat-rolled products of iron or nonalloy steel, of a width of 600 mm or more, hotrolled, not clad, plated or coated.",872813610.0
202308,7209,"Flat-rolled products of iron or nonalloy steel, of a width of 600 mm or more, coldrolled (coldreduced), not clad, plated or coated.",238087775.0
202308,7210,"at-rolled products of iron or non-alloy steel, of a width ≥ 600 mm, hot-rolled or cold-rolled cold-reduced"", clad, plated or coated""",730725189.0
202308,7211,"Flat-rolled products of iron or nonalloy steel, of a width of less than 600 mm, not clad, plated or coated.",48510719.0
202308,7212,"Flat-rolled products of iron or nonalloy steel, of a width of less than 600 mm, clad, plated or coated.",97066649.0
202308,7213,"Bars and rods, hotrolled, in irregularly wound coils, of iron or nonalloy steel.",61544317.0
202308,7214,"Other bars and rods of iron or nonalloy steel, not further worked than forged, hotrolled, hotdrawn or hotextruded, but including those twisted after rolling.",41436344.0
202308,7215,Other bars and rods of iron or nonalloy steel.,39734876.0
202308,7216,"Angles, shapes and sections of iron or nonalloy steel.",69724873.0
202308,7217,Wire of iron or nonalloy steel.,47308010.0
202308,7218,Stainless steel in ingots or other primary forms; semifinished products of stainless steel.,414897445.0
202308,7219,"Flat-rolled products of stainless steel, of a width of 600 mm or more.",1806234300.0
202308,7220,"Flat-rolled products of stainless steel, of a width of less than 600 mm.",142501667.0
202308,7221,"Bars and rods, hotrolled, in irregularly wound coils, of stainless steel.",114541858.0
202308,7222,"Other bars and rods of stainless steel; angles, shapes and sections of stainless steel.",255772330.0
202308,7223,Wire of stainless steel,113289313.0
202308,7224,Other alloy steel in ingots or other primary forms; semifinished products of other alloy steel.,171051180.0
202308,7225,"Flat-rolled products of other alloy steel, of a width of 600 mm or more.",943949108.0
202308,7226,"Flat-rolled products of alloy steel other than stainless, of a width of ≥ 600 mm, hot-rolled or cold-rolled cold-reduced"" and further worked (excluding plated or coated with zinc and products of silicon-electrical steel)""",236649938.0
202308,7227,"Bars and rods, hot-rolled, in irregularly wound coils, of other alloy steel.",98851553.0
202308,7228,"Other bars and rods of other alloy steel; angles, shapes and sections, of other alloy steel; hollow drill bars and rods, of alloy or nonalloy steel.",301624815.0
202308,7229,Wire of other alloy steel.,75270303.0
202308,7301,"Sheet piling of iron or steel, whether or not drilled, punched or made from assembled elements; welded angles, shapes and sections, of iron or steel.",825118.0
202308,7302,"Railway or tramway track construction material of iron or steel, the following : rails, check-rails and rack rails, switch blades, crossing frogs, point rods and other crossing pieces, sleepers cross-ties"", fish-plates, chairs, chair wedges, sole plates ""base plates"", rail clips, bedplates, ties and other material specialised for jointing or fixing rails""",11691119.0
202308,7303,"Tubes, pipes and hollow profiles, of cast iron.",1281835.0
202308,7304,"Tubes, pipes and hollow profiles, seamless, of iron (other than cast iron) or steel.",602348399.0
202308,7305,"Other tubes and pipes (for example, welded, riveted or similarly closed), having circular cross-sections, the external diameter of which exceeds 406.4 mm, of iron or steel.",42217046.0
202308,7306,"Other tubes, pipes and hollow profiles (for example, open seam or welded, riveted or similarly closed), of iron or steel.",187701128.0
202308,7307,"Tube or pipe fittings (for example, couplings, elbows, sleeves), of iron or steel.",474774026.0
202308,7308,"Structures (excluding prefabricated buildings of heading 94.06) and parts of structures (for example, bridges and bridgesections, lockgates, towers, lattice masts, roofs, roofing frameworks, doors and windows and their frames and thresholds for doors, shutters, balustrades, pillars and columns), of iron or steel; plates, rods, angles, shapes, sections, tubes and the like, prepared for use in structures, of iron or steel.",206925913.0
202308,7309,"eservoirs, tanks, vats and similar containers for any material (other than compressed or liquefied gas), of iron or steel, of a capacity exceeding 300 l, whether or not lined or heatinsulated, but not fitted with mechanical or thermal equipment.",92883984.0
202308,7310,"anks, casks, drums, cans, boxes and similar containers, for any material (other than compressed or liquefied gas), of iron or steel, of a capacity not exceeding 300 l, whether or not lined or heatinsulated, but not fitted with mechanical or thermal equipment.",49606693.0
202308,7311,"Containers for compressed or liquefied gas, of iron or steel.",28509983.0
202308,7312,"Stranded wire, ropes, cables, plaited bands, slings and the like, of iron or steel, not electrically insulated.",183820531.0
202308,7313,"Barbed wire of iron or steel; twisted hoop or single flat wire, barbed or not, and loosely twisted double wire, of a kind used for fencing, of iron or steel.",1491.0
202308,7314,"Cloth (including endless bands), grill, netting and fencing, of iron or steel wire; expanded metal of iron or steel.",121239961.0
202308,7315,"Chain and parts thereof, of iron or steel.",139047406.0
202308,7316,"Anchors, grapnels and parts thereof, of iron or steel.",2893233.0
202308,7317,"Nails, tacks, drawing pins, corrugated nails, staples (other than those of heading 83.05) and similar articles, of iron or steel, whether or not with heads of other material, but excluding such articles with heads of copper.",9312182.0
202308,7318,"Screws, bolts, nuts, coach screws, screw hooks, rivets, cotters, cotterpins, washers (including spring washers) and similar articles, of iron or steel.",1462499653.0
202308,7319,"Sewing needles, knitting needles, bodkins, crochet hooks, embroidery stilettos and similar articles, for use in the hand, of iron or steel; safety pins and other pins of iron or steel, not elsewhere specified or included.",5773027.0
202308,7320,"Springs and leaves for springs, of iron or steel.",280319416.0
202308,7321,"Stoves, ranges, grates, cookers (including those with subsidiary boilers for central heating), barbecues, braziers, gasrings, plate warmers and similar nonelectric domestic appliances, and parts thereof, of iron or steel.",24688348.0
202308,7322,"Radiators for central heating, not electrically heated, and parts thereof, of iron or steel; air heaters and hot air distributors (including distributors which can also distribute fresh or conditioned air), not electrically heated, incorporating a motordriven fan or blower, and parts thereof, of iron or steel.",8331395.0
202308,7323,"Table, kitchen or other household articles and parts thereof, of iron or steel; iron or steel wool; pot scourers and scouring or polishing pads, gloves and the like, of iron or steel.",46681326.0
202308,7324,"Sanitary ware and parts thereof, of iron or steel.",18828538.0
202308,7325,Other cast articles of iron or steel.,39863601.0
202308,7326,Other articles of iron or steel.,1367597722.0
202308,7401,Copper mattes; cement copper (precipitated copper).,120454097.0
202308,7402,Unrefined copper; copper anodes for electrolytic refining.,4038892005.0
202308,7403,"Refined copper and copper alloys, unwrought.",22202905968.0
202308,7404,Copper waste and scrap.,8037623380.0
202308,7405,Master alloys of copper.,21763296.0
202308,7406,Copper powders and flakes.,35128455.0
202308,7407,"Copper bars, rods and profiles.",143613092.0
202308,7408,Copper wire.,602501696.0
202308,7409,"Copper plates, sheets and strip, of a thickness exceeding 0.15mm.",557549567.0
202308,7410,"Copper foil (whether or not printed or backed with paper, paperboard, plastics or similar backing materials) of a thickness (excluding any backing) not exceeding 0.15 mm.",1516803265.0
202308,7411,Copper tubes and pipes.,79116426.0
202308,7412,"Copper tube or pipe fittings (for example, couplings, elbows, sleeves).",74850633.0
202308,7413,"Stranded wire, cables, plaited bands and the like, of copper, not electrically insulated.",44316886.0
202308,7415,"Nails, tacks, drawing pins, staples (other than those of heading 83.05) and similar articles, of copper or of iron or steel with heads of copper; screws, bolts, nuts, screw hooks, rivets, cotters, cotterpins, washers (including spring washers) and similar articles, of copper.",56978297.0
202308,7418,"Table, kitchen or other household articles and parts thereof, of copper; pot scourers and scouring or polishing pads, gloves and the like, of copper; sanitary ware and parts thereof, of copper.",16221059.0
202308,7419,Other articles of copper.,177315931.0
202308,7501,"Nickel mattes, nickel oxide sinters and other intermediate products of nickel metallurgy.",5525816567.0
202308,7502,nwrought nickel.,1103474236.0
202308,7504,Nickel powders and flakes.,127498989.0
202308,7505,"Nickel bars, rods, profiles and wire.",275487392.0
202308,7506,"Nickel plates, sheets, strip and foil.",390692825.0
202308,7507,"Nickel tubes, pipes and tube or pipe fittings (for example, couplings, elbows, sleeves).",60599261.0
202308,7508,Other articles of nickel.,184094772.0
202308,7601,Unwrought aluminium.,3770372866.0
202308,7602,Aluminium waste and scrap.,2115325898.0
202308,7603,Aluminium powders and flakes.,14107924.0
202308,7604,"Aluminium bars, rods and profiles.",220381527.0
202308,7605,Aluminium wire.,30463412.0
202308,7606,"Aluminium plates, sheets and strip, of a thickness exceeding 0.2 mm.",650464578.0
202308,7607,"Aluminium foil (whether or not printed or backed with paper, paperboard, plastics or similar backing materials) of a thickness (excluding any backing) not exceeding 0.2 mm.",450673650.0
202308,7608,Aluminium tubes and pipes.,21323763.0
202308,7609,"Aluminium tube or pipe fittings (for example, couplings, elbows, sleeves).",20810272.0
202308,7610,"Aluminium structures (excluding prefabricated buildings of heading 94.06) and parts of structures (for example, bridges and bridgesections, towers, lattice masts, roofs, roofing frameworks, doors and windows and their frames and thresholds for doors, balustrades, pillars and columns); aluminium plates, rods, profiles, tubes and the like, prepared for use in structures.",44117734.0
202308,7611,"Aluminium reservoirs, tanks, vats and similar containers, for any material (other than compressed or liquefied gas), of a capacity exceeding 300 l, whether or not lined or heatinsulated, but not fitted with mechanical or thermal equipment.",7189521.0
202308,7612,"Aluminium casks, drums, cans, boxes and similar containers (including rigid or collapsible tubular containers), for any material (other than compressed or liquefied gas), of a capacity not exceeding 300 l, whether or not lined or heatinsulated, but not fitted with mechanical or thermal equipment.",10574526.0
202308,7613,Aluminium containers for compressed or liquefied gas.,12219361.0
202308,7614,"Stranded wire, cables, plaited bands and the like, of aluminium, not electrically insulated.",1375673.0
202308,7615,"Table, kitchen or other household articles and parts thereof, of aluminium; pot scourers and scouring or polishing pads, gloves and the like, of aluminium; sanitary ware and parts thereof, of aluminium.",21231740.0
202308,7616,Other articles of aluminium.,399331873.0
202308,7801,Unwrought lead.,50054922.0
202308,7804,"Lead plates, sheets, strip and foil; lead powders and flakes.",914920.0
202308,7806,Other articles of lead.,5546690.0
202308,7901,Unwrought zinc.,608246153.0
202308,7903,"zinc dust, powders and flakes.",9621915.0
202308,7904,"Zinc bars, rods, profiles and wire.",1906543.0
202308,7905,"Zinc plates, sheets, strip and foil.",13181115.0
202308,7907,Other articles of zinc.,20274862.0
202308,8001,Unwrought tin.,508562050.0
202308,8003,"Tin bars, rods, profiles and wire.",30716870.0
202308,8007,Other articles of tin.,20586314.0
202308,8101,"Wungsten (wolfram) and articles thereof, including waste and scrap.",35899658.0
202308,8102,"Molybdenum and articles thereof, including waste and scrap.",28805075.0
202308,8103,"Tantalum and articles thereof, including waste and scrap.",33778879.0
202308,8104,"Magnesium and articles thereof, including waste and scrap.",2864251.0
202308,8105,"Cobalt mattes and other intermediate products of cobalt metallurgy; cobalt and articles thereof, including waste and scrap.",1202915640.0
202308,8106,"Bismuth and articles thereof, including waste and scrap.",3171488.0
202308,8108,"Titanium and articles thereof, including waste and scrap.",351936001.0
202308,8109,"Zirconium and articles thereof, including waste and scrap.",15015126.0
202308,8110,"Antimony and articles thereof, including waste and scrap.",325879.0
202308,8111,"Manganese and articles thereof, including waste and scrap",52309282.0
202308,8112,"Beryllium, chromium, hafnium, rhenium, thallium, cadmium, germanium, vanadium, gallium, indium, niobium and their products, including waste and scrap:",309376353.0
202308,8113,"Cermets and articles thereof, including waste and scrap.",49247552.0
202308,8201,"Hand tools, the following : spades, shovels, mattocks, picks, hoes, forks and rakes; axes, bill hooks and similar hewing tools; secateurs and pruners of any kind; scythes, sickles, hay knives, hedge shears, timber wedges and other tools of a kind used in agriculture, horticulture or forestry.",3542335.0
202308,8202,"Hand saws; blades for saws of all kinds (including slitting, slotting or toothless saw blades).",94677506.0
202308,8203,"Files, rasps, pliers (including cutting pliers), pincers, tweezers, metal cutting shears, pipecutters, bolt croppers, perforating punches and similar hand tools.",28886341.0
202308,8204,"Hand-operated spanners and wrenches (including torque meter wrenches but not including tap wrenches); interchangeable spanner sockets, with or without handles.",66012298.0
202308,8205,"Hand tools (including glaziers' diamonds), not elsewhere specified or included; blow lamps; vices, clamps and the like, other than accessories for and parts of, machinetools or waterjet cutting machines; anvils; portable forges; hand or pedaloperated grinding wheels with frameworks.",54712810.0
202308,8206,"Tools of two or more of the headings 82.02 to 82.05, put up in sets for retail sale.",16857400.0
202308,8207,"Interchangeable tools for hand tools, whether or not poweroperated, or for machinetools (for example, for pressing, stamping, punching, tapping, threading, drilling, boring, broaching, milling, turning or screw driving), including dies for drawing or extruding metal, and rock drilling or earth boring tools.",595819959.0
202308,8208,"Knives and cutting blades, for machines or for mechanical appliances.",452566451.0
202308,8209,"Plates, sticks, tips and the like for tools, unmounted, of cermets.",121030143.0
202308,8210,"Hand-operated mechanical appliances, weighing 10 kg or less, used in the preparation, conditioning or serving of food or drink.",6093796.0
202308,8211,"Knives with cutting blades, serrated or not (including pruning knives), other than knives of heading 82.08, and blades therefor.",13735563.0
202308,8212,Razors and razor blades (including razor blade blanks in strips).,61131525.0
202308,8213,"Scissors, tailors' shears and similar shears, and blades therefor.",3233873.0
202308,8214,"Other articles of cutlery (for example, hair clippers, butchers' or kitchen cleavers, choppers and mincing knives, paper knives); manicure or pedicure sets and instruments (including nail files).",12497188.0
202308,8215,"Spoons, forks, ladles, skimmers, cakeservers, fishknives, butterknives, sugar tongs and similar kitchen or tableware.",8831661.0
202308,8301,"Padlocks and locks (key, combination or electrically operated), of base metal; clasps and frames with clasps, incorporating locks, of base metal; keys for any of the foregoing articles, of base metal",219223566.0
202308,8302,"Base metal mountings, fittings and similar articles suitable for furniture, doors, staircases, windows, blinds, coachwork, saddlery, trunks, chests, caskets or the like; base metal hatracks, hatpegs, brackets and similar fixtures; castors with mountings of base metal; automatic door closers of base metal",440372547.0
202308,8303,"Armoured or reinforced safes, strongboxes and doors and safe deposit lockers for strongrooms, cash or deed boxes and the like, of base metal",4083755.0
202308,8304,"Filing cabinets, cardindex cabinets, paper trays, paper rests, pen trays, officestamp stands and similar office or desk equipment, of base metal, other than office furniture of heading 9403",93728.0
202308,8305,"Fittings for looseleaf binders or files, letter clips, letter corners, paper clips, indexing tags and similar office articles, of base metal; staples in strips (for example, for offices, upholstery, packaging), of base metal",2589655.0
202308,8306,"Bells, gongs and the like, nonelectric, of base metal; statuettes and other ornaments, of base metal; photograph, picture or similar frames, of base metal; mirrors of base metal",32542060.0
202308,8307,"Flexible tubing of base metal, with or without fittings",97991421.0
202308,8308,"Clasps, frames with clasps, buckles, buckleclasps, hooks, eyes, eyelets and the like, of base metal, of a kind used for clothing or clothing accessories, footwear, jewellery, wristwatches, books, awnings, leather goods, travel goods or saddlery or for other made up articles; tubular or bifurcated rivets, of base metal; beads and spangles, of base metal",88063191.0
