Date of data,Commodity code,Commodity,Renminbi Yuan
201605,5206,"otton yarn (other than sewing thread), containing less than 85% by weight of cotton, not put up for retail sale.",293526317
201605,5207,otton yarn (other than sewing thread) put up for retail sale.,12809085
201605,5208,"Woven fabrics of cotton, containing 85% or more by weight of cotton, weighing not more than 200 g/m2",4989660202
201605,5209,"Woven fabrics of cotton, containing 85% or more by weight of cotton, weighing more than 200 g/m2",1312007103
201605,5210,"Woven fabrics of cotton, containing less than 85% by weight of cotton, mixed mainly or solely with manmade fibres, weighing not more than 200 g/m2.",753214964
201605,5211,"Woven fabrics of cotton, containing less than 85% by weight of cotton, mixed mainly or solely with manmade fibres, weighing more than 200 g/m2.",1190354650
201605,5212,Other woven fabrics of cotton.,23809226
201605,5301,"Flax, raw or processed but not spun; flax tow and waste (including yarn waste and garnetted stock).",2795916
201605,5302,"True hemp (Cannabis sativa L.), raw or processed but not spun; tow and waste of true hemp (including yarn waste and garnetted stock).",28613
201605,5303,"Jute and other textile bast fibres (excluding flax, true hemp and ramie), raw or processed but not spun; tow and waste of these fibres (including yarn waste and garnetted stock).",141268
201605,5305,"Coconut, abaca ""Manila hemp or Musa textilis Nee"", ramie, agave and other vegetable textile fibres, n.e.s., raw or processed, but not spun; tow, noils and waste of such fibres, incl. yarn waste and garnetted stock",1028596
201605,5306,lax yarn.,142740420
201605,5307,Yarn of jute or of other textile bast fibres of heading 53.03.,595477
201605,5308,Yarn of other vegetable textile fibres; paper yarn.,12646250
201605,5309,Woven fabrics of flax.,135260140
201605,5310,Woven fabrics of jute or of other textile bast fibres of heading 5303,1764927
201605,5311,Woven fabrics of other vegetable textile fibres; woven fabrics of paper yarn.,123932011
201605,5401,"Sewing thread of manmade filaments, whether or not put up for retail sale.",231120013
201605,5402,"Synthetic filament yarn (other than sewing thread), not put up for retail sale, including synthetic monofilament of less than 67 decitex.",2525204124
201605,5403,"Artificial filament yarn (other than sewing thread), not put up for retail sale, including artificial monofilament of less than 67 decitex.",222271024
201605,5404,"Synthetic monofilament of 67 decitex or more and of which no crosssectional dimension exceeds 1 mm; strip and the like (for example, artificial straw) of synthetic textile materials of an apparent width not exceeding 5 mm.",81813933
201605,5405,"Artificial monofilament of 67 decitex or more and of which no crosssectional dimension exceeds 1 mm; strip and the like (for example, artificial straw) of artificial textile materials of an apparent width not exceeding 5 mm.",1421679
201605,5406,"Manmade filament yarn (other than sewing thread), put up for retail sale.",21463069
201605,5407,"Woven fabrics of synthetic filament yarn, including woven fabrics obtained from materials of heading 54.04.",7405608435
201605,5408,"Woven fabrics of artificial filament yarn, including woven fabrics obtained from materials of heading 54.05.",125501591
201605,5501,Synthetic filament tow.,50161650
201605,5502,Artificial filament tow.,478978
201605,5503,"Synthetic staple fibres, not carded, combed or otherwise processed for spinning.",691193633
201605,5504,"Artificial staple fibres, not carded, combed or otherwise processed for spinning.",447266092
201605,5505,"Waste (including noils, yarn waste and garnetted stock) of manmade fibres.",740543
201605,5506,"Synthetic staple fibres, carded, combed or otherwise processed for spinning.",10481740
201605,5507,"Artificial staple fibres, carded, combed or otherwise processed for spinning.",2121213
201605,5508,"Sewing thread of manmade staple fibres, whether or not put up for retail sale.",247472068
201605,5509,"Yarn (other than sewing thread) of synthetic staple fibres, not put up for retail sale.",987767876
201605,5510,"Yarn (other than sewing thread) of artificial staple fibres, not put up for retail sale.",285411044
201605,5511,"Yarn (other than sewing thread) of manmade staple fibres, put up for retail sale.",13382020
201605,5512,"Woven fabrics of synthetic staple fibres, containing 85% or more by weight of synthetic staple fibres.",654999887
201605,5513,"Woven fabrics of synthetic staple fibres, containing less than 85% by weight of such fibres, mixed mainly or solely with cotton, of a weight not exceeding 170 g/m2.",1118619251
201605,5514,"Woven fabrics of synthetic staple fibres, containing less than 85% by weight of such fibres, mixed mainly or solely with cotton, of a weight exceeding 170g/m2.",431320935
201605,5515,Other woven fabrics of synthetic staple fibres.,974672843
201605,5516,Woven fabrics of artificial staple fibres.,1731977329
201605,5601,"Wadding of textile materials and articles thereof; textile fibres, not exceeding 5 mm in length (flock),textile dust and mill neps.",185187971
201605,5602,"Felt, whether or not impregnated, coated, covered or laminated.",72447950
201605,5603,"Nonwovens, whether or not impregnated, coated, covered or laminated.",1550465706
201605,5604,"Textile-covered rubber thread and cord; textile yarn, strip and the like of heading 5404 and 5405, impregnated, coated, covered or sheathed with rubber or plastics",113334107
201605,5605,"Metallised yarn, whether or not gimped, being textile yarn, or strip or the like of heading 5404 or 5405, of textile fibres, combined with metal in the form of thread, strip or powder or covered with metal",71739179
201605,5606,"Gimped yarn, gimped strip and the like of heading 5404 or 5405; chenille yarn, incl. flock chenille yarn, and loop wale-yarn",77505782
201605,5607,"Twine, cordage, ropes and cables, whether or not plaited or braided and whether or not impregnated, coated, covered or sheathed with rubber or plastics",393776991
201605,5608,"Knotted netting of twine, cordage or rope; made up fishing nets and other made up nets, of textile materials.",488117915
201605,5609,"Articles of yarn, strip or the like of heading 54.04 or 54.05, twine, cordage, rope or cables, not elsewhere specified or included.",115004245
201605,5701,"Carpets and other textile floor coverings, knotted, whether or not made up.",47318262
201605,5702,"Carpets and other textile floor coverings, woven, not tufted or flocked, whether or not made up, incl. Kelem, Schumacks, Karamanie and similar hand-woven rugs",227923256
201605,5703,"Carpets and other textile floor coverings, tufted, whether or not made up.",762763889
201605,5704,"Carpets and other floor coverings, of felt, not tufted or flocked, whether or not made up",12152853
201605,5705,"Other carpets and other textile floor coverings, whether or not made up.",424541397
201605,5801,"Woven pile fabrics and chenille fabrics (excluding terry towelling and similar woven terry fabrics, tufted textile fabrics and narrow woven fabrics of heading 5806)",754907328
201605,5802,"Terry towelling and similar woven terry fabrics, tufted textile fabrics (excluding narrow woven fabrics of heading 5806, carpets and other floor coverings)",30241978
201605,5803,"Gauze, other than narrow fabrics of heading 58.06",2501392
201605,5804,"Tulles and other net fabrics, not including woven, knitted or crocheted fabrics; lace in the piece, in strips or in motifs, other than fabrics of headings 60.02 to 60.06.",475447355
201605,5805,"Hand-woven tapestries of the type Gobelin, Flanders, Aubusson, Beauvais and the like, and needle-worked tapestries, e.g. petit point, cross-stitch, whether or not made up (excluding Kelem, Schumacks, Karamanie and the like, and tapestries ＞ 100 years old)",10620777
201605,5806,"Narrow woven fabrics of textile materials, with a width of ≤ 30 cm (excluding labels, badges and similar articles); narrow fabrics consisting of warp without weft assembled by means of an adhesive ""bolducs""",763793018
201605,5807,"Cabels, badges and similar articles of textile materials, in the piece, in strips or cut to shape or size, not embroidered.",182216440
201605,5808,"Braids of textile materials, in the piece; ornamental trimmings of textile materials, in the piece, not embroidered, other than knitted or crocheted; tassels, pompons and similar articles of textile materials",106906920
201605,5809,"Woven fabrics of metal thread and woven fabrics of metallised yarn of heading 5605, of a kind used in apparel, as furnishing fabrics or for similar purposes, n.e.s.",607301
201605,5810,"Embroidery on a textile fabric ground, in the piece, in strips or in motifs",520800859
201605,5811,"Quilted textile products in the piece, composed of one or more layers of textile materials assembled with padding by stitching or otherwise (excluding embroidery of heading 5810 and quilted fabrics for bedding and furnishings)",26122900
201605,5901,"Quilted textile products in the piece, composed of one or more layers of textile materials assembled with padding by stitching or otherwise (excluding embroidery of heading 5810 and quilted fabrics for bedding and furnishings)",185521995
201605,5902,"Tyre cord fabric of high-tenacity yarn of nylon or other polyamides, polyesters or viscose rayon, whether or not dipped or impregnated with rubber or plastic",349316469
201605,5903,"Textile fabrics impregnated, coated, covered or laminated with plastics, other than those of heading 59.02.",3054539041
201605,5904,"Linoleum, whether or not cut to shape; floor coverings consisting of a coating or covering applied on a textile backing, whether or not cut to shape.",9924001
201605,5905,Textile wall coverings.,7563257
201605,5906,"Rubberised textile fabrics, other than those of heading 59.02.",56881383
201605,5907,"Impregnated, coated or covered textile fabrics; painted canvas being theatrical scenery, studio backcloths or the like, n.e.s.",191684460
201605,5908,"Textile wicks, woven, plaited or knitted, for lamps, stoves, lighters, candles or the like; incandescent gas mantles and tubular knitted gas-mantle fabric for incandescent gas mantles, whether or not impregnated",1559823
201605,5909,"Textile hosepiping and similar textile tubing, whether or not impregnated or coated, with or without lining, armour or accessories of other materials",64579053
201605,5910,"Transmission or conveyor belts or belting, of textile material, whether or not impregnated, coated, covered or laminated with plastics, or reinforced with metal or other material.",46161557
201605,5911,"Textile products and articles, for technical use, specified in Note 7 to chapter 59",327670190
201605,6001,"Pile fabrics, incl. ""long pile"" fabrics and terry fabrics, knitted or crocheted",2049380366
201605,6002,"Knitted or crocheted fabrics of a width not exceeding 30cm, containing by weight 5% or more of elastomeric yarn or rubber thread, other than those of heading 60.01.",74033748
201605,6003,"Knitted or crocheted fabrics of a width not exceeding 30cm, other than those of heading 60.01 or 60.02.",29361914
201605,6004,"Knitted or crocheted fabrics of a width exceeding 30 cm, containing by weight 5% or more of elastomeric yarn or rubber thread, other than those of heading 60.01",1546669872
201605,6005,"Warp knit fabrics (including those made on galloon knitting machines), other than those of headings 60.01 to 60.04.",563603576
201605,6006,Other knitted or crocheted fabrics.,4979356133
201605,6101,"Men's or boys' overcoats, car coats, capes, cloaks, anoraks, incl. ski jackets, windcheaters, wind-jackets and similar articles, knitted or crocheted (excluding suits, ensembles, jackets, blazers, bib and brace overalls and trousers)",183286605
201605,6102,"Women's or girls' overcoats, carcoats, capes, cloaks, anoraks (including skijackets), windcheaters, windjackets and similar articles, knitted or crocheted, other than those of heading 61.04.",376940015
201605,6103,"Men's or boys' suits, ensembles, jackets, blazers, trousers, bib and brace overalls, breeches and shorts",3820323255
201605,6104,"Women's or girls' suits, ensembles, jackets, blazers, dresses, skirts, divided skirts, trousers, bib and brace overalls, breeches and shorts, knitted or crocheted",9168283640
201605,6105,"en's or boys' shirts, knitted or crocheted.",642373721
201605,6106,"Women's or girls' blouses, shirts and shirt-blouses, knitted or crocheted (excluding T-shirts and vests)",269718004
201605,6107,"Men's or boys' underpants, briefs, nightshirts, pyjamas, bathrobes, dressing gowns and similar articles, knitted or crocheted (excluding vests and singlets)",1423084505
201605,6108,"Women's or girls' slips, petticoats, briefs, panties, nightdresses, pyjamas, négligés, bathrobes, dressing gowns, housecoats and similar articles, knitted or crocheted (excluding T-shirts, vests, brassieres, girdles, corsets and similar articles)",2659281830
201605,6109,"T-shirts, singlets and other vests, knitted or crocheted",5664028701
201605,6110,"Jerseys, pullovers, cardigans, waistcoats and similar articles, of wool, knitted or crocheted (excluding wadded waistcoats)",7700259016
201605,6111,"Babies' garments and clothing accessories of wool or fine animal hair, knitted or crocheted (excluding hats)",1387095457
201605,6112,"Track-suits, ski-suits and swimwear, knitted or crocheted",809043055
201605,6113,"Garments, knitted or crocheted, rubberised or impregnated, coated or covered with plastics or other materials (excluding babies' garments and clothing accessories)",93269539
201605,6114,"Special garments for professional, sporting or other purposes, n.e.s., knitted or crocheted",774459175
201605,6115,"Pantyhose, tights, stockings, socks and other hosiery, incl. graduated compression hosiery [e.g., stockings for varicose veins] and footwear without applied soles, knitted or crocheted (excluding for babies)",2833463151
201605,6116,"Gloves, mittens and mitts, knitted or crocheted (excluding for babies)",1264171619
201605,6117,"Other made up clothing accessories, knitted or crocheted; knitted or crocheted parts of garments or of clothing accessories.",872248844
201605,6201,"Men’s or boys’ overcoats, car-coats, capes, cloaks, anoraks (including ski-jackets), wind-cheaters, windjackets and similar articles, other than those of heading 62.03.",2055760463
201605,6202,"Women’s or girls’ overcoats, car-coats, capes, cloaks, anoraks (including ski-jackets), wind-cheaters, wind-jackets and similar articles, other than those of heading 62.04.",2148856247
201605,6203,"Men's or boys' suits, ensembles, jackets, blazers, trousers, bib and brace overalls, breeches and shorts (excluding knitted or crocheted, wind-jackets and similar articles, separate waistcoats, tracksuits, ski suits and swimwear)",6627589985
201605,6204,"Women's or girls' suits, ensembles, jackets, blazers, dresses, skirts, divided skirts, trousers, bib and brace overalls, breeches and shorts (excluding knitted or crocheted, wind-jackets and similar articles, slips, petticoats and panties, tracksuits, ski suits and swimwear)",14199019476
201605,6205,Men's or boys' shirts.,1756329411
201605,6206,"Women's or girls' blouses, shirts and shirtblouses.",1225360689
201605,6207,"Men's or boys' singlets and other vests, underpants, briefs, nightshirts, pyjamas, bathrobes, dressing gowns and similar articles",279052805
201605,6208,"Women's or girls' singlets and other vests, slips, petticoats, briefs, panties, nightdresses, pyjamas, négligés, bathrobes, dressing gowns, housecoats and similar articles (excluding knitted or crocheted, brassières, girdles, corsets and similar articles)",675197958
201605,6209,Babies garments and clothing accessories of textile materials (excluding knitted or crocheted and hats),325400277
201605,6210,"Garments made up of felt or nonwovens, whether or not impregnated, coated, covered or laminated; garments of textile fabrics, rubberised or impregnated, coated, covered or laminated with plastics or other substances (excluding knitted or crocheted, and babies' garments and clothing accessories)",2102180682
201605,6211,"Tracksuits, ski suits, swimwear and other garments, n.e.s.",2415951820
201605,6212,"Brassieres, girdles, corsets, braces, suspenders, garters and similar articles and parts thereof, of all types of textile materials, whether or not elasticated, incl. knitted or crocheted (excluding belts and corselets made entirely of rubber)",2369052892
201605,6213,Handkerchiefs,87911139
201605,6214,"Shawls, scarves, mufflers, mantillas, veils and similar articles",936678564
201605,6215,"Ties, bow ties and cravats of textile materials",158920914
201605,6216,"Gloves, mittens and mitts, of all types of textile materials (excluding knitted or crocheted and for babies)",193642028
201605,6217,"Made-up clothing accessories and parts of garments or clothing accessories, of all types of textile materials, n.e.s.",184962034
201605,6301,Blankets and travelling rugs,1493504407
201605,6302,"Bed linen, table linen, toilet linen and kitchen linen.",5003145477
201605,6303,Curtains (including drapes) and interior blinds; curtain or bed valances.,1353242340
201605,6304,"Other furnishing articles, excluding those of heading 94.04.",1084908129
201605,6305,"Packs and bags, of a kind used for the packing of goods.",1088078978
201605,6306,"Tarpaulins, awnings and sunblinds; tents; sails for boats, sailboards or landcraft; camping goods of all types of textile materials",1355261919
201605,6307,"other made up articles, including dress patterns.",3208951002
201605,6308,"Sets consisting of woven fabric and yarn, whether or not with accessories, for making up into rugs, tapestries, embroidered table cloths or serviettes, or similar textile articles, put up in packings for retail sale.",8066985
201605,6309,Worn clothing and other worn articles.,120707204
201605,6310,"Used or new rags, scrap twine, cordage, rope and cables and worn-out articles thereof, of textile materials",14435897
201605,6401,"Waterproof footwear with outer soles and uppers of rubber or of plastics, the uppers of which are neither fixed to the sole nor assembled by stitching, riveting, nailing, screwing, plugging or similar processes.",366604505
201605,6402,Other footwear with outer soles and uppers of rubber or plastics.,12012567483
201605,6403,"ootwear with outer soles of rubber, plastics, leather or composition leather and uppers of leather.",4588116285
201605,6404,"Footwear with outer soles of rubber, plastics, leather or composition leather and uppers of textile materials.",7104538248
201605,6405,Other footwear.,698226721
201605,6406,"Parts of footwear, incl. uppers whether or not attached to soles other than outer soles; removable in-soles, heel cushions and similar articles; gaiters, leggings and similar articles, and parts thereof (excluding articles of asbestos)",1304523305
201605,6501,"Hatforms, hat bodies and hoods of felt, neither blocked to shape nor with made brims; plateaux and manchons (including slit manchons), of felt.",11603599
201605,6502,"Hatshapes, plaited or made by assembling strips of any material, neither blocked to shape, nor with made brims, nor lined, nor trimmed",6900487
201605,6504,"Hats and other headgear, plaited or made by assembling strips of any material, whether or not lined or trimmed",142628994
201605,6505,"Hats and other headgear, knitted or crocheted, or made up from lace, felt or other textile fabric, in the piece (but not in strips), whether or not lined or trimmed; hairnets of any material, whether or not lined or trimmed.",1380216498
201605,6506,"Other headgear, whether or not lined or trimmed.",684034157
201605,6507,"Headbands, linings, covers, hat foundations, hat frames, peaks and chinstraps, for headgear",70997983
201605,6601,"Umbrellas and sun umbrellas (including walkingstick umbrellas, garden umbrellas and similar umbrellas).",1489546469
201605,6602,"Walkingsticks, seatsticks, whips, ridingcrops and the like",49428228
201605,6603,"Parts, trimmings and accessories of articles of heading 66.01 or 66.02.",100309063
201605,6701,"Skins and other parts of birds with their feathers or down, feathers, parts of feathers, down and articles thereof (other than goods of heading 05.05 and worked quills and scapes)",32958442
201605,6702,"Artificial flowers, foliage and fruit and parts thereof; articles made of artificial flowers, foliage or fruit.",1023625339
201605,6703,"Human hair, dressed, thinned, bleached or otherwise worked; wool or other animal hair or other textile materials, prepared for use in making wigs or the like.",42312966
201605,6704,"igs, false beards, eyebrows and eyelashes, switches and the like, of human or animal hair or of textile materials; articles of human hair not elsewhere specified or included.",1627901706
201605,6801,"Setts, curbstones and flagstones, of natural stone (except slate).",209026612
201605,6802,"Worked monumental or building stone (except slate) and articles thereof, other than goods of heading 68.01; mosaic cubes and the like, of natural stone (including slate), whether or not on a backing; artificially coloured granules, chippings and powder, of natural stone (including slate).",3934071670
201605,6803,Worked slate and articles of slate or of agglomerated slate.,140446160
201605,6804,"Millstones, grindstones, grinding wheels and the like, without frameworks, for milling, grinding, pulping, sharpening, polishing, trueing or cutting, hand sharpening or polishing stones, and parts thereof, of natural stone, of agglomerated natural or artificial abrasives, or of ceramics, with or without parts of other materials",430758369
201605,6805,"Natural or artificial abrasive powder or grain, on a base of textile material, of paper, of paperboard or of other materials, whether or not cut to shape or sewn or otherwise made up.",187918023
201605,6806,"Slag-wool, rock-wool and similar mineral wools; exfoliated vermiculite, expanded clays, foamed slag and similar expanded mineral materials; mixtures and articles of heat-insulating, sound-insulating or sound absorbing mineral materials",194517166
201605,6807,"Articles of asphalt or of similar material (for example, petroleum bitumen or coal tar pitch).",21932916
201605,6808,"Panels, boards, tiles, blocks and similar articles of vegetable fibre, of straw or of shavings, chips, particles, sawdust or other waste, of wood, agglomerated with cement, plaster or other mineral binders",67667567
201605,6809,Articles of plaster or of compositions based on plaster.,120826069
201605,6810,"Articles of cement, of concrete or of artificial stone, whether or not reinforced.",1046685239
201605,6811,"Articles of asbestos-cement, of cellulose fibre-cement or the like.",60626251
201605,6812,"Fabricated asbestos fibres; mixtures with a basis of asbestos or with a basis of asbestos and magnesium carbonate; articles of such mixtures or of asbestos (for example, thread, woven fabric, clothing, headgear, footwear, gaskets), whether or not reinforced, other than goods of heading 68.11 or 68.13.",12502526
201605,6813,"Friction material and articles thereof, e.g., sheets, rolls, strips, segments, discs, washers, pads, not mounted, for brakes, clutches or the like, with a basis of asbestos, other mineral substances or cellulose, whether or not combined with textile or other materials",27708970
201605,6814,"Worked mica and articles of mica, including agglomerated or reconstituted mica, whether or not on a support of paper, paperboard or other materials.",28314395
201605,6815,"Articles of stone or of other mineral substances (including carbon fibres, articles of carbon fibres and articles of peat), not elsewhere specified or included.",263917943
201605,6901,"Bricks, blocks, tiles and other ceramic goods of siliceous fossil meals (for example, kieselguhr, tripolite or diatomite) or of similar siliceous earths",16841312
201605,6902,"Refractory bricks, blocks, tiles and similar refractory ceramic constructional goods, other than those of siliceous fossil meals or similar siliceous earths.",578960320
201605,6903,"Other refractory ceramic goods (for example, retorts, crucibles, muffles, nozzles, plugs, supports, cupels, tubes, pipes, sheaths and rods), other than those of siliceous fossil meals or of similar siliceous earths.",138634517
201605,6904,"Geramic building bricks, flooring blocks, support or filler tiles and the like.",320050609
201605,6905,"Roofing tiles, chimneypots, cowls, chimney liners, architectural ornaments and other ceramic constructional goods.",21004404
201605,6906,"Ceramic pipes, conduits, guttering and pipe fittings",4791135
201605,6907,"Geramic flags and paving, hearth or wall tiles; ceramic mosaic cubes and the like, whether or not on a backing; finishing ceramics.",1065736017
201605,6908,-------,2318841298
201605,6909,"Geramic wares for laboratory, chemical or other technical uses; ceramic troughs, tubs and similar receptacles of a kind used in agriculture; ceramic pots, jars and similar articles of a kind used for the conveyance or packing of goods.",262879750
201605,6910,"Geramic sinks, wash basins, wash basin pedestals, baths, bidets, water closet pans, flushing cisterns, urinals and similar sanitary fixtures.",1501801368
201605,6911,"Tableware, kitchenware, other household articles and toilet articles, of porcelain or china.",2615892518
201605,6912,"Geramic tableware, kitchenware, other household articles and toilet articles, other than of porcelain or china.",179604730
201605,6913,Statuettes and other ornamental ceramic articles.,714991355
201605,6914,Other ceramic articles.,197450026
201605,7001,Cullet and other waste and scrap of glass; glass in the mass.,31973569
201605,7002,"Glass in balls (other than microspheres of heading 70.18), rods or tubes, unworked.",72115114
