Date of data,Commodity code,Commodity,Renminbi Yuan
202101,3606,Ferrocerium and other pyrophoric alloys in all forms; articles of combustible materials as specified in Note 2 to this Chapter.,12001237.0
202101,3701,"Photographic plates and film in the flat, sensitised, unexposed, of any material other than paper, paperboard or textiles; instant print film in the flat, sensitised, unexposed, whether or not in packs.",351086002.0
202101,3702,"Photographic film in rolls, sensitised, unexposed, of any material other than paper, paperboard or textiles; instant print film in rolls, sensitised, unexposed.",80256803.0
202101,3703,"photographic paper, paperboard and textiles, sensitised,unexposed.",39170061.0
202101,3704,"Photographic plates, film, paper, paperboard and textiles, exposed but not developed.",84394.0
202101,3705,"Photographic plates and film, exposed and developed, other than cinematographic film.",454928.0
202101,3707,"Chemical preparations for photographic uses (other than varnishes, glues, adhesives and similar preparations); unmixed products for photographic uses, put up in measured portions or put up for retail sale in a form ready for use.",154038194.0
202101,3801,"Artificial graphite; colloidal or semicolloidal graphite; preparations based on graphite or other carbon in the form of pastes, blocks, plates or other semimanufactures.",681782184.0
202101,3802,"ctivated carbon; activated natural mineral products; animal black, including spent animal black.",239596158.0
202101,3803,"Tall oil, whether or not refined.",9934.0
202101,3804,"Residual lyes from the manufacture of wood pulp, whether or not concentrated, desugared or chemically treated, including lignin sulphonates, but excluding tall oil of heading 38.03.",22194582.0
202101,3805,"Gum, wood or sulphate turpentine and other terpenic oils produced by the distillation or other treatment of coniferous woods; crude dipentene; sulphite turpentine and other crude para-cymene; pine oil containing alpha-terpineol as the main constituent",8778651.0
202101,3806,"Rosin and resin acids, and derivatives thereof; rosin spirit and rosin oils; run gums.",135426807.0
202101,3807,"Wood tar; wood tar oils; wood creosote; wood naphtha; vegetable pitch; brewers' pitch and similar preparations based on rosin, resin acids or on vegetable pitch.",8694129.0
202101,3808,"Insecticides, rodenticides, fungicides, herbicides, antisprouting products and plantgrowth regulators, disinfectants and similar products, put up in forms or packings for retail sale or as preparations or articles (for example, sulphurtreated bands, wicks and candles, and flypapers).",3940624133.0
202101,3809,"Finishing agents, dye carriers to accelerate the dyeing or fixing of dyestuffs and other products and preparations (for example, dressings and mordants), of a kind used in the textile, paper, leather or like industries, not elsewhere specified or included.",155210567.0
202101,3810,"Pickling preparations for metal surfaces; fluxes and other auxiliary preparations for soldering, brazing or welding; soldering, brazing or welding powders and pastes consisting of metal and other materials; preparations of a kind used as cores or coatings for welding electrodes or rods.",91005933.0
202101,3811,"ntiknock preparations, oxidation inhibitors, gum inhibitors, viscosity improvers, anticorrosive preparations and other prepared additives, for mineral oils (including gasoline) or for other liquids used for the same purposes as mineral oils.",176880219.0
202101,3812,"Prepared rubber accelerators; compound plasticisers for rubber or plastics, not elsewhere specified or included; antioxidising preparations and other compound stabilisers for rubber or plastics.",613781180.0
202101,3813,Preparations and charges for fireextinguishers; charged fireextinguishing grenades.,20227516.0
202101,3814,"Organic composite solvents and thinners, not elsewhere specified or included; prepared paint or varnish removers.",18857588.0
202101,3815,"Reaction initiators, reaction accelerators and catalytic preparations, not elsewhere specified or included.",486794410.0
202101,3816,"Refractory cements, mortars, concretes and similar compositions, other than products of heading 38.01.",194999553.0
202101,3817,"Mixed alkylbenzenes and mixed alkylnaphthalenes, other than those of heading 27.07 or 29.02.",101923722.0
202101,3818,"Chemical elements doped for use in electronics, in the form of discs, wafers or similar forms; chemical compounds doped for use in electronics. form of",1831491028.0
202101,3819,"Hydraulic brake fluids and other prepared liquids for hydraulictransmission, not containing or containing less than 70% byweight of petroleum oils or oils obtained from bituminousminerals.",5051836.0
202101,3820,Antifreezing preparations and prepared deicing fluids.,11005793.0
202101,3821,"Prepared culture media for the development or maintenance of microorganisms (including viruses and the like) or of plant, human or animal cells.",183229460.0
202101,3822,"Diagnostic or laboratory reagents on a backing, prepared diagnostic or laboratory reagents whether or not on a backing, other than those of heading 30.02 or 30.06; certified reference materials",1119733465.0
202101,3823,Industrial monocarboxylic fatty acids; acid oils from refining;industrial fatty alcohols.,33838791.0
202101,3824,"Prepared binders for foundry moulds or cores; chemical products and preparations for the chemical or allied industries, incl. mixtures of natural products, n.e.s.",3028349608.0
202101,3825,"Residual products of the chemical or allied industries, not elsewhere specified or included; municipal waste; sewage sludge; other wastes specified in Note 6 to this Chapter.",7556646.0
202101,3826,"Biodiesel and mixtures thereof, not containing or containing less than 70% by weight of petroleum oils or oils obtained from bituminous minerals.",692980491.0
202101,3901,"Polymers of ethylene, in primary forms.",733317451.0
202101,3902,"Polymers of propylene or of other olefins, in primary forms.",455281162.0
202101,3903,"Polymers of styrene, in primary forms.",361155297.0
202101,3904,"Polymers of vinyl chloride or of other halogenated olefins, in primary forms.",1615899743.0
202101,3905,"Polymers of vinyl acetate or of other vinyl esters, in primary forms; other vinyl polymers in primary forms.",226784129.0
202101,3906,crylic polymers in primary forms.,749178215.0
202101,3907,"Polyacetals, other polyethers and epoxide resins, in primary forms; polycarbonates, alkyd resins, polyallyl esters and other polyesters, in primary forms.",3602234880.0
202101,3908,Polyamides in primary forms.,662796862.0
202101,3909,"minoresins, phenolic resins and polyurethanes, in primary forms.",1266015383.0
202101,3910,Silicones in primary forms.,504128074.0
202101,3911,"etroleum resins, coumaroneindene resins, polyterpenes, polysulphides, polysulphones and other products specified in Note 3 to this Chapter, not elsewhere specified or included, in primary forms.",407260977.0
202101,3912,"Cellulose and its chemical derivatives, not elsewhere specified or included, in primary forms.",363533486.0
202101,3913,"Natural polymers (for example, alginic acid) and modified natural polymers (for example, hardened proteins, chemical derivatives of natural rubber), not elsewhere specified or included, in primary forms.",271426262.0
202101,3914,"Ionexchangers based on polymers of headings 39.01 to 39.13, in primary forms.",162979741.0
202101,3915,"Waste, parings and scrap, of plastics.",68360546.0
202101,3916,"Monofilament of which any crosssectional dimension exceeds 1 mm, rods, sticks and profile shapes, whether or not surfacworked but not otherwise worked, of plastics.",475548346.0
202101,3917,"Tubes, pipes and hoses, and fittings therefor (for example, joints,elbows, flanges), of plastics.",2162114380.0
202101,3918,"Floor coverings of plastics, whether or not selfadhesive, in rolls or in the form of tiles; wall or ceiling coverings of plastics, as defined in Note 9 to this Chapter.",4620758567.0
202101,3919,"Selfadhesive plates, sheets, film, foil, tape, strip and other flat shapes, of plastics, whether or not in rolls.",2818845322.0
202101,3920,"Other plates, sheets, film, foil and strip, of plastics, noncellular and not reinforced, laminated, supported or similarly combined with other materials.",5192636047.0
202101,3921,"Other plates, sheets, film, foil and strip, of plastics.",2050352816.0
202101,3922,"Baths, showerbaths, sinks, washbasins, bidets, lavatory pans, seats and covers, flushing cisterns and similar sanitary ware, of plastics.",962497324.0
202101,3923,"Articles for the conveyance or packing of goods, of plastics; stoppers, lids, caps and other closures, of plastics.",7319093889.0
202101,3924,"Tableware, kitchenware, other household articles and hygienic or toilet articles, of plastics.",8253756750.0
202101,3925,"Builders' ware of plastics, not elsewhere specified or included.",1501265915.0
202101,3926,Other articles of plastics and articles of other materials of headings 39.01 to 39.14.,21747021814.0
202101,4001,"Natural rubber, balata, guttapercha, guayule, chicle and similar natural gums, in primary forms or in plates, sheets or strip.",3486311.0
202101,4002,"Synthetic rubber and factice derived from oils, in primary forms or in plates, sheets or strip; mixtures of any product of heading 40.01 with any product of this heading, in primary forms or in plates, sheets or strip.",831761038.0
202101,4003,"Reclaimed rubber in primary forms or in plates, sheets or strip.",60363665.0
202101,4004,"Waste, parings and scrap of rubber (other than hard rubber)and powders and granules obtained therefrom.",29329896.0
202101,4005,"ompounded rubber, unvulcanised, in primary forms or in plates, sheets or strip.",66556746.0
202101,4006,"Other forms (for example, rods, tubes and profile shapes) and articles (for example, discs and rings), of unvulcanised rubber.",6341231.0
202101,4007,Vulcanised rubber thread and cord.,77043101.0
202101,4008,"lates, sheets, strip, rods and profile shapes, of vulcanised rubber other than hard rubber.",224553010.0
202101,4009,"Tubes, pipes and hoses, of vulcanised rubber other than hard rubber, with or without their fittings (for example, joints, elbows, flanges).",670427485.0
202101,4010,"Conveyor or transmission belts or belting, of vulcanised rubber.",577078542.0
202101,4011,"New pneumatic tyres, of rubber.",8504491347.0
202101,4012,"Retreaded or used pneumatic tyres of rubber; solid or cushion tyres, tyre treads and tyre flaps, of rubber.",81504091.0
202101,4013,"Inner tubes, of rubber.",351618998.0
202101,4014,"Hygienic or pharmaceutical articles (including teats), of vulcanised rubber other than hard rubber, with or without fittings of hard rubber.",84423554.0
202101,4015,"Articles of apparel and clothing accessories (including gloves, mittens and mitts), for all purposes, of vulcanised rubber other than hard rubber.",2421323630.0
202101,4016,Other articles of vulcanised rubber other than hard rubber.,1855251061.0
202101,4017,"Hard rubber (for example, ebonite) in all forms, including waste and scrap; articles of hard rubber.",29864745.0
202101,4101,"Raw hides and skins of bovine (including buffalo) or equine animals (fresh, or salted, dried, limed, pickled or otherwise preserved, but not tanned, parchmentdressed or further prepared), whether or not dehaired or split.",6211164.0
202101,4102,"Raw skins of sheep or lambs (fresh, or salted, dried, limed,pickled or otherwise preserved, but not tanned, parchmentdressed or further prepared), whether or not with wool on orsplit, other than those excluded by Note 1 (c) to this Chapter.",5215342.0
202101,4104,"Tanned or crust hides and skins of bovine (including buffalo) or equine animals, without hair on, whether or not split, but not further prepared.",20939586.0
202101,4105,"Tanned or crust skins of sheep or lambs, without wool on, whether or not split, but not further prepared.",4181092.0
202101,4106,"Tanned or crust hides and skins of other animals, without wool whether or not split, but not further prepared.",3540912.0
202101,4107,"Leather further prepared after tanning or crusting, including parchmentdressed leather, of bovine (including buffalo) or equine animals, without hair on, whether or not split, other than leather of heading 41.14.",434031084.0
202101,4112,"Leather further prepared after tanning or crusting, including parchmentdressed leather, of sheep or lamb, without wool on, whether or not split, other than leather of heading 41.14.",9102005.0
202101,4113,"Leather further prepared after tanning or crusting, including parchmentdressed leather, of other animals, without wool or hair on, whether or not split, other than leather of heading 41.14.",16557171.0
202101,4114,Chamois (including combination chamois) leather; patentleather and patent laminated leather; metallised leather.,5859431.0
202101,4115,"Composition leather with a basis of leather or leather fibre, in slabs, sheets or strip, whether or not in rolls; parings and other waste of leather or of composition leather, not suitable for the manufacture of leather articles; leather dust, powder and flour.",11705616.0
202101,4201,"Saddlery and harness for any animal, incl. traces, leads, knee pads, muzzles, saddle cloths, saddlebags, dog coats and the like, of any material",631633611.0
202101,4202,"Trunks, suitcases, vanitycases, executivecases, briefcases, school satchels, spectacle cases, binocular cases, camera cases, musical instrument cases, gun cases, holsters and similar containers; travellingbags, insulated food or beverages bags, toilet bags, rucksacks, handbags, shoppingbags, wallets, purses, mapcases, cigarettecases, tobaccopouches, tool bags, sports bags, bottlecases, jewellery boxes, powderboxes, cutlery cases and similar containers, of leather or of composition leather, of sheeting of plastics, of textile materials, of vulcanised fibre or of paperboard, or wholly or mainly covered with such materials or with paper.",14707994377.0
202101,4203,"Articles of apparel and clothing accessories, of leather or of composition leather.",492648680.0
202101,4205,Other articles of leather or of composition leather.,271991262.0
202101,4302,"Tanned or dressed furskins (including heads, tails, paws and other pieces or cuttings), unassembled, or assembled (without the addition of other materials) other than those of heading 43.03.",75755740.0
202101,4303,"rticles of apparel, clothing accessories and other articles of furskin.",2466014871.0
202101,4304,Artificial fur and articles thereof.,13118614.0
202101,4401,"Fuel wood, in logs, billets, twigs, faggots or similar forms; wood in chips or particles; sawdust and wood waste and scrap, whether or not agglomerated in logs, briquettes, pellets or similar forms",6364631.0
202101,4402,"Wood charcoal (including shell or nut charcoal), whether or notagglomerated.",107435358.0
202101,4404,"Hoopwood; split poles; piles, pickets and stakes of wood, pointed but not sawn lengthwise; wooden sticks, roughly trimmed but not turned, bent or otherwise worked, suitable for the manufacture of walkingsticks,umbrellas, tool handles or the like; chipwood and the like.",4578028.0
202101,4405,Wood wool; wood flour.,1023283.0
202101,4406,Railway or tramway sleepers (crossties) of wood.,211737.0
202101,4407,"Wood sawn or chipped lengthwise, sliced or peeled, whether or not planed, sanded or endjointed, of a thickness exceeding 6 mm.",82969751.0
202101,4408,"Sheets for veneering, incl. those obtained by slicing laminated wood, for plywood or for other similar laminated wood and other wood, sawn lengthwise, sliced or peeled, whether or not planed, sanded, spliced or end-jointed, of a thickness of ≤ 6 mm",416954175.0
202101,4409,"Wood, incl. strips and friezes for parquet flooring, not assembled, continuously shaped tongued, grooved, rebated, chamfered, V-jointed beaded, moulded, rounded or the like"" along any of its edges, ends or faces, whether or not planed, sanded or end-jointed""",142167917.0
202101,4410,"Particle board, oriented strand board (OSB) and similar board (for example, waferboard) of wood or other ligneous materials, whether or not agglomerated with resins or other organic binding substances.",155128759.0
202101,4411,"Fibreboard of wood or other ligneous materials, whether or not bonded with resins or other organic substances.",634481634.0
202101,4412,"Plywood, veneered panels and similar laminated wood.",2695346655.0
202101,4413,"Densified wood, in blocks, plates, strips or profile shapes.",7994849.0
202101,4414,"Wooden frames for paintings, photographs, mirrors or similar objects.",297256966.0
202101,4415,"Packing cases, boxes, crates, drums and similar packings, of wood; cabledrums of wood; pallets, box pallets and other loadboards,of wood; pallet collars of wood.",52724660.0
202101,4416,"Casks, barrels, vats, tubs and other coopers' products and parts thereof, of wood, including staves.",5190284.0
202101,4417,"Tools, tool bodies, tool handles, broom or brush bodies and handles, of wood; boot or shoe lasts and trees, of wood.",122786717.0
202101,4418,"Builders' joinery and carpentry of wood, including cellular wood panels, assembled flooring panels, shingles and shakes.",631659006.0
202101,4419,"Tableware and kitchenware, of wood.",648996511.0
202101,4420,"Wood marquetry and inlaid wood; caskets and cases for jewellery or cutlery, and similar articles, of wood; statuettes and other ornaments, of wood; wooden articles of furniture (excluding furniture, lighting fixtures and parts thereof)",801752258.0
202101,4421,Other articles of wood.,2174460669.0
202101,4501,"Natural cork, raw or merely surface-worked or otherwise cleaned; cork waste; crushed, powdered or ground cork",12155.0
202101,4503,Articles of natural cork.,479824.0
202101,4504,"Agglomerated cork, with or without a binding substance, and articles of agglomerated cork",16590472.0
202101,4601,"Plaits and similar products of plaiting materials, whether or not assembled into strips; plaiting materials, plaits and similar products of plaiting materials, bound together in parallel strands or woven, in sheet form, whether or not being finished articles (for example, mats, matting, screens).",286224308.0
202101,4602,"Basketwork, wickerwork and other articles, made directly to shape from plaiting materials or made up from goods of heading 46.01; articles of loofah.",852958783.0
202101,4701,Mechanical wood pulp.,48234.0
202101,4702,"Chemical wood pulp, dissolving grades.",583216.0
202101,4703,"Chemical wood pulp, soda or sulphate, other than dissolving grades.",10229259.0
202101,4706,"Pulps of fibres derived from recovered waste and scrap"" paper or paperboard or of other fibrous cellulosic material""",42504568.0
202101,4801,"Newsprint, in rolls or sheets.",8123986.0
202101,4802,"Uncoated paper and paperboard, of a kind used for writing, printing or other graphic purposes, and non perforated punchcards and punch tape paper, in rolls or rectangular (including square) sheets, of any size, other than paper of heading 48.01 or 48.03; handmade paper and paperboard.",420895032.0
202101,4803,"Toilet or facial tissue stock, towel or napkin stock and similar paper of a kind used for household or sanitary purposes, cellulose wadding and webs of cellulose fibres, whether or not creped, crinkled, embossed, perforated, surfacecoloured, surfacedecorated or printed, in rolls or sheets.",88938396.0
202101,4804,"Uncoated kraft paper and paperboard, in rolls or sheets, other than that of heading 48.02 or 48.03.",63631531.0
202101,4805,"Other uncoated paper and paperboard, in rolls or sheets, not further worked or processed than as specified in Note 3 to this Chapter.",371089505.0
202101,4806,"vegetable parchment, greaseproof papers, tracing papers and glassine and other glazed transparent or translucent papers, in rolls or sheets.",102392393.0
202101,4807,"Composite paper and paperboard (made by sticking flat layers of paper or paperboard together with an adhesive), not surfacecoated or impregnated, whether or not internally reinforced, in rolls or sheets.",8250519.0
202101,4808,"Paper and paperboard, corrugated (with or without glued flat surface sheets), creped, crinkled, embossed or perforated, in rolls or sheets, other than paper of the kind described in heading 48.03.",70648066.0
202101,4809,"Carbon paper, selfcopy paper and other copying or transfer papers (including coated or impregnated paper for duplicator stencils or offset plates), whether or not printed, in rolls or sheets.",130431389.0
202101,4810,"Paper and paperboard, coated on one or both sides with kaolin (China clay) or other inorganic substances, with or without a binder, and with no other coating, whether or not surface coloured, surfacedecorated or printed, in rolls or rectangular (including square) sheets, of any size.",1204072178.0
202101,4811,"Paper, paperboard, cellulose wadding and webs of cellulose fibres,coated,impregnated,covered, surfacecoloured, surface decorated or printed, in rolls or rectangular (including square) sheets, of any size, other than goods of the kind described in heading 48.03, 48.09 or 48.10.",1102117036.0
202101,4812,"Filter blocks, slabs and plates, of paper pulp.",2002191.0
202101,4813,"Cigarette paper, whether or not cut to size or in the form of booklets or tubes.",58635808.0
202101,4814,Wallpaper and similar wall coverings; window transparencies of paper.,307956166.0
202101,4816,"Carbon paper, self-copy paper and other copying or transfer papers, in rolls of a width of ≤ 36 cm or in rectangular or square sheets with no side measuring ＞ 36 cm in the unfolded state, or cut into shapes other than rectangles or squares, together with full duplicator stencils and offset plates of paper, whether or not in boxes",123711679.0
202101,4817,"Envelopes, letter cards, plain postcards and correspondence cards, of paper or paperboard; boxes, pouches, wallets and writing compendiums, of paper or paperboard, containing an assortment of paper stationery.",193121491.0
202101,4818,"Toilet paper and similar paper, cellulose wadding or webs of cellulose fibres, of a kind used for household or sanitary purposes, in rolls of a width ≤ 36 cm, or cut to size or shape; handkerchiefs, cleansing tissues, towels, tablecloths, serviettes, bedsheets and similar household, sanitary or hospital articles, articles of apparel and clothing accessories, of paper pulp, paper, cellulose wadding or webs of cellulose fibres",1041560320.0
202101,4819,"Cartons, boxes, cases, bags and other packing containers, of paper, paperboard, cellulose wadding or webs of cellulose fibres, n.e.s.; box files, letter trays, and similar articles, of paperboard of a kind used in offices, shops or the like",3490103817.0
202101,4820,"Registers, account books, note books, order books, receipt books, letter pads, memorandum pads,diaries and similar articles, exercise books, blottingpads, binders (looseleaf or other), folders, file covers, manifold business forms, interleaved carbon sets and other articles of stationery, of paper or paperboard; albums for samples or for collections and book covers, of paper or paperboard.",706257623.0
202101,4821,"paper or paperboard labels of all kinds, whether or not printed.",537419527.0
202101,4822,"Bobbins, spools, cops and similar supports of paper pulp, paper or paperboard (whether or not perforated or hardened).",29781756.0
202101,4823,"Other paper, paperboard, cellulose wadding and webs of cellulose fibres, cut to size or shape; other articles of paper pulp, paper,paperboard, cellulose wadding or webs of cellulose fibres.",1927726663.0
202101,4901,"Printed books, brochures, leaflets and similar printed matter, whether or not in single sheets.",517297189.0
202101,4902,"Newspapers, journals and periodicals, whether or not illustrated or containing advertising material.",7908613.0
202101,4903,"Children's picture, drawing or colouring books.",329757358.0
202101,4904,"Music, printed or in manuscript, whether or not bound or illustrated",14224.0
202101,4905,"Maps and hydrographic or similar charts of all kinds, including atlases, wall maps, topographical plans and globes, printed.",7054063.0
202101,4906,"Plans and drawings for architectural, engineering, industrial, commercial, topographical or similar purposes, being originals drawn by hand; handwritten texts; photographic reproductions on sensitised paper and carbon copies of the foregoing",1083043.0
202101,4907,"Unused postage, revenue or similar stamps of current or new issue in the country in which they have, or will have, a recognised face value; stamp-impressed paper; banknotes; cheque forms; stock, share or bond certificates and similar documents of title",16116269.0
202101,4908,Transfers (decalcomanias),175070834.0
202101,4909,"Printed or illustrated postcards; printed cards bearing personal greetings, messages or announcements, whether or not illustrated, with or without envelopes or trimmings.",278081980.0
202101,4910,"Calendars of any kind, printed, including calendar blocks.",20354683.0
202101,4911,"Other printed matter, including printed pictures and photographs.",606554807.0
202101,5002,Raw silk (not thrown).,83988107.0
202101,5003,"Silk waste (including cocoons unsuitable for reeling, yarn waste and garnetted stock).",12205838.0
202101,5004,Silk yarn (other than yarn spun from silk waste) not put up for retail sale.,28218503.0
202101,5005,"Yarn spun from silk waste, not put up for retail sale.",52979933.0
202101,5006,"Silk yarn and yarn spun from silk waste, put up for retail sale;silkworm gut.",199461.0
202101,5007,Woven fabrics of silk or of silk waste.,170029317.0
202101,5101,"Wool, not carded or combed.",13895412.0
202101,5102,"Fine or coarse animal hair, not carded or combed.",3606803.0
202101,5103,"Waste of wool or of fine or coarse animal hair, including yarn waste but excluding garnetted stock.",4058004.0
