Date of data,Commodity code,Commodity,Renminbi Yuan
202311,0102,Live bovine animals,30360078
202311,0103,Live swine,245786311
202311,0104,Live sheep and goats,621872
202311,0105,"Live poultry, that is to say, fowls of the species Gallus domesticus, ducks, geese, turkeys and guinea fowls",1163686
202311,0106,Other live animals,26961763
202311,0201,"Meat of bovine animals, fresh or chilled",64135
202311,0202,"Meat of bovine animals, frozen",1704164
202311,0203,"Meat of swine, fresh, chilled or frozen",66208478
202311,0204,"Meat of sheep or goats, fresh, chilled or frozen",15913782
202311,0205,"Meat of horses, asses, mules or hinnies, fresh, chilled or frozen",5186980
202311,0206,"Edible offal of bovine animals, swine, sheep, goats, horses, asses, mules or hinnies, fresh, chilled or frozen",1827841
202311,0207,"Meat and edible offal, of the poultry of heading 0105, fresh, chilled or frozen",516188192
202311,0208,"Other meat and edible meat offal, fresh, chilled or frozen",26690997
202311,0209,"Pig fat, free of lean meat, and poultry fat, not rendered or otherwise extracted, fresh, chilled, frozen, salted, in brine, dried or smoked",290000
202311,0210,"Meat and edible meat offal, salted, in brine, dried or smoked; edible flours and meals of meat or meat offal",5346754
202311,0301,Live fish,396907621
202311,0302,"Fish, fresh or chilled, excluding fish fillets and other fish meat of heading 0304",241057714
202311,0303,"Fish, frozen, excluding fish fillets and other fish meat of heading 0304",1622212473
202311,0304,"Fish fillets and other fish meat (whether or not minced), fresh, chilled or frozen",1840145929
202311,0305,"Fish, dried, salted or in brine; smoked fish, whether or not cooked before or during the smoking process",238087199
202311,0306,"Crustaceans, whether in shell or not, live, fresh, chilled, frozen, dried, salted or in brine; smoked crustaceans, whether in shell or not, whether or not cooked before or during the smoking process; crustaceans, in shell, cooked by steaming or by boiling in water, whether or not chilled, frozen, dried, salted or in brine",726821841
202311,0307,"Molluscs, whether in shell or not, live, fresh, chilled, frozen, dried, salted or in brine; smoked molluscs, whether in shell or not, whether or not cooked before or during the smoking process",1640854476
202311,0308,"Aquatic invertebrates other than crustaceans and molluscs, live, fresh, chilled, frozen, dried, salted or in brine; smoked aquatic invertebrates other than crustaceans and molluscs, whether or not cooked before or during the smoking process",44564999
202311,0309,"Flours, meals and pellets of fish, crustaceans, molluscs and other aquatic invertebrates, fit for human consumption",6528003
202311,0401,"Milk and cream, not concentrated nor containing added sugar or other sweetening matter.",15729662
202311,0402,"Milk and cream, concentrated or containing added sugar or other sweetening matter",34035952
202311,0403,"Yogurt; buttermilk, curdled milk and cream, kephir and other fermented or acidified milk and cream, whether or not concentrated or containing added sugar or other sweetening matter or flavoured or containing added fruit, nuts or cocoa",7331943
202311,0404,"Whey, whether or not concentrated or containing added sugar or other sweetening matter; products consisting of natural milk constituents, whether or not containing added sugar or other sweetening matter, not elsewhere specified or included",975284
202311,0405,Butter and other fats and oils derived from milk; dairy spreads,8514018
202311,0406,Cheese and curd,2185672
202311,0407,"Birds' eggs, in shell, fresh, preserved or cooked",165774813
202311,0408,"Birds' eggs, not in shell, and egg yolks, fresh, dried, cooked by steaming or by boiling in water, moulded, frozen or otherwise preserved, whether or not containing added sugar or other sweetening matter",24719308
202311,0409,atural honey,177645723
202311,0410,"Insects and other edible products of animal origin, not elsewhere specified or included",36739074
202311,0502,"Pigs', hogs' or boars' bristles and hair; badger hair and other brush making hair; waste of such bristles or hair",17282417
202311,0504,"Guts, bladders and stomachs of animals (other than fish), whole and pieces thereof, fresh, chilled, frozen, salted, in brine, dried or smoked",443242168
202311,0505,"Skins and other parts of birds, with their feathers or down, feathers and parts of feathers (whether or not with trimmed edges) and down, not further worked than cleaned, disinfected or treated for preservation;powder and waste of feathers or parts of feathers",284546013
202311,0507,"Ivory, tortoiseshell, whalebone and whalebone hair, horns, antlers, hooves, nails, claws and beaks, unworked or simply prepared but not cut to shape; powder and waste of these products",22727781
202311,0508,"Coral and similar materials, unworked or simply prepared bunot otherwise worked; shells of molluscs, crustaceans or echinoderms and cuttlebone, unworked or simply prepared bunot cut to shape, powder and waste thereof",4367224
202311,0510,"Ambergris, castoreum, civet and musk; cantharides; bile, whether or not dried; glands and other animal products used in the preparation of pharmaceutical products, fresh, chilled, frozen or otherwise provisionally preserved",1053107
202311,0511,"Animal products not elsewhere specified or included; dead animals of Chapter 1 or 3, unfit for human consumption",67560267
202311,0601,"Bulbs, tubers, tuberous roots, corms, crowns and rhizomes, dormant, in growth or in flower; chicory plants and roots other than roots of heading 12.12.",245851
202311,0602,"Other live plants (including their roots), cuttings and slips; mushroom spawn.",193779501
202311,0603,"Cut flowers and flower buds of a kind suitable for bouquets or for ornamental purposes, fresh, dried, dyed, bleached, impregnated or otherwise prepared.",86279311
202311,0604,"Foliage, branches and other parts of plants, without flowers or flower buds, and grasses, mosses and lichens, being goods of a kind suitable for bouquets or for ornamental purposes, fresh,dried, dyed, bleached, impregnated or otherwise prepared",52133504
202311,0701,"Potatoes, fresh or chilled.",177023822
202311,0702,"Tomatoes, fresh or chilled.",125678515
202311,0703,"Onions, shallots, garlic, leeks and other alliaceous vegetables, fresh or chilled.",2630348838
202311,0704,"Cabbages, cauliflowers, kohlrabi, kale and similar edible brassicas, fresh or chilled.",490316891
202311,0705,"Lettuce (Lactuca sativa) and chicory (Cichorium spp.), fresh or chilled.",280068075
202311,0706,"Carrots, turnips, salad beetroot, salsify, celeriac, radishes and similar edible roots, fresh or chilled.",387616997
202311,0707,"Cucumbers and gherkins, fresh or chilled.",27343156
202311,0708,"Leguminous vegetables, shelled or unshelled, fresh or chilled.",155159733
202311,0709,"Other vegetables, fresh or chilled.",1111896795
202311,0710,"Vegetables (uncooked or cooked by steaming or boiling in water),frozen.",1023113642
202311,0711,"Vegetables provisionally preserved, but unsuitable in that state for immediate consumption.",113709182
202311,0712,"Dried vegetables, whole, cut, sliced, broken or in powder, but not further prepared.",1145448652
202311,0713,"Dried leguminous vegetables, shelled, whether or not skinned or split.",212800889
202311,0714,"Manioc, arrowroot, salep, Jerusalem artichokes, sweet potatoes and similar roots and tubers with high starch or inulin content, fresh, chilled, frozen or dried, whether or not sliced or in the form of pellets; sago pith.",142744091
202311,0801,"Coconuts, Brazil nuts and cashew nuts, fresh or dried, whether or not shelled or peeled.",1997848
202311,0802,"Other nuts, fresh or dried, whether or not shelled or peeled.",952602812
202311,0803,"Bananas, including plantains, fresh or dried.",26574828
202311,0804,"Dates, figs, pineapples, avocados, guavas, mangoes and mangosteens, fresh or dried.",42491017
202311,0805,"Citrus fruit, fresh or dried.",1462396538
202311,0806,"Grapes, fresh or dried.",944366203
202311,0807,"Melons (including watermelons) and papaws (papayas), fresh",90980769
202311,0808,"Apples, pears and quinces, fresh.",1343091978
202311,0809,"Apricots, cherries, peaches (including nectarines), plums and sloes, fresh.",12258484
202311,0810,Other fresh fruits,389420422
202311,0811,"Fruit and nuts, uncooked or cooked by steaming or boiling in water, frozen, whether or not containing added sugar or other sweetening matter.",147645791
202311,0812,"Fruit and nuts provisionally preserved, but unsuitable in that state for immediate consumption.",93693449
202311,0813,"Fruit, dried, other than that of headings 08.01 to 08.06; mixtures of nuts or dried fruits of this Chapter.",170011378
202311,0814,"Peel of citrus fruit or melons (including watermelons), fresh, frozen, dried or provisionally preserved in brine, in sulphur water or in other preservative solutions.",3990870
202311,0901,"Coffee, whether or not roasted or decaffeinated; coffee husks and skins; coffee substitutes containing coffee in any proportion.",13401547
202311,0902,"Tea, whether or not flavoured.",1099393227
202311,0904,Pepper of the genus Piper; dried or crushed or ground fruits of the genus Capsicum or of the genus Pimenta.,549562171
202311,0906,Cinnamon and cinnamontree flowers.,76769756
202311,0907,"loves (whole fruit, cloves and stems).",1563143
202311,0908,"Nutmeg, mace and cardamoms.",523154
202311,0909,"Seeds of anise, badian, fennel, coriander, cumin or caraway; juniper berries.",39814931
202311,0910,"Ginger, saffron, turmeric (curcuma), thyme, bay leaves, curry and other spices.",310126587
202311,1001,Wheat and meslin.,7329118
202311,1003,Barley,8615
202311,1004,Oats,31732
202311,1005,Maize (corn).,8400000
202311,1006,Rice.,813905207
202311,1007,Grain sorghum.,1283575
202311,1008,"Buckwheat, millet and canary seeds; other cereals.",21435650
202311,1101,Wheat or meslin flour.,47894175
202311,1102,Cereal flours other than of wheat or meslin.,1092260
202311,1103,"Cereal groats, meal and pellets.",7141
202311,1104,"Cereal grains otherwise worked (for example, hulled, rolled, flaked, pearled, sliced or kibbled), except rice of heading 10.06; germ of cereals, whole, rolled, flaked or ground.",38578940
202311,1105,"Flour, meal, powder, flakes, granules and pellets of potatoes.",177334
202311,1106,"Flour, meal and powder of the dried leguminous vegetables of heading 07.13, of sago or of roots or tubers of heading 07.14 or of the products of Chapter 8.",17191819
202311,1107,"Malt, whether or not roasted.",167134810
202311,1108,tarches; inulin.,43909196
202311,1109,"Wheat gluten, whether or not dried.",179475046
202311,1201,"Soya beans, whether or not broken.",103093499
202311,1202,"Groundnuts, not roasted or otherwise cooked, whether or not shelled or broken.",238617191
202311,1203,Copra,7538
202311,1204,"Linseed, whether or not broken.",891672
202311,1206,"Sunflower seeds, whether or not broken.",996391628
202311,1207,"Other oil seeds and oleaginous fruits, whether or not broken.",256650163
202311,1208,"Flours and meals of oil seeds or oleaginous fruits, other than those of mustard.",29018965
202311,1209,"Seeds, fruit and spores, of a kind used for sowing.",47019176
202311,1210,"Hop cones, fresh or dried, whether or not ground, powdered or in the form of pellets; lupulin.",1797557
202311,1211,"lants and parts of plants (including seeds and fruits), of a kind used primarily in perfumery, in pharmacy or for insecticidal, fungicidal or similar purposes, fresh, chilled, frozen or dried, whether or not cut, crushed or powdered.",612615714
202311,1212,"Locust beans, seaweeds and other algae, sugar beet and sugar cane, fresh, chilled, frozen or dried, whether or not ground; fruit stones and kernels and other vegetable products (including unroasted chicory roots of the variety Cichorium intybus sativum) of a kind used primarily for human consumption, not elsewhere specified or included.",594962203
202311,1213,"Cereal straw and husks, unprepared, whether or not chopped,ground, pressed or in the form of pellets.",1150328
202311,1214,"wedes, mangolds, fodder roots, hay, lucerne (alfalfa), clover, sainfoin, forage kale, lupines, vetches and similar forage products, whether or not in the form of pellets.",944802
202311,1301,"Lac; natural gums, resins, gumresins and oleoresins (for example, balsams).",2895699
202311,1302,"Vegetable saps and extracts; pectic substances, pectinates and pectates; agaragar and other mucilages and thickeners, whether or not modified, derived from vegetable products.",1429442933
202311,1401,"Vegetable materials of a kind used primarily for plaiting (for example, bamboos, rattans, reeds, rushes, osier, raffia, cleaned, bleached or dyed cereal straw, and lime bark).",41994128
202311,1404,Vegetable products not elsewhere specified or included.,114012539
202311,1501,"Pig fat (including lard) and poultry fat, other than that of heading 02.09 or 15.03",1298427
202311,1502,"Fats of bovine animals, sheep or goats, other than those of heading 15.03.",3541612
202311,1504,"ats and oils and their fractions, of fish or marine mammals, whether or not refined, but not chemically modified.",290807526
202311,1505,Wool grease and fatty substances derived therefrom (including lanolin).,25739606
202311,1506,"Other animal fats and oils and their fractions, whether or not refined, but not chemically modified.",1919408
202311,1507,"oyabean oil and its fractions, whether or not refined, but not chemically modified.",104913621
202311,1508,"Groundnut oil and its fractions, whether or not refined, but not chemically modified.",13743447
202311,1509,"Olive oil and its fractions, whether or not refined, but not chemically modified.",5272
202311,1510,"Other oils and their fractions, obtained solely from olives, whether or not refined, but not chemically modified, including blends of these oils or fractions with oils or fractions of heading 15.09",3895
202311,1511,"Palm oil and its fractions, whether or not refined, but not chemically modified.",21299730
202311,1512,"unflowerseed, safflower or cottonseed oil and fractions thereof, whether or not refined, but not chemically modified.",6025257
202311,1513,"Coconut (copra), palm kernel or babassu oil and fractions thereof, whether or not refined, but not chemically modified.",5293
202311,1514,"Rape, colza or mustard oil and fractions thereof, whether or not refined, but not chemically modified.",5295787
202311,1515,"Other fixed vegetable or microbial fats and oils (including jojoba oil) and their fractions, whether or not refined, but not chemically modified",111031059
202311,1516,"Animal，vegetable or microbial fats and oils and their fractions, partly or wholly hydrogenated, interesterified, reesterified or elaidinised, whether or not refined, but not further prepared.",326539486
202311,1517,"Margarine; edible mixtures or preparations of animal, vegetable or microbial fats or oils or of fractions of different fats or oils of this Chapter, other than edible fats and oils or their fractions of heading 15.16.",24313678
202311,1518,"Animal, vegetable or microbial fats and oils and their fractions, boiled, oxidised, dehydrated, sulphurised, blown, polymerised by heat in vacuum or in inert gas or otherwise chemically modified, excluding those of heading 15.16; inedible mixtures or preparations of animal, vegetable or microbial fats or oils or of fractions of different fats or oils of this Chapter, not elsewhere specified or included",1524552218
202311,1520,"Glycerol, crude; glycerol waters and glycerol lyes.",322820
202311,1521,"egetable waxes (other than triglycerides), beeswax, other insect waxes and spermaceti, whether or not refined or coloured.",39735715
202311,1522,Degras; residues resulting from the treatment of fatty substances or animal or vegetable waxes.,51908
202311,1601,"Sausages and similar products, of meat, meat offal, blood or insects; food preparations based on these products",70134545
202311,1602,"Other prepared or preserved meat, meat offal, blood or insects",1124572169
202311,1603,"Extracts and juices of meat, fish or crustaceans, molluscs or other aquatic invertebrates.",17543204
202311,1604,Prepared or preserved fish; caviar and caviar substitutes prepared from fish eggs.,2873028445
202311,1605,"rustaceans, molluscs and other aquatic invertebrates, prepared or preserved.",2847639831
202311,1701,"Cane or beet sugar and chemically pure sucrose, in solid form.",172941360
202311,1702,"Other sugars, including chemically pure lactose, maltose, glucose and fructose, in solid form; sugar syrups not containing added flavouring or colouring matter; artificial honey, whether or not mixed with natural honey; caramel.",835306325
202311,1703,olasses resulting from the extraction or refining of sugar.,2569
202311,1704,"ugar confectionery (including white chocolate), not containing cocoa.",1029202561
202311,1801,"Cocoa beans, whole or broken, raw or roasted",38056
202311,1803,"Cocoa paste, whether or not defatted.",1662434
202311,1804,"Cocoa butter, fat and oil",31216894
202311,1805,"Cocoa powder, not containing added sugar or other sweetening matter",9479663
202311,1806,hocolate and other food preparations containing cocoa.,341553102
202311,1901,"Malt extract; food preparations of flour, groats, meal, starch or malt extract, not containing cocoa or containing less than 40% by weight of cocoa calculated on a totally defatted basis, not elsewhere specified or included; food preparations of goods of headings 04.01 to 04.04,not containing cocoa or containing less than 5% by weight of cocoa calculated on a totally efatted basis, not elsewhere specified or included.",218742609
202311,1902,"Pasta, whether or not cooked or stuffed (with meat or other substances) or otherwise prepared, such as spaghetti, macaroni, noodles, lasagne, gnocchi, ravioli, cannelloni; couscous, whether or not prepared.",787391133
202311,1903,"Tapioca and substitutes therefor prepared from starch, in the form of flakes, grains, pearls, siftings or in similar forms",11892330
202311,1904,"repared foods obtained by the swelling or roasting of cereals or cereal products (for example, corn flakes); cereals (other than maize (corn)) in grain form or in the form of flakes or other worked grains (except flour, groats and meal), precooked, or otherwise prepared, not elsewhere specified or included.",200616992
202311,1905,"read, pastry, cakes, biscuits and other bakers' wares, whether or not containing cocoa; communion wafers, empty cachets of a kind suitable for pharmaceutical use, sealing wafers, rice paper and similar products.",445837844
202311,2001,"Vegetables, fruit, nuts and other edible parts of plants, prepared or preserved by vinegar or acetic acid.",83282516
202311,2002,Tomatoes prepared or preserved otherwise than by vinegar or acetic acid.,1110961866
202311,2003,"Mushrooms and truffles, prepared or preserved otherwise than by vinegar or acetic acid.",402843763
202311,2004,"Other vegetables prepared or preserved otherwise than by vinegar or acetic acid, frozen, other than products of heading 20.06.",404331463
202311,2005,"Other vegetables prepared or preserved otherwise than by vinegar or acetic acid, not frozen, other than products of heading 20.06.",1279548473
202311,2006,"Vegetables, fruit, nuts, fruitpeel and other parts of plants, preserved by sugar (drained, glacé or crystallised).",214360363
202311,2007,"Jams, fruit jellies, marmalades, fruit or nut purée and fruit or nut pastes, obtained by cooking, whether or not containing added sugar or other sweetening matter.",50507599
202311,2008,"Fruit, nuts and other edible parts of plants, otherwise prepared or preserved, whether or not containing added sugar or other sweetening matter or spirit, not elsewhere specified or included.",1921206352
202311,2009,"Fruit or nut juices (including grape must and coconut water) and vegetable juices, unfermented and not containing added spirit, whether or not containing added sugar or other sweetening matter",439161293
202311,2101,"Extracts, essences and concentrates, of coffee, tea or maté and preparations with a basis of these products or with a basis of coffee, tea or mate; roasted chicory and other roasted coffee substitutes, and extracts, essences and concentrates thereof",141220574
202311,2102,"Yeasts (active or inactive); other singlecell microorganisms, dead (but not including vaccines of heading 30.02); prepared baking powders.",284428643
202311,2103,"Sauce and preparations therefor; mixed condiments and mixed seasonings; mustard flour and meal, whether or not prepared, and mustard",880926767
202311,2104,Soups and broths and preparations therefor; homogenised composite food preparations.,50272517
202311,2105,"Ice cream and other edible ice, whether or not containing cocoa.",25679077
202311,2106,Food preparations not elsewhere specified or included.,2077659561
202311,2201,"Waters, including natural or artificial mineral waters andaerated waters, not containing added sugar or other sweetening matter nor flavoured; ice and snow.",476762161
202311,2202,"Waters, including mineral waters and aerated waters, containing added sugar or other sweetening matter or flavoured, and other non-alcoholic beverages, not including fruit, nut or vegetable juices of heading 20.09",262267286
202311,2203,Beer made from malt.,282937383
202311,2204,"Wine of fresh grapes, including fortified wines; grape must other than that of heading 20.09.",24272629
202311,2205,Vermouth and other wine of fresh grapes flavoured with plants or aromatic substances.,142232
202311,2206,"Other fermented beverages (for example, cider, perry, mead, saké); mixtures of fermented beverages and mixtures of fermented beverages and nonalcoholic beverages, not elsewhere specified or included.",21041031
202311,2207,"Undenatured ethyl alcohol of an alcoholic strength by volume of 80% vol.or higher; ethyl alcohol and other spirits, denatured, of any strength.",66509896
202311,2208,"Undenatured ethyl alcohol of an alcoholic strength by volume of Undenatured ethyl alcohol of an alcoholic strength by volume of less than 80% vol.; spirits, liqueurs and other spirituous beverages.",1071404612
202311,2209,Vinegar and substitutes for vinegar obtained from acetic acid.,17781588
202311,2301,"Flours, meals and pellets, of meat or meat offal, of fish or ofcrustaceans, molluscs or other aquatic invertebrates, unfit for human consumption; greaves.",1355044
202311,2302,"Bran, sharps and other residues, whether or not in the form of pellets, derived from the sifting, milling or other working of cereals or of leguminous plants.",4201565
202311,2303,"Residues of starch manufacture and similar residues, beetpulp, bagasse and other waste of sugar manufacture, brewing ordistilling dregs and waste, whether or not in the form of pellets.",308732717
202311,2304,"Oilcake and other solid residues, whether or not ground or in the form of pellets, resulting from the extraction of soyabean oil.",115348739
202311,2305,"Oilcake and other soli residues, whether or not ground or in the form of pellets, resulting from the extraction of groundnut oil.",297803
202311,2306,"Oil-cake and other solid residues, whether or not ground or in the form of pellets, resulting from the extraction of vegetable or microbial fats or oils, other than those of heading 23.04 or 23.05",16644059
202311,2308,"Vegetable materials and vegetable waste, vegetable residues and byproducts, whether or not in the form of pellets, of a kind used in animal feeding, not elsewhere specified or included.",66019175
202311,2309,Preparations of a kind used in animal feeding.,1658425220
202311,2401,Unmanufactured tobacco; tobacco refuse.,318149632
202311,2402,"Cigars, cheroots, cigarillos and cigarettes, of tobacco or of tobacco substitutes.",307925804
202311,2403,Other manufactured tobacco and manufactured tobacco substitutes; “homogenised” or reconstituted” tobacco; tobacco extracts and essences.,103116354
202311,2404,"Products containing tobacco, reconstituted tobacco, nicotine, or tobacco or nicotine substitutes, intended for inhalation without combustion; other nicotine containing products intended for the intake of nicotine into the human body",5331414226
202311,2501,"Salts, incl. table salt and denatured salt, and pure sodium chloride, whether or not in aqueous solution or containing added anti-caking or free-flowing agents; sea water",108810678
202311,2502,Unroasted iron pyrites.,3515938
202311,2503,"Sulphur of all kinds (excluding sublimed sulphur, precipitated sulphur and colloidal sulphur)",538410
202311,2504,Natural graphite.,372398723
202311,2505,"Natural sands of all kinds, whether or not coloured, other than metalbearing sands of Chapter 26.",5950974
202311,2506,"Quartz (excluding natural sands); quartzite, whether or not roughly trimmed or merely cut, by sawing or otherwise, into blocks or slabs of a square or rectangular shape",114107908
202311,2507,"Kaolin and other kaolinic clays, whether or not calcined",98840283
202311,2508,"Other clays (not including expanded clays of heading 68.06), andalusite, kyanite and sillimanite, whether or not calcined; mullite; chamotte or dinas earths.",193121000
202311,2509,Chalk.,26886
202311,2510,"Natural calcium phosphates, natural aluminium calcium phosphates and phosphatic chalk.",12084634
202311,2511,"Natural barium sulphate (barytes); natural barium carbonate (witherite), whether or not calcined, other than barium oxide of heading 28.16.",37459719
202311,2512,"Siliceous fossil meals, e.g. kieselguhr, tripolite and diatomite, and similar siliceous earths, whether or not calcined, of an apparent specific gravity of 1 or less.",6996311
202311,2513,"Pumice stone; emery; natural corundum, natural garnet and other natural abrasives, whether or not heat-treated",26901166
