Date of data,Commodity code,Commodity,Renminbi Yuan
201605,0102,Live bovine animals,31167404
201605,0103,Live swine,245308470
201605,0104,Live sheep and goats,194017
201605,0105,"Live poultry, that is to say, fowls of the species Gallus domesticus, ducks, geese, turkeys and guinea fowls",8045760
201605,0106,Other live animals,20971323
201605,0202,"Meat of bovine animals, frozen",29218772
201605,0203,"Meat of swine, fresh, chilled or frozen",132406993
201605,0204,"Meat of sheep or goats, fresh, chilled or frozen",6762498
201605,0206,"Edible offal of bovine animals, swine, sheep, goats, horses, asses, mules or hinnies, fresh, chilled or frozen",189266
201605,0207,"Meat and edible offal, of the poultry of heading 0105, fresh, chilled or frozen",319199555
201605,0208,"Other meat and edible meat offal, fresh, chilled or frozen",14955187
201605,0210,"Meat and edible meat offal, salted, in brine, dried or smoked; edible flours and meals of meat or meat offal",966284
201605,0301,Live fish,390070008
201605,0302,"Fish, fresh or chilled, excluding fish fillets and other fish meat of heading 0304",72854478
201605,0303,"Fish, frozen, excluding fish fillets and other fish meat of heading 0304",1503250758
201605,0304,"Fish fillets and other fish meat (whether or not minced), fresh, chilled or frozen",2593450366
201605,0305,"Fish, dried, salted or in brine; smoked fish, whether or not cooked before or during the smoking process; flours, meals and pellets of fish, fit for human consumption",290849617
201605,0306,"Crustaceans, whether in shell or not, live, fresh, chilled, frozen, dried, salted or in brine; smoked crustaceans, whether in shell or not, whether or not cooked before or during the smoking process; crustaceans, in shell, cooked by steaming or by boiling in water, whether or not chilled, frozen, dried, salted or in brine; flours, meals and pellets of crustaceans, fit for human consumption",901442608
201605,0307,"Molluscs, whether in shell or not, live, fresh, chilled, frozen, dried, salted or in brine; smoked molluscs, whether in shell or not, whether or not cooked before or during the smoking process; flours, meals and pellets of molluscs, fit for human consumption",2021147195
201605,0308,"Aquatic invertebrates other than crustaceans and molluscs, live, fresh, chilled, frozen, dried, salted or in brine; smoked aquatic invertebrates other than crustaceans and molluscs, whether or not cooked before or during the smoking process; flours, meals and pellets of aquatic invertebrates other than crustaceans and molluscs, fit for human consumption",70312510
201605,0401,"Milk and cream, not concentrated nor containing added sugar or other sweetening matter.",12006233
201605,0402,"Milk and cream, concentrated or containing added sugar or other sweetening matter",12305418
201605,0403,"Buttermilk, curdled milk and cream, yogurt, kephir and other fermented or acidified milk and cream, whether or not concentrated or containing added sugar or other sweetening matter or flavoured or containing added fruit, nuts or cocoa",624774
201605,0404,"Whey, whether or not concentrated or containing added sugar or other sweetening matter; products consisting of natural milk constituents, whether or not containing added sugar or other sweetening matter, not elsewhere specified or included",65871
201605,0405,Butter and other fats and oils derived from milk; dairy spreads,420359
201605,0406,Cheese and curd,552835
201605,0407,"Birds' eggs, in shell, fresh, preserved or cooked",93897639
201605,0408,"Birds' eggs, not in shell, and egg yolks, fresh, dried, cooked by steaming or by boiling in water, moulded, frozen or otherwise preserved, whether or not containing added sugar or other sweetening matter",10721560
201605,0409,atural honey,117707223
201605,0410,"dible products of animal origin, not elsewhere specified or included",39443964
201605,0502,"Pigs', hogs' or boars' bristles and hair; badger hair and other brush making hair; waste of such bristles or hair",72026749
201605,0504,"Guts, bladders and stomachs of animals (other than fish), whole and pieces thereof, fresh, chilled, frozen, salted, in brine, dried or smoked",571078702
201605,0505,"Skins and other parts of birds, with their feathers or down, feathers and parts of feathers (whether or not with trimmed edges) and down, not further worked than cleaned, disinfected or treated for preservation;powder and waste of feathers or parts of feathers",311689030
201605,0507,"Ivory, tortoiseshell, whalebone and whalebone hair, horns, antlers, hooves, nails, claws and beaks, unworked or simply prepared but not cut to shape; powder and waste of these products",7632384
201605,0508,"Coral and similar materials, unworked or simply prepared bunot otherwise worked; shells of molluscs, crustaceans or echinoderms and cuttlebone, unworked or simply prepared bunot cut to shape, powder and waste thereof",4437515
201605,0510,"Ambergris, castoreum, civet and musk; cantharides; bile, whether or not dried; glands and other animal products used in the preparation of pharmaceutical products, fresh, chilled, frozen or otherwise provisionally preserved",1270574
201605,0511,"Animal products not elsewhere specified or included; dead animals of Chapter 1 or 3, unfit for human consumption",53876619
201605,0601,"Bulbs, tubers, tuberous roots, corms, crowns and rhizomes, dormant, in growth or in flower; chicory plants and roots other than roots of heading 12.12.",4375
201605,0602,"Other live plants (including their roots), cuttings and slips; mushroom spawn.",100513909
201605,0603,"Cut flowers and flower buds of a kind suitable for bouquets or for ornamental purposes, fresh, dried, dyed, bleached, impregnated or otherwise prepared.",46590867
201605,0604,"Foliage, branches and other parts of plants, without flowers or flower buds, and grasses, mosses and lichens, being goods of a kind suitable for bouquets or for ornamental purposes, fresh,dried, dyed, bleached, impregnated or otherwise prepared",27050298
201605,0701,"Potatoes, fresh or chilled.",64349062
201605,0702,"Tomatoes, fresh or chilled.",143189630
201605,0703,"Onions, shallots, garlic, leeks and other alliaceous vegetables, fresh or chilled.",1695383998
201605,0704,"Cabbages, cauliflowers, kohlrabi, kale and similar edible brassicas, fresh or chilled.",277934467
201605,0705,"Lettuce (Lactuca sativa) and chicory (Cichorium spp.), fresh or chilled.",37963252
201605,0706,"Carrots, turnips, salad beetroot, salsify, celeriac, radishes and similar edible roots, fresh or chilled.",155768853
201605,0707,"Cucumbers and gherkins, fresh or chilled.",25491183
201605,0708,"Leguminous vegetables, shelled or unshelled, fresh or chilled.",28375020
201605,0709,"Other vegetables, fresh or chilled.",331708207
201605,0710,"Vegetables (uncooked or cooked by steaming or boiling in water),frozen.",572125859
201605,0711,"Vegetables provisionally preserved (for example, by sulphur dioxide gas, in brine, in sulphur water or in other preservative solutions), but unsuitable in that state for immediate consumption.",83363678
201605,0712,"Dried vegetables, whole, cut, sliced, broken or in powder, but not further prepared.",2092336339
201605,0713,"Dried leguminous vegetables, shelled, whether or not skinned or split.",408349689
201605,0714,"Manioc, arrowroot, salep, Jerusalem artichokes, sweet potatoes and similar roots and tubers with high starch or inulin content, fresh, chilled, frozen or dried, whether or not sliced or in the form of pellets; sago pith.",92223863
201605,0801,"Coconuts, Brazil nuts and cashew nuts, fresh or dried, whether or not shelled or peeled.",50157
201605,0802,"Other nuts, fresh or dried, whether or not shelled or peeled.",229543168
201605,0803,"Bananas, including plantains, fresh or dried.",2895400
201605,0804,"Dates, figs, pineapples, avocados, guavas, mangoes and mangosteens, fresh or dried.",22078619
201605,0805,"Citrus fruit, fresh or dried.",114072681
201605,0806,"Grapes, fresh or dried.",123692480
201605,0807,"Melons (including watermelons) and papaws (papayas), fresh.",58722314
201605,0808,"Apples, pears and quinces, fresh.",827457664
201605,0809,"Apricots, cherries, peaches (including nectarines), plums and sloes, fresh.",75822534
201605,0810,Other fresh fruits,21358042
201605,0811,"Fruit and nuts, uncooked or cooked by steaming or boiling in water, frozen, whether or not containing added sugar or other sweetening matter.",95473413
201605,0812,"Fruit and nuts, provisionally preserved (for example, by sulphur dioxide gas, in brine, in sulphur water or in other preservative solutions), but unsuitable in that state for immediate consumption.",12822254
201605,0813,"Fruit, dried, other than that of headings 08.01 to 08.06; mixtures of nuts or dried fruits of this Chapter.",70316784
201605,0814,"Peel of citrus fruit or melons (including watermelons), fresh, frozen, dried or provisionally preserved in brine, in sulphur water or in other preservative solutions.",3381074
201605,0901,"Coffee, whether or not roasted or decaffeinated; coffee husks and skins; coffee substitutes containing coffee in any proportion.",323686229
201605,0902,"Tea, whether or not flavoured.",941569716
201605,0904,Pepper of the genus Piper; dried or crushed or ground fruits of the genus Capsicum or of the genus Pimenta.,281977157
201605,0906,Cinnamon and cinnamontree flowers.,45010806
201605,0907,"loves (whole fruit, cloves and stems).",814628
201605,0909,"Seeds of anise, badian, fennel, coriander, cumin or caraway; juniper berries.",9637866
201605,0910,"Ginger, saffron, turmeric (curcuma), thyme, bay leaves, curry and other spices.",215521359
201605,1005,Maize (corn).,352982
201605,1006,Rice.,233971244
201605,1007,Grain sorghum.,9470405
201605,1008,"Buckwheat, millet and canary seeds; other cereals.",18410630
201605,1101,Wheat or meslin flour.,28725465
201605,1102,Cereal flours other than of wheat or meslin.,1261390
201605,1104,"Cereal grains otherwise worked (for example, hulled, rolled, flaked, pearled, sliced or kibbled), except rice of heading 10.06; germ of cereals, whole, rolled, flaked or ground.",32057518
201605,1105,"Flour, meal, powder, flakes, granules and pellets of potatoes.",613328
201605,1106,"Flour, meal and powder of the dried leguminous vegetables of heading 07.13, of sago or of roots or tubers of heading 07.14 or of the products of Chapter 8.",13858500
201605,1107,"Malt, whether or not roasted.",71433642
201605,1108,tarches; inulin.,49374738
201605,1109,"Wheat gluten, whether or not dried.",85446780
201605,1201,"Soya beans, whether or not broken.",77476652
201605,1202,"Groundnuts, not roasted or otherwise cooked, whether or not shelled or broken.",140489723
201605,1204,"Linseed, whether or not broken.",3350440
201605,1206,"Sunflower seeds, whether or not broken.",180510572
201605,1207,"Other oil seeds and oleaginous fruits, whether or not broken.",106189726
201605,1208,"Flours and meals of oil seeds or oleaginous fruits, other than those of mustard.",17250950
201605,1209,"Seeds, fruit and spores, of a kind used for sowing.",32123471
201605,1211,"lants and parts of plants (including seeds and fruits), of a kind used primarily in perfumery, in pharmacy or for insecticidal, fungicidal or similar purposes, fresh, chilled, frozen or dried, whether or not cut, crushed or powdered.",495671213
201605,1212,"Locust beans, seaweeds and other algae, sugar beet and sugar cane, fresh, chilled, frozen or dried, whether or not ground; fruit stones and kernels and other vegetable products (including unroasted chicory roots of the variety Cichorium intybus sativum) of a kind used primarily for human consumption, not elsewhere specified or included.",318488704
201605,1213,"Cereal straw and husks, unprepared, whether or not chopped,ground, pressed or in the form of pellets.",1173419
201605,1301,"Lac; natural gums, resins, gumresins and oleoresins (for example, balsams).",3185923
201605,1302,"Vegetable saps and extracts; pectic substances, pectinates and pectates; agaragar and other mucilages and thickeners, whether or not modified, derived from vegetable products.",826480716
201605,1401,"Vegetable materials of a kind used primarily for plaiting (for example, bamboos, rattans, reeds, rushes, osier, raffia, cleaned, bleached or dyed cereal straw, and lime bark).",44172623
201605,1404,Vegetable products not elsewhere specified or included.,15549584
201605,1502,"Fats of bovine animals, sheep or goats, other than those of heading 15.03.",147328
201605,1504,"ats and oils and their fractions, of fish or marine mammals, whether or not refined, but not chemically modified.",74432721
201605,1505,Wool grease and fatty substances derived therefrom (including lanolin).,28148748
201605,1506,"Other animal fats and oils and their fractions, whether or not refined, but not chemically modified.",521489
201605,1507,"oyabean oil and its fractions, whether or not refined, but not chemically modified.",30061566
201605,1508,"Groundnut oil and its fractions, whether or not refined, but not chemically modified.",13565969
201605,1509,"Olive oil and its fractions, whether or not refined, but not chemically modified.",1495926
201605,1511,"Palm oil and its fractions, whether or not refined, but not chemically modified.",3263562
201605,1512,"unflowerseed, safflower or cottonseed oil and fractions thereof, whether or not refined, but not chemically modified.",531760
201605,1513,"Coconut (copra), palm kernel or babassu oil and fractions thereof, whether or not refined, but not chemically modified.",139800
201605,1514,"Rape, colza or mustard oil and fractions thereof, whether or not refined, but not chemically modified.",1655283
201605,1515,"Other fixed vegetable fats and oils (including jojoba oil) and their fractions, whether or not refined, but not chemically modified.",45368526
201605,1516,"Animal or vegetable fats and oils and their fractions, partly or wholly hydrogenated, interesterified, reesterified or elaidinised, whether or not refined, but not further prepared.",112903
201605,1517,"Margarine; edible mixtures or preparations of animal or vegetable fats or oils or of fractions of different fats or oils of this Chapter, other than edible fats or oils or their fractions of heading 15.16.",12660991
201605,1518,"Animal or vegetable fats and oils and their fractions, boiled, oxidised,dehydrated, sulphurised, blown, polymerised by heat in vacuum or in inert gas or otherwise chemically modified, excluding those of heading 15.16; inedible mixtures or preparations of animal or vegetable fats or oils or of fractions of different fats or oils of this Chapter, not elsewhere specified or included.",54943760
201605,1521,"egetable waxes (other than triglycerides), beeswax, other insect waxes and spermaceti, whether or not refined or coloured.",42007323
201605,1522,Degras; residues resulting from the treatment of fatty substances or animal or vegetable waxes.,20614
201605,1601,"Sausages and similar products, of meat, meat offal or blood; food preparations based on these products.",53425899
201605,1602,"Other prepared or preserved meat, meat offal or blood.",866685810
201605,1603,"Extracts and juices of meat, fish or crustaceans, molluscs or other aquatic invertebrates.",12626916
201605,1604,Prepared or preserved fish; caviar and caviar substitutes prepared from fish eggs.,1722581140
201605,1605,"rustaceans, molluscs and other aquatic invertebrates, prepared or preserved.",1981058138
201605,1701,"Cane or beet sugar and chemically pure sucrose, in solid form.",72730534
201605,1702,"Other sugars, including chemically pure lactose, maltose, glucose and fructose, in solid form; sugar syrups not containing added flavouring or colouring matter; artificial honey, whether or not mixed with natural honey; caramel.",442809712
201605,1703,olasses resulting from the extraction or refining of sugar.,22983
201605,1704,"ugar confectionery (including white chocolate), not containing cocoa.",406839398
201605,1803,"Cocoa paste, whether or not defatted.",2373419
201605,1804,"Cocoa butter, fat and oil",37556989
201605,1805,"Cocoa powder, not containing added sugar or other sweetening matter",8001315
201605,1806,hocolate and other food preparations containing cocoa.,151256865
201605,1901,"Malt extract; food preparations of flour, groats, meal, starch or malt extract, not containing cocoa or containing less than 40% by weight of cocoa calculated on a totally defatted basis, not elsewhere specified or included; food preparations of goods of headings 04.01 to 04.04,not containing cocoa or containing less than 5% by weight of cocoa calculated on a totally efatted basis, not elsewhere specified or included.",59177063
201605,1902,"Pasta, whether or not cooked or stuffed (with meat or other substances) or otherwise prepared, such as spaghetti, macaroni, noodles, lasagne, gnocchi, ravioli, cannelloni; couscous, whether or not prepared.",460297437
201605,1903,"Tapioca and substitutes therefor prepared from starch, in the form of flakes, grains, pearls, siftings or in similar forms",7853113
201605,1904,"repared foods obtained by the swelling or roasting of cereals or cereal products (for example, corn flakes); cereals (other than maize (corn)) in grain form or in the form of flakes or other worked grains (except flour, groats and meal), precooked, or otherwise prepared, not elsewhere specified or included.",139388403
201605,1905,"read, pastry, cakes, biscuits and other bakers' wares, whether or not containing cocoa; communion wafers, empty cachets of a kind suitable for pharmaceutical use, sealing wafers, rice paper and similar products.",190183626
201605,2001,"Vegetables, fruit, nuts and other edible parts of plants, prepared or preserved by vinegar or acetic acid.",90115212
201605,2002,Tomatoes prepared or preserved otherwise than by vinegar or acetic acid.,401723014
201605,2003,"Mushrooms and truffles, prepared or preserved otherwise than by vinegar or acetic acid.",413247618
201605,2004,"Other vegetables prepared or preserved otherwise than by vinegar or acetic acid, frozen, other than products of heading 20.06.",161588611
201605,2005,"Other vegetables prepared or preserved otherwise than by vinegar or acetic acid, not frozen, other than products of heading 20.06.",1165548724
201605,2006,"Vegetables, fruit, nuts, fruitpeel and other parts of plants, preserved by sugar (drained, glacé or crystallised).",155063873
201605,2007,"Jams, fruit jellies, marmalades, fruit or nut purée and fruit or nut pastes, obtained by cooking, whether or not containing added sugar or other sweetening matter.",41702584
201605,2008,"Fruit, nuts and other edible parts of plants, otherwise prepared or preserved, whether or not containing added sugar or other sweetening matter or spirit, not elsewhere specified or included.",1477054811
201605,2009,"ruit juices (including grape must) and vegetable juices, unfermented and not containing added spirit, whether or not containing added sugar or other sweetening matter.",409416294
201605,2101,"Extracts, essences and concentrates, of coffee, tea or maté and preparations with a basis of these products or with a basis of coffee, tea or mate; roasted chicory and other roasted coffee substitutes, and extracts, essences and concentrates thereof",271899949
201605,2102,"Yeasts (active or inactive); other singlecell microorganisms, dead (but not including vaccines of heading 30.02); prepared baking powders.",163867919
201605,2103,"Sauce and preparations therefor; mixed condiments and mixed seasonings; mustard flour and meal, whether or not prepared, and mustard",502629141
201605,2104,Soups and broths and preparations therefor; homogenised composite food preparations.,37390501
201605,2105,"Ice cream and other edible ice, whether or not containing cocoa.",18443946
201605,2106,Food preparations not elsewhere specified or included.,816378194
201605,2201,"Waters, including natural or artificial mineral waters andaerated waters, not containing added sugar or other sweetening matter nor flavoured; ice and snow.",414836184
201605,2202,"Waters, including mineral waters and aerated waters, containing added sugar or other sweetening matter or flavoured, and other nonalcoholic beverages, not including fruit or vegetable juices of heading 20.09.",105970560
201605,2203,Beer made from malt.,119705264
201605,2204,"Wine of fresh grapes, including fortified wines; grape must other than that of heading 20.09.",456357966
201605,2206,"Other fermented beverages (for example, cider, perry, mead, saké); mixtures of fermented beverages and mixtures of fermented beverages and nonalcoholic beverages, not elsewhere specified or included.",18347475
201605,2207,"Undenatured ethyl alcohol of an alcoholic strength by volume of 80% vol.or higher; ethyl alcohol and other spirits, denatured, of any strength.",5343525
201605,2208,"Undenatured ethyl alcohol of an alcoholic strength by volume of Undenatured ethyl alcohol of an alcoholic strength by volume of less than 80% vol.; spirits, liqueurs and other spirituous beverages.",245229578
201605,2209,Vinegar and substitutes for vinegar obtained from acetic acid.,8578317
201605,2301,"Flours, meals and pellets, of meat or meat offal, of fish or ofcrustaceans, molluscs or other aquatic invertebrates, unfit for human consumption; greaves.",7436252
201605,2302,"Bran, sharps and other residues, whether or not in the form of pellets, derived from the sifting, milling or other working of cereals or of leguminous plants.",2794958
201605,2303,"Residues of starch manufacture and similar residues, beetpulp, bagasse and other waste of sugar manufacture, brewing ordistilling dregs and waste, whether or not in the form of pellets.",62887149
201605,2304,"Oilcake and other solid residues, whether or not ground or in the form of pellets, resulting from the extraction of soyabean oil.",419964341
201605,2306,"Oilcake and other solid residues, whether or not ground or in the form of pellets, resulting from the extraction of vegetable fats or oils,other than those of heading 23.04 or 23.05.",34226571
201605,2308,"Vegetable materials and vegetable waste, vegetable residues and byproducts, whether or not in the form of pellets, of a kind used in animal feeding, not elsewhere specified or included.",34631069
201605,2309,Preparations of a kind used in animal feeding.,1026876064
201605,2401,Unmanufactured tobacco; tobacco refuse.,424500613
201605,2402,"Cigars, cheroots, cigarillos and cigarettes, of tobacco or of tobacco substitutes.",335390311
201605,2403,Other manufactured tobacco and manufactured tobacco substitutes; “homogenised” or reconstituted” tobacco; tobacco extracts and essences.,85591113
201605,2501,"Salts, incl. table salt and denatured salt, and pure sodium chloride, whether or not in aqueous solution or containing added anti-caking or free-flowing agents; sea water",32160977
201605,2502,Unroasted iron pyrites.,2886444
201605,2503,"Sulphur of all kinds (excluding sublimed sulphur, precipitated sulphur and colloidal sulphur)",815594
201605,2504,Natural graphite.,150364434
201605,2505,"Natural sands of all kinds, whether or not coloured, other than metalbearing sands of Chapter 26.",14403451
201605,2506,"Quartz (excluding natural sands); quartzite, whether or not roughly trimmed or merely cut, by sawing or otherwise, into blocks or slabs of a square or rectangular shape",17746261
201605,2507,"Kaolin and other kaolinic clays, whether or not calcined",60125253
201605,2508,"Other clays (not including expanded clays of heading 68.06), andalusite, kyanite and sillimanite, whether or not calcined; mullite; chamotte or dinas earths.",127099983
201605,2509,Chalk.,1541119
201605,2510,"Natural calcium phosphates, natural aluminium calcium phosphates and phosphatic chalk.",18941
201605,2511,"Natural barium sulphate (barytes); natural barium carbonate (witherite), whether or not calcined, other than barium oxide of heading 28.16.",118273186
201605,2512,"Siliceous fossil meals, e.g. kieselguhr, tripolite and diatomite, and similar siliceous earths, whether or not calcined, of an apparent specific gravity of 1 or less.",2941972
201605,2513,"Pumice stone; emery; natural corundum, natural garnet and other natural abrasives, whether or not heat-treated",5624525
201605,2514,"Slate, whether or not roughly trimmed or merely cut, by sawing or otherwise, into blocks or slabs of a square or rectangular shape; slate powder and slate refuse",10962038
201605,2515,"Marble, travertine, ecaussine and other calcareous monumental or building stone of an apparent specific gravity of 2.5 or more, and alabaster, whether or not roughly trimmed or merely cut, by sawing or otherwise, into blocks or slabs of a rectangular (including square) shape.",6102084
201605,2516,"Granite, porphyry, basalt, sandstone and other monumental or building stone, whether or not roughly trimmed or merely cut, by sawing or otherwise, into blocks or slabs of a rectangular (including square) shape.",33673022
201605,2517,"Pebbles, gravel, broken or crushed stone, for concrete aggregates, for road metalling or for railway ballast, shingle and flint, whether or not heat-treated; macadam of slag, dross or similar industrial waste, whether or not incorporating the materials cited in the first part of the heading; tarred macadam; granules, chippings and powder, of stones of heading 2515 and 2516, whether or not heat-treated",100910651
201605,2518,"Dolomite, whether or not calcined or sintered, including dolomite roughly trimmed or merely cut, by sawing or otherwise, into blocks or slabs of a rectangular (including square) shape; dolomite ramming mix.",16610180
201605,2519,"Natural magnesium carbonate ""magnesite""; fused magnesia; dead-burned ""sintered"" magnesia, whether or not containing small quantities of other oxides added before sintering; other magnesium oxide, whether or not pure",246564039
