Date of data,Commodity code,Commodity,Renminbi Yuan
202311,6901,"Bricks, blocks, tiles and other ceramic goods of siliceous fossil meals (for example, kieselguhr, tripolite or diatomite) or of similar siliceous earths",8878058
202311,6902,"Refractory bricks, blocks, tiles and similar refractory ceramic constructional goods, other than those of siliceous fossil meals or similar siliceous earths.",1097274412
202311,6903,"Other refractory ceramic goods (for example, retorts, crucibles, muffles, nozzles, plugs, supports, cupels, tubes, pipes, sheaths, rods and slide gates), other than those of siliceous fossil meals or of similar siliceous earths.”",213102198
202311,6904,"Geramic building bricks, flooring blocks, support or filler tiles and the like.",1851472821
202311,6905,"Roofing tiles, chimneypots, cowls, chimney liners, architectural ornaments and other ceramic constructional goods.",36454419
202311,6906,"Ceramic pipes, conduits, guttering and pipe fittings",14824045
202311,6907,"Geramic flags and paving, hearth or wall tiles; ceramic mosaic cubes and the like, whether or not on a backing; finishing ceramics.",2785837719
202311,6909,"Geramic wares for laboratory, chemical or other technical uses; ceramic troughs, tubs and similar receptacles of a kind used in agriculture; ceramic pots, jars and similar articles of a kind used for the conveyance or packing of goods.",587398236
202311,6910,"Geramic sinks, wash basins, wash basin pedestals, baths, bidets, water closet pans, flushing cisterns, urinals and similar sanitary fixtures.",4095724710
202311,6911,"Tableware, kitchenware, other household articles and toilet articles, of porcelain or china.",4446231744
202311,6912,"Geramic tableware, kitchenware, other household articles and toilet articles, other than of porcelain or china.",292876186
202311,6913,Statuettes and other ornamental ceramic articles.,1132486288
202311,6914,Other ceramic articles.,699709331
202311,7001,"Cullet and other waste and scrap of glass, excluding glass from cathode ray tubes or other activated glass of heading 85.49; glass in the mass.",47585889
202311,7002,"Glass in balls (other than microspheres of heading 70.18), rods or tubes, unworked.",106481585
202311,7003,"Cast glass and rolled glass, in sheets or profiles, whether or not having an absorbent, reflecting or nonreflecting layer, but not otherwise worked.",459493804
202311,7004,"Drawn glass and blown glass, in sheets, whether or not having an absorbent, reflecting or nonreflecting layer, but not otherwise worked.",93373677
202311,7005,"Float glass and surface ground or polished glass, in sheets, whether or not having an absorbent, reflecting or nonreflecting layer, but not otherwise worked.",307204554
202311,7006,"Glass of heading 70.03, 70.04 or 70.05, bent, edgeworked, engraved, drilled, enamelled or otherwise worked, but not framed or fitted with other materials.",448197728
202311,7007,"safety glass, consisting of toughened (tempered) or laminated glass.",2796203186
202311,7008,Multiplewalled insulating units of glass.,177468834
202311,7009,"Glass mirrors, whether or not framed, including rearview mirrors.",2178060502
202311,7010,"Carboys, bottles, flasks, jars, pots, phials, ampoules and other containers, of glass, of a kind used for the conveyance or packing of goods; preserving jars of glass; stoppers, lids and other closures, of glass.",1870907484
202311,7011,"Glass envelopes (including bulbs and tubes), open, and glass parts thereof, without fittings, for electric lamps and light sources, cathoderay tubes or the like.",7772570
202311,7013,"Glassware of a kind used for table, kitchen, toilet, office, indoor decoration or similar purposes (other than that of heading 70.10 or 70.18).",3329796190
202311,7014,"Signalling glassware and optical elements of glass (other than those of heading 70.15), not optically worked.",46650881
202311,7015,"Clock or watch glasses and similar glasses, glasses for non corrective or corrective spectacles, curved, bent, hollowed or the like, not optically worked; hollow glass spheres and their segments, for the manufacture of such glasses.",4718524
202311,7016,"Paving blocks, slabs, bricks, squares, tiles and other articles of pressed or moulded glass, whether or not wired, of a kind used for building or construction purposes; glass cubes and other glass smallwares, whether or not on a backing, for mosaics or similar decorative purposes; leaded lights and the like; multicellular or foam glass in blocks, panels, plates, shells or similar forms.",336616919
202311,7017,"Laboratory, hygienic or pharmaceutical glassware, whether or not graduated or calibrated.",86380655
202311,7018,"Glass beads, imitation pearls, imitation precious or semiprecious stones and similar glass smallwares, and articles thereof other than imitation jewellery; glass eyes other than prosthetic articles; statuettes and other ornaments of lampworked glass, other than imitation jewellery; glass microspheres not exceeding 1mm in diameter.",1118751941
202311,7019,"Glass fibres (including glass wool) and articles thereof (for example, yarn, rovings, woven fabrics).",1633806642
202311,7020,Other articles of glass,347370391
202311,7101,"Pearls, natural or cultured, whether or not worked or graded but not strung, mounted or set; pearls, natural or cultured, temporarily strung for convenience of transport.",18005621
202311,7102,"Diamonds, whether or not worked, but not mounted or set.",645456966
202311,7103,"Precious stones and semi-precious stones, whether or not worked or graded, but not strung, mounted or set, ungraded precious stones and semi-precious stones, temporarily strung for convenience of transport",38174337
202311,7104,"Synthetic or reconstructed precious or semiprecious stones, whether or not worked or graded but not strung, mounted or set; ungraded synthetic or reconstructed precious or semiprecious stones, temporarily strung for convenience of transport.",314485656
202311,7105,Dust and powder of natural or synthetic precious or semiprecious stones.,95238439
202311,7106,"Silver (including silver plated with gold or platinum), unwrought or in semimanufactured forms, or in powder form.",1864156502
202311,7107,"Base metals clad with silver, not further worked than semimanufactured.",8595322
202311,7108,"Gold (including gold plated with platinum) unwrought or in semimanufactured forms, or in powder form.",3366366949
202311,7110,"Platinum, unwrought or in semimanufactured forms, or in powder form.",171479480
202311,7112,"Waste and scrap of precious metal or of metal clad with precious metal; other waste and scrap containing precious metal or precious metal compounds, of a kind used principally for the recovery of precious metal.Except for articles of 85.49",17217
202311,7113,"Articles of jewellery and parts thereof, of precious metal or of metal clad with precious metal.",10989120193
202311,7114,"Articles of goldsmiths' or silversmiths' wares and parts thereof, of precious metal or of metal clad with precious metal.",201243789
202311,7115,Other articles of precious metal or of metal clad with precious metal.,236401415
202311,7116,"Articles of natural or cultured pearls, precious or semiprecious stones (natural, synthetic or reconstructed).",200091842
202311,7117,Imitation jewellery.,2823072652
202311,7118,Coin.,929078
202311,7201,"Pig iron and spiegeleisen in pigs, blocks or other primary forms.",4619153
202311,7202,Ferroalloys.,940206274
202311,7203,"Ferrous products obtained by direct reduction of iron ore and other spongy ferrous products, in lumps, pellets or similar forms; iron having a minimum purity by weight of 99.94%, in lumps, pellets or similar forms.",38796599
202311,7204,Ferrous waste and scrap; remelting scrap ingots of iron or steel.,696812
202311,7205,"Nranules and powders, of pig iron, spiegeleisen, iron or steel",125698395
202311,7207,Semi-finished products of iron or nonalloy steel.,989604715
202311,7208,"Flat-rolled products of iron or nonalloy steel, of a width of 600 mm or more, hotrolled, not clad, plated or coated.",10807505240
202311,7209,"Flat-rolled products of iron or nonalloy steel, of a width of 600 mm or more, coldrolled (coldreduced), not clad, plated or coated.",1309159185
202311,7210,"at-rolled products of iron or non-alloy steel, of a width ≥ 600 mm, hot-rolled or cold-rolled ""cold-reduced"", clad, plated or coated",9266507114
202311,7211,"Flat-rolled products of iron or nonalloy steel, of a width of less than 600 mm, not clad, plated or coated.",211150495
202311,7212,"Flat-rolled products of iron or nonalloy steel, of a width of less than 600 mm, clad, plated or coated.",718500739
202311,7213,"Bars and rods, hotrolled, in irregularly wound coils, of iron or nonalloy steel.",1349925500
202311,7214,"Other bars and rods of iron or nonalloy steel, not further worked than forged, hotrolled, hotdrawn or hotextruded, but including those twisted after rolling.",1014700325
202311,7215,Other bars and rods of iron or nonalloy steel.,63248829
202311,7216,"Angles, shapes and sections of iron or nonalloy steel.",1342366161
202311,7217,Wire of iron or nonalloy steel.,993944376
202311,7218,Stainless steel in ingots or other primary forms; semifinished products of stainless steel.,1389082
202311,7219,"Flat-rolled products of stainless steel, of a width of 600 mm or more.",2871113205
202311,7220,"Flat-rolled products of stainless steel, of a width of less than 600 mm.",311312074
202311,7221,"Bars and rods, hotrolled, in irregularly wound coils, of stainless steel.",86008765
202311,7222,"Other bars and rods of stainless steel; angles, shapes and sections of stainless steel.",229651855
202311,7223,Wire of stainless steel,172945491
202311,7224,Other alloy steel in ingots or other primary forms; semifinished products of other alloy steel.,23221247
202311,7225,"Flat-rolled products of other alloy steel, of a width of 600 mm or more.",2833526762
202311,7226,"Flat-rolled products of alloy steel other than stainless, of a width of ≥ 600 mm, hot-rolled or cold-rolled ""cold-reduced"" and further worked (excluding plated or coated with zinc and products of silicon-electrical steel)",271241734
202311,7227,"Bars and rods, hot-rolled, in irregularly wound coils, of other alloy steel.",451243997
202311,7228,"Other bars and rods of other alloy steel; angles, shapes and sections, of other alloy steel; hollow drill bars and rods, of alloy or nonalloy steel.",1345995241
202311,7229,Wire of other alloy steel.,265202861
202311,7301,"Sheet piling of iron or steel, whether or not drilled, punched or made from assembled elements; welded angles, shapes and sections, of iron or steel.",299046729
202311,7302,"Railway or tramway track construction material of iron or steel, the following : rails, check-rails and rack rails, switch blades, crossing frogs, point rods and other crossing pieces, sleepers ""cross-ties"", fish-plates, chairs, chair wedges, sole plates ""base plates"", rail clips, bedplates, ties and other material specialised for jointing or fixing rails",438267714
202311,7303,"Tubes, pipes and hollow profiles, of cast iron.",184362225
202311,7304,"Tubes, pipes and hollow profiles, seamless, of iron (other than cast iron) or steel.",4342600402
202311,7305,"Other tubes and pipes (for example, welded, riveted or similarly closed), having circular cross-sections, the external diameter of which exceeds 406.4 mm, of iron or steel.",774835507
202311,7306,"Other tubes, pipes and hollow profiles (for example, open seam or welded, riveted or similarly closed), of iron or steel.",1936571294
202311,7307,"Tube or pipe fittings (for example, couplings, elbows, sleeves), of iron or steel.",2672144834
202311,7308,"Structures (excluding prefabricated buildings of heading 94.06) and parts of structures (for example, bridges and bridgesections, lockgates, towers, lattice masts, roofs, roofing frameworks, doors and windows and their frames and thresholds for doors, shutters, balustrades, pillars and columns), of iron or steel; plates, rods, angles, shapes, sections, tubes and the like, prepared for use in structures, of iron or steel.",12554015234
202311,7309,"eservoirs, tanks, vats and similar containers for any material (other than compressed or liquefied gas), of iron or steel, of a capacity exceeding 300 l, whether or not lined or heatinsulated, but not fitted with mechanical or thermal equipment.",719606850
202311,7310,"anks, casks, drums, cans, boxes and similar containers, for any material (other than compressed or liquefied gas), of iron or steel, of a capacity not exceeding 300 l, whether or not lined or heatinsulated, but not fitted with mechanical or thermal equipment.",725286652
202311,7311,"Containers for compressed or liquefied gas, of iron or steel.",676746287
202311,7312,"Stranded wire, ropes, cables, plaited bands, slings and the like, of iron or steel, not electrically insulated.",1481804592
202311,7313,"Barbed wire of iron or steel; twisted hoop or single flat wire, barbed or not, and loosely twisted double wire, of a kind used for fencing, of iron or steel.",82803973
202311,7314,"Cloth (including endless bands), grill, netting and fencing, of iron or steel wire; expanded metal of iron or steel.",875549258
202311,7315,"Chain and parts thereof, of iron or steel.",1266328763
202311,7316,"Anchors, grapnels and parts thereof, of iron or steel.",61444391
202311,7317,"Nails, tacks, drawing pins, corrugated nails, staples (other than those of heading 83.05) and similar articles, of iron or steel, whether or not with heads of other material, but excluding such articles with heads of copper.",920367956
202311,7318,"Screws, bolts, nuts, coach screws, screw hooks, rivets, cotters, cotterpins, washers (including spring washers) and similar articles, of iron or steel.",5387266689
202311,7319,"Sewing needles, knitting needles, bodkins, crochet hooks, embroidery stilettos and similar articles, for use in the hand, of iron or steel; safety pins and other pins of iron or steel, not elsewhere specified or included.",96960099
202311,7320,"Springs and leaves for springs, of iron or steel.",576256053
202311,7321,"Stoves, ranges, grates, cookers (including those with subsidiary boilers for central heating), barbecues, braziers, gasrings, plate warmers and similar nonelectric domestic appliances, and parts thereof, of iron or steel.",3056569664
202311,7322,"Radiators for central heating, not electrically heated, and parts thereof, of iron or steel; air heaters and hot air distributors (including distributors which can also distribute fresh or conditioned air), not electrically heated, incorporating a motordriven fan or blower, and parts thereof, of iron or steel.",148652345
202311,7323,"Table, kitchen or other household articles and parts thereof, of iron or steel; iron or steel wool; pot scourers and scouring or polishing pads, gloves and the like, of iron or steel.",6677420789
202311,7324,"Sanitary ware and parts thereof, of iron or steel.",1971870114
202311,7325,Other cast articles of iron or steel.,687169516
202311,7326,Other articles of iron or steel.,9764497505
202311,7402,Unrefined copper; copper anodes for electrolytic refining.,73595
202311,7403,"Refined copper and copper alloys, unwrought.",982301360
202311,7404,Copper waste and scrap.,97309
202311,7405,Master alloys of copper.,2798866
202311,7406,Copper powders and flakes.,16326509
202311,7407,"Copper bars, rods and profiles.",171554433
202311,7408,Copper wire.,543436749
202311,7409,"Copper plates, sheets and strip, of a thickness exceeding 0.15mm.",623722687
202311,7410,"Copper foil (whether or not printed or backed with paper, paperboard, plastics or similar backing materials) of a thickness (excluding any backing) not exceeding 0.15 mm.",612208081
202311,7411,Copper tubes and pipes.,1277743284
202311,7412,"Copper tube or pipe fittings (for example, couplings, elbows, sleeves).",734316945
202311,7413,"Stranded wire, cables, plaited bands and the like, of copper, not electrically insulated.",32748092
202311,7415,"Nails, tacks, drawing pins, staples (other than those of heading 83.05) and similar articles, of copper or of iron or steel with heads of copper; screws, bolts, nuts, screw hooks, rivets, cotters, cotterpins, washers (including spring washers) and similar articles, of copper.",94489438
202311,7418,"Table, kitchen or other household articles and parts thereof, of copper; pot scourers and scouring or polishing pads, gloves and the like, of copper; sanitary ware and parts thereof, of copper.",251857297
202311,7419,Other articles of copper.,248575611
202311,7501,"Nickel mattes, nickel oxide sinters and other intermediate products of nickel metallurgy.",3344660
202311,7502,nwrought nickel.,776825152
202311,7503,Nickel waste and scrap.,7098065
202311,7504,Nickel powders and flakes.,36970695
202311,7505,"Nickel bars, rods, profiles and wire.",125970191
202311,7506,"Nickel plates, sheets, strip and foil.",43180885
202311,7507,"Nickel tubes, pipes and tube or pipe fittings (for example, couplings, elbows, sleeves).",159513836
202311,7508,Other articles of nickel.,29871446
202311,7601,Unwrought aluminium.,638360715
202311,7602,Aluminium waste and scrap.,1505493
202311,7603,Aluminium powders and flakes.,22891896
202311,7604,"Aluminium bars, rods and profiles.",2147688506
202311,7605,Aluminium wire.,83917726
202311,7606,"Aluminium plates, sheets and strip, of a thickness exceeding 0.2 mm.",5093332093
202311,7607,"Aluminium foil (whether or not printed or backed with paper, paperboard, plastics or similar backing materials) of a thickness (excluding any backing) not exceeding 0.2 mm.",2824317317
202311,7608,Aluminium tubes and pipes.,359143613
202311,7609,"Aluminium tube or pipe fittings (for example, couplings, elbows, sleeves).",231025016
202311,7610,"Aluminium structures (excluding prefabricated buildings of heading 94.06) and parts of structures (for example, bridges and bridgesections, towers, lattice masts, roofs, roofing frameworks, doors and windows and their frames and thresholds for doors, balustrades, pillars and columns); aluminium plates, rods, profiles, tubes and the like, prepared for use in structures.",3889528236
202311,7611,"Aluminium reservoirs, tanks, vats and similar containers, for any material (other than compressed or liquefied gas), of a capacity exceeding 300 l, whether or not lined or heatinsulated, but not fitted with mechanical or thermal equipment.",14957693
202311,7612,"Aluminium casks, drums, cans, boxes and similar containers (including rigid or collapsible tubular containers), for any material (other than compressed or liquefied gas), of a capacity not exceeding 300 l, whether or not lined or heatinsulated, but not fitted with mechanical or thermal equipment.",205013581
202311,7613,Aluminium containers for compressed or liquefied gas.,44646727
202311,7614,"Stranded wire, cables, plaited bands and the like, of aluminium, not electrically insulated.",389929948
202311,7615,"Table, kitchen or other household articles and parts thereof, of aluminium; pot scourers and scouring or polishing pads, gloves and the like, of aluminium; sanitary ware and parts thereof, of aluminium.",2208283014
202311,7616,Other articles of aluminium.,3234921859
202311,7801,Unwrought lead.,263189526
202311,7804,"Lead plates, sheets, strip and foil; lead powders and flakes.",12975300
202311,7806,Other articles of lead.,6423403
202311,7901,Unwrought zinc.,13423234
202311,7903,"zinc dust, powders and flakes.",3849916
202311,7904,"Zinc bars, rods, profiles and wire.",6864011
202311,7905,"Zinc plates, sheets, strip and foil.",1454125
202311,7907,Other articles of zinc.,74010068
202311,8001,Unwrought tin.,191558120
202311,8003,"Tin bars, rods, profiles and wire.",7870337
202311,8007,Other articles of tin.,20187110
202311,8101,"Wungsten (wolfram) and articles thereof, including waste and scrap.",143145702
202311,8102,"Molybdenum and articles thereof, including waste and scrap.",244737072
202311,8103,"Tantalum and articles thereof, including waste and scrap.",143943476
202311,8104,"Magnesium and articles thereof, including waste and scrap.",882764187
202311,8105,"Cobalt mattes and other intermediate products of cobalt metallurgy; cobalt and articles thereof, including waste and scrap.",149455547
202311,8106,"Bismuth and articles thereof, including waste and scrap.",11429979
202311,8108,"Titanium and articles thereof, including waste and scrap.",644709439
202311,8109,"Zirconium and articles thereof, including waste and scrap.",8021968
202311,8110,"Antimony and articles thereof, including waste and scrap.",23431721
202311,8111,"Manganese and articles thereof, including waste and scrap",480750131
202311,8112,"Beryllium, chromium, hafnium, rhenium, thallium, cadmium, germanium, vanadium, gallium, indium, niobium and their products, including waste and scrap:",798926641
202311,8113,"Cermets and articles thereof, including waste and scrap.",27611373
202311,8201,"Hand tools, the following : spades, shovels, mattocks, picks, hoes, forks and rakes; axes, bill hooks and similar hewing tools; secateurs and pruners of any kind; scythes, sickles, hay knives, hedge shears, timber wedges and other tools of a kind used in agriculture, horticulture or forestry.",623750713
202311,8202,"Hand saws; blades for saws of all kinds (including slitting, slotting or toothless saw blades).",1054319957
202311,8203,"Files, rasps, pliers (including cutting pliers), pincers, tweezers, metal cutting shears, pipecutters, bolt croppers, perforating punches and similar hand tools.",703369150
202311,8204,"Hand-operated spanners and wrenches (including torque meter wrenches but not including tap wrenches); interchangeable spanner sockets, with or without handles.",825003559
202311,8205,"Hand tools (including glaziers' diamonds), not elsewhere specified or included; blow lamps; vices, clamps and the like, other than accessories for and parts of, machinetools or waterjet cutting machines; anvils; portable forges; hand or pedaloperated grinding wheels with frameworks.",2676010554
202311,8206,"Tools of two or more of the headings 82.02 to 82.05, put up in sets for retail sale.",596440775
202311,8207,"Interchangeable tools for hand tools, whether or not poweroperated, or for machinetools (for example, for pressing, stamping, punching, tapping, threading, drilling, boring, broaching, milling, turning or screw driving), including dies for drawing or extruding metal, and rock drilling or earth boring tools.",2897217914
202311,8208,"Knives and cutting blades, for machines or for mechanical appliances.",428165843
202311,8209,"Plates, sticks, tips and the like for tools, unmounted, of cermets.",370679844
202311,8210,"Hand-operated mechanical appliances, weighing 10 kg or less, used in the preparation, conditioning or serving of food or drink.",236905492
202311,8211,"Knives with cutting blades, serrated or not (including pruning knives), other than knives of heading 82.08, and blades therefor.",845558723
202311,8212,Razors and razor blades (including razor blade blanks in strips).,379948251
202311,8213,"Scissors, tailors' shears and similar shears, and blades therefor.",440413809
202311,8214,"Other articles of cutlery (for example, hair clippers, butchers' or kitchen cleavers, choppers and mincing knives, paper knives); manicure or pedicure sets and instruments (including nail files).",650730891
202311,8215,"Spoons, forks, ladles, skimmers, cakeservers, fishknives, butterknives, sugar tongs and similar kitchen or tableware.",1499014578
202311,8301,"Padlocks and locks (key, combination or electrically operated), of base metal; clasps and frames with clasps, incorporating locks, of base metal; keys for any of the foregoing articles, of base metal",3184120154
202311,8302,"Base metal mountings, fittings and similar articles suitable for furniture, doors, staircases, windows, blinds, coachwork, saddlery, trunks, chests, caskets or the like; base metal hatracks, hatpegs, brackets and similar fixtures; castors with mountings of base metal; automatic door closers of base metal",8609615508
202311,8303,"Armoured or reinforced safes, strongboxes and doors and safe deposit lockers for strongrooms, cash or deed boxes and the like, of base metal",362736933
202311,8304,"Filing cabinets, cardindex cabinets, paper trays, paper rests, pen trays, officestamp stands and similar office or desk equipment, of base metal, other than office furniture of heading 9403",131169030
202311,8305,"Fittings for looseleaf binders or files, letter clips, letter corners, paper clips, indexing tags and similar office articles, of base metal; staples in strips (for example, for offices, upholstery, packaging), of base metal",297160853
202311,8306,"Bells, gongs and the like, nonelectric, of base metal; statuettes and other ornaments, of base metal; photograph, picture or similar frames, of base metal; mirrors of base metal",1089829984
202311,8307,"Flexible tubing of base metal, with or without fittings",296193269
202311,8308,"Clasps, frames with clasps, buckles, buckleclasps, hooks, eyes, eyelets and the like, of base metal, of a kind used for clothing or clothing accessories, footwear, jewellery, wristwatches, books, awnings, leather goods, travel goods or saddlery or for other made up articles; tubular or bifurcated rivets, of base metal; beads and spangles, of base metal",899849428
202311,8309,"Stoppers, caps and lids (including crown corks, screw caps and pouring stoppers), capsules for bottles, threaded bungs, bung covers, seals and other packing accessories, of base metal",758056969
202311,8310,"Signplates, nameplates, addressplates and similar plates, numbers, letters and other symbols, of base metal, excluding those of heading 9405",208578626
