Date of data,Commodity code,Commodity,Renminbi Yuan
202503,0102,Live bovine animals,21965088
202503,0103,Live swine,226076160
202503,0105,"Live poultry, that is to say, fowls of the species Gallus domesticus, ducks, geese, turkeys and guinea fowls",3721509
202503,0106,Other live animals,30066674
202503,0201,"Meat of bovine animals, fresh or chilled",2234599
202503,0202,"Meat of bovine animals, frozen",1270153
202503,0203,"Meat of swine, fresh, chilled or frozen",84108452
202503,0204,"Meat of sheep or goats, fresh, chilled or frozen",8671016
202503,0205,"Meat of horses, asses, mules or hinnies, fresh, chilled or frozen",4886146
202503,0206,"Edible offal of bovine animals, swine, sheep, goats, horses, asses, mules or hinnies, fresh, chilled or frozen",1005462
202503,0207,"Meat and edible offal, of the poultry of heading 0105, fresh, chilled or frozen",697768451
202503,0208,"Other meat and edible meat offal, fresh, chilled or frozen",38711370
202503,0210,"Meat and edible meat offal, salted, in brine, dried or smoked; edible flours and meals of meat or meat offal",4007298
202503,0301,Live fish,352038833
202503,0302,"Fish, fresh or chilled, excluding fish fillets and other fish meat of heading 0304",111680591
202503,0303,"Fish, frozen, excluding fish fillets and other fish meat of heading 0304",1773679748
202503,0304,"Fish fillets and other fish meat (whether or not minced), fresh, chilled or frozen",2240682244
202503,0305,"Fish, dried, salted or in brine; smoked fish, whether or not cooked before or during the smoking process",224415143
202503,0306,"Crustaceans, whether in shell or not, live, fresh, chilled, frozen, dried, salted or in brine; smoked crustaceans, whether in shell or not, whether or not cooked before or during the smoking process; crustaceans, in shell, cooked by steaming or by boiling in water, whether or not chilled, frozen, dried, salted or in brine",425075520
202503,0307,"Molluscs, whether in shell or not, live, fresh, chilled, frozen, dried, salted or in brine; smoked molluscs, whether in shell or not, whether or not cooked before or during the smoking process",1643860193
202503,0308,"Aquatic invertebrates other than crustaceans and molluscs, live, fresh, chilled, frozen, dried, salted or in brine; smoked aquatic invertebrates other than crustaceans and molluscs, whether or not cooked before or during the smoking process",33555670
202503,0309,"Flours, meals and pellets of fish, crustaceans, molluscs and other aquatic invertebrates, fit for human consumption",4046697
202503,0401,"Milk and cream, not concentrated nor containing added sugar or other sweetening matter.",18967216
202503,0402,"Milk and cream, concentrated or containing added sugar or other sweetening matter",106462083
202503,0403,"Yogurt; buttermilk, curdled milk and cream, kephir and other fermented or acidified milk and cream, whether or not concentrated or containing added sugar or other sweetening matter or flavoured or containing added fruit, nuts or cocoa",10776300
202503,0404,"Whey, whether or not concentrated or containing added sugar or other sweetening matter; products consisting of natural milk constituents, whether or not containing added sugar or other sweetening matter, not elsewhere specified or included",685473
202503,0405,Butter and other fats and oils derived from milk; dairy spreads,24731267
202503,0406,Cheese and curd,10126013
202503,0407,"Birds' eggs, in shell, fresh, preserved or cooked",153707164
202503,0408,"Birds' eggs, not in shell, and egg yolks, fresh, dried, cooked by steaming or by boiling in water, moulded, frozen or otherwise preserved, whether or not containing added sugar or other sweetening matter",39756461
202503,0409,atural honey,171838527
202503,0410,"Insects and other edible products of animal origin, not elsewhere specified or included",26890371
202503,0502,"Pigs', hogs' or boars' bristles and hair; badger hair and other brush making hair; waste of such bristles or hair",14462481
202503,0504,"Guts, bladders and stomachs of animals (other than fish), whole and pieces thereof, fresh, chilled, frozen, salted, in brine, dried or smoked",574360838
202503,0505,"Skins and other parts of birds, with their feathers or down, feathers and parts of feathers (whether or not with trimmed edges) and down, not further worked than cleaned, disinfected or treated for preservation;powder and waste of feathers or parts of feathers",706674433
202503,0506,"Bones and horncores, unworked, defatted, simply prepared (but not cut to shape), treated with acid or degelatinised; powder and waste of these products",2700
202503,0507,"Ivory, tortoiseshell, whalebone and whalebone hair, horns, antlers, hooves, nails, claws and beaks, unworked or simply prepared but not cut to shape; powder and waste of these products",6747299
202503,0508,"Coral and similar materials, unworked or simply prepared bunot otherwise worked; shells of molluscs, crustaceans or echinoderms and cuttlebone, unworked or simply prepared bunot cut to shape, powder and waste thereof",4517913
202503,0510,"Ambergris, castoreum, civet and musk; cantharides; bile, whether or not dried; glands and other animal products used in the preparation of pharmaceutical products, fresh, chilled, frozen or otherwise provisionally preserved",3595708
202503,0511,"Animal products not elsewhere specified or included; dead animals of Chapter 1 or 3, unfit for human consumption",131027783
202503,0601,"Bulbs, tubers, tuberous roots, corms, crowns and rhizomes, dormant, in growth or in flower; chicory plants and roots other than roots of heading 12.12.",394111
202503,0602,"Other live plants (including their roots), cuttings and slips; mushroom spawn.",236681909
202503,0603,"Cut flowers and flower buds of a kind suitable for bouquets or for ornamental purposes, fresh, dried, dyed, bleached, impregnated or otherwise prepared.",139630911
202503,0604,"Foliage, branches and other parts of plants, without flowers or flower buds, and grasses, mosses and lichens, being goods of a kind suitable for bouquets or for ornamental purposes, fresh,dried, dyed, bleached, impregnated or otherwise prepared",36712413
202503,0701,"Potatoes, fresh or chilled.",241033490
202503,0702,"Tomatoes, fresh or chilled.",160717773
202503,0703,"Onions, shallots, garlic, leeks and other alliaceous vegetables, fresh or chilled.",2426508333
202503,0704,"Cabbages, cauliflowers, kohlrabi, kale and similar edible brassicas, fresh or chilled.",504556022
202503,0705,"Lettuce (Lactuca sativa) and chicory (Cichorium spp.), fresh or chilled.",123279908
202503,0706,"Carrots, turnips, salad beetroot, salsify, celeriac, radishes and similar edible roots, fresh or chilled.",284151239
202503,0707,"Cucumbers and gherkins, fresh or chilled.",47616019
202503,0708,"Leguminous vegetables, shelled or unshelled, fresh or chilled.",188000929
202503,0709,"Other vegetables, fresh or chilled.",953905912
202503,0710,"Vegetables (uncooked or cooked by steaming or boiling in water),frozen.",1053319900
202503,0711,"Vegetables provisionally preserved, but unsuitable in that state for immediate consumption.",105198452
202503,0712,"Dried vegetables, whole, cut, sliced, broken or in powder, but not further prepared.",1367469016
202503,0713,"Dried leguminous vegetables, shelled, whether or not skinned or split.",332754455
202503,0714,"Manioc, arrowroot, salep, Jerusalem artichokes, sweet potatoes and similar roots and tubers with high starch or inulin content, fresh, chilled, frozen or dried, whether or not sliced or in the form of pellets; sago pith.",116834071
202503,0801,"Coconuts, Brazil nuts and cashew nuts, fresh or dried, whether or not shelled or peeled.",2556678
202503,0802,"Other nuts, fresh or dried, whether or not shelled or peeled.",1127558272
202503,0803,"Bananas, including plantains, fresh or dried.",47997164
202503,0804,"Dates, figs, pineapples, avocados, guavas, mangoes and mangosteens, fresh or dried.",115943466
202503,0805,"Citrus fruit, fresh or dried.",1364849353
202503,0806,"Grapes, fresh or dried.",300821602
202503,0807,"Melons (including watermelons) and papaws (papayas), fresh",53442984
202503,0808,"Apples, pears and quinces, fresh.",1117363177
202503,0809,"Apricots, cherries, peaches (including nectarines), plums and sloes, fresh.",17184065
202503,0810,Other fresh fruits,262531683
202503,0811,"Fruit and nuts, uncooked or cooked by steaming or boiling in water, frozen, whether or not containing added sugar or other sweetening matter.",196821845
202503,0812,"Fruit and nuts provisionally preserved, but unsuitable in that state for immediate consumption.",16637292
202503,0813,"Fruit, dried, other than that of headings 08.01 to 08.06; mixtures of nuts or dried fruits of this Chapter.",198082618
202503,0814,"Peel of citrus fruit or melons (including watermelons), fresh, frozen, dried or provisionally preserved in brine, in sulphur water or in other preservative solutions.",2492365
202503,0901,"Coffee, whether or not roasted or decaffeinated; coffee husks and skins; coffee substitutes containing coffee in any proportion.",178157735
202503,0902,"Tea, whether or not flavoured.",865023593
202503,0904,Pepper of the genus Piper; dried or crushed or ground fruits of the genus Capsicum or of the genus Pimenta.,622768424
202503,0906,Cinnamon and cinnamontree flowers.,92105127
202503,0907,"loves (whole fruit, cloves and stems).",2690831
202503,0908,"Nutmeg, mace and cardamoms.",894570
202503,0909,"Seeds of anise, badian, fennel, coriander, cumin or caraway; juniper berries.",148155049
202503,0910,"Ginger, saffron, turmeric (curcuma), thyme, bay leaves, curry and other spices.",508312770
202503,1003,Barley,70636
202503,1004,Oats,168441
202503,1005,Maize (corn).,9008332
202503,1006,Rice.,678220874
202503,1007,Grain sorghum.,1441987
202503,1008,"Buckwheat, millet and canary seeds; other cereals.",21481546
202503,1101,Wheat or meslin flour.,23410197
202503,1102,Cereal flours other than of wheat or meslin.,1893777
202503,1104,"Cereal grains otherwise worked (for example, hulled, rolled, flaked, pearled, sliced or kibbled), except rice of heading 10.06; germ of cereals, whole, rolled, flaked or ground.",25842237
202503,1105,"Flour, meal, powder, flakes, granules and pellets of potatoes.",2880207
202503,1106,"Flour, meal and powder of the dried leguminous vegetables of heading 07.13, of sago or of roots or tubers of heading 07.14 or of the products of Chapter 8.",28116426
202503,1107,"Malt, whether or not roasted.",254168289
202503,1108,tarches; inulin.,102774865
202503,1109,"Wheat gluten, whether or not dried.",152259596
202503,1201,"Soya beans, whether or not broken.",51236176
202503,1202,"Groundnuts, not roasted or otherwise cooked, whether or not shelled or broken.",188557019
202503,1203,Copra,16490
202503,1204,"Linseed, whether or not broken.",526698
202503,1205,"Rape or colza seeds, whether or not broken.",22178
202503,1206,"Sunflower seeds, whether or not broken.",475318833
202503,1207,"Other oil seeds and oleaginous fruits, whether or not broken.",209106255
202503,1208,"Flours and meals of oil seeds or oleaginous fruits, other than those of mustard.",15527964
202503,1209,"Seeds, fruit and spores, of a kind used for sowing.",122137541
202503,1210,"Hop cones, fresh or dried, whether or not ground, powdered or in the form of pellets; lupulin.",262085
202503,1211,"lants and parts of plants (including seeds and fruits), of a kind used primarily in perfumery, in pharmacy or for insecticidal, fungicidal or similar purposes, fresh, chilled, frozen or dried, whether or not cut, crushed or powdered.",572406147
202503,1212,"Locust beans, seaweeds and other algae, sugar beet and sugar cane, fresh, chilled, frozen or dried, whether or not ground; fruit stones and kernels and other vegetable products (including unroasted chicory roots of the variety Cichorium intybus sativum) of a kind used primarily for human consumption, not elsewhere specified or included.",638355084
202503,1213,"Cereal straw and husks, unprepared, whether or not chopped,ground, pressed or in the form of pellets.",846193
202503,1214,"wedes, mangolds, fodder roots, hay, lucerne (alfalfa), clover, sainfoin, forage kale, lupines, vetches and similar forage products, whether or not in the form of pellets.",1010638
202503,1301,"Lac; natural gums, resins, gumresins and oleoresins (for example, balsams).",10295662
202503,1302,"Vegetable saps and extracts; pectic substances, pectinates and pectates; agaragar and other mucilages and thickeners, whether or not modified, derived from vegetable products.",1463560184
202503,1401,"Vegetable materials of a kind used primarily for plaiting (for example, bamboos, rattans, reeds, rushes, osier, raffia, cleaned, bleached or dyed cereal straw, and lime bark).",84341436
202503,1404,Vegetable products not elsewhere specified or included.,165350246
202503,1501,"Pig fat (including lard) and poultry fat, other than that of heading 02.09 or 15.03",2142328
202503,1502,"Fats of bovine animals, sheep or goats, other than those of heading 15.03.",6624528
202503,1504,"ats and oils and their fractions, of fish or marine mammals, whether or not refined, but not chemically modified.",264186016
202503,1505,Wool grease and fatty substances derived therefrom (including lanolin).,31503262
202503,1506,"Other animal fats and oils and their fractions, whether or not refined, but not chemically modified.",4968639
202503,1507,"oyabean oil and its fractions, whether or not refined, but not chemically modified.",157929779
202503,1508,"Groundnut oil and its fractions, whether or not refined, but not chemically modified.",17508950
202503,1509,"Olive oil and its fractions, whether or not refined, but not chemically modified.",1799102
202503,1510,"Other oils and their fractions, obtained solely from olives, whether or not refined, but not chemically modified, including blends of these oils or fractions with oils or fractions of heading 15.09",20687
202503,1511,"Palm oil and its fractions, whether or not refined, but not chemically modified.",6985896
202503,1512,"unflowerseed, safflower or cottonseed oil and fractions thereof, whether or not refined, but not chemically modified.",8910790
202503,1513,"Coconut (copra), palm kernel or babassu oil and fractions thereof, whether or not refined, but not chemically modified.",7
202503,1514,"Rape, colza or mustard oil and fractions thereof, whether or not refined, but not chemically modified.",16144506
202503,1515,"Other fixed vegetable or microbial fats and oils (including jojoba oil) and their fractions, whether or not refined, but not chemically modified",148327756
202503,1516,"Animal，vegetable or microbial fats and oils and their fractions, partly or wholly hydrogenated, interesterified, reesterified or elaidinised, whether or not refined, but not further prepared.",23528734
202503,1517,"Margarine; edible mixtures or preparations of animal, vegetable or microbial fats or oils or of fractions of different fats or oils of this Chapter, other than edible fats and oils or their fractions of heading 15.16.",60522185
202503,1518,"Animal, vegetable or microbial fats and oils and their fractions, boiled, oxidised, dehydrated, sulphurised, blown, polymerised by heat in vacuum or in inert gas or otherwise chemically modified, excluding those of heading 15.16; inedible mixtures or preparations of animal, vegetable or microbial fats or oils or of fractions of different fats or oils of this Chapter, not elsewhere specified or included",1770342441
202503,1520,"Glycerol, crude; glycerol waters and glycerol lyes.",52598
202503,1521,"egetable waxes (other than triglycerides), beeswax, other insect waxes and spermaceti, whether or not refined or coloured.",27358857
202503,1522,Degras; residues resulting from the treatment of fatty substances or animal or vegetable waxes.,4443717
202503,1601,"Sausages and similar products, of meat, meat offal, blood or insects; food preparations based on these products",87639713
202503,1602,"Other prepared or preserved meat, meat offal, blood or insects",1269261723
202503,1603,"Extracts and juices of meat, fish or crustaceans, molluscs or other aquatic invertebrates.",16491931
202503,1604,Prepared or preserved fish; caviar and caviar substitutes prepared from fish eggs.,2765533366
202503,1605,"rustaceans, molluscs and other aquatic invertebrates, prepared or preserved.",2933065511
202503,1701,"Cane or beet sugar and chemically pure sucrose, in solid form.",55740576
202503,1702,"Other sugars, including chemically pure lactose, maltose, glucose and fructose, in solid form; sugar syrups not containing added flavouring or colouring matter; artificial honey, whether or not mixed with natural honey; caramel.",909232953
202503,1703,olasses resulting from the extraction or refining of sugar.,107622
202503,1704,"ugar confectionery (including white chocolate), not containing cocoa.",1026418650
202503,1803,"Cocoa paste, whether or not defatted.",1897813
202503,1804,"Cocoa butter, fat and oil",16457241
202503,1805,"Cocoa powder, not containing added sugar or other sweetening matter",18311178
202503,1806,hocolate and other food preparations containing cocoa.,275606007
202503,1901,"Malt extract; food preparations of flour, groats, meal, starch or malt extract, not containing cocoa or containing less than 40% by weight of cocoa calculated on a totally defatted basis, not elsewhere specified or included; food preparations of goods of headings 04.01 to 04.04,not containing cocoa or containing less than 5% by weight of cocoa calculated on a totally efatted basis, not elsewhere specified or included.",175148754
202503,1902,"Pasta, whether or not cooked or stuffed (with meat or other substances) or otherwise prepared, such as spaghetti, macaroni, noodles, lasagne, gnocchi, ravioli, cannelloni; couscous, whether or not prepared.",869984259
202503,1903,"Tapioca and substitutes therefor prepared from starch, in the form of flakes, grains, pearls, siftings or in similar forms",12595028
202503,1904,"repared foods obtained by the swelling or roasting of cereals or cereal products (for example, corn flakes); cereals (other than maize (corn)) in grain form or in the form of flakes or other worked grains (except flour, groats and meal), precooked, or otherwise prepared, not elsewhere specified or included.",227991236
202503,1905,"read, pastry, cakes, biscuits and other bakers' wares, whether or not containing cocoa; communion wafers, empty cachets of a kind suitable for pharmaceutical use, sealing wafers, rice paper and similar products.",514327957
202503,2001,"Vegetables, fruit, nuts and other edible parts of plants, prepared or preserved by vinegar or acetic acid.",84031741
202503,2002,Tomatoes prepared or preserved otherwise than by vinegar or acetic acid.,585594730
202503,2003,"Mushrooms and truffles, prepared or preserved otherwise than by vinegar or acetic acid.",381112772
202503,2004,"Other vegetables prepared or preserved otherwise than by vinegar or acetic acid, frozen, other than products of heading 20.06.",472065204
202503,2005,"Other vegetables prepared or preserved otherwise than by vinegar or acetic acid, not frozen, other than products of heading 20.06.",1194857598
202503,2006,"Vegetables, fruit, nuts, fruitpeel and other parts of plants, preserved by sugar (drained, glacé or crystallised).",224268581
202503,2007,"Jams, fruit jellies, marmalades, fruit or nut purée and fruit or nut pastes, obtained by cooking, whether or not containing added sugar or other sweetening matter.",56071691
202503,2008,"Fruit, nuts and other edible parts of plants, otherwise prepared or preserved, whether or not containing added sugar or other sweetening matter or spirit, not elsewhere specified or included.",1928736596
202503,2009,"Fruit or nut juices (including grape must and coconut water) and vegetable juices, unfermented and not containing added spirit, whether or not containing added sugar or other sweetening matter",578768941
202503,2101,"Extracts, essences and concentrates, of coffee, tea or maté and preparations with a basis of these products or with a basis of coffee, tea or mate; roasted chicory and other roasted coffee substitutes, and extracts, essences and concentrates thereof",195676151
202503,2102,"Yeasts (active or inactive); other singlecell microorganisms, dead (but not including vaccines of heading 30.02); prepared baking powders.",427130321
202503,2103,"Sauce and preparations therefor; mixed condiments and mixed seasonings; mustard flour and meal, whether or not prepared, and mustard",917120693
202503,2104,Soups and broths and preparations therefor; homogenised composite food preparations.,40876355
202503,2105,"Ice cream and other edible ice, whether or not containing cocoa.",38728821
202503,2106,Food preparations not elsewhere specified or included.,2728595798
202503,2201,"Waters, including natural or artificial mineral waters andaerated waters, not containing added sugar or other sweetening matter nor flavoured; ice and snow.",485869305
202503,2202,"Waters, including mineral waters and aerated waters, containing added sugar or other sweetening matter or flavoured, and other non-alcoholic beverages, not including fruit, nut or vegetable juices of heading 20.09",292792498
202503,2203,Beer made from malt.,284538525
202503,2204,"Wine of fresh grapes, including fortified wines; grape must other than that of heading 20.09.",31143428
202503,2205,Vermouth and other wine of fresh grapes flavoured with plants or aromatic substances.,758519
202503,2206,"Other fermented beverages (for example, cider, perry, mead, saké); mixtures of fermented beverages and mixtures of fermented beverages and nonalcoholic beverages, not elsewhere specified or included.",19208503
202503,2207,"Undenatured ethyl alcohol of an alcoholic strength by volume of 80% vol.or higher; ethyl alcohol and other spirits, denatured, of any strength.",8671185
202503,2208,"Undenatured ethyl alcohol of an alcoholic strength by volume of Undenatured ethyl alcohol of an alcoholic strength by volume of less than 80% vol.; spirits, liqueurs and other spirituous beverages.",995797506
202503,2209,Vinegar and substitutes for vinegar obtained from acetic acid.,16792484
202503,2301,"Flours, meals and pellets, of meat or meat offal, of fish or ofcrustaceans, molluscs or other aquatic invertebrates, unfit for human consumption; greaves.",118747
202503,2302,"Bran, sharps and other residues, whether or not in the form of pellets, derived from the sifting, milling or other working of cereals or of leguminous plants.",2680324
202503,2303,"Residues of starch manufacture and similar residues, beetpulp, bagasse and other waste of sugar manufacture, brewing ordistilling dregs and waste, whether or not in the form of pellets.",243666258
202503,2304,"Oilcake and other solid residues, whether or not ground or in the form of pellets, resulting from the extraction of soyabean oil.",223702224
202503,2305,"Oilcake and other soli residues, whether or not ground or in the form of pellets, resulting from the extraction of groundnut oil.",364457
202503,2306,"Oil-cake and other solid residues, whether or not ground or in the form of pellets, resulting from the extraction of vegetable or microbial fats or oils, other than those of heading 23.04 or 23.05",40871247
202503,2308,"Vegetable materials and vegetable waste, vegetable residues and byproducts, whether or not in the form of pellets, of a kind used in animal feeding, not elsewhere specified or included.",48369540
202503,2309,Preparations of a kind used in animal feeding.,2003223449
202503,2401,Unmanufactured tobacco; tobacco refuse.,282750253
202503,2402,"Cigars, cheroots, cigarillos and cigarettes, of tobacco or of tobacco substitutes.",138399532
202503,2403,Other manufactured tobacco and manufactured tobacco substitutes; “homogenised” or reconstituted” tobacco; tobacco extracts and essences.,33831571
202503,2404,"Products containing tobacco, reconstituted tobacco, nicotine, or tobacco or nicotine substitutes, intended for inhalation without combustion; other nicotine containing products intended for the intake of nicotine into the human body",4504380435
202503,2501,"Salts, incl. table salt and denatured salt, and pure sodium chloride, whether or not in aqueous solution or containing added anti-caking or free-flowing agents; sea water",55945301
202503,2502,Unroasted iron pyrites.,5596092
202503,2503,"Sulphur of all kinds (excluding sublimed sulphur, precipitated sulphur and colloidal sulphur)",376427
202503,2504,Natural graphite.,197491464
202503,2505,"Natural sands of all kinds, whether or not coloured, other than metalbearing sands of Chapter 26.",8871860
202503,2506,"Quartz (excluding natural sands); quartzite, whether or not roughly trimmed or merely cut, by sawing or otherwise, into blocks or slabs of a square or rectangular shape",58917689
202503,2507,"Kaolin and other kaolinic clays, whether or not calcined",105214198
202503,2508,"Other clays (not including expanded clays of heading 68.06), andalusite, kyanite and sillimanite, whether or not calcined; mullite; chamotte or dinas earths.",165659337
202503,2509,Chalk.,29972
202503,2510,"Natural calcium phosphates, natural aluminium calcium phosphates and phosphatic chalk.",4159
202503,2511,"Natural barium sulphate (barytes); natural barium carbonate (witherite), whether or not calcined, other than barium oxide of heading 28.16.",185261212
202503,2512,"Siliceous fossil meals, e.g. kieselguhr, tripolite and diatomite, and similar siliceous earths, whether or not calcined, of an apparent specific gravity of 1 or less.",11716338
202503,2513,"Pumice stone; emery; natural corundum, natural garnet and other natural abrasives, whether or not heat-treated",34385067
202503,2514,"Slate, whether or not roughly trimmed or merely cut, by sawing or otherwise, into blocks or slabs of a square or rectangular shape; slate powder and slate refuse",1330848
