Date of data,Commodity code,Commodity,Renminbi Yuan
201605,7003,"Cast glass and rolled glass, in sheets or profiles, whether or not having an absorbent, reflecting or nonreflecting layer, but not otherwise worked.",436672614
201605,7004,"Drawn glass and blown glass, in sheets, whether or not having an absorbent, reflecting or nonreflecting layer, but not otherwise worked.",24124725
201605,7005,"Float glass and surface ground or polished glass, in sheets, whether or not having an absorbent, reflecting or nonreflecting layer, but not otherwise worked.",321341261
201605,7006,"Glass of heading 70.03, 70.04 or 70.05, bent, edgeworked, engraved, drilled, enamelled or otherwise worked, but not framed or fitted with other materials.",335313792
201605,7007,"safety glass, consisting of toughened (tempered) or laminated glass.",1358215402
201605,7008,Multiplewalled insulating units of glass.,89564218
201605,7009,"Glass mirrors, whether or not framed, including rearview mirrors.",974227587
201605,7010,"Carboys, bottles, flasks, jars, pots, phials, ampoules and other containers, of glass, of a kind used for the conveyance or packing of goods; preserving jars of glass; stoppers, lids and other closures, of glass.",962777822
201605,7011,"Glass envelopes (including bulbs and tubes), open, and glass parts thereof, without fittings, for electric lamps, cathoderay tubes or the like.",13539342
201605,7013,"Glassware of a kind used for table, kitchen, toilet, office, indoor decoration or similar purposes (other than that of heading 70.10 or 70.18).",1693735197
201605,7014,"Signalling glassware and optical elements of glass (other than those of heading 70.15), not optically worked.",48764742
201605,7015,"Clock or watch glasses and similar glasses, glasses for non corrective or corrective spectacles, curved, bent, hollowed or the like, not optically worked; hollow glass spheres and their segments, for the manufacture of such glasses.",11658227
201605,7016,"Paving blocks, slabs, bricks, squares, tiles and other articles of pressed or moulded glass, whether or not wired, of a kind used for building or construction purposes; glass cubes and other glass smallwares, whether or not on a backing, for mosaics or similar decorative purposes; leaded lights and the like; multicellular or foam glass in blocks, panels, plates, shells or similar forms.",332523695
201605,7017,"Laboratory, hygienic or pharmaceutical glassware, whether or not graduated or calibrated.",52409246
201605,7018,"Glass beads, imitation pearls, imitation precious or semiprecious stones and similar glass smallwares, and articles thereof other than imitation jewellery; glass eyes other than prosthetic articles; statuettes and other ornaments of lampworked glass, other than imitation jewellery; glass microspheres not exceeding 1mm in diameter.",625483628
201605,7019,"Glass fibres (including glass wool) and articles thereof (for example, yarn, woven fabrics).",1290385905
201605,7020,Other articles of glass,266814804
201605,7101,"Pearls, natural or cultured, whether or not worked or graded but not strung, mounted or set; pearls, natural or cultured, temporarily strung for convenience of transport.",36466178
201605,7102,"Diamonds, whether or not worked, but not mounted or set.",897487478
201605,7103,"Precious stones and semi-precious stones, whether or not worked or graded, but not strung, mounted or set, ungraded precious stones and semi-precious stones, temporarily strung for convenience of transport",80178033
201605,7104,"Synthetic or reconstructed precious or semiprecious stones, whether or not worked or graded but not strung, mounted or set; ungraded synthetic or reconstructed precious or semiprecious stones, temporarily strung for convenience of transport.",106243751
201605,7105,Dust and powder of natural or synthetic precious or semiprecious stones.,68265757
201605,7106,"Silver (including silver plated with gold or platinum), unwrought or in semimanufactured forms, or in powder form.",453287238
201605,7107,"Base metals clad with silver, not further worked than semimanufactured.",1396168
201605,7108,"Gold (including gold plated with platinum) unwrought or in semimanufactured forms, or in powder form.",1108012188
201605,7110,"Platinum, unwrought or in semimanufactured forms, or in powder form.",10175603
201605,7112,"Waste and scrap of precious metal or of metal clad with precious metal; other waste and scrap containing precious metal or precious metal compounds, of a kind used principally for the recovery of precious metal.",39629298
201605,7113,"Articles of jewellery and parts thereof, of precious metal or of metal clad with precious metal.",4496083416
201605,7114,"Articles of goldsmiths' or silversmiths' wares and parts thereof, of precious metal or of metal clad with precious metal.",44676584
201605,7115,Other articles of precious metal or of metal clad with precious metal.,599138485
201605,7116,"Articles of natural or cultured pearls, precious or semiprecious stones (natural, synthetic or reconstructed).",74276542
201605,7117,Imitation jewellery.,1371377578
201605,7118,Coin.,104386
201605,7201,"Pig iron and spiegeleisen in pigs, blocks or other primary forms.",3865241
201605,7202,Ferroalloys.,441719398
201605,7203,"Ferrous products obtained by direct reduction of iron ore and other spongy ferrous products, in lumps, pellets or similar forms; iron having a minimum purity by weight of 99.94%, in lumps, pellets or similar forms.",112665
201605,7204,Ferrous waste and scrap; remelting scrap ingots of iron or steel.,400259
201605,7205,"Nranules and powders, of pig iron, spiegeleisen, iron or steel",65233896
201605,7207,Semi-finished products of iron or nonalloy steel.,220873
201605,7208,"Flat-rolled products of iron or nonalloy steel, of a width of 600 mm or more, hotrolled, not clad, plated or coated.",102991248
201605,7209,"Flat-rolled products of iron or nonalloy steel, of a width of 600 mm or more, coldrolled (coldreduced), not clad, plated or coated.",406796873
201605,7210,"at-rolled products of iron or non-alloy steel, of a width ≥ 600 mm, hot-rolled or cold-rolled ""cold-reduced"", clad, plated or coated",6017194489
201605,7211,"Flat-rolled products of iron or nonalloy steel, of a width of less than 600 mm, not clad, plated or coated.",55779404
201605,7212,"Flat-rolled products of iron or nonalloy steel, of a width of less than 600 mm, clad, plated or coated.",117371832
201605,7213,"Bars and rods, hotrolled, in irregularly wound coils, of iron or nonalloy steel.",17695187
201605,7214,"Other bars and rods of iron or nonalloy steel, not further worked than forged, hotrolled, hotdrawn or hotextruded, but including those twisted after rolling.",75072806
201605,7215,Other bars and rods of iron or nonalloy steel.,3852333
201605,7216,"Angles, shapes and sections of iron or nonalloy steel.",292504486
201605,7217,Wire of iron or nonalloy steel.,795318098
201605,7218,Stainless steel in ingots or other primary forms; semifinished products of stainless steel.,13949
201605,7219,"Flat-rolled products of stainless steel, of a width of 600 mm or more.",1931554396
201605,7220,"Flat-rolled products of stainless steel, of a width of less than 600 mm.",236709641
201605,7221,"Bars and rods, hotrolled, in irregularly wound coils, of stainless steel.",80917520
201605,7222,"Other bars and rods of stainless steel; angles, shapes and sections of stainless steel.",126947444
201605,7223,Wire of stainless steel.,114812391
201605,7224,Other alloy steel in ingots or other primary forms; semifinished products of other alloy steel.,3138916
201605,7225,"Flat-rolled products of other alloy steel, of a width of 600 mm or more.",3711677577
201605,7226,"Flat-rolled products of alloy steel other than stainless, of a width of ≥ 600 mm, hot-rolled or cold-rolled ""cold-reduced"" and further worked (excluding plated or coated with zinc and products of silicon-electrical steel)",83126821
201605,7227,"Bars and rods, hot-rolled, in irregularly wound coils, of other alloy steel.",2136782311
201605,7228,"Other bars and rods of other alloy steel; angles, shapes and sections, of other alloy steel; hollow drill bars and rods, of alloy or nonalloy steel.",7143087711
201605,7229,Wire of other alloy steel.,204184121
201605,7301,"Sheet piling of iron or steel, whether or not drilled, punched or made from assembled elements; welded angles, shapes and sections, of iron or steel.",125619375
201605,7302,"Railway or tramway track construction material of iron or steel, the following : rails, check-rails and rack rails, switch blades, crossing frogs, point rods and other crossing pieces, sleepers ""cross-ties"", fish-plates, chairs, chair wedges, sole plates ""base plates"", rail clips, bedplates, ties and other material specialised for jointing or fixing rails",139245003
201605,7303,"Tubes, pipes and hollow profiles, of cast iron.",212865774
201605,7304,"Tubes, pipes and hollow profiles, seamless, of iron (other than cast iron) or steel.",2051504271
201605,7305,"Other tubes and pipes (for example, welded, riveted or similarly closed), having circular cross-sections, the external diameter of which exceeds 406.4 mm, of iron or steel.",357982624
201605,7306,"Other tubes, pipes and hollow profiles (for example, open seam or welded, riveted or similarly closed), of iron or steel.",1634395501
201605,7307,"Tube or pipe fittings (for example, couplings, elbows, sleeves), of iron or steel.",2157942960
201605,7308,"Structures (excluding prefabricated buildings of heading 94.06) and parts of structures (for example, bridges and bridgesections, lockgates, towers, lattice masts, roofs, roofing frameworks, doors and windows and their frames and thresholds for doors, shutters, balustrades, pillars and columns), of iron or steel; plates, rods, angles, shapes, sections, tubes and the like, prepared for use in structures, of iron or steel.",6001861458
201605,7309,"eservoirs, tanks, vats and similar containers for any material (other than compressed or liquefied gas), of iron or steel, of a capacity exceeding 300 l, whether or not lined or heatinsulated, but not fitted with mechanical or thermal equipment.",181562110
201605,7310,"anks, casks, drums, cans, boxes and similar containers, for any material (other than compressed or liquefied gas), of iron or steel, of a capacity not exceeding 300 l, whether or not lined or heatinsulated, but not fitted with mechanical or thermal equipment.",355511003
201605,7311,"Containers for compressed or liquefied gas, of iron or steel.",283215225
201605,7312,"Stranded wire, ropes, cables, plaited bands, slings and the like, of iron or steel, not electrically insulated.",760579327
201605,7313,"Barbed wire of iron or steel; twisted hoop or single flat wire, barbed or not, and loosely twisted double wire, of a kind used for fencing, of iron or steel.",35160208
201605,7314,"Cloth (including endless bands), grill, netting and fencing, of iron or steel wire; expanded metal of iron or steel.",505002945
201605,7315,"Chain and parts thereof, of iron or steel.",809493164
201605,7316,"Anchors, grapnels and parts thereof, of iron or steel.",44550488
201605,7317,"Nails, tacks, drawing pins, corrugated nails, staples (other than those of heading 83.05) and similar articles, of iron or steel, whether or not with heads of other material, but excluding such articles with heads of copper.",650748929
201605,7318,"Screws, bolts, nuts, coach screws, screw hooks, rivets, cotters, cotterpins, washers (including spring washers) and similar articles, of iron or steel.",2717721486
201605,7319,"Sewing needles, knitting needles, bodkins, crochet hooks, embroidery stilettos and similar articles, for use in the hand, of iron or steel; safety pins and other pins of iron or steel, not elsewhere specified or included.",56712192
201605,7320,"Springs and leaves for springs, of iron or steel.",264952299
201605,7321,"Stoves, ranges, grates, cookers (including those with subsidiary boilers for central heating), barbecues, braziers, gasrings, plate warmers and similar nonelectric domestic appliances, and parts thereof, of iron or steel.",1691240769
201605,7322,"Radiators for central heating, not electrically heated, and parts thereof, of iron or steel; air heaters and hot air distributors (including distributors which can also distribute fresh or conditioned air), not electrically heated, incorporating a motordriven fan or blower, and parts thereof, of iron or steel.",54266629
201605,7323,"Table, kitchen or other household articles and parts thereof, of iron or steel; iron or steel wool; pot scourers and scouring or polishing pads, gloves and the like, of iron or steel.",2829633258
201605,7324,"Sanitary ware and parts thereof, of iron or steel.",731606096
201605,7325,Other cast articles of iron or steel.,385665156
201605,7326,Other articles of iron or steel.,3993779328
201605,7402,Unrefined copper; copper anodes for electrolytic refining.,1550
201605,7403,"Refined copper and copper alloys, unwrought.",2669759058
201605,7404,Copper waste and scrap.,758269
201605,7405,Master alloys of copper.,3105046
201605,7406,Copper powders and flakes.,21276050
201605,7407,"Copper bars, rods and profiles.",48152124
201605,7408,Copper wire.,131430995
201605,7409,"Copper plates, sheets and strip, of a thickness exceeding 0.15mm.",131027031
201605,7410,"Copper foil (whether or not printed or backed with paper, paperboard, plastics or similar backing materials) of a thickness (excluding any backing) not exceeding 0.15 mm.",362583119
201605,7411,Copper tubes and pipes.,590741080
201605,7412,"Copper tube or pipe fittings (for example, couplings, elbows, sleeves).",517041311
201605,7413,"Stranded wire, cables, plaited bands and the like, of copper, not electrically insulated.",28234337
201605,7415,"Nails, tacks, drawing pins, staples (other than those of heading 83.05) and similar articles, of copper or of iron or steel with heads of copper; screws, bolts, nuts, screw hooks, rivets, cotters, cotterpins, washers (including spring washers) and similar articles, of copper.",74177349
201605,7418,"Table, kitchen or other household articles and parts thereof, of copper; pot scourers and scouring or polishing pads, gloves and the like, of copper; sanitary ware and parts thereof, of copper.",167003136
201605,7419,Other articles of copper.,115440425
201605,7502,nwrought nickel.,142195457
201605,7503,Nickel waste and scrap.,887894
201605,7504,Nickel powders and flakes.,14280309
201605,7505,"Nickel bars, rods, profiles and wire.",22714163
201605,7506,"Nickel plates, sheets, strip and foil.",10133564
201605,7507,"Nickel tubes, pipes and tube or pipe fittings (for example, couplings, elbows, sleeves).",10682001
201605,7508,Other articles of nickel.,24315962
201605,7601,Unwrought aluminium.,504052124
201605,7602,Aluminium waste and scrap.,608802
201605,7603,Aluminium powders and flakes.,23960919
201605,7604,"Aluminium bars, rods and profiles.",2042519312
201605,7605,Aluminium wire.,51475343
201605,7606,"Aluminium plates, sheets and strip, of a thickness exceeding 0.2 mm.",2277854940
201605,7607,"Aluminium foil (whether or not printed or backed with paper, paperboard, plastics or similar backing materials) of a thickness (excluding any backing) not exceeding 0.2 mm.",1936736903
201605,7608,Aluminium tubes and pipes.,216729423
201605,7609,"Aluminium tube or pipe fittings (for example, couplings, elbows, sleeves).",112171215
201605,7610,"Aluminium structures (excluding prefabricated buildings of heading 94.06) and parts of structures (for example, bridges and bridgesections, towers, lattice masts, roofs, roofing frameworks, doors and windows and their frames and thresholds for doors, balustrades, pillars and columns); aluminium plates, rods, profiles, tubes and the like, prepared for use in structures.",1651198516
201605,7611,"Aluminium reservoirs, tanks, vats and similar containers, for any material (other than compressed or liquefied gas), of a capacity exceeding 300 l, whether or not lined or heatinsulated, but not fitted with mechanical or thermal equipment.",2173132
201605,7612,"Aluminium casks, drums, cans, boxes and similar containers (including rigid or collapsible tubular containers), for any material (other than compressed or liquefied gas), of a capacity not exceeding 300 l, whether or not lined or heatinsulated, but not fitted with mechanical or thermal equipment.",99800339
201605,7613,Aluminium containers for compressed or liquefied gas.,28418605
201605,7614,"Stranded wire, cables, plaited bands and the like, of aluminium, not electrically insulated.",251535712
201605,7615,"Table, kitchen or other household articles and parts thereof, of aluminium; pot scourers and scouring or polishing pads, gloves and the like, of aluminium; sanitary ware and parts thereof, of aluminium.",1227562112
201605,7616,Other articles of aluminium.,1623954554
201605,7801,Unwrought lead.,30915880
201605,7804,"Lead plates, sheets, strip and foil; lead powders and flakes.",9107755
201605,7806,Other articles of lead.,5631988
201605,7901,Unwrought zinc.,27275354
201605,7903,"zinc dust, powders and flakes.",697435
201605,7904,"Zinc bars, rods, profiles and wire.",13101334
201605,7905,"Zinc plates, sheets, strip and foil.",478397
201605,7907,Other articles of zinc.,121713065
201605,8001,Unwrought tin.,14220431
201605,8003,"Tin bars, rods, profiles and wire.",2440406
201605,8007,Other articles of tin.,19909364
201605,8101,"Wungsten (wolfram) and articles thereof, including waste and scrap.",212239319
201605,8102,"Molybdenum and articles thereof, including waste and scrap.",72777123
201605,8103,"Tantalum and articles thereof, including waste and scrap.",91598896
201605,8104,"Magnesium and articles thereof, including waste and scrap.",320398916
201605,8105,"Cobalt mattes and other intermediate products of cobalt metallurgy; cobalt and articles thereof, including waste and scrap.",21169065
201605,8106,"Bismuth and articles thereof, including waste and scrap.",42340324
201605,8107,"Cadmium and articles thereof, including waste and scrap.",334006
201605,8108,"Titanium and articles thereof, including waste and scrap.",156943553
201605,8109,"Zirconium and articles thereof, including waste and scrap.",30274571
201605,8110,"Antimony and articles thereof, including waste and scrap.",11152895
201605,8111,"Manganese and articles thereof, including waste and scrap.",293194445
201605,8112,"Beryllium, chromium, germanium, vanadium, gallium, hafnium, indium, niobium (columbium), rhenium and thallium, and articles of these metals, including waste and scrap.",69151318
201605,8113,"Cermets and articles thereof, including waste and scrap.",12277087
201605,8201,"Hand tools, the following : spades, shovels, mattocks, picks, hoes, forks and rakes; axes, bill hooks and similar hewing tools; secateurs and pruners of any kind; scythes, sickles, hay knives, hedge shears, timber wedges and other tools of a kind used in agriculture, horticulture or forestry.",349296136
201605,8202,"Hand saws; blades for saws of all kinds (including slitting, slotting or toothless saw blades).",627654486
201605,8203,"Files, rasps, pliers (including cutting pliers), pincers, tweezers, metal cutting shears, pipecutters, bolt croppers, perforating punches and similar hand tools.",388406841
201605,8204,"Hand-operated spanners and wrenches (including torque meter wrenches but not including tap wrenches); interchangeable spanner sockets, with or without handles.",436228316
201605,8205,"Hand tools (including glaziers' diamonds), not elsewhere specified or included; blow lamps; vices, clamps and the like, other than accessories for and parts of, machinetools or waterjet cutting machines; anvils; portable forges; hand or pedaloperated grinding wheels with frameworks.",1271245771
201605,8206,"Tools of two or more of the headings 82.02 to 82.05, put up in sets for retail sale.",282670797
201605,8207,"Interchangeable tools for hand tools, whether or not poweroperated, or for machinetools (for example, for pressing, stamping, punching, tapping, threading, drilling, boring, broaching, milling, turning or screw driving), including dies for drawing or extruding metal, and rock drilling or earth boring tools.",1405948873
201605,8208,"Knives and cutting blades, for machines or for mechanical appliances.",170739820
201605,8209,"Plates, sticks, tips and the like for tools, unmounted, of cermets.",248990391
201605,8210,"Hand-operated mechanical appliances, weighing 10 kg or less, used in the preparation, conditioning or serving of food or drink.",101127442
201605,8211,"Knives with cutting blades, serrated or not (including pruning knives), other than knives of heading 82.08, and blades therefor.",515488214
201605,8212,Razors and razor blades (including razor blade blanks in strips).,271523570
201605,8213,"Scissors, tailors' shears and similar shears, and blades therefor.",248671798
201605,8214,"Other articles of cutlery (for example, hair clippers, butchers' or kitchen cleavers, choppers and mincing knives, paper knives); manicure or pedicure sets and instruments (including nail files).",372270932
201605,8215,"Spoons, forks, ladles, skimmers, cakeservers, fishknives, butterknives, sugar tongs and similar kitchen or tableware.",794636834
201605,8301,"Padlocks and locks (key, combination or electrically operated), of base metal; clasps and frames with clasps, incorporating locks, of base metal; keys for any of the foregoing articles, of base metal",2352460880
201605,8302,"Base metal mountings, fittings and similar articles suitable for furniture, doors, staircases, windows, blinds, coachwork, saddlery, trunks, chests, caskets or the like; base metal hatracks, hatpegs, brackets and similar fixtures; castors with mountings of base metal; automatic door closers of base metal",3948418858
201605,8303,"Armoured or reinforced safes, strongboxes and doors and safe deposit lockers for strongrooms, cash or deed boxes and the like, of base metal",225474369
201605,8304,"Filing cabinets, cardindex cabinets, paper trays, paper rests, pen trays, officestamp stands and similar office or desk equipment, of base metal, other than office furniture of heading 9403",92015837
201605,8305,"Fittings for looseleaf binders or files, letter clips, letter corners, paper clips, indexing tags and similar office articles, of base metal; staples in strips (for example, for offices, upholstery, packaging), of base metal",227825723
201605,8306,"Bells, gongs and the like, nonelectric, of base metal; statuettes and other ornaments, of base metal; photograph, picture or similar frames, of base metal; mirrors of base metal",684817292
201605,8307,"Flexible tubing of base metal, with or without fittings",118782472
201605,8308,"Clasps, frames with clasps, buckles, buckleclasps, hooks, eyes, eyelets and the like, of base metal, of a kind used for clothing or clothing accessories, footwear, jewellery, wristwatches, books, awnings, leather goods, travel goods or saddlery or for other made up articles; tubular or bifurcated rivets, of base metal; beads and spangles, of base metal",435228826
201605,8309,"Stoppers, caps and lids (including crown corks, screw caps and pouring stoppers), capsules for bottles, threaded bungs, bung covers, seals and other packing accessories, of base metal",205260697
201605,8310,"Signplates, nameplates, addressplates and similar plates, numbers, letters and other symbols, of base metal, excluding those of heading 9405",79061448
201605,8311,"Wire, rods, tubes, plates, electrodes and similar products, of base metal or of metal carbides, coated or cored with flux material, of a kind used for soldering, brazing, welding or deposition of metal or of metal carbides; wire and rods, of agglomerated base metal powder, used for metal spraying",350501302
201605,8401,"Nuclear reactors; fuel elements (cartridges), nonirradiated, for nuclear reactors; machinery and apparatus for isotopicseparation.",157770002
201605,8402,Steam or other vapour generating boilers (other than central heating hot water boilers capable also of producing low pressure steam); superheated water boilers.,766042867
201605,8403,Central heating boilers other than those of heading 8402.,62826451
201605,8404,"Auxiliary plant for use with boilers of heading 84.02 or 84.03 (for example, economisers, superheaters, soot removers, gas recoverers); condensers for steam or other vapour power units.",703610252
201605,8405,"Producer gas or water gas generators, with or without their purifiers; acetylene gas generators and similar water process gas generators, with or without their purifiers.",21814287
201605,8406,Steam turbines and other vapour turbines.,395614840
201605,8407,Sparkignition reciprocating or rotary internal combustion piston engines.,1362635305
201605,8408,Compressionignition internal combustion piston engines (diesel or semidiesel engines).,878248321
201605,8409,Parts suitable for use solely or principally with the engines of heading 84.07 or 84.08.,2977186990
201605,8410,"Hydraulic turbines, water wheels, and regulators therefor.",313976089
201605,8411,"Turbojets, turbopropellers and other gas turbines.",1946658714
201605,8412,Other engines and motors.,1370600355
201605,8413,"Pumps for liquids, whether or not fitted with a measuring device; liquid elevators.",3856283004
201605,8414,"Air or vacuum pumps, air or other gas compressors and fans; ventilating or recycling hoods incorporating a fan, whether or not fitted with filters.",8288866086
201605,8415,"Air conditioning machines, comprising a motordriven fan and elements for changing the temperature and humidity, including those machines in which the humidity cannot be separately regulated.",10565732642
201605,8416,"Furnace burners for liquid fuel, for pulverised solid fuel or for gas; mechanical stokers, including their mechanical grates,mechanical ash dischargers and similar appliances.",72555669
