Date of data,Commodity code,Commodity,Renminbi Yuan
201605,3802,"ctivated carbon; activated natural mineral products; animal black, including spent animal black.",194942976
201605,3803,"Tall oil, whether or not refined.",214499
201605,3804,"Residual lyes from the manufacture of wood pulp, whether or not concentrated, desugared or chemically treated, including lignin sulphonates, but excluding tall oil of heading 38.03.",11025948
201605,3805,"Gum, wood or sulphate turpentine and other terpenic oils produced by the distillation or other treatment of coniferous woods; crude dipentene; sulphite turpentine and other crude para-cymene; pine oil containing alpha-terpineol as the main constituent",7384325
201605,3806,"Rosin and resin acids, and derivatives thereof; rosin spirit and rosin oils; run gums.",156442194
201605,3807,"Wood tar; wood tar oils; wood creosote; wood naphtha; vegetable pitch; brewers' pitch and similar preparations based on rosin, resin acids or on vegetable pitch.",4578264
201605,3808,"Insecticides, rodenticides, fungicides, herbicides, antisprouting products and plantgrowth regulators, disinfectants and similar products, put up in forms or packings for retail sale or as preparations or articles (for example, sulphurtreated bands, wicks and candles, and flypapers).",2249215046
201605,3809,"Finishing agents, dye carriers to accelerate the dyeing or fixing of dyestuffs and other products and preparations (for example, dressings and mordants), of a kind used in the textile, paper, leather or like industries, not elsewhere specified or included.",114280575
201605,3810,"Pickling preparations for metal surfaces; fluxes and other auxiliary preparations for soldering, brazing or welding; soldering, brazing or welding powders and pastes consisting of metal and other materials; preparations of a kind used as cores or coatings for welding electrodes or rods.",49179073
201605,3811,"ntiknock preparations, oxidation inhibitors, gum inhibitors, viscosity improvers, anticorrosive preparations and other prepared additives, for mineral oils (including gasoline) or for other liquids used for the same purposes as mineral oils.",89779260
201605,3812,"Prepared rubber accelerators; compound plasticisers for rubber or plastics, not elsewhere specified or included; antioxidising preparations and other compound stabilisers for rubber or plastics.",340865799
201605,3813,Preparations and charges for fireextinguishers; charged fireextinguishing grenades.,15224177
201605,3814,"Organic composite solvents and thinners, not elsewhere specified or included; prepared paint or varnish removers.",17277515
201605,3815,"Reaction initiators, reaction accelerators and catalytic preparations, not elsewhere specified or included.",366289884
201605,3816,"Refractory cements, mortars, concretes and similar compositions, other than products of heading 38.01.",135603416
201605,3817,"Mixed alkylbenzenes and mixed alkylnaphthalenes, other than those of heading 27.07 or 29.02.",146894630
201605,3818,"Chemical elements doped for use in electronics, in the form of discs, wafers or similar forms; chemical compounds doped for use in electronics. form of",2246790548
201605,3819,"Hydraulic brake fluids and other prepared liquids for hydraulic transmission, not containing or containing less than 70% by weight of petroleum oils or oils obtained from bituminous minerals.",3562637
201605,3820,Antifreezing preparations and prepared deicing fluids.,7874543
201605,3821,"Prepared culture media for the development or maintenance of microorganisms (including viruses and the like) or of plant, human or animal cells.",4581006
201605,3822,"Diagnostic or laboratory reagents on a backing, prepared diagnostic or laboratory reagents whether or not on a backing, other than those of heading 30.02 or 30.06; certified reference materials.",90127283
201605,3823,Industrial monocarboxylic fatty acids; acid oils from refining;industrial fatty alcohols.,36267582
201605,3824,"Prepared binders for foundry moulds or cores; chemical products and preparations for the chemical or allied industries, incl. mixtures of natural products, n.e.s.",1933712280
201605,3825,"Residual products of the chemical or allied industries, not elsewhere specified or included; municipal waste; sewage sludge; other wastes specified in Note 6 to this Chapter.",7864566
201605,3901,"Polymers of ethylene, in primary forms.",525686244
201605,3902,"Polymers of propylene or of other olefins, in primary forms.",288943418
201605,3903,"Polymers of styrene, in primary forms.",309681611
201605,3904,"Polymers of vinyl chloride or of other halogenated olefins, in primary forms.",883496696
201605,3905,"Polymers of vinyl acetate or of other vinyl esters, in primary forms; other vinyl polymers in primary forms.",165877515
201605,3906,crylic polymers in primary forms.,423589595
201605,3907,"Polyacetals, other polyethers and epoxide resins, in primary forms; polycarbonates, alkyd resins, polyallyl esters and other polyesters, in primary forms.",2697916095
201605,3908,Polyamides in primary forms.,319987978
201605,3909,"minoresins, phenolic resins and polyurethanes, in primary forms.",698013818
201605,3910,Silicones in primary forms,232960620
201605,3911,"etroleum resins, coumaroneindene resins, polyterpenes, polysulphides, polysulphones and other products specified in Note 3 to this Chapter, not elsewhere specified or included, in primary forms.",302481280
201605,3912,"Cellulose and its chemical derivatives, not elsewhere specified or included, in primary forms.",279196031
201605,3913,"Natural polymers (for example, alginic acid) and modified natural polymers (for example, hardened proteins, chemical derivatives of natural rubber), not elsewhere specified or included, in primary forms.",126536963
201605,3914,"Ionexchangers based on polymers of headings 39.01 to 39.13, in primary forms",107573175
201605,3915,"Waste, parings and scrap, of plastics.",24090681
201605,3916,"Monofilament of which any crosssectional dimension exceeds 1 mm, rods, sticks and profile shapes, whether or not surfac worked but not otherwise worked, of plastics.",247417847
201605,3917,"Tubes, pipes and hoses, and fittings therefor (for example, joints,elbows, flanges), of plastics.",1259980312
201605,3918,"Floor coverings of plastics, whether or not selfadhesive, in rolls or in the form of tiles; wall or ceiling coverings of plastics, as defined in Note 9 to this Chapter.",1992218394
201605,3919,"Selfadhesive plates, sheets, film, foil, tape, strip and other flat shapes, of plastics, whether or not in rolls.",1580319817
201605,3920,"Other plates, sheets, film, foil and strip, of plastics, noncellular and not reinforced, laminated, supported or similarly combined with other materials.",3077251182
201605,3921,"Other plates, sheets, film, foil and strip, of plastics.",1094214162
201605,3922,"Baths, showerbaths, sinks, washbasins, bidets, lavatory pans, seats and covers, flushing cisterns and similar sanitary ware, of plastics.",442188563
201605,3923,"Articles for the conveyance or packing of goods, of plastics; stoppers, lids, caps and other closures, of plastics.",4313885575
201605,3924,"Tableware, kitchenware, other household articles and hygienic or toilet articles, of plastics.",4243041715
201605,3925,"Builders' ware of plastics, not elsewhere specified or included.",934387104
201605,3926,Other articles of plastics and articles of other materials of headings 39.01 to 39.14.,9518534044
201605,4001,"Natural rubber, balata, guttapercha, guayule, chicle and similar natural gums, in primary forms or in plates, sheets or strip.",5094783
201605,4002,"Synthetic rubber and factice derived from oils, in primary forms or in plates, sheets or strip; mixtures of any product of heading 40.01 with any product of this heading, in primary forms or in plates, sheets or strip.",236216575
201605,4003,"Reclaimed rubber in primary forms or in plates, sheets or strip.",60517166
201605,4004,"Waste, parings and scrap of rubber (other than hard rubber)and powders and granules obtained therefrom.",1517298
201605,4005,"ompounded rubber, unvulcanised, in primary forms or in plates, sheets or strip.",44546908
201605,4006,"Other forms (for example, rods, tubes and profile shapes) and articles (for example, discs and rings), of unvulcanised rubber.",2276599
201605,4007,Vulcanised rubber thread and cord.,65347110
201605,4008,"lates, sheets, strip, rods and profile shapes, of vulcanised rubber other than hard rubber.",132155877
201605,4009,"Tubes, pipes and hoses, of vulcanised rubber other than hard rubber, with or without their fittings (for example, joints, elbows, flanges).",441821978
201605,4010,"Conveyor or transmission belts or belting, of vulcanised rubber.",389943901
201605,4011,"New pneumatic tyres, of rubber.",8298740431
201605,4012,"Retreaded or used pneumatic tyres of rubber; solid or cushion tyres, tyre treads and tyre flaps, of rubber.",83662864
201605,4013,"Inner tubes, of rubber.",305904422
201605,4014,"Hygienic or pharmaceutical articles (including teats), of vulcanised rubber other than hard rubber, with or without fittings of hard rubber.",64529951
201605,4015,"Articles of apparel and clothing accessories (including gloves, mittens and mitts), for all purposes, of vulcanised rubber other than hard rubber.",296174268
201605,4016,Other articles of vulcanised rubber other than hard rubber.,1267609372
201605,4017,"Hard rubber (for example, ebonite) in all forms, including waste and scrap; articles of hard rubber.",20495600
201605,4101,"Raw hides and skins of bovine (including buffalo) or equine animals (fresh, or salted, dried, limed, pickled or otherwise preserved, but not tanned, parchmentdressed or further prepared), whether or not dehaired or split.",6328584
201605,4102,"Raw skins of sheep or lambs (fresh, or salted, dried, limed, pickled or otherwise preserved, but not tanned, parchment dressed or further prepared), whether or not with wool on or split, other than those excluded by Note 1 (c) to this Chapter.",726435
201605,4104,"Tanned or crust hides and skins of bovine (including buffalo) or equine animals, without hair on, whether or not split, but not further prepared.",20466780
201605,4105,"Tanned or crust skins of sheep or lambs, without wool on, whether or not split, but not further prepared.",996168
201605,4106,"Tanned or crust hides and skins of other animals, without wool whether or not split, but not further prepared.",5333237
201605,4107,"Leather further prepared after tanning or crusting, including parchmentdressed leather, of bovine (including buffalo) or equine animals, without hair on, whether or not split, other than leather of heading 41.14.",297117853
201605,4112,"Leather further prepared after tanning or crusting, including parchmentdressed leather, of sheep or lamb, without wool on, whether or not split, other than leather of heading 41.14",15480119
201605,4113,"Leather further prepared after tanning or crusting, including parchmentdressed leather, of other animals, without wool or hair on, whether or not split, other than leather of heading 41.14.",40088031
201605,4114,Chamois (including combination chamois) leather; patentleather and patent laminated leather; metallised leather.,6559639
201605,4115,"Composition leather with a basis of leather or leather fibre, in slabs, sheets or strip, whether or not in rolls; parings and other waste of leather or of composition leather, not suitable for the manufacture of leather articles; leather dust, powder and flour.",10001879
201605,4201,"Saddlery and harness for any animal, incl. traces, leads, knee pads, muzzles, saddle cloths, saddlebags, dog coats and the like, of any material",236987610
201605,4202,"Trunks, suitcases, vanitycases, executivecases, briefcases, school satchels, spectacle cases, binocular cases, camera cases, musical instrument cases, gun cases, holsters and similar containers; travellingbags, insulated food or beverages bags, toilet bags, rucksacks, handbags, shoppingbags, wallets, purses, mapcases, cigarettecases, tobaccopouches, tool bags, sports bags, bottlecases, jewellery boxes, powderboxes, cutlery cases and similar containers, of leather or of composition leather, of sheeting of plastics, of textile materials, of vulcanised fibre or of paperboard, or wholly or mainly covered with such materials or with paper.",15393945180
201605,4203,"Articles of apparel and clothing accessories, of leather or of composition leather.",708112427
201605,4205,Other articles of leather or of composition leather,227549685
201605,4301,"Raw furskins, incl. heads, tails, paws and other pieces or cuttings suitable for use in furriery (excluding raw hides and skins of heading 4101, 4102 or 4103)",2299012
201605,4302,"Tanned or dressed furskins (including heads, tails, paws and other pieces or cuttings), unassembled, or assembled (without the addition of other materials) other than those of heading 43.03.",41725217
201605,4303,"rticles of apparel, clothing accessories and other articles of furskin.",1445254792
201605,4304,Artificial fur and articles thereof,7690705
201605,4401,"Fuel wood, in logs, billets, twigs, faggots or similar forms; wood in chips or particles; sawdust and wood waste and scrap, whether or not agglomerated in logs, briquettes, pellets or similar forms",9157135
201605,4402,"Wood charcoal (including shell or nut charcoal), whether or notagglomerated.",64715192
201605,4403,"Wood in the rough, whether or not stripped of bark or sapwood,or roughly squared.",10497017
201605,4404,"Hoopwood; split poles; piles, pickets and stakes of wood, pointed but not sawn lengthwise; wooden sticks, roughly trimmed but not turned, bent or otherwise worked, suitable for the manufacture of walkingsticks,umbrellas, tool handles or the like; chipwood and the like.",1960210
201605,4405,Wood wool; wood flour.,1197278
201605,4406,Railway or tramway sleepers (crossties) of wood.,332000
201605,4407,"Wood sawn or chipped lengthwise, sliced or peeled, whether or not planed, sanded or endjointed, of a thickness exceeding 6 mm.",120713342
201605,4408,"Sheets for veneering, incl. those obtained by slicing laminated wood, for plywood or for other similar laminated wood and other wood, sawn lengthwise, sliced or peeled, whether or not planed, sanded, spliced or end-jointed, of a thickness of ≤ 6 mm",166379928
201605,4409,"Wood, incl. strips and friezes for parquet flooring, not assembled, continuously shaped ""tongued, grooved, rebated, chamfered, V-jointed beaded, moulded, rounded or the like"" along any of its edges, ends or faces, whether or not planed, sanded or end-jointed",330068281
201605,4410,"Particle board, oriented strand board (OSB) and similar board (for example, waferboard) of wood or other ligneous materials, whether or not agglomerated with resins or other organic binding substances.",82185400
201605,4411,"Fibreboard of wood or other ligneous materials, whether or not bonded with resins or other organic substances.",769777232
201605,4412,"Plywood, veneered panels and similar laminated wood.",3499281617
201605,4413,"Densified wood, in blocks, plates, strips or profile shapes",2479851
201605,4414,"Wooden frames for paintings, photographs, mirrors or similar objects.",225168138
201605,4415,"Packing cases, boxes, crates, drums and similar packings, of wood; cabledrums of wood; pallets, box pallets and other load boards,of wood; pallet collars of wood.",37235317
201605,4416,"Wood casks, barrels, vats, tubs and other coopers' products and parts thereof, of wood, including stave",1552174
201605,4417,"Tools, tool bodies, tool handles, broom or brush bodies and handles, of wood; boot or shoe lasts and trees, of wood.",51945079
201605,4418,"Builders' joinery and carpentry of wood, including cellular wood panels, assembled flooring panels, shingles and shakes.",714503365
201605,4419,"Tableware and kitchenware, of wood.",368514385
201605,4420,"Wood marquetry and inlaid wood; caskets and cases for jewellery or cutlery, and similar articles, of wood; statuettes and other ornaments, of wood; wooden articles of furniture (excluding furniture, lighting fixtures and parts thereof)",486051402
201605,4421,Other articles of wood.,1441112129
201605,4501,"Natural cork, raw or merely surface-worked or otherwise cleaned; cork waste; crushed, powdered or ground cork",150331
201605,4502,"Natural cork, debacked or roughly squared, or in square or rectangular blocks, plates, sheets or strip, incl. sharp-edged blanks for corks or stoppers",13949
201605,4503,Articles of natural cork.,393704
201605,4504,"Agglomerated cork, with or without a binding substance, and articles of agglomerated cork",12915050
201605,4601,"Plaits and similar products of plaiting materials, whether or not assembled into strips; plaiting materials, plaits and similar products of plaiting materials, bound together in parallel strands or woven, in sheet form, whether or not being finished articles (for example, mats, matting, screens).",300301904
201605,4602,"Basketwork, wickerwork and other articles, made directly to shape from plaiting materials or made up from goods of heading 46.01; articles of loofah.",521066927
201605,4701,Mechanical wood pulp,107124
201605,4702,"Chemical wood pulp, dissolving grades",80401
201605,4703,"Chemical wood pulp, soda or sulphate, other than dissolving grades.",17790266
201605,4705,Wood pulp obtained by a combination of mechanical and chemical pulping processes.,22680
201605,4706,"Pulps of fibres derived from recovered ""waste and scrap"" paper or paperboard or of other fibrous cellulosic material",52465637
201605,4707,ecovered (waste and scrap) paper or paperboard.,145731
201605,4801,"Newsprint, in rolls or sheets",9086730
201605,4802,"Uncoated paper and paperboard, of a kind used for writing, printing or other graphic purposes, and non perforated punchcards and punch tape paper, in rolls or rectangular (including square) sheets, of any size, other than paper of heading 48.01 or 48.03; handmade paper and paperboard.",678252533
201605,4803,"Toilet or facial tissue stock, towel or napkin stock and similar paper of a kind used for household or sanitary purposes, cellulose wadding and webs of cellulose fibres, whether or not creped, crinkled, embossed, perforated, surfacecoloured, surface decorated or printed, in rolls or sheets",138838118
201605,4804,"Uncoated kraft paper and paperboard, in rolls or sheets, other than that of heading 48.02 or 48.03.",154170737
201605,4805,"Other uncoated paper and paperboard, in rolls or sheets, not further worked or processed than as specified in Note 3 to this Chapter.",292785012
201605,4806,"vegetable parchment, greaseproof papers, tracing papers and glassine and other glazed transparent or translucent papers, in rolls or sheets.",37001685
201605,4807,"Composite paper and paperboard (made by sticking flat layers of paper or paperboard together with an adhesive), not surface coated or impregnated, whether or not internally reinforced, in rolls or sheets.",8249114
201605,4808,"Paper and paperboard, corrugated (with or without glued flat surface sheets), creped, crinkled, embossed or perforated, in rolls or sheets, other than paper of the kind described in heading 48.03.",57219660
201605,4809,"Carbon paper, selfcopy paper and other copying or transfer papers (including coated or impregnated paper for duplicator stencils or offset plates), whether or not printed, in rolls or sheets.",105179858
201605,4810,"Paper and paperboard, coated on one or both sides with kaolin (China clay) or other inorganic substances, with or without a binder, and with no other coating, whether or not surface coloured, surfacedecorated or printed, in rolls or rectangular (including square) sheets, of any size.",1910378347
201605,4811,"Paper, paperboard, cellulose wadding and webs of cellulose fibres,coated,impregnated,covered, surfacecoloured, surface decorated or printed, in rolls or rectangular (including square) sheets, of any size, other than goods of the kind described in heading 48.03, 48.09 or 48.10.",815962293
201605,4812,"Filter blocks, slabs and plates, of paper pulp",1357838
201605,4813,"Cigarette paper, whether or not cut to size or in the form of booklets or tubes.",55201496
201605,4814,Wallpaper and similar wall coverings; window transparencies of paper.,145705057
201605,4816,"Carbon paper, self-copy paper and other copying or transfer papers, in rolls of a width of ≤ 36 cm or in rectangular or square sheets with no side measuring > 36 cm in the unfolded state, or cut into shapes other than rectangles or squares, together with full duplicator stencils and offset plates of paper, whether or not in boxes",63204852
201605,4817,"Envelopes, letter cards, plain postcards and correspondence cards, of paper or paperboard; boxes, pouches, wallets and writing compendiums, of paper or paperboard, containing an assortment of paper stationery.",67878884
201605,4818,"Toilet paper and similar paper, cellulose wadding or webs of cellulose fibres, of a kind used for household or sanitary purposes, in rolls of a width ≤ 36 cm, or cut to size or shape; handkerchiefs, cleansing tissues, towels, tablecloths, serviettes, bedsheets and similar household, sanitary or hospital articles, articles of apparel and clothing accessories, of paper pulp, paper, cellulose wadding or webs of cellulose fibres",814341981
201605,4819,"Cartons, boxes, cases, bags and other packing containers, of paper, paperboard, cellulose wadding or webs of cellulose fibres, n.e.s.; box files, letter trays, and similar articles, of paperboard of a kind used in offices, shops or the like",1797396969
201605,4820,"Registers, account books, note books, order books, receipt books, letter pads, memorandum pads,diaries and similar articles, exercise books, blottingpads, binders (looseleaf or other), folders, file covers, manifold business forms, interleaved carbon sets and other articles of stationery, of paper or paperboard; albums for samples or for collections and book covers, of paper or paperboard.",1030358425
201605,4821,"paper or paperboard labels of all kinds, whether or not printed.",359158246
201605,4822,"Bobbins, spools, cops and similar supports of paper pulp, paper or paperboard (whether or not perforated or hardened).",16488223
201605,4823,"Other paper, paperboard, cellulose wadding and webs of cellulose fibres, cut to size or shape; other articles of paper pulp, paper,paperboard, cellulose wadding or webs of cellulose fibres.",1085098066
201605,4901,"Printed books, brochures, leaflets and similar printed matter, whether or not in single sheets.",545072964
201605,4902,"Newspapers, journals and periodicals, whether or not illustrated or containing advertising material.",6663749
201605,4903,"Children's picture, drawing or colouring books.",266214623
201605,4904,"Music, printed or in manuscript, whether or not bound or illustrated",165561
201605,4905,"Maps and hydrographic or similar charts of all kinds, including atlases, wall maps, topographical plans and globes, printed.",6790005
201605,4906,"Plans and drawings for architectural, engineering, industrial, commercial, topographical or similar purposes, being originals drawn by hand; handwritten texts; photographic reproductions on sensitised paper and carbon copies of the foregoing",4944928
201605,4907,"Unused postage, revenue or similar stamps of current or new issue in the country in which they have, or will have, a recognised face value; stamp-impressed paper; banknotes; cheque forms; stock, share or bond certificates and similar documents of title",86387396
201605,4908,Transfers (decalcomanias),125125823
201605,4909,"Printed or illustrated postcards; printed cards bearing personal greetings, messages or announcements, whether or not illustrated, with or without envelopes or trimmings.",193433510
201605,4910,"Calendars of any kind, printed, including calendar blocks.",67357625
201605,4911,"Other printed matter, including printed pictures and photographs.",453316502
201605,5002,Raw silk (not thrown).,184702010
201605,5003,"Silk waste (including cocoons unsuitable for reeling, yarn waste and garnetted stock).",22266156
201605,5004,Silk yarn (other than yarn spun from silk waste) not put up for retail sale.,63742960
201605,5005,"Yarn spun from silk waste, not put up for retail sale.",61527257
201605,5006,"Silk yarn and yarn spun from silk waste, put up for retail sale;silkworm gut.",384898
201605,5007,Woven fabrics of silk or of silk waste.,443430724
201605,5101,"Wool, not carded or combed.",33104097
201605,5103,"Waste of wool or of fine or coarse animal hair, including yarn waste but excluding garnetted stock.",9198887
201605,5104,Garnetted stock of wool or of fine or coarse animal hair.,826663
201605,5105,"Wool and fine or coarse animal hair, carded or combed (including combed wool in fragments).",388022742
201605,5106,"Yarn of carded wool, not put up for retail sale.",143918411
201605,5107,"Yarn of combed wool, not put up for retail sale.",236437789
201605,5108,"yarn of fine animal hair (carded or combed), not put up for retail sale.",339479155
201605,5109,"Yarn of wool or of fine animal hair, put up for retail sale.",14369077
201605,5110,"Yarn of coarse animal hair or of horsehair (including gimped horsehair yarn), whether or not put up for retail sale.",1471425
201605,5111,Woven fabrics of carded wool or of carded fine animal hair.,174303551
201605,5112,Woven fabrics of combed wool or of combed fine animal hair.,216850610
201605,5113,Woven fabrics of coarse animal hair or of horsehair.,2537993
201605,5201,"Cotton, not carded or combed.",5486072
201605,5202,Cotton waste (including yarn waste and garnetted stock).,371394
201605,5204,"Cotton sewing thread, whether or not put up for retail sale.",14218008
201605,5205,"Cotton yarn (other than sewing thread), containing 85% or more by weight of cotton, not put up for retail sale.",601665380
