Date of data,Commodity code,Commodity,Renminbi Yuan
202311,4911,"Other printed matter, including printed pictures and photographs.",745807599
202311,5002,Raw silk (not thrown).,104942900
202311,5003,"Silk waste (including cocoons unsuitable for reeling, yarn waste and garnetted stock).",16643501
202311,5004,Silk yarn (other than yarn spun from silk waste) not put up for retail sale.,47586987
202311,5005,"Yarn spun from silk waste, not put up for retail sale.",34902040
202311,5006,"Silk yarn and yarn spun from silk waste, put up for retail sale;silkworm gut.",366085
202311,5007,Woven fabrics of silk or of silk waste.,265241060
202311,5101,"Wool, not carded or combed.",14605073
202311,5102,"Fine or coarse animal hair, not carded or combed.",28141841
202311,5103,"Waste of wool or of fine or coarse animal hair, including yarn waste but excluding garnetted stock.",3517520
202311,5105,"Wool and fine or coarse animal hair, carded or combed (including combed wool in fragments).",446859115
202311,5106,"Yarn of carded wool, not put up for retail sale.",29786935
202311,5107,"Yarn of combed wool, not put up for retail sale.",63657035
202311,5108,"yarn of fine animal hair (carded or combed), not put up for retail sale.",173911962
202311,5109,"Yarn of wool or of fine animal hair, put up for retail sale.",12035781
202311,5110,"Yarn of coarse animal hair or of horsehair (including gimped horsehair yarn), whether or not put up for retail sale.",13682
202311,5111,Woven fabrics of carded wool or of carded fine animal hair.,26261337
202311,5112,Woven fabrics of combed wool or of combed fine animal hair.,87471890
202311,5113,Woven fabrics of coarse animal hair or of horsehair.,464065
202311,5201,"Cotton, not carded or combed.",13999390
202311,5202,Cotton waste (including yarn waste and garnetted stock).,36543
202311,5204,"Cotton sewing thread, whether or not put up for retail sale.",24099902
202311,5205,"Cotton yarn (other than sewing thread), containing 85% or more by weight of cotton, not put up for retail sale.",338751537
202311,5206,"otton yarn (other than sewing thread), containing less than 85% by weight of cotton, not put up for retail sale.",139971754
202311,5207,otton yarn (other than sewing thread) put up for retail sale.,31410102
202311,5208,"Woven fabrics of cotton, containing 85% or more by weight of cotton, weighing not more than 200 g/m2",2492373413
202311,5209,"Woven fabrics of cotton, containing 85% or more by weight of cotton, weighing more than 200 g/m2",1098694118
202311,5210,"Woven fabrics of cotton, containing less than 85% by weight of cotton, mixed mainly or solely with manmade fibres, weighing not more than 200 g/m2.",497513546
202311,5211,"Woven fabrics of cotton, containing less than 85% by weight of cotton, mixed mainly or solely with manmade fibres, weighing more than 200 g/m2.",989720283
202311,5212,Other woven fabrics of cotton.,123092365
202311,5301,"Flax, raw or processed but not spun; flax tow and waste (including yarn waste and garnetted stock).",347905
202311,5302,"True hemp (Cannabis sativa L.), raw or processed but not spun; tow and waste of true hemp (including yarn waste and garnetted stock).",151743
202311,5303,"Jute and other textile bast fibres (excluding flax, true hemp and ramie), raw or processed but not spun; tow and waste of these fibres (including yarn waste and garnetted stock).",34935
202311,5305,"Coconut, abaca ""Manila hemp or Musa textilis Nee"", ramie, agave and other vegetable textile fibres, n.e.s., raw or processed, but not spun; tow, noils and waste of such fibres, incl. yarn waste and garnetted stock",888034
202311,5306,lax yarn.,163851682
202311,5307,Yarn of jute or of other textile bast fibres of heading 53.03.,4769570
202311,5308,Yarn of other vegetable textile fibres; paper yarn.,22905467
202311,5309,Woven fabrics of flax.,1477444819
202311,5310,Woven fabrics of jute or of other textile bast fibres of heading 5303,3691346
202311,5311,Woven fabrics of other vegetable textile fibres; woven fabrics of paper yarn.,52394183
202311,5401,"Sewing thread of manmade filaments, whether or not put up for retail sale.",257267821
202311,5402,"Synthetic filament yarn (other than sewing thread), not put up for retail sale, including synthetic monofilament of less than 67 decitex.",4377122726
202311,5403,"Artificial filament yarn (other than sewing thread), not put up for retail sale, including artificial monofilament of less than 67 decitex.",331966834
202311,5404,"Synthetic monofilament of 67 decitex or more and of which no crosssectional dimension exceeds 1 mm; strip and the like (for example, artificial straw) of synthetic textile materials of an apparent width not exceeding 5 mm.",141316069
202311,5405,"Artificial monofilament of 67 decitex or more and of which no crosssectional dimension exceeds 1 mm; strip and the like (for example, artificial straw) of artificial textile materials of an apparent width not exceeding 5 mm.",1726271
202311,5406,"Manmade filament yarn (other than sewing thread), put up for retail sale.",49432046
202311,5407,"Woven fabrics of synthetic filament yarn, including woven fabrics obtained from materials of heading 54.04.",11632738419
202311,5408,"Woven fabrics of artificial filament yarn, including woven fabrics obtained from materials of heading 54.05.",195881311
202311,5501,Synthetic filament tow.,90684667
202311,5502,Artificial filament tow.,271791352
202311,5503,"Synthetic staple fibres, not carded, combed or otherwise processed for spinning.",923015951
202311,5504,"Artificial staple fibres, not carded, combed or otherwise processed for spinning.",285031397
202311,5505,"Waste (including noils, yarn waste and garnetted stock) of manmade fibres.",760994
202311,5506,"Synthetic staple fibres, carded, combed or otherwise processed for spinning.",17105031
202311,5507,"Artificial staple fibres, carded, combed or otherwise processed for spinning.",2790074
202311,5508,"Sewing thread of manmade staple fibres, whether or not put up for retail sale.",244969679
202311,5509,"Yarn (other than sewing thread) of synthetic staple fibres, not put up for retail sale.",825494622
202311,5510,"Yarn (other than sewing thread) of artificial staple fibres, not put up for retail sale.",252505094
202311,5511,"Yarn (other than sewing thread) of manmade staple fibres, put up for retail sale.",40145425
202311,5512,"Woven fabrics of synthetic staple fibres, containing 85% or more by weight of synthetic staple fibres.",853044704
202311,5513,"Woven fabrics of synthetic staple fibres, containing less than 85% by weight of such fibres, mixed mainly or solely with cotton, of a weight not exceeding 170 g/m2.",641447341
202311,5514,"Woven fabrics of synthetic staple fibres, containing less than 85% by weight of such fibres, mixed mainly or solely with cotton, of a weight exceeding 170g/m2.",329609819
202311,5515,Other woven fabrics of synthetic staple fibres.,918507919
202311,5516,Woven fabrics of artificial staple fibres.,2186349132
202311,5601,"Wadding of textile materials and articles thereof; textile fibres, not exceeding 5 mm in length (flock),textile dust and mill neps.",278038633
202311,5602,"Felt, whether or not impregnated, coated, covered or laminated.",164308945
202311,5603,"Nonwovens, whether or not impregnated, coated, covered or laminated.",2292649303
202311,5604,"Textile-covered rubber thread and cord; textile yarn, strip and the like of heading 5404 and 5405, impregnated, coated, covered or sheathed with rubber or plastics",228335926
202311,5605,"Metallised yarn, whether or not gimped, being textile yarn, or strip or the like of heading 5404 or 5405, of textile fibres, combined with metal in the form of thread, strip or powder or covered with metal",47917654
202311,5606,"Gimped yarn, gimped strip and the like of heading 5404 or 5405; chenille yarn, incl. flock chenille yarn, and loop wale-yarn",80624693
202311,5607,"Twine, cordage, ropes and cables, whether or not plaited or braided and whether or not impregnated, coated, covered or sheathed with rubber or plastics",597626789
202311,5608,"Knotted netting of twine, cordage or rope; made up fishing nets and other made up nets, of textile materials.",488678866
202311,5609,"Articles of yarn, strip or the like of heading 54.04 or 54.05, twine, cordage, rope or cables, not elsewhere specified or included.",265572477
202311,5701,"Carpets and other textile floor coverings, knotted, whether or not made up.",46146870
202311,5702,"Carpets and other textile floor coverings, woven, not tufted or flocked, whether or not made up, incl. Kelem, Schumacks, Karamanie and similar hand-woven rugs",440314386
202311,5703,"Carpets and other textile floor coverings, tufted, whether or not made up.",863328025
202311,5704,"Carpets and other floor coverings, of felt, not tufted or flocked, whether or not made up",13043936
202311,5705,"Other carpets and other textile floor coverings, whether or not made up.",1067574485
202311,5801,"Woven pile fabrics and chenille fabrics (excluding terry towelling and similar woven terry fabrics, tufted textile fabrics and narrow woven fabrics of heading 5806)",561007199
202311,5802,"Terry towelling and similar woven terry fabrics, tufted textile fabrics (excluding narrow woven fabrics of heading 5806, carpets and other floor coverings)",26057579
202311,5803,"Gauze, other than narrow fabrics of heading 58.06",7639402
202311,5804,"Tulles and other net fabrics, not including woven, knitted or crocheted fabrics; lace in the piece, in strips or in motifs, other than fabrics of headings 60.02 to 60.06.",524792815
202311,5805,"Hand-woven tapestries of the type Gobelin, Flanders, Aubusson, Beauvais and the like, and needle-worked tapestries, e.g. petit point, cross-stitch, whether or not made up (excluding Kelem, Schumacks, Karamanie and the like, and tapestries ＞ 100 years old)",1293072
202311,5806,"Narrow woven fabrics of textile materials, with a width of ≤ 30 cm (excluding labels, badges and similar articles); narrow fabrics consisting of warp without weft assembled by means of an adhesive ""bolducs""",1082974093
202311,5807,"Cabels, badges and similar articles of textile materials, in the piece, in strips or cut to shape or size, not embroidered.",249668313
202311,5808,"Braids of textile materials, in the piece; ornamental trimmings of textile materials, in the piece, not embroidered, other than knitted or crocheted; tassels, pompons and similar articles of textile materials",103558219
202311,5809,"Woven fabrics of metal thread and woven fabrics of metallised yarn of heading 5605, of a kind used in apparel, as furnishing fabrics or for similar purposes, n.e.s.",2151868
202311,5810,"Embroidery on a textile fabric ground, in the piece, in strips or in motifs",748505148
202311,5811,"Quilted textile products in the piece, composed of one or more layers of textile materials assembled with padding by stitching or otherwise (excluding embroidery of heading 5810 and quilted fabrics for bedding and furnishings)",76272366
202311,5901,"Quilted textile products in the piece, composed of one or more layers of textile materials assembled with padding by stitching or otherwise (excluding embroidery of heading 5810 and quilted fabrics for bedding and furnishings)",205614951
202311,5902,"Tyre cord fabric of high-tenacity yarn of nylon or other polyamides, polyesters or viscose rayon, whether or not dipped or impregnated with rubber or plastic",468730551
202311,5903,"Textile fabrics impregnated, coated, covered or laminated with plastics, other than those of heading 59.02.",3723989404
202311,5904,"Linoleum, whether or not cut to shape; floor coverings consisting of a coating or covering applied on a textile backing, whether or not cut to shape.",11065639
202311,5905,Textile wall coverings.,21434594
202311,5906,"Rubberised textile fabrics, other than those of heading 59.02.",181296630
202311,5907,"Impregnated, coated or covered textile fabrics; painted canvas being theatrical scenery, studio backcloths or the like, n.e.s.",203622373
202311,5908,"Textile wicks, woven, plaited or knitted, for lamps, stoves, lighters, candles or the like; incandescent gas mantles and tubular knitted gas-mantle fabric for incandescent gas mantles, whether or not impregnated",4668322
202311,5909,"Textile hosepiping and similar textile tubing, whether or not impregnated or coated, with or without lining, armour or accessories of other materials",83503739
202311,5910,"Transmission or conveyor belts or belting, of textile material, whether or not impregnated, coated, covered or laminated with plastics, or reinforced with metal or other material.",69091521
202311,5911,"Textile products and articles, for technical use, specified in Note 7 to chapter 59",504686777
202311,6001,"Pile fabrics, incl. ""long pile"" fabrics and terry fabrics, knitted or crocheted",2621046195
202311,6002,"Knitted or crocheted fabrics of a width not exceeding 30cm, containing by weight 5% or more of elastomeric yarn or rubber thread, other than those of heading 60.01.",90181036
202311,6003,"Knitted or crocheted fabrics of a width not exceeding 30cm, other than those of heading 60.01 or 60.02.",32722326
202311,6004,"Knitted or crocheted fabrics of a width exceeding 30 cm, containing by weight 5% or more of elastomeric yarn or rubber thread, other than those of heading 60.01",3161307895
202311,6005,"Warp knit fabrics (including those made on galloon knitting machines), other than those of headings 60.01 to 60.04.",729365625
202311,6006,Other knitted or crocheted fabrics.,6156980058
202311,6101,"Men's or boys' overcoats, car coats, capes, cloaks, anoraks, incl. ski jackets, windcheaters, wind-jackets and similar articles, knitted or crocheted (excluding suits, ensembles, jackets, blazers, bib and brace overalls and trousers)",161665586
202311,6102,"Women's or girls' overcoats, carcoats, capes, cloaks, anoraks (including skijackets), windcheaters, windjackets and similar articles, knitted or crocheted, other than those of heading 61.04.",340417639
202311,6103,"Men's or boys' suits, ensembles, jackets, blazers, trousers, bib and brace overalls, breeches and shorts",2890918582
202311,6104,"Women's or girls' suits, ensembles, jackets, blazers, dresses, skirts, divided skirts, trousers, bib and brace overalls, breeches and shorts, knitted or crocheted",8949092871
202311,6105,"en's or boys' shirts, knitted or crocheted.",690599006
202311,6106,"Women's or girls' blouses, shirts and shirt-blouses, knitted or crocheted (excluding T-shirts and vests)",226692465
202311,6107,"Men's or boys' underpants, briefs, nightshirts, pyjamas, bathrobes, dressing gowns and similar articles, knitted or crocheted (excluding vests and singlets)",1687686762
202311,6108,"Women's or girls' slips, petticoats, briefs, panties, nightdresses, pyjamas, négligés, bathrobes, dressing gowns, housecoats and similar articles, knitted or crocheted (excluding T-shirts, vests, brassieres, girdles, corsets and similar articles)",3913351058
202311,6109,"T-shirts, singlets and other vests, knitted or crocheted",4763064221
202311,6110,"Jerseys, pullovers, cardigans, waistcoats and similar articles, of wool, knitted or crocheted (excluding wadded waistcoats)",12230188753
202311,6111,"Babies' garments and clothing accessories of wool or fine animal hair, knitted or crocheted (excluding hats)",976968198
202311,6112,"Track-suits, ski-suits and swimwear, knitted or crocheted",1129385630
202311,6113,"Garments, knitted or crocheted, rubberised or impregnated, coated or covered with plastics or other materials (excluding babies' garments and clothing accessories)",134656489
202311,6114,"Special garments for professional, sporting or other purposes, n.e.s., knitted or crocheted",2047791554
202311,6115,"Pantyhose, tights, stockings, socks and other hosiery, incl. graduated compression hosiery [e.g., stockings for varicose veins] and footwear without applied soles, knitted or crocheted (excluding for babies)",3810091556
202311,6116,"Gloves, mittens and mitts, knitted or crocheted (excluding for babies)",1733027469
202311,6117,"Other made up clothing accessories, knitted or crocheted; knitted or crocheted parts of garments or of clothing accessories.",1081454712
202311,6201,"Men’s or boys’ overcoats, car-coats, capes, cloaks, anoraks (including ski-jackets), wind-cheaters, windjackets and similar articles, other than those of heading 62.03.",2465202083
202311,6202,"Women’s or girls’ overcoats, car-coats, capes, cloaks, anoraks (including ski-jackets), wind-cheaters, wind-jackets and similar articles, other than those of heading 62.04.",3655992543
202311,6203,"Men's or boys' suits, ensembles, jackets, blazers, trousers, bib and brace overalls, breeches and shorts (excluding knitted or crocheted, wind-jackets and similar articles, separate waistcoats, tracksuits, ski suits and swimwear)",6111187597
202311,6204,"Women's or girls' suits, ensembles, jackets, blazers, dresses, skirts, divided skirts, trousers, bib and brace overalls, breeches and shorts (excluding knitted or crocheted, wind-jackets and similar articles, slips, petticoats and panties, tracksuits, ski suits and swimwear)",14535759276
202311,6205,Men's or boys' shirts.,1154507837
202311,6206,"Women's or girls' blouses, shirts and shirtblouses.",957010471
202311,6207,"Men's or boys' singlets and other vests, underpants, briefs, nightshirts, pyjamas, bathrobes, dressing gowns and similar articles",180842547
202311,6208,"Women's or girls' singlets and other vests, slips, petticoats, briefs, panties, nightdresses, pyjamas, négligés, bathrobes, dressing gowns, housecoats and similar articles (excluding knitted or crocheted, brassières, girdles, corsets and similar articles)",656980538
202311,6209,Babies garments and clothing accessories of textile materials (excluding knitted or crocheted and hats),186970187
202311,6210,"Garments made up of felt or nonwovens, whether or not impregnated, coated, covered or laminated; garments of textile fabrics, rubberised or impregnated, coated, covered or laminated with plastics or other substances (excluding knitted or crocheted, and babies' garments and clothing accessories)",1834571136
202311,6211,"Tracksuits, ski suits, swimwear and other garments, n.e.s.",2643015877
202311,6212,"Brassieres, girdles, corsets, braces, suspenders, garters and similar articles and parts thereof, of all types of textile materials, whether or not elasticated, incl. knitted or crocheted (excluding belts and corselets made entirely of rubber)",2788752031
202311,6213,Handkerchiefs,60203940
202311,6214,"Shawls, scarves, mufflers, mantillas, veils and similar articles",1040951110
202311,6215,"Ties, bow ties and cravats of textile materials",107613292
202311,6216,"Gloves, mittens and mitts, of all types of textile materials (excluding knitted or crocheted and for babies)",203845414
202311,6217,"Made-up clothing accessories and parts of garments or clothing accessories, of all types of textile materials, n.e.s.",290786906
202311,6301,Blankets and travelling rugs,2937307173
202311,6302,"Bed linen, table linen, toilet linen and kitchen linen.",5443808804
202311,6303,Curtains (including drapes) and interior blinds; curtain or bed valances.,1665865127
202311,6304,"Other furnishing articles, excluding those of heading 94.04.",1371997931
202311,6305,"Packs and bags, of a kind used for the packing of goods.",1052633853
202311,6306,"Tarpaulins, awnings and sunblinds; tents (including temporary canopies and similar articles); sails for boats, sailboards or landcraft; camping goods.”",1888011623
202311,6307,"other made up articles, including dress patterns.",4737878352
202311,6308,"Sets consisting of woven fabric and yarn, whether or not with accessories, for making up into rugs, tapestries, embroidered table cloths or serviettes, or similar textile articles, put up in packings for retail sale.",7951915
202311,6309,Worn clothing and other worn articles.,498884878
202311,6310,"Used or new rags, scrap twine, cordage, rope and cables and worn-out articles thereof, of textile materials",23422025
202311,6401,"Waterproof footwear with outer soles and uppers of rubber or of plastics, the uppers of which are neither fixed to the sole nor assembled by stitching, riveting, nailing, screwing, plugging or similar processes.",313466616
202311,6402,Other footwear with outer soles and uppers of rubber or plastics.,14920357920
202311,6403,"ootwear with outer soles of rubber, plastics, leather or composition leather and uppers of leather.",4615678961
202311,6404,"Footwear with outer soles of rubber, plastics, leather or composition leather and uppers of textile materials.",7003100126
202311,6405,Other footwear.,817407310
202311,6406,"Parts of footwear, incl. uppers whether or not attached to soles other than outer soles; removable in-soles, heel cushions and similar articles; gaiters, leggings and similar articles, and parts thereof (excluding articles of asbestos)",2442113506
202311,6501,"Hatforms, hat bodies and hoods of felt, neither blocked to shape nor with made brims; plateaux and manchons (including slit manchons), of felt.",7314244
202311,6502,"Hatshapes, plaited or made by assembling strips of any material, neither blocked to shape, nor with made brims, nor lined, nor trimmed",12751590
202311,6504,"Hats and other headgear, plaited or made by assembling strips of any material, whether or not lined or trimmed",131149211
202311,6505,"Hats and other headgear, knitted or crocheted, or made up from lace, felt or other textile fabric, in the piece (but not in strips), whether or not lined or trimmed; hairnets of any material, whether or not lined or trimmed",1929078726
202311,6506,"Other headgear, whether or not lined or trimmed.",1004186875
202311,6507,"Headbands, linings, covers, hat foundations, hat frames, peaks and chinstraps, for headgear",85986661
202311,6601,"Umbrellas and sun umbrellas (including walkingstick umbrellas, garden umbrellas and similar umbrellas).",1627856586
202311,6602,"Walkingsticks, seatsticks, whips, ridingcrops and the like",115233176
202311,6603,"Parts, trimmings and accessories of articles of heading 66.01 or 66.02.",174862853
202311,6701,"Skins and other parts of birds with their feathers or down, feathers, parts of feathers, down and articles thereof (other than goods of heading 05.05 and worked quills and scapes)",32674069
202311,6702,"Artificial flowers, foliage and fruit and parts thereof; articles made of artificial flowers, foliage or fruit.",3244112062
202311,6703,"Human hair, dressed, thinned, bleached or otherwise worked; wool or other animal hair or other textile materials, prepared for use in making wigs or the like.",189268577
202311,6704,"igs, false beards, eyebrows and eyelashes, switches and the like, of human or animal hair or of textile materials; articles of human hair not elsewhere specified or included.",3281053002
202311,6801,"Setts, curbstones and flagstones, of natural stone (except slate).",49221766
202311,6802,"Worked monumental or building stone (except slate) and articles thereof, other than goods of heading 68.01; mosaic cubes and the like, of natural stone (including slate), whether or not on a backing; artificially coloured granules, chippings and powder, of natural stone (including slate).",2755218319
202311,6803,Worked slate and articles of slate or of agglomerated slate.,125336689
202311,6804,"Millstones, grindstones, grinding wheels and the like, without frameworks, for milling, grinding, pulping, sharpening, polishing, trueing or cutting, hand sharpening or polishing stones, and parts thereof, of natural stone, of agglomerated natural or artificial abrasives, or of ceramics, with or without parts of other materials",850894419
202311,6805,"Natural or artificial abrasive powder or grain, on a base of textile material, of paper, of paperboard or of other materials, whether or not cut to shape or sewn or otherwise made up.",381870398
202311,6806,"Slag-wool, rock-wool and similar mineral wools; exfoliated vermiculite, expanded clays, foamed slag and similar expanded mineral materials; mixtures and articles of heat-insulating, sound-insulating or sound absorbing mineral materials",336937002
202311,6807,"Articles of asphalt or of similar material (for example, petroleum bitumen or coal tar pitch).",37286639
202311,6808,"Panels, boards, tiles, blocks and similar articles of vegetable fibre, of straw or of shavings, chips, particles, sawdust or other waste, of wood, agglomerated with cement, plaster or other mineral binders",153703507
202311,6809,Articles of plaster or of compositions based on plaster.,188940450
202311,6810,"Articles of cement, of concrete or of artificial stone, whether or not reinforced.",2191472557
202311,6811,"Articles of asbestos-cement, of cellulose fibre-cement or the like.",134281896
202311,6812,"Fabricated asbestos fibres; mixtures with a basis of asbestos or with a basis of asbestos and magnesium carbonate; articles of such mixtures or of asbestos (for example, thread, woven fabric, clothing, headgear, footwear, gaskets), whether or not reinforced, other than goods of heading 68.11 or 68.13.",17558705
202311,6813,"Friction material and articles thereof, e.g., sheets, rolls, strips, segments, discs, washers, pads, not mounted, for brakes, clutches or the like, with a basis of asbestos, other mineral substances or cellulose, whether or not combined with textile or other materials",59202562
202311,6814,"Worked mica and articles of mica, including agglomerated or reconstituted mica, whether or not on a support of paper, paperboard or other materials.",92871160
202311,6815,"Articles of stone or of other mineral substances (including carbon fibres, articles of carbon fibres and articles of peat), not elsewhere specified or included.",583912116
