Date of data,Commodity code,Commodity,Renminbi Yuan
202311,3602,"Prepared explosives, other than propellent powders",5904880
202311,3603,Safety fuses; detonating fuses; percussion or detonating caps; igniters; electric detonators.,9606740
202311,3604,"Fireworks, signalling flares, rain rockets, fog signals and other pyrotechnic articles.",669735312
202311,3605,"Matches, other than pyrotechnic articles of heading 36.04.",3590183
202311,3606,Ferrocerium and other pyrophoric alloys in all forms; articles of combustible materials as specified in Note 2 to this Chapter.,16288572
202311,3701,"Photographic plates and film in the flat, sensitised, unexposed, of any material other than paper, paperboard or textiles; instant print film in the flat, sensitised, unexposed, whether or not in packs.",463172768
202311,3702,"Photographic film in rolls, sensitised, unexposed, of any material other than paper, paperboard or textiles; instant print film in rolls, sensitised, unexposed.",84403403
202311,3703,"photographic paper, paperboard and textiles, sensitised,unexposed.",43369043
202311,3704,"Photographic plates, film, paper, paperboard and textiles, exposed but not developed",155622
202311,3705,"Photographic plates and film, exposed and developed, other than cinematographic film",735070
202311,3707,"Chemical preparations for photographic uses (other than varnishes, glues, adhesives and similar preparations); unmixed products for photographic uses, put up in measured portions or put up for retail sale in a form ready for use.",141437303
202311,3801,"Artificial graphite; colloidal or semicolloidal graphite; preparations based on graphite or other carbon in the form of pastes, blocks, plates or other semimanufactures.",1543030045
202311,3802,"ctivated carbon; activated natural mineral products; animal black, including spent animal black.",343117850
202311,3803,"Tall oil, whether or not refined.",277202
202311,3804,"Residual lyes from the manufacture of wood pulp, whether or not concentrated, desugared or chemically treated, including lignin sulphonates, but excluding tall oil of heading 38.03.",6538555
202311,3805,"Gum, wood or sulphate turpentine and other terpenic oils produced by the distillation or other treatment of coniferous woods; crude dipentene; sulphite turpentine and other crude para-cymene; pine oil containing alpha-terpineol as the main constituent",7646604
202311,3806,"Rosin and resin acids, and derivatives thereof; rosin spirit and rosin oils; run gums.",116748322
202311,3807,"Wood tar; wood tar oils; wood creosote; wood naphtha; vegetable pitch; brewers' pitch and similar preparations based on rosin, resin acids or on vegetable pitch.",2658343
202311,3808,"Insecticides, rodenticides, fungicides, herbicides, antisprouting products and plantgrowth regulators, disinfectants and similar products, put up in forms or packings for retail sale or as preparations or articles (for example, sulphurtreated bands, wicks and candles, and flypapers).",4611212885
202311,3809,"Finishing agents, dye carriers to accelerate the dyeing or fixing of dyestuffs and other products and preparations (for example, dressings and mordants), of a kind used in the textile, paper, leather or like industries, not elsewhere specified or included.",124060101
202311,3810,"Pickling preparations for metal surfaces; fluxes and other auxiliary preparations for soldering, brazing or welding; soldering, brazing or welding powders and pastes consisting of metal and other materials; preparations of a kind used as cores or coatings for welding electrodes or rods.",113551921
202311,3811,"ntiknock preparations, oxidation inhibitors, gum inhibitors, viscosity improvers, anticorrosive preparations and other prepared additives, for mineral oils (including gasoline) or for other liquids used for the same purposes as mineral oils.",377946815
202311,3812,"Prepared rubber accelerators; compound plasticisers for rubber or plastics, not elsewhere specified or included; antioxidising preparations and other compound stabilisers for rubber or plastics.",717104381
202311,3813,Preparations and charges for fireextinguishers; charged fireextinguishing grenades,20525282
202311,3814,"Organic composite solvents and thinners, not elsewhere specified or included; prepared paint or varnish removers",28438680
202311,3815,"Reaction initiators, reaction accelerators and catalytic preparations, not elsewhere specified or included.",639728372
202311,3816,"Refractory cements, mortars, concretes and similar compositions, including dolomite ramming mix, other than products of heading 38.01",313255440
202311,3817,"Mixed alkylbenzenes and mixed alkylnaphthalenes, other than those of heading 27.07 or 29.02.",151294930
202311,3818,"Chemical elements doped for use in electronics, in the form of discs, wafers or similar forms; chemical compounds doped for use in electronics. form of",3180760958
202311,3819,"Hydraulic brake fluids and other prepared liquids for hydraulic transmission, not containing or containing less than 70% by weight of petroleum oils or oils obtained from bituminous minerals.",18871936
202311,3820,Antifreezing preparations and prepared deicing fluids.,25010933
202311,3821,"Prepared culture media for the development or maintenance of microorganisms (including viruses and the like) or of plant, human or animal cells.",30596253
202311,3822,"Diagnostic or laboratory reagents on a backing, prepared diagnostic or laboratory reagents whether or not on a backing, whether or not put up in the form of kits, other than those of heading 30.06; certified reference materials",1163459577
202311,3823,Industrial monocarboxylic fatty acids; acid oils from refining;industrial fatty alcohols.,43456159
202311,3824,"Prepared binders for foundry moulds or cores; chemical products and preparations for the chemical or allied industries, incl. mixtures of natural products, n.e.s.",3600748772
202311,3825,"Residual products of the chemical or allied industries, not elsewhere specified or included; municipal waste; sewage sludge; other wastes specified in Note 6 to this Chapter.",11169226
202311,3826,"Biodiesel and mixtures thereof, not containing or containing less than 70% by weight of petroleum oils or oils obtained from bituminous minerals.",636440186
202311,3827,"Mixtures containing halogenated derivatives of methane, ethane or propane, not elsewhere specified or included",449845749
202311,3901,"Polymers of ethylene, in primary forms.",1463312844
202311,3902,"Polymers of propylene or of other olefins, in primary forms.",1119559236
202311,3903,"Polymers of styrene, in primary forms.",759638629
202311,3904,"Polymers of vinyl chloride or of other halogenated olefins, in primary forms.",1866645574
202311,3905,"Polymers of vinyl acetate or of other vinyl esters, in primary forms; other vinyl polymers in primary forms.",439616674
202311,3906,crylic polymers in primary forms.,1179623560
202311,3907,"Polyacetals, other polyethers and epoxide resins, in primary forms; polycarbonates, alkyd resins, polyallyl esters and other polyesters, in primary forms.",7179528072
202311,3908,Polyamides in primary forms.,1053097724
202311,3909,"minoresins, phenolic resins and polyurethanes, in primary forms.",1497809171
202311,3910,Silicones in primary forms,700580056
202311,3911,"etroleum resins, coumaroneindene resins, polyterpenes, polysulphides, polysulphones and other products specified in Note 3 to this Chapter, not elsewhere specified or included, in primary forms.",599556337
202311,3912,"Cellulose and its chemical derivatives, not elsewhere specified or included, in primary forms.",620702347
202311,3913,"Natural polymers (for example, alginic acid) and modified natural polymers (for example, hardened proteins, chemical derivatives of natural rubber), not elsewhere specified or included, in primary forms.",581722820
202311,3914,"Ionexchangers based on polymers of headings 39.01 to 39.13, in primary forms",174000809
202311,3915,"Waste, parings and scrap, of plastics.",16833629
202311,3916,"Monofilament of which any crosssectional dimension exceeds 1 mm, rods, sticks and profile shapes, whether or not surfac worked but not otherwise worked, of plastics.",599976501
202311,3917,"Tubes, pipes and hoses, and fittings therefor (for example, joints,elbows, flanges), of plastics.",2687755894
202311,3918,"Floor coverings of plastics, whether or not selfadhesive, in rolls or in the form of tiles; wall or ceiling coverings of plastics, as defined in Note 9 to this Chapter.",4428864781
202311,3919,"Selfadhesive plates, sheets, film, foil, tape, strip and other flat shapes, of plastics, whether or not in rolls.",3786986225
202311,3920,"Other plates, sheets, film, foil and strip, of plastics, noncellular and not reinforced, laminated, supported or similarly combined with other materials.",7041743041
202311,3921,"Other plates, sheets, film, foil and strip, of plastics.",2438489013
202311,3922,"Baths, showerbaths, sinks, washbasins, bidets, lavatory pans, seats and covers, flushing cisterns and similar sanitary ware, of plastics.",1040179843
202311,3923,"Articles for the conveyance or packing of goods, of plastics; stoppers, lids, caps and other closures, of plastics.",9195102653
202311,3924,"Tableware, kitchenware, other household articles and hygienic or toilet articles, of plastics.",9832108319
202311,3925,"Builders' ware of plastics, not elsewhere specified or included.",1975247852
202311,3926,Other articles of plastics and articles of other materials of headings 39.01 to 39.14.,20057533132
202311,4001,"Natural rubber, balata, guttapercha, guayule, chicle and similar natural gums, in primary forms or in plates, sheets or strip.",16833944
202311,4002,"Synthetic rubber and factice derived from oils, in primary forms or in plates, sheets or strip; mixtures of any product of heading 40.01 with any product of this heading, in primary forms or in plates, sheets or strip.",1179687917
202311,4003,"Reclaimed rubber in primary forms or in plates, sheets or strip.",40670700
202311,4004,"Waste, parings and scrap of rubber (other than hard rubber)and powders and granules obtained therefrom",1205158
202311,4005,"ompounded rubber, unvulcanised, in primary forms or in plates, sheets or strip.",101698997
202311,4006,"Other forms (for example, rods, tubes and profile shapes) and articles (for example, discs and rings), of unvulcanised rubber.",10738888
202311,4007,Vulcanised rubber thread and cord.,89132802
202311,4008,"lates, sheets, strip, rods and profile shapes, of vulcanised rubber other than hard rubber.",326789771
202311,4009,"Tubes, pipes and hoses, of vulcanised rubber other than hard rubber, with or without their fittings (for example, joints, elbows, flanges).",918949988
202311,4010,"Conveyor or transmission belts or belting, of vulcanised rubber.",900314901
202311,4011,"New pneumatic tyres, of rubber.",12894959837
202311,4012,"Retreaded or used pneumatic tyres of rubber; solid or cushion tyres, tyre treads and tyre flaps, of rubber.",146665801
202311,4013,"Inner tubes, of rubber.",374168038
202311,4014,"Hygienic or pharmaceutical articles (including teats), of vulcanised rubber other than hard rubber, with or without fittings of hard rubber.",92491867
202311,4015,"Articles of apparel and clothing accessories (including gloves, mittens and mitts), for all purposes, of vulcanised rubber other than hard rubber.",1021656279
202311,4016,Other articles of vulcanised rubber other than hard rubber.,2408331799
202311,4017,"Hard rubber (for example, ebonite) in all forms, including waste and scrap; articles of hard rubber",38289126
202311,4101,"Raw hides and skins of bovine (including buffalo) or equine animals (fresh, or salted, dried, limed, pickled or otherwise preserved, but not tanned, parchmentdressed or further prepared), whether or not dehaired or split.",7653949
202311,4102,"Raw skins of sheep or lambs (fresh, or salted, dried, limed, pickled or otherwise preserved, but not tanned, parchment dressed or further prepared), whether or not with wool on or split, other than those excluded by Note 1 (c) to this Chapter.",295077
202311,4104,"Tanned or crust hides and skins of bovine (including buffalo) or equine animals, without hair on, whether or not split, but not further prepared.",63729795
202311,4105,"Tanned or crust skins of sheep or lambs, without wool on, whether or not split, but not further prepared.",35241286
202311,4106,"Tanned or crust hides and skins of other animals, without wool whether or not split, but not further prepared.",3914819
202311,4107,"Leather further prepared after tanning or crusting, including parchmentdressed leather, of bovine (including buffalo) or equine animals, without hair on, whether or not split, other than leather of heading 41.14.",353440900
202311,4112,"Leather further prepared after tanning or crusting, including parchmentdressed leather, of sheep or lamb, without wool on, whether or not split, other than leather of heading 41.14",17769289
202311,4113,"Leather further prepared after tanning or crusting, including parchmentdressed leather, of other animals, without wool or hair on, whether or not split, other than leather of heading 41.14.",31196565
202311,4114,Chamois (including combination chamois) leather; patentleather and patent laminated leather; metallised leather.,4340126
202311,4115,"Composition leather with a basis of leather or leather fibre, in slabs, sheets or strip, whether or not in rolls; parings and other waste of leather or of composition leather, not suitable for the manufacture of leather articles; leather dust, powder and flour.",6196809
202311,4201,"Saddlery and harness for any animal, incl. traces, leads, knee pads, muzzles, saddle cloths, saddlebags, dog coats and the like, of any material",648270315
202311,4202,"Trunks, suitcases, vanitycases, executivecases, briefcases, school satchels, spectacle cases, binocular cases, camera cases, musical instrument cases, gun cases, holsters and similar containers; travellingbags, insulated food or beverages bags, toilet bags, rucksacks, handbags, shoppingbags, wallets, purses, mapcases, cigarettecases, tobaccopouches, tool bags, sports bags, bottlecases, jewellery boxes, powderboxes, cutlery cases and similar containers, of leather or of composition leather, of sheeting of plastics, of textile materials, of vulcanised fibre or of paperboard, or wholly or mainly covered with such materials or with paper.",21019882357
202311,4203,"Articles of apparel and clothing accessories, of leather or of composition leather.",540625107
202311,4205,Other articles of leather or of composition leather,328716908
202311,4206,"Articles of gut (other than silkworm gut), of goldbeater's skin, of bladders or of tendons.",303705
202311,4301,"Raw furskins, incl. heads, tails, paws and other pieces or cuttings suitable for use in furriery (excluding raw hides and skins of heading 4101, 4102 or 4103)",242427
202311,4302,"Tanned or dressed furskins (including heads, tails, paws and other pieces or cuttings), unassembled, or assembled (without the addition of other materials) other than those of heading 43.03.",67527689
202311,4303,"rticles of apparel, clothing accessories and other articles of furskin.",1009236715
202311,4304,Artificial fur and articles thereof,92659592
202311,4401,"Fuel wood, in logs, billets, twigs, faggots or similar forms; wood in chips or particles; sawdust and wood waste and scrap, whether or not agglomerated in logs, briquettes, pellets or similar forms",9874124
202311,4402,"Wood charcoal (including shell or nut charcoal), whether or notagglomerated.",87956122
202311,4403,"Wood in the rough, whether or not stripped of bark or sapwood,or roughly squared.",1659211
202311,4404,"Hoopwood; split poles; piles, pickets and stakes of wood, pointed but not sawn lengthwise; wooden sticks, roughly trimmed but not turned, bent or otherwise worked, suitable for the manufacture of walkingsticks,umbrellas, tool handles or the like; chipwood and the like.",3716326
202311,4405,Wood wool; wood flour.,1289627
202311,4406,Railway or tramway sleepers (crossties) of wood.,1730
202311,4407,"Wood sawn or chipped lengthwise, sliced or peeled, whether or not planed, sanded or endjointed, of a thickness exceeding 6 mm.",85961018
202311,4408,"Sheets for veneering, incl. those obtained by slicing laminated wood, for plywood or for other similar laminated wood and other wood, sawn lengthwise, sliced or peeled, whether or not planed, sanded, spliced or end-jointed, of a thickness of ≤ 6 mm",438517781
202311,4409,"Wood, incl. strips and friezes for parquet flooring, not assembled, continuously shaped ""tongued, grooved, rebated, chamfered, V-jointed beaded, moulded, rounded or the like"" along any of its edges, ends or faces, whether or not planed, sanded or end-jointed",97501515
202311,4410,"Particle board, oriented strand board (OSB) and similar board (for example, waferboard) of wood or other ligneous materials, whether or not agglomerated with resins or other organic binding substances.",158494748
202311,4411,"Fibreboard of wood or other ligneous materials, whether or not bonded with resins or other organic substances.",788658974
202311,4412,"Plywood, veneered panels and similar laminated wood.",2781593595
202311,4413,"Densified wood, in blocks, plates, strips or profile shapes",8974903
202311,4414,"Wooden frames for paintings, photographs, mirrors or similar objects.",315805903
202311,4415,"Packing cases, boxes, crates, drums and similar packings, of wood; cabledrums of wood; pallets, box pallets and other load boards,of wood; pallet collars of wood.",70238994
202311,4416,"Wood casks, barrels, vats, tubs and other coopers' products and parts thereof, of wood, including stave",2439128
202311,4417,"Tools, tool bodies, tool handles, broom or brush bodies and handles, of wood; boot or shoe lasts and trees, of wood",58229214
202311,4418,"Builders' joinery and carpentry of wood, including cellular wood panels, assembled flooring panels, shingles and shakes.",892415785
202311,4419,"Tableware and kitchenware, of wood.",773194308
202311,4420,"Wood marquetry and inlaid wood; caskets and cases for jewellery or cutlery, and similar articles, of wood; statuettes and other ornaments, of wood; wooden articles of furniture (excluding furniture, lighting fixtures and parts thereof)",689804998
202311,4421,Other articles of wood.,2272420948
202311,4501,"Natural cork, raw or merely surface-worked or otherwise cleaned; cork waste; crushed, powdered or ground cork",6298093
202311,4503,Articles of natural cork.,706567
202311,4504,"Agglomerated cork, with or without a binding substance, and articles of agglomerated cork",29762790
202311,4601,"Plaits and similar products of plaiting materials, whether or not assembled into strips; plaiting materials, plaits and similar products of plaiting materials, bound together in parallel strands or woven, in sheet form, whether or not being finished articles (for example, mats, matting, screens).",155516301
202311,4602,"Basketwork, wickerwork and other articles, made directly to shape from plaiting materials or made up from goods of heading 46.01; articles of loofah.",704187344
202311,4701,Mechanical wood pulp,3125179
202311,4702,"Chemical wood pulp, dissolving grades",4255068
202311,4703,"Chemical wood pulp, soda or sulphate, other than dissolving grades.",84092004
202311,4704,"Chemical wood pulp, sulphite, other than dissolving grades.",22025
202311,4705,Wood pulp obtained by a combination of mechanical and chemical pulping processes.,3625514
202311,4706,"Pulps of fibres derived from recovered ""waste and scrap"" paper or paperboard or of other fibrous cellulosic material",99329959
202311,4801,"Newsprint, in rolls or sheets",8598735
202311,4802,"Uncoated paper and paperboard, of a kind used for writing, printing or other graphic purposes, and non perforated punchcards and punch tape paper, in rolls or rectangular (including square) sheets, of any size, other than paper of heading 48.01 or 48.03; handmade paper and paperboard.",886521543
202311,4803,"Toilet or facial tissue stock, towel or napkin stock and similar paper of a kind used for household or sanitary purposes, cellulose wadding and webs of cellulose fibres, whether or not creped, crinkled, embossed, perforated, surfacecoloured, surface decorated or printed, in rolls or sheets",257206487
202311,4804,"Uncoated kraft paper and paperboard, in rolls or sheets, other than that of heading 48.02 or 48.03.",74299615
202311,4805,"Other uncoated paper and paperboard, in rolls or sheets, not further worked or processed than as specified in Note 3 to this Chapter.",442377391
202311,4806,"vegetable parchment, greaseproof papers, tracing papers and glassine and other glazed transparent or translucent papers, in rolls or sheets.",145514667
202311,4807,"Composite paper and paperboard (made by sticking flat layers of paper or paperboard together with an adhesive), not surface coated or impregnated, whether or not internally reinforced, in rolls or sheets.",7607358
202311,4808,"Paper and paperboard, corrugated (with or without glued flat surface sheets), creped, crinkled, embossed or perforated, in rolls or sheets, other than paper of the kind described in heading 48.03.",47223214
202311,4809,"Carbon paper, selfcopy paper and other copying or transfer papers (including coated or impregnated paper for duplicator stencils or offset plates), whether or not printed, in rolls or sheets.",156265373
202311,4810,"Paper and paperboard, coated on one or both sides with kaolin (China clay) or other inorganic substances, with or without a binder, and with no other coating, whether or not surface coloured, surfacedecorated or printed, in rolls or rectangular (including square) sheets, of any size.",2226173049
202311,4811,"Paper, paperboard, cellulose wadding and webs of cellulose fibres,coated,impregnated,covered, surfacecoloured, surface decorated or printed, in rolls or rectangular (including square) sheets, of any size, other than goods of the kind described in heading 48.03, 48.09 or 48.10.",1809361432
202311,4812,"Filter blocks, slabs and plates, of paper pulp",1617129
202311,4813,"Cigarette paper, whether or not cut to size or in the form of booklets or tubes.",98878806
202311,4814,Wallpaper and similar wall coverings; window transparencies of paper.,314385590
202311,4816,"Carbon paper, self-copy paper and other copying or transfer papers, in rolls of a width of ≤ 36 cm or in rectangular or square sheets with no side measuring ＞ 36 cm in the unfolded state, or cut into shapes other than rectangles or squares, together with full duplicator stencils and offset plates of paper, whether or not in boxes",87375378
202311,4817,"Envelopes, letter cards, plain postcards and correspondence cards, of paper or paperboard; boxes, pouches, wallets and writing compendiums, of paper or paperboard, containing an assortment of paper stationery.",204889746
202311,4818,"Toilet paper and similar paper, cellulose wadding or webs of cellulose fibres, of a kind used for household or sanitary purposes, in rolls of a width ≤ 36 cm, or cut to size or shape; handkerchiefs, cleansing tissues, towels, tablecloths, serviettes, bedsheets and similar household, sanitary or hospital articles, articles of apparel and clothing accessories, of paper pulp, paper, cellulose wadding or webs of cellulose fibres",1649078033
202311,4819,"Cartons, boxes, cases, bags and other packing containers, of paper, paperboard, cellulose wadding or webs of cellulose fibres, n.e.s.; box files, letter trays, and similar articles, of paperboard of a kind used in offices, shops or the like",4210433779
202311,4820,"Registers, account books, note books, order books, receipt books, letter pads, memorandum pads,diaries and similar articles, exercise books, blottingpads, binders (looseleaf or other), folders, file covers, manifold business forms, interleaved carbon sets and other articles of stationery, of paper or paperboard; albums for samples or for collections and book covers, of paper or paperboard.",1314502641
202311,4821,"paper or paperboard labels of all kinds, whether or not printed.",783300917
202311,4822,"Bobbins, spools, cops and similar supports of paper pulp, paper or paperboard (whether or not perforated or hardened).",40273611
202311,4823,"Other paper, paperboard, cellulose wadding and webs of cellulose fibres, cut to size or shape; other articles of paper pulp, paper,paperboard, cellulose wadding or webs of cellulose fibres.",3074894613
202311,4901,"Printed books, brochures, leaflets and similar printed matter, whether or not in single sheets.",564076071
202311,4902,"Newspapers, journals and periodicals, whether or not illustrated or containing advertising material.",5910549
202311,4903,"Children's picture, drawing or colouring books.",357815543
202311,4904,"Music, printed or in manuscript, whether or not bound or illustrated",14934
202311,4905,"Maps and hydrographic or similar charts of all kinds, including atlases, wall maps, topographical plans and globes, printed.",3164167
202311,4906,"Plans and drawings for architectural, engineering, industrial, commercial, topographical or similar purposes, being originals drawn by hand; handwritten texts; photographic reproductions on sensitised paper and carbon copies of the foregoing",936003
202311,4907,"Unused postage, revenue or similar stamps of current or new issue in the country in which they have, or will have, a recognised face value; stamp-impressed paper; banknotes; cheque forms; stock, share or bond certificates and similar documents of title",48391717
202311,4908,Transfers (decalcomanias),146260175
202311,4909,"Printed or illustrated postcards; printed cards bearing personal greetings, messages or announcements, whether or not illustrated, with or without envelopes or trimmings.",242825361
202311,4910,"Calendars of any kind, printed, including calendar blocks.",111879356
