Date of data,Commodity code,Commodity,Renminbi Yuan
202503,6901,"Bricks, blocks, tiles and other ceramic goods of siliceous fossil meals (for example, kieselguhr, tripolite or diatomite) or of similar siliceous earths",7492333
202503,6902,"Refractory bricks, blocks, tiles and similar refractory ceramic constructional goods, other than those of siliceous fossil meals or similar siliceous earths.",991715377
202503,6903,"Other refractory ceramic goods (for example, retorts, crucibles, muffles, nozzles, plugs, supports, cupels, tubes, pipes, sheaths, rods and slide gates), other than those of siliceous fossil meals or of similar siliceous earths.”",216079754
202503,6904,"Geramic building bricks, flooring blocks, support or filler tiles and the like.",894909003
202503,6905,"Roofing tiles, chimneypots, cowls, chimney liners, architectural ornaments and other ceramic constructional goods.",111229797
202503,6906,"Ceramic pipes, conduits, guttering and pipe fittings",13523203
202503,6907,"Geramic flags and paving, hearth or wall tiles; ceramic mosaic cubes and the like, whether or not on a backing; finishing ceramics.",1874070775
202503,6909,"Geramic wares for laboratory, chemical or other technical uses; ceramic troughs, tubs and similar receptacles of a kind used in agriculture; ceramic pots, jars and similar articles of a kind used for the conveyance or packing of goods.",601950209
202503,6910,"Geramic sinks, wash basins, wash basin pedestals, baths, bidets, water closet pans, flushing cisterns, urinals and similar sanitary fixtures.",3082245557
202503,6911,"Tableware, kitchenware, other household articles and toilet articles, of porcelain or china.",3515792175
202503,6912,"Geramic tableware, kitchenware, other household articles and toilet articles, other than of porcelain or china.",242009891
202503,6913,Statuettes and other ornamental ceramic articles.,653657700
202503,6914,Other ceramic articles.,717831483
202503,7001,"Cullet and other waste and scrap of glass, excluding glass from cathode ray tubes or other activated glass of heading 85.49; glass in the mass.",124712378
202503,7002,"Glass in balls (other than microspheres of heading 70.18), rods or tubes, unworked.",148514690
202503,7003,"Cast glass and rolled glass, in sheets or profiles, whether or not having an absorbent, reflecting or nonreflecting layer, but not otherwise worked.",74513875
202503,7004,"Drawn glass and blown glass, in sheets, whether or not having an absorbent, reflecting or nonreflecting layer, but not otherwise worked.",205573256
202503,7005,"Float glass and surface ground or polished glass, in sheets, whether or not having an absorbent, reflecting or nonreflecting layer, but not otherwise worked.",314306757
202503,7006,"Glass of heading 70.03, 70.04 or 70.05, bent, edgeworked, engraved, drilled, enamelled or otherwise worked, but not framed or fitted with other materials.",364863863
202503,7007,"safety glass, consisting of toughened (tempered) or laminated glass.",2579314137
202503,7008,Multiplewalled insulating units of glass.,148283871
202503,7009,"Glass mirrors, whether or not framed, including rearview mirrors.",2054583483
202503,7010,"Carboys, bottles, flasks, jars, pots, phials, ampoules and other containers, of glass, of a kind used for the conveyance or packing of goods; preserving jars of glass; stoppers, lids and other closures, of glass.",1839073499
202503,7011,"Glass envelopes (including bulbs and tubes), open, and glass parts thereof, without fittings, for electric lamps and light sources, cathoderay tubes or the like.",6478756
202503,7013,"Glassware of a kind used for table, kitchen, toilet, office, indoor decoration or similar purposes (other than that of heading 70.10 or 70.18).",3182071589
202503,7014,"Signalling glassware and optical elements of glass (other than those of heading 70.15), not optically worked.",71570526
202503,7015,"Clock or watch glasses and similar glasses, glasses for non corrective or corrective spectacles, curved, bent, hollowed or the like, not optically worked; hollow glass spheres and their segments, for the manufacture of such glasses.",2358502
202503,7016,"Paving blocks, slabs, bricks, squares, tiles and other articles of pressed or moulded glass, whether or not wired, of a kind used for building or construction purposes; glass cubes and other glass smallwares, whether or not on a backing, for mosaics or similar decorative purposes; leaded lights and the like; multicellular or foam glass in blocks, panels, plates, shells or similar forms.",463597640
202503,7017,"Laboratory, hygienic or pharmaceutical glassware, whether or not graduated or calibrated.",98424410
202503,7018,"Glass beads, imitation pearls, imitation precious or semiprecious stones and similar glass smallwares, and articles thereof other than imitation jewellery; glass eyes other than prosthetic articles; statuettes and other ornaments of lampworked glass, other than imitation jewellery; glass microspheres not exceeding 1mm in diameter.",900788251
202503,7019,"Glass fibres (including glass wool) and articles thereof (for example, yarn, rovings, woven fabrics).",2017663216
202503,7020,Other articles of glass,338331752
202503,7101,"Pearls, natural or cultured, whether or not worked or graded but not strung, mounted or set; pearls, natural or cultured, temporarily strung for convenience of transport.",12738687
202503,7102,"Diamonds, whether or not worked, but not mounted or set.",672479521
202503,7103,"Precious stones and semi-precious stones, whether or not worked or graded, but not strung, mounted or set, ungraded precious stones and semi-precious stones, temporarily strung for convenience of transport",18024565
202503,7104,"Synthetic or reconstructed precious or semiprecious stones, whether or not worked or graded but not strung, mounted or set; ungraded synthetic or reconstructed precious or semiprecious stones, temporarily strung for convenience of transport.",261055885
202503,7105,Dust and powder of natural or synthetic precious or semiprecious stones.,91379349
202503,7106,"Silver (including silver plated with gold or platinum), unwrought or in semimanufactured forms, or in powder form.",2783280187
202503,7107,"Base metals clad with silver, not further worked than semimanufactured.",18476248
202503,7108,"Gold (including gold plated with platinum) unwrought or in semimanufactured forms, or in powder form.",18817708637
202503,7109,"Base metals or silver, clad with gold, not further worked than semimanufactured.",473656
202503,7110,"Platinum, unwrought or in semimanufactured forms, or in powder form.",142955277
202503,7112,"Waste and scrap of precious metal or of metal clad with precious metal; other waste and scrap containing precious metal or precious metal compounds, of a kind used principally for the recovery of precious metal.Except for articles of 85.49",14013337
202503,7113,"Articles of jewellery and parts thereof, of precious metal or of metal clad with precious metal.",8867508034
202503,7114,"Articles of goldsmiths' or silversmiths' wares and parts thereof, of precious metal or of metal clad with precious metal.",297988691
202503,7115,Other articles of precious metal or of metal clad with precious metal.,276581051
202503,7116,"Articles of natural or cultured pearls, precious or semiprecious stones (natural, synthetic or reconstructed).",133943787
202503,7117,Imitation jewellery.,2385851253
202503,7118,Coin.,839287
202503,7201,"Pig iron and spiegeleisen in pigs, blocks or other primary forms.",9124728
202503,7202,Ferroalloys.,908474947
202503,7203,"Ferrous products obtained by direct reduction of iron ore and other spongy ferrous products, in lumps, pellets or similar forms; iron having a minimum purity by weight of 99.94%, in lumps, pellets or similar forms.",8096580
202503,7204,Ferrous waste and scrap; remelting scrap ingots of iron or steel.,67455
202503,7205,"Nranules and powders, of pig iron, spiegeleisen, iron or steel",156129684
202503,7207,Semi-finished products of iron or nonalloy steel.,3348126961
202503,7208,"Flat-rolled products of iron or nonalloy steel, of a width of 600 mm or more, hotrolled, not clad, plated or coated.",9573547166
202503,7209,"Flat-rolled products of iron or nonalloy steel, of a width of 600 mm or more, coldrolled (coldreduced), not clad, plated or coated.",1419327662
202503,7210,"at-rolled products of iron or non-alloy steel, of a width ≥ 600 mm, hot-rolled or cold-rolled ""cold-reduced"", clad, plated or coated",11377160943
202503,7211,"Flat-rolled products of iron or nonalloy steel, of a width of less than 600 mm, not clad, plated or coated.",219658493
202503,7212,"Flat-rolled products of iron or nonalloy steel, of a width of less than 600 mm, clad, plated or coated.",873270047
202503,7213,"Bars and rods, hotrolled, in irregularly wound coils, of iron or nonalloy steel.",2150229965
202503,7214,"Other bars and rods of iron or nonalloy steel, not further worked than forged, hotrolled, hotdrawn or hotextruded, but including those twisted after rolling.",1854447216
202503,7215,Other bars and rods of iron or nonalloy steel.,91264743
202503,7216,"Angles, shapes and sections of iron or nonalloy steel.",1976881117
202503,7217,Wire of iron or nonalloy steel.,1125958499
202503,7219,"Flat-rolled products of stainless steel, of a width of 600 mm or more.",3451635485
202503,7220,"Flat-rolled products of stainless steel, of a width of less than 600 mm.",383112164
202503,7221,"Bars and rods, hotrolled, in irregularly wound coils, of stainless steel.",170714612
202503,7222,"Other bars and rods of stainless steel; angles, shapes and sections of stainless steel.",179132874
202503,7223,Wire of stainless steel,175517332
202503,7224,Other alloy steel in ingots or other primary forms; semifinished products of other alloy steel.,54846453
202503,7225,"Flat-rolled products of other alloy steel, of a width of 600 mm or more.",2766320390
202503,7226,"Flat-rolled products of alloy steel other than stainless, of a width of ≥ 600 mm, hot-rolled or cold-rolled ""cold-reduced"" and further worked (excluding plated or coated with zinc and products of silicon-electrical steel)",290347729
202503,7227,"Bars and rods, hot-rolled, in irregularly wound coils, of other alloy steel.",584359507
202503,7228,"Other bars and rods of other alloy steel; angles, shapes and sections, of other alloy steel; hollow drill bars and rods, of alloy or nonalloy steel.",1617159635
202503,7229,Wire of other alloy steel.,261710153
202503,7301,"Sheet piling of iron or steel, whether or not drilled, punched or made from assembled elements; welded angles, shapes and sections, of iron or steel.",399836137
202503,7302,"Railway or tramway track construction material of iron or steel, the following : rails, check-rails and rack rails, switch blades, crossing frogs, point rods and other crossing pieces, sleepers ""cross-ties"", fish-plates, chairs, chair wedges, sole plates ""base plates"", rail clips, bedplates, ties and other material specialised for jointing or fixing rails",623176344
202503,7303,"Tubes, pipes and hollow profiles, of cast iron.",305522587
202503,7304,"Tubes, pipes and hollow profiles, seamless, of iron (other than cast iron) or steel.",4702138132
202503,7305,"Other tubes and pipes (for example, welded, riveted or similarly closed), having circular cross-sections, the external diameter of which exceeds 406.4 mm, of iron or steel.",910367040
202503,7306,"Other tubes, pipes and hollow profiles (for example, open seam or welded, riveted or similarly closed), of iron or steel.",2056628206
202503,7307,"Tube or pipe fittings (for example, couplings, elbows, sleeves), of iron or steel.",2480156056
202503,7308,"Structures (excluding prefabricated buildings of heading 94.06) and parts of structures (for example, bridges and bridgesections, lockgates, towers, lattice masts, roofs, roofing frameworks, doors and windows and their frames and thresholds for doors, shutters, balustrades, pillars and columns), of iron or steel; plates, rods, angles, shapes, sections, tubes and the like, prepared for use in structures, of iron or steel.",14298956667
202503,7309,"eservoirs, tanks, vats and similar containers for any material (other than compressed or liquefied gas), of iron or steel, of a capacity exceeding 300 l, whether or not lined or heatinsulated, but not fitted with mechanical or thermal equipment.",626315771
202503,7310,"anks, casks, drums, cans, boxes and similar containers, for any material (other than compressed or liquefied gas), of iron or steel, of a capacity not exceeding 300 l, whether or not lined or heatinsulated, but not fitted with mechanical or thermal equipment.",743194499
202503,7311,"Containers for compressed or liquefied gas, of iron or steel.",850689916
202503,7312,"Stranded wire, ropes, cables, plaited bands, slings and the like, of iron or steel, not electrically insulated.",1742666526
202503,7313,"Barbed wire of iron or steel; twisted hoop or single flat wire, barbed or not, and loosely twisted double wire, of a kind used for fencing, of iron or steel.",126158378
202503,7314,"Cloth (including endless bands), grill, netting and fencing, of iron or steel wire; expanded metal of iron or steel.",1240325893
202503,7315,"Chain and parts thereof, of iron or steel.",1240593396
202503,7316,"Anchors, grapnels and parts thereof, of iron or steel.",82599680
202503,7317,"Nails, tacks, drawing pins, corrugated nails, staples (other than those of heading 83.05) and similar articles, of iron or steel, whether or not with heads of other material, but excluding such articles with heads of copper.",927901094
202503,7318,"Screws, bolts, nuts, coach screws, screw hooks, rivets, cotters, cotterpins, washers (including spring washers) and similar articles, of iron or steel.",6011610634
202503,7319,"Sewing needles, knitting needles, bodkins, crochet hooks, embroidery stilettos and similar articles, for use in the hand, of iron or steel; safety pins and other pins of iron or steel, not elsewhere specified or included.",107485230
202503,7320,"Springs and leaves for springs, of iron or steel.",608493780
202503,7321,"Stoves, ranges, grates, cookers (including those with subsidiary boilers for central heating), barbecues, braziers, gasrings, plate warmers and similar nonelectric domestic appliances, and parts thereof, of iron or steel.",3746297665
202503,7322,"Radiators for central heating, not electrically heated, and parts thereof, of iron or steel; air heaters and hot air distributors (including distributors which can also distribute fresh or conditioned air), not electrically heated, incorporating a motordriven fan or blower, and parts thereof, of iron or steel.",123852054
202503,7323,"Table, kitchen or other household articles and parts thereof, of iron or steel; iron or steel wool; pot scourers and scouring or polishing pads, gloves and the like, of iron or steel.",6939896626
202503,7324,"Sanitary ware and parts thereof, of iron or steel.",1679355734
202503,7325,Other cast articles of iron or steel.,817400188
202503,7326,Other articles of iron or steel.,12353249018
202503,7402,Unrefined copper; copper anodes for electrolytic refining.,511114
202503,7403,"Refined copper and copper alloys, unwrought.",4638283390
202503,7404,Copper waste and scrap.,4896
202503,7405,Master alloys of copper.,3424958
202503,7406,Copper powders and flakes.,20814342
202503,7407,"Copper bars, rods and profiles.",193087334
202503,7408,Copper wire.,1210267671
202503,7409,"Copper plates, sheets and strip, of a thickness exceeding 0.15mm.",816370789
202503,7410,"Copper foil (whether or not printed or backed with paper, paperboard, plastics or similar backing materials) of a thickness (excluding any backing) not exceeding 0.15 mm.",866297213
202503,7411,Copper tubes and pipes.,1930212228
202503,7412,"Copper tube or pipe fittings (for example, couplings, elbows, sleeves).",692409772
202503,7413,"Stranded wire, cables, plaited bands and the like, of copper, not electrically insulated.",70321448
202503,7415,"Nails, tacks, drawing pins, staples (other than those of heading 83.05) and similar articles, of copper or of iron or steel with heads of copper; screws, bolts, nuts, screw hooks, rivets, cotters, cotterpins, washers (including spring washers) and similar articles, of copper.",108546065
202503,7418,"Table, kitchen or other household articles and parts thereof, of copper; pot scourers and scouring or polishing pads, gloves and the like, of copper; sanitary ware and parts thereof, of copper.",211910308
202503,7419,Other articles of copper.,320608797
202503,7502,nwrought nickel.,1553765589
202503,7503,Nickel waste and scrap.,2292648
202503,7504,Nickel powders and flakes.,109821161
202503,7505,"Nickel bars, rods, profiles and wire.",190778821
202503,7506,"Nickel plates, sheets, strip and foil.",49584350
202503,7507,"Nickel tubes, pipes and tube or pipe fittings (for example, couplings, elbows, sleeves).",72658783
202503,7508,Other articles of nickel.,35153371
202503,7601,Unwrought aluminium.,538868034
202503,7602,Aluminium waste and scrap.,1499877
202503,7603,Aluminium powders and flakes.,24156220
202503,7604,"Aluminium bars, rods and profiles.",1648199197
202503,7605,Aluminium wire.,170024586
202503,7606,"Aluminium plates, sheets and strip, of a thickness exceeding 0.2 mm.",6558902564
202503,7607,"Aluminium foil (whether or not printed or backed with paper, paperboard, plastics or similar backing materials) of a thickness (excluding any backing) not exceeding 0.2 mm.",3397733880
202503,7608,Aluminium tubes and pipes.,301609859
202503,7609,"Aluminium tube or pipe fittings (for example, couplings, elbows, sleeves).",106802688
202503,7610,"Aluminium structures (excluding prefabricated buildings of heading 94.06) and parts of structures (for example, bridges and bridgesections, towers, lattice masts, roofs, roofing frameworks, doors and windows and their frames and thresholds for doors, balustrades, pillars and columns); aluminium plates, rods, profiles, tubes and the like, prepared for use in structures.",4293640019
202503,7611,"Aluminium reservoirs, tanks, vats and similar containers, for any material (other than compressed or liquefied gas), of a capacity exceeding 300 l, whether or not lined or heatinsulated, but not fitted with mechanical or thermal equipment.",18153412
202503,7612,"Aluminium casks, drums, cans, boxes and similar containers (including rigid or collapsible tubular containers), for any material (other than compressed or liquefied gas), of a capacity not exceeding 300 l, whether or not lined or heatinsulated, but not fitted with mechanical or thermal equipment.",270705065
202503,7613,Aluminium containers for compressed or liquefied gas.,57732608
202503,7614,"Stranded wire, cables, plaited bands and the like, of aluminium, not electrically insulated.",521144449
202503,7615,"Table, kitchen or other household articles and parts thereof, of aluminium; pot scourers and scouring or polishing pads, gloves and the like, of aluminium; sanitary ware and parts thereof, of aluminium.",2127766739
202503,7616,Other articles of aluminium.,3748659963
202503,7801,Unwrought lead.,81386416
202503,7804,"Lead plates, sheets, strip and foil; lead powders and flakes.",12061477
202503,7806,Other articles of lead.,4578071
202503,7901,Unwrought zinc.,34412069
202503,7903,"zinc dust, powders and flakes.",1722895
202503,7904,"Zinc bars, rods, profiles and wire.",9374503
202503,7905,"Zinc plates, sheets, strip and foil.",2156557
202503,7907,Other articles of zinc.,65402284
202503,8001,Unwrought tin.,393100238
202503,8003,"Tin bars, rods, profiles and wire.",40221173
202503,8007,Other articles of tin.,24103423
202503,8101,"Wungsten (wolfram) and articles thereof, including waste and scrap.",130406762
202503,8102,"Molybdenum and articles thereof, including waste and scrap.",203902515
202503,8103,"Tantalum and articles thereof, including waste and scrap.",155470251
202503,8104,"Magnesium and articles thereof, including waste and scrap.",704380555
202503,8105,"Cobalt mattes and other intermediate products of cobalt metallurgy; cobalt and articles thereof, including waste and scrap.",267072395
202503,8106,"Bismuth and articles thereof, including waste and scrap.",1076
202503,8108,"Titanium and articles thereof, including waste and scrap.",613715303
202503,8109,"Zirconium and articles thereof, including waste and scrap.",97782918
202503,8110,"Antimony and articles thereof, including waste and scrap.",25478790
202503,8111,"Manganese and articles thereof, including waste and scrap",319661799
202503,8112,"Beryllium, chromium, hafnium, rhenium, thallium, cadmium, germanium, vanadium, gallium, indium, niobium and their products, including waste and scrap:",444585257
202503,8113,"Cermets and articles thereof, including waste and scrap.",43727031
202503,8201,"Hand tools, the following : spades, shovels, mattocks, picks, hoes, forks and rakes; axes, bill hooks and similar hewing tools; secateurs and pruners of any kind; scythes, sickles, hay knives, hedge shears, timber wedges and other tools of a kind used in agriculture, horticulture or forestry.",713935178
202503,8202,"Hand saws; blades for saws of all kinds (including slitting, slotting or toothless saw blades).",1029242093
202503,8203,"Files, rasps, pliers (including cutting pliers), pincers, tweezers, metal cutting shears, pipecutters, bolt croppers, perforating punches and similar hand tools.",665711062
202503,8204,"Hand-operated spanners and wrenches (including torque meter wrenches but not including tap wrenches); interchangeable spanner sockets, with or without handles.",975861400
202503,8205,"Hand tools (including glaziers' diamonds), not elsewhere specified or included; blow lamps; vices, clamps and the like, other than accessories for and parts of, machinetools or waterjet cutting machines; anvils; portable forges; hand or pedaloperated grinding wheels with frameworks.",2826733267
202503,8206,"Tools of two or more of the headings 82.02 to 82.05, put up in sets for retail sale.",645530309
202503,8207,"Interchangeable tools for hand tools, whether or not poweroperated, or for machinetools (for example, for pressing, stamping, punching, tapping, threading, drilling, boring, broaching, milling, turning or screw driving), including dies for drawing or extruding metal, and rock drilling or earth boring tools.",3064904995
202503,8208,"Knives and cutting blades, for machines or for mechanical appliances.",531271202
202503,8209,"Plates, sticks, tips and the like for tools, unmounted, of cermets.",480652738
202503,8210,"Hand-operated mechanical appliances, weighing 10 kg or less, used in the preparation, conditioning or serving of food or drink.",235861130
202503,8211,"Knives with cutting blades, serrated or not (including pruning knives), other than knives of heading 82.08, and blades therefor.",720848332
202503,8212,Razors and razor blades (including razor blade blanks in strips).,380160599
202503,8213,"Scissors, tailors' shears and similar shears, and blades therefor.",412056478
202503,8214,"Other articles of cutlery (for example, hair clippers, butchers' or kitchen cleavers, choppers and mincing knives, paper knives); manicure or pedicure sets and instruments (including nail files).",625336708
202503,8215,"Spoons, forks, ladles, skimmers, cakeservers, fishknives, butterknives, sugar tongs and similar kitchen or tableware.",1299371574
202503,8301,"Padlocks and locks (key, combination or electrically operated), of base metal; clasps and frames with clasps, incorporating locks, of base metal; keys for any of the foregoing articles, of base metal",2936820683
202503,8302,"Base metal mountings, fittings and similar articles suitable for furniture, doors, staircases, windows, blinds, coachwork, saddlery, trunks, chests, caskets or the like; base metal hatracks, hatpegs, brackets and similar fixtures; castors with mountings of base metal; automatic door closers of base metal",7381851093
202503,8303,"Armoured or reinforced safes, strongboxes and doors and safe deposit lockers for strongrooms, cash or deed boxes and the like, of base metal",391307394
202503,8304,"Filing cabinets, cardindex cabinets, paper trays, paper rests, pen trays, officestamp stands and similar office or desk equipment, of base metal, other than office furniture of heading 9403",135654195
202503,8305,"Fittings for looseleaf binders or files, letter clips, letter corners, paper clips, indexing tags and similar office articles, of base metal; staples in strips (for example, for offices, upholstery, packaging), of base metal",266998218
202503,8306,"Bells, gongs and the like, nonelectric, of base metal; statuettes and other ornaments, of base metal; photograph, picture or similar frames, of base metal; mirrors of base metal",1112319776
202503,8307,"Flexible tubing of base metal, with or without fittings",335859619
202503,8308,"Clasps, frames with clasps, buckles, buckleclasps, hooks, eyes, eyelets and the like, of base metal, of a kind used for clothing or clothing accessories, footwear, jewellery, wristwatches, books, awnings, leather goods, travel goods or saddlery or for other made up articles; tubular or bifurcated rivets, of base metal; beads and spangles, of base metal",984505252
202503,8309,"Stoppers, caps and lids (including crown corks, screw caps and pouring stoppers), capsules for bottles, threaded bungs, bung covers, seals and other packing accessories, of base metal",967765603
202503,8310,"Signplates, nameplates, addressplates and similar plates, numbers, letters and other symbols, of base metal, excluding those of heading 9405",292296671
202503,8311,"Wire, rods, tubes, plates, electrodes and similar products, of base metal or of metal carbides, coated or cored with flux material, of a kind used for soldering, brazing, welding or deposition of metal or of metal carbides; wire and rods, of agglomerated base metal powder, used for metal spraying",738706240
