Date of data,Commodity code,Commodity,Renminbi Yuan
202503,4908,Transfers (decalcomanias),183063240
202503,4909,"Printed or illustrated postcards; printed cards bearing personal greetings, messages or announcements, whether or not illustrated, with or without envelopes or trimmings.",189828013
202503,4910,"Calendars of any kind, printed, including calendar blocks.",47803040
202503,4911,"Other printed matter, including printed pictures and photographs.",687548577
202503,5001,Silkworm cocoons suitable for reeling.,2341154
202503,5002,Raw silk (not thrown).,133109583
202503,5003,"Silk waste (including cocoons unsuitable for reeling, yarn waste and garnetted stock).",15742528
202503,5004,Silk yarn (other than yarn spun from silk waste) not put up for retail sale.,53991537
202503,5005,"Yarn spun from silk waste, not put up for retail sale.",38207903
202503,5006,"Silk yarn and yarn spun from silk waste, put up for retail sale;silkworm gut.",745338
202503,5007,Woven fabrics of silk or of silk waste.,196405905
202503,5101,"Wool, not carded or combed.",24483975
202503,5102,"Fine or coarse animal hair, not carded or combed.",13510142
202503,5103,"Waste of wool or of fine or coarse animal hair, including yarn waste but excluding garnetted stock.",7588980
202503,5105,"Wool and fine or coarse animal hair, carded or combed (including combed wool in fragments).",415225329
202503,5106,"Yarn of carded wool, not put up for retail sale.",109055881
202503,5107,"Yarn of combed wool, not put up for retail sale.",169041332
202503,5108,"yarn of fine animal hair (carded or combed), not put up for retail sale.",356662096
202503,5109,"Yarn of wool or of fine animal hair, put up for retail sale.",7401063
202503,5110,"Yarn of coarse animal hair or of horsehair (including gimped horsehair yarn), whether or not put up for retail sale.",131251
202503,5111,Woven fabrics of carded wool or of carded fine animal hair.,70599808
202503,5112,Woven fabrics of combed wool or of combed fine animal hair.,89472558
202503,5113,Woven fabrics of coarse animal hair or of horsehair.,1532412
202503,5201,"Cotton, not carded or combed.",4264848
202503,5202,Cotton waste (including yarn waste and garnetted stock).,209872
202503,5204,"Cotton sewing thread, whether or not put up for retail sale.",19430069
202503,5205,"Cotton yarn (other than sewing thread), containing 85% or more by weight of cotton, not put up for retail sale.",650964441
202503,5206,"otton yarn (other than sewing thread), containing less than 85% by weight of cotton, not put up for retail sale.",187577803
202503,5207,otton yarn (other than sewing thread) put up for retail sale.,28762471
202503,5208,"Woven fabrics of cotton, containing 85% or more by weight of cotton, weighing not more than 200 g/m2",2538764980
202503,5209,"Woven fabrics of cotton, containing 85% or more by weight of cotton, weighing more than 200 g/m2",1450235294
202503,5210,"Woven fabrics of cotton, containing less than 85% by weight of cotton, mixed mainly or solely with manmade fibres, weighing not more than 200 g/m2.",340844076
202503,5211,"Woven fabrics of cotton, containing less than 85% by weight of cotton, mixed mainly or solely with manmade fibres, weighing more than 200 g/m2.",1386722071
202503,5212,Other woven fabrics of cotton.,129199157
202503,5303,"Jute and other textile bast fibres (excluding flax, true hemp and ramie), raw or processed but not spun; tow and waste of these fibres (including yarn waste and garnetted stock).",20950
202503,5305,"Coconut, abaca ""Manila hemp or Musa textilis Nee"", ramie, agave and other vegetable textile fibres, n.e.s., raw or processed, but not spun; tow, noils and waste of such fibres, incl. yarn waste and garnetted stock",676216
202503,5306,lax yarn.,121931511
202503,5307,Yarn of jute or of other textile bast fibres of heading 53.03.,6160026
202503,5308,Yarn of other vegetable textile fibres; paper yarn.,15847325
202503,5309,Woven fabrics of flax.,452575103
202503,5310,Woven fabrics of jute or of other textile bast fibres of heading 5303,3163817
202503,5311,Woven fabrics of other vegetable textile fibres; woven fabrics of paper yarn.,41730852
202503,5401,"Sewing thread of manmade filaments, whether or not put up for retail sale.",280249884
202503,5402,"Synthetic filament yarn (other than sewing thread), not put up for retail sale, including synthetic monofilament of less than 67 decitex.",4615906927
202503,5403,"Artificial filament yarn (other than sewing thread), not put up for retail sale, including artificial monofilament of less than 67 decitex.",366744491
202503,5404,"Synthetic monofilament of 67 decitex or more and of which no crosssectional dimension exceeds 1 mm; strip and the like (for example, artificial straw) of synthetic textile materials of an apparent width not exceeding 5 mm.",157788096
202503,5405,"Artificial monofilament of 67 decitex or more and of which no crosssectional dimension exceeds 1 mm; strip and the like (for example, artificial straw) of artificial textile materials of an apparent width not exceeding 5 mm.",802248
202503,5406,"Manmade filament yarn (other than sewing thread), put up for retail sale.",35046169
202503,5407,"Woven fabrics of synthetic filament yarn, including woven fabrics obtained from materials of heading 54.04.",11920736106
202503,5408,"Woven fabrics of artificial filament yarn, including woven fabrics obtained from materials of heading 54.05.",198600835
202503,5501,Synthetic filament tow.,68685897
202503,5502,Artificial filament tow.,454426
202503,5503,"Synthetic staple fibres, not carded, combed or otherwise processed for spinning.",1196189295
202503,5504,"Artificial staple fibres, not carded, combed or otherwise processed for spinning.",356170269
202503,5505,"Waste (including noils, yarn waste and garnetted stock) of manmade fibres.",591129
202503,5506,"Synthetic staple fibres, carded, combed or otherwise processed for spinning.",34070284
202503,5507,"Artificial staple fibres, carded, combed or otherwise processed for spinning.",1594743
202503,5508,"Sewing thread of manmade staple fibres, whether or not put up for retail sale.",229328841
202503,5509,"Yarn (other than sewing thread) of synthetic staple fibres, not put up for retail sale.",1324977163
202503,5510,"Yarn (other than sewing thread) of artificial staple fibres, not put up for retail sale.",364138134
202503,5511,"Yarn (other than sewing thread) of manmade staple fibres, put up for retail sale.",44914099
202503,5512,"Woven fabrics of synthetic staple fibres, containing 85% or more by weight of synthetic staple fibres.",795963132
202503,5513,"Woven fabrics of synthetic staple fibres, containing less than 85% by weight of such fibres, mixed mainly or solely with cotton, of a weight not exceeding 170 g/m2.",454096428
202503,5514,"Woven fabrics of synthetic staple fibres, containing less than 85% by weight of such fibres, mixed mainly or solely with cotton, of a weight exceeding 170g/m2.",368359058
202503,5515,Other woven fabrics of synthetic staple fibres.,1018984510
202503,5516,Woven fabrics of artificial staple fibres.,2112071733
202503,5601,"Wadding of textile materials and articles thereof; textile fibres, not exceeding 5 mm in length (flock),textile dust and mill neps.",337265868
202503,5602,"Felt, whether or not impregnated, coated, covered or laminated.",229016042
202503,5603,"Nonwovens, whether or not impregnated, coated, covered or laminated.",2745544730
202503,5604,"Textile-covered rubber thread and cord; textile yarn, strip and the like of heading 5404 and 5405, impregnated, coated, covered or sheathed with rubber or plastics",248343617
202503,5605,"Metallised yarn, whether or not gimped, being textile yarn, or strip or the like of heading 5404 or 5405, of textile fibres, combined with metal in the form of thread, strip or powder or covered with metal",36339201
202503,5606,"Gimped yarn, gimped strip and the like of heading 5404 or 5405; chenille yarn, incl. flock chenille yarn, and loop wale-yarn",192505146
202503,5607,"Twine, cordage, ropes and cables, whether or not plaited or braided and whether or not impregnated, coated, covered or sheathed with rubber or plastics",690200476
202503,5608,"Knotted netting of twine, cordage or rope; made up fishing nets and other made up nets, of textile materials.",607986307
202503,5609,"Articles of yarn, strip or the like of heading 54.04 or 54.05, twine, cordage, rope or cables, not elsewhere specified or included.",279936413
202503,5701,"Carpets and other textile floor coverings, knotted, whether or not made up.",89364807
202503,5702,"Carpets and other textile floor coverings, woven, not tufted or flocked, whether or not made up, incl. Kelem, Schumacks, Karamanie and similar hand-woven rugs",516560848
202503,5703,"Carpets and other textile floor coverings, tufted, whether or not made up.",897964890
202503,5704,"Carpets and other floor coverings, of felt, not tufted or flocked, whether or not made up",17449250
202503,5705,"Other carpets and other textile floor coverings, whether or not made up.",1362046937
202503,5801,"Woven pile fabrics and chenille fabrics (excluding terry towelling and similar woven terry fabrics, tufted textile fabrics and narrow woven fabrics of heading 5806)",783516366
202503,5802,"Terry towelling and similar woven terry fabrics, tufted textile fabrics (excluding narrow woven fabrics of heading 5806, carpets and other floor coverings)",30025948
202503,5803,"Gauze, other than narrow fabrics of heading 58.06",9975480
202503,5804,"Tulles and other net fabrics, not including woven, knitted or crocheted fabrics; lace in the piece, in strips or in motifs, other than fabrics of headings 60.02 to 60.06.",547092192
202503,5805,"Hand-woven tapestries of the type Gobelin, Flanders, Aubusson, Beauvais and the like, and needle-worked tapestries, e.g. petit point, cross-stitch, whether or not made up (excluding Kelem, Schumacks, Karamanie and the like, and tapestries ＞ 100 years old)",1511894
202503,5806,"Narrow woven fabrics of textile materials, with a width of ≤ 30 cm (excluding labels, badges and similar articles); narrow fabrics consisting of warp without weft assembled by means of an adhesive ""bolducs""",1267680884
202503,5807,"Cabels, badges and similar articles of textile materials, in the piece, in strips or cut to shape or size, not embroidered.",327625332
202503,5808,"Braids of textile materials, in the piece; ornamental trimmings of textile materials, in the piece, not embroidered, other than knitted or crocheted; tassels, pompons and similar articles of textile materials",95716404
202503,5809,"Woven fabrics of metal thread and woven fabrics of metallised yarn of heading 5605, of a kind used in apparel, as furnishing fabrics or for similar purposes, n.e.s.",951936
202503,5810,"Embroidery on a textile fabric ground, in the piece, in strips or in motifs",564206846
202503,5811,"Quilted textile products in the piece, composed of one or more layers of textile materials assembled with padding by stitching or otherwise (excluding embroidery of heading 5810 and quilted fabrics for bedding and furnishings)",70314603
202503,5901,"Quilted textile products in the piece, composed of one or more layers of textile materials assembled with padding by stitching or otherwise (excluding embroidery of heading 5810 and quilted fabrics for bedding and furnishings)",184095123
202503,5902,"Tyre cord fabric of high-tenacity yarn of nylon or other polyamides, polyesters or viscose rayon, whether or not dipped or impregnated with rubber or plastic",549680778
202503,5903,"Textile fabrics impregnated, coated, covered or laminated with plastics, other than those of heading 59.02.",4333484535
202503,5904,"Linoleum, whether or not cut to shape; floor coverings consisting of a coating or covering applied on a textile backing, whether or not cut to shape.",21385912
202503,5905,Textile wall coverings.,24392378
202503,5906,"Rubberised textile fabrics, other than those of heading 59.02.",194339812
202503,5907,"Impregnated, coated or covered textile fabrics; painted canvas being theatrical scenery, studio backcloths or the like, n.e.s.",232593811
202503,5908,"Textile wicks, woven, plaited or knitted, for lamps, stoves, lighters, candles or the like; incandescent gas mantles and tubular knitted gas-mantle fabric for incandescent gas mantles, whether or not impregnated",4577145
202503,5909,"Textile hosepiping and similar textile tubing, whether or not impregnated or coated, with or without lining, armour or accessories of other materials",110156287
202503,5910,"Transmission or conveyor belts or belting, of textile material, whether or not impregnated, coated, covered or laminated with plastics, or reinforced with metal or other material.",80739842
202503,5911,"Textile products and articles, for technical use, specified in Note 7 to chapter 59",601686618
202503,6001,"Pile fabrics, incl. ""long pile"" fabrics and terry fabrics, knitted or crocheted",3443756705
202503,6002,"Knitted or crocheted fabrics of a width not exceeding 30cm, containing by weight 5% or more of elastomeric yarn or rubber thread, other than those of heading 60.01.",99285182
202503,6003,"Knitted or crocheted fabrics of a width not exceeding 30cm, other than those of heading 60.01 or 60.02.",29816040
202503,6004,"Knitted or crocheted fabrics of a width exceeding 30 cm, containing by weight 5% or more of elastomeric yarn or rubber thread, other than those of heading 60.01",3559866704
202503,6005,"Warp knit fabrics (including those made on galloon knitting machines), other than those of headings 60.01 to 60.04.",791611656
202503,6006,Other knitted or crocheted fabrics.,6497343228
202503,6101,"Men's or boys' overcoats, car coats, capes, cloaks, anoraks, incl. ski jackets, windcheaters, wind-jackets and similar articles, knitted or crocheted (excluding suits, ensembles, jackets, blazers, bib and brace overalls and trousers)",70100308
202503,6102,"Women's or girls' overcoats, carcoats, capes, cloaks, anoraks (including skijackets), windcheaters, windjackets and similar articles, knitted or crocheted, other than those of heading 61.04.",169617987
202503,6103,"Men's or boys' suits, ensembles, jackets, blazers, trousers, bib and brace overalls, breeches and shorts",2905784133
202503,6104,"Women's or girls' suits, ensembles, jackets, blazers, dresses, skirts, divided skirts, trousers, bib and brace overalls, breeches and shorts, knitted or crocheted",8468205258
202503,6105,"en's or boys' shirts, knitted or crocheted.",972237750
202503,6106,"Women's or girls' blouses, shirts and shirt-blouses, knitted or crocheted (excluding T-shirts and vests)",329352538
202503,6107,"Men's or boys' underpants, briefs, nightshirts, pyjamas, bathrobes, dressing gowns and similar articles, knitted or crocheted (excluding vests and singlets)",1678739978
202503,6108,"Women's or girls' slips, petticoats, briefs, panties, nightdresses, pyjamas, négligés, bathrobes, dressing gowns, housecoats and similar articles, knitted or crocheted (excluding T-shirts, vests, brassieres, girdles, corsets and similar articles)",3341125082
202503,6109,"T-shirts, singlets and other vests, knitted or crocheted",6762399216
202503,6110,"Jerseys, pullovers, cardigans, waistcoats and similar articles, of wool, knitted or crocheted (excluding wadded waistcoats)",7513962587
202503,6111,"Babies' garments and clothing accessories of wool or fine animal hair, knitted or crocheted (excluding hats)",727236900
202503,6112,"Track-suits, ski-suits and swimwear, knitted or crocheted",1407576178
202503,6113,"Garments, knitted or crocheted, rubberised or impregnated, coated or covered with plastics or other materials (excluding babies' garments and clothing accessories)",70905613
202503,6114,"Special garments for professional, sporting or other purposes, n.e.s., knitted or crocheted",1974660387
202503,6115,"Pantyhose, tights, stockings, socks and other hosiery, incl. graduated compression hosiery [e.g., stockings for varicose veins] and footwear without applied soles, knitted or crocheted (excluding for babies)",3110560365
202503,6116,"Gloves, mittens and mitts, knitted or crocheted (excluding for babies)",1582703130
202503,6117,"Other made up clothing accessories, knitted or crocheted; knitted or crocheted parts of garments or of clothing accessories.",1285889708
202503,6201,"Men’s or boys’ overcoats, car-coats, capes, cloaks, anoraks (including ski-jackets), wind-cheaters, wind jackets and similar articles, other than those of heading 62.03.",993223556
202503,6202,"Women’s or girls’ overcoats, car-coats, capes, cloaks, anoraks (including ski-jackets), wind-cheaters, wind-jackets and similar articles, other than those of heading 62.04.",1227343825
202503,6203,"Men's or boys' suits, ensembles, jackets, blazers, trousers, bib and brace overalls, breeches and shorts (excluding knitted or crocheted, wind-jackets and similar articles, separate waistcoats, tracksuits, ski suits and swimwear)",5837466541
202503,6204,"Women's or girls' suits, ensembles, jackets, blazers, dresses, skirts, divided skirts, trousers, bib and brace overalls, breeches and shorts (excluding knitted or crocheted, wind-jackets and similar articles, slips, petticoats and panties, tracksuits, ski suits and swimwear)",15510303121
202503,6205,Men's or boys' shirts.,1137368593
202503,6206,"Women's or girls' blouses, shirts and shirtblouses.",1437701414
202503,6207,"Men's or boys' singlets and other vests, underpants, briefs, nightshirts, pyjamas, bathrobes, dressing gowns and similar articles",207003503
202503,6208,"Women's or girls' singlets and other vests, slips, petticoats, briefs, panties, nightdresses, pyjamas, négligés, bathrobes, dressing gowns, housecoats and similar articles (excluding knitted or crocheted, brassières, girdles, corsets and similar articles)",889500254
202503,6209,Babies garments and clothing accessories of textile materials (excluding knitted or crocheted and hats),151218553
202503,6210,"Garments made up of felt or nonwovens, whether or not impregnated, coated, covered or laminated; garments of textile fabrics, rubberised or impregnated, coated, covered or laminated with plastics or other substances (excluding knitted or crocheted, and babies' garments and clothing accessories)",1244461938
202503,6211,"Tracksuits, ski suits, swimwear and other garments, n.e.s.",3082938772
202503,6212,"Brassieres, girdles, corsets, braces, suspenders, garters and similar articles and parts thereof, of all types of textile materials, whether or not elasticated, incl. knitted or crocheted (excluding belts and corselets made entirely of rubber)",2821417719
202503,6213,Handkerchiefs,55731029
202503,6214,"Shawls, scarves, mufflers, mantillas, veils and similar articles",612915660
202503,6215,"Ties, bow ties and cravats of textile materials",99983020
202503,6216,"Gloves, mittens and mitts, of all types of textile materials (excluding knitted or crocheted and for babies)",147176513
202503,6217,"Made-up clothing accessories and parts of garments or clothing accessories, of all types of textile materials, n.e.s.",267429902
202503,6301,Blankets and travelling rugs,1714832996
202503,6302,"Bed linen, table linen, toilet linen and kitchen linen.",5774171902
202503,6303,Curtains (including drapes) and interior blinds; curtain or bed valances.,1881909812
202503,6304,"Other furnishing articles, excluding those of heading 94.04.",1565875447
202503,6305,"Packs and bags, of a kind used for the packing of goods.",1064301625
202503,6306,"Tarpaulins, awnings and sunblinds; tents (including temporary canopies and similar articles); sails for boats, sailboards or landcraft; camping goods.”",3141561765
202503,6307,"other made up articles, including dress patterns.",5417141866
202503,6308,"Sets consisting of woven fabric and yarn, whether or not with accessories, for making up into rugs, tapestries, embroidered table cloths or serviettes, or similar textile articles, put up in packings for retail sale.",11503190
202503,6309,Worn clothing and other worn articles.,365276498
202503,6310,"Used or new rags, scrap twine, cordage, rope and cables and worn-out articles thereof, of textile materials",22370377
202503,6401,"Waterproof footwear with outer soles and uppers of rubber or of plastics, the uppers of which are neither fixed to the sole nor assembled by stitching, riveting, nailing, screwing, plugging or similar processes.",382217460
202503,6402,Other footwear with outer soles and uppers of rubber or plastics.,12592160467
202503,6403,"ootwear with outer soles of rubber, plastics, leather or composition leather and uppers of leather.",3395693707
202503,6404,"Footwear with outer soles of rubber, plastics, leather or composition leather and uppers of textile materials.",5765264452
202503,6405,Other footwear.,624583917
202503,6406,"Parts of footwear, incl. uppers whether or not attached to soles other than outer soles; removable in-soles, heel cushions and similar articles; gaiters, leggings and similar articles, and parts thereof (excluding articles of asbestos)",2661459671
202503,6501,"Hatforms, hat bodies and hoods of felt, neither blocked to shape nor with made brims; plateaux and manchons (including slit manchons), of felt.",5310831
202503,6502,"Hatshapes, plaited or made by assembling strips of any material, neither blocked to shape, nor with made brims, nor lined, nor trimmed",8122267
202503,6504,"Hats and other headgear, plaited or made by assembling strips of any material, whether or not lined or trimmed",163448669
202503,6505,"Hats and other headgear, knitted or crocheted, or made up from lace, felt or other textile fabric, in the piece (but not in strips), whether or not lined or trimmed; hairnets of any material, whether or not lined or trimmed",1852027789
202503,6506,"Other headgear, whether or not lined or trimmed.",1169219491
202503,6507,"Headbands, linings, covers, hat foundations, hat frames, peaks and chinstraps, for headgear",97925245
202503,6601,"Umbrellas and sun umbrellas (including walkingstick umbrellas, garden umbrellas and similar umbrellas).",2119449347
202503,6602,"Walkingsticks, seatsticks, whips, ridingcrops and the like",114269355
202503,6603,"Parts, trimmings and accessories of articles of heading 66.01 or 66.02.",163366330
202503,6701,"Skins and other parts of birds with their feathers or down, feathers, parts of feathers, down and articles thereof (other than goods of heading 05.05 and worked quills and scapes)",18998600
202503,6702,"Artificial flowers, foliage and fruit and parts thereof; articles made of artificial flowers, foliage or fruit.",2552697960
202503,6703,"Human hair, dressed, thinned, bleached or otherwise worked; wool or other animal hair or other textile materials, prepared for use in making wigs or the like.",237549619
202503,6704,"igs, false beards, eyebrows and eyelashes, switches and the like, of human or animal hair or of textile materials; articles of human hair not elsewhere specified or included.",3199714951
202503,6801,"Setts, curbstones and flagstones, of natural stone (except slate).",22637602
202503,6802,"Worked monumental or building stone (except slate) and articles thereof, other than goods of heading 68.01; mosaic cubes and the like, of natural stone (including slate), whether or not on a backing; artificially coloured granules, chippings and powder, of natural stone (including slate).",2381734085
202503,6803,Worked slate and articles of slate or of agglomerated slate.,87314482
202503,6804,"Millstones, grindstones, grinding wheels and the like, without frameworks, for milling, grinding, pulping, sharpening, polishing, trueing or cutting, hand sharpening or polishing stones, and parts thereof, of natural stone, of agglomerated natural or artificial abrasives, or of ceramics, with or without parts of other materials",762107274
202503,6805,"Natural or artificial abrasive powder or grain, on a base of textile material, of paper, of paperboard or of other materials, whether or not cut to shape or sewn or otherwise made up.",409583194
202503,6806,"Slag-wool, rock-wool and similar mineral wools; exfoliated vermiculite, expanded clays, foamed slag and similar expanded mineral materials; mixtures and articles of heat-insulating, sound-insulating or sound absorbing mineral materials",389821161
202503,6807,"Articles of asphalt or of similar material (for example, petroleum bitumen or coal tar pitch).",43871396
202503,6808,"Panels, boards, tiles, blocks and similar articles of vegetable fibre, of straw or of shavings, chips, particles, sawdust or other waste, of wood, agglomerated with cement, plaster or other mineral binders",152297759
202503,6809,Articles of plaster or of compositions based on plaster.,201666717
202503,6810,"Articles of cement, of concrete or of artificial stone, whether or not reinforced.",1552321245
202503,6811,"Articles of asbestos-cement, of cellulose fibre-cement or the like.",161072008
202503,6812,"Fabricated asbestos fibres; mixtures with a basis of asbestos or with a basis of asbestos and magnesium carbonate; articles of such mixtures or of asbestos (for example, thread, woven fabric, clothing, headgear, footwear, gaskets), whether or not reinforced, other than goods of heading 68.11 or 68.13.",37271973
202503,6813,"Friction material and articles thereof, e.g., sheets, rolls, strips, segments, discs, washers, pads, not mounted, for brakes, clutches or the like, with a basis of asbestos, other mineral substances or cellulose, whether or not combined with textile or other materials",60146863
202503,6814,"Worked mica and articles of mica, including agglomerated or reconstituted mica, whether or not on a support of paper, paperboard or other materials.",125801307
202503,6815,"Articles of stone or of other mineral substances (including carbon fibres, articles of carbon fibres and articles of peat), not elsewhere specified or included.",627930491
