Date of data,Commodity code,Commodity,Renminbi Yuan
201510,101,"Live horses, asses, mules and hinnies",389917.0
201510,102,Live bovine animals,32135274.0
201510,103,Live swine,287330055.0
201510,104,Live sheep and goats,189905.0
201510,105,"Live poultry, that is to say, fowls of the species Gallus domesticus, ducks, geese, turkeys and guinea fowls",9563081.0
201510,106,Other live animals,24635713.0
201510,202,"Meat of bovine animals, frozen",15520238.0
201510,203,"Meat of swine, fresh, chilled or frozen",134736978.0
201510,204,"Meat of sheep or goats, fresh, chilled or frozen",22647465.0
201510,206,"Edible offal of bovine animals, swine, sheep, goats, horses, asses, mules or hinnies, fresh, chilled or frozen",2050701.0
201510,207,"Meat and edible offal, of the poultry of heading 0105, fresh, chilled or frozen",324156146.0
201510,208,"Other meat and edible meat offal, fresh, chilled or frozen",21481514.0
201510,210,"Meat and edible meat offal, salted, in brine, dried or smoked; edible flours and meals of meat or meat offal",5082448.0
201510,301,Live fish,295305474.0
201510,302,"Fish, fresh or chilled, excluding fish fillets and other fish meat of heading 0304",83753155.0
201510,303,"Fish, frozen, excluding fish fillets and other fish meat of heading 0304",1239035990.0
201510,304,"Fish fillets and other fish meat (whether or not minced), fresh, chilled or frozen",2156762318.0
201510,305,"Fish, dried, salted or in brine; smoked fish, whether or not cooked before or during the smoking process; flours, meals and pellets of fish, fit for human consumption",290226398.0
201510,306,"Crustaceans, whether in shell or not, live, fresh, chilled, frozen, dried, salted or in brine; smoked crustaceans, whether in shell or not, whether or not cooked before or during the smoking process; crustaceans, in shell, cooked by steaming or by boiling in water, whether or not chilled, frozen, dried, salted or in brine; flours, meals and pellets of crustaceans, fit for human consumption",1253297429.0
201510,307,"Molluscs, whether in shell or not, live, fresh, chilled, frozen, dried, salted or in brine; smoked molluscs, whether in shell or not, whether or not cooked before or during the smoking process; flours, meals and pellets of molluscs, fit for human consumption",1695122555.0
201510,308,"Aquatic invertebrates other than crustaceans and molluscs, live, fresh, chilled, frozen, dried, salted or in brine; smoked aquatic invertebrates other than crustaceans and molluscs, whether or not cooked before or during the smoking process; flours, meals and pellets of aquatic invertebrates other than crustaceans and molluscs, fit for human consumption",51977947.0
201510,401,"Milk and cream, not concentrated nor containing added sugar or other sweetening matter.",12214520.0
201510,402,"Milk and cream, concentrated or containing added sugar or other sweetening matter",8556974.0
201510,403,"Buttermilk, curdled milk and cream, yogurt, kephir and other fermented or acidified milk and cream, whether or not concentrated or containing added sugar or other sweeteningmatter or flavoured or containing added fruit, nuts or cocoa",200768.0
201510,404,"Whey, whether or not concentrated or containing added sugar or other sweetening matter; products consisting of natural milk constituents, whether or not containing added sugar or other sweetening matter, not elsewhere specified or included",1376.0
201510,405,Butter and other fats and oils derived from milk; dairy spreads,1055050.0
201510,406,Cheese and curd,472201.0
201510,407,"Birds' eggs, in shell, fresh, preserved or cooked",85160329.0
201510,408,"Birds' eggs, not in shell, and egg yolks, fresh, dried, cooked by steaming or by boiling in water, moulded, frozen or otherwise preserved, whether or not containing added sugar or other sweetening matter",5141938.0
201510,409,atural honey,165968721.0
201510,410,"dible products of animal origin, not elsewhere specified or included",46681477.0
201510,502,"Pigs', hogs' or boars' bristles and hair; badger hair and other brush making hair; waste of such bristles or hair",70328096.0
201510,504,"Guts, bladders and stomachs of animals (other than fish), wholeand pieces thereof, fresh, chilled, frozen, salted, in brine, dried orsmoked",528719514.0
201510,505,"Skins and other parts of birds, with their feathers or down, feathers and parts of feathers (whether or not with trimmed edges) and down, not further worked than cleaned, disinfected or treated for preservation;powder and waste of feathers or parts of feathers",221518427.0
201510,507,"Ivory, tortoiseshell, whalebone and whalebone hair, horns, antlers, hooves, nails, claws and beaks, unworked or simply prepared but not cut to shape; powder and waste of these products",11991266.0
201510,508,"Coral and similar materials, unworked or simply prepared bunot otherwise worked; shells of molluscs, crustaceans or echinoderms and cuttlebone, unworked or simply prepared bunot cut to shape, powder and waste thereof",3225315.0
201510,510,"Ambergris, castoreum, civet and musk; cantharides; bile, whether or not dried; glands and other animal products used in the preparation of pharmaceutical products, fresh, chilled, frozen or otherwise provisionally preserved",1613718.0
201510,511,"Animal products not elsewhere specified or included; dead animals of Chapter 1 or 3, unfit for human consumption",40838832.0
201510,601,"Bulbs, tubers, tuberous roots, corms, crowns and rhizomes, dormant, in growth or in flower; chicory plants and roots other than roots of heading 12.12.",880023.0
201510,602,"Other live plants (including their roots), cuttings and slips; mushroom spawn.",76622102.0
201510,603,"Cut flowers and flower buds of a kind suitable for bouquets or for ornamental purposes, fresh, dried, dyed, bleached, impregnated or otherwise prepared.",41167904.0
201510,604,"Foliage, branches and other parts of plants, without flowers or flower buds, and grasses, mosses and lichens, being goods of a kind suitable for bouquets or for ornamental purposes, fresh,dried, dyed, bleached, impregnated or otherwise prepared",23529688.0
201510,701,"Potatoes, fresh or chilled.",177768665.0
201510,702,"Tomatoes, fresh or chilled.",56727668.0
201510,703,"Onions, shallots, garlic, leeks and other alliaceous vegetables, fresh or chilled.",1402815812.0
201510,704,"Cabbages, cauliflowers, kohlrabi, kale and similar edible brassicas, fresh or chilled.",304801779.0
201510,705,"Lettuce (Lactuca sativa) and chicory (Cichorium spp.), fresh or chilled.",25950909.0
201510,706,"Carrots, turnips, salad beetroot, salsify, celeriac, radishes and similar edible roots, fresh or chilled.",257425955.0
201510,707,"Cucumbers and gherkins, fresh or chilled.",15156503.0
201510,708,"Leguminous vegetables, shelled or unshelled, fresh or chilled.",18714893.0
201510,709,"Other vegetables, fresh or chilled.",351149510.0
201510,710,"Vegetables (uncooked or cooked by steaming or boiling in water),frozen.",514254674.0
201510,711,"Vegetables provisionally preserved (for example, by sulphur dioxide gas, in brine, in sulphur water or in other preservative solutions), but unsuitable in that state for immediate consumption.",105952522.0
201510,712,"Dried vegetables, whole, cut, sliced, broken or in powder, but not further prepared.",1234609465.0
201510,713,"Dried leguminous vegetables, shelled, whether or not skinned or split.",276008940.0
201510,714,"Manioc, arrowroot, salep, Jerusalem artichokes, sweet potatoes and similar roots and tubers with high starch or inulin content, fresh, chilled, frozen or dried, whether or not sliced or in the form of pellets; sago pith.",91330927.0
201510,801,"Coconuts, Brazil nuts and cashew nuts, fresh or dried, whether or not shelled or peeled.",78483.0
201510,802,"Other nuts, fresh or dried, whether or not shelled or peeled.",308918451.0
201510,803,"Bananas, including plantains, fresh or dried.",7794919.0
201510,804,"Dates, figs, pineapples, avocados, guavas, mangoes and mangosteens, fresh or dried.",54808120.0
201510,805,"Citrus fruit, fresh or dried.",1128864417.0
201510,806,"Grapes, fresh or dried.",1222259517.0
201510,807,"Melons (including watermelons) and papaws (papayas), fresh.",133412116.0
201510,808,"Apples, pears and quinces, fresh.",960529157.0
201510,809,"Apricots, cherries, peaches (including nectarines), plums and sloes, fresh.",193120439.0
201510,810,Other fresh fruits,670290028.0
201510,811,"Fruit and nuts, uncooked or cooked by steaming or boiling in water, frozen, whether or not containing added sugar or other sweetening matter.",173665003.0
201510,812,"Fruit and nuts, provisionally preserved (for example, by sulphurdioxide gas, in brine, in sulphur water or in other preservativesolutions), but unsuitable in that state for immediateconsumption.",58128650.0
201510,813,"Fruit, dried, other than that of headings 08.01 to 08.06; mixtures of nuts or dried fruits of this Chapter.",67739678.0
201510,814,"Peel of citrus fruit or melons (including watermelons), fresh, frozen, dried or provisionally preserved in brine, in sulphur water or in other preservative solutions.",1287354.0
201510,901,"Coffee, whether or not roasted or decaffeinated; coffee husks and skins; coffee substitutes containing coffee in any proportion.",148756465.0
201510,902,"Tea, whether or not flavoured.",771770184.0
201510,904,Pepper of the genus Piper; dried or crushed or ground fruits of the genus Capsicum or of the genus Pimenta.,170830409.0
201510,906,Cinnamon and cinnamontree flowers.,45662608.0
201510,907,"loves (whole fruit, cloves and stems).",120887.0
201510,908,"Nutmeg, mace and cardamoms.",438554.0
201510,909,"Seeds of anise, badian, fennel, coriander, cumin or caraway; juniper berries.",8563670.0
201510,910,"Ginger, saffron, turmeric (curcuma), thyme, bay leaves, curry and other spices.",225849353.0
201510,1003,Barley,44312.0
201510,1004,Oats,313463.0
201510,1005,Maize (corn).,3363661.0
201510,1006,Rice.,148093358.0
201510,1007,Grain sorghum.,2320707.0
201510,1008,"Buckwheat, millet and canary seeds; other cereals.",27992508.0
201510,1101,Wheat or meslin flour.,31772764.0
201510,1102,Cereal flours other than of wheat or meslin.,299770.0
201510,1104,"Cereal grains otherwise worked (for example, hulled, rolled, flaked, pearled, sliced or kibbled), except rice of heading 10.06; germ of cereals, whole, rolled, flaked or ground.",27376968.0
201510,1105,"Flour, meal, powder, flakes, granules and pellets of potatoes.",1196387.0
201510,1106,"Flour, meal and powder of the dried leguminous vegetables of heading 07.13, of sago or of roots or tubers of heading 07.14 or of the products of Chapter 8.",6963496.0
201510,1107,"Malt, whether or not roasted.",67504192.0
201510,1108,tarches; inulin.,48522539.0
201510,1109,"Wheat gluten, whether or not dried.",129189854.0
201510,1201,"Soya beans, whether or not broken.",22737010.0
201510,1202,"Groundnuts, not roasted or otherwise cooked, whether or not shelled or broken.",65940257.0
201510,1204,"Linseed, whether or not broken.",2071374.0
201510,1205,"Rape or colza seeds, whether or not broken.",208711.0
201510,1206,"Sunflower seeds, whether or not broken.",217070046.0
201510,1207,"Other oil seeds and oleaginous fruits, whether or not broken.",134012820.0
201510,1208,"Flours and meals of oil seeds or oleaginous fruits, other than those of mustard.",16310498.0
201510,1209,"Seeds, fruit and spores, of a kind used for sowing.",154316609.0
201510,1211,"lants and parts of plants (including seeds and fruits), of a kind used primarily in perfumery, in pharmacy or for insecticidal, fungicidal or similar purposes, fresh, chilled, frozen or dried, whether or not cut, crushed or powdered.",447432192.0
201510,1212,"Locust beans, seaweeds and other algae, sugar beet and sugar cane, fresh, chilled, frozen or dried, whether or not ground; fruit stones and kernels and other vegetable products (including unroasted chicory roots of the variety Cichorium intybus sativum) of a kind used primarily for human consumption, not elsewhere specified or included.",271928109.0
201510,1213,"Cereal straw and husks, unprepared, whether or not chopped,ground, pressed or in the form of pellets.",6356928.0
201510,1214,"wedes, mangolds, fodder roots, hay, lucerne (alfalfa), clover, sainfoin, forage kale, lupines, vetches and similar forage products, whether or not in the form of pellets.",362740.0
201510,1301,"Lac; natural gums, resins, gumresins and oleoresins (for example, balsams).",3631753.0
201510,1302,"Vegetable saps and extracts; pectic substances, pectinates and pectates; agaragar and other mucilages and thickeners, whether or not modified, derived from vegetable products.",648307090.0
201510,1401,"Vegetable materials of a kind used primarily for plaiting (for example, bamboos, rattans, reeds, rushes, osier, raffia, cleaned, bleached or dyed cereal straw, and lime bark).",43262929.0
201510,1404,Vegetable products not elsewhere specified or included.,30915403.0
201510,1501,"Pig fat (including lard) and poultry fat, other than that of heading 02.09 or 15.03",63243.0
201510,1502,"Fats of bovine animals, sheep or goats, other than those of heading 15.03.",179791.0
201510,1504,"ats and oils and their fractions, of fish or marine mammals, whether or not refined, but not chemically modified.",75671343.0
201510,1505,Wool grease and fatty substances derived therefrom (including lanolin).,39029068.0
201510,1506,"Other animal fats and oils and their fractions, whether or not refined, but not chemically modified.",2798550.0
201510,1507,"oyabean oil and its fractions, whether or not refined, but not chemically modified.",73388015.0
201510,1508,"Groundnut oil and its fractions, whether or not refined, but not chemically modified.",12940518.0
201510,1509,"Olive oil and its fractions, whether or not refined, but not chemically modified.",1994537.0
201510,1511,"Palm oil and its fractions, whether or not refined, but not chemically modified.",308549.0
201510,1512,"unflowerseed, safflower or cottonseed oil and fractions thereof, whether or not refined, but not chemically modified.",1791694.0
201510,1514,"Rape, colza or mustard oil and fractions thereof, whether or not refined, but not chemically modified.",1787076.0
201510,1515,"Other fixed vegetable fats and oils (including jojoba oil) and their fractions, whether or not refined, but not chemically modified.",82060504.0
201510,1516,"Animal or vegetable fats and oils and their fractions, partly or wholly hydrogenated, interesterified, reesterified or elaidinised, whether or not refined, but not further prepared.",345632.0
201510,1517,"Margarine; edible mixtures or preparations of animal or vegetable fats or oils or of fractions of different fats or oils of this Chapter, other than edible fats or oils or their fractions of heading 15.16.",12248835.0
201510,1518,"Animal or vegetable fats and oils and their fractions, boiled, oxidised,dehydrated, sulphurised, blown, polymerised by heat in vacuum or in inert gas or otherwise chemically modified, excluding those of heading 15.16; inedible mixtures or preparations of animal or vegetable fats or oils or of fractions of different fats or oils of this Chapter, not elsewhere specified or included.",42940681.0
201510,1521,"egetable waxes (other than triglycerides), beeswax, other insect waxes and spermaceti, whether or not refined or coloured.",34823389.0
201510,1522,Degras; residues resulting from the treatment of fatty substances or animal or vegetable waxes.,149269.0
201510,1601,"Sausages and similar products, of meat, meat offal or blood; food preparations based on these products.",142797831.0
201510,1602,"Other prepared or preserved meat, meat offal or blood.",817503868.0
201510,1603,"Extracts and juices of meat, fish or crustaceans, molluscs or other aquatic invertebrates.",7424941.0
201510,1604,Prepared or preserved fish; caviar and caviar substitutes prepared from fish eggs.,1391708857.0
201510,1605,"rustaceans, molluscs and other aquatic invertebrates, prepared or preserved.",1793769631.0
201510,1701,"Cane or beet sugar and chemically pure sucrose, in solid form.",21079404.0
201510,1702,"Other sugars, including chemically pure lactose, maltose, glucose and fructose, in solid form; sugar syrups not containing added flavouring or colouring matter; artificial honey, whether or not mixed with natural honey; caramel.",341640475.0
201510,1703,olasses resulting from the extraction or refining of sugar.,1852658.0
201510,1704,"ugar confectionery (including white chocolate), not containing cocoa.",472701517.0
201510,1803,"Cocoa paste, whether or not defatted.",7672043.0
201510,1804,"Cocoa butter, fat and oil",35801047.0
201510,1805,"Cocoa powder, not containing added sugar or other sweetening matter",10300541.0
201510,1806,hocolate and other food preparations containing cocoa.,215514802.0
201510,1901,"Malt extract; food preparations of flour, groats, meal, starch or malt extract, not containing cocoa or containing less than 40% by weight of cocoa calculated on a totally defatted basis, not elsewhere specified or included; food preparations of goods of headings 04.01 to 04.04,not containing cocoa or containing less than 5% by weight of cocoa calculated on a totally efatted basis, not elsewhere specified or included.",43042658.0
201510,1902,"Pasta, whether or not cooked or stuffed (with meat or other substances) or otherwise prepared, such as spaghetti, macaroni, noodles, lasagne, gnocchi, ravioli, cannelloni; couscous, whether or not prepared.",441444549.0
201510,1903,"Tapioca and substitutes therefor prepared from starch, in the form of flakes, grains, pearls, siftings or in similar forms",4240049.0
201510,1904,"repared foods obtained by the swelling or roasting of cereals or cereal products (for example, corn flakes); cereals (other than maize (corn)) in grain form or in the form of flakes or other worked grains (except flour, groats and meal), precooked, or otherwise prepared, not elsewhere specified or included.",109979754.0
201510,1905,"read, pastry, cakes, biscuits and other bakers' wares, whether or not containing cocoa; communion wafers, empty cachets of a kind suitable for pharmaceutical use, sealing wafers, rice paper and similar products.",195877652.0
201510,2001,"Vegetables, fruit, nuts and other edible parts of plants, prepared or preserved by vinegar or acetic acid.",95154176.0
201510,2002,Tomatoes prepared or preserved otherwise than by vinegar or acetic acid.,501953494.0
201510,2003,"Mushrooms and truffles, prepared or preserved otherwise than by vinegar or acetic acid.",240684815.0
201510,2004,"Other vegetables prepared or preserved otherwise than by vinegar or acetic acid, frozen, other than products of heading 20.06.",147810566.0
201510,2005,"Other vegetables prepared or preserved otherwise than by vinegar or acetic acid, not frozen, other than products of heading 20.06.",1012516159.0
201510,2006,"Vegetables, fruit, nuts, fruitpeel and other parts of plants, preserved by sugar (drained, glacé or crystallised).",123835595.0
201510,2007,"Jams, fruit jellies, marmalades, fruit or nut purée and fruit or nut pastes, obtained by cooking, whether or not containing added sugar or other sweetening matter.",52337809.0
201510,2008,"Fruit, nuts and other edible parts of plants, otherwise prepared or preserved, whether or not containing added sugar or other sweetening matter or spirit, not elsewhere specified or included.",1295742602.0
201510,2009,"ruit juices (including grape must) and vegetable juices, unfermented and not containing added spirit, whether or not containing added sugar or other sweetening matter.",470315344.0
201510,2101,"Extracts, essences and concentrates, of coffee, tea or maté and preparations with a basis of these products or with a basis of coffee, tea or mate; roasted chicory and other roasted coffee substitutes, and extracts, essences and concentrates thereof",289031544.0
201510,2102,"Yeasts (active or inactive); other singlecell microorganisms, dead (but not including vaccines of heading 30.02); prepared baking powders.",143020926.0
201510,2103,"Sauce and preparations therefor; mixed condiments and mixed seasonings; mustard flour and meal, whether or not prepared, and mustard",504371861.0
201510,2104,Soups and broths and preparations therefor; homogenised composite food preparations.,31263339.0
201510,2105,"Ice cream and other edible ice, whether or not containing cocoa.",10543472.0
201510,2106,Food preparations not elsewhere specified or included.,674785741.0
201510,2201,"Waters, including natural or artificial mineral waters andaerated waters, not containing added sugar or other sweeteningmatter nor flavoured; ice and snow.",43539950.0
201510,2202,"Waters, including mineral waters and aerated waters, containing added sugar or other sweetening matter or flavoured, and other nonalcoholic beverages, not including fruit or vegetable juices of heading 20.09.",98325348.0
201510,2203,Beer made from malt.,100964519.0
201510,2204,"Wine of fresh grapes, including fortified wines; grape must other than that of heading 20.09.",250960241.0
201510,2205,Vermouth and other wine of fresh grapes flavoured with plants or aromatic substances.,439664.0
201510,2206,"Other fermented beverages (for example, cider, perry, mead, saké); mixtures of fermented beverages and mixtures of fermented beverages and nonalcoholic beverages, not elsewhere specified or included.",18218567.0
201510,2207,"Undenatured ethyl alcohol of an alcoholic strength by volume of 80% vol.or higher; ethyl alcohol and other spirits, denatured, of any strength.",7862588.0
201510,2208,"Undenatured ethyl alcohol of an alcoholic strength by volume of Undenatured ethyl alcohol of an alcoholic strength by volume of less than 80% vol.; spirits, liqueurs and other spirituous beverages.",280582183.0
201510,2209,Vinegar and substitutes for vinegar obtained from acetic acid.,7222385.0
201510,2302,"Bran, sharps and other residues, whether or not in the form of pellets, derived from the sifting, milling or other working of cereals or of leguminous plants.",4725451.0
201510,2303,"Residues of starch manufacture and similar residues, beetpulp, bagasse and other waste of sugar manufacture, brewing ordistilling dregs and waste, whether or not in the form of pellets.",63956790.0
201510,2304,"Oilcake and other solid residues, whether or not ground or in the form of pellets, resulting from the extraction of soyabean oil.",290403799.0
201510,2305,"Oilcake and other soli residues, whether or not ground or in the form of pellets, resulting from the extraction of groundnut oil.",603557.0
201510,2306,"Oilcake and other solid residues, whether or not ground or in the form of pellets, resulting from the extraction of vegetable fats or oils,other than those of heading 23.04 or 23.05.",19874563.0
201510,2308,"Vegetable materials and vegetable waste, vegetable residues and byproducts, whether or not in the form of pellets, of a kind used in animal feeding, not elsewhere specified or included.",32442697.0
201510,2309,Preparations of a kind used in animal feeding.,855139517.0
201510,2401,Unmanufactured tobacco; tobacco refuse.,228822796.0
201510,2402,"Cigars, cheroots, cigarillos and cigarettes, of tobacco or of tobacco substitutes.",283072070.0
201510,2403,Other manufactured tobacco and manufactured tobacco substitutes; “homogenised” or reconstituted” tobacco; tobacco extracts and essences.,100201775.0
201510,2501,"Salts, incl. table salt and denatured salt, and pure sodium chloride, whether or not in aqueous solution or containing added anti-caking or free-flowing agents; sea water",44893958.0
201510,2502,Unroasted iron pyrites.,1200542.0
201510,2503,"Sulphur of all kinds (excluding sublimed sulphur, precipitated sulphur and colloidal sulphur)",312423.0
201510,2504,Natural graphite.,139686493.0
201510,2505,"Natural sands of all kinds, whether or not coloured, other than metalbearing sands of Chapter 26.",10951252.0
201510,2506,"Quartz (excluding natural sands); quartzite, whether or not roughly trimmed or merely cut, by sawing or otherwise, into blocks or slabs of a square or rectangular shape",36538842.0
201510,2507,"Kaolin and other kaolinic clays, whether or not calcined",48991467.0
201510,2508,"Other clays (not including expanded clays of heading 68.06), andalusite, kyanite and sillimanite, whether or not calcined; mullite; chamotte or dinas earths.",106875928.0
201510,2509,Chalk.,4393777.0
201510,2510,"Natural calcium phosphates, natural aluminium calcium phosphates and phosphatic chalk.",616732.0
201510,2511,"Natural barium sulphate (barytes); natural barium carbonate (witherite), whether or not calcined, other than barium oxide of heading 28.16.",102677119.0
201510,2512,"Siliceous fossil meals, e.g. kieselguhr, tripolite and diatomite, and similar siliceous earths, whether or not calcined, of an apparent specific gravity of 1 or less.",2390221.0
201510,2513,"Pumice stone; emery; natural corundum, natural garnet and other natural abrasives, whether or not heat-treated",5345136.0
201510,2514,"Slate, whether or not roughly trimmed or merely cut, by sawing or otherwise, into blocks or slabs of a square or rectangular shape; slate powder and slate refuse",8582276.0
201510,2515,"Marble, travertine, ecaussine and other calcareous monumental or building stone of an apparent specific gravity of 2.5 or more, and alabaster, whether or not roughly trimmed or merely cut, by sawing or otherwise, into blocks or slabs of a rectangular (including square) shape.",2852175.0
201510,2516,"Granite, porphyry, basalt, sandstone and other monumental or building stone, whether or not roughly trimmed or merely cut, by sawing or otherwise, into blocks or slabs of a rectangular (including square) shape.",41995015.0
