Date of data,Commodity code,Commodity,US dollar
201504,732394,"Table, kitchen or other household articles, and parts thereof, of iron other than cast iron or steel other than stainless, enamelled (excluding cans, boxes and similar containers of heading 7310; waste baskets; shovels, corkscrews and other articles of the nature of a work implement; articles of cutlery, spoons, ladles, forks etc. of heading 8211 to 8215; ornamental articles; sanitary ware; articles for table use)",175743.0
201504,732399,"Table, kitchen or other household articles, and parts thereof, of iron other than cast iron or steel other than stainless (excluding enamelled articles; cans, boxes and similar containers of heading 7310; waste baskets; shovels and other articles of the nature of a work implement; cutlery, spoons, ladles etc. of heading 8211 to 8215; ornamental articles; sanitary ware)",675587.0
201504,732410,"Sinks and washbasins, of stainless steel",510250.0
201504,732421,"Baths of cast iron, whether or not enamelled",134330.0
201504,732429,Baths of steel sheet,509921.0
201504,732490,"Sanitary ware, incl. parts thereof (excluding cans, boxes and similar containers of heading 7310, small wall cabinets for medical supplies or toiletries and other furniture of chapter 94, and fittings, complete sinks and washbasins, of stainless steel, complete baths and fittings)",1780572.0
201504,732510,"Articles of non-malleable cast iron, n.e.s.",1863032.0
201504,732591,"Grinding balls and similar articles for mills, cast (excluding such articles of non-malleable cast iron)",47813.0
201504,732599,"Cast articles of iron or steel, n.e.s. (excluding articles of non-malleable cast iron, and grinding balls and similar articles for mills)",2556664.0
201504,732611,"Grinding balls and similar articles for mills, of iron or steel, forged or stamped, but not further worked",19292.0
201504,732619,"Articles of iron or steel, forged or stamped, but not further worked, n.e.s. (excluding grinding balls and similar articles for mills)",29768509.0
201504,732620,"Articles of iron or steel wire, n.e.s.",3611192.0
201504,732690,"Articles of iron or steel, n.e.s. (excluding cast articles or articles of iron or steel wire)",156825038.0
201504,740100,Copper mattes; cement copper (precipitated copper).,2598061.0
201504,740200,Unrefined copper; copper anodes for electrolytic refining.,271002684.0
201504,740311,Cathodes and sections of cathodes,2008251743.0
201504,740313,Billets,1555223.0
201504,740319,Other,526927.0
201504,740321,Copperzincbasealloys(brass),9730154.0
201504,740322,Coppertinbasealloys(bronze),5148248.0
201504,740329,Othercopperalloys(otherthanmasteralloysofheading74.05),1444265.0
201504,740400,Copper waste and scrap.,721475602.0
201504,740500,Master alloys of copper.,1191455.0
201504,740610,Powders of nonlamellar structure,2775023.0
201504,740620,Powders of lamellar structure; flakes,344528.0
201504,740710,"Bars, rods and profiles, of refined copper, n.e.s.",6811562.0
201504,740721,"Bars, rods and profiles, of copper-zinc base alloys brass"", n.e.s.""",28217542.0
201504,740729,"Bars, rods and profiles of copper alloys, n.e.s. (excluding such articles of copper-zinc base alloys brass"")""",2889663.0
201504,740811,"Wire of refined copper, of which the maximum crosssectional dimension exceeds 6 mm",42660375.0
201504,740819,"Wire of refined copper, other",34658658.0
201504,740821,Wire of copper-zinc base alloys (brass),3149691.0
201504,740822,"Wire of copper-nickel alloys (cupro-nickel)or copper-nickel-zinc alloys nickel silver""""",828620.0
201504,740829,"Wire of copper alloys (other than copper-zinc alloys [brass], copper-nickel alloys [cupro-nickel] or copper-nickel-zinc alloys [nickel silver])",3535382.0
201504,740911,"Plates, sheets and strip, of refined copper, in coils, of a thickness of ＞ 0,15 mm",20840676.0
201504,740919,"Plates, sheets and strip, of refined copper, not in coils, of a thickness of ＞ 0,15 mm",2500293.0
201504,740921,"Plates, sheets and strip, of copper-zinc base alloys brass"", of a thickness of ＞ 0,15 mm, in coils""",28420068.0
201504,740929,"Plates, sheets and strip, of copper-zinc base alloys brass"", of a thickness of ＞ 0,15 mm, not in coils""",1182636.0
201504,740931,"Plates, sheets and strip, of copper-tin base alloys bronze"", of a thickness of ＞ 0,15 mm, in coils""",12827378.0
201504,740939,"Plates, sheets and strip, of copper-tin base alloys bronze"", of a thickness of ＞ 0,15 mm, not in coils""",287131.0
201504,740940,"Plates, sheets and strip, of copper-nickel base alloys cupro-nickel"" or copper-nickel-zinc base alloys ""nickel silver"", of a thickness of ＞ 0,15 mm, not in coils""",10156199.0
201504,740990,"Plates, sheets and strip, of copper alloys, of a thickness of ＞ 0,15 mm, other",17015622.0
201504,741011,"Refined copper foil, not backed, of a thickness of ≤ 0,15 mm",90355279.0
201504,741012,"Copper alloy foil, not backed, of a thickness of ≤ 0,15 mm",16199407.0
201504,741021,"Refined copper foil, backed, of a thickness excluding any backing"" of ≤ 0,15 mm""",97942599.0
201504,741022,"Copper alloy foil, backed, of a thickness excluding any backing"" of ≤ 0,15 mm""",866792.0
201504,741110,Tubes and pipes of refined copper,8757143.0
201504,741121,"Tubes and pipes of copper-zinc base alloys brass""""",2564611.0
201504,741122,"Tubes and pipes of copper-nickel base alloys cupro-nickel"" or copper-nickel-zinc base alloys ""nickel silver""""",694651.0
201504,741129,"Tubes and pipes of copper alloys (excluding copper-zinc base alloys brass"", copper-nickel base alloys ""cupro-nickel"" and copper-nickel-zinc base alloys ""nickel silver"")""",983588.0
201504,741210,"Refined copper tube or pipe fittings e.g., couplings, elbows, sleeves""""",1091048.0
201504,741220,"Copper alloy tube or pipe fittings e.g., couplings, elbows, sleeves""""",8196775.0
201504,741300,"Stranded wire, cables, plaited bands and the like, of copper, not electrically insulated.",9680406.0
201504,741510,"Nails and tacks, drawing pins, staples and similar articles",473377.0
201504,741521,"Washers, incl. spring washers and spring lock washers"", of copper""",2992875.0
201504,741529,"Rivets, cotters, cotter pins and the like, not threaded, of copper (excluding spring washers and spring lock washers)",1432007.0
201504,741533,"Screws, bolts, nuts and similar articles, threaded, of copper (other than screw hooks, ring- and eyebolts, lag screws, plugs, bungs and the like, with screw thread)",5429913.0
201504,741539,"Screw hooks, screw rings and the like, threaded, of copper (excluding standard screws and bolts and nuts)",837607.0
201504,741810,"Table, kitchen or other household articles and parts thereof; pot scourers and scouring or polishing pads, gloves and the like",225010.0
201504,741820,Sanitary ware and parts thereof,992101.0
201504,741910,"Chain and parts thereof, of copper (excluding watch chains, necklace chains and the like)",59129.0
201504,741991,"Articles of copper, cast, moulded, stamped or forged, but not further worked, n.e.s.",4150649.0
201504,741999,"Articles of copper, n.e.s.",28140566.0
201504,750110,Nickel mattes,16147503.0
201504,750120,Nickel oxide sinters and other intermediate products of nickel metallurgy,85190624.0
201504,750210,"Nickel, not alloyed",251559214.0
201504,750220,Nickel alloys,347847.0
201504,750400,Nickel powders and flakes.,7846679.0
201504,750511,"Bars, rods, profiles and wire, of non-alloy nickel, n.e.s.",142291.0
201504,750512,"Bars, rods, profiles and wire, of nickel alloys, n.e.s.",7711185.0
201504,750521,Wire of non-alloy nickel,241387.0
201504,750522,Wire of nickel alloys,3107180.0
201504,750610,"Plates, sheets, strip and foil, of non-alloy nickel",3650911.0
201504,750620,"Plates, sheets, strip and foil, of nickel alloys",11210156.0
201504,750711,Tubes and pipes of non-alloy nickel,504441.0
201504,750712,Tubes and pipes of nickel alloys,15811333.0
201504,750720,"Tube or pipe fittings, of nickel",925268.0
201504,750810,"Cloth, grill, netting and fencing, of nickel wire",2064545.0
201504,750890,"Articles of nickel, n.e.s.",12544690.0
201504,760110,"Aluminium, not alloyed",37230348.0
201504,760120,Aluminium alloys,12364682.0
201504,760200,Aluminium waste and scrap.,266970641.0
201504,760310,"Powders of aluminium, of non-lamellar structure",516184.0
201504,760320,"Powders of aluminium, of lamellar structure, and flakes of aluminium",1056816.0
201504,760410,"Bars, rods and profiles, of non-alloy aluminium, n.e.s.",3149713.0
201504,760421,"Hollow profiles of aluminium alloys, n.e.s.",3842122.0
201504,760429,"Bars, rods and solid profiles, of aluminium alloys, n.e.s.",30244161.0
201504,760511,"Wire of non-alloy aluminium, with a maximum cross-sectional dimension of ＞ 7 mm",163415.0
201504,760519,"Wire of non-alloy aluminium, with a maximum cross-sectional dimension of ≤ 7 mm",1029899.0
201504,760521,"Wire of aluminium alloys, with a maximum cross-sectional dimension of ＞ 7 mm",1422384.0
201504,760529,"Wire, of aluminium alloys, having a maximum cross-sectional dimension of ≤ 7 mm",1721935.0
201504,760611,"Plates, sheets and strip, of non-alloy aluminium, of a thickness exceeding 0.2 mm, square or rectangular",5112574.0
201504,760612,"Plates, sheets and strip, of aluminium alloys, of a thickness exceeding 0.2 mm, square or rectangular",103865732.0
201504,760691,"Plates, sheets and strip, of non-alloy aluminium, of a thickness exceeding 0.2 mm",1037552.0
201504,760692,"Plates, sheets and strip, of aluminium alloys, of a thickness exceeding 0.2 mm , other",2315686.0
201504,760711,"Aluminium foil, not backed, rolled but not further worked, of a thickness not exceeding 0.2 mm. (excluding stamping foils of heading 3212, and foil made up as christmas tree decorating material)",10904659.0
201504,760719,"Aluminium foil, not backed, rolled and further worked, of a thickness not exceeding 0.2 mm. (excluding stamping foils of heading 3212, and foil made up as christmas tree decorating material)",51942320.0
201504,760720,"Aluminium foil, backed, of a thickness (excluding any backing) not exceeding 0.2 mm.(excluding stamping foils of heading 3212, and foil made up as christmas tree decorating material)",29277931.0
201504,760810,Tubes and pipes of non-alloy aluminium,1019953.0
201504,760820,Tubes and pipes of aluminium alloys,4495379.0
201504,760900,"Aluminium tube or pipe fittings (for example, couplings, elbows, sleeves).",3279160.0
201504,761010,"Doors, windows and their frames and thresholds for doors",1585321.0
201504,761090,"Structures and parts of structures, of aluminium, n.e.s., and plates, rods, profiles, tubes and the like, prepared for use in structures, of aluminium, n.e.s.",3369171.0
201504,761100,"Aluminium reservoirs, tanks, vats and similar containers, for any material (other than compressed or liquefied gas), of a capacity exceeding 300 l, whether or not lined or heatinsulated, but not fitted with mechanical or thermal equipment.",211377.0
201504,761210,"Collapsible tubular containers, of aluminium",166569.0
201504,761290,"Casks, drums, cans, boxes and similar containers, incl. rigid tubular containers, of aluminium, for any material (other than compressed or liquefied gas), of a capacity of ≤ 300 l, n.e.s.",1826747.0
201504,761300,Aluminium containers for compressed or liquefied gas.,898119.0
201504,761410,"Stranded wire, cables, plaited bands and the like, of aluminium, with steel core, not electrically insulated",6215.0
201504,761490,"Stranded wires, cables, ropes and similar articles, of aluminium (other than with steel core and electrically insulated products)",659.0
201504,761510,"Table, kitchen or other household articles and parts thereof; pot scourers and scouring or polishing pads, gloves and the like",4432272.0
201504,761520,Sanitary ware and parts thereof,23589.0
201504,761610,"Nails, tacks, staples (other than those of heading 83.05), screws, bolts, nuts, screw hooks, rivets, cotters, cotterpins, washers and similar articles",8325407.0
201504,761691,"Cloth, grill, netting and fencing, of aluminium wire",496500.0
201504,761699,Unwrought lead (excluding refined lead and lead containing by weight antimony as the principal other element),42870468.0
201504,780110,"Unwrought lead, refined",22571.0
201504,780191,"Unwrought lead, containing by weight antimony as the principal other element",890056.0
201504,780199,Unwrought lead (excluding refined lead and lead containing by weight antimony as the principal other element),2489886.0
201504,780411,"Sheets, strip and foil of a thickness (excluding any backing) not exceeding 0.2 mm",43311.0
201504,780419,"Lead plates; lead sheets, strip and foil, of a thickness (excluding any backing) exceeding 0,2 mm",74825.0
201504,780420,Powders and flakes,9584.0
201504,780600,Other articles of lead.,456800.0
201504,790111,"Unwrought zinc, not alloyed, containing by weight 99.99% or more of zinc",109331551.0
201504,790112,"Unwrought zinc, not alloyed, containing by weight less than 99.99% of zinc",2239009.0
201504,790120,Unwrought zinc alloys,21262680.0
201504,790200,zinc waste and scrap.,6996251.0
201504,790310,Zinc dust,9594.0
201504,790390,Zinc powders and flakes,464000.0
201504,790400,"Zinc bars, rods, profiles and wire.",1414697.0
201504,790500,"Zinc plates, sheets, strip and foil.",310463.0
201504,790700,Other articles of zinc.,2409811.0
201504,800110,"Unwrought tin, not alloyed",20242081.0
201504,800120,"Unwrought tin, alloys",1639231.0
201504,800300,"Tin bars, rods, profiles and wire.",8956299.0
201504,800700,Other articles of tin.,5353583.0
201504,810110,Tungsten powders,73228.0
201504,810194,"Unwrought tungsten, incl. bars and rods of tungsten obtained simply by sintering",43177.0
201504,810196,"Tungsten bars and rods (other than those obtained simply by sintering), profiles, plates, sheets, strip and foil, n.e.s.",979162.0
201504,810199,Tungsten waste and scrap (excluding ash and residues containing tungsten),1487720.0
201504,810210,Molybdenum powders,393323.0
201504,810295,"Molybdenum bars and rods (other than those obtained simply by sintering), profiles, plates, sheets, strip and foil, n.e.s.",3314382.0
201504,810296,Molybdenum wire,197035.0
201504,810299,"Articles of molybdenum, n.e.s.",633435.0
201504,810320,"Unwrought tantalum, including bars and rods obtained simply by sintering; powders",180278.0
201504,810390,"Articles of tantalum, n.e.s.",4058669.0
201504,810419,"Unwrought magnesium, containing ＜ 99,8% by weight of magnesium",59925.0
201504,810420,Magnesium waste and scrap,12198.0
201504,810430,"Magnesium raspings, turnings and granules, graded according to size; magnesium powders",100105.0
201504,810490,"Articles of magnesium, n.e.s.",452351.0
201504,810520,Cobalt mattes and other intermediate products of cobalt metallurgy; unwrought cobalt; powders,89666771.0
201504,810590,"Articles of cobalt, n.e.s.",4886844.0
201504,810600,"Bismuth and articles thereof, including waste and scrap.",254628.0
201504,810720,Unwrought cadmium; powders,967176.0
201504,810790,"Articles of cadmium, n.e.s.",208127.0
201504,810820,Unwrought titanium; powders,710579.0
201504,810890,"Articles of titanium, nes",40188879.0
201504,810920,Unwrought zirconium; powders,127793.0
201504,810990,"Articles of zirconium, n.e.s.",977499.0
201504,811090,Antimony wrought & articles thereof,5105.0
201504,811100,"Manganese and articles thereof, including waste and scrap.",117288.0
201504,811219,Wrought beryllium and articles thereof,18417.0
201504,811221,Unwrought chromium; chromium powders,414543.0
201504,811229,Wrought chromium and articles thereof,290183.0
201504,811259,Wrought thallium and articles thereof,927.0
201504,811292,"Unwrought hafnium (celtium), niobium (columbium), rhenium, gallium, indium, vanadium and germanium; powders and waste and scrap of these metals (excluding ash and residues containing these metals)",804374.0
201504,811299,"Articles of hafnium (celtium), niobium (columbium), rhenium, gallium, indium, vanadium and germanium, n.e.s.",2865781.0
201504,811300,"Cermets and articles thereof, including waste and scrap.",10320579.0
201504,820110,Spades and shovels,11753.0
201504,820130,"Mattocks, picks, hoes and rakes",5550.0
201504,820140,"Axes, bill hooks and similar hewing tools",10321.0
201504,820150,Secateurs and similar onehanded pruners and shears (including poultry shears),408631.0
201504,820160,"Hedge shears, twohanded pruning shears and similar twohanded shears",224461.0
201504,820190,"Other hand tools of a kind used in agriculture, horticulture or forestry",64112.0
201504,820210,Hand saws,245265.0
201504,820220,Band saw blades,3860273.0
201504,820231,"Circular saw blades, incl. slitting or slotting saw blades, of base metal, with working parts of steel",1663334.0
201504,820239,"Circular saw blades, incl. slitting or slotting saw blades, and parts thereof, of base metal, with working parts of materials other than steel",3095263.0
201504,820240,Chain saw blades,1616850.0
201504,820291,"Straight saw blades, for working metal",854520.0
201504,820299,"Saw blades, incl. toothless saw blades, of base metal (excluding bandsaw blades, circular saw blades, slitting or slotting saw blades, chainsaw blades and straight saw blades for working metal)",8688174.0
201504,820310,"Files, rasps and similar tools",353837.0
201504,820320,"Pliers (including cutting pliers), pincers, tweezers and similar tools",2983241.0
201504,820330,Metal cutting shears and similar tools,132905.0
201504,820340,"Pipecutters, bolt croppers, perforating punches and similar tools",193379.0
201504,820411,"Hand-operated spanners and wrenches, incl. torque meter wrenches, of base metal, non-adjustable",3786985.0
201504,820412,"Hand-operated spanners and wrenches, incl. torque meter wrenches, of base metal, adjustable (excluding tap wrenches)",1294109.0
201504,820420,"Interchangeable spanner sockets, with or without handles",2490325.0
201504,820510,"Drilling, threading or tapping tools",190663.0
201504,820520,Hammers and sledge hammers,246086.0
201504,820530,"Planes, chisels, gouges and similar cutting tools for working wood",87306.0
201504,820540,Screwdrivers,1072987.0
201504,820551,"Household hand tools, non-mechanical, with working parts of base metal, n.e.s.",294690.0
201504,820559,"Hand tools, incl. glaziers' diamonds, of base metal, n.e.s.",5036939.0
201504,820560,Blow lamps,32375.0
201504,820570,"Vices, clamps and the like",1232142.0
201504,820590,Portable forges; hand or pedal operated grinding wheels with frameworks; including sets of articles of two or more of  subheadings of this heading,840313.0
201504,820600,"Tools of two or more of the headings 82.02 to 82.05, put up in sets for retail sale.",3261460.0
201504,820713,"Rock-drilling or earth-boring tools, interchangeable, with working parts of sintered metal carbides or cermets",189172.0
201504,820719,"Rock-drilling or earth-boring tools, interchangeable, and parts therefor, with working parts of materials other than sintered metal carbide or cermets",8208608.0
201504,820720,Dies for drawing or extruding metal,2732065.0
201504,820730,"Tools for pressing, stamping or punching",115944658.0
201504,820740,Tools for tapping or threading,9856077.0
201504,820750,"Tools for drilling, other than for rock drilling",14883317.0
201504,820760,Tools for boring or broaching,4869418.0
201504,820770,Tools for milling,15350096.0
201504,820780,Tools for turning,2002574.0
201504,820790,Other interchangeable tools,8037669.0
201504,820810,"Knives and cutting blades, of base metal, for machines or for mechanical appliances, for metalworking",50451246.0
201504,820820,"Knives and cutting blades, of base metal, for machines or for mechanical appliances, for wood-working",567480.0
201504,820830,"Knives and cutting blades, of base metal, for kitchen appliances or for machines used by the food industry",705462.0
201504,820840,"Knives and cutting blades, of base metal, for agricultural, horticultural or forestry machines (excluding those for wood-working)",2388209.0
201504,820890,"Knives and cutting blades, of base metal, for machines or for mechanical appliances (excluding those for metal or wood-working, kitchen appliances or machines used by the food industry and those for agricultural, horticultural or forestry machines)",14337494.0
201504,820900,"Plates, sticks, tips and the like for tools, unmounted, of cermets.",14367945.0
201504,821000,"Hand-operated mechanical appliances, weighing 10 kg or less, used in the preparation, conditioning or serving of food or drink.",126182.0
201504,821110,Sets of assorted articles,63573.0
201504,821191,Table knives having fixed blades,230748.0
201504,821192,Other knives having fixed blades,344577.0
201504,821193,Knives having other than fixed blades,2557041.0
201504,821194,"Blades of base metal for table knives, pocket knives and other knives of heading 8211",680244.0
201504,821195,Handles of base metal,169658.0
201504,821210,Razors,2970018.0
201504,821220,"Safety razor blades, including razor blade blanks in strips",11856429.0
201504,821290,Parts of non-electric razors of base metal (excluding safety razor blades and razor blade blanks in strips),680211.0
201504,821300,"Scissors, tailors' shears and similar shears, and blades therefor.",615211.0
201504,821410,"Paper knives, letter openers, erasing knives, pencil sharpeners and blades therefor",425549.0
201504,821420,Manicure or pedicure sets and instruments (including nail files),667515.0
201504,821490,"Hair clippers, butchers' or kitchen cleavers and other articles of cutlery of base metal, n.e.s.",785567.0
201504,821510,Sets of assorted articles containing at least one article plated with precious metal,34215.0
201504,821520,Other sets of assorted articles,536428.0
201504,821591,Plated with precious metal,66093.0
201504,821599,"Spoons, forks, ladles, skimmers, cake-servers, fish-knives, butter-knives, sugar tongs and similar kitchen or tableware of base metal, not plated with precious metal (excluding sets of articles such as lobster cutters and poultry shears)",436676.0
201504,830110,Padlocks,99946.0
201504,830120,Locks of a kind used for motor vehicles,20013665.0
201504,830130,Locks of a kind used for furniture,1433203.0
201504,830140,Other locks,8192439.0
201504,830150,"Clasps and frames with clasps, incorporating locks",548690.0
201504,830160,"Parts of padlocks, locks, clasps and frames with clasps, incorporating locks, of base metal, n.e.s.",16368565.0
201504,830170,Keys presented separately,1166115.0
201504,830210,"Hinges of all kinds, of base metal",17377508.0
201504,830220,Castors with mountings of base metal,1846278.0
201504,830230,"Base metal mountings, fittings and similar articles suitable for motor vehicles (excluding hinges and castors)",5225919.0
201504,830241,Base metal mountings and fittings suitable for buildings (excluding locks with keys and hinges),3947148.0
201504,830242,"Base metal mountings, fittings and similar articles suitable for furniture (excluding locks with keys, hinges and castors)",9243248.0
201504,830249,"Base metal mountings, fittings and similar articles (excluding locks with keys, clasps and frames with clasps incorporating locks, hinges, castors and mountings and fittings suitable for buildings, motor vehicles or furniture)",3679696.0
201504,830250,"Hat-racks, hat-pegs, brackets and similar fixtures of base metal",645230.0
201504,830260,Automatic door closers of base metal,2208903.0
201504,830300,"Armoured or reinforced safes, strongboxes and doors and safe deposit lockers for strongrooms, cash or deed boxes and the like, of base metal",423211.0
201504,830400,"Filing cabinets, cardindex cabinets, paper trays, paper rests, pen trays, officestamp stands and similar office or desk equipment, of base metal, other than office furniture of heading 9403",77423.0
201504,830510,"Fittings for loose-leaf binders or files, of base metal (excluding drawing pins and clasps for books or registers)",64682.0
201504,830520,"Staples in strips, of base metal",591697.0
201504,830590,"Office articles such as letter clips, letter corners, paper clips and indexing tags, of base metal, incl. parts of articles of heading 8305 (excluding fittings for loose-leaf binders or files, staples in strips, drawing pins and clasps for books or registers)",75670.0
201504,830610,"Bells, gongs and the like, non-electric, of base metal",59581.0
201504,830621,"Statuettes and other ornaments, of base metal, plated with precious metal",41222.0
201504,830629,"Statuettes and other ornaments, of base metal, not plated with precious metal",2479050.0
201504,830630,"Photograph, picture or similar frames, of base metal; mirrors of base metal",218520.0
201504,830710,"Flexible tubing of iron or steel, with or without fittings",5849544.0
201504,830790,"Flexible tubing of base metal other than iron or steel, with or without fittings",669555.0
201504,830810,"Hooks, eyes and eyelets, of base metal, of a kind used for clothing, footwear, awnings, handbags, travel goods or other made-up articles",10676135.0
201504,830820,"Tubular or bifurcated rivets, of base metal",2903013.0
201504,830890,"Clasps, frames with clasps without locks, buckles and buckle-clasps, of base metal, for clothing, footwear, handbags, travel goods or other made-up articles, incl. parts of articles of heading 8308, of base metal (excluding hooks, eyes, eyelets and tubular or bifurcated rivets)",5541843.0
201504,830910,Crown corks of base metal,45351.0
201504,830990,"Stoppers, caps and lids, incl. screw caps and pouring stoppers, capsules for bottles, threaded bungs, bung covers, seals and other packing accessories of base metal (excluding crow corks)",5635940.0
201504,831000,"Signplates, nameplates, addressplates and similar plates, numbers, letters and other symbols, of base metal, excluding those of heading 9405",6444399.0
201504,831110,"Coated electrodes of base metal, for electric arc-welding",6853003.0
201504,831120,"Cored wire of base metal, for electric arc-welding",10744680.0
