Date of data,Commodity code,Commodity,US dollar
202510,390599,"Polymers of vinyl esters and other vinyl polymers, in primary forms (excluding those of vinyl chloride or other halogenated olefins, polyvinyl acetate"", vinyl acetate copolymers and poly""vinyl alcohol"", whether or not containing unhydrolised acetate groups)""",21729945.0
202510,390610,"Polymethyl methacrylate"", in primary forms""",23432472.0
202510,390690,"Acrylic polymers, in primary forms (excluding polymethyl methacrylate"")""",168870102.0
202510,390710,Polyacetals,54776208.0
202510,390721,"Bis(polyoxyethylene) methylphosphonate, in primary forms",77299.0
202510,390729,"Other polyethers, in primary forms",79380337.0
202510,390730,Epoxide resins,51469591.0
202510,390740,Polycarbonates,143984758.0
202510,390750,Alkyd resins,2010300.0
202510,390761,"Polyethylene terephthalate"", in primary forms, having a viscosity number of 78 ml/g or higher""",5129220.0
202510,390769,"Polyethylene terephthalate"", in primary forms, having a viscosity number of ＜ 78 ml/g""",20204349.0
202510,390770,Poly(lactic acid) in primary forms,9746495.0
202510,390791,Unsaturated polyesters in primary forms,3710307.0
202510,390799,"Saturated polyesters in primary forms (excluding polycarbonates, alkyd resins, polyethylene terephthalate"" and poly""lactic acid"")""",103934503.0
202510,390810,"Polyamide6, 11, 12, 6,6, 6,9, 6,10 or 6,12 ,in primary forms",50313353.0
202510,390890,"Polyamides, in primary forms (excluding polyamides-6, -11, -12, -6,6, -6,9, -6,10 and -6,12)",59689052.0
202510,390910,"Urea resins and thiourea resins, in primary forms",1391643.0
202510,390920,Melamine resins,2280598.0
202510,390931,"Poly(methylene phenyl isocyanate) (crude MDI, polymeric MDI) ,in primary forms",50100198.0
202510,390939,"Amino-resins, in primary forms (excl. urea, thiourea and melamine resins and MDI)",1245034.0
202510,390940,"Phenolic resins,in primary forms",22072889.0
202510,390950,"Polyurethanes,in primary forms",43861054.0
202510,391000,Silicones in primary forms,63511508.0
202510,391110,"Petroleum resins, coumarone, indene or coumaroneindene resins and polyterpenes",7813659.0
202510,391190,"Polysulphides, polysulphones and other polymers and prepolymers produced by chemical synthesis, nes, in primary forms",62349836.0
202510,391211,"Nonplasticised cellulose acetates,in primary forms",15893831.0
202510,391212,"Plasticised cellulose acetates,in primary forms",215806.0
202510,391220,"Cellulose nitrates (including collodions), in primary forms",194729.0
202510,391231,"Carboxymethylcellulose and its salts,in primary forms",4245797.0
202510,391239,"Cellulose ethers, in primary forms (excluding carboxymethylcellulose and its salts)",9387496.0
202510,391290,"Cellulose and chemical derivatives thereof, n.e.s., in primary forms (excluding cellulose acetates, cellulose nitrates and cellulose ethers)",9540728.0
202510,391310,"Alginic acid, its salts and esters,in primary forms",206625.0
202510,391390,"Natural polymers and modified natural polymers, e.g. hardened proteins, chemical derivatives of natural rubber, n.e.s., in primary forms (excluding alginic acid and its salts and esters)",7443929.0
202510,391400,"Ionexchangers based on polymers of headings 39.01 to 39.13, in primary forms",15589696.0
202510,391610,Monofilament of polymers of ethylene,2094313.0
202510,391620,Monofilament of polymers of vinyl chloride,357117.0
202510,391690,Monofilament of other plastics,10138210.0
202510,391710,Artificial guts (sausage casings) of hardened protein or of cellulosic materials,2274296.0
202510,391721,"Rigid tubes, pipes and hoses, of polymers of ethylene",1172398.0
202510,391722,"Rigid tubes, pipes and hoses, of polymers of propylene",882288.0
202510,391723,"Rigid tubes, pipes and hoses, of polymers of vinyl chloride",758079.0
202510,391729,"Rigid tubes, pipes and hoses, of other plastics",6457923.0
202510,391731,"Flexible tubes, pipes and hoses, having a minimum burst pressure of 27.6 Mpa",9535609.0
202510,391732,"Other plastic tubes, not reinforced or otherwise combined with other materials,without fittings",22270858.0
202510,391733,"Other plastic tubes, not reinforced or otherwise combined with other materials,with fittings",3441580.0
202510,391739,"Flexible tubes, pipes and hoses, of plastics, reinforced or otherwise combined with other materials (excluding those with a burst pressure of ≥ 27,6 MPa)",9716210.0
202510,391740,"Fittings for tubes, of plastic",23175959.0
202510,391810,"Wall or floor coverings, of polymers of vinyl chloride",2279162.0
202510,391890,"Wall or floor coverings, of other plastics",1123938.0
202510,391910,"Self-adhesive plates, sheets, film, foil, tape, strip and other flat shapes, of plastics, in rolls ≤ 20 cm wide",30156170.0
202510,391990,"Self-adhesive plates, sheets, film, foil, tape, strip and other flat shapes, of plastics, whether or not in rolls ＞ 20 cm wide (excluding floor, wall and ceiling coverings of heading 3918)",198090839.0
202510,392010,"Plates, sheets, film, foil and strip, of non-cellular polymers of ethylene, not reinforced, laminated, supported or similarly combined with other materials, without backing, unworked or merely surface-worked or merely cut into squares or rectangles (excluding self-adhesive products, and floor, wall and ceiling coverings of heading 3918)",47895464.0
202510,392020,"Plates, sheets, film, foil and strip, of non-cellular polymers of ethylene, not reinforced, laminated, supported or similarly combined with other materials, without backing, unworked or merely surface-worked or merely cut into squares or rectangles (excluding self-adhesive products, and floor, wall and ceiling coverings of heading 3918)",27167375.0
202510,392030,"Plates, sheets, foil, film and strip, of non-cellular polymers of styrene, not reinforced, laminated, supported or similarly combined with other materials, without backing, unworked or merely surface-worked or merely cut into squares or rectangles (excluding self-adhesive products, and floor, wall and ceiling coverings of heading 3918)",6513602.0
202510,392043,"Plates, sheets, film, foil and strip, of non-cellular polymers of vinyl chloride, containing by weight ≥ 6% of plasticisers, not reinforced, laminated, supported or similarly combined with other materials, without backing, unworked or merely surface-worked or merely cut into squares or rectangles (excluding self-adhesive products, and floor, wall and ceiling coverings of heading 3918)",3849627.0
202510,392049,"Plates, sheets, film, foil and strip, of non-cellular polymers of vinyl chloride, containing by weight ＜ 6% of plasticisers, not reinforced, laminated, supported or similarly combined with other materials, without backing, unworked or merely surface-worked or merely cut into squares or rectangles (excluding self-adhesive products, and floor, wall and ceiling coverings of heading 3918)",5511700.0
202510,392051,"Plates, sheets, film, foil and strip, of non-cellular polymethyl methacrylate"", not reinforced, laminated, supported or similarly combined with other materials, without backing, unworked or merely surface-worked or merely cut into squares or rectangles (excluding self-adhesive products, and floor, wall and ceiling coverings of heading 3918)""",26814054.0
202510,392059,"Plates, sheets, film, foil and strip, of non-cellular acrylic polymers, not reinforced, laminated, supported or similarly combined with other materials, without backing, unworked or merely surface-worked or merely cut into squares or rectangles (excluding those of polymethyl methacrylate"", self-adhesive products, and floor, wall and ceiling coverings of heading 3918)""",4347077.0
202510,392061,"Plates, sheets, film, foil and strip, of non-cellular polycarbonates, not reinforced, laminated, supported or similarly combined with other materials, without backing, unworked or merely surface-worked or merely cut into squares or rectangles (excluding those of polymethyl methacrylate"", self-adhesive products, and floor, wall and ceiling coverings of heading 3918)""",8400916.0
202510,392062,"Plates, sheets, film, foil and strip, of non-cellular polyethylene terephthalate"", not reinforced, laminated, supported or similarly combined with other materials, without backing, unworked or merely surface-worked or merely cut into squares or rectangles (excluding those of poly""methyl methacrylate"", self-adhesive products, and floor, wall and ceiling coverings of heading 3918)""",147423124.0
202510,392063,"Plates, sheets, film, foil and strip, of non-cellular unsaturated polyesters, not reinforced, laminated, supported or similarly combined with other materials, without backing, unworked or merely surface-worked or merely cut into squares or rectangles (excluding those of polymethyl methacrylate"", self-adhesive products, and floor, wall and ceiling coverings of heading 3918)""",5505.0
202510,392069,"Plates, sheets, film, foil and strip, of non-cellular polyesters, not reinforced, laminated, supported or similarly combined with other materials, not worked or only surface-worked, or only cut to rectangular, incl. square, shapes (excluding polycarbonates, polythylene terephthalate and other unsaturated polyesters, self-adhesive products, and floor, wall and ceiling coverings in heading 3918)",7670677.0
202510,392071,"Plates, sheets, film, foil and strip, of non-cellular regenerated cellulose, not reinforced, laminated, supported or similarly combined with other materials, without backing, unworked or merely surface-worked or merely cut into squares or rectangles (excluding self-adhesive products, and floor, wall and ceiling coverings of heading 3918)",42741.0
202510,392073,"Plates, sheets, film, foil and strip, of non-cellular cellulose acetates, not reinforced, laminated, supported or similarly combined with other materials, without backing, unworked or merely surface-worked or merely cut into squares or rectangles (excluding self-adhesive products, and floor, wall and ceiling coverings of heading 3918)",56235423.0
202510,392079,"Plates, sheets, film, foil and strip, of non-cellular cellulose derivatives, not reinforced, laminated, supported or similarly combined with other materials, without backing, unworked or merely surface-worked or merely cut into squares or rectangles (excluding products of cellulose acetates, self-adhesive products, floor, wall and ceiling coverings of heading 3918)",1609420.0
202510,392091,"Plates, sheets, film, foil and strip, of non-cellular polyvinyl butyral"", not reinforced, laminated, supported or similarly combined with other materials, without backing, unworked or merely surface-worked or merely cut into squares or rectangles (excluding self-adhesive products, floor, wall and ceiling coverings of heading 3918)""",12547849.0
202510,392092,"Plates, sheets, film, foil and strip, of non-cellular polyamides, not reinforced, laminated, supported or similarly combined with other materials, without backing, unworked or merely surface-worked or merely cut into squares or rectangles (excluding self-adhesive products, floor, wall and ceiling coverings of heading 3918)",6108030.0
202510,392093,"Plates, sheets, film, foil and strip, of non-cellular amino-resins, not reinforced, laminated, supported or similarly combined with other materials, without backing, unworked or merely surface-worked or merely cut into squares or rectangles (excluding self-adhesive products, floor, wall and ceiling coverings of heading 3918)",259539.0
202510,392094,"Plates, sheets, film, foil and strip, of non-cellular phenolic resins, not reinforced, laminated, supported or similarly combined with other materials, without backing, unworked or merely surface-worked or merely cut into squares or rectangles (excluding self-adhesive products, floor, wall and ceiling coverings of heading 3918)",459273.0
202510,392099,"Plates, sheets, film, foil and strip, of non-cellular plastics, n.e.s., not reinforced, laminated, supported or similarly combined with other materials, without backing, unworked or merely surface-worked or merely cut into squares or rectangles (excluding self-adhesive products, floor, wall and ceiling coverings of heading 3918 and sterile surgical or dental adhesion barriers of subheading 3006.10.30)",142837569.0
202510,392111,"Plates, sheets, film, foil and strip, of polymers of styrene",265802.0
202510,392112,"Plates, sheets, film, foil and strip, of polymers of vinyl chloride",6318786.0
202510,392113,"Plates, sheets, film, foil and strip, of polyurethanes",14685780.0
202510,392114,"Plates, sheets, film, foil and strip, of regenerated cellulose",62791.0
202510,392119,"Plates, sheets, film, foil and strip, of other plastics",33547286.0
202510,392190,"Plates, sheets, film, foil and strip, (excluding of cellular plastic; self-adhesive products, floor, wall and ceiling coverings of heading 3918)",44686306.0
202510,392210,"Baths, showerbaths, sinks and washbasins,of plastics",1831499.0
202510,392220,Lavatory seats and covers,482697.0
202510,392290,"Bidets, lavatory pans, flushing cisterns and similar sanitary ware, of plastics (excluding baths, shower-baths, sinks, washbasins, lavatory seats and covers)",800923.0
202510,392310,"Boxes, cases, crates and similar articles",32686850.0
202510,392321,"Sacks and bags, incl. cones, of polymers of ethylene",8635101.0
202510,392329,"Sacks and bags, incl. cones, of other plastics",4557083.0
202510,392330,"Carboys, bottles, flasks and similar articles, of plastics",4184672.0
202510,392340,"Spools, cops, bobbins and similar supports, of plastics",2988099.0
202510,392350,"Stoppers, lids, caps and other closures, of plastics",11362967.0
202510,392390,"Articles for the conveyance or packaging of goods, of plastics (excluding boxes, cases, crates and similar articles; sacks and bags, incl. cones; carboys, bottles, flasks and similar articles; spools, spindles, bobbins and similar supports; stoppers, lids, caps and other closures)",26113722.0
202510,392410,"Tableware and kitchenware, of plastics",4667156.0
202510,392490,"Household articles and toilet articles, of plastics (excluding tableware, kitchenware, baths, shower-baths, washbasins, bidets, lavatory pans, seats and covers, flushing cisterns and similar sanitary ware)",8335029.0
202510,392510,"Reservoirs, tanks, vats and similar containers, of a capacity exceeding 300 l, of plastics",754093.0
202510,392520,"Doors, windows and their frames and thresholds for doors, of plastics",701548.0
202510,392530,"Shutters, blinds (including Venetian blinds) and similar articles and parts thereof, of plastics",75148.0
202510,392590,"Builderss ware of plastics, nes",1174347.0
202510,392610,"Office or school supplies, of plastics",1039760.0
202510,392620,"Articles of apparel and clothing accessories (including gloves, mittens and mitts), of plastics",2227016.0
202510,392630,"Fittings for furniture, coachwork or the like, of plastics",3028607.0
202510,392640,"Statuettes and other ornamental articles, of plastics",1382480.0
202510,392690,"Articles of plastics and articles of other materials of heading 3901 to 3914, n.e.s (excluding goods of 9619)",272585357.0
202510,400110,"Natural rubber latex, whether or not prevulcanised",42587751.0
202510,400121,Smoked sheets,65750663.0
202510,400122,Technically specified natural rubber (TSNR),226663578.0
202510,400129,"Natural rubber in primary forms or in plates, sheets or strip (excluding smoked sheets, technically specified natural rubber TSNR"" and natural rubber latex, whether or not prevulcanised)""",101756317.0
202510,400130,"Balata, guttapercha, guayule, chicle and similar natural gums",1152.0
202510,400211,Latex,13268549.0
202510,400219,"Styrene-butadiene rubber SBR""; carboxylated styrene-butadiene rubber ""XSBR"", in primary forms or in plates, sheets or strip (excluding latex)""",89917470.0
202510,400220,Butadiene rubber (BR),39392217.0
202510,400231,Isobuteneisoprene (butyl) rubber (IIR),13004774.0
202510,400239,"Halo-isobutene-isoprene rubber CIIR"" or ""BIIR"", in primary forms or in plates, sheets or strip""",20511613.0
202510,400241,"Chloroprene latex chlorobutadiene rubber, CR""""",595122.0
202510,400249,"Chloroprene chlorobutadiene rubber, CR"", in primary forms or in plates, sheets or strip (excluding latex)""",5105927.0
202510,400251,"Latex of acrylonitrile-butadiene rubber NBR""""",12968956.0
202510,400259,"Acrylonitrile-butadiene rubber NBR"", in primary forms or in plates, sheets or strip (excluding latex)""",19008832.0
202510,400260,Isoprene rubber (IR),20622348.0
202510,400270,Ethylenepropylenenonconjugated diene rubber (EPDM),37138419.0
202510,400280,Mixtures of any product of heading 40.01 with any product of this heading,463644038.0
202510,400291,Latex,516007.0
202510,400299,"Synthetic rubber and factice derived from oils, in primary forms or in plates, sheets or strip (excluding latex, styrene-butadiene rubber SBR"", carboxylated styrene-butadiene rubber ""XSBR"", butadiene rubber ""BR"", isobutylene isoprene rubber ""IIR"", halo-isobutene-isoprene rubber ""CIIR"" or ""BIIR"", chloroprene rubber ""CR"", acrylonitrile-butadiene rubber ""NBR"", isoprene rubber ""IR"" and non-conjugated ethylene-propylene diene rubber ""EPDM"")""",18677849.0
202510,400300,"Reclaimed rubber in primary forms or in plates, sheets or strip.",10380442.0
202510,400400,"Waste, parings and scrap of rubber (other than hard rubber) and powders and granules obtained therefrom",967679.0
202510,400510,"Compounded rubber with carbon black or silica, unvulcanized",17082392.0
202510,400520,Solutions of unvulcanized compounded rubber; dispersions other than those of subheading 4005.10,1770465.0
202510,400591,"Compounded rubber, unvulcanised, in the form of plates, sheets or strip",3055157.0
202510,400599,"Other compounded, unvulcanised rubber in primary forms",2430050.0
202510,400610,Camel-back strips for retreading rubber tyres,50586.0
202510,400690,"Rods, bars, tubes, profiles and other forms of unvulcanised rubber, incl. mixed rubber, and articles of unvulcanised rubber, incl. mixed rubber (excluding plates, sheets and strip which, apart from basic surface-working, have not been cut, or have merely been cut into square or rectangular shapes, and 'camel-back' strips)",726971.0
202510,400700,Vulcanised rubber thread and cord.,18937320.0
202510,400811,"Plates, sheets and strip, of cellular rubber",3621507.0
202510,400819,"Rods and profile shapes, of cellular rubber",265725.0
202510,400821,"Plates, sheets and strip, of non-cellular rubber",9891019.0
202510,400829,"Rods, tubes and profile shapes, of non-cellular rubber",911638.0
202510,400911,"Tubes, pipes and hoses, of vulcanised rubber (excluding hard rubber), not reinforced or otherwise combined with other materials, without fittings",4743842.0
202510,400912,"Tubes, pipes and hoses, of vulcanised rubber (excluding hard rubber), not reinforced or otherwise combined with other materials, with fittings",1976559.0
202510,400921,"Tubes, pipes and hoses, of vulcanised rubber (excluding hard rubber), reinforced or otherwise combined only with metal, without fittings",4208830.0
202510,400922,"Tubes, pipes and hoses, of vulcanised rubber (excluding hard rubber), reinforced or otherwise combined only with metal, with fittings",2372705.0
202510,400931,"Tubes, pipes and hoses, of vulcanised rubber (excluding hard rubber), reinforced or otherwise combined only with textile materials, without fittings",9209577.0
202510,400932,"Tubes, pipes and hoses, of vulcanised rubber (excluding hard rubber), reinforced or otherwise combined only with textile materials, with fittings",6530407.0
202510,400941,"Tubes, pipes and hoses, of vulcanised rubber (excluding hard rubber), reinforced or otherwise combined with materials other than metal or textile materials, without fittings",2859341.0
202510,400942,"Tubes, pipes and hoses, of vulcanised rubber (excluding hard rubber), reinforced or otherwise combined with materials other than metal or textile materials, with fittings",2911656.0
202510,401011,"Conveyor belts or belting, of vulcanised rubber, reinforced only with metal",1883992.0
202510,401012,"Conveyor belts or belting, of vulcanised rubber, reinforced only with textile materials",871147.0
202510,401019,"Conveyor belts or belting, of vulcanised rubber (excluding reinforced only with metal or only with textile materials)",407672.0
202510,401031,"Endless transmission belts of trapezoidal crosssection (Vbelts), Vribbed, of an outside circumference exceeding 60 cm but not exceeding 180 cm",2055257.0
202510,401032,"Endless transmission belts of trapezoidal crosssection (Vbelts), other than Vribbed, of an outside circumference exceeding 60 cm but not exceeding 180 cm",1292988.0
202510,401033,"Endless transmission belts of trapezoidal crosssection (Vbelts), Vribbed, of an outside circumference exceeding 180 cm but not exceeding 240 cm",311755.0
202510,401034,"Endless transmission belts of trapezoidal crosssection (Vbelts), other than Vribbed, of an outside circumference exceeding 180 cm but not exceeding 240 cm",366518.0
202510,401035,"Endless synchronous belts, of an outside circumference exceeding 60 cm but not exceeding 150 cm",1563942.0
202510,401036,"Endless synchronous belts, of an outside circumference exceeding 150 cm but not exceeding 198 cm",288757.0
202510,401039,"Other transmission belts or belting, of valcanized rubber",7568491.0
202510,401110,"New pneumatic tyres, of rubber, of a kind used on motor cars (including station wagons and racing cars)",24201413.0
202510,401120,"New pneumatic tyres, of rubber, of a kind used on buses or lorries",6402608.0
202510,401130,"New pneumatic tyres, of rubber, of a kind used on aircraft",6758996.0
202510,401140,"New pneumatic tyres, of rubber, of a kind used on motorcycles",2415873.0
202510,401150,"New pneumatic tyres, of rubber, of a kind used on bicycles",1553299.0
202510,401170,"New pneumatic tyres, of rubber, of a kind used on agricultural or forestry vehicles and machines",133542.0
202510,401180,"New pneumatic tyres, of rubber, of a kind used on construction, mining or industrial handling vehicles and machines",27010378.0
202510,401190,"Other new pneumatic tyres, of rubber, o",231327.0
202510,401213,"Retreaded pneumatic tyres, of rubber, of a kind used on aircraft",4404935.0
202510,401220,Used pneumatic tyres,6783.0
202510,401290,"Solid or cushion tyres, interchangeable tyre treads and tyre flaps, of rubber",1081110.0
202510,401310,"Inner tubes, of rubber, of a kind used on motor cars (including station wagons and racingcars), buses or lorries",664.0
202510,401320,"Inner tubes, of rubber, of a kind used on bicycles",70924.0
202510,401390,"Inner tubes, of rubber (excluding those of a kind used on motor cars, incl. station wagons and racing cars, buses, lorries and bicycles)",40599.0
202510,401410,"Sheath contraceptives, of valcanized rubber",12597181.0
202510,401490,"Hygienic or pharmaceutical articles, incl. teats, of vulcanised rubber (excluding hard rubber), with or without fittings of hard rubber, n.e.s. (excluding sheath contraceptives and articles of apparel and clothing accessories, incl. gloves, for all purposes)",499106.0
202510,401512,"Gloves, mittens and mitts of vulcanised rubber, Of a kind used for medical, surgical, dental or veterinarypurposes",6972815.0
202510,401519,"Gloves, mittens and mitts, of vulcanised rubber (excluding surgical gloves)",17098934.0
202510,401590,"Articles of apparel and clothing accessories, for all purposes, of vulcanised rubber (excluding hard rubber and footwear and headgear and parts thereof, and gloves, mittens and mitts)",287870.0
202510,401610,"Articles of cellular rubber, of valcanized rubber",2866181.0
202510,401691,"Floor coverings and mats, of valcanized rubber",297366.0
202510,401692,"Erasers, of valcanized rubber",100087.0
202510,401693,"Gaskets, washers and other seals,of valcanized rubber",88782771.0
202510,401694,"Boat or dock fenders, whether or not inflatable, of valcanized rubber",73881.0
202510,401695,"Other inflatable articles, of valcanized rubber",4532525.0
202510,401699,"Articles of vulcanised rubber (excluding hard rubber), n.e.s",61880550.0
202510,401700,"Hard rubber (for example, ebonite) in all forms, including waste and scrap; articles of hard rubber",527125.0
202510,410120,"Whole hides and skins, unsplit, of a weight per skin not exceeding 8 kg when simply dried, 10 kg when drysalted, or 16 kg when fresh, wetsalted or otherwise preserved",4398041.0
202510,410150,"Whole hides and skins, of a weight exceeding 16 kg",67031434.0
202510,410190,"Other raw hides and skins of bovine animals, including butts, bends and bellies",8669.0
202510,410210,"Raw skins of sheep or lambs, with wool on, fresh or salted, dried, limed, pickled or otherwise preserved (excluding those of Astrakhan, Caracul, Persian, Broadtail or similar lambs, or of Indian, Chinese, Mongolian or Tibetan lambs and tanned, parchment-dressed or further prepared)",13609335.0
202510,410320,"Raw hides and skins of reptiles, fresh or salted, dried, limed, pickled or otherwise preserved (excluding tanned, parchment-dressed or further prepared)",116412.0
202510,410330,"Raw hides and skins of swine, fresh, or salted, dried, limed, pickled or otherwise preserved, whether or not dehaired or split (excluding tanned, parchment-dressed or further prepared)",152228.0
202510,410390,"Raw hides and skins, fresh, or salted, dried, limed, pickled or otherwise preserved, whether or not dehaired, incl. birdskins without feathers or down (excluding tanned, parchment-dressed or further prepared, hides and skins of bovine incl. buffalo"" animals, equine animals, sheep, lambs, reptiles and s""",210548.0
202510,410411,"Full grains, unsplit and grain splits, in the wet state incl. wet-blue"", of hides and skins of bovine ""incl. buffalo"" or equine animals, tanned, without hair on (excluding further prepared)""",26293062.0
