Date of data,Commodity code,Commodity,US dollar
201504,10121,Purebred breeding horses,338290.0
201504,10129,Other horses,2410085.0
201504,10221,Purebred breeding cattle,20663100.0
201504,10290,Other live bovine animals,10346800.0
201504,10511,"Fowls of the species Gallus omesticus, weighing not more than 185 g",2193667.0
201504,10612,"Whales, dolphins and porpoises (mammals of the order Cetacea); manatees and dugongs (mammals of the order Sirenia); seals, sea lions and walruses (mammals of the suborder Pinnipedia)",343000.0
201504,10613,Camels and other camelids (Camelidae),133037.0
201504,10614,Rabbits and hares,169273.0
201504,10619,Other mammals,597284.0
201504,10620,Reptiles (including snakes and turtles),706229.0
201504,10632,"Psittaciformes (including parrots, parakeets, macaws and cockatoos)",32500.0
201504,10639,Other birds,589535.0
201504,10641,Bees,46861.0
201504,10649,Other insects,746.0
201504,20120,Other cuts with bone in,101581.0
201504,20130,Boneless,2579532.0
201504,20220,Other cuts with bone in,22719467.0
201504,20230,Boneless,144263649.0
201504,20322,"Hams, shoulders and cuts thereof, with bone in",25601082.0
201504,20329,Other frozen meat of swine,63426138.0
201504,20422,"Other sheep cuts with bone in ,fresh or chilled",134988.0
201504,20430,"Carcasses and halfcarcasses of lamb, frozen",921387.0
201504,20441,"Carcasses and halfcarcasses,frozen",7333598.0
201504,20442,"Other cuts with bone in,frozen",83578099.0
201504,20443,"Boneless meat of sheep,frozen",2256146.0
201504,20500,"Meat of horses, asses, mules or hinnies, fresh, chilled or frozen",31250.0
201504,20621,"Tongues of bovine animals,frozen",150199.0
201504,20629,"Other edible offal of bovine animals,frozen",5120903.0
201504,20641,"Livers,frozen",32347.0
201504,20649,"Other edible offal of swine,frozen",107102995.0
201504,20690,"Other edible offal,frozen",1005651.0
201504,20712,"Fowls of the species gallus domesticus,not cut in pieces, frozen",1605.0
201504,20714,"Cuts and offal, frozen",71984415.0
201504,20727,"Cuts and offal of turkeys , frozen",2713632.0
201504,20910,"Pig fat, free of lean meat,not rendered or otherwise extracted, fresh, chilled, frozen, salted, in brine, dried or smoked",305647.0
201504,21019,Other,106281.0
201504,21099,"Other meat and edible meat offal,salted, in brine, dried or smoked",21600.0
201504,30111,Ornamental fish of freshwater,884494.0
201504,30119,Other ornamental fish,324445.0
201504,30192,Eels (Anguilla spp),483833.0
201504,30199,Other,4668291.0
201504,30213,"Pacific salmon (Oncorhynchus nerka, Oncorhynchus gorbuscha, fresh or chilledOncorhynchus keta, Oncorhynchus tschawytscha, Oncorhynchus kisutch, Oncorhynchus masou and Oncorhynchus rhodurus)",66991.0
201504,30214,"Atlantic salmon (Salmo salar) and Danube salmon (Hucho hucho) ,fresh or chilled",23550647.0
201504,30222,"Plaice (Pleuronectes platessa),fresh or chilled",182.0
201504,30232,"Yellowfin tunas (Thunnus albacares) ,fresh or chilled",10974.0
201504,30233,"Skipjack or stripebellied bonito ,fresh or chilled",3272.0
201504,30235,"Atlantic and Pacific bluefin tunas (Thunnus thynnus, Thunnus orientalis),fresh or chilled",378130.0
201504,30241,"Herrings (Clupea harengus, Clupea pallasii) ,fresh or chilled,fresh or chilled",2316.0
201504,30243,"Sardines (Sardina pilchardus, Sardinops spp), sardinella (Sardinella spp), brisling or sprats (Sprattus sprattus) ,fresh or chilled",523.0
201504,30244,"Mackerel (Scomber scombrus, Scomber australasicus, Scomber japonicus) ,fresh or chilled",11584.0
201504,30245,"Jack and horse mackerel (Trachurus spp) ,fresh or chilled",79481.0
201504,30251,"Cod (Gadus morhua, Gadus ogac, Gadus macrocephalus) ,fresh or chilled",21571.0
201504,30281,"Dogfish and other sharks ,fresh or chilled",17994.0
201504,30289,"Other fish,fresh or chilled",1196879.0
201504,30311,"Sockeye salmon (red salmon) (Oncorhynchus nerka) ,frozen",136280.0
201504,30312,"Other Pacific salmon (Oncorhynchus gorbuscha, Oncorhynchus keta, Oncorhynchus tschawytscha, Oncorhynchus kisutch, Oncorhynchus masou and Oncorhynchus rhodurus) ,frozen",7680729.0
201504,30313,"Atlantic salmon (Salmo salar) and Danube salmon (Hucho hucho) ,frozen",5347355.0
201504,30314,"Trout (Salmo trutta, Oncorhynchus mykiss, Oncorhynchus clarki, Oncorhynchus aguabonita, Oncorhynchus gilae, Oncorhynchus apache and Oncorhynchus chrysogaster) ,frozen",2695854.0
201504,30319,"Other salmonidae,frozen",177939.0
201504,30324,"Catfish (Pangasius spp, Silurus spp, Clarias spp, Ictalurus spp) , frozen",239119.0
201504,30325,"Carp (Cyprinus spp, Carassius spp, Ctenopharyngodon idellus, , frozenHypophthalmichthys spp, Cirrhinus spp, Mylopharyngodon piceus, Catla catla, Labeo spp, Osteochilus hasselti, Leptobarbus hoeveni, Megalobrama spp)",37733.0
201504,30326,"Eels (Anguilla spp) , frozen",48288.0
201504,30331,"Halibut (Reinhardtius hippoglossoides, Hippoglossus hippoglossus, Hippoglossus stenolepis) , frozen",3772399.0
201504,30332,Frozen plaice,879878.0
201504,30333,Frozen sole,354600.0
201504,30339,"Other flat fish (Pleuronectidae, Bothidae, Cynoglossidae, Soleidae Scophthalmidae and Citharidae), frozen",25754070.0
201504,30341,"Albacore or longfinned tunas (Thunnus alalunga),frozen",600190.0
201504,30342,"Yellowfin tunas (Thunnus albacares),frozen",2116225.0
201504,30343,"Skipjack or stripebellied bonito ,frozen",8355502.0
201504,30344,"Bigeye tunas (Thunnus obesus) ,frozen",19303.0
201504,30345,"Atlantic and Pacific bluefin tunas (Thunnus thynnus, Thunnus orientalis) ,frozen",42266.0
201504,30351,"Herrings (Clupea harengus, Clupea pallasii) ,frozen",3011947.0
201504,30353,"Sardines (Sardina pilchardus, Sardinops spp), sardinella (Sardinella spp), brisling or sprats (Sprattus sprattus),frozen",190075.0
201504,30354,"Mackerel (Scomber scombrus, Scomber australasicus, Scomber japonicus) ,frozen",12872582.0
201504,30355,"Jack and horse mackerel (Trachurus spp) ,frozen",6075778.0
201504,30357,"Swordfish (Xiphias gladius) ,frozen",261496.0
201504,30363,"Cod (Gadus morhua, Gadus ogac, Gadus macrocephalus) ,frozen",55864921.0
201504,30364,"Haddock (Melanogrammus aeglefinus) ,frozen",10131943.0
201504,30365,"Coalfish (Pollachius virens) ,frozen",2727834.0
201504,30366,"Hake (Merluccius spp, Urophycis spp) ,frozen",597587.0
201504,30367,"Alaska Pollack (Theragra chalcogramma) ,frozen",169580904.0
201504,30368,"Blue whitings (Micromesistius poutassou, Micromesistius australis) ,frozen",1056248.0
201504,30369,"Other fish of the families Bregmacerotidae, Euclichthyidae, Gadidae, Macrouridae, Melanonidae, Merlucciidae, Moridae and Muraenolepididae,frozen",2237605.0
201504,30381,"Dogfish and other sharks ,frozen",791894.0
201504,30382,"Rays and skates (Rajidae) ,frozen",91080.0
201504,30389,"Other fish ,frozen",25644585.0
201504,30390,-------,7494982.0
201504,30449,"Fresh or chilled fillets of fish, n.e.s",18790.0
201504,30459,"Fresh or chilled fish meat, whether or not minced (excluding all fillets, tilapias, catfish, carp, eels, Nile perch, snakeheads, salmonidae, swordfish, toothfish and fish of the families Bregmacerotidae, Euclichthyidae, Gadidae, Macrouridae, Melanonidae, Merlucciidae, Moridae and Muraenolepididae)",15458.0
201504,30462,"Frozen fillets of catfish (Pangasius spp, Silurus spp, Clarias spp, Ictalurus spp)",1682258.0
201504,30463,Frozen fillets of nile Perch (Lates niloticus),198819.0
201504,30471,"Frozen fillets of cod (Gadus morhua, Gadus ogac, Gadus macrocephalus)",254434.0
201504,30474,"Frozen fillets of hake (Merluccius spp, Urophycis spp)",820.0
201504,30475,Frozen fillets of alaska Pollack (Theragra chalcogramma),494503.0
201504,30481,"Frozen fillets of Pacific salmon (Oncorhynchus nerka, Oncorhynchus gorbuscha, Oncorhynchus keta, Oncorhynchus tschawytscha, Oncorhynchus kisutch, Oncorhynchus masou and Oncorhynchus rhodurus), Atlantic salmon (Salmo salar) and Danube salmon (Hucho hucho)",1286483.0
201504,30482,"Frozen fillets of trout (Salmo trutta, Oncorhynchus mykiss, Oncorhynchusclarki, Oncorhynchus aguabonita, Oncorhynchus gilae,Oncorhynchus apache and Oncorhynchus chrysogaster)",200600.0
201504,30487,"Frozen fillets of tunas (of the genus Thunnus), skipjack or stripebellied bonito (Euthynnus (Katsuwonus) pelamis)",88113.0
201504,30489,"Frozen fish fillets, n.e.s.",1178557.0
201504,30494,"Frozen meat, whether or not minced, of alaska Pollack (Theragra chalcogramma)",343653.0
201504,30495,"Frozen meat, whether or not minced, of fish of the families Bregmacerotidae, Euclichthyidae, Gadidae, Macrouridae, Melanonidae, Merlucciidae, Moridae and Muraenolepididae, other than Alaska Pollack (Theragra chalcogramma)",1254436.0
201504,30499,Frozen fish meat n.e.s. (excluding fillets),5427948.0
201504,30510,"Flours, meals and pellets of fish, fit for human consumption",27242.0
201504,30520,"Livers, roes and milt of fish, dried, smoked, salted or in brine",271996.0
201504,30541,"Smoked Pacific salmon (Oncorhynchus nerka, Oncorhynchus gorbuscha, Oncorhynchus keta, Oncorhynchus tschawytscha, Oncorhynchus kisutch, Oncorhynchus masou and Oncorhynchus rhodurus), Atlantic salmon (Salmo salar) and Danube salmon (Hucho hucho)",26940.0
201504,30549,"Smoked fish, incl. fillets (excluding offal, Pacific salmon, Atlantic salmon, Danube salmon, herring, trout, tilapia, catfish, carp, eels, Nile perch and snakeheads)",82403.0
201504,30563,"Anchovies (Engraulis spp), salted or in brine only (excluding fillets and offal)",256665.0
201504,30611,"Frozen rock lobster and other sea crawfish (Palinurus spp, Panulirus spp, Jasus spp)",688785.0
201504,30614,Frozen crabs,16699047.0
201504,30616,"Frozen cold-water shrimps and prawns (Pandalus spp, Crangon crangon)",12040617.0
201504,30617,"Frozen shrimps and prawns, even smoked, whether in shell or not, incl. shrimps and prawns in shell, cooked by steaming or by boiling in water (excluding cold-water shrimps and prawns)",31365401.0
201504,30619,"Other, including flours, meals and pellets of crustaceans, fit for human consumption",840629.0
201504,30621,-------,21112206.0
201504,30622,-------,12699492.0
201504,30624,-------,28655965.0
201504,30626,-------,52383.0
201504,30627,-------,12460702.0
201504,30629,-------,2548268.0
201504,30711,"Oysters, live, fresh, chilled",1836952.0
201504,30719,"Oysters, smoked, frozen, dried, salted or in brine",168572.0
201504,30721,"Live, fresh or chilled, scallops, incl. queen scallops, of the genera Pecten, Chlamys or Placopecten, even in shell",303102.0
201504,30729,"Scallops, incl. queen scallops, of the genera Pecten, Chlamys or Placopecten, smoked, frozen, dried, salted or in brine, even in shell",47051132.0
201504,30731,"Live, fresh or chilled, not smoked, mussels (Mytilus spp., Perna spp.), with or without shell",89023.0
201504,30739,"Mussels (Mytilus spp., Perna spp.), smoked, frozen, dried, salted or in brine, with or without shell",785281.0
201504,30741,-------,34639.0
201504,30749,"Cuttle fish and squid, smoked, frozen, dried, salted or in brine, with or without shell",20214687.0
201504,30759,"Octopus (Octopus spp.), smoked, frozen, dried, salted or in brine",778528.0
201504,30760,"Snails, other than sea snails",29056.0
201504,30771,"Live, fresh or chilled, even in shell, clams, cockles and ark shells (families Arcidae, Arcticidae,Cardiidae,Donacidae,Hiatellidae,Mactridae,Mesodesmatidae, Myidae, Semelidae, Solecurtidae, Solenidae, Tridacnidae and Veneridae)",2744424.0
201504,30779,"Smoked, frozen, dried, salted or in brine, even in shell, clams, cockles and ark shells families Arcidae, Arcticidae, Cardiidae, Donacidae, Hiatellidae, Mactridae, Mesodesmatidae, Myidae, Semelidae, Solecurtidae, Solenidae, Tridacnidae and Veneridae""""",575557.0
201504,30781,"Live, fresh or chilled abalone (Haliotis spp)",900440.0
201504,30789,-------,269757.0
201504,30791,"Live, fresh or chilled molluscs, fit for human consumption, even in shell (excluding oysters, scallops of the genera Pecten, Chlamys or Placopecten, mussels Mytilus spp., Perna spp."", cuttle fish ""Sepia officinalis, Rossia macrosoma, Sepiola spp."", squid ""Ommastrephes spp., Loligo spp., Nototodarus spp., Sepioteuthis spp."", octopus ""Octopus spp."", snails other than sea snails, clams, cockles and ark shells and abalone); fresh or chilled flours, meals and pellets of molluscs, fit for human consumption""",3283432.0
201504,30799,"Molluscs, fit for human consumption, even in shell, smoked, frozen, dried, salted or in brine (excluding oysters, scallops of the genera Pecten, Chlamys or Placopecten, mussels Mytilus spp., Perna spp."", cuttle fish ""Sepia officinalis, Rossia macrosoma, Sepiola spp."", squid ""Ommastrephes spp., Loligo spp., Nototodarus spp., Sepioteuthis spp."", octopus ""Octopus spp."", snails other than sea snails, clams, cockles and ark shells and abalone); frozen, dried, salted or in brine, flours, meals and pellets of molluscs, fit for human consumption""",7201456.0
201504,30819,"Smoked, dried, salted or in brine, sea cucumbers (Stichopus japonicus, Holothurioidea)",174296.0
201504,30821,"Live, fresh or chilled, sea urchins (Strongylocentrotus spp., Paracentrotus lividus, Loxechinus albus, Echinus esculentus)",206433.0
201504,30829,"Smoked, dried, salted or in brine, sea urchins (Strongylocentrotus spp., Paracentrotus lividus, Loxechinus albus, Echinus esculentus)",513.0
201504,30830,Jellyfish (Rhopilema spp),351190.0
201504,30890,"Live, fresh, chilled, frozen, dried, salted or in brine, even smoked, aquatic invertebrates (excluding crustaceans, molluscs, sea cucumbers, sea urchins and jellyfish); all flours, meals and pellets of aquatic invertebrates other than crustaceans and molluscs, fit for human consumption",34477.0
201504,40110,"Milk and cream of a fat content, by weight, not exceeding 1%",1595166.0
201504,40120,"Milk and cream of a fat content, by weight, exceeding 1% but not exceeding 6%",25479008.0
201504,40150,"Milk and cream of a fat content, by weight, exceeding 10%",10280421.0
201504,40210,"Milk and cream in powder, granules or other solid forms, of a fat content, by weight, not exceeding 1.5%",50675295.0
201504,40221,"Not containing added sugar or other sweetening matter, of a fat content, by weight, more than 1.5%",80664040.0
201504,40229,"Milk and cream in solid forms, of a fat content by weight, more than 1,5%, sweetened",507302.0
201504,40291,"Milk and cream, concentrated but unsweetened (excluding in solid forms)",1443836.0
201504,40299,"Milk and cream, concentrated and sweetened (excluding in solid forms)",71569.0
201504,40310,"Yogurt, whether or not flavoured or containing added sugar or other sweetening matter, fruits, nuts or cocoa",1073027.0
201504,40390,"Buttermilk, curdled milk and cream, kephir and other fermented or acidified milk and cream, whether or not concentrated or flavoured or containing added sugar or other sweetening matter, fruits, nuts or cocoa (excluding yogurt)",364939.0
201504,40410,"Whey and modified whey, whether or not concentrated or containing added sugar or other sweetening matter",46699040.0
201504,40490,"Products consisting of natural milk constituents, whether or not sweetened, n.e.s.",1292000.0
201504,40510,Butter,16145128.0
201504,40520,Dairy spreads,29.0
201504,40590,"Fats and oils derived from milk, and dehydrated butter and ghee (excluding natural butter, recombined butter and whey butter)",5362035.0
201504,40610,"Fresh (unripened or uncured) cheese, including whey cheese, and curd",6625300.0
201504,40620,"Grated or powdered cheese, of all kinds",7971761.0
201504,40630,"Processed cheese, not grated or powdered",6907708.0
201504,40640,Blueveined cheese and other cheese containing veins produced by Penicillium roqueforti,31881.0
201504,40690,Other cheese,10605880.0
201504,40900,atural honey,7178848.0
201504,41000,"dible products of animal origin, not elsewhere specified or included",2708864.0
201504,50400,"Guts, bladders and stomachs of animals (other than fish), wholeand pieces thereof, fresh, chilled, frozen, salted, in brine, dried orsmoked",23957425.0
201504,50510,Feathers of a kind used for stuffing; down,10676584.0
201504,50590,"Skins and other parts of birds, with their feathers or down, feathers and parts of feathers, whether or not with trimmed edges, not further worked than cleaned, disinfected or treated for preservation; powder and waste of feathers or parts of feathers (excluding feathers used for stuffing and down)",409495.0
201504,50690,"Bones and horn-cores and their powder and waste, unworked, defatted, degelatinised or simply prepared (excluding ossein and bones treated with acid and cut to shape)",690382.0
201504,50710,vory; ivory powder and waste,328149.0
201504,50790,"Tortoiseshell, whalebone, Otherhorns, antlers, hooves, nails, claws and beaks, other powder and waste there of",2020383.0
201504,50800,"Coral and similar materials, unworked or simply prepared bunot otherwise worked; shells of molluscs, crustaceans or echinoderms and cuttlebone, unworked or simply prepared bunot cut to shape, powder and waste thereof",1240715.0
201504,51000,"Ambergris, castoreum, civet and musk; cantharides; bile, whether or not dried; glands and other animal products used in the preparation of pharmaceutical products, fresh, chilled, frozen or otherwise provisionally preserved",165281.0
201504,51110,Bovine semen,1893743.0
201504,51191,"Products of fish or crustaceans, molluscs or other aquatic invertebrates; dead animals of Chapter 3",795542.0
201504,51199,"Unkown Products of animal origin, n.e.s., dead animals, unfit for human consumption (excluding fish, crustaceans, molluscs or other aquatic invertebrates)",1788778.0
201504,60110,"Bulbs, tubers, tuberous roots, corms, crowns and rhizomes, dormant",3238165.0
201504,60210,Unrooted cuttings and slips,513773.0
201504,60220,"Trees, shrubs and bushes, grafted or not, of kinds which bear edible fruit or nuts",567873.0
201504,60230,"Rhododendrons and azaleas, grafted or not",318859.0
201504,60240,"Roses, grafted or not",52.0
201504,60290,Other live plant,17623988.0
201504,60311,"Fresh cut roses and buds, of a kind suitable for bouquets or for ornamental purposes",262868.0
201504,60312,"Fresh cut carnations and buds, of a kind suitable for bouquets or for ornamental purposes",1070.0
201504,60313,"Fresh cut orchids and buds, of a kind suitable for bouquets or for ornamental purposes",956588.0
201504,60314,"Fresh cut chrysanthemums and buds, of a kind suitable for bouquets or for ornamental purposes",113398.0
201504,60315,"Fresh cut Lilies (Lilium spp.) and buds, of a kind suitable for bouquets or for ornamental purposes",3146.0
201504,60319,"Fresh cut flowers and buds, of a kind suitable for bouquets or for ornamental purposes",469067.0
201504,60390,"Dried, dyed, bleached, impregnated or otherwise prepared cut flowers and buds, of a kind suitable for bouquets or for ornamental purposes",510088.0
201504,60420,"Foliage, branches and other parts of plants, without flowers or flower buds, and grasses, mosses and lichens, being goods of a kind suitable for bouquets or for ornamental purposes, fresh",146682.0
201504,60490,"Foliage, branches and other parts of plants, without flowers or flower buds, and grasses, mosses and lichens, being goods of a kind suitable for bouquets or for ornamental purposes, dried, dyed, bleached, impregnated or otherwise prepared",251375.0
201504,70310,Fresh or chilled onions and shallots,219.0
201504,70320,Fresh or chilled garlic,144.0
201504,70420,Fresh or chilled brussels sprouts,228.0
201504,70519,"Chicory (Cichorium spp.), fresh or chilled.",303.0
201504,70610,Fresh or chilled carrots and turnips,133.0
201504,70700,"Cucumbers and gherkins, fresh or chilled.",4298.0
201504,70940,Fresh or chilled celery other than celeriac,665.0
201504,70959,Other fresh or chilled edible mushrooms and truffles,110.0
201504,70993,"Fresh or chilled pumpkins, squash and gourds (Cucurbita spp.)",336409.0
201504,70999,Fresh or chilled vegetables n.e.s.,163.0
201504,71021,Frozen peas (Pisum sativum),1549774.0
201504,71022,"Frozen beans (Vigna spp., Phaseolus spp.)",118731.0
201504,71029,"Leguminous vegetables, shelled or unshelled, uncooked or cooked by steaming or by boiling in water, frozen (excluding peas and beans)",342776.0
201504,71030,"Spinach, New Zealand spinach and orache spinach (garden spinach),frozen.",3940.0
201504,71040,"Sweet corn,frozen.",1799923.0
201504,71080,"Other vegetables (uncooked or cooked by steaming or boiling in water),frozen.",46911.0
201504,71090,"Mixtures of vegetables,frozen.",4286.0
201504,71120,"Olives, provisionally preserved, e.g. by sulphur dioxide gas, in brine, in sulphur water or in other preservative solutions, but unsuitable in that state for immediate consumption",72799.0
201504,71140,"Cucumbers and gherkins , provisionally preserved, e.g. by sulphur dioxide gas, in brine, in sulphur water or in other preservative solutions, but unsuitable in that state for immediate consumption",19584.0
201504,71190,Other vegetables; mixtures of vegetables,98420.0
201504,71220,"Dried Onions, whole, cut, sliced, broken or in powder, but not further prepared.",82779.0
201504,71231,"Dried Mushrooms of the genus Agaricus, whole, cut, sliced, broken or in powder, but not further prepared.",1368.0
201504,71232,"Dried wood ears (Auricularia spp.), whole, cut, sliced, broken or in powder, but not further prepared.",10.0
201504,71239,"Dried other mushrooms and truffles, whole, cut, sliced, broken or in powder, but not further prepared.",253593.0
201504,71290,"Dried other vegetables; mixtures of vegetables, whole, cut, sliced, broken or in powder, but not further prepared.",369298.0
201504,71310,"Dried peas (Pisum sativum), shelled, whether or not skinned or split.",38678092.0
201504,71320,"Dried chickpeas (garbanzos), shelled, whether or not skinned or split.",2972.0
201504,71331,"Dried beans of the species Vigna mungo (L.) Hepper or Vigna radiata (L.) Wilczek, shelled, whether or not skinned or split.",9768333.0
201504,71332,"Dried small red (Adzuki) beans (Phaseolus or Vigna angularis), shelled, whether or not skinned or split.",379998.0
201504,71333,"Dried kidney beans, including white pea beans (Phaseolus vulgaris), shelled, whether or not skinned or split.",533829.0
201504,71335,"Dried cow peas (Vigna unguiculata), shelled, whether or not skinned or split.",97973.0
201504,71339,"Dried, shelled leguminous vegetables, whether or not skinned or split (excluding peas, chickpeas, beans, lentils, broad beans, horse beans and pigeon peas)",488352.0
201504,71340,"Dried, shelled lentils",7333.0
201504,71350,"Dried, shelled broad beans (Vicia faba var. major) and horse beans (Vicia faba var. equina, Vicia faba var. minor)",283.0
201504,71390,"Dried, shelled leguminous vegetables, whether or not skinned or split (excluding peas, chickpeas, beans, lentils, broad beans, horse beans and pigeon peas)",5837857.0
201504,71410,"Fresh, chilled, frozen or dried roots and tubers of manioc (cassava), whether or not sliced or in the form of pellets",259902202.0
201504,71420,"Sweet potatoes, fresh, chilled, frozen or dried, whether or not sliced or in the form of pellets; sago pith.",27107.0
201504,80111,Desiccated coconuts,1513395.0
201504,80112,In the inner shell (endocarp) coconuts,7854577.0
201504,80119,Other coconuts,2353429.0
201504,80131,In shell cashew nuts,116013.0
201504,80132,Shelled cashew nuts,451772.0
201504,80211,"In shell almonds, fresh or dried, whether or not shelled or peeled.",4753573.0
201504,80212,"Shelled almonds, fresh or dried, whether or not shelled or peeled.",4971738.0
201504,80222,Shelled hazelnuts or filberts (Corylus spp.),333000.0
201504,80231,In shell walnuts,4240109.0
201504,80232,Shelled walnuts,2710692.0
201504,80242,Shelled chestnuts (Castanea spp.),37180.0
201504,80251,In shell pistachios,3606805.0
201504,80252,Shelled pistachios,137106.0
201504,80261,In shell macadamia nuts,3895935.0
201504,80262,Shelled macadamia nuts,1476.0
201504,80280,Areca nuts,304862.0
201504,80290,Other nuts fresh or dried,26155548.0
201504,80390,Fresh or dried bananas (excluding plantains),84715240.0
201504,80410,Fresh or dried dates,243957.0
201504,80420,Fresh or dried figs,509818.0
201504,80430,Fresh or dried pineapples,14852663.0
201504,80440,Fresh or dried avocados,3098819.0
201504,80450,"Fresh or dried guavas, mangoes and mangosteens",24776730.0
201504,80510,Fresh or dried oranges,13364568.0
201504,80520,-------,2618855.0
201504,80540,"Fresh or dried grapefruit, including pomelos",1393562.0
201504,80550,"Fresh or dried lemons (Citrus limon, Citrus limonum) and limes (Citrus aurantifolia, Citrus latifolia)",1938642.0
201504,80610,Fresh Grapes,137661277.0
201504,80620,Dried Grapes,3735949.0
201504,80711,Fresh. Watermelons,5938504.0
201504,80719,Other Melons,29587.0
201504,80720,Fresh Papaws (papayas),74451.0
201504,80810,Fresh Apples,18774642.0
201504,80830,Fresh Pears,1817051.0
201504,80929,Other Fresh cherries,331053.0
201504,80940,Fresh Plums and sloes,20723089.0
201504,81020,"Fresh Raspberries, blackberries, mulberries and loganberries",225908.0
201504,81040,"Fresh Cranberries, bilberries and other fruits of the genus Vaccinium",116044.0
201504,81050,Fresh Kiwifruit,14624936.0
201504,81060,Fresh Durians,55029929.0
201504,81090,Other Fresh fruits,102958844.0
201504,81110,Frozen Strawberries,890280.0
201504,81120,"Frozen Raspberries, blackberries, mulberries, loganberries, black, white or red currants and gooseberries",1231160.0
201504,81190,Other Frozen Fruit and nuts,11439276.0
201504,81210,"Cherries, provisionally preserved (for example, by sulphurdioxide gas, in brine, in sulphur water or in other preservativesolutions), but unsuitable in that state for immediateconsumption.",188173.0
201504,81290,"Other Fruit and nuts, provisionally preserved (for example, by sulphurdioxide gas, in brine, in sulphur water or in other preservativesolutions), but unsuitable in that state for immediateconsumption.",22823.0
201504,81310,Dried Apricots,167941.0
201504,81320,Dried Prunes,209182.0
201504,81330,Dried Apples,6852.0
