Date of data,Commodity code,Commodity,US dollar
202211,730792,"Threaded elbows, bends and sleeves, of stainless steel (excluding cast or stainless products)",4532640.0
202211,730793,"Butt welding fittings of iron or steel (excluding cast iron or stainless steel products, and flanges)",3095871.0
202211,730799,"Tube or pipe fittings, of iron or steel (excluding cast iron or stainless steel products; flanges; threaded elbows, bends and sleeves; butt welding fittings)",11677068.0
202211,730820,"Towers and lattice masts, of iron or steel",21081.0
202211,730830,"Doors, windows and their frames and thresholds for doors, of iron or steel",2443063.0
202211,730840,"Equipment for scaffolding, shuttering, propping or pit-propping (excluding composite sheetpiling products and formwork panels for poured-in-place concrete, which have the characteristics of moulds)",444419.0
202211,730890,"Structures and parts of structures, of iron or steel, n.e.s. (excluding bridges and bridge-sections, towers and lattice masts, doors and windows and their frames, thresholds for doors, props and similar equipment for scaffolding, shuttering, propping or pit-propping)",24368241.0
202211,730900,"eservoirs, tanks, vats and similar containers for any material (other than compressed or liquefied gas), of iron or steel, of a capacity exceeding 300 l, whether or not lined or heatinsulated, but not fitted with mechanical or thermal equipment.",12172371.0
202211,731010,"Tanks, casks, drums, cans, boxes and similar containers, of iron or steel, for any material, of a capacity of ≥ 50 l but ≤ 300 l, n.e.s. (excluding containers for compressed or liquefied gas, or containers fitted with mechanical or thermal equipment)",3935654.0
202211,731021,"Cans of iron or steel, of a capacity of ＜ 50 l, which are to be closed by soldering or crimping (excluding containers for compressed or liquefied gas)",4180716.0
202211,731029,"Tanks, casks, drums, cans, boxes and similar containers, of iron or steel, for any material, of a capacity of ＜ 50 l, n.e.s. (excluding containers for compressed or liquefied gas, or containers fitted with mechanical or thermal equipment, and cans which are to be closed by soldering or crimping)",1460627.0
202211,731100,"Containers for compressed or liquefied gas, of iron or steel.",6806137.0
202211,731210,"Stranded wire, ropes and cables",17206354.0
202211,731290,"Plaited bands, slings and the like, of iron or steel (excluding electrically insulated products)",1881117.0
202211,731300,"Barbed wire of iron or steel; twisted hoop or single flat wire, barbed or not, and loosely twisted double wire, of a kind used for fencing, of iron or steel.",766.0
202211,731412,"Endless bands for machinery, of stainless steel",49844.0
202211,731414,"Other woven cloth, of stainless steel",9590947.0
202211,731419,"Woven cloth, incl. endless bands, of iron or steel wire (excluding stainless and woven products of metal fibres of a kind used for cladding, lining or similar purposes)",574633.0
202211,731420,"Grill, netting and fencing, welded at the intersection, of wire with a maximum crosssectional dimension of 3 mm or more and having a mesh size of 100 cm2 or more",641.0
202211,731431,"Grill, netting and fencing, of iron or steel wire, welded at the intersection, plated or coated with zinc (excluding products of wire with a maximum cross-sectional dimension of ≥ 3 mm and having a mesh size of ≥ 100 cm2)",138351.0
202211,731439,"Grill, netting and fencing, of iron or steel wire, welded at the intersection (excluding products of wire with a maximum cross-sectional dimension of ≥ 3 mm and having a mesh size of ≥ 100 cm2, and grill, netting and fencing plated or coated with zinc)",159378.0
202211,731441,"Grill, netting and fencing, of iron or steel wire, not welded at the intersection, plated or coated with zinc",300065.0
202211,731442,"Grill, netting and fencing, of iron or steel wire, not welded at the intersection, coated with plastics",70682.0
202211,731449,"Grill, netting and fencing, of iron or steel wire, not welded at the intersection (excluding plated or coated with zinc or coated with plastics)",1089812.0
202211,731450,"Expanded metal, of iron or steel",149733.0
202211,731511,Roller chain of iron or steel,5163777.0
202211,731512,Articulated link chain of iron or steel (excluding roller chain),2671470.0
202211,731519,"Parts of articulated link chain, of iron or steel",3987532.0
202211,731520,"Skid chain for motor vehicles, of iron or steel",62345.0
202211,731581,Stud-link of iron or steel,356599.0
202211,731582,"Welded link chain of iron or steel (excluding articulated link chain, skid chain and stud-link chain)",4472406.0
202211,731589,"Chain of iron or steel (excluding articulated link chain, skid chain, stud-link chain, welded link chain and parts thereof; watch chains, necklace chains and the like, cutting and saw chain, skid chain, scraper chain for conveyors, toothed chain for textile machinery and the like, safety devices with chains for securing doors, and measuring chains)",1654947.0
202211,731590,"Parts of skid chain, stud-link chain and other chains of heading 7315 (excluding articulated link chain)",750627.0
202211,731600,"Anchors, grapnels and parts thereof, of iron or steel.",48509.0
202211,731700,"Nails, tacks, drawing pins, corrugated nails, staples (other than those of heading 83.05) and similar articles, of iron or steel, whether or not with heads of other material, but excluding such articles with heads of copper.",1058270.0
202211,731811,Coach screws,170891.0
202211,731812,Other wood screws,43786.0
202211,731813,Screw hooks and screw rings,386613.0
202211,731814,Selftapping screws,8881283.0
202211,731815,"Other screws and bolts, whether or not with their nuts or washers",112405528.0
202211,731816,Nuts,46897835.0
202211,731819,"Threaded articles, of iron or steel, nes",7435068.0
202211,731821,Spring washers and other lock washers,5249672.0
202211,731822,Other washers,23086262.0
202211,731823,Rivets,4091962.0
202211,731824,Cotters and cotterpins,19095842.0
202211,731829,"Non-threaded articles, of iron or steel",10920442.0
202211,731940,"Safety pins and other pins of iron or steel, n.e.s.",19991.0
202211,731990,"Knitting needles, bodkins, crochet hooks, embroidery stilettos and similar articles, for use in the hand, of iron or steel",662677.0
202211,732010,Leafsprings and leaves therefor of steel,10400116.0
202211,732020,Helical springs of steel,23796193.0
202211,732090,"Springs and leaves for springs, of iron or steel, incl. flat spiral springs (excluding helical springs, spiral springs, leaf-springs and leaves therefor, clock and watch springs, spring washers and other lock washers and shock absorbers and torque rod or torsion bar springs of Section 17)",6684192.0
202211,732111,"Appliances for baking, frying, grilling and cooking and plate warmers, for domestic use, of iron or steel, for gas fuel or for both gas and other fuels (excluding large cooking appliances)",2352189.0
202211,732112,"Appliances for baking, frying, grilling and cooking and plate warmers, for domestic use, of iron or steel, for liquid fuel (excluding large cooking appliances)",50777.0
202211,732119,"Appliances for baking, frying, grilling and cooking and plate warmers, for domestic use, of iron or steel, for solid fuel or other non-electric source of energy (excluding liquid or gaseous fuel, and large cooking appliances)",402656.0
202211,732181,"Stoves, heaters, grates, fires, wash boilers, braziers and similar appliances, of iron or steel, for gas fuel or for both gas and other fuels (excluding cooking appliances, whether or not with oven, separate ovens, plate warmers, central heating boilers, geysers and hot water cylinders and large cooking appliances)",152302.0
202211,732182,"Stoves, heaters, grates, fires, wash boilers, braziers and similar appliances, of iron or steel, for liquid fuel (excluding cooking appliances, whether or not with oven, separate ovens, plate warmers, central heating boilers, geysers, hot water cylinders and large cooking appliances)",401838.0
202211,732189,"Stoves, heaters, grates, fires, wash boilers, braziers and similar domestic appliances, of iron or steel, for solid fuel or other non-electricsource of energy (excluding liquid or gaseous fuel, and cooking appliances, whether or not with oven, separate ovens, plate warmers, central heating boilers, hot water cylinders and large cooking appliances)",96781.0
202211,732190,"Parts of domestic appliances non-electrically heated of heading 7321, n.e.s.",570711.0
202211,732211,"Radiators for central heating, non-electrically heated, and parts thereof, of iron or steel (excluding parts, elsewhere specified or included, and central-heating boilers)",13104.0
202211,732219,"Radiators for central heating, non-electrically heated, and parts thereof, of iron other than cast iron or steel (excluding parts, elsewhere specified or included, and central-heating boilers)",881184.0
202211,732290,"Air heaters and hot-air distributors, incl. distributors which can also distribute fresh or conditioned air, non-electrically heated, incorporating a motor-driven fan or blower, and parts thereof, of iron or steel",228724.0
202211,732310,"Iron or steel wool; pot scourers and scouring or polishing pads, gloves and the like",19165.0
202211,732391,"Table, kitchen or other household articles, and parts thereof, of cast iron, not enamelled (excluding cans, boxes and similar containers of heading 7310; waste baskets; shovels, corkscrews and other articles of the nature of a work implement; articles of cutlery, spoons, ladles, forks etc. of heading 8211 to 8215; ornamental articles; sanitary ware)",541819.0
202211,732392,"Table, kitchen or other household articles, and parts thereof, of cast iron, enamelled (excluding cans, boxes and similar containers of heading 7310; waste baskets; shovels, corkscrews and other articles of the nature of a work implement; articles of cutlery, spoons, ladles, forks etc. of heading 8211 to 8215; ornamental articles; sanitary ware)",1230596.0
202211,732393,"Table, kitchen or other household articles, and parts thereof, of stainless steel (excluding cans, boxes and similar containers of heading 7310; waste baskets; shovels, corkscrews and other articles of the nature of a work implement; articles of cutlery, spoons, ladles, forks etc. of heading 8211 to 8215; ornamental articles; sanitary ware)",3153439.0
202211,732394,"Table, kitchen or other household articles, and parts thereof, of iron other than cast iron or steel other than stainless, enamelled (excluding cans, boxes and similar containers of heading 7310; waste baskets; shovels, corkscrews and other articles of the nature of a work implement; articles of cutlery, spoons, ladles, forks etc. of heading 8211 to 8215; ornamental articles; sanitary ware; articles for table use)",603171.0
202211,732399,"Table, kitchen or other household articles, and parts thereof, of iron other than cast iron or steel other than stainless (excluding enamelled articles; cans, boxes and similar containers of heading 7310; waste baskets; shovels and other articles of the nature of a work implement; cutlery, spoons, ladles etc. of heading 8211 to 8215; ornamental articles; sanitary ware)",657975.0
202211,732410,"Sinks and washbasins, of stainless steel",478465.0
202211,732421,"Baths of cast iron, whether or not enamelled",3117.0
202211,732429,Baths of steel sheet,382093.0
202211,732490,"Sanitary ware, incl. parts thereof (excluding cans, boxes and similar containers of heading 7310, small wall cabinets for medical supplies or toiletries and other furniture of chapter 94, and fittings, complete sinks and washbasins, of stainless steel, complete baths and fittings)",1261221.0
202211,732510,"Articles of non-malleable cast iron, n.e.s.",2282685.0
202211,732591,"Grinding balls and similar articles for mills, cast (excluding such articles of non-malleable cast iron)",142020.0
202211,732599,"Cast articles of iron or steel, n.e.s. (excluding articles of non-malleable cast iron, and grinding balls and similar articles for mills)",2521219.0
202211,732611,"Grinding balls and similar articles for mills, of iron or steel, forged or stamped, but not further worked",60721.0
202211,732619,"Articles of iron or steel, forged or stamped, but not further worked, n.e.s. (excluding grinding balls and similar articles for mills)",18865018.0
202211,732620,"Articles of iron or steel wire, n.e.s.",2391001.0
202211,732690,"Articles of iron or steel, n.e.s. (excluding cast articles or articles of iron or steel wire)",165076604.0
202211,740100,Copper mattes; cement copper (precipitated copper).,10567426.0
202211,740200,Unrefined copper; copper anodes for electrolytic refining.,737836453.0
202211,740311,Cathodes and sections of cathodes,2890475909.0
202211,740312,Wirebars of refined copper,2066991.0
202211,740313,Billets,38599893.0
202211,740319,Other,126629684.0
202211,740321,Copperzincbasealloys(brass),76693150.0
202211,740322,Coppertinbasealloys(bronze),4518357.0
202211,740329,Othercopperalloys(otherthanmasteralloysofheading74.05),88514680.0
202211,740400,Copper waste and scrap.,1097953984.0
202211,740500,Master alloys of copper.,15546190.0
202211,740610,Powders of nonlamellar structure,2351041.0
202211,740620,Powders of lamellar structure; flakes,1037022.0
202211,740710,"Bars, rods and profiles, of refined copper, n.e.s.",7062221.0
202211,740721,"Bars, rods and profiles, of copper-zinc base alloys brass"", n.e.s.""",15676651.0
202211,740729,"Bars, rods and profiles of copper alloys, n.e.s. (excluding such articles of copper-zinc base alloys brass"")""",3425935.0
202211,740811,"Wire of refined copper, of which the maximum crosssectional dimension exceeds 6 mm",32427372.0
202211,740819,"Wire of refined copper, other",29096885.0
202211,740821,Wire of copper-zinc base alloys (brass),10447739.0
202211,740822,"Wire of copper-nickel alloys (cupro-nickel)or copper-nickel-zinc alloys nickel silver""""",1395801.0
202211,740829,"Wire of copper alloys (other than copper-zinc alloys [brass], copper-nickel alloys [cupro-nickel] or copper-nickel-zinc alloys [nickel silver])",4334008.0
202211,740911,"Plates, sheets and strip, of refined copper, in coils, of a thickness of ＞ 0,15 mm",27074715.0
202211,740919,"Plates, sheets and strip, of refined copper, not in coils, of a thickness of ＞ 0,15 mm",4362789.0
202211,740921,"Plates, sheets and strip, of copper-zinc base alloys brass"", of a thickness of ＞ 0,15 mm, in coils""",19869902.0
202211,740929,"Plates, sheets and strip, of copper-zinc base alloys brass"", of a thickness of ＞ 0,15 mm, not in coils""",234420.0
202211,740931,"Plates, sheets and strip, of copper-tin base alloys bronze"", of a thickness of ＞ 0,15 mm, in coils""",10392992.0
202211,740939,"Plates, sheets and strip, of copper-tin base alloys bronze"", of a thickness of ＞ 0,15 mm, not in coils""",162900.0
202211,740940,"Plates, sheets and strip, of copper-nickel base alloys cupro-nickel"" or copper-nickel-zinc base alloys ""nickel silver"", of a thickness of ＞ 0,15 mm, not in coils""",13316701.0
202211,740990,"Plates, sheets and strip, of copper alloys, of a thickness of ＞ 0,15 mm, other",21834893.0
202211,741011,"Refined copper foil, not backed, of a thickness of ≤ 0,15 mm",117058535.0
202211,741012,"Copper alloy foil, not backed, of a thickness of ≤ 0,15 mm",19516846.0
202211,741021,"Refined copper foil, backed, of a thickness excluding any backing"" of ≤ 0,15 mm""",75655994.0
202211,741022,"Copper alloy foil, backed, of a thickness excluding any backing"" of ≤ 0,15 mm""",2305007.0
202211,741110,Tubes and pipes of refined copper,8438155.0
202211,741121,"Tubes and pipes of copper-zinc base alloys brass""""",818910.0
202211,741122,"Tubes and pipes of copper-nickel base alloys cupro-nickel"" or copper-nickel-zinc base alloys ""nickel silver""""",954410.0
202211,741129,"Tubes and pipes of copper alloys (excluding copper-zinc base alloys brass"", copper-nickel base alloys ""cupro-nickel"" and copper-nickel-zinc base alloys ""nickel silver"")""",1463057.0
202211,741210,"Refined copper tube or pipe fittings e.g., couplings, elbows, sleeves""""",541138.0
202211,741220,"Copper alloy tube or pipe fittings e.g., couplings, elbows, sleeves""""",11066449.0
202211,741300,"Stranded wire, cables, plaited bands and the like, of copper, not electrically insulated.",8034232.0
202211,741510,"Nails and tacks, drawing pins, staples and similar articles",244837.0
202211,741521,"Washers, incl. spring washers and spring lock washers"", of copper""",2151449.0
202211,741529,"Rivets, cotters, cotter pins and the like, not threaded, of copper (excluding spring washers and spring lock washers)",1724119.0
202211,741533,"Screws, bolts, nuts and similar articles, threaded, of copper (other than screw hooks, ring- and eyebolts, lag screws, plugs, bungs and the like, with screw thread)",3503854.0
202211,741539,"Screw hooks, screw rings and the like, threaded, of copper (excluding standard screws and bolts and nuts)",770144.0
202211,741810,"Table, kitchen or other household articles and parts thereof; pot scourers and scouring or polishing pads, gloves and the like",209572.0
202211,741820,Sanitary ware and parts thereof,1222965.0
202211,741920,"Cast, moulded, stamped or forged copper articles without further processing",3782922.0
202211,741980,other copper articles,27886242.0
202211,750110,Nickel mattes,366964991.0
202211,750120,Nickel oxide sinters and other intermediate products of nickel metallurgy,440805752.0
202211,750210,"Nickel, not alloyed",331792185.0
202211,750220,Nickel alloys,4435429.0
202211,750400,Nickel powders and flakes.,28501623.0
202211,750511,"Bars, rods, profiles and wire, of non-alloy nickel, n.e.s.",540383.0
202211,750512,"Bars, rods, profiles and wire, of nickel alloys, n.e.s.",23060056.0
202211,750521,Wire of non-alloy nickel,146610.0
202211,750522,Wire of nickel alloys,5927854.0
202211,750610,"Plates, sheets, strip and foil, of non-alloy nickel",1543072.0
202211,750620,"Plates, sheets, strip and foil, of nickel alloys",30445537.0
202211,750711,Tubes and pipes of non-alloy nickel,172115.0
202211,750712,Tubes and pipes of nickel alloys,5854951.0
202211,750720,"Tube or pipe fittings, of nickel",2435065.0
202211,750810,"Cloth, grill, netting and fencing, of nickel wire",1121239.0
202211,750890,"Articles of nickel, n.e.s.",16531190.0
202211,760110,"Aluminium, not alloyed",255674137.0
202211,760120,Aluminium alloys,224368051.0
202211,760200,Aluminium waste and scrap.,247642690.0
202211,760310,"Powders of aluminium, of non-lamellar structure",135408.0
202211,760320,"Powders of aluminium, of lamellar structure, and flakes of aluminium",887390.0
202211,760410,"Bars, rods and profiles, of non-alloy aluminium, n.e.s.",89934.0
202211,760421,"Hollow profiles of aluminium alloys, n.e.s.",3028467.0
202211,760429,"Bars, rods and solid profiles, of aluminium alloys, n.e.s.",18847891.0
202211,760511,"Wire of non-alloy aluminium, with a maximum cross-sectional dimension of ＞ 7 mm",719538.0
202211,760519,"Wire of non-alloy aluminium, with a maximum cross-sectional dimension of ≤ 7 mm",1990638.0
202211,760521,"Wire of aluminium alloys, with a maximum cross-sectional dimension of ＞ 7 mm",1091605.0
202211,760529,"Wire, of aluminium alloys, having a maximum cross-sectional dimension of ≤ 7 mm",1497709.0
202211,760611,"Plates, sheets and strip, of non-alloy aluminium, of a thickness exceeding 0.2 mm, square or rectangular",4526930.0
202211,760612,"Plates, sheets and strip, of aluminium alloys, of a thickness exceeding 0.2 mm, square or rectangular",103351356.0
202211,760691,"Plates, sheets and strip, of non-alloy aluminium, of a thickness exceeding 0.2 mm",726724.0
202211,760692,"Plates, sheets and strip, of aluminium alloys, of a thickness exceeding 0.2 mm , other",1207987.0
202211,760711,"Aluminium foil, not backed, rolled but not further worked, of a thickness not exceeding 0.2 mm. (excluding stamping foils of heading 3212, and foil made up as christmas tree decorating material)",13941725.0
202211,760719,"Aluminium foil, not backed, rolled and further worked, of a thickness not exceeding 0.2 mm. (excluding stamping foils of heading 3212, and foil made up as christmas tree decorating material)",26096552.0
202211,760720,"Aluminium foil, backed, of a thickness (excluding any backing) not exceeding 0.2 mm.(excluding stamping foils of heading 3212, and foil made up as christmas tree decorating material)",24386682.0
202211,760810,Tubes and pipes of non-alloy aluminium,442917.0
202211,760820,Tubes and pipes of aluminium alloys,4146586.0
202211,760900,"Aluminium tube or pipe fittings (for example, couplings, elbows, sleeves).",3679341.0
202211,761010,"Doors, windows and their frames and thresholds for doors",817628.0
202211,761090,"Structures and parts of structures, of aluminium, n.e.s., and plates, rods, profiles, tubes and the like, prepared for use in structures, of aluminium, n.e.s.",15802010.0
202211,761100,"Aluminium reservoirs, tanks, vats and similar containers, for any material (other than compressed or liquefied gas), of a capacity exceeding 300 l, whether or not lined or heatinsulated, but not fitted with mechanical or thermal equipment.",733755.0
202211,761210,"Collapsible tubular containers, of aluminium",8346.0
202211,761290,"Casks, drums, cans, boxes and similar containers, incl. rigid tubular containers, of aluminium, for any material (other than compressed or liquefied gas), of a capacity of ≤ 300 l, n.e.s.",2148090.0
202211,761300,Aluminium containers for compressed or liquefied gas.,1393376.0
202211,761410,"Stranded wire, cables, plaited bands and the like, of aluminium, with steel core, not electrically insulated",3592.0
202211,761490,"Stranded wires, cables, ropes and similar articles, of aluminium (other than with steel core and electrically insulated products)",7631.0
202211,761510,"Table, kitchen or other household articles and parts thereof; pot scourers and scouring or polishing pads, gloves and the like",5223722.0
202211,761520,Sanitary ware and parts thereof,188054.0
202211,761610,"Nails, tacks, staples (other than those of heading 83.05), screws, bolts, nuts, screw hooks, rivets, cotters, cotterpins, washers and similar articles",8040754.0
202211,761691,"Cloth, grill, netting and fencing, of aluminium wire",384451.0
202211,761699,Unwrought lead (excluding refined lead and lead containing by weight antimony as the principal other element),40678470.0
202211,780110,"Unwrought lead, refined",78889.0
202211,780191,"Unwrought lead, containing by weight antimony as the principal other element",284408.0
202211,780199,Unwrought lead (excluding refined lead and lead containing by weight antimony as the principal other element),8616234.0
202211,780411,"Sheets, strip and foil of a thickness (excluding any backing) not exceeding 0.2 mm",59685.0
202211,780419,"Lead plates; lead sheets, strip and foil, of a thickness (excluding any backing) exceeding 0,2 mm",200008.0
202211,780420,Powders and flakes,2507.0
202211,780600,Other articles of lead.,421877.0
202211,790111,"Unwrought zinc, not alloyed, containing by weight 99.99% or more of zinc",35268242.0
202211,790112,"Unwrought zinc, not alloyed, containing by weight less than 99.99% of zinc",930794.0
202211,790120,Unwrought zinc alloys,16097511.0
202211,790310,Zinc dust,696820.0
202211,790390,Zinc powders and flakes,488185.0
202211,790400,"Zinc bars, rods, profiles and wire.",215073.0
202211,790500,"Zinc plates, sheets, strip and foil.",1035526.0
202211,790700,Other articles of zinc.,3846051.0
202211,800110,"Unwrought tin, not alloyed",107687383.0
202211,800120,"Unwrought tin, alloys",2212918.0
202211,800300,"Tin bars, rods, profiles and wire.",3378634.0
202211,800700,Other articles of tin.,2700987.0
202211,810110,Tungsten powders,299131.0
202211,810194,"Unwrought tungsten, incl. bars and rods of tungsten obtained simply by sintering",17732.0
202211,810196,"Tungsten bars and rods (other than those obtained simply by sintering), profiles, plates, sheets, strip and foil, n.e.s.",734629.0
202211,810199,Tungsten waste and scrap (excluding ash and residues containing tungsten),2335259.0
202211,810210,Molybdenum powders,3497.0
202211,810294,"Unwrought molybdenum, incl. bars and rods obtained simply by sintering",795.0
202211,810295,"Molybdenum bars and rods (other than those obtained simply by sintering), profiles, plates, sheets, strip and foil, n.e.s.",3217533.0
202211,810296,Molybdenum wire,154269.0
202211,810299,"Articles of molybdenum, n.e.s.",1487952.0
202211,810320,"Unwrought tantalum, including bars and rods obtained simply by sintering; powders",123976.0
202211,810391,Tantalum crucible,2038.0
202211,810399,Other wrought tantalum and its products,13055530.0
202211,810411,"Unwrought magnesium, containing ≥ 99,8% by weight of magnesium",516541.0
202211,810419,"Unwrought magnesium, containing ＜ 99,8% by weight of magnesium",2696.0
202211,810430,"Magnesium raspings, turnings and granules, graded according to size; magnesium powders",12455.0
202211,810490,"Articles of magnesium, n.e.s.",697009.0
202211,810520,Cobalt mattes and other intermediate products of cobalt metallurgy; unwrought cobalt; powders,259789491.0
202211,810590,"Articles of cobalt, n.e.s.",4675579.0
202211,810610,"Bismuth content of more than 99% by weight Bismuth and its products, including waste and scrap",226711.0
202211,810690,"Bismuth content of 99% or less by weight Bismuth and its products, including waste and scrap",323761.0
202211,810820,Unwrought titanium; powders,3964121.0
202211,810890,"Articles of titanium, nes",48379899.0
202211,810991,Wrought zirconium and zirconium products with a hafnium to zirconium ratio of less than 1:500 by weight,3299832.0
202211,810999,Other wrought zirconium and zirconium products,672315.0
202211,811010,Unwrought antimony; powders,36034.0
