Date of data,Commodity code,Commodity,US dollar
202211,560311,"Nonwovens, whether or not impregnated, coated, covered or laminated, n.e.s., of synthetic or man-made filaments, weighing ≤ 25 g/m2",842300.0
202211,560312,"Nonwovens, whether or not impregnated, coated, covered or laminated, n.e.s., of man-made filaments, weighing ＞ 25 g/m2 but ≤ 70 g/m2",14729270.0
202211,560313,"Nonwovens, whether or not impregnated, coated, covered or laminated, n.e.s., of man-made filaments, weighing ＞ 70 g/m2 but ≤ 150 g/m2",11737798.0
202211,560314,"Nonwovens, whether or not impregnated, coated, covered or laminated, n.e.s., of man-made filaments, weighing ＞ 150 g",7335291.0
202211,560391,"Nonwovens, whether or not impregnated, coated, covered or laminated, n.e.s., weighing ≤ 25 g/m2 (excluding of man-made filaments)",1249586.0
202211,560392,"Nonwovens, whether or not impregnated, coated, covered or laminated, n.e.s., weighing ＞ 25 g/m2 but ≤ 70 g/m2 (excluding of man-made filaments)",9962230.0
202211,560393,"Nonwovens, whether or not impregnated, coated, covered or laminated, n.e.s., weighing ＞ 70 g/m2 but ≤ 150 g/m2 (excluding of man-made filaments)",8384036.0
202211,560394,"Nonwovens, whether or not impregnated, coated, covered or laminated, n.e.s., weighing ＞ than 150 g/m2 (excluding of man-made filaments)",17423664.0
202211,560410,Textile-covered rubber thread and cord,643212.0
202211,560490,"High tenacity yarn of polyesters, nylon, other polyamides or viscose, impregnated or coated with rubber or plastics",640793.0
202211,560500,"Metallised yarn, whether or not gimped, being textile yarn, or strip or the like of heading 5404 or 5405, of textile fibres, combined with metal in the form of thread, strip or powder or covered with metal",215288.0
202211,560600,"Gimped yarn, gimped strip and the like of heading 5404 or 5405; chenille yarn, incl. flock chenille yarn, and loop wale-yarn",487108.0
202211,560721,"Binder or baler twine, of sisal or other textile fibres of the genus Agave",51840.0
202211,560729,"Twine, cordage, ropes and cables, of sisal or other textile fibres of the genus Agave, whether or not plaited or braided and whether or not impregnated, coated, covered or sheathed with rubber or plastics (excluding binder or baler twine)",2470.0
202211,560741,"Binder or baler twine, of polyethylene or polypropylene",23169.0
202211,560749,"Twine, cordage, ropes and cables of polyethylene or polypropylene, whether or not plaited or braided and whether or not impregnated, coated, covered or sheathed with rubber or plastics (excluding binder or baler twine)",318187.0
202211,560750,"Twine, cordage, ropes and cables, of synthetic fibres, whether or not plaited or braided and whether or not impregnated, coated, covered or sheathed with rubber or plastics (excluding polyethylene and polypropylene)",5839459.0
202211,560790,"Twine, cordage, ropes and cables, whether or not plaited or braided and whether or not impregnated, coated, covered or sheathed with rubber or plastics (excluding that of synthetic fibres and of sisal or other textile fibres of the genus Agave)",512589.0
202211,560811,Made-up knotted fishing nets of man-made textile materials (excluding landing nets),355287.0
202211,560819,"Knotted netting of twine, cordage, ropes or cables, by the piece or metre; made-up nets, of man-made textile materials (excluding made-up fishing nets, hairnets, nets for sporting purposes, incl. landing nets, butterfly nets and the like)",458887.0
202211,560890,"Knotted netting of twine, cordage, ropes or cables, by the piece or metre; made-up fishing nets and other made-up nets, of vegetable textile materials (excluding hairnets, nets for sporting purposes, incl. landing nets, butterfly nets and the like)",40990.0
202211,560900,"Articles of yarn, strip or the like of heading 54.04 or 54.05, twine, cordage, rope or cables, not elsewhere specified or included.",956539.0
202211,570110,"Carpets and other textile floor coverings, of wool or fine animal hair, knotted, whether or not made up",334668.0
202211,570190,"Carpets and other textile floor coverings, of textile materials, knotted, whether or not made up (excluding those of wool or fine animal hair)",145631.0
202211,570210,"Kelem, Schumacks, Karamanie and similar hand-woven rugs, whether or not made up",142060.0
202211,570220,"Floor coverings of coconut fibres coir"", woven, whether or not made up""",65812.0
202211,570231,"Carpets and other floor coverings, of wool or fine animal hair, woven, not tufted or flocked, of pile construction, not made up (excluding Kelem, Schumacks, Karamanie and similar hand-woven rugs)",69690.0
202211,570232,"Carpets and other floor coverings, of man-made textile materials, woven, not tufted or flocked, of pile construction, not made up (excluding Kelem, Schumacks, Karamanie and similar hand-woven rugs)",24481.0
202211,570241,"Carpets and other floor coverings, of wool or fine animal hair, woven, not tufted or flocked, of pile construction, made up (excluding Kelem, Schumacks, Karamanie and similar hand-woven rugs)",252905.0
202211,570242,"Carpets and other floor coverings, of man-made textile materials, woven, not tufted or flocked, of pile construction, made up (excluding Kelem, Schumacks, Karamanie and similar hand-woven rugs)",662191.0
202211,570249,"Carpets and other floor coverings, of vegetable textile materials or coarse animal hair, woven, not tufted or flocked, of pile construction, made up (excluding Kelem, Schumacks, Karamanie and similar hand-woven rugs, and floor coverings of coconut fibres coir"")""",52473.0
202211,570250,"Carpets and other textile floor coverings, woven, not tufted or flocked, not of pile construction, not made up (excluding Kelem, Schumacks, Karamanie and similar hand-woven rugs, and floor coverings of coconut fibres coir"")""",39122.0
202211,570291,"Carpets and other floor coverings, of wool or fine animal hair, woven, not tufted or flocked, not of pile construction, made up (excluding Kelem, Schumacks, Karamanie and similar hand-woven rugs)",314853.0
202211,570292,"Carpets and other floor coverings, of man-made textile materials, woven, not tufted or flocked, not of pile construction, made up (excluding Kelem, Schumacks, Karamanie and similar hand-woven rugs)",137843.0
202211,570299,"Carpets and other floor coverings, of vegetable textile materials or coarse animal hair, woven, not tufted or flocked, not of pile construction, made up (excluding Kelem, Schumacks, Karamanie and similar hand-woven rugs, and floor coverings of coconut fibres coir"")""",322150.0
202211,570310,"Carpets and other floor coverings, of wool or fine animal hair, tufted needle punched"", whether or not made up""",1241075.0
202211,570321,"Turf,tufted,of nylon or other polyamides",4623.0
202211,570329,"Carpets and other floor coverings,tufted, of nylon or other polyamides",1231922.0
202211,570331,"Turf,tufted, of other man-made textile materials",2386.0
202211,570339,"Carpets and other floor coverings,tufted, of other man-made textile materials",379550.0
202211,570390,"Carpets and other floor coverings,tufted, of other textile materials",118209.0
202211,570410,"Floor tiles, of felt, not tufted or flocked, with an area of ≤ 0,3 m2",14497.0
202211,570420,"Floor tiles, of felt, not tufted or flocked, with an area of ＞ 0,3 m2 but ≤ 1 m2",24408.0
202211,570490,"Carpets and other floor coverings, of felt, not tufted or flocked, whether or not made up (excluding floor tiles with an area of ≤ 0,3 m2)",14236.0
202211,570500,"Other carpets and other textile floor coverings, whether or not made up.",606853.0
202211,580110,"Woven pile fabrics and chenille fabrics, of wool or fine animal hair (excluding terry towelling and similar woven terry fabrics, tufted textile fabrics and narrow woven fabrics of heading 5806)",98642.0
202211,580121,"Uncut weft pile fabrics, of cotton (excluding terry towelling and similar woven terry fabrics, tufted textile fabrics and narrow woven fabrics of heading 5806)",2382.0
202211,580122,"Cut corduroy, of cotton (excluding terry towelling and similar woven terry fabrics, tufted textile fabrics and narrow woven fabrics of heading 5806)",161053.0
202211,580123,"Cut weft pile fabrics, of cotton (excluding terry towelling and similar woven terry fabrics, tufted textile fabrics and narrow woven fabrics of heading 5806)",352057.0
202211,580126,"Chenille fabrics, of cotton (excluding terry towelling and similar woven terry fabrics, tufted textile fabrics and narrow woven fabrics of heading 5806)",3982.0
202211,580127,"Warp pile fabrics, of cotton (excluding terry towelling and similar woven terry fabrics, tufted textile fabrics and narrow woven fabrics of heading 5806)",313693.0
202211,580131,"Uncut weft pile fabrics, of man-made fibres (excluding terry towelling and similar woven terry fabrics, tufted textile fabrics and narrow woven fabrics of heading 5806)",17027.0
202211,580132,"Cut corduroy, of man-made fibres (excluding terry towelling and similar woven terry fabrics, tufted textile fabrics and narrow woven fabrics of heading 5806)",76614.0
202211,580133,"Cut weft pile fabrics, of man-made fibres (excluding terry towelling and similar woven terry fabrics, tufted textile fabrics and narrow woven fabrics of heading 5806)",240170.0
202211,580136,"Chenille fabrics, of man-made fibres (excluding terry towelling and similar woven terry fabrics, tufted textile fabrics and narrow woven fabrics of heading 5806)",95160.0
202211,580137,"Warp pile fabrics, of man-made fibres (excluding terry towelling and similar woven terry fabrics, tufted textile fabrics and narrow woven fabrics of heading 5806)",1041491.0
202211,580190,"Woven pile fabrics and chenille fabrics (excluding those of man-made fibres, wool or fine animal hair, terry towelling and similar woven terry fabrics, tufted textile fabrics and narrow woven fabrics of heading 5806)",2629.0
202211,580210,"Terry towelling and similar woven terry fabrics, of cotton",797.0
202211,580220,"Terry towelling and similar woven terry fabrics, of other textile materials",152100.0
202211,580230,Tufted textile fabrics,951598.0
202211,580300,"Gauze, other than narrow fabrics of heading 58.06",223447.0
202211,580410,Tulles and other net fabrics,3352489.0
202211,580421,"Mechanically made lace of man-made fibres in the piece, in strips or in motifs (excluding fabrics of heading 6002 to 6006)",2347300.0
202211,580429,"Mechanically made lace in the piece, in strips or in motifs (excluding that of man-made fibres and fabrics of heading 6002 to 6006)",99693.0
202211,580500,"Hand-woven tapestries of the type Gobelin, Flanders, Aubusson, Beauvais and the like, and needle-worked tapestries, e.g. petit point, cross-stitch, whether or not made up (excluding Kelem, Schumacks, Karamanie and the like, and tapestries ＞ 100 years old)",818.0
202211,580610,Woven pile fabrics (including terry towelling and similar terry fabrics) and chenille fabrics,694210.0
202211,580620,"Other woven fabrics, containing by weight 5% or more of elastomeric yarn or rubber thread",1833137.0
202211,580631,"Narrow woven fabrics of cotton, with a width of ≤ 30 cm, n.e.s.",460350.0
202211,580632,"Narrow woven fabrics of man-made fibres, with a width of ≤ 30 cm, n.e.s.",8390162.0
202211,580639,"Narrow woven fabrics of textile materials other than cotton or man-made fibres, with a width of ≤ 30 cm, n.e.s.",125024.0
202211,580640,Fabrics consisting of warp without weft assembled by means of an adhesive (bolducs),87766.0
202211,580710,"Labels, badges and similar articles, of textile materials, in the piece, in strips or cut to shape or size, woven, not embroidered",2909676.0
202211,580790,"Labels, badges and similar articles, of textile materials, in the piece, in strips or cut to shape or size, not embroidered (excluding woven)",151637.0
202211,580810,Braids in the piece,689500.0
202211,580890,"Ornamental trimmings of textile materials, in the piece, not embroidered, other than knitted or crocheted; tassels, pompons and similar articles of textile materials (excluding braids in the piece)",188435.0
202211,580900,"Woven fabrics of metal thread and woven fabrics of metallised yarn of heading 5605, of a kind used in apparel, as furnishing fabrics or for similar purposes, n.e.s.",55741.0
202211,581010,Embroidery without visible ground,119000.0
202211,581091,"Embroidery of cotton on a textile fabric ground, in the piece, in strips or in motifs (excluding embroidery without visible ground)",145941.0
202211,581092,"Embroidery of man-made fibres on a textile fabric base, in the piece, in strips or in motifs (excluding embroidery without visible ground)",745952.0
202211,581099,"Embroidery of materials other than cotton or man-made fibres, on a textile fabric base, in the piece, in strips or in motifs (excluding embroidery without visible ground)",13950.0
202211,581100,"Quilted textile products in the piece, composed of one or more layers of textile materials assembled with padding by stitching or otherwise (excluding embroidery of heading 5810 and quilted fabrics for bedding and furnishings)",1180911.0
202211,590110,"Textile fabrics coated with gum or amylaceous substances, of a kind used for the outer covers of books or the like",18447.0
202211,590190,Tracing cloth; prepared painting canvas; buckram and similar stiffened textile fabrics of a kind used for hat foundations (excluding plastic-coated textile fabrics),566631.0
202211,590210,"Tyre cord fabric of high-tenacity yarn of nylon or other polyamides, whether or not dipped or impregnated with rubber or plastic",5550409.0
202211,590220,"Tyre cord fabric of high-tenacity polyester yarn, whether or not dipped or impregnated with rubber or plastic",889647.0
202211,590290,"Tyre cord fabric of high-tenacity viscose rayon yarn, whether or not dipped in rubber or plastic",2713673.0
202211,590310,"Textile fabrics impregnated, coated, covered or laminated with polyvinyl chloride"" (excluding wallcoverings of textile materials impregnated or covered with poly""vinyl chloride""; floor coverings consisting of a textile backing and a top layer or covering of poly""vinyl chloride"")""",10125024.0
202211,590320,"Textile fabrics impregnated, coated, covered or laminated with polyurethane (excluding wallcoverings of textile materials impregnated or covered with polyurethane; floor coverings consisting of a textile backing and a top layer or covering of polyurethane)",30105680.0
202211,590390,"Textile fabrics impregnated, coated, covered or laminated with plastics other than polyvinyl chloride"" or polyurethane (excluding tyre cord fabric of high-tenacity yarn of nylon or other polyamides, polyesters or viscose rayon; wallcoverings of textile materials impregnated or covered with plastic; floor coverings consisting of a textile backing and a top layer or covering of plastics)""",21140082.0
202211,590410,"Linoleum, whether or not cut to shap",89247.0
202211,590490,"Floor coverings consisting of a coating or covering applied on a textile backing, whether or not cut to shape (excluding linoleum)",1307.0
202211,590500,Textile wall coverings.,255864.0
202211,590610,Adhesive tape of a width not exceeding 20 cm,2499823.0
202211,590691,"Knitted or crocheted textile fabrics, rubberised, n.e.s.",378903.0
202211,590699,"Rubberised textile fabrics (excluding knitted or crocheted textile fabrics, adhesive tape of a width of ≤ 20 cm, and tyre cord fabric of high-tenacity yarn of nylon or other polyamides, polyesters or viscose rayon)",4754563.0
202211,590700,"Impregnated, coated or covered textile fabrics; painted canvas being theatrical scenery, studio backcloths or the like, n.e.s.",4899959.0
202211,590800,"Textile wicks, woven, plaited or knitted, for lamps, stoves, lighters, candles or the like; incandescent gas mantles and tubular knitted gas-mantle fabric for incandescent gas mantles, whether or not impregnated",253495.0
202211,590900,"Textile hosepiping and similar textile tubing, whether or not impregnated or coated, with or without lining, armour or accessories of other materials",452154.0
202211,591000,"Transmission or conveyor belts or belting, of textile material, whether or not impregnated, coated, covered or laminated with plastics, or reinforced with metal or other material.",2724670.0
202211,591110,"Textile fabrics, felt and felt-lined woven fabrics, coated, covered or laminated with rubber, leather or other material, of a kind used for card clothing, and similar fabrics of a kind used for other technical purposes, incl. narrow fabrics made of velvet impregnated with rubber, for covering weaving spindles weaving beams""""",3590571.0
202211,591120,"Bolting cloth, whether or not made up",3066509.0
202211,591131,"Textile fabrics and felts, endless or fitted with linking devices, of a kind used in papermaking or similar machines, e.g. for paper pulp or asbestos-cement, weighing ＜ 650 g/m2",2378845.0
202211,591132,"Textile fabrics and felts, endless or fitted with linking devices, of a kind used in papermaking or similar machines, e.g. for paper pulp or asbestos-cement, weighing ≥ 650 g/m2",5486418.0
202211,591140,"Filtering or straining cloth of a kind used in oil-presses or for similar technical purposes, incl. that of human hair",1582668.0
202211,591190,"Textile products and articles, for technical purposes, specified in Note 7 to chapter 59, n.e.s.",19849302.0
202211,600110,"Long pile fabrics, knitted or crocheted",593620.0
202211,600121,"Looped pile fabrics of cotton, knitted or crocheted",1191423.0
202211,600122,"Looped pile fabrics of man-made fibres, knitted or crocheted",263652.0
202211,600129,"Looped pile fabrics, knitted or crocheted (excluding of cotton or man-made fibres)",1534.0
202211,600191,"Pile fabrics of cotton, knitted or crocheted (excluding long pile"" fabrics)""",776426.0
202211,600192,"Pile fabrics of man-made fibres, knitted or crocheted (excluding long pile"" fabrics)""",4062764.0
202211,600199,"Pile fabrics, knitted or crocheted (excluding cotton or man-made fibres and long pile"" fabrics)""",26524.0
202211,600240,"Knitted or crocheted fabrics, of a width of ≤ 30 cm, containing ≥ 5% by weight elastomeric yarn",122993.0
202211,600290,"Knitted or crocheted fabrics, of a width of ≤ 30 cm, containing ≥ 5% by weight elastomeric yarn and rubber thread or rubber thread only",211049.0
202211,600310,"Knitted or crocheted fabrics of wool or fine animal hair, of a width of ≤ 30 cm",442.0
202211,600320,"Knitted or crocheted fabrics of cotton, of a width of ≤ 30 cm",13073.0
202211,600330,"Knitted or crocheted fabrics of synthetic fibres, of a width of ≤ 30 cm",367586.0
202211,600340,"Knitted or crocheted fabrics of artificial fibres, of a width of ≤ 30 cm",599.0
202211,600390,Knitted or crocheted fabrics of a width of ≤ 30 cm,5743.0
202211,600410,"Knitted or crocheted fabrics, of a width of ＞ 30 cm, containing ≥ 5% by weight elastomeric yarn",20036727.0
202211,600490,"Knitted or crocheted fabrics, of a width of ＞ 30 cm, containing ≥ 5% by weight elastomeric yarn and rubber thread or rubber thread only",262806.0
202211,600521,"Unbleached or bleached cotton warp knit fabrics incl. those made on galloon knitting machines"", of a width of ＞ 30 cm""",2139.0
202211,600522,"Dyed cotton warp knit fabrics incl. those made on galloon knitting machines"", of a width of ＞ 30 cm""",90033.0
202211,600523,"Cotton warp knit fabrics of yarns of different colours incl. those made on galloon knitting machines"", of a width of ＞ 30 cm""",6770.0
202211,600524,"Printed cotton warp knit fabrics incl. those made on galloon knitting machines"", of a width of ＞ 30 cm""",6567.0
202211,600535,Fabrics specified in Subheading Note 1 to this Chapter,71735.0
202211,600536,"Unbleached or bleached warp knit fabrics of synthetic fibres incl. those made on galloon knitting machines"", of a width of ＞ 30 cm""",1231078.0
202211,600537,"Dyed warp knit fabrics of synthetic fibres incl. those made on galloon knitting machines"", of a width of ＞ 30 cm""",7150387.0
202211,600538,"Warp knit fabrics of synthetic fibres, of yarns of different colours incl. those made on galloon knitting machines"", of a width of ＞ 30 cm""",286326.0
202211,600539,"Printed warp knit fabrics of synthetic fibres incl. those made on galloon knitting machines"", of a width of ＞ 30 cm""",533334.0
202211,600541,"Unbleached or bleached warp knit fabrics of artificial fibres incl. those made on galloon knitting machines"", of a width of ＞ 30 cm""",6678.0
202211,600542,"Dyed warp knit fabrics of artificial fibres incl. those made on galloon knitting machines"", of a width of ＞ 30 cm""",350709.0
202211,600543,"Warp knit fabrics of artificial fibres, of yarns of different colours incl. those made on galloon knitting machines"", of a width of ＞ 30 cm""",11393.0
202211,600544,"Printed warp knit fabrics of artificial fibres incl. those made on galloon knitting machines"", of a width of ＞ 30 cm""",7655.0
202211,600590,"Warp knit fabrics incl. those made on galloon knitting machines"", of a width of ＞ 30 cm""",22295.0
202211,600610,"Fabrics, knitted or crocheted, of a width of ＞ 30 cm, of wool or fine animal hair",1026873.0
202211,600621,"Unbleached or bleached cotton fabrics, knitted or crocheted, of a width of ＞ 30 cm",414475.0
202211,600622,"Dyed cotton fabrics, knitted or crocheted, of a width of ＞ 30 cm",5570567.0
202211,600623,"Cotton fabrics, knitted or crocheted, of yarns of different colours, of a width of ＞ 30 cm",247691.0
202211,600624,"Printed cotton fabrics, knitted or crocheted, of a width of ＞ 30 cm",199058.0
202211,600631,"Unbleached or bleached fabrics, knitted or crocheted, of synthetic fibres, of a width of ＞ 30 cm",979246.0
202211,600632,"Dyed fabrics, knitted or crocheted, of synthetic fibres, of a width of ＞ 30 cm",19764179.0
202211,600633,"Fabrics, knitted or crocheted, of synthetic fibres, of yarns of different colours, of a width of ＞ 30 cm",1481621.0
202211,600634,"Printed fabrics, knitted or crocheted, of synthetic fibres, of a width of ＞ 30 cm",683872.0
202211,600641,"Unbleached or bleached fabrics, knitted or crocheted, of artificial fibres, of a width of ＞ 30 cm",3099.0
202211,600642,"Dyed fabrics, knitted or crocheted, of artificial fibres, of a width of ＞ 30 cm",501974.0
202211,600643,"Fabrics, knitted or crocheted, of artificial fibres, of yarns of different colours, of a width of ＞ 30 cm",81433.0
202211,600644,"Printed fabrics, knitted or crocheted, of artificial fibres, of a width of ＞ 30 cm",55650.0
202211,600690,"Fabrics, knitted or crocheted, of a width of ＞ 30 cm",301042.0
202211,610120,"Overcoats, car coats, capes, cloaks, anoraks, incl. ski jackets, windcheaters, wind-jackets and similar articles of cotton, for men or boys, knitted or crocheted",1076722.0
202211,610130,"Overcoats, car coats, capes, cloaks, anoraks, incl. ski jackets, windcheaters, wind-jackets and similar articles of man-made fibres, for men or boys, knitted or crocheted",3794236.0
202211,610190,"Overcoats, car coats, capes, cloaks, anoraks, incl. ski jackets, windcheaters, wind-jackets and similar articles of textile materials, for men or boys, knitted or crocheted",608098.0
202211,610210,"Women's or girls' overcoats, car coats, capes, cloaks, anoraks, incl. ski jackets, windcheaters, wind-jackets and similar articles, of wool or fine animal hair, knitted or crocheted",3986429.0
202211,610220,"Women's or girls' overcoats, car coats, capes, cloaks, anoraks, incl. ski jackets, windcheaters, wind-jackets and similar articles of cotton, knitted or crocheted",369732.0
202211,610230,"Women's or girls' overcoats, car coats, capes, cloaks, anoraks, incl. ski jackets, windcheaters, wind-jackets and similar articles of man-made fibres, knitted or crocheted",1643685.0
202211,610290,"Women's or girls' overcoats, car coats, capes, cloaks, anoraks, incl. ski jackets, windcheaters, wind-jackets and similar articles, of textile materials, knitted or crocheted",79101.0
202211,610310,"Men's or boys' suits of textile materials, knitted or crocheted",45264.0
202211,610322,"Men's or boys' ensembles of cotton, knitted or crocheted",71816.0
202211,610323,"Men's or boys' ensembles of synthetic fibres, knitted or crocheted",2823.0
202211,610329,Men's or boys' ensembles of textile materials,21623.0
202211,610331,"Men's or boys' jackets and blazers of wool or fine animal hair, knitted or crocheted",614343.0
202211,610332,"Men's or boys' jackets and blazers of cotton, knitted or crocheted",456518.0
202211,610333,"Men's or boys' jackets and blazers of synthetic fibres, knitted or crocheted",721825.0
202211,610339,Men's or boys' jackets and blazers of textile materials,44380.0
202211,610341,"Men's or boys' trousers, bib and brace overalls, breeches and shorts of wool or fine animal hair, knitted or crocheted",1336947.0
202211,610342,"Men's or boys' trousers, bib and brace overalls, breeches and shorts of cotton, knitted or crocheted",13515756.0
202211,610343,"Men's or boys' trousers, bib and brace overalls, breeches and shorts of synthetic fibres, knitted or crocheted",9645367.0
202211,610349,"Men's or boys' trousers, bib and brace overalls, breeches and shorts of textile materials, knitted or crocheted",149110.0
202211,610413,"Women's or girls' suits of synthetic fibres, knitted or crocheted",930.0
202211,610422,"Women's or girls' ensembles of cotton, knitted or crocheted",17280.0
202211,610423,"Women's or girls' ensembles of synthetic fibres, knitted or crocheted",5096.0
202211,610429,Women's or girls' ensembles of textile materials,7712.0
202211,610431,"Women's or girls' jackets and blazers of wool or fine animal hair, knitted or crocheted",2484689.0
202211,610432,"Women's or girls' jackets and blazers of cotton, knitted or crocheted",1332716.0
202211,610433,"Women's or girls' jackets and blazers of synthetic fibres, knitted or crocheted",358573.0
